timestamp,url,title,description,content,content-segmented,kws-l,loc-l,org-l,per-l,kws,loc,org,per,year,month,day
1676156400,https://fr.sputniknews.africa/20230212/moscou-et-teheran-se-passent-de-swift-et-commercent-en-roubles-et-en-rials-1057899361.html,Moscou et Téhéran se passent de SWIFT et commercent en roubles et en rials,"Les Russes et les Iraniens ont l’intention d’augmenter la part de leurs monnaies nationales dans les règlements mutuels, selon le vice-ministre russe des Affaires étrangères Andreï Roudenko.","La Russie et l’Iran développent leur coopération interbancaire et se proposent de booster les transactions en monnaies nationales.""Nous continuerons à travailler avec l'Iran, en stimulant les opérations commerciales en monnaies nationales. En 2021, la part des règlements en monnaies nationales a dépassé 60%. La tendance positive s'est poursuivie l'année dernière"", a déclaré à la presse vendredi le vice-ministre russe des Affaires étrangères Andreï Roudenko.Il a noté que l'interaction avec l'Iran au niveau des banques centrales et des établissements de crédit s'est également étendue.Communications interbancaires remplaçant SWIFT""Fin janvier, la mise en place d'un canal de communication direct entre les banques russes et iraniennes a été officialisée sur le papier, prévoyant la synchronisation du Système de transfert de messages financiers russe (SPFS) et du système de télécommunication interbancaire iranien SEPAM"", a indiqué le diplomate.Selon lui, cette décision permettra de réaliser des transactions transfrontalières sans utiliser le système de messagerie financière occidental SWIFT.La coopération entre la Russie et l'Iran, qui font face aux sanctions occidentales s'est accélérée l'année dernière.Leurs échanges commerciaux ont augmenté de 15% en 2022 pour atteindre 4,6 milliards de dollars, selon les données officielles.","[[['La Russie et l’Iran développent leur coopération interbancaire et se proposent de booster les transactions en monnaies nationales.'], ['""Nous continuerons à travailler avec l\'Iran, en stimulant les opérations commerciales en monnaies nationales.'], ['En 2021, la part des règlements en monnaies nationales a dépassé 60%.'], ['La tendance positive s\'est poursuivie l\'année dernière"", a déclaré à la presse vendredi le vice-ministre russe des Affaires étrangères Andreï Roudenko.Il a noté que l\'interaction avec l\'Iran au niveau des banques centrales et des établissements de crédit s\'est également étendue.Communications interbancaires remplaçant SWIFT""Fin janvier, la mise en place d\'un canal de communication direct entre les banques russes et iraniennes a été officialisée sur le papier, prévoyant la synchronisation du Système de transfert de messages financiers russe (SPFS) et du système de télécommunication interbancaire iranien SEPAM"", a indiqué le diplomate.Selon lui, cette décision permettra de réaliser des transactions transfrontalières sans utiliser le système de messagerie financière occidental SWIFT.La coopération entre la Russie et l\'Iran, qui font face aux sanctions occidentales s\'est accélérée l\'année dernière.Leurs échanges commerciaux ont augmenté de 15% en 2022 pour atteindre 4,6 milliards de dollars, selon les données officielles.']]]","[[['russie', 'iran', 'coopération', 'interbancaire', 'transactions', 'monnaies', 'nationales'], ['iran', 'opérations', 'commerciales', 'monnaies', 'nationales'], ['part', 'règlements', 'monnaies', 'nationales'], ['tendance', 'positive', 'année', 'dernière', 'presse', 'vendredi', 'russe', 'affaires', 'étrangères', 'andreï', 'interaction', 'iran', 'niveau', 'banques', 'centrales', 'établissements', 'crédit', 'interbancaires', 'janvier', 'mise', 'place', 'canal', 'communication', 'direct', 'banques', 'russes', 'iraniennes', 'papier', 'synchronisation', 'système', 'transfert', 'messages', 'financiers', 'russe', 'système', 'télécommunication', 'interbancaire', 'iranien', 'décision', 'transactions', 'transfrontalières', 'système', 'messagerie', 'financière', 'occidental', 'coopération', 'russie', 'iran', 'face', 'sanctions', 'occidentales', 'année', 'échanges', 'commerciaux', 'milliards', 'dollars', 'données', 'officielles']]]","[[['Russie', 'Iran'], ['Iran'], [], ['Iran', 'Russie', 'Iran']]]","[[[], [], [], ['SEPAM', 'SWIFT.La']]]","[[[], [], [], ['Andreï Roudenko', 'SWIFT""Fin janvier']]]","{'russie': 2, 'iran': 4, 'coopération': 2, 'interbancaire': 2, 'transactions': 2, 'monnaies': 3, 'nationales': 3, 'opérations': 1, 'commerciales': 1, 'part': 1, 'règlements': 1, 'tendance': 1, 'positive': 1, 'année': 2, 'dernière': 1, 'presse': 1, 'vendredi': 1, 'russe': 2, 'affaires': 1, 'étrangères': 1, 'andreï': 1, 'interaction': 1, 'niveau': 1, 'banques': 2, 'centrales': 1, 'établissements': 1, 'crédit': 1, 'interbancaires': 1, 'janvier': 1, 'mise': 1, 'place': 1, 'canal': 1, 'communication': 1, 'direct': 1, 'russes': 1, 'iraniennes': 1, 'papier': 1, 'synchronisation': 1, 'système': 3, 'transfert': 1, 'messages': 1, 'financiers': 1, 'télécommunication': 1, 'iranien': 1, 'décision': 1, 'transfrontalières': 1, 'messagerie': 1, 'financière': 1, 'occidental': 1, 'face': 1, 'sanctions': 1, 'occidentales': 1, 'échanges': 1, 'commerciaux': 1, 'milliards': 1, 'dollars': 1, 'données': 1, 'officielles': 1}","{'Russie': 2, 'Iran': 4}","{'SEPAM': 1, 'SWIFT.La': 1}","{'Andreï Roudenko': 1, 'SWIFT""Fin janvier': 1}",2023,2,11
1676156400,https://fr.sputniknews.africa/20230212/anniversaire-des-accords-de-minsk-un-echec-planifie-1057899119.html,Anniversaire des accords de Minsk: un échec planifié,"Le sommet en format Normandie tenu en 2015 à Minsk s'est achevé par la signature d'un cessez-le-feu dans le Donbass. Huit ans après, les partenaires de Moscou avouent que pour eux, ce n'était qu'une manœuvre en vue de gagner du temps, pour...","Les 11 et 12 février 2015 s’est tenue, à Minsk, une rencontre en format Normandie qui a abouti à la signature d'un cessez-le-feu en Ukraine. Il a été concerté par les dirigeants de l'Ukraine, de la Russie, de la France, de l'Allemagne et des Républiques populaires autoproclamées de Donetsk et de Lougansk. Les documents signés, baptisés accords de Minsk II, devaient notamment servir à la restauration et au respect des droits de la population russophone du Sud-Est ukrainien. Le sommet a réuni Vladimir Poutine, Président russe, Petro Porochenko, Président ukrainien, Angela Merkel, chancelière allemande, François Hollande, Président français, Alexandre Zakhartchenko, représentant de la République populaire de Donetsk, et Igor Plotnitski, représentant de la République populaire de Lougansk. Le protocole de Minsk du 5 septembre 2014 destiné à faire respecter le cessez-le-feu dans la région du Donbass s'était soldé par un échec.Révélations marquantesVu d'abord comme une ""lueur d'espoir"", selon les dires d'Angela Merkel, l'accord en question s'est cependant révélé n'être qu’un prétexte pour donner à l’Ukraine du temps pour se préparer à un conflit militaire avec la Russie. En témoignent les récentes déclarations de Kiev et de l'UE. Ainsi, Mme Merkel a confié début décembre à l'hebdomadaire allemand Die Zeit que les accords de Minsk avaient été une tentative de ""donner du temps à l'Ukraine"" pour qu'elle puisse se renforcer.François Hollande a plus tard confirmé ses propos au Kiev Independent. Selon lui, les accords de Minsk, formellement conclus pour rétablir la paix dans le Donbass, étaient destinés à donner du temps à l’Ukraine pour préparer son armée.L'actuel Président ukrainien, Volodymyr Zelensky, avait pour sa part déclaré au quotidien allemand Der Spiegel qu’il n’allait pas respecter ces accords, et qu'il en avait prévenu Poutine, Merkel et Macron.","[[[""Les 11 et 12 février 2015 s’est tenue, à Minsk, une rencontre en format Normandie qui a abouti à la signature d'un cessez-le-feu en Ukraine.""], [""Il a été concerté par les dirigeants de l'Ukraine, de la Russie, de la France, de l'Allemagne et des Républiques populaires autoproclamées de Donetsk et de Lougansk.""], ['Les documents signés, baptisés accords de Minsk II, devaient notamment servir à la restauration et au respect des droits de la population russophone du Sud-Est ukrainien.'], ['Le sommet a réuni Vladimir Poutine, Président russe, Petro Porochenko, Président ukrainien, Angela Merkel, chancelière allemande, François Hollande, Président français, Alexandre Zakhartchenko, représentant de la République populaire de Donetsk, et Igor Plotnitski, représentant de la République populaire de Lougansk.'], ['Le protocole de Minsk du 5 septembre 2014 destiné à faire respecter le cessez-le-feu dans la région du Donbass s\'était soldé par un échec.Révélations marquantesVu d\'abord comme une ""lueur d\'espoir"", selon les dires d\'Angela Merkel, l\'accord en question s\'est cependant révélé n\'être qu’un prétexte pour donner à l’Ukraine du temps pour se préparer à un conflit militaire avec la Russie.'], [""En témoignent les récentes déclarations de Kiev et de l'UE.""], ['Ainsi, Mme Merkel a confié début décembre à l\'hebdomadaire allemand Die Zeit que les accords de Minsk avaient été une tentative de ""donner du temps à l\'Ukraine"" pour qu\'elle puisse se renforcer.François Hollande a plus tard confirmé ses propos au Kiev Independent.'], [""Selon lui, les accords de Minsk, formellement conclus pour rétablir la paix dans le Donbass, étaient destinés à donner du temps à l’Ukraine pour préparer son armée.L'actuel Président ukrainien, Volodymyr Zelensky, avait pour sa part déclaré au quotidien allemand Der Spiegel qu’il n’allait pas respecter ces accords, et qu'il en avait prévenu Poutine, Merkel et Macron.""]]]","[[['février', 'rencontre', 'format', 'normandie', 'signature', 'ukraine'], ['dirigeants', 'ukraine', 'russie', 'france', 'allemagne', 'républiques', 'populaires', 'donetsk', 'lougansk'], ['documents', 'accords', 'restauration', 'respect', 'droits', 'population', 'russophone', 'ukrainien'], ['sommet', 'vladimir', 'poutine', 'président', 'russe', 'petro', 'président', 'ukrainien', 'angela', 'merkel', 'chancelière', 'allemande', 'françois', 'hollande', 'président', 'français', 'alexandre', 'zakhartchenko', 'représentant', 'république', 'populaire', 'donetsk', 'igor', 'plotnitski', 'représentant', 'république', 'populaire', 'lougansk'], ['protocole', 'septembre', 'région', 'donbass', 'marquantesvu', 'lueur', 'espoir', 'dires', 'angela', 'merkel', 'accord', 'question', 'prétexte', 'ukraine', 'temps', 'conflit', 'militaire', 'russie'], ['récentes', 'déclarations', 'kiev', 'ue'], ['mme', 'début', 'hebdomadaire', 'allemand', 'accords', 'minsk', 'tentative', 'temps', 'ukraine', 'propos', 'kiev'], ['accords', 'minsk', 'paix', 'donbass', 'temps', 'ukraine', 'actuel', 'président', 'ukrainien', 'volodymyr', 'zelensky', 'part', 'quotidien', 'allemand', 'accords', 'poutine', 'merkel']]]","[[['Minsk', 'Normandie', 'Ukraine'], ['Ukraine', 'Russie', 'France', 'Allemagne', 'Donetsk', 'Lougansk'], ['Sud-Est'], ['République populaire de Donetsk', 'République populaire de Lougansk'], ['Minsk', 'Donbass', 'Ukraine', 'Russie'], ['Kiev'], ['Minsk', 'Ukraine'], ['Minsk', 'Donbass', 'Ukraine']]]","[[[], ['Républiques populaires autoproclamées'], [], [], [], ['UE'], ['Die Zeit', 'Kiev Independent'], []]]","[[[], [], ['Minsk II'], ['Vladimir Poutine', 'Président russe', 'Petro Porochenko', 'Président ukrainien', 'Angela Merkel', 'François Hollande', 'Président français', 'Alexandre Zakhartchenko', 'Igor Plotnitski'], ['Angela Merkel'], [], ['Mme Merkel', 'François Hollande'], ['Président ukrainien', 'Volodymyr Zelensky', 'Der Spiegel', 'Poutine', 'Merkel', 'Macron']]]","{'février': 1, 'rencontre': 1, 'format': 1, 'normandie': 1, 'signature': 1, 'ukraine': 5, 'dirigeants': 1, 'russie': 2, 'france': 1, 'allemagne': 1, 'républiques': 1, 'populaires': 1, 'donetsk': 2, 'lougansk': 2, 'documents': 1, 'accords': 4, 'restauration': 1, 'respect': 1, 'droits': 1, 'population': 1, 'russophone': 1, 'ukrainien': 3, 'sommet': 1, 'vladimir': 1, 'poutine': 2, 'président': 4, 'russe': 1, 'petro': 1, 'angela': 2, 'merkel': 3, 'chancelière': 1, 'allemande': 1, 'françois': 1, 'hollande': 1, 'français': 1, 'alexandre': 1, 'zakhartchenko': 1, 'représentant': 2, 'république': 2, 'populaire': 2, 'igor': 1, 'plotnitski': 1, 'protocole': 1, 'septembre': 1, 'région': 1, 'donbass': 2, 'marquantesvu': 1, 'lueur': 1, 'espoir': 1, 'dires': 1, 'accord': 1, 'question': 1, 'prétexte': 1, 'temps': 3, 'conflit': 1, 'militaire': 1, 'récentes': 1, 'déclarations': 1, 'kiev': 2, 'ue': 1, 'mme': 1, 'début': 1, 'hebdomadaire': 1, 'allemand': 2, 'minsk': 2, 'tentative': 1, 'propos': 1, 'paix': 1, 'actuel': 1, 'volodymyr': 1, 'zelensky': 1, 'part': 1, 'quotidien': 1}","{'Minsk': 4, 'Normandie': 1, 'Ukraine': 5, 'Russie': 2, 'France': 1, 'Allemagne': 1, 'Donetsk': 1, 'Lougansk': 1, 'Sud-Est': 1, 'République populaire de Donetsk': 1, 'République populaire de Lougansk': 1, 'Donbass': 2, 'Kiev': 1}","{'Républiques populaires autoproclamées': 1, 'UE': 1, 'Die Zeit': 1, 'Kiev Independent': 1}","{'Minsk II': 1, 'Vladimir Poutine': 1, 'Président russe': 1, 'Petro Porochenko': 1, 'Président ukrainien': 2, 'Angela Merkel': 2, 'François Hollande': 2, 'Président français': 1, 'Alexandre Zakhartchenko': 1, 'Igor Plotnitski': 1, 'Mme Merkel': 1, 'Volodymyr Zelensky': 1, 'Der Spiegel': 1, 'Poutine': 1, 'Merkel': 1, 'Macron': 1}",2023,2,11
1676156400,https://fr.sputniknews.africa/20230212/les-troupes-russes-ont-pris-une-autre-localite-dans-le-donbass-1057898637.html,Les troupes russes ont pris une autre localité dans le Donbass,Le groupe paramilitaire Wagner a pris la localité de Krasnaïa Gora en République populaire de Donetsk.,"Des unités d'assaut du groupe paramilitaire Wagner ont pris la localité de Krasnaïa Gora en République populaire de Donetsk (RPD), a fait savoir le fondateur de la société, Evgueni Prigojine.La localité en question se situe près de la ville d'Artiomovsk (Bakhmout en ukrainien). L'armée russe est en train d’encercler cette ville stratégique en RPD depuis des semaines. Elle est importante en raison de sa situation géographique et de sa position dans le système de défense ukrainien.Une zone stratégiqueIl s'agit d'un nœud de transport important pour l'approvisionnement de l'armée ukrainienne dans le Donbass, qui inclut aussi la ville de Gorlovka. Des combats acharnés continuent à Artiomovsk.Les forces russes ont pris position dans la partie nord d'Artiomovsk, a indiqué vendredi le chef par intérim de la RPD Denis Pouchiline. Elles ont aussi réussi à couper trois des quatre routes servant à approvisionner les militaires ukrainiens présents dans la ville.","[[[""Des unités d'assaut du groupe paramilitaire Wagner ont pris la localité de Krasnaïa Gora en République populaire de Donetsk (RPD), a fait savoir le fondateur de la société, Evgueni Prigojine.La localité en question se situe près de la ville d'Artiomovsk (Bakhmout en ukrainien).""], [""L'armée russe est en train d’encercler cette ville stratégique en RPD depuis des semaines.""], [""Elle est importante en raison de sa situation géographique et de sa position dans le système de défense ukrainien.Une zone stratégiqueIl s'agit d'un nœud de transport important pour l'approvisionnement de l'armée ukrainienne dans le Donbass, qui inclut aussi la ville de Gorlovka.""], [""Des combats acharnés continuent à Artiomovsk.Les forces russes ont pris position dans la partie nord d'Artiomovsk, a indiqué vendredi le chef par intérim de la RPD Denis Pouchiline.""], ['Elles ont aussi réussi à couper trois des quatre routes servant à approvisionner les militaires ukrainiens présents dans la ville.']]]","[[['unités', 'assaut', 'groupe', 'paramilitaire', 'wagner', 'localité', 'krasnaïa', 'gora', 'république', 'populaire', 'donetsk', 'rpd', 'fondateur', 'société', 'evgueni', 'localité', 'question', 'ville', 'artiomovsk', 'bakhmout', 'ukrainien'], ['armée', 'russe', 'train', 'ville', 'stratégique', 'semaines'], ['importante', 'raison', 'situation', 'géographique', 'position', 'système', 'défense', 'zone', 'nœud', 'transport', 'important', 'approvisionnement', 'armée', 'ukrainienne', 'donbass', 'ville', 'gorlovka'], ['combats', 'acharnés', 'forces', 'russes', 'position', 'partie', 'nord', 'artiomovsk', 'vendredi', 'chef', 'intérim', 'rpd', 'denis', 'pouchiline'], ['routes', 'militaires', 'ukrainiens', 'présents', 'ville']]]","[[['Krasnaïa Gora', 'République populaire de Donetsk', 'RPD', 'Artiomovsk', 'Bakhmout'], ['RPD'], ['Donbass', 'Gorlovka'], ['Artiomovsk', 'Artiomovsk', 'RPD'], []]]","[[[], [], [], [], []]]","[[['Wagner', 'Evgueni Prigojine'], [], [], ['Denis Pouchiline'], []]]","{'unités': 1, 'assaut': 1, 'groupe': 1, 'paramilitaire': 1, 'wagner': 1, 'localité': 2, 'krasnaïa': 1, 'gora': 1, 'république': 1, 'populaire': 1, 'donetsk': 1, 'rpd': 2, 'fondateur': 1, 'société': 1, 'evgueni': 1, 'question': 1, 'ville': 4, 'artiomovsk': 2, 'bakhmout': 1, 'ukrainien': 1, 'armée': 2, 'russe': 1, 'train': 1, 'stratégique': 1, 'semaines': 1, 'importante': 1, 'raison': 1, 'situation': 1, 'géographique': 1, 'position': 2, 'système': 1, 'défense': 1, 'zone': 1, 'nœud': 1, 'transport': 1, 'important': 1, 'approvisionnement': 1, 'ukrainienne': 1, 'donbass': 1, 'gorlovka': 1, 'combats': 1, 'acharnés': 1, 'forces': 1, 'russes': 1, 'partie': 1, 'nord': 1, 'vendredi': 1, 'chef': 1, 'intérim': 1, 'denis': 1, 'pouchiline': 1, 'routes': 1, 'militaires': 1, 'ukrainiens': 1, 'présents': 1}","{'Krasnaïa Gora': 1, 'République populaire de Donetsk': 1, 'RPD': 3, 'Artiomovsk': 3, 'Bakhmout': 1, 'Donbass': 1, 'Gorlovka': 1}",{},"{'Wagner': 1, 'Evgueni Prigojine': 1, 'Denis Pouchiline': 1}",2023,2,11
1676156400,https://fr.sputniknews.africa/20230212/otan-stoltenberg-ne-demande-pas-de-nouvelle-prolongation-de-mandat-1057898473.html,Otan: Stoltenberg ne demande pas de nouvelle prolongation de mandat,"Le secrétaire général de l’Otan Jens Stoltenberg ne demande pas de nouvelle prolongation de mandat et devrait quitter son poste comme prévu à l'automne de cette année, a déclaré l'Alliance. La présidence de la Banque mondiale lui serait...","La porte-parole de l’Otan Oana Lungescu a révélé à l’agence DPA les projets d’avenir du secrétaire général de l’Alliance, dont le mandat expire le 30 septembre prochain.""Le mandat du secrétaire général arrive à son terme en octobre de cette année et il n'a pas l'intention de demander une nouvelle prolongation de son mandat"", a-t-elle confié à l’agence.Mme Lungescu a précisé que le mandat de Jens Stoltenberg avait été prolongé à trois reprises et qu’il avait occupé ce poste pendant près de neuf ans au total.La dernière reconduction jusqu'au 30 septembre 2023 est intervenue en mars de l'année dernière, peu après le début de l'opération russe en Ukraine.Le Welt am Sonntag a cependant rapporté ce dimanche 12 février, citant des sources diplomatiques non identifiées, que l’Otan pourrait à nouveau prolonger le mandat du secrétaire général Jens Stoltenberg.""Les membres prolongeront le mandat de Stoltenberg jusqu'en avril 2024 en raison de ses ‘réalisations exceptionnelles’ et pour garantir la stabilité de l'Alliance militaire pendant la guerre en cours en Ukraine"", a indiqué le journal.Continuer ou présider la Banque mondiale?Le Welt am Sonntag fait état d’un accord informel entre les 30 États membres selon lequel Stoltenberg devrait rester en poste au-delà de la fin de son mandat le 30 septembre. Une décision formelle devrait être prise dans les prochaines semaines.Aucune décision n'a été prise quant à la succession de Stoltenberg, mais le Premier ministre espagnol Pedro Sanchez et le secrétaire britannique à la Défense Ben Wallace figurent parmi les principaux candidats au poste, soutient le journal.Économiste de formation, Jens Stoltenberg pourrait être nommé à la tête de la Banque mondiale lorsque son président actuel David Malpass partira vers avril 2014.","[[['La porte-parole de l’Otan Oana Lungescu a révélé à l’agence DPA les projets d’avenir du secrétaire général de l’Alliance, dont le mandat expire le 30 septembre prochain.'], ['""Le mandat du secrétaire général arrive à son terme en octobre de cette année et il n\'a pas l\'intention de demander une nouvelle prolongation de son mandat"", a-t-elle confié à l’agence.Mme Lungescu a précisé que le mandat de Jens Stoltenberg avait été prolongé à trois reprises et qu’il avait occupé ce poste pendant près de neuf ans au total.La dernière reconduction jusqu\'au 30 septembre 2023 est intervenue en mars de l\'année dernière, peu après le début de l\'opération russe en Ukraine.Le Welt am Sonntag a cependant rapporté ce dimanche 12 février, citant des sources diplomatiques non identifiées, que l’Otan pourrait à nouveau prolonger le mandat du secrétaire général Jens Stoltenberg.'], ['""Les membres prolongeront le mandat de Stoltenberg jusqu\'en avril 2024 en raison de ses ‘réalisations exceptionnelles’ et pour garantir la stabilité de l\'Alliance militaire pendant la guerre en cours en Ukraine"", a indiqué le journal.Continuer ou présider la Banque mondiale?Le Welt am Sonntag fait état d’un accord informel entre les 30 États membres selon lequel Stoltenberg devrait rester en poste au-delà de la fin de son mandat le 30 septembre.'], [""Une décision formelle devrait être prise dans les prochaines semaines.Aucune décision n'a été prise quant à la succession de Stoltenberg, mais le Premier ministre espagnol Pedro Sanchez et le secrétaire britannique à la Défense Ben Wallace figurent parmi les principaux candidats au poste, soutient le journal.Économiste de formation, Jens Stoltenberg pourrait être nommé à la tête de la Banque mondiale lorsque son président actuel David Malpass partira vers avril 2014.""]]]","[[['otan', 'oana', 'lungescu', 'agence', 'dpa', 'projets', 'avenir', 'secrétaire', 'général', 'alliance', 'mandat', 'septembre', 'prochain'], ['mandat', 'secrétaire', 'général', 'terme', 'octobre', 'année', 'intention', 'nouvelle', 'prolongation', 'mandat', 'lungescu', 'mandat', 'jens', 'stoltenberg', 'reprises', 'poste', 'ans', 'dernière', 'reconduction', 'septembre', 'mars', 'année', 'dernière', 'début', 'opération', 'russe', 'welt', 'sonntag', 'dimanche', 'février', 'sources', 'diplomatiques', 'otan', 'mandat', 'secrétaire', 'général', 'jens', 'stoltenberg'], ['membres', 'mandat', 'stoltenberg', 'avril', 'raison', 'réalisations', 'exceptionnelles', 'stabilité', 'alliance', 'militaire', 'guerre', 'cours', 'ukraine', 'banque', 'welt', 'sonntag', 'état', 'accord', 'informel', 'états', 'membres', 'stoltenberg', 'poste', 'fin', 'mandat', 'septembre'], ['décision', 'formelle', 'prochaines', 'décision', 'succession', 'stoltenberg', 'ministre', 'espagnol', 'pedro', 'sanchez', 'secrétaire', 'britannique', 'défense', 'ben', 'wallace', 'principaux', 'candidats', 'poste', 'formation', 'jens', 'stoltenberg', 'tête', 'banque', 'mondiale', 'président', 'actuel', 'david', 'malpass', 'avril']]]","[[[], ['Ukraine'], ['Ukraine', 'États'], []]]","[[['Otan', 'DPA'], ['Otan'], ['Alliance militaire', 'Banque mondiale?Le Welt am Sonntag'], ['Banque mondiale']]]","[[['Oana Lungescu'], ['Mme Lungescu', 'Jens Stoltenberg', 'Jens Stoltenberg'], ['Stoltenberg', 'Stoltenberg'], ['Pedro Sanchez', 'Ben Wallace', 'Jens Stoltenberg', 'David Malpass']]]","{'otan': 2, 'oana': 1, 'lungescu': 2, 'agence': 1, 'dpa': 1, 'projets': 1, 'avenir': 1, 'secrétaire': 4, 'général': 3, 'alliance': 2, 'mandat': 7, 'septembre': 3, 'prochain': 1, 'terme': 1, 'octobre': 1, 'année': 2, 'intention': 1, 'nouvelle': 1, 'prolongation': 1, 'jens': 3, 'stoltenberg': 6, 'reprises': 1, 'poste': 3, 'ans': 1, 'dernière': 2, 'reconduction': 1, 'mars': 1, 'début': 1, 'opération': 1, 'russe': 1, 'welt': 2, 'sonntag': 2, 'dimanche': 1, 'février': 1, 'sources': 1, 'diplomatiques': 1, 'membres': 2, 'avril': 2, 'raison': 1, 'réalisations': 1, 'exceptionnelles': 1, 'stabilité': 1, 'militaire': 1, 'guerre': 1, 'cours': 1, 'ukraine': 1, 'banque': 2, 'état': 1, 'accord': 1, 'informel': 1, 'états': 1, 'fin': 1, 'décision': 2, 'formelle': 1, 'prochaines': 1, 'succession': 1, 'ministre': 1, 'espagnol': 1, 'pedro': 1, 'sanchez': 1, 'britannique': 1, 'défense': 1, 'ben': 1, 'wallace': 1, 'principaux': 1, 'candidats': 1, 'formation': 1, 'tête': 1, 'mondiale': 1, 'président': 1, 'actuel': 1, 'david': 1, 'malpass': 1}","{'Ukraine': 2, 'États': 1}","{'Otan': 2, 'DPA': 1, 'Alliance militaire': 1, 'Banque mondiale?Le Welt am Sonntag': 1, 'Banque mondiale': 1}","{'Oana Lungescu': 1, 'Mme Lungescu': 1, 'Jens Stoltenberg': 3, 'Stoltenberg': 2, 'Pedro Sanchez': 1, 'Ben Wallace': 1, 'David Malpass': 1}",2023,2,11
