timestamp,url,title,description,content,content-segmented,kws-l,loc-l,org-l,per-l,kws,loc,org,per,year,month,day
1680386400,https://fr.sputniknews.africa/20230402/je-taime-moi-non-plus-elon-musk-va-discuter-avec-les-autorites-chinoises-1058386213.html,Je t’aime moi non plus: Elon Musk va discuter avec les autorités chinoises,"Le patron de Tesla et de Twitter va se rendre en Chine, pays avec lequel il entretient des relations contrastées. Sa dernière visite remonte à 2020.","Les tribulations d’un milliardaire en Chine. L’homme d’affaires ElonMusk a prévu de se rendre bientôt dans l'Empire du milieu, où il espère notamment rencontrer le nouveau Premier ministre Li Qiang, rapporte Reuters.Une destination importante pour le patron de Tesla, qui avait ouvert une ""giga-usine"" à Shanghai en 2019. Musk avait d’ailleurs déjà rencontré Li Qiang à cette occasion. La dernière visite du fantasque homme d’affaires en Chine remonte néanmoins à trois ans, alors que Xi Jinping n’avait pas encore entamé son troisième mandat.La visite de Musk entre aussi dans une logique de réouverture chinoise, alors que le pays a été sévèrement mis à l’épreuve par la pandémie de Covid et compte attirer à nouveaux les investisseurs.Une relation tourmentéeMalgré l’ouverture de l’usine Tesla à Shanghai, Pékin entretient pourtant une relation ambigüe avec Elon Musk. La Chine voit en particulier d’un mauvais œil le déploiement de son réseau de satellites Starlink, censé fournir des services internet. L’Empire milieu envisage même de créer une constellation concurrente de 13.000 satellites, pour empêcher Starlink de monopoliser l’orbite terrestre basse.En mars 2021, le Wall Street Journal avait également affirmé que le gouvernement chinois restreignait l’utilisation des véhicules Tesla pour certains employés militaires, à cause des caméras capables de récolter certaines données sensibles. Elon Musk avait cependant nié les accusations d’espionnage via ces véhicules.Le milliardaire americano-sud-africain a également donné son avis géopolitique sur la Chine à plusieurs reprises. Fin 2021, il avait ainsi déclaré que le pays avait acquis le statut de puissance mondiale, devançant même les États-Unis économiquement. En octobre 2022, il avait aussi proposé de donner à Taïwan le statut de zone administrative spéciale pour apaiser les tensions autour de l’île.Si ses usines sont implantées en Chine, Tesla connaît par ailleurs quelques difficultés sur le marché intérieur, distancé par les constructeurs locaux. BYD, géant chinois des véhicules électriques a depuis longtemps dépassé la marque américaine dans le pays, représentant 41% des ventes de voitures à énergie verte, contre 8% pour Tesla.","[[['Les tribulations d’un milliardaire en Chine.'], ['L’homme d’affaires ElonMusk a prévu de se rendre bientôt dans l\'Empire du milieu, où il espère notamment rencontrer le nouveau Premier ministre Li Qiang, rapporte Reuters.Une destination importante pour le patron de Tesla, qui avait ouvert une ""giga-usine"" à Shanghai en 2019.'], ['Musk avait d’ailleurs déjà rencontré Li Qiang à cette occasion.'], ['La dernière visite du fantasque homme d’affaires en Chine remonte néanmoins à trois ans, alors que Xi Jinping n’avait pas encore entamé son troisième mandat.La visite de Musk entre aussi dans une logique de réouverture chinoise, alors que le pays a été sévèrement mis à l’épreuve par la pandémie de Covid et compte attirer à nouveaux les investisseurs.Une relation tourmentéeMalgré l’ouverture de l’usine Tesla à Shanghai, Pékin entretient pourtant une relation ambigüe avec Elon Musk.'], ['La Chine voit en particulier d’un mauvais œil le déploiement de son réseau de satellites Starlink, censé fournir des services internet.'], ['L’Empire milieu envisage même de créer une constellation concurrente de 13.000 satellites, pour empêcher Starlink de monopoliser l’orbite terrestre basse.En mars 2021, le Wall Street Journal avait également affirmé que le gouvernement chinois restreignait l’utilisation des véhicules Tesla pour certains employés militaires, à cause des caméras capables de récolter certaines données sensibles.'], ['Elon Musk avait cependant nié les accusations d’espionnage via ces véhicules.Le milliardaire americano-sud-africain a également donné son avis géopolitique sur la Chine à plusieurs reprises.'], ['Fin 2021, il avait ainsi déclaré que le pays avait acquis le statut de puissance mondiale, devançant même les États-Unis économiquement.'], ['En octobre 2022, il avait aussi proposé de donner à Taïwan le statut de zone administrative spéciale pour apaiser les tensions autour de l’île.Si ses usines sont implantées en Chine, Tesla connaît par ailleurs quelques difficultés sur le marché intérieur, distancé par les constructeurs locaux.'], ['BYD, géant chinois des véhicules électriques a depuis longtemps dépassé la marque américaine dans le pays, représentant 41% des ventes de voitures à énergie verte, contre 8% pour Tesla.']]]","[[['tribulations', 'milliardaire', 'chine'], ['homme', 'affaires', 'empire', 'milieu', 'ministre', 'qiang', 'destination', 'importante', 'patron', 'tesla', 'giga', 'usine'], ['qiang', 'occasion'], ['dernière', 'visite', 'fantasque', 'homme', 'affaires', 'chine', 'ans', 'jinping', 'visite', 'musk', 'logique', 'réouverture', 'chinoise', 'pays', 'épreuve', 'pandémie', 'covid', 'compte', 'nouveaux', 'relation', 'tourmentéemalgré', 'ouverture', 'usine', 'tesla', 'shanghai', 'pékin', 'relation', 'ambigüe', 'elon', 'musk'], ['chine', 'particulier', 'mauvais', 'œil', 'déploiement', 'réseau', 'satellites', 'starlink', 'censé', 'services', 'internet'], ['empire', 'milieu', 'constellation', 'concurrente', 'satellites', 'starlink', 'orbite', 'terrestre', 'mars', 'wall', 'street', 'gouvernement', 'chinois', 'utilisation', 'véhicules', 'tesla', 'employés', 'militaires', 'cause', 'caméras', 'capables', 'données', 'sensibles'], ['elon', 'musk', 'accusations', 'espionnage', 'milliardaire', 'avis', 'géopolitique', 'chine', 'reprises'], ['fin', 'pays', 'statut', 'puissance', 'mondiale'], ['octobre', 'taïwan', 'statut', 'zone', 'administrative', 'spéciale', 'tensions', 'usines', 'chine', 'tesla', 'difficultés', 'marché', 'intérieur', 'constructeurs', 'locaux'], ['byd', 'géant', 'chinois', 'véhicules', 'électriques', 'marque', 'américaine', 'pays', 'représentant', 'ventes', 'voitures', 'énergie', 'verte', 'tesla']]]","[[['Chine'], ['Shanghai'], [], ['Chine', 'Shanghai', 'Pékin'], ['Chine'], ['L’Empire'], ['americano-sud-africain', 'Chine'], ['États-Unis'], ['Taïwan', 'Chine'], []]]","[[[], ['Reuters'], [], ['Tesla'], [], ['Tesla'], [], [], [], ['BYD']]]","[[[], ['Premier', 'Li Qiang', 'Tesla'], ['Musk', 'Li Qiang'], ['Xi Jinping', 'Musk', 'Elon Musk'], [], [], ['Elon Musk'], [], ['Tesla'], ['Tesla']]]","{'tribulations': 1, 'milliardaire': 2, 'chine': 5, 'homme': 2, 'affaires': 2, 'empire': 2, 'milieu': 2, 'ministre': 1, 'qiang': 2, 'destination': 1, 'importante': 1, 'patron': 1, 'tesla': 5, 'giga': 1, 'usine': 2, 'occasion': 1, 'dernière': 1, 'visite': 2, 'fantasque': 1, 'ans': 1, 'jinping': 1, 'musk': 3, 'logique': 1, 'réouverture': 1, 'chinoise': 1, 'pays': 3, 'épreuve': 1, 'pandémie': 1, 'covid': 1, 'compte': 1, 'nouveaux': 1, 'relation': 2, 'tourmentéemalgré': 1, 'ouverture': 1, 'shanghai': 1, 'pékin': 1, 'ambigüe': 1, 'elon': 2, 'particulier': 1, 'mauvais': 1, 'œil': 1, 'déploiement': 1, 'réseau': 1, 'satellites': 2, 'starlink': 2, 'censé': 1, 'services': 1, 'internet': 1, 'constellation': 1, 'concurrente': 1, 'orbite': 1, 'terrestre': 1, 'mars': 1, 'wall': 1, 'street': 1, 'gouvernement': 1, 'chinois': 2, 'utilisation': 1, 'véhicules': 2, 'employés': 1, 'militaires': 1, 'cause': 1, 'caméras': 1, 'capables': 1, 'données': 1, 'sensibles': 1, 'accusations': 1, 'espionnage': 1, 'avis': 1, 'géopolitique': 1, 'reprises': 1, 'fin': 1, 'statut': 2, 'puissance': 1, 'mondiale': 1, 'octobre': 1, 'taïwan': 1, 'zone': 1, 'administrative': 1, 'spéciale': 1, 'tensions': 1, 'usines': 1, 'difficultés': 1, 'marché': 1, 'intérieur': 1, 'constructeurs': 1, 'locaux': 1, 'byd': 1, 'géant': 1, 'électriques': 1, 'marque': 1, 'américaine': 1, 'représentant': 1, 'ventes': 1, 'voitures': 1, 'énergie': 1, 'verte': 1}","{'Chine': 5, 'Shanghai': 2, 'Pékin': 1, 'L’Empire': 1, 'americano-sud-africain': 1, 'États-Unis': 1, 'Taïwan': 1}","{'Reuters': 1, 'Tesla': 2, 'BYD': 1}","{'Premier': 1, 'Li Qiang': 2, 'Tesla': 3, 'Musk': 2, 'Xi Jinping': 1, 'Elon Musk': 2}",2023,4,1
1680386400,https://fr.sputniknews.africa/20230402/la-russie-poursuit-les-reductions-de-sa-production-de-petrole-1058385898.html,La Russie poursuit les réductions de sa production de pétrole,"La Russie va continuer de resserrer les vannes pétrolières, au moins jusqu’à la fin de l’année. Les réductions avaient été décidées suite à la mise en place du plafonnement des prix de l’or noir par certains pays occidentaux.","Parti pour durer. La Russie, qui avait déjà restreint sa production de pétrole de 500.000 barils par jour en mars, va étendre son programme jusqu’à la fin de l’année, a annoncé le vice-Premier ministre russe Alexander Novak.Moscou s’aligne ainsi sur la décision de plusieurs autres membres de l’Opep+, comme l’Arabie saoudite, le Koweït ou les Émirats arabes unis, qui ont aussi décidé de réduire leur production.""En agissant comme un acteur responsable, dans le cadre des mesures de prudence contre une plus grande volatilité du marché, la Russie mettra en œuvre une réduction volontaire de sa production de 500.000 barils par jour jusqu'à la fin de 2023, à partir du niveau moyen évalué en février"", explique ainsi Alexander Novak dans un communiqué.Moscou avait déjà lancé un programme de réduction début février, qui avait été reconduit au 21 mars.Mesure de rétorsion contre le plafonnementEn mai 2022, l’Union européenne avait décidé d’un embargo sur le pétrole russe. Cette mesure s’était vu doubler d’un plafonnement des prix du baril, adopté par les pays du G7 début décembre. En réaction, Moscou avait décidé de ne plus vendre son or noir aux États observant ce plafond, réduisant volontairement sa production de 500.000 barils, soit 5% de baisse.La Russie continue néanmoins de vendre son pétrole à divers autres acheteurs. Les achats chinois et indiens ont notamment augmenté. L’Afrique est également devenue un marché de choix pour Moscou et certains pays ont même doublé leurs importations, comme le Maroc, la Tunisie, le Sénégal ou le Ghana.Même refrain pour les dérivés du pétrole (diesel, produits raffinés), sous embargo en Europe, qui se trouvent de nouveaux débouchés en Afrique du Nord.Ces mouvements ont récemment fait dire au média Bloomberg que le commerce du pétrole vivait un tournant radical. Le centre de gravité des raffineries s’est notamment déplacé de l’Ouest vers l’Est, poussant à la construction de nouveaux navires pétroliers.","[[['Parti pour durer.'], ['La Russie, qui avait déjà restreint sa production de pétrole de 500.000 barils par jour en mars, va étendre son programme jusqu’à la fin de l’année, a annoncé le vice-Premier ministre russe Alexander Novak.Moscou s’aligne ainsi sur la décision de plusieurs autres membres de l’Opep+, comme l’Arabie saoudite, le Koweït ou les Émirats arabes unis, qui ont aussi décidé de réduire leur production.'], ['""En agissant comme un acteur responsable, dans le cadre des mesures de prudence contre une plus grande volatilité du marché, la Russie mettra en œuvre une réduction volontaire de sa production de 500.000 barils par jour jusqu\'à la fin de 2023, à partir du niveau moyen évalué en février"", explique ainsi Alexander Novak dans un communiqué.Moscou avait déjà lancé un programme de réduction début février, qui avait été reconduit au 21 mars.Mesure de rétorsion contre le plafonnementEn mai 2022, l’Union européenne avait décidé d’un embargo sur le pétrole russe.'], ['Cette mesure s’était vu doubler d’un plafonnement des prix du baril, adopté par les pays du G7 début décembre.'], ['En réaction, Moscou avait décidé de ne plus vendre son or noir aux États observant ce plafond, réduisant volontairement sa production de 500.000 barils, soit 5% de baisse.La Russie continue néanmoins de vendre son pétrole à divers autres acheteurs.'], ['Les achats chinois et indiens ont notamment augmenté.'], ['L’Afrique est également devenue un marché de choix pour Moscou et certains pays ont même doublé leurs importations, comme le Maroc, la Tunisie, le Sénégal ou le Ghana.Même refrain pour les dérivés du pétrole (diesel, produits raffinés), sous embargo en Europe, qui se trouvent de nouveaux débouchés en Afrique du Nord.Ces mouvements ont récemment fait dire au média Bloomberg que le commerce du pétrole vivait un tournant radical.'], ['Le centre de gravité des raffineries s’est notamment déplacé de l’Ouest vers l’Est, poussant à la construction de nouveaux navires pétroliers.']]]","[[[], ['russie', 'production', 'pétrole', 'barils', 'jour', 'mars', 'programme', 'fin', 'année', 'ministre', 'russe', 'décision', 'membres', 'arabie', 'saoudite', 'koweït', 'émirats', 'arabes', 'unis', 'production'], ['acteur', 'responsable', 'cadre', 'mesures', 'prudence', 'grande', 'volatilité', 'marché', 'russie', 'œuvre', 'réduction', 'volontaire', 'production', 'barils', 'jour', 'fin', 'niveau', 'moyen', 'février', 'novak', 'programme', 'réduction', 'début', 'février', 'rétorsion', 'plafonnementen', 'mai', 'union', 'européenne', 'embargo', 'pétrole', 'russe'], ['mesure', 'plafonnement', 'prix', 'baril', 'pays', 'début', 'décembre'], ['réaction', 'moscou', 'noir', 'états', 'plafond', 'production', 'barils', 'russie', 'pétrole', 'acheteurs'], ['achats', 'chinois', 'indiens'], ['afrique', 'marché', 'choix', 'moscou', 'pays', 'importations', 'maroc', 'tunisie', 'sénégal', 'refrain', 'dérivés', 'pétrole', 'diesel', 'produits', 'raffinés', 'embargo', 'europe', 'nouveaux', 'débouchés', 'afrique', 'mouvements', 'média', 'bloomberg', 'commerce', 'pétrole', 'tournant', 'radical'], ['centre', 'gravité', 'raffineries', 'ouest', 'construction', 'nouveaux', 'navires', 'pétroliers']]]","[[[], ['Russie', 'Moscou', 'Arabie saoudite', 'Koweït', 'Émirats arabes unis'], ['Russie', 'Moscou'], [], ['Moscou', 'États', 'Russie'], [], ['L’Afrique', 'Moscou', 'Maroc', 'Tunisie', 'Sénégal', 'Ghana', 'Europe', 'Afrique du Nord'], ['Ouest', 'Est']]]","[[['Parti'], ['Opep+'], ['Union européenne'], ['G7'], [], [], [], []]]","[[[], ['Alexander Novak'], ['Alexander Novak'], [], [], [], ['Bloomberg'], []]]","{'russie': 3, 'production': 4, 'pétrole': 5, 'barils': 3, 'jour': 2, 'mars': 1, 'programme': 2, 'fin': 2, 'année': 1, 'ministre': 1, 'russe': 2, 'décision': 1, 'membres': 1, 'arabie': 1, 'saoudite': 1, 'koweït': 1, 'émirats': 1, 'arabes': 1, 'unis': 1, 'acteur': 1, 'responsable': 1, 'cadre': 1, 'mesures': 1, 'prudence': 1, 'grande': 1, 'volatilité': 1, 'marché': 2, 'œuvre': 1, 'réduction': 2, 'volontaire': 1, 'niveau': 1, 'moyen': 1, 'février': 2, 'novak': 1, 'début': 2, 'rétorsion': 1, 'plafonnementen': 1, 'mai': 1, 'union': 1, 'européenne': 1, 'embargo': 2, 'mesure': 1, 'plafonnement': 1, 'prix': 1, 'baril': 1, 'pays': 2, 'décembre': 1, 'réaction': 1, 'moscou': 2, 'noir': 1, 'états': 1, 'plafond': 1, 'acheteurs': 1, 'achats': 1, 'chinois': 1, 'indiens': 1, 'afrique': 2, 'choix': 1, 'importations': 1, 'maroc': 1, 'tunisie': 1, 'sénégal': 1, 'refrain': 1, 'dérivés': 1, 'diesel': 1, 'produits': 1, 'raffinés': 1, 'europe': 1, 'nouveaux': 2, 'débouchés': 1, 'mouvements': 1, 'média': 1, 'bloomberg': 1, 'commerce': 1, 'tournant': 1, 'radical': 1, 'centre': 1, 'gravité': 1, 'raffineries': 1, 'ouest': 1, 'construction': 1, 'navires': 1, 'pétroliers': 1}","{'Russie': 3, 'Moscou': 4, 'Arabie saoudite': 1, 'Koweït': 1, 'Émirats arabes unis': 1, 'États': 1, 'L’Afrique': 1, 'Maroc': 1, 'Tunisie': 1, 'Sénégal': 1, 'Ghana': 1, 'Europe': 1, 'Afrique du Nord': 1, 'Ouest': 1, 'Est': 1}","{'Parti': 1, 'Opep+': 1, 'Union européenne': 1, 'G7': 1}","{'Alexander Novak': 2, 'Bloomberg': 1}",2023,4,1
