timestamp,url,title,description,content,content-segmented,kws-l,loc-l,org-l,per-l,kws,loc,org,per,year,month,day
1667862000,https://fr.sputniknews.africa/20221108/cameroun-un-hippopotame-tue-sept-passagers-sur-des-pirogues-1056758308.html,Cameroun: un hippopotame tue sept passagers sur des pirogues,"Dans le nord du Cameroun, un hippopotame a semé la terreur en renversant deux pirogues sur le fleuve Logone début novembre. L'attaque subite a coûté la vie à sept passagers.","L'hippopotame a beau être classé comme vulnérable à l'état sauvage et prisé pour son ivoire, il reste très dangereux pour les humains. Dans la région de l‘Extrême-Nord du Cameroun, un pachyderme a ainsi attaqué deux pirogues sur le fleuve Logone début novembre. L'attaque a coûté la vie à sept passagers, dont les embarcations ont chaviré non loin des berges du fleuve.Une fois les bateaux renversés, l'animal a replongé dans les eaux pour y disparaître.Les inondations comme facteur de proliférationLes circonstances de ce drame restent toujours floues, mais, selon des rapports, les attaques d’hippopotames sont très nombreuses dans certaines rivières de cette région camerounaise, en particulier durant la période des inondations qui est en cours, relate Actu Cameroun.C'est la montée des eaux qui est le principal facteur favorisant la propagation des hippopotames, indique le média Cameroon magazine. Selon lui, les troupeaux ont visiblement augmenté en nombre cette année.","[[[""L'hippopotame a beau être classé comme vulnérable à l'état sauvage et prisé pour son ivoire, il reste très dangereux pour les humains."", 'Dans la région de l‘Extrême-Nord du Cameroun, un pachyderme a ainsi attaqué deux pirogues sur le fleuve Logone début novembre.', ""L'attaque a coûté la vie à sept passagers, dont les embarcations ont chaviré non loin des berges du fleuve.Une fois les bateaux renversés, l'animal a replongé dans les eaux pour y disparaître.Les inondations comme facteur de proliférationLes circonstances de ce drame restent toujours floues, mais, selon des rapports, les attaques d’hippopotames sont très nombreuses dans certaines rivières de cette région camerounaise, en particulier durant la période des inondations qui est en cours, relate Actu Cameroun.C'est la montée des eaux qui est le principal facteur favorisant la propagation des hippopotames, indique le média Cameroon magazine."", 'Selon lui, les troupeaux ont visiblement augmenté en nombre cette année.']]]","[[['hippopotame', 'beau', 'vulnérable', 'état', 'sauvage', 'ivoire', 'dangereux', 'humain'], ['région', 'nord', 'cameroun', 'pachyderme', 'pirogue', 'fleuve', 'début', 'novembre'], ['attaque', 'vie', 'passager', 'embarcation', 'berge', 'fois', 'bateau', 'animal', 'eau', 'inondation', 'facteur', 'proliférationle', 'circonstance', 'drame', 'flou', 'rapport', 'attaque', 'hippopotame', 'rivière', 'région', 'camerounais', 'particulier', 'période', 'inondation', 'cours', 'actualité', 'montée', 'eau', 'principal', 'facteur', 'propagation', 'hippopotame', 'média', 'cameroon', 'magazine'], ['troupeau', 'nombre', 'année']]]","[[[], ['l‘Extrême-Nord', 'Cameroun', 'Logone'], ['proliférationLes'], []]]","[[[], [], ['Cameroon magazine'], []]]","[[[], [], [], []]]","{'hippopotame': 3, 'beau': 1, 'vulnérable': 1, 'état': 1, 'sauvage': 1, 'ivoire': 1, 'dangereux': 1, 'humain': 1, 'région': 2, 'nord': 1, 'cameroun': 1, 'pachyderme': 1, 'pirogue': 1, 'fleuve': 1, 'début': 1, 'novembre': 1, 'attaque': 2, 'vie': 1, 'passager': 1, 'embarcation': 1, 'berge': 1, 'fois': 1, 'bateau': 1, 'animal': 1, 'eau': 2, 'inondation': 2, 'facteur': 2, 'proliférationle': 1, 'circonstance': 1, 'drame': 1, 'flou': 1, 'rapport': 1, 'rivière': 1, 'camerounais': 1, 'particulier': 1, 'période': 1, 'cours': 1, 'actualité': 1, 'montée': 1, 'principal': 1, 'propagation': 1, 'média': 1, 'cameroon': 1, 'magazine': 1, 'troupeau': 1, 'nombre': 1, 'année': 1}","{'l‘Extrême-Nord': 1, 'Cameroun': 1, 'Logone': 1, 'proliférationLes': 1}",{'Cameroon magazine': 1},{},2022,11,7
1667862000,https://fr.sputniknews.africa/20221108/des-calins-et-un-bisou-sur-la-joue-les-retrouvailles-macron-tebboune-provoquent-un-tolle-1056757251.html,"Des ""câlins"" et un ""bisou sur la joue"": les retrouvailles Macron-Tebboune provoquent un tollé","Un bisou d’Emmanuel Macron sur la joue d’Abdelmadjid Tebboune, ""un peu too much""? Alors qu’il n’avait pas encore eu le temps de se calmer après l'échange entre le Président français et son homologue vénézuélien, Twitter a bouillonné de...","Alors qu’il prend part à la 27e édition de la COP en Égypte, Emmanuel Macron a échangé avec nombre de chefs d’État, jusqu’à dialoguer amicalement avec Nicolas Maduro, dont il n’a jamais reconnu la réélection à la présidentielle vénézuélienne. Si cette dernière a fait quelques Unes dans la presse, la rencontre de M.Macron avec son homologue algérien a suscité quant à elle un tollé.Et pour cause: pendant leur rencontre, la première depuis la visite de M.Macron en Algérie fin août, les Présidents se sont adonnés à une accolade plutôt chaleureuse. La séquence diffusée largement sur Twitter montre le chef de l’État français faire un ""bisou"" sur la joue d’Abdelmadjid Tebboune.Pour certains, ce geste était exagéré. Quand #Macron rencontre le président algérien #tebboune en marge de la #cop27, ça donne ça.Un peu too much ou c'est une idée ?! 🤔 pic.twitter.com/QXOkynx5y6— Fred Marseille (@fred2marseille) November 8, 2022 ""Un peu too much ou c'est une idée?"" BAISER APPUYÉ SUR LES JOUES du président de l’Algérie Tebboune. E.Macron a de bizarres comportements avec les hommes dans l’exécution de son rôle de chef d’état. En froid avec la Russie, Dieu merci, il ne l’a pas embrassé sur la bouche, à la Russe. pic.twitter.com/vVifHnP1NJ— Bernet Louis (@bernet83) November 8, 2022 Ce Président a un problème avec les câlins. https://t.co/9W3mENGJse— Et pourquoi pas ? (@EliseMiaou77) November 8, 2022 ""Alors que Tebboune a rabaissé la France dans tous ses discours, Macron l’enlace"", a fait remarquer un internaute.Cette attitude d’Alger envers Paris avait déjà refait surface suite à l’accueil auquel a eu droit Emmanuel Macron lors de sa visite en Algérie cet été. D’abord, du pupitre du Président, la langue française a été détrônée par anglais. Ensuite, avant de quitter le pays africain, il a reçu un bain de foule controversé.La France et son besoin du gaz algérien""C’est officiel: la France a besoin de l’Algérie"", a ironisé un utilisateur de Twitter. Ce, alors que le gaz algérien peut partiellement remplacer le manque de gaz russe en Europe, bien que fin août le Président français ait déclaré que le gaz algérien ne pouvait pas ""changer la donne"". Petit bisou de Macron au président Algérien Tebboune. C’est officiel la France a Besoin de l’Algérie. 😂 pic.twitter.com/5c0u0HfmXh— Physionomiste Tdah PSG Forever!!! 93-95 (@physionomiste1) November 8, 2022 Ce type a vraiment un problème tactile...😳😳Sinon, quelqu'un pour lui dire que l'Algérie a demandé à rejoindre les BRICS.... https://t.co/2qe4PJ3Lzo— HURIEL (@Jfh82) November 8, 2022 ""Sinon, quelqu'un pour lui dire que l'Algérie a demandé à rejoindre les BRICS...""L’accolade Macron-Tebboune a provoqué l’ironie de quelques twittos qui ont laissé libre cours à leur imagination: #macron avec le président #algerien 😂😂😂#algerie #Tebboune https://t.co/pFbLmXcuWn pic.twitter.com/mcaZDVZY7m— phen (@phoenixwright99) November 8, 2022 MDRRR la grosse bise de Macron, Tebboune a dû vraiment lui manqué https://t.co/FgDFGcoqLK— 𝐑𝐒 🦢 (@_rsdni) November 7, 2022 @f_philippot @MarionMarechal @dupontaignan @tamilatapayeva Parfois les mots sont insuffisants pour traduire ce que l'on ressent. https://t.co/1dNJiAuDFu— 🇨🇵🇨🇵Réveillez-vous bon sang 📢 📢😈😈😈 (@kiberen56) November 7, 2022 Outre ses échanges avec Abdelmadjid Tebboune et Nicolas Maduro, la rencontre d'Emmanuel Macron avec un ministre du Bénin avait également fait l'objet de moqueries sur les réseaux sociaux. Après que le Président français avait fait une petite tape à l'épaule du ministre Agbenonci, celui-ci avait immédiatement nettoyé du bout des doigts son épaule. La rencontre de Macron avec un ministre du Bénin moquée sur les réseaux sociaux- Les internautes n'hésitent pas à parler ""d'humiliation du président français"" pic.twitter.com/Y1b2uiiGBL— ANADOLU AGENCY (FR) (@aa_french) July 30, 2022","[[['Alors qu’il prend part à la 27e édition de la COP en Égypte, Emmanuel Macron a échangé avec nombre de chefs d’État, jusqu’à dialoguer amicalement avec Nicolas Maduro, dont il n’a jamais reconnu la réélection à la présidentielle vénézuélienne.', 'Si cette dernière a fait quelques Unes dans la presse, la rencontre de M.Macron avec son homologue algérien a suscité quant à elle un tollé.Et pour cause: pendant leur rencontre, la première depuis la visite de M.Macron en Algérie fin août, les Présidents se sont adonnés à une accolade plutôt chaleureuse.', 'La séquence diffusée largement sur Twitter montre le chef de l’État français faire un ""bisou"" sur la joue d’Abdelmadjid Tebboune.Pour certains, ce geste était exagéré.', ""Quand #Macron rencontre le président algérien #tebboune en marge de la #cop27, ça donne ça.Un peu too much ou c'est une idée ?"", '!', '🤔 pic.twitter.com/QXOkynx5y6— Fred Marseille (@fred2marseille) November 8, 2022 ""Un peu too much ou c\'est une idée?""', 'BAISER APPUYÉ SUR LES JOUES du président de l’Algérie Tebboune.', 'E.Macron a de bizarres comportements avec les hommes dans l’exécution de son rôle de chef d’état.', 'En froid avec la Russie, Dieu merci, il ne l’a pas embrassé sur la bouche, à la Russe.', 'pic.twitter.com/vVifHnP1NJ— Bernet Louis (@bernet83) November 8, 2022 Ce Président a un problème avec les câlins.', 'https://t.co/9W3mENGJse— Et pourquoi pas ?', '(@EliseMiaou77) November 8, 2022 ""Alors que Tebboune a rabaissé la France dans tous ses discours, Macron l’enlace"", a fait remarquer un internaute.Cette attitude d’Alger envers Paris avait déjà refait surface suite à l’accueil auquel a eu droit Emmanuel Macron lors de sa visite en Algérie cet été.', 'D’abord, du pupitre du Président, la langue française a été détrônée par anglais.', 'Ensuite, avant de quitter le pays africain, il a reçu un bain de foule controversé.La France et son besoin du gaz algérien""C’est officiel: la France a besoin de l’Algérie"", a ironisé un utilisateur de Twitter.', 'Ce, alors que le gaz algérien peut partiellement remplacer le manque de gaz russe en Europe, bien que fin août le Président français ait déclaré que le gaz algérien ne pouvait pas ""changer la donne"".', 'Petit bisou de Macron au président Algérien Tebboune.', 'C’est officiel la France a Besoin de l’Algérie.', '😂 pic.twitter.com/5c0u0HfmXh— Physionomiste Tdah PSG Forever!!!', '93-95 (@physionomiste1) November 8, 2022 Ce type a vraiment un problème tactile...😳😳Sinon, quelqu\'un pour lui dire que l\'Algérie a demandé à rejoindre les BRICS.... https://t.co/2qe4PJ3Lzo— HURIEL (@Jfh82) November 8, 2022 ""Sinon, quelqu\'un pour lui dire que l\'Algérie a demandé à rejoindre les BRICS...""L’accolade Macron-Tebboune a provoqué l’ironie de quelques twittos qui ont laissé libre cours à leur imagination: #macron avec le président #algerien 😂😂😂#algerie #Tebboune https://t.co/pFbLmXcuWn pic.twitter.com/mcaZDVZY7m— phen (@phoenixwright99) November 8, 2022 MDRRR la grosse bise de Macron, Tebboune a dû vraiment lui manqué https://t.co/FgDFGcoqLK— 𝐑𝐒 🦢 (@_rsdni) November 7, 2022 @f_philippot @MarionMarechal @dupontaignan @tamilatapayeva Parfois les mots sont insuffisants pour traduire ce que l\'on ressent.', ""https://t.co/1dNJiAuDFu— 🇨🇵🇨🇵Réveillez-vous bon sang 📢 📢😈😈😈 (@kiberen56) November 7, 2022 Outre ses échanges avec Abdelmadjid Tebboune et Nicolas Maduro, la rencontre d'Emmanuel Macron avec un ministre du Bénin avait également fait l'objet de moqueries sur les réseaux sociaux."", ""Après que le Président français avait fait une petite tape à l'épaule du ministre Agbenonci, celui-ci avait immédiatement nettoyé du bout des doigts son épaule."", 'La rencontre de Macron avec un ministre du Bénin moquée sur les réseaux sociaux- Les internautes n\'hésitent pas à parler ""d\'humiliation du président français"" pic.twitter.com/Y1b2uiiGBL— ANADOLU AGENCY (FR) (@aa_french) July 30, 2022']]]","[[['part', 'édition', 'cop', 'égypte', 'emmanuel', 'nombre', 'chef', 'état', 'nicolas', 'maduro', 'réélection', 'présidentielle', 'vénézuélien'], ['dernier', 'presse', 'rencontre', 'homologue', 'algérien', 'cause', 'rencontre', 'visite', 'algérie', 'août', 'président', 'accolade', 'chaleureux'], ['séquence', 'chef', 'état', 'français', 'bisou', 'abdelmadjid', 'geste'], ['président', 'algérien', 'tebboun', 'marge', 'idée'], [], ['fred', 'marseille', 'november', 'idée'], ['baiser', 'joue', 'président', 'algérie', 'tebboun'], ['bizarre', 'comportement', 'homme', 'exécution', 'rôle', 'chef', 'état'], ['froid', 'russie', 'dieu', 'bouche', 'russe'], ['bernet', 'louis', 'november', 'président', 'problème', 'câlin'], [], ['november', 'france', 'discours', 'enlace', 'attitude', 'alger', 'pari', 'surface', 'suite', 'accueil', 'droit', 'emmanuel', 'visite', 'algérie'], ['pupitre', 'président', 'langue', 'français', 'anglais'], ['pays', 'africain', 'bain', 'foule', 'france', 'besoin', 'gaz', 'officiel', 'france', 'besoin', 'algérie', 'utilisateur', 'twitter'], ['gaz', 'algérien', 'manque', 'gaz', 'russe', 'europe', 'fin', 'août', 'président', 'français', 'gaz', 'algérien'], ['petit', 'bisou', 'président', 'algérien', 'tebboune'], ['officiel', 'france', 'besoin', 'algérie'], ['physionomiste', 'tdah', 'psg'], ['november', 'type', 'problème', 'tactile', 'algérie', 'bric', 'huriel', 'november', 'algérie', 'bric', 'accolade', 'tebboun', 'ironie', 'twitto', 'libre', 'cours', 'imagination', 'président', 'algerien', 'algerie', 'phen', 'november', 'gros', 'bise', '𝐑𝐒', 'november', 'mot', 'insuffisant'], ['bon', 'sang', 'november', 'échange', 'abdelmadjid', 'tebboun', 'nicolas', 'maduro', 'rencontre', 'emmanuel', 'ministre', 'bénin', 'objet', 'moquerie', 'réseau', 'social'], ['président', 'français', 'petit', 'épaule', 'ministre', 'agbenonci', 'bout', 'doigt', 'épaule'], ['rencontre', 'ministre', 'bénin', 'réseau', 'internaute', 'humiliation', 'président', 'français', 'anadolu', 'fr', 'july']]]","[[['État'], ['Algérie'], [], [], [], [], [], [], ['Russie', 'Russie'], [], ['https://t.co/9W3mENGJse—'], ['France', 'Alger', 'Paris', 'Algérie'], [], ['France', 'France', 'l’Algérie'], ['Europe'], [], ['France'], [], ['Algérie', 'Algérie'], ['https://t.co/1dNJiAuDFu— 🇨🇵', 'Bénin'], [], ['Bénin', 'FR', '@aa_french']]]","[[[], ['M.Macron', 'M.Macron'], [], [], [], [], [], ['E.Macron'], [], [], [], [], [], [], ['Président français'], [], ['Besoin de l’Algérie'], ['Tdah PSG'], ['BRICS', 'BRICS'], [], ['Président français'], ['AGENCY']]]","[[['Emmanuel Macron', 'Nicolas Maduro'], [], ['Abdelmadjid Tebboune'], ['#Macron', '#tebboune'], [], ['Fred Marseille'], ['président de l’'], [], [], ['Ce Président'], [], ['Tebboune', 'Macron', 'Emmanuel Macron'], ['Président'], ['algérien""C’'], [], ['Macron', 'Algérien Tebboune'], [], [], ['#macron', 'Tebboune', '𝐑𝐒'], ['Abdelmadjid Tebboune', 'Nicolas Maduro', 'Emmanuel Macron'], [], ['Macron']]]","{'part': 1, 'édition': 1, 'cop': 1, 'égypte': 1, 'emmanuel': 3, 'nombre': 1, 'chef': 3, 'état': 3, 'nicolas': 2, 'maduro': 2, 'réélection': 1, 'présidentielle': 1, 'vénézuélien': 1, 'dernier': 1, 'presse': 1, 'rencontre': 4, 'homologue': 1, 'algérien': 5, 'cause': 1, 'visite': 2, 'algérie': 7, 'août': 2, 'président': 10, 'accolade': 2, 'chaleureux': 1, 'séquence': 1, 'français': 5, 'bisou': 2, 'abdelmadjid': 2, 'geste': 1, 'tebboun': 4, 'marge': 1, 'idée': 2, 'fred': 1, 'marseille': 1, 'november': 8, 'baiser': 1, 'joue': 1, 'bizarre': 1, 'comportement': 1, 'homme': 1, 'exécution': 1, 'rôle': 1, 'froid': 1, 'russie': 1, 'dieu': 1, 'bouche': 1, 'russe': 2, 'bernet': 1, 'louis': 1, 'problème': 2, 'câlin': 1, 'france': 4, 'discours': 1, 'enlace': 1, 'attitude': 1, 'alger': 1, 'pari': 1, 'surface': 1, 'suite': 1, 'accueil': 1, 'droit': 1, 'pupitre': 1, 'langue': 1, 'anglais': 1, 'pays': 1, 'africain': 1, 'bain': 1, 'foule': 1, 'besoin': 3, 'gaz': 4, 'officiel': 2, 'utilisateur': 1, 'twitter': 1, 'manque': 1, 'europe': 1, 'fin': 1, 'petit': 2, 'tebboune': 1, 'physionomiste': 1, 'tdah': 1, 'psg': 1, 'type': 1, 'tactile': 1, 'bric': 2, 'huriel': 1, 'ironie': 1, 'twitto': 1, 'libre': 1, 'cours': 1, 'imagination': 1, 'algerien': 1, 'algerie': 1, 'phen': 1, 'gros': 1, 'bise': 1, '𝐑𝐒': 1, 'mot': 1, 'insuffisant': 1, 'bon': 1, 'sang': 1, 'échange': 1, 'ministre': 3, 'bénin': 2, 'objet': 1, 'moquerie': 1, 'réseau': 2, 'social': 1, 'épaule': 2, 'agbenonci': 1, 'bout': 1, 'doigt': 1, 'internaute': 1, 'humiliation': 1, 'anadolu': 1, 'fr': 1, 'july': 1}","{'État': 1, 'Algérie': 4, 'Russie': 2, 'https://t.co/9W3mENGJse—': 1, 'France': 4, 'Alger': 1, 'Paris': 1, 'l’Algérie': 1, 'Europe': 1, 'https://t.co/1dNJiAuDFu— 🇨🇵': 1, 'Bénin': 2, 'FR': 1, '@aa_french': 1}","{'M.Macron': 2, 'E.Macron': 1, 'Président français': 2, 'Besoin de l’Algérie': 1, 'Tdah PSG': 1, 'BRICS': 2, 'AGENCY': 1}","{'Emmanuel Macron': 3, 'Nicolas Maduro': 2, 'Abdelmadjid Tebboune': 2, '#Macron': 1, '#tebboune': 1, 'Fred Marseille': 1, 'président de l’': 1, 'Ce Président': 1, 'Tebboune': 2, 'Macron': 3, 'Président': 1, 'algérien""C’': 1, 'Algérien Tebboune': 1, '#macron': 1, '𝐑𝐒': 1}",2022,11,7
1667862000,https://fr.sputniknews.africa/20221108/ankara-et-moscou-commencent-et-vont-intensifier-les-paiements-en-monnaies-nationales-1056756927.html,Ankara et Moscou commencent et vont intensifier les paiements en monnaies nationales,"La Turquie et la Russie sont parvenues à un consensus sur les transactions libellées en monnaies nationales, notamment dans le domaine énergétique, selon le ministre turc de l’Énergie et des Ressources naturelles.","Après être parvenues à un consensus, la Turquie et la Russie ont déjà entamé les paiements en monnaies nationales, et ils seront plus intenses dans les mois à venir, a annoncé le ministre turc de l’Énergie et des Ressources naturelles Fatih Donmez.""Notre commerce avec la Russie se poursuit dans de nombreux domaines. L'énergie est sans aucun doute une catégorie de dépenses des plus importantes. Mais il y a aussi le tourisme, les denrées alimentaires et pas seulement. Depuis près de 5-6 ans, les deux dirigeants ont toujours exprimé leur intention d'ouvrir la voie aux échanges en monnaies nationales. La situation actuelle a fait accélérer un peu plus le processus. Lors de leur dernière réunion, il y a eu un accord [sur le paiement pour le gaz russe en roubles]. Cela nécessite, bien sûr, certains travaux techniques"", a indiqué le ministre dans un entretien à la chaîne de télévision TRT.Le ministre a confirmé que les paiements en roubles ont déjà commencé et qu’ils seront un peu plus intenses dans les mois à venir.""Il y a un consensus sur cette question des deux côtés. Il va de soi que les transactions en monnaies nationales réduiront également le besoin des pays pour d'autres devises"".25% des livraisons de gaz payés en roublesAprès s’être entretenu avec Recep Tayyip Erdogan le 16 septembre en marge du sommet de l’Organisation de coopération de Shanghai, Vladimir Poutine a déclaré que tous deux étaient tombés d’accord pour qu’Ankara paie en roubles 25% des livraisons de gaz russe.Quelques jours plus tard, Fatih Donmez a fait savoir que l’accord sur le paiement des 25% de livraisons russes en roubles entrerait en vigueur dans un proche avenir.Le 6 octobre, le vice-Premier ministre russe Alexandre Novak a annoncé que la Russie et la Turquie avaient procédé au règlement en roubles d’une part des livraisons de gaz russe.","[[['Après être parvenues à un consensus, la Turquie et la Russie ont déjà entamé les paiements en monnaies nationales, et ils seront plus intenses dans les mois à venir, a annoncé le ministre turc de l’Énergie et des Ressources naturelles Fatih Donmez.', '""Notre commerce avec la Russie se poursuit dans de nombreux domaines.', ""L'énergie est sans aucun doute une catégorie de dépenses des plus importantes."", 'Mais il y a aussi le tourisme, les denrées alimentaires et pas seulement.', ""Depuis près de 5-6 ans, les deux dirigeants ont toujours exprimé leur intention d'ouvrir la voie aux échanges en monnaies nationales."", 'La situation actuelle a fait accélérer un peu plus le processus.', 'Lors de leur dernière réunion, il y a eu un accord [sur le paiement pour le gaz russe en roubles].', 'Cela nécessite, bien sûr, certains travaux techniques"", a indiqué le ministre dans un entretien à la chaîne de télévision TRT.Le ministre a confirmé que les paiements en roubles ont déjà commencé et qu’ils seront un peu plus intenses dans les mois à venir.', '""Il y a un consensus sur cette question des deux côtés.', 'Il va de soi que les transactions en monnaies nationales réduiront également le besoin des pays pour d\'autres devises"".25% des livraisons de gaz payés en roublesAprès s’être entretenu avec Recep Tayyip Erdogan le 16 septembre en marge du sommet de l’Organisation de coopération de Shanghai, Vladimir Poutine a déclaré que tous deux étaient tombés d’accord pour qu’Ankara paie en roubles 25% des livraisons de gaz russe.Quelques jours plus tard, Fatih Donmez a fait savoir que l’accord sur le paiement des 25% de livraisons russes en roubles entrerait en vigueur dans un proche avenir.Le 6 octobre, le vice-Premier ministre russe Alexandre Novak a annoncé que la Russie et la Turquie avaient procédé au règlement en roubles d’une part des livraisons de gaz russe.']]]","[[['consensus', 'turquie', 'russie', 'paiement', 'monnaie', 'national', 'intense', 'mois', 'ministre', 'turc', 'énergie', 'ressource', 'naturel', 'fatih'], ['commerce', 'russie', 'domaine'], ['énergie', 'doute', 'catégorie', 'dépense', 'important'], ['tourisme', 'denrée', 'alimentaire'], ['an', 'dirigeant', 'intention', 'voie', 'échange', 'monnaie', 'national'], ['situation', 'actuel', 'processus'], ['dernier', 'réunion', 'accord', 'paiement', 'gaz', 'russe'], ['sûr', 'travail', 'technique', 'ministre', 'entretien', 'chaîne', 'télévision', 'ministre', 'paiement', 'rouble', 'intense', 'mois'], ['consensus', 'question', 'côté'], ['transaction', 'monnaie', 'national', 'besoin', 'pays', 'livraison', 'gaz', 'roublesaprè', 'recep', 'erdogan', 'septembre', 'marge', 'sommet', 'organisation', 'coopération', 'shanghai', 'vladimir', 'poutine', 'accord', 'ankara', 'rouble', 'livraison', 'gaz', 'jour', 'accord', 'paiement', 'livraison', 'russe', 'rouble', 'vigueur', 'octobre', 'ministre', 'russe', 'alexandre', 'novak', 'russie', 'turquie', 'règlement', 'rouble', 'part', 'livraison', 'gaz', 'russe']]]","[[['Turquie', 'Russie'], ['Russie'], [], [], [], [], [], [], [], ['Ankara', 'Russie', 'Turquie']]]","[[['Énergie et des Ressources naturelles Fatih Donmez'], [], [], [], [], [], [], [], [], ['Organisation de coopération de Shanghai']]]","[[[], [], [], [], [], [], [], ['TRT.Le'], [], ['Recep Tayyip Erdogan', 'Vladimir Poutine', 'Fatih Donmez', 'Alexandre Novak']]]","{'consensus': 2, 'turquie': 2, 'russie': 3, 'paiement': 4, 'monnaie': 3, 'national': 3, 'intense': 2, 'mois': 2, 'ministre': 4, 'turc': 1, 'énergie': 2, 'ressource': 1, 'naturel': 1, 'fatih': 1, 'commerce': 1, 'domaine': 1, 'doute': 1, 'catégorie': 1, 'dépense': 1, 'important': 1, 'tourisme': 1, 'denrée': 1, 'alimentaire': 1, 'an': 1, 'dirigeant': 1, 'intention': 1, 'voie': 1, 'échange': 1, 'situation': 1, 'actuel': 1, 'processus': 1, 'dernier': 1, 'réunion': 1, 'accord': 3, 'gaz': 4, 'russe': 4, 'sûr': 1, 'travail': 1, 'technique': 1, 'entretien': 1, 'chaîne': 1, 'télévision': 1, 'rouble': 4, 'question': 1, 'côté': 1, 'transaction': 1, 'besoin': 1, 'pays': 1, 'livraison': 4, 'roublesaprè': 1, 'recep': 1, 'erdogan': 1, 'septembre': 1, 'marge': 1, 'sommet': 1, 'organisation': 1, 'coopération': 1, 'shanghai': 1, 'vladimir': 1, 'poutine': 1, 'ankara': 1, 'jour': 1, 'vigueur': 1, 'octobre': 1, 'alexandre': 1, 'novak': 1, 'règlement': 1, 'part': 1}","{'Turquie': 2, 'Russie': 3, 'Ankara': 1}","{'Énergie et des Ressources naturelles Fatih Donmez': 1, 'Organisation de coopération de Shanghai': 1}","{'TRT.Le': 1, 'Recep Tayyip Erdogan': 1, 'Vladimir Poutine': 1, 'Fatih Donmez': 1, 'Alexandre Novak': 1}",2022,11,7
