timestamp,url,title,description,content,content-segmented,kws-l,loc-l,org-l,per-l,kws,loc,org,per,year,month,day
1680904800,https://fr.sputniknews.africa/20230408/une-enseignante-francaise-au-maroc-viree-pour-propagande-de-lhomosexualite-1058441867.html,Une enseignante française au Maroc virée pour propagande de l’homosexualité,"Une enseignante travaillant au sein des établissements de la mission française à Kénitra, au Maroc, a été congédiée pour avoir présenté à ses élèves de moins de 10 ans des informations sur l’homosexualité, ""ce qui en fait une exploitation...","Tout a commencé à l’école Honoré de Balzac à Kénitra, qui fait partie des établissements de la mission française à l’étranger. Une enseignante y a présenté des informations sur l’homosexualité à ses élèves de moins de 10 ans.Outre cela elle ""diffusait des idées insultantes sur les personnalités et les symboles de l’islam qui affectent la croyance religieuse des enfants, et les appelle à accepter les conceptions à caractère homosexuel et à diffuser des perceptions faisant l’éloge des relations entre personnes du même sexe"", a déclaré à la presse locale Abderrahim Jamai, l’avocat des parents.Il a également informé que l’école avait renvoyé l’enseignante en question.Cette décision a été prise ""après que les responsables de l’établissement Balzac ont été convaincus de la gravité de l’affaire et de ses dangers et pour les élèves et pour la réputation de l’école elle-même"", indique-t-il dans un communiqué cité par Bladi.net.Un incident datant de décembre dernierL’affaire fait du bruit au Maroc depuis décembre dernier après que des parents d’élèves ont signalé l’incident à l’administration de l’école.Cette dernière restant indifférente, les parents se sont adressés aux autorités judiciaires de Kénitra début 2023.L’avocat a indiqué qu’aux yeux des parents, le comportement de l’enseignante était une ""agression grave contre les enfants, affectant leur identité culturelle, leur environnement sociétal et leur stabilité psychologique, en plus d’être des sujets qui ne conviennent pas à leur âge et ils sont incapables de discuter de ses significations, de comprendre ses dimensions ou d’exprimer une opinion à son sujet"".Le parquet a repris le dossier et a ouvert les procédures préliminaires.L'article 489 du code pénal du Maroc interdit ""les actes licencieux ou contre nature avec un individu du même sexe"". L’homosexualité est punie de six mois à trois ans d’emprisonnement et d’une amende allant jusqu’à 1.200 dirhams (environ 120 dollars).","[[['Tout a commencé à l’école Honoré de Balzac à Kénitra, qui fait partie des établissements de la mission française à l’étranger.'], ['Une enseignante y a présenté des informations sur l’homosexualité à ses élèves de moins de 10 ans.Outre cela elle ""diffusait des idées insultantes sur les personnalités et les symboles de l’islam qui affectent la croyance religieuse des enfants, et les appelle à accepter les conceptions à caractère homosexuel et à diffuser des perceptions faisant l’éloge des relations entre personnes du même sexe"", a déclaré à la presse locale Abderrahim Jamai, l’avocat des parents.Il a également informé que l’école avait renvoyé l’enseignante en question.Cette décision a été prise ""après que les responsables de l’établissement Balzac ont été convaincus de la gravité de l’affaire et de ses dangers et pour les élèves et pour la réputation de l’école elle-même"", indique-t-il dans un communiqué cité par Bladi.net.Un incident datant de décembre dernierL’affaire fait du bruit au Maroc depuis décembre dernier après que des parents d’élèves ont signalé l’incident à l’administration de l’école.Cette dernière restant indifférente, les parents se sont adressés aux autorités judiciaires de Kénitra début 2023.L’avocat a indiqué qu’aux yeux des parents, le comportement de l’enseignante était une ""agression grave contre les enfants, affectant leur identité culturelle, leur environnement sociétal et leur stabilité psychologique, en plus d’être des sujets qui ne conviennent pas à leur âge et ils sont incapables de discuter de ses significations, de comprendre ses dimensions ou d’exprimer une opinion à son sujet"".Le parquet a repris le dossier et a ouvert les procédures préliminaires.L\'article 489 du code pénal du Maroc interdit ""les actes licencieux ou contre nature avec un individu du même sexe"".'], ['L’homosexualité est punie de six mois à trois ans d’emprisonnement et d’une amende allant jusqu’à 1.200 dirhams (environ 120 dollars).']]]","[[['école', 'balzac', 'partie', 'établissements', 'mission', 'française', 'étranger'], ['enseignante', 'informations', 'homosexualité', 'élèves', 'idées', 'insultantes', 'personnalités', 'symboles', 'islam', 'croyance', 'religieuse', 'enfants', 'conceptions', 'caractère', 'homosexuel', 'perceptions', 'éloge', 'relations', 'personnes', 'sexe', 'presse', 'locale', 'jamai', 'avocat', 'école', 'enseignante', 'décision', 'responsables', 'établissement', 'balzac', 'gravité', 'affaire', 'dangers', 'élèves', 'réputation', 'école', 'communiqué', 'cité', 'incident', 'décembre', 'affaire', 'bruit', 'maroc', 'décembre', 'dernier', 'parents', 'élèves', 'incident', 'administration', 'dernière', 'indifférente', 'parents', 'autorités', 'judiciaires', 'début', 'avocat', 'yeux', 'parents', 'comportement', 'enseignante', 'agression', 'grave', 'enfants', 'identité', 'culturelle', 'environnement', 'sociétal', 'stabilité', 'psychologique', 'sujets', 'âge', 'incapables', 'significations', 'dimensions', 'opinion', 'parquet', 'dossier', 'procédures', 'article', 'code', 'pénal', 'maroc', 'actes', 'licencieux', 'nature', 'individu', 'sexe'], ['homosexualité', 'mois', 'ans', 'emprisonnement', 'amende', 'dirhams', 'dollars']]]","[[['Kénitra'], ['Maroc', 'Kénitra', 'Maroc'], []]]","[[[], [], []]]","[[['Honoré de Balzac'], ['Abderrahim Jamai', 'Balzac'], []]]","{'école': 3, 'balzac': 2, 'partie': 1, 'établissements': 1, 'mission': 1, 'française': 1, 'étranger': 1, 'enseignante': 3, 'informations': 1, 'homosexualité': 2, 'élèves': 3, 'idées': 1, 'insultantes': 1, 'personnalités': 1, 'symboles': 1, 'islam': 1, 'croyance': 1, 'religieuse': 1, 'enfants': 2, 'conceptions': 1, 'caractère': 1, 'homosexuel': 1, 'perceptions': 1, 'éloge': 1, 'relations': 1, 'personnes': 1, 'sexe': 2, 'presse': 1, 'locale': 1, 'jamai': 1, 'avocat': 2, 'décision': 1, 'responsables': 1, 'établissement': 1, 'gravité': 1, 'affaire': 2, 'dangers': 1, 'réputation': 1, 'communiqué': 1, 'cité': 1, 'incident': 2, 'décembre': 2, 'bruit': 1, 'maroc': 2, 'dernier': 1, 'parents': 3, 'administration': 1, 'dernière': 1, 'indifférente': 1, 'autorités': 1, 'judiciaires': 1, 'début': 1, 'yeux': 1, 'comportement': 1, 'agression': 1, 'grave': 1, 'identité': 1, 'culturelle': 1, 'environnement': 1, 'sociétal': 1, 'stabilité': 1, 'psychologique': 1, 'sujets': 1, 'âge': 1, 'incapables': 1, 'significations': 1, 'dimensions': 1, 'opinion': 1, 'parquet': 1, 'dossier': 1, 'procédures': 1, 'article': 1, 'code': 1, 'pénal': 1, 'actes': 1, 'licencieux': 1, 'nature': 1, 'individu': 1, 'mois': 1, 'ans': 1, 'emprisonnement': 1, 'amende': 1, 'dirhams': 1, 'dollars': 1}","{'Kénitra': 2, 'Maroc': 2}",{},"{'Honoré de Balzac': 1, 'Abderrahim Jamai': 1, 'Balzac': 1}",2023,4,7
1680904800,https://fr.sputniknews.africa/20230408/leurope-en-manque-dhydrocarbures-boostera-encore-la-croissance-algerienne-en-2023-1058441677.html,L’Europe en manque d’hydrocarbures boostera encore la croissance algérienne en 2023,"La croissance algérienne devrait un peu ralentir en 2023 mais sera toujours dans le vert, portée par la demande européenne en énergie, à en croire les prévisions de la Banque mondiale.","L’économie algérienne garde le sourire. Le pays des fennecs devrait connaître une croissance de 2% en 2023, à en croire les derniers calculs de la Banque mondiale (BM). La dynamique sera néanmoins moins marquée qu’en 2022, où le PIB avait augmenté de 3,1%.Le pays profite en particulier des craintes énergétiques européennes, les Vingt-Sept cherchant à diversifier leurs approvisionnements en hydrocarbure, après les sanctions prises contre la Russie.Plus généralement, c’est toute la région constituée du Moyen-Orient et de l’Afrique du Nord qui continuera d’être dans le vert, avec une croissance de 3% en 2023, puis de 3,1% en 2024. Un ralentissement devrait néanmoins s’opérer du côté des pays du Golfe, gros exportateurs de pétrole, à cause de la baisse attendue des prix de l’or noir. Les États membres du Conseil de coopération du Golfe (CCG) devraient ainsi voir leur croissance ralentir de 7,3% en 2022 à 3,2% en 2023, prévoit la Banque mondiale.Inflation et insécurité alimentaireL’organisme international met néanmoins en garde contre deux fléaux qui pourraient menacer les économies du Moyen-Orient et d’Afrique du Nord en 2023: l’inflation et l’insécurité alimentaire. La flambée des prix déjà constatée en 2022 devrait en effet continuer de sévir. L’inflation sur les produits alimentaires est particulièrement handicapante pour les pays à revenu faible ou intermédiaire. Le poids de l’alimentation pèse parfois plus de 25% dans l’indice des prix à la consommation ces pays.Conséquence directe: l’inflation sur la nourriture fait croître l’insécurité alimentaire. Dans la région, la part de population se trouvant en situation d’insécurité alimentaire à cause de l’inflation a augmenté de 66% depuis la période prépandémique, souligne la Banque mondiale.L’institution est particulièrement inquiète pour la santé des enfants. La flambée des prix de l’alimentaire pousse en effet les populations à se rabattre sur des produits moins nutritifs, favorisant les retards de croissance des plus jeunes. L’obésité et la dénutrition infantiles pèsent déjà lourd dans la zone regroupant Moyen-Orient et Afrique du Nord.La Banque mondiale pointe d’ailleurs directement du doigt la situation en Ukraine, estimant que ""la hausse des prix alimentaires liée au conflit pourrait avoir augmenté de 17 à 24% le risque de retard de croissance"".Le conflit ukrainien a en particulier bouleversé les exportations céréalières, dont Kiev et Moscou sont les champions. Les accords d’Istanbul, signés en juillet, devaient mettre fin à ces difficultés, mais l’Occident continue de leur mettre des bâtons dans les roues, à travers des restrictions sur l’affrètement des navires ou les systèmes d’assurances.La Russie a d’ailleurs récemment fait part de son agacement et n’exclut pas mettre un terme aux accords, si toutes les conditions ne sont pas respectées.","[[['L’économie algérienne garde le sourire.'], ['Le pays des fennecs devrait connaître une croissance de 2% en 2023, à en croire les derniers calculs de la Banque mondiale (BM).'], ['La dynamique sera néanmoins moins marquée qu’en 2022, où le PIB avait augmenté de 3,1%.Le pays profite en particulier des craintes énergétiques européennes, les Vingt-Sept cherchant à diversifier leurs approvisionnements en hydrocarbure, après les sanctions prises contre la Russie.Plus généralement, c’est toute la région constituée du Moyen-Orient et de l’Afrique du Nord\u2009qui continuera d’être dans le vert, avec une croissance de 3% en 2023, puis de 3,1% en 2024.'], ['Un ralentissement devrait néanmoins s’opérer du côté des pays du Golfe, gros exportateurs de pétrole, à cause de la baisse attendue des prix de l’or noir.'], ['Les États membres du Conseil de coopération du Golfe (CCG) devraient ainsi voir leur croissance ralentir de 7,3% en 2022 à 3,2% en 2023, prévoit la Banque mondiale.Inflation et insécurité alimentaireL’organisme international met néanmoins en garde contre deux fléaux qui pourraient menacer les économies du Moyen-Orient et d’Afrique du Nord en 2023: l’inflation et l’insécurité alimentaire.'], ['La flambée des prix déjà constatée en 2022 devrait en effet continuer de sévir.'], ['L’inflation sur les produits alimentaires est particulièrement handicapante pour les pays à revenu faible ou intermédiaire.'], ['Le poids de l’alimentation pèse parfois plus de 25% dans l’indice des prix à la consommation ces pays.Conséquence directe: l’inflation sur la nourriture fait croître l’insécurité alimentaire.'], ['Dans la région, la part de population se trouvant en situation d’insécurité alimentaire à cause de l’inflation a augmenté de 66% depuis la période prépandémique, souligne la Banque mondiale.L’institution est particulièrement inquiète pour la santé des enfants.'], ['La flambée des prix de l’alimentaire pousse en effet les populations à se rabattre sur des produits moins nutritifs, favorisant les retards de croissance des plus jeunes.'], ['L’obésité et la dénutrition infantiles pèsent déjà lourd dans la zone regroupant Moyen-Orient et Afrique du Nord.La Banque mondiale pointe d’ailleurs directement du doigt la situation en Ukraine, estimant que ""la hausse des prix alimentaires liée au conflit pourrait avoir augmenté de 17 à 24% le risque de retard de croissance"".Le conflit ukrainien a en particulier bouleversé les exportations céréalières, dont Kiev et Moscou sont les champions.'], ['Les accords d’Istanbul, signés en juillet, devaient mettre fin à ces difficultés, mais l’Occident continue de leur mettre des bâtons dans les roues, à travers des restrictions sur l’affrètement des navires ou les systèmes d’assurances.La Russie a d’ailleurs récemment fait part de son agacement et n’exclut pas mettre un terme aux accords, si toutes les conditions ne sont pas respectées.']]]","[[['économie', 'algérienne', 'sourire'], ['pays', 'fennecs', 'croissance', 'derniers', 'calculs', 'banque', 'mondiale'], ['dynamique', 'pib', 'pays', 'particulier', 'craintes', 'énergétiques', 'européennes', 'approvisionnements', 'hydrocarbure', 'sanctions', 'région', 'afrique', 'nord', 'vert', 'croissance'], ['ralentissement', 'côté', 'pays', 'golfe', 'gros', 'exportateurs', 'pétrole', 'cause', 'baisse', 'prix', 'noir'], ['états', 'membres', 'conseil', 'coopération', 'golfe', 'ccg', 'croissance', 'banque', 'insécurité', 'organisme', 'international', 'garde', 'fléaux', 'économies', 'afrique', 'nord', 'inflation', 'insécurité', 'alimentaire'], ['flambée', 'prix'], ['inflation', 'produits', 'alimentaires', 'handicapante', 'pays', 'revenu', 'faible', 'intermédiaire'], ['poids', 'alimentation', 'indice', 'prix', 'consommation', 'inflation', 'nourriture', 'insécurité', 'alimentaire'], ['région', 'part', 'population', 'situation', 'insécurité', 'alimentaire', 'cause', 'inflation', 'période', 'prépandémique', 'banque', 'institution', 'inquiète', 'santé', 'enfants'], ['flambée', 'prix', 'alimentaire', 'populations', 'produits', 'nutritifs', 'retards', 'croissance', 'jeunes'], ['obésité', 'dénutrition', 'infantiles', 'lourd', 'zone', 'afrique', 'banque', 'mondiale', 'pointe', 'doigt', 'situation', 'ukraine', 'hausse', 'prix', 'alimentaires', 'conflit', 'risque', 'retard', 'conflit', 'ukrainien', 'particulier', 'exportations', 'céréalières', 'kiev', 'moscou', 'champions'], ['accords', 'istanbul', 'juillet', 'fin', 'difficultés', 'occident', 'bâtons', 'roues', 'travers', 'restrictions', 'affrètement', 'navires', 'systèmes', 'russie', 'part', 'agacement', 'terme', 'accords', 'conditions']]]","[[[], [], ['Russie', 'Moyen-Orient', 'Afrique du Nord'], ['pays du Golfe'], ['États', 'Moyen-Orient', 'Afrique du Nord'], [], [], [], [], [], ['Moyen-Orient', 'Afrique du Nord', 'Ukraine', 'Kiev', 'Moscou'], ['Occident', 'Russie']]]","[[[], ['Banque mondiale', 'BM'], ['Vingt-Sept'], [], ['Conseil de coopération du Golfe', 'CCG', 'Banque mondiale'], [], [], [], ['Banque mondiale'], [], ['Banque mondiale'], []]]","[[[], [], [], [], [], [], [], [], [], [], [], []]]","{'économie': 1, 'algérienne': 1, 'sourire': 1, 'pays': 4, 'fennecs': 1, 'croissance': 4, 'derniers': 1, 'calculs': 1, 'banque': 4, 'mondiale': 2, 'dynamique': 1, 'pib': 1, 'particulier': 2, 'craintes': 1, 'énergétiques': 1, 'européennes': 1, 'approvisionnements': 1, 'hydrocarbure': 1, 'sanctions': 1, 'région': 2, 'afrique': 3, 'nord': 2, 'vert': 1, 'ralentissement': 1, 'côté': 1, 'golfe': 2, 'gros': 1, 'exportateurs': 1, 'pétrole': 1, 'cause': 2, 'baisse': 1, 'prix': 5, 'noir': 1, 'états': 1, 'membres': 1, 'conseil': 1, 'coopération': 1, 'ccg': 1, 'insécurité': 4, 'organisme': 1, 'international': 1, 'garde': 1, 'fléaux': 1, 'économies': 1, 'inflation': 4, 'alimentaire': 4, 'flambée': 2, 'produits': 2, 'alimentaires': 2, 'handicapante': 1, 'revenu': 1, 'faible': 1, 'intermédiaire': 1, 'poids': 1, 'alimentation': 1, 'indice': 1, 'consommation': 1, 'nourriture': 1, 'part': 2, 'population': 1, 'situation': 2, 'période': 1, 'prépandémique': 1, 'institution': 1, 'inquiète': 1, 'santé': 1, 'enfants': 1, 'populations': 1, 'nutritifs': 1, 'retards': 1, 'jeunes': 1, 'obésité': 1, 'dénutrition': 1, 'infantiles': 1, 'lourd': 1, 'zone': 1, 'pointe': 1, 'doigt': 1, 'ukraine': 1, 'hausse': 1, 'conflit': 2, 'risque': 1, 'retard': 1, 'ukrainien': 1, 'exportations': 1, 'céréalières': 1, 'kiev': 1, 'moscou': 1, 'champions': 1, 'accords': 2, 'istanbul': 1, 'juillet': 1, 'fin': 1, 'difficultés': 1, 'occident': 1, 'bâtons': 1, 'roues': 1, 'travers': 1, 'restrictions': 1, 'affrètement': 1, 'navires': 1, 'systèmes': 1, 'russie': 1, 'agacement': 1, 'terme': 1, 'conditions': 1}","{'Russie': 2, 'Moyen-Orient': 3, 'Afrique du Nord': 3, 'pays du Golfe': 1, 'États': 1, 'Ukraine': 1, 'Kiev': 1, 'Moscou': 1, 'Occident': 1}","{'Banque mondiale': 4, 'BM': 1, 'Vingt-Sept': 1, 'Conseil de coopération du Golfe': 1, 'CCG': 1}",{},2023,4,7
1680904800,https://fr.sputniknews.africa/20230408/la-russie-fournira-a-legypte-600000-tonnes-supplementaires-de-ble-1058441549.html,La Russie fournira à l'Égypte 600.000 tonnes supplémentaires de blé,L'Égypte importera 600.000 tonnes de blé russe à deux reprises en mai à la suite d'un appel d'offres international. Ce pays est le plus grand acheteur de blé au monde. Les importations de Russie ont doublé durant les derniers mois de 2022.,"L'Autorité générale pour l'approvisionnement en produits de base, l'acheteur de céréales de l'État égyptien, a déclaré jeudi avoir acheté 600.000 tonnes de blé russe dans le cadre d'un appel d'offres, relate Reuters.De ce lot, 300.000 tonnes devront être expédiées du 10 au 20 mai et 300.000 autres du 21 au 31 mai.La Russie est le plus grand fournisseur étranger du marché égyptien du blé, ayant fourni près de 5 millions de tonnes au cours de la campagne de commercialisation 2020-21, selon le portail World Grain. Le plus grand importateurLes importations de blé de l'Égypte au cours de la campagne de commercialisation 2023-24 devraient augmenter de 3%, pour atteindre 10,8 millions de tonnes, selon un rapport du Département de l’Agriculture des États-Unis (USDA).Au début de l'année, Elena Tiourina, directrice du département d'analyse de l'Union céréalière russe, a fait savoir que les livraisons avaient doublé durant les derniers mois de l’année 2022, s'élevant à 963.000 tonnes. En janvier, l'Égypte est devenue le leader des importations de blé de Russie.Un fret contenant 100.000 tonnes de blé russe a été acheminé à la mi-mars jusqu’à Damiette. Il s'agit d'un chiffre record enregistré dans ce port depuis la fondation du port en 1986.","[[[""L'Autorité générale pour l'approvisionnement en produits de base, l'acheteur de céréales de l'État égyptien, a déclaré jeudi avoir acheté 600.000 tonnes de blé russe dans le cadre d'un appel d'offres, relate Reuters.De ce lot, 300.000 tonnes devront être expédiées du 10 au 20 mai et 300.000 autres du 21 au 31 mai.La Russie est le plus grand fournisseur étranger du marché égyptien du blé, ayant fourni près de 5 millions de tonnes au cours de la campagne de commercialisation 2020-21, selon le portail World Grain.""], [""Le plus grand importateurLes importations de blé de l'Égypte au cours de la campagne de commercialisation 2023-24 devraient augmenter de 3%, pour atteindre 10,8 millions de tonnes, selon un rapport du Département de l’Agriculture des États-Unis (USDA).Au début de l'année, Elena Tiourina, directrice du département d'analyse de l'Union céréalière russe, a fait savoir que les livraisons avaient doublé durant les derniers mois de l’année 2022, s'élevant à 963.000 tonnes.""], [""En janvier, l'Égypte est devenue le leader des importations de blé de Russie.Un fret contenant 100.000 tonnes de blé russe a été acheminé à la mi-mars jusqu’à Damiette.""], [""Il s'agit d'un chiffre record enregistré dans ce port depuis la fondation du port en 1986.""]]]","[[['autorité', 'générale', 'approvisionnement', 'produits', 'base', 'acheteur', 'céréales', 'état', 'égyptien', 'jeudi', 'tonnes', 'blé', 'russe', 'cadre', 'appel', 'offres', 'lot', 'tonnes', 'mai', 'russie', 'grand', 'fournisseur', 'étranger', 'marché', 'égyptien', 'blé', 'millions', 'tonnes', 'cours', 'campagne', 'commercialisation', 'portail', 'world', 'grain'], ['grand', 'importateurles', 'importations', 'blé', 'égypte', 'cours', 'campagne', 'commercialisation', 'millions', 'tonnes', 'rapport', 'département', 'agriculture', 'début', 'année', 'elena', 'tiourina', 'directrice', 'département', 'analyse', 'union', 'céréalière', 'russe', 'livraisons', 'derniers', 'mois', 'année', 'tonnes'], ['janvier', 'égypte', 'leader', 'importations', 'blé', 'fret', 'tonnes', 'blé', 'russe', 'damiette'], ['chiffre', 'record', 'port', 'fondation', 'port']]]","[[['État égyptien', 'Russie'], ['importateurLes', 'Égypte'], ['Égypte', 'Russie', 'Damiette'], []]]","[[[""Autorité générale pour l'approvisionnement"", 'Reuters'], ['Département de l’Agriculture des États-Unis', 'USDA).Au', 'Union céréalière russe'], [], []]]","[[[], ['Elena Tiourina'], [], []]]","{'autorité': 1, 'générale': 1, 'approvisionnement': 1, 'produits': 1, 'base': 1, 'acheteur': 1, 'céréales': 1, 'état': 1, 'égyptien': 2, 'jeudi': 1, 'tonnes': 6, 'blé': 5, 'russe': 3, 'cadre': 1, 'appel': 1, 'offres': 1, 'lot': 1, 'mai': 1, 'russie': 1, 'grand': 2, 'fournisseur': 1, 'étranger': 1, 'marché': 1, 'millions': 2, 'cours': 2, 'campagne': 2, 'commercialisation': 2, 'portail': 1, 'world': 1, 'grain': 1, 'importateurles': 1, 'importations': 2, 'égypte': 2, 'rapport': 1, 'département': 2, 'agriculture': 1, 'début': 1, 'année': 2, 'elena': 1, 'tiourina': 1, 'directrice': 1, 'analyse': 1, 'union': 1, 'céréalière': 1, 'livraisons': 1, 'derniers': 1, 'mois': 1, 'janvier': 1, 'leader': 1, 'fret': 1, 'damiette': 1, 'chiffre': 1, 'record': 1, 'port': 2, 'fondation': 1}","{'État égyptien': 1, 'Russie': 2, 'importateurLes': 1, 'Égypte': 2, 'Damiette': 1}","{""Autorité générale pour l'approvisionnement"": 1, 'Reuters': 1, 'Département de l’Agriculture des États-Unis': 1, 'USDA).Au': 1, 'Union céréalière russe': 1}",{'Elena Tiourina': 1},2023,4,7
