timestamp,url,title,description,content,content-segmented,kws-l,loc-l,org-l,per-l,kws,loc,org,per,year,month,day
1676242800,https://fr.sputniknews.africa/20230213/des-mercenaires-au-mali-vetus-duniformes-francais-marvel-rend-paris-furieux-1057906295.html,Des mercenaires au Mali vêtus d’uniformes français: Marvel rend Paris furieux,"""Quand les méchants sont arabes ou russes, c’est du cinéma, quand ils sont français, c’est de la propagande"". La twittosphère ironise sur les propos du ministre français des Armées qui a condamné ""fermement"" la ""représentation trompeuse""...","Le ministre français des Armées Sébastien Lecornu a critiqué la représentation négative des militaires français dans le film ""Black Panther: Wakanda Forever"" de Marvel. Qualifiée par lui de ""trompeuse"", elle ne l’est guère, selon la femme politique Nathalie Yamb. Réagissant à la publication de Sébastien Lecornu, elle a estimé que ""le monde entier sait que vous êtes des voleurs et des déstabilisateurs"". Et d’ajouter qu’""au lieu du renseignement et de l’appui aérien souhaité, vous avez imposé des troupes au sol"".Parmi les voix satiriques qui ont tourné en dérision la publication de Lecornu, l'une d'entre elles a pointé l’approche sélective de la France sur ce sujet:""Quand les méchants sont arabes ou russes, c’est du cinéma, quand ils sont français, c’est de la propagande.""Le ministre français des Armées Sébastien Lecornu a critiqué la représentation négative des militaires français dans le film ""Black Panther: Wakanda Forever"" de Marvel.Sorti il y a quatre mois, ce film fantastique n’attire l’attention de Paris que maintenant suite à une série de publications du journaliste Jean Bexon. Regrettant l’absence de médiatisation, il a jugé qu’il s’agissait d’""une attaque informationnelle grave qui décrédibilise la présence militaire française au Mali"".Dans ce film, les ""mauvais mercenaires"", agissant au Mali selon l’intrigue, sont habillés comme des militaires français ayant participé à l'opération antiterroriste Barkhane. Celle qu’a arrêtée Emmanuel Macron il y a plus d’un an.Vers un ""boycott diplomatique du Wakanda""?Cette réaction de Sébastien Lecornu a été jugée tardive par plusieurs internautes, qui ont rappelé la date de sortie du film. 4 mois de retard. C'est drôle quand même. pic.twitter.com/P2oVq7DrEP— Fabrice Epelboin (@epelboin) February 12, 2023 Tu va faire quoi concrètement ?Appeler au boycott diplomatique du Wakanda ?— Vilain Syndicaliste (@MarxFanAccount) February 12, 2023 ""En tant que ministre des Armées, vous avez des choses bien plus importantes à régler que de twitter des bêtises pareilles"", a écrit l’un d’entre eux.D’autres ont tenu à rappeler, sur un ton ironique, qu’il s’agissait d’une œuvre fantastique. Sébastien on respire, on est Charlie.— Chef Bé (@chef_b_976) February 12, 2023 Je suis obligé d’intervenir sur un truc, t’es pas du tout au courant que le Wakanda est un pays imaginaire ?? pic.twitter.com/0zbzm9S9bZ— Alkor (@Alkor_yt) February 12, 2023 Paris ne souhaite tolérer aucun ""révisionnisme""Pourtant, le ministère français des Armées a déclaré à l'AFP qu’il s’agit d'une ""œuvre artistique"" dont la France ne réclame ni le retrait, ni la censure.En outre, toujours auprès de la même source, l’entourage de Sébastien Lecornu a souligné ""la colère du ministre en voyant le film"", alors que Paris accuse régulièrement la Russie de mener une guerre informationnelle et de manipuler l’image de la France dans la région.""Il ne saurait y avoir de révisionnisme sur l'action récente de la France au Mali: nous sommes intervenus à la demande du pays pour lutter contre les groupes armés terroristes loin de l'histoire racontée dans le film, à savoir une armée française qui vient piller ses ressources naturelles"", a ajouté le ministère.Un peu de ""zénitude"" s’impose pour d’autres utilisateurs de Twitter:""Sébastien on respire, on est Charlie"". Bravo pour cette position ferme face au Wakanda !— StructuresMinimalistes (@Minimaliste13) February 12, 2023","[[['Le ministre français des Armées Sébastien Lecornu a critiqué la représentation négative des militaires français dans le film ""Black Panther: Wakanda Forever"" de Marvel.'], ['Qualifiée par lui de ""trompeuse"", elle ne l’est guère, selon la femme politique Nathalie Yamb.'], ['Réagissant à la publication de Sébastien Lecornu, elle a estimé que ""le monde entier sait que vous êtes des voleurs et des déstabilisateurs"".'], ['Et d’ajouter qu’""au lieu du renseignement et de l’appui aérien souhaité, vous avez imposé des troupes au sol"".Parmi les voix satiriques qui ont tourné en dérision la publication de Lecornu, l\'une d\'entre elles a pointé l’approche sélective de la France sur ce sujet:""Quand les méchants sont arabes ou russes, c’est du cinéma, quand ils sont français, c’est de la propagande.'], ['""Le ministre français des Armées Sébastien Lecornu a critiqué la représentation négative des militaires français dans le film ""Black Panther: Wakanda Forever"" de Marvel.Sorti il y a quatre mois, ce film fantastique n’attire l’attention de Paris que maintenant suite à une série de publications du journaliste Jean Bexon.'], ['Regrettant l’absence de médiatisation, il a jugé qu’il s’agissait d’""une attaque informationnelle grave qui décrédibilise la présence militaire française au Mali"".Dans ce film, les ""mauvais mercenaires"", agissant au Mali selon l’intrigue, sont habillés comme des militaires français ayant participé à l\'opération antiterroriste Barkhane.'], ['Celle qu’a arrêtée Emmanuel Macron il y a plus d’un an.Vers un ""boycott diplomatique du Wakanda""?Cette réaction de Sébastien Lecornu a été jugée tardive par plusieurs internautes, qui ont rappelé la date de sortie du film.'], ['4 mois de retard.'], [""C'est drôle quand même.""], ['pic.twitter.com/P2oVq7DrEP— Fabrice Epelboin (@epelboin) February 12, 2023 Tu va faire quoi concrètement ?Appeler au boycott diplomatique du Wakanda ?— Vilain Syndicaliste (@MarxFanAccount) February 12, 2023 ""En tant que ministre des Armées, vous avez des choses bien plus importantes à régler que de twitter des bêtises pareilles"", a écrit l’un d’entre eux.D’autres ont tenu à rappeler, sur un ton ironique, qu’il s’agissait d’une œuvre fantastique.'], ['Sébastien on respire, on est Charlie.— Chef Bé (@chef_b_976) February 12, 2023 Je suis obligé d’intervenir sur un truc, t’es pas du tout au courant que le Wakanda est un pays imaginaire ?'], ['?'], ['pic.twitter.com/0zbzm9S9bZ— Alkor (@Alkor_yt) February 12, 2023 Paris ne souhaite tolérer aucun ""révisionnisme""Pourtant, le ministère français des Armées a déclaré à l\'AFP qu’il s’agit d\'une ""œuvre artistique"" dont la France ne réclame ni le retrait, ni la censure.En outre, toujours auprès de la même source, l’entourage de Sébastien Lecornu a souligné ""la colère du ministre en voyant le film"", alors que Paris accuse régulièrement la Russie de mener une guerre informationnelle et de manipuler l’image de la France dans la région.'], ['""Il ne saurait y avoir de révisionnisme sur l\'action récente de la France au Mali: nous sommes intervenus à la demande du pays pour lutter contre les groupes armés terroristes loin de l\'histoire racontée dans le film, à savoir une armée française qui vient piller ses ressources naturelles"", a ajouté le ministère.Un peu de ""zénitude"" s’impose pour d’autres utilisateurs de Twitter:""Sébastien on respire, on est Charlie"".'], ['Bravo pour cette position ferme face au Wakanda !— StructuresMinimalistes (@Minimaliste13) February 12, 2023']]]","[[['ministre', 'français', 'armées', 'sébastien', 'lecornu', 'représentation', 'négative', 'militaires', 'français', 'film', 'panther', 'marvel'], ['trompeuse', 'femme', 'politique', 'nathalie', 'yamb'], ['publication', 'sébastien', 'lecornu', 'monde', 'entier', 'voleurs', 'déstabilisateurs'], ['lieu', 'renseignement', 'appui', 'aérien', 'troupes', 'voix', 'satiriques', 'dérision', 'publication', 'lecornu', 'approche', 'sélective', 'france', 'méchants', 'arabes', 'russes', 'cinéma', 'français', 'propagande'], ['ministre', 'français', 'armées', 'sébastien', 'lecornu', 'représentation', 'négative', 'militaires', 'français', 'film', 'panther', 'mois', 'film', 'fantastique', 'attention', 'paris', 'suite', 'série', 'publications', 'journaliste', 'jean', 'bexon'], ['absence', 'médiatisation', 'attaque', 'informationnelle', 'grave', 'présence', 'militaire', 'française', 'film', 'mauvais', 'mercenaires', 'mali', 'intrigue', 'militaires', 'français', 'opération', 'antiterroriste', 'barkhane'], ['emmanuel', 'boycott', 'diplomatique', 'réaction', 'sébastien', 'lecornu', 'tardive', 'internautes', 'date', 'sortie', 'film'], ['mois', 'retard'], [], ['fabrice', 'february', 'boycott', 'diplomatique', 'wakanda', 'vilain', 'syndicaliste', 'february', 'ministre', 'armées', 'choses', 'importantes', 'bêtises', 'pareilles', 'ironique', 'œuvre', 'fantastique'], ['sébastien', 'chef', 'bé', 'february', 'truc', 'courant', 'wakanda', 'pays', 'imaginaire'], [], ['alkor', 'february', 'paris', 'ministère', 'français', 'armées', 'afp', 'œuvre', 'artistique', 'france', 'retrait', 'source', 'entourage', 'sébastien', 'lecornu', 'colère', 'ministre', 'film', 'paris', 'russie', 'guerre', 'informationnelle', 'image', 'france', 'région'], ['révisionnisme', 'action', 'récente', 'france', 'mali', 'demande', 'pays', 'groupes', 'armés', 'terroristes', 'histoire', 'film', 'armée', 'française', 'ressources', 'naturelles', 'zénitude', 'utilisateurs'], ['bravo', 'position', 'ferme', 'face', 'wakanda', 'february']]]","[[[], [], [], ['Lecornu', 'France', 'sujet:""Quand'], ['Paris'], ['Mali'], [], [], [], [], ['Wakanda'], [], ['Paris', 'France', 'Paris', 'Russie', 'France'], ['France', 'Mali'], []]]","[[['Armées Sébastien Lecornu', 'Marvel'], [], [], [], ['Armées Sébastien Lecornu', 'Marvel'], [], [], [], [], ['Armées'], [], [], ['Armées', 'AFP'], [], []]]","[[['Wakanda Forever'], ['Nathalie Yamb'], ['Sébastien Lecornu'], [], ['Wakanda Forever', 'Jean Bexon'], [], ['Emmanuel', 'Sébastien Lecornu'], [], [], ['Fabrice Epelboin', 'Vilain Syndicaliste'], ['Charlie.— Chef Bé'], [], ['Alkor', '@Alkor_yt', 'Sébastien Lecornu'], ['Twitter:""Sébastien'], ['Bravo', 'Wakanda']]]","{'ministre': 4, 'français': 7, 'armées': 4, 'sébastien': 6, 'lecornu': 6, 'représentation': 2, 'négative': 2, 'militaires': 3, 'film': 7, 'panther': 2, 'marvel': 1, 'trompeuse': 1, 'femme': 1, 'politique': 1, 'nathalie': 1, 'yamb': 1, 'publication': 2, 'monde': 1, 'entier': 1, 'voleurs': 1, 'déstabilisateurs': 1, 'lieu': 1, 'renseignement': 1, 'appui': 1, 'aérien': 1, 'troupes': 1, 'voix': 1, 'satiriques': 1, 'dérision': 1, 'approche': 1, 'sélective': 1, 'france': 4, 'méchants': 1, 'arabes': 1, 'russes': 1, 'cinéma': 1, 'propagande': 1, 'mois': 2, 'fantastique': 2, 'attention': 1, 'paris': 3, 'suite': 1, 'série': 1, 'publications': 1, 'journaliste': 1, 'jean': 1, 'bexon': 1, 'absence': 1, 'médiatisation': 1, 'attaque': 1, 'informationnelle': 2, 'grave': 1, 'présence': 1, 'militaire': 1, 'française': 2, 'mauvais': 1, 'mercenaires': 1, 'mali': 2, 'intrigue': 1, 'opération': 1, 'antiterroriste': 1, 'barkhane': 1, 'emmanuel': 1, 'boycott': 2, 'diplomatique': 2, 'réaction': 1, 'tardive': 1, 'internautes': 1, 'date': 1, 'sortie': 1, 'retard': 1, 'fabrice': 1, 'february': 5, 'wakanda': 3, 'vilain': 1, 'syndicaliste': 1, 'choses': 1, 'importantes': 1, 'bêtises': 1, 'pareilles': 1, 'ironique': 1, 'œuvre': 2, 'chef': 1, 'bé': 1, 'truc': 1, 'courant': 1, 'pays': 2, 'imaginaire': 1, 'alkor': 1, 'ministère': 1, 'afp': 1, 'artistique': 1, 'retrait': 1, 'source': 1, 'entourage': 1, 'colère': 1, 'russie': 1, 'guerre': 1, 'image': 1, 'région': 1, 'révisionnisme': 1, 'action': 1, 'récente': 1, 'demande': 1, 'groupes': 1, 'armés': 1, 'terroristes': 1, 'histoire': 1, 'armée': 1, 'ressources': 1, 'naturelles': 1, 'zénitude': 1, 'utilisateurs': 1, 'bravo': 1, 'position': 1, 'ferme': 1, 'face': 1}","{'Lecornu': 1, 'France': 4, 'sujet:""Quand': 1, 'Paris': 3, 'Mali': 2, 'Wakanda': 1, 'Russie': 1}","{'Armées Sébastien Lecornu': 2, 'Marvel': 2, 'Armées': 2, 'AFP': 1}","{'Wakanda Forever': 2, 'Nathalie Yamb': 1, 'Sébastien Lecornu': 3, 'Jean Bexon': 1, 'Emmanuel': 1, 'Fabrice Epelboin': 1, 'Vilain Syndicaliste': 1, 'Charlie.— Chef Bé': 1, 'Alkor': 1, '@Alkor_yt': 1, 'Twitter:""Sébastien': 1, 'Bravo': 1, 'Wakanda': 1}",2023,2,12
1676242800,https://fr.sputniknews.africa/20230213/la-defense-russe-livre-des-details-sur-la-liberation-de-krasnaia-gora-dans-le-donbass-1057906090.html,La Défense russe livre des détails sur la libération de Krasnaïa Gora dans le Donbass,"Les forces russes ont pris le contrôle d’une autre localité dans le Donbass, celle de Krasnaïa Gora. Selon les détails fournis ce 13 février par la Défense russe, les pertes qu’a essuyées l'ennemi dans cette zone en 24h se sont élevées à...","Le ministère russe de la Défense a livré des détails sur la prise de contrôle d’une autre localité en République populaire de Donetsk, celle de Krasnaïa Gora. L’institution a précisé que cette libération avait été effectuée par ""les volontaires des détachements d'assaut, avec l'appui-feu des troupes de missiles et de l'artillerie du groupe de troupes ""Sud"""".Les pertes de l'ennemi en 24h se sont élevées à plus de 150 militaires ukrainiens. En outre, quatre véhicules blindés de combat, six camionnettes et deux obusiers D-30 ont été détruits, indique le communiqué du ministère de la Défense.Ville stratégiqueDepuis des semaines, l'armée russe est en train d’encercler la ville stratégique d’Artiomovsk (Bakhmout) en RPD, importante en raison de sa situation géographique et de sa position dans le système de défense ukrainien.","[[['Le ministère russe de la Défense a livré des détails sur la prise de contrôle d’une autre localité en République populaire de Donetsk, celle de Krasnaïa Gora.'], ['L’institution a précisé que cette libération avait été effectuée par ""les volontaires des détachements d\'assaut, avec l\'appui-feu des troupes de missiles et de l\'artillerie du groupe de troupes ""Sud"""".Les pertes de l\'ennemi en 24h se sont élevées à plus de 150 militaires ukrainiens.'], [""En outre, quatre véhicules blindés de combat, six camionnettes et deux obusiers D-30 ont été détruits, indique le communiqué du ministère de la Défense.Ville stratégiqueDepuis des semaines, l'armée russe est en train d’encercler la ville stratégique d’Artiomovsk (Bakhmout) en RPD, importante en raison de sa situation géographique et de sa position dans le système de défense ukrainien.""]]]","[[['ministère', 'russe', 'défense', 'détails', 'prise', 'contrôle', 'localité', 'république', 'populaire', 'donetsk', 'krasnaïa', 'gora'], ['institution', 'libération', 'volontaires', 'détachements', 'assaut', 'appui', 'feu', 'troupes', 'missiles', 'artillerie', 'groupe', 'troupes', 'pertes', 'ennemi', 'élevées', 'militaires', 'ukrainiens'], ['véhicules', 'blindés', 'combat', 'camionnettes', 'obusiers', 'communiqué', 'ministère', 'stratégiquedepuis', 'semaines', 'armée', 'russe', 'train', 'ville', 'stratégique', 'artiomovsk', 'bakhmout', 'rpd', 'importante', 'raison', 'situation', 'géographique', 'position', 'système', 'défense', 'ukrainien']]]","[[['République populaire de Donetsk', 'Krasnaïa Gora'], [], ['Ville', 'Artiomovsk', 'Bakhmout']]]","[[['ministère russe de la Défense'], [], ['ministère de la Défense']]]","[[[], ['Sud""""'], []]]","{'ministère': 2, 'russe': 2, 'défense': 2, 'détails': 1, 'prise': 1, 'contrôle': 1, 'localité': 1, 'république': 1, 'populaire': 1, 'donetsk': 1, 'krasnaïa': 1, 'gora': 1, 'institution': 1, 'libération': 1, 'volontaires': 1, 'détachements': 1, 'assaut': 1, 'appui': 1, 'feu': 1, 'troupes': 2, 'missiles': 1, 'artillerie': 1, 'groupe': 1, 'pertes': 1, 'ennemi': 1, 'élevées': 1, 'militaires': 1, 'ukrainiens': 1, 'véhicules': 1, 'blindés': 1, 'combat': 1, 'camionnettes': 1, 'obusiers': 1, 'communiqué': 1, 'stratégiquedepuis': 1, 'semaines': 1, 'armée': 1, 'train': 1, 'ville': 1, 'stratégique': 1, 'artiomovsk': 1, 'bakhmout': 1, 'rpd': 1, 'importante': 1, 'raison': 1, 'situation': 1, 'géographique': 1, 'position': 1, 'système': 1, 'ukrainien': 1}","{'République populaire de Donetsk': 1, 'Krasnaïa Gora': 1, 'Ville': 1, 'Artiomovsk': 1, 'Bakhmout': 1}","{'ministère russe de la Défense': 1, 'ministère de la Défense': 1}","{'Sud""""': 1}",2023,2,12
1676242800,https://fr.sputniknews.africa/20230213/des-ballons-americains-ont-viole-lespace-chinois-plus-de-10-fois-depuis-2022-dit-pekin-1057905893.html,"Des ballons américains ont violé l’espace chinois ""plus de 10 fois"" depuis 2022, dit Pékin","La Chine a déclaré que, depuis 2022, des ballons américains ont violé son espace aérien ""plus de 10 fois"" depuis 2022. Une déclaration qui intervient peu après que l’armée américaine a abattu un ballon chinois présenté comme un...","La Chine a accusé lundi des ballons américains d'avoir violé son espace aérien plus d'une dizaine de fois depuis début 2022, dans un contexte de tensions entre Pékin et Washington après le survol aux Etats-Unis d'un engin chinois. L'armée américaine a abattu début février un ballon chinois présenté par le Pentagone comme un ballon espion, destiné à récolter des informations sensibles. La destruction de l'appareil a été fermement dénoncée par la Chine, qui assure qu'il s'agissait d'un simple aérostat civil ayant dévié de sa trajectoire. Depuis cet incident, d'autres objets volants ont été aperçus au-dessus du Canada et des Etats-Unis, avant d'être abattus. La nature de ces engins et leur appartenance n'est pour l'heure pas connue.Des ballons américains dans le ciel chinoisInterrogé sur ces questions, Pékin a assuré lundi que des ballons américains avaient violé son espace aérien. ""Rien que depuis l'année dernière, des ballons américains ont survolé (le territoire de) la Chine à plus de dix reprises sans aucune autorisation"", a indiqué devant la presse un porte-parole de la diplomatie chinoise, Wang Wenbin. Il n'a pas donné de détails sur ces incidents, invitant les journalistes à se ""référer à la partie américaine"". Il a toutefois assuré que ces incursions avaient été gérées par Pékin de manière ""responsable et professionnelle"".","[[[""La Chine a accusé lundi des ballons américains d'avoir violé son espace aérien plus d'une dizaine de fois depuis début 2022, dans un contexte de tensions entre Pékin et Washington après le survol aux Etats-Unis d'un engin chinois.""], [""L'armée américaine a abattu début février un ballon chinois présenté par le Pentagone comme un ballon espion, destiné à récolter des informations sensibles.""], [""La destruction de l'appareil a été fermement dénoncée par la Chine, qui assure qu'il s'agissait d'un simple aérostat civil ayant dévié de sa trajectoire.""], [""Depuis cet incident, d'autres objets volants ont été aperçus au-dessus du Canada et des Etats-Unis, avant d'être abattus.""], [""La nature de ces engins et leur appartenance n'est pour l'heure pas connue.Des ballons américains dans le ciel chinoisInterrogé sur ces questions, Pékin a assuré lundi que des ballons américains avaient violé son espace aérien.""], ['""Rien que depuis l\'année dernière, des ballons américains ont survolé (le territoire de) la Chine à plus de dix reprises sans aucune autorisation"", a indiqué devant la presse un porte-parole de la diplomatie chinoise, Wang Wenbin.'], ['Il n\'a pas donné de détails sur ces incidents, invitant les journalistes à se ""référer à la partie américaine"".'], ['Il a toutefois assuré que ces incursions avaient été gérées par Pékin de manière ""responsable et professionnelle"".']]]","[[['chine', 'lundi', 'ballons', 'américains', 'espace', 'aérien', 'dizaine', 'fois', 'début', 'contexte', 'tensions', 'pékin', 'washington', 'survol', 'engin', 'chinois'], ['armée', 'américaine', 'début', 'février', 'ballon', 'chinois', 'pentagone', 'ballon', 'espion', 'informations', 'sensibles'], ['destruction', 'appareil', 'chine', 'simple', 'aérostat', 'civil', 'trajectoire'], ['incident', 'objets', 'volants', 'canada'], ['nature', 'engins', 'appartenance', 'heure', 'ballons', 'américains', 'ciel', 'chinoisinterrogé', 'questions', 'pékin', 'lundi', 'ballons', 'américains', 'espace', 'aérien'], ['année', 'dernière', 'ballons', 'américains', 'territoire', 'chine', 'reprises', 'autorisation', 'presse', 'diplomatie', 'chinoise', 'wang', 'wenbin'], ['détails', 'incidents', 'journalistes', 'partie', 'américaine'], ['incursions', 'pékin', 'manière', 'responsable', 'professionnelle']]]","[[['Chine', 'Pékin', 'Washington', 'Etats-Unis'], ['Pentagone'], ['Chine'], ['Canada', 'Etats-Unis'], ['Pékin'], [], [], ['Pékin']]]","[[[], [], [], [], [], [], [], []]]","[[[], [], [], [], [], ['Wang Wenbin'], [], []]]","{'chine': 3, 'lundi': 2, 'ballons': 4, 'américains': 4, 'espace': 2, 'aérien': 2, 'dizaine': 1, 'fois': 1, 'début': 2, 'contexte': 1, 'tensions': 1, 'pékin': 3, 'washington': 1, 'survol': 1, 'engin': 1, 'chinois': 2, 'armée': 1, 'américaine': 2, 'février': 1, 'ballon': 2, 'pentagone': 1, 'espion': 1, 'informations': 1, 'sensibles': 1, 'destruction': 1, 'appareil': 1, 'simple': 1, 'aérostat': 1, 'civil': 1, 'trajectoire': 1, 'incident': 1, 'objets': 1, 'volants': 1, 'canada': 1, 'nature': 1, 'engins': 1, 'appartenance': 1, 'heure': 1, 'ciel': 1, 'chinoisinterrogé': 1, 'questions': 1, 'année': 1, 'dernière': 1, 'territoire': 1, 'reprises': 1, 'autorisation': 1, 'presse': 1, 'diplomatie': 1, 'chinoise': 1, 'wang': 1, 'wenbin': 1, 'détails': 1, 'incidents': 1, 'journalistes': 1, 'partie': 1, 'incursions': 1, 'manière': 1, 'responsable': 1, 'professionnelle': 1}","{'Chine': 2, 'Pékin': 3, 'Washington': 1, 'Etats-Unis': 2, 'Pentagone': 1, 'Canada': 1}",{},{'Wang Wenbin': 1},2023,2,12
