timestamp,url,title,description,content,content-segmented,kws-l,loc-l,org-l,per-l,kws,loc,org,per,year,month,day
1677106800,https://fr.sputniknews.africa/20230223/defense-russe-kiev-se-prepare-a-une-invasion-dans-la-transnistrie-1058004462.html,Défense russe: Kiev prépare une invasion dans la Transnistrie,"L'Ukraine a commencé à se préparer à une invasion dans la Transnistrie, une république autoproclamée sur le territoire moldave où se trouvent des soldats de la paix russes, a annoncé le ministère russe de la Défense.","Moscou signale une concentration de troupes ukrainiennes à la frontière avec la Transnistrie, cela présente une menace pour les soldats de la paix russes déployés dans cette république autoproclamée sur le territoire moldave, a annoncé ce jeudi 23 février le ministère russe de la Défense.""Le régime de Kiev a intensifié ses préparatifs pour une invasion en Transnistrie. Cette action de l'armée ukrainienne se déroulera en réponse à une prétendue offensive des troupes russes depuis le territoire transnistrien"", a indiqué le ministère.Selon le ministère, l'armée ukrainienne déploie des pièces d'artillerie sur les positions de tir et masse des effectifs et des équipements militaires à la frontière. Des drones militaires ukrainiens ont intensifié leurs vols dans la région.""Les forces russes répondront de manière adéquate à la provocation imminente de la partie ukrainienne"", a ajouté le ministère de la Défense.Plus tôt dans la journée, le ministère a annoncé que Kiev préparait une provocation armée contre la Transnistrie. Selon la Défense, des membres du groupe nationaliste Azov* y seront également impliqués. Comme prétexte à l'invasion, l'Ukraine prévoit d'imiter une ""offensive des troupes russes"" depuis le territoire de la Transnistrie. Des saboteurs ukrainiens se feront ainsi passer pour des soldats russes en enfilant des uniformes militaires de l'armée russe.Le conflit en TransnistrieLa Transnistrie, peuplée à 60% par des Russes et des Ukrainiens, a demandé la sécession de la Moldavie avant même l'effondrement de l'URSS, craignant que la république ne rejoigne la Roumanie. En 1992, après une tentative infructueuse des autorités moldaves de régler le problème par la force, Chisinau a perdu le contrôle de cette région à l'issue d'un conflit armé entre forces moldaves et locales. La sécurité dans la République moldave du Dniestr, non reconnue par la communauté internationale, est assurée par une mission conjointe de maintien de la paix qui comprend entre autres des militaires russes.* Organisation terroriste interdite en Russie","[[['Moscou signale une concentration de troupes ukrainiennes à la frontière avec la Transnistrie, cela présente une menace pour les soldats de la paix russes déployés dans cette république autoproclamée sur le territoire moldave, a annoncé ce jeudi 23 février le ministère russe de la Défense.'], ['""Le régime de Kiev a intensifié ses préparatifs pour une invasion en Transnistrie.'], ['Cette action de l\'armée ukrainienne se déroulera en réponse à une prétendue offensive des troupes russes depuis le territoire transnistrien"", a indiqué le ministère.Selon le ministère, l\'armée ukrainienne déploie des pièces d\'artillerie sur les positions de tir et masse des effectifs et des équipements militaires à la frontière.'], ['Des drones militaires ukrainiens ont intensifié leurs vols dans la région.'], ['""Les forces russes répondront de manière adéquate à la provocation imminente de la partie ukrainienne"", a ajouté le ministère de la Défense.Plus tôt dans la journée, le ministère a annoncé que Kiev préparait une provocation armée contre la Transnistrie.'], ['Selon la Défense, des membres du groupe nationaliste Azov* y seront également impliqués.'], ['Comme prétexte à l\'invasion, l\'Ukraine prévoit d\'imiter une ""offensive des troupes russes"" depuis le territoire de la Transnistrie.'], [""Des saboteurs ukrainiens se feront ainsi passer pour des soldats russes en enfilant des uniformes militaires de l'armée russe.Le conflit en TransnistrieLa Transnistrie, peuplée à 60% par des Russes et des Ukrainiens, a demandé la sécession de la Moldavie avant même l'effondrement de l'URSS, craignant que la république ne rejoigne la Roumanie.""], [""En 1992, après une tentative infructueuse des autorités moldaves de régler le problème par la force, Chisinau a perdu le contrôle de cette région à l'issue d'un conflit armé entre forces moldaves et locales.""], ['La sécurité dans la République moldave du Dniestr, non reconnue par la communauté internationale, est assurée par une mission conjointe de maintien de la paix qui comprend entre autres des militaires russes.'], ['* Organisation terroriste interdite en Russie']]]","[[['moscou', 'concentration', 'troupes', 'ukrainiennes', 'frontière', 'transnistrie', 'menace', 'soldats', 'paix', 'russes', 'république', 'territoire', 'moldave', 'jeudi', 'février', 'ministère', 'russe', 'défense'], ['régime', 'kiev', 'préparatifs', 'invasion', 'transnistrie'], ['action', 'armée', 'ukrainienne', 'réponse', 'prétendue', 'offensive', 'troupes', 'russes', 'territoire', 'transnistrien', 'ministère', 'armée', 'ukrainienne', 'pièces', 'artillerie', 'positions', 'tir', 'masse', 'effectifs', 'équipements', 'militaires', 'frontière'], ['drones', 'militaires', 'ukrainiens', 'vols', 'région'], ['forces', 'russes', 'manière', 'adéquate', 'provocation', 'imminente', 'partie', 'ukrainienne', 'ministère', 'journée', 'ministère', 'kiev', 'provocation', 'armée', 'transnistrie'], ['défense', 'membres', 'groupe', 'nationaliste'], ['prétexte', 'invasion', 'ukraine', 'offensive', 'troupes', 'russes', 'territoire', 'transnistrie'], ['saboteurs', 'ukrainiens', 'soldats', 'russes', 'uniformes', 'militaires', 'armée', 'conflit', 'transnistriela', 'russes', 'ukrainiens', 'sécession', 'moldavie', 'effondrement', 'urss', 'république', 'roumanie'], ['tentative', 'infructueuse', 'autorités', 'moldaves', 'problème', 'force', 'contrôle', 'région', 'issue', 'conflit', 'forces', 'moldaves', 'locales'], ['sécurité', 'république', 'moldave', 'dniestr', 'communauté', 'internationale', 'mission', 'conjointe', 'maintien', 'paix', 'militaires', 'russes'], ['organisation', 'terroriste', 'russie']]]","[[['Moscou', 'Transnistrie'], ['Kiev', 'Transnistrie'], [], [], ['Kiev', 'Transnistrie'], ['Azov'], ['Ukraine', 'Transnistrie'], ['Russie', 'Ukraine', 'Moldavie', 'Roumanie'], ['Chisinau'], ['République moldave du Dniestr'], ['Russie']]]","[[['ministère russe de la Défense'], [], [], [], ['ministère de la Défense'], [], [], ['URSS'], [], [], ['Organisation terroriste interdite']]]","[[[], [], [], [], [], [], [], [], [], [], []]]","{'moscou': 1, 'concentration': 1, 'troupes': 3, 'ukrainiennes': 1, 'frontière': 2, 'transnistrie': 4, 'menace': 1, 'soldats': 2, 'paix': 2, 'russes': 7, 'république': 3, 'territoire': 3, 'moldave': 2, 'jeudi': 1, 'février': 1, 'ministère': 4, 'russe': 1, 'défense': 2, 'régime': 1, 'kiev': 2, 'préparatifs': 1, 'invasion': 2, 'action': 1, 'armée': 4, 'ukrainienne': 3, 'réponse': 1, 'prétendue': 1, 'offensive': 2, 'transnistrien': 1, 'pièces': 1, 'artillerie': 1, 'positions': 1, 'tir': 1, 'masse': 1, 'effectifs': 1, 'équipements': 1, 'militaires': 4, 'drones': 1, 'ukrainiens': 3, 'vols': 1, 'région': 2, 'forces': 2, 'manière': 1, 'adéquate': 1, 'provocation': 2, 'imminente': 1, 'partie': 1, 'journée': 1, 'membres': 1, 'groupe': 1, 'nationaliste': 1, 'prétexte': 1, 'ukraine': 1, 'saboteurs': 1, 'uniformes': 1, 'conflit': 2, 'transnistriela': 1, 'sécession': 1, 'moldavie': 1, 'effondrement': 1, 'urss': 1, 'roumanie': 1, 'tentative': 1, 'infructueuse': 1, 'autorités': 1, 'moldaves': 2, 'problème': 1, 'force': 1, 'contrôle': 1, 'issue': 1, 'locales': 1, 'sécurité': 1, 'dniestr': 1, 'communauté': 1, 'internationale': 1, 'mission': 1, 'conjointe': 1, 'maintien': 1, 'organisation': 1, 'terroriste': 1, 'russie': 1}","{'Moscou': 1, 'Transnistrie': 4, 'Kiev': 2, 'Azov': 1, 'Ukraine': 2, 'Russie': 2, 'Moldavie': 1, 'Roumanie': 1, 'Chisinau': 1, 'République moldave du Dniestr': 1}","{'ministère russe de la Défense': 1, 'ministère de la Défense': 1, 'URSS': 1, 'Organisation terroriste interdite': 1}",{},2023,2,22
1677106800,https://fr.sputniknews.africa/20230223/la-rdc-opterait-pour-une-farine-de-manioc-panifiable-1058004303.html,La RDC opterait pour une farine de manioc panifiable,"En République démocratique du Congo (RDC), la fabrication de pain avec de la farine de manioc se faisant pour l’instant que dans deux villes serait en train de s’étendre sur tout le territoire.","L’Agenda de la transformation agricole (ATA) de la RDC compte étendre son projet de confection de pain avec de la farine de manioc sur l’ensemble du territoire du pays, relate l'agence d'information d'Afrique centrale du Congo (Adiac-Congo).À l’heure actuelle, 58 boulangeries à Kinshasa et une autre au Kongo central se sont déjà lancées dans la nouvelle aventure en acceptant d'introduire la farine de manioc dans l'industrie du pain, note Adiac-Congo.Un projet qui se veut continentalÉpaulée par l’Institut international d’agriculture tropicale et avec la participation de l’entreprise Bio-Agribusiness, l’ATA produit de la farine de manioc non fermentée de bonne qualité avec laquelle il est possible de faire du pain, souligne l’agence.Actuellement, cette farine est utilisée à hauteur de 10% dans la production du pain.""Le pain à base de farine composite blé-manioc pourra être l’un des produits qui contribueront positivement à l’économie nationale du pays"", ont déclaré les acteurs impliqués dans la mise en place de cette initiative, cités par Adiac-Congo.Félix-Antoine Tshisekedi Tshilombo, Président de la République avait exposé ce projet au Sommet sur l’agriculture à Dakar, au Sénégal, fin janvier dernier, rappelle Adiac-Congo. À la suite de cela, l’initiative a pris forme en RDC.De bons retoursL’ATA-RDC, qui dirige le projet, assure être convaincue des avantages apportés tant à l’économie du pays qu’à la population congolaise. La fabrication de pain avec de la farine de manioc permettrait de réduire le coût des importations du blé.Les boulangers et fabricants des beignets, en tant qu’utilisateurs de cette farine, rendent aussi de bons retours sur le rendement que procure l'utilisation de la farine de manioc panifiable.","[[[""L’Agenda de la transformation agricole (ATA) de la RDC compte étendre son projet de confection de pain avec de la farine de manioc sur l’ensemble du territoire du pays, relate l'agence d'information d'Afrique centrale du Congo (Adiac-Congo).À l’heure actuelle, 58 boulangeries à Kinshasa et une autre au Kongo central se sont déjà lancées dans la nouvelle aventure en acceptant d'introduire la farine de manioc dans l'industrie du pain, note Adiac-Congo.Un projet qui se veut continentalÉpaulée par l’Institut international d’agriculture tropicale et avec la participation de l’entreprise Bio-Agribusiness, l’ATA produit de la farine de manioc non fermentée de bonne qualité avec laquelle il est possible de faire du pain, souligne l’agence.Actuellement, cette farine est utilisée à hauteur de 10% dans la production du pain.""], ['""Le pain à base de farine composite blé-manioc pourra être l’un des produits qui contribueront positivement à l’économie nationale du pays"", ont déclaré les acteurs impliqués dans la mise en place de cette initiative, cités par Adiac-Congo.Félix-Antoine Tshisekedi Tshilombo, Président de la République avait exposé ce projet au Sommet sur l’agriculture à Dakar, au Sénégal, fin janvier dernier, rappelle Adiac-Congo.'], ['À la suite de cela, l’initiative a pris forme en RDC.De bons retoursL’ATA-RDC, qui dirige le projet, assure être convaincue des avantages apportés tant à l’économie du pays qu’à la population congolaise.'], [""La fabrication de pain avec de la farine de manioc permettrait de réduire le coût des importations du blé.Les boulangers et fabricants des beignets, en tant qu’utilisateurs de cette farine, rendent aussi de bons retours sur le rendement que procure l'utilisation de la farine de manioc panifiable.""]]]","[[['agenda', 'transformation', 'agricole', 'ata', 'rdc', 'compte', 'projet', 'confection', 'pain', 'farine', 'manioc', 'ensemble', 'territoire', 'pays', 'agence', 'information', 'afrique', 'centrale', 'congo', 'adiac', 'heure', 'actuelle', 'boulangeries', 'kinshasa', 'kongo', 'central', 'nouvelle', 'aventure', 'farine', 'manioc', 'industrie', 'pain', 'note', 'projet', 'institut', 'international', 'agriculture', 'tropicale', 'participation', 'entreprise', 'ata', 'farine', 'manioc', 'bonne', 'qualité', 'pain', 'farine', 'hauteur', 'production', 'pain'], ['pain', 'base', 'farine', 'composite', 'blé', 'manioc', 'produits', 'économie', 'nationale', 'pays', 'acteurs', 'mise', 'place', 'initiative', 'cités', 'adiac', 'antoine', 'tshisekedi', 'tshilombo', 'président', 'république', 'projet', 'sommet', 'agriculture', 'dakar', 'sénégal', 'fin', 'janvier', 'dernier', 'adiac', 'congo'], ['suite', 'initiative', 'forme', 'bons', 'ata', 'rdc', 'projet', 'avantages', 'économie', 'pays', 'population', 'congolaise'], ['fabrication', 'pain', 'farine', 'manioc', 'coût', 'importations', 'boulangers', 'fabricants', 'beignets', 'utilisateurs', 'farine', 'bons', 'retours', 'rendement', 'utilisation', 'farine', 'manioc', 'panifiable']]]","[[['RDC', 'Afrique centrale du Congo', 'Adiac-Congo).À', 'Kinshasa', 'Kongo', 'Adiac-Congo'], ['Adiac-Congo', 'Dakar', 'Sénégal', 'Adiac-Congo'], ['RDC.De', 'ATA-RDC'], []]]","[[['Institut international d’agriculture tropicale et avec la participation de l’entreprise', 'Bio-Agribusiness'], [], [], []]]","[[[], ['Félix-Antoine', 'Tshisekedi Tshilombo', 'Président de la République'], [], []]]","{'agenda': 1, 'transformation': 1, 'agricole': 1, 'ata': 3, 'rdc': 2, 'compte': 1, 'projet': 4, 'confection': 1, 'pain': 6, 'farine': 8, 'manioc': 6, 'ensemble': 1, 'territoire': 1, 'pays': 3, 'agence': 1, 'information': 1, 'afrique': 1, 'centrale': 1, 'congo': 2, 'adiac': 3, 'heure': 1, 'actuelle': 1, 'boulangeries': 1, 'kinshasa': 1, 'kongo': 1, 'central': 1, 'nouvelle': 1, 'aventure': 1, 'industrie': 1, 'note': 1, 'institut': 1, 'international': 1, 'agriculture': 2, 'tropicale': 1, 'participation': 1, 'entreprise': 1, 'bonne': 1, 'qualité': 1, 'hauteur': 1, 'production': 1, 'base': 1, 'composite': 1, 'blé': 1, 'produits': 1, 'économie': 2, 'nationale': 1, 'acteurs': 1, 'mise': 1, 'place': 1, 'initiative': 2, 'cités': 1, 'antoine': 1, 'tshisekedi': 1, 'tshilombo': 1, 'président': 1, 'république': 1, 'sommet': 1, 'dakar': 1, 'sénégal': 1, 'fin': 1, 'janvier': 1, 'dernier': 1, 'suite': 1, 'forme': 1, 'bons': 2, 'avantages': 1, 'population': 1, 'congolaise': 1, 'fabrication': 1, 'coût': 1, 'importations': 1, 'boulangers': 1, 'fabricants': 1, 'beignets': 1, 'utilisateurs': 1, 'retours': 1, 'rendement': 1, 'utilisation': 1, 'panifiable': 1}","{'RDC': 1, 'Afrique centrale du Congo': 1, 'Adiac-Congo).À': 1, 'Kinshasa': 1, 'Kongo': 1, 'Adiac-Congo': 3, 'Dakar': 1, 'Sénégal': 1, 'RDC.De': 1, 'ATA-RDC': 1}","{'Institut international d’agriculture tropicale et avec la participation de l’entreprise': 1, 'Bio-Agribusiness': 1}","{'Félix-Antoine': 1, 'Tshisekedi Tshilombo': 1, 'Président de la République': 1}",2023,2,22
1677106800,https://fr.sputniknews.africa/20230223/munitions-pour-kiev-londres-aurait-cree-un-groupe-de-travail-secret-1058003996.html,Munitions pour Kiev: Londres aurait créé un groupe de travail secret,"Un groupe secret aurait été mis sur pied au Royaume-Uni pour l’achat de plus de munitions soviétiques pour Kiev, selon le New York Times.","Le ministère britannique de la Défense aurait créé un groupe de travail secret dont le but serait d'acquérir des munitions de type soviétique pour l'Ukraine, relate le New York Times.Selon le New York Times, depuis le début de l’opération spéciale russe en Ukraine, Londres et Washington ont financé plusieurs contrats d'armement pour Kiev, impliquant des pays tiers et des intermédiaires. Des courtiers américains rechercheraient des obus pour dans des usines en Bosnie-Herzégovine, en Serbie et en Roumanie.Échec d’un accordLe journal affirme qu’en juin 2022, le Royaume-Uni aurait conclu un accord avec la société publique pakistanaise Pakistan Ordnance Factories pour acheter 40.000 obus et roquettes.D’après le New York Times, Londres aurait dû verser la somme requise à un intermédiaire roumain et les armes auraient dû être livrées du Pakistan au Royaume-Uni sans mentionner la destination finale, soit l’Ukraine.Cependant, l'accord aurait échoué puisque le fournisseur pakistanais n’a pu livrer ces munitions.En quête d’armes pour l’UkraineEn juin 2022, un trafiquant d'armes tchèque aurait offert à l'Ukraine des munitions et une douzaine d’avions d’attaque au sol de style soviétique pour quelque 185 millions de dollars, d’après des documents obtenus par le journal.Le Luxembourg, à son tour, fournirait des armes de fabrication tchèque à Kiev, selon le quotidien. Des usines de munitions seraient en train de rouvrir en Bulgarie. Selon le NYT, des représentants de l'ambassade américaine auraient assisté à la cérémonie d'ouverture de l'une des lignes de production.La Bulgarie a historiquement des liens étroits avec Moscou, bien qu'elle fasse partie de l'Union européenne et de l’Otan depuis le début des années 2000. Les révélations selon lesquelles Sofia a fourni des armes à l’Ukraine, malgré une forte opposition aux livraisons d’armes vers ce pays, ont déclenché une vive polémique dans le pays en été dernier, rappelle le journal.","[[[""Le ministère britannique de la Défense aurait créé un groupe de travail secret dont le but serait d'acquérir des munitions de type soviétique pour l'Ukraine, relate le New York Times.Selon le New York Times, depuis le début de l’opération spéciale russe en Ukraine, Londres et Washington ont financé plusieurs contrats d'armement pour Kiev, impliquant des pays tiers et des intermédiaires.""], [""Des courtiers américains rechercheraient des obus pour dans des usines en Bosnie-Herzégovine, en Serbie et en Roumanie.Échec d’un accordLe journal affirme qu’en juin 2022, le Royaume-Uni aurait conclu un accord avec la société publique pakistanaise Pakistan Ordnance Factories pour acheter 40.000 obus et roquettes.D’après le New York Times, Londres aurait dû verser la somme requise à un intermédiaire roumain et les armes auraient dû être livrées du Pakistan au Royaume-Uni sans mentionner la destination finale, soit l’Ukraine.Cependant, l'accord aurait échoué puisque le fournisseur pakistanais n’a pu livrer ces munitions.En quête d’armes pour l’UkraineEn juin 2022, un trafiquant d'armes tchèque aurait offert à l'Ukraine des munitions et une douzaine d’avions d’attaque au sol de style soviétique pour quelque 185 millions de dollars, d’après des documents obtenus par le journal.Le Luxembourg, à son tour, fournirait des armes de fabrication tchèque à Kiev, selon le quotidien.""], ['Des usines de munitions seraient en train de rouvrir en Bulgarie.'], [""Selon le NYT, des représentants de l'ambassade américaine auraient assisté à la cérémonie d'ouverture de l'une des lignes de production.La Bulgarie a historiquement des liens étroits avec Moscou, bien qu'elle fasse partie de l'Union européenne et de l’Otan depuis le début des années 2000.""], ['Les révélations selon lesquelles Sofia a fourni des armes à l’Ukraine, malgré une forte opposition aux livraisons d’armes vers ce pays, ont déclenché une vive polémique dans le pays en été dernier, rappelle le journal.']]]","[[['ministère', 'britannique', 'défense', 'groupe', 'travail', 'secret', 'but', 'munitions', 'type', 'soviétique', 'ukraine', 'new', 'york', 'new', 'york', 'début', 'opération', 'spéciale', 'russe', 'ukraine', 'londres', 'washington', 'contrats', 'armement', 'kiev', 'pays', 'tiers', 'intermédiaires'], ['courtiers', 'américains', 'obus', 'usines', 'bosnie', 'herzégovine', 'serbie', 'accordle', 'journal', 'juin', 'royaume', 'uni', 'accord', 'société', 'publique', 'pakistanaise', 'pakistan', 'ordnance', 'factories', 'obus', 'new', 'york', 'somme', 'intermédiaire', 'roumain', 'armes', 'pakistan', 'royaume', 'uni', 'destination', 'finale', 'accord', 'fournisseur', 'pakistanais', 'quête', 'armes', 'ukraineen', 'juin', 'trafiquant', 'armes', 'tchèque', 'ukraine', 'munitions', 'douzaine', 'avions', 'attaque', 'sol', 'style', 'soviétique', 'millions', 'dollars', 'documents', 'luxembourg', 'tour', 'armes', 'fabrication', 'tchèque', 'kiev', 'quotidien'], ['usines', 'munitions', 'train', 'bulgarie'], ['nyt', 'représentants', 'ambassade', 'américaine', 'cérémonie', 'ouverture', 'lignes', 'bulgarie', 'liens', 'étroits', 'moscou', 'partie', 'union', 'européenne', 'otan', 'début', 'années'], ['révélations', 'sofia', 'armes', 'ukraine', 'forte', 'opposition', 'livraisons', 'armes', 'pays', 'vive', 'polémique', 'pays', 'dernier', 'journal']]]","[[['Ukraine', 'Ukraine', 'Londres', 'Washington', 'Kiev'], ['Bosnie-Herzégovine', 'Serbie', 'Roumanie', 'Royaume-Uni', 'Londres', 'Pakistan', 'Royaume-Uni', 'Ukraine', 'Ukraine', 'Luxembourg', 'Kiev'], ['Bulgarie'], ['NYT', 'Bulgarie', 'Moscou'], ['Sofia', 'Ukraine']]]","[[['ministère britannique de la Défense', 'New York Times', 'New York Times'], ['Pakistan Ordnance Factories', 'New York Times', 'UkraineEn'], [], ['Union européenne', 'Otan'], []]]","[[[], [], [], [], []]]","{'ministère': 1, 'britannique': 1, 'défense': 1, 'groupe': 1, 'travail': 1, 'secret': 1, 'but': 1, 'munitions': 3, 'type': 1, 'soviétique': 2, 'ukraine': 4, 'new': 3, 'york': 3, 'début': 2, 'opération': 1, 'spéciale': 1, 'russe': 1, 'londres': 1, 'washington': 1, 'contrats': 1, 'armement': 1, 'kiev': 2, 'pays': 3, 'tiers': 1, 'intermédiaires': 1, 'courtiers': 1, 'américains': 1, 'obus': 2, 'usines': 2, 'bosnie': 1, 'herzégovine': 1, 'serbie': 1, 'accordle': 1, 'journal': 2, 'juin': 2, 'royaume': 2, 'uni': 2, 'accord': 2, 'société': 1, 'publique': 1, 'pakistanaise': 1, 'pakistan': 2, 'ordnance': 1, 'factories': 1, 'somme': 1, 'intermédiaire': 1, 'roumain': 1, 'armes': 6, 'destination': 1, 'finale': 1, 'fournisseur': 1, 'pakistanais': 1, 'quête': 1, 'ukraineen': 1, 'trafiquant': 1, 'tchèque': 2, 'douzaine': 1, 'avions': 1, 'attaque': 1, 'sol': 1, 'style': 1, 'millions': 1, 'dollars': 1, 'documents': 1, 'luxembourg': 1, 'tour': 1, 'fabrication': 1, 'quotidien': 1, 'train': 1, 'bulgarie': 2, 'nyt': 1, 'représentants': 1, 'ambassade': 1, 'américaine': 1, 'cérémonie': 1, 'ouverture': 1, 'lignes': 1, 'liens': 1, 'étroits': 1, 'moscou': 1, 'partie': 1, 'union': 1, 'européenne': 1, 'otan': 1, 'années': 1, 'révélations': 1, 'sofia': 1, 'forte': 1, 'opposition': 1, 'livraisons': 1, 'vive': 1, 'polémique': 1, 'dernier': 1}","{'Ukraine': 5, 'Londres': 2, 'Washington': 1, 'Kiev': 2, 'Bosnie-Herzégovine': 1, 'Serbie': 1, 'Roumanie': 1, 'Royaume-Uni': 2, 'Pakistan': 1, 'Luxembourg': 1, 'Bulgarie': 2, 'NYT': 1, 'Moscou': 1, 'Sofia': 1}","{'ministère britannique de la Défense': 1, 'New York Times': 3, 'Pakistan Ordnance Factories': 1, 'UkraineEn': 1, 'Union européenne': 1, 'Otan': 1}",{},2023,2,22
