timestamp,url,title,description,content,content-segmented,kws-l,loc-l,org-l,per-l,kws,loc,org,per,year,month,day
1667862000,https://fr.sputniknews.africa/20221108/pekin-presente-son-missile-antinavire-supersonique-de-pointe--photo-1056761280.html,Pékin présente son missile antinavire supersonique de pointe – photos,"Sur fond de récentes tensions autour de Taïwan, un missile hypersonique antinavire chinois a fait ce mardi 8 novembre ses débuts auprès du grand public. Son rayon d’action est supérieur à 2.000 km.","Lors de l'ouverture de son principal salon aéronautique, la Chine a présenté au public sa dernière collection d'avions de guerre et d'armes de pointe, dont un missile hypersonique antinavire, rapporte le South China Morning Post. Details of the H-6K missile https://t.co/WVNV9qxjzb pic.twitter.com/fcg8y4QtVz— Jesus Roman (@jesusfroman) November 3, 2022 C’est une version destinée à l'exportation du missile balistique chinois YJ-21, également connu sous le nom d’Eagle Strike 21, dont le rayon d’action dépasse les 2.000 km.La présentation de cette arme vise à mettre les États-Unis en garde contre toute intervention dans la situation autour de Taïwan, a expliqué au South China Morning Post Andrei Chang, rédacteur en chef du magazine militaire canadien Kanwa Asian Defence.""Aucun système américain de défense aérienne basé en mer n'est capable d'intercepter le missile hypersonique"", affirme-t-il.","[[[""Lors de l'ouverture de son principal salon aéronautique, la Chine a présenté au public sa dernière collection d'avions de guerre et d'armes de pointe, dont un missile hypersonique antinavire, rapporte le South China Morning Post."", ""Details of the H-6K missile https://t.co/WVNV9qxjzb pic.twitter.com/fcg8y4QtVz— Jesus Roman (@jesusfroman) November 3, 2022 C’est une version destinée à l'exportation du missile balistique chinois YJ-21, également connu sous le nom d’Eagle Strike 21, dont le rayon d’action dépasse les 2.000 km.La présentation de cette arme vise à mettre les États-Unis en garde contre toute intervention dans la situation autour de Taïwan, a expliqué au South China Morning Post Andrei Chang, rédacteur en chef du magazine militaire canadien Kanwa Asian Defence."", '""Aucun système américain de défense aérienne basé en mer n\'est capable d\'intercepter le missile hypersonique"", affirme-t-il.']]]","[[['ouverture', 'principal', 'salon', 'aéronautique', 'chine', 'public', 'dernier', 'collection', 'avion', 'guerre', 'arme', 'pointe', 'missile', 'hypersonique', 'antinavire', 'south', 'china', 'post'], ['missile', 'jesu', 'roman', 'november', 'version', 'exportation', 'missile', 'balistique', 'chinois', 'nom', 'eagle', 'rayon', 'action', 'présentation', 'arme', 'garde', 'intervention', 'situation', 'taïwan', 'south', 'china', 'post', 'andrei', 'chang', 'rédacteur', 'chef', 'magazine', 'militaire', 'canadien', 'defence'], ['système', 'américain', 'défense', 'aérien', 'mer', 'capable', 'missile', 'hypersonique']]]","[[['Chine'], ['États-Unis', 'Taïwan'], []]]","[[[], ['Kanwa Asian Defence'], []]]","[[[], [], []]]","{'ouverture': 1, 'principal': 1, 'salon': 1, 'aéronautique': 1, 'chine': 1, 'public': 1, 'dernier': 1, 'collection': 1, 'avion': 1, 'guerre': 1, 'arme': 2, 'pointe': 1, 'missile': 4, 'hypersonique': 2, 'antinavire': 1, 'south': 2, 'china': 2, 'post': 2, 'jesu': 1, 'roman': 1, 'november': 1, 'version': 1, 'exportation': 1, 'balistique': 1, 'chinois': 1, 'nom': 1, 'eagle': 1, 'rayon': 1, 'action': 1, 'présentation': 1, 'garde': 1, 'intervention': 1, 'situation': 1, 'taïwan': 1, 'andrei': 1, 'chang': 1, 'rédacteur': 1, 'chef': 1, 'magazine': 1, 'militaire': 1, 'canadien': 1, 'defence': 1, 'système': 1, 'américain': 1, 'défense': 1, 'aérien': 1, 'mer': 1, 'capable': 1}","{'Chine': 1, 'États-Unis': 1, 'Taïwan': 1}",{'Kanwa Asian Defence': 1},{},2022,11,7
1667862000,https://fr.sputniknews.africa/20221108/macron-accuse-les-usa-de-comportement-inamical-sur-le-climat-1056761010.html,"Macron accuse les USA de comportement ""inamical"" sur le climat","Emmanuel Macron a proposé ce mardi 8 novembre un pacte de décarbonation aux industriels les plus émetteurs de CO2 en France avec un doublement de l'aide publique à 10 milliards d'euros. Lors de la réunion, il a notamment accusé les USA de...","Intervenant ce mardi 8 novembre devant les industriels réunis à l'Elysée, Emmanuel Macron a pointé la concurrence exacerbée de puissances économiques comme les Etats-Unis qui promettent des subventions publiques massives pour la décarbonation, avec un risque de désindustrialisation si les Européens ne suivent pas.""Les Etats-Unis sont producteurs d'un gaz peu cher qu'ils vendent cher, et en plus ont pris des dispositifs d'aides massives sur certains secteurs"", a-t-il dit.""Ce n'est pas conforme aux règles de l'OMC et ce n'est pas amical"", a-t-il insisté en promettant de mettre le sujet sur la table lors de sa visite d'Etat début décembre à Washington.Pacte de décarbonationLors de la réunion, le chef d'Etat français a dévoilé un pacte de décarbonation destiné aux industriels les plus émetteurs de CO2 dans l'Hexagone avec un doublement de l'aide publique à 10 milliards d'euros en échange d'un doublement de leur effort en la matière.Pour arriver à cet effort, le chef de l'Etat, tout juste de retour de la conférence mondiale sur le climat (COP27) à Charm el-Cheikh en Egypte, a aussi annoncé que le gouvernement allait dérouler une planification précise à six mois et dans les années à venir, ""filière par filière"".","[[[""Intervenant ce mardi 8 novembre devant les industriels réunis à l'Elysée, Emmanuel Macron a pointé la concurrence exacerbée de puissances économiques comme les Etats-Unis qui promettent des subventions publiques massives pour la décarbonation, avec un risque de désindustrialisation si les Européens ne suivent pas."", '""Les Etats-Unis sont producteurs d\'un gaz peu cher qu\'ils vendent cher, et en plus ont pris des dispositifs d\'aides massives sur certains secteurs"", a-t-il dit.', '""Ce n\'est pas conforme aux règles de l\'OMC et ce n\'est pas amical"", a-t-il insisté en promettant de mettre le sujet sur la table lors de sa visite d\'Etat début décembre à Washington.Pacte de décarbonationLors de la réunion, le chef d\'Etat français a dévoilé un pacte de décarbonation destiné aux industriels les plus émetteurs de CO2 dans l\'Hexagone avec un doublement de l\'aide publique à 10 milliards d\'euros en échange d\'un doublement de leur effort en la matière.Pour arriver à cet effort, le chef de l\'Etat, tout juste de retour de la conférence mondiale sur le climat (COP27) à Charm el-Cheikh en Egypte, a aussi annoncé que le gouvernement allait dérouler une planification précise à six mois et dans les années à venir, ""filière par filière"".']]]","[[['mardi', 'novembre', 'industriel', 'elysée', 'emmanuel', 'concurrence', 'puissance', 'économique', 'subvention', 'public', 'massif', 'décarbonation', 'risque', 'désindustrialisation', 'européen'], ['gaz', 'cher', 'cher', 'dispositif', 'aide', 'massif', 'secteur'], ['conforme', 'règle', 'omc', 'amical', 'sujet', 'table', 'visite', 'etat', 'début', 'décarbonationlor', 'réunion', 'chef', 'etat', 'français', 'pacte', 'décarbonation', 'industriel', 'émetteur', 'hexagone', 'aide', 'public', 'milliard', 'euro', 'échange', 'effort', 'effort', 'chef', 'etat', 'conférence', 'mondial', 'climat', 'charm', 'cheikh', 'egypte', 'gouvernement', 'planification', 'mois', 'année', 'filière', 'filière']]]","[[['Elysée', 'Etats-Unis', 'Européens'], ['Etats-Unis'], ['Etat', 'Washington', 'Etat français', 'Hexagone', 'Etat', 'Charm el-Cheikh', 'Egypte']]]","[[[], [], ['OMC']]]","[[['Emmanuel Macron'], [], []]]","{'mardi': 1, 'novembre': 1, 'industriel': 2, 'elysée': 1, 'emmanuel': 1, 'concurrence': 1, 'puissance': 1, 'économique': 1, 'subvention': 1, 'public': 2, 'massif': 2, 'décarbonation': 2, 'risque': 1, 'désindustrialisation': 1, 'européen': 1, 'gaz': 1, 'cher': 2, 'dispositif': 1, 'aide': 2, 'secteur': 1, 'conforme': 1, 'règle': 1, 'omc': 1, 'amical': 1, 'sujet': 1, 'table': 1, 'visite': 1, 'etat': 3, 'début': 1, 'décarbonationlor': 1, 'réunion': 1, 'chef': 2, 'français': 1, 'pacte': 1, 'émetteur': 1, 'hexagone': 1, 'milliard': 1, 'euro': 1, 'échange': 1, 'effort': 2, 'conférence': 1, 'mondial': 1, 'climat': 1, 'charm': 1, 'cheikh': 1, 'egypte': 1, 'gouvernement': 1, 'planification': 1, 'mois': 1, 'année': 1, 'filière': 2}","{'Elysée': 1, 'Etats-Unis': 2, 'Européens': 1, 'Etat': 2, 'Washington': 1, 'Etat français': 1, 'Hexagone': 1, 'Charm el-Cheikh': 1, 'Egypte': 1}",{'OMC': 1},{'Emmanuel Macron': 1},2022,11,7
1667862000,https://fr.sputniknews.africa/20221108/macky-sall-sexprime-sur-laccord-cerealier--1056760824.html,Macky Sall s’exprime sur l’accord céréalier,Le Président sénégalais Macky Sall a grandement apprécié la signature de l'accord sur les céréales qui permet de débloquer les denrées alimentaires se trouvant dans les ports ukrainiens.,"Quelques jours après que la Russie a repris sa participation à l’accord sur les céréales, le dirigeant sénégalais et président de l’Union africaine, Macky Sall, a dévoilé à Sputnik son point de vue à l’égard de la convention.""Nous avons beaucoup apprécié cet accord du blé. Je crois que l’arrêt des restrictions sur les céréales a ramené les marchés à la normale"", a déclaré M.Sall.Accord du bléLe 22 juillet, la Russie, la Turquie, l’Ukraine et l’Onu ont signé un accord portant sur l’exportation de céréales et d’engrais depuis trois ports ukrainiens. En septembre, Vladimir Poutine a déclaré que la majorité des céréales était exportée vers les États européens plutôt que vers les pays africains dans le besoin.Le 30 octobre, la Russie a annoncé la suspension de sa participation à l’accord, après l'attaque de drones ukrainiens contre ses navires, se trouvant dans la baie de Sébastopol en Crimée. Les bâtiments ciblés assuraient la sécurité du couloir céréalier, selon Moscou.Le 2 novembre, la Russie a annoncé la reprise de sa participation à l'accord, car Kiev avait donné des garanties de ne pas utiliser le corridor céréalier et les ports ukrainiens pour mener des actions militaires.","[[['Quelques jours après que la Russie a repris sa participation à l’accord sur les céréales, le dirigeant sénégalais et président de l’Union africaine, Macky Sall, a dévoilé à Sputnik son point de vue à l’égard de la convention.', '""Nous avons beaucoup apprécié cet accord du blé.', 'Je crois que l’arrêt des restrictions sur les céréales a ramené les marchés à la normale"", a déclaré M.Sall.Accord du bléLe 22 juillet, la Russie, la Turquie, l’Ukraine et l’Onu ont signé un accord portant sur l’exportation de céréales et d’engrais depuis trois ports ukrainiens.', ""En septembre, Vladimir Poutine a déclaré que la majorité des céréales était exportée vers les États européens plutôt que vers les pays africains dans le besoin.Le 30 octobre, la Russie a annoncé la suspension de sa participation à l’accord, après l'attaque de drones ukrainiens contre ses navires, se trouvant dans la baie de Sébastopol en Crimée."", ""Les bâtiments ciblés assuraient la sécurité du couloir céréalier, selon Moscou.Le 2 novembre, la Russie a annoncé la reprise de sa participation à l'accord, car Kiev avait donné des garanties de ne pas utiliser le corridor céréalier et les ports ukrainiens pour mener des actions militaires.""]]]","[[['jour', 'russie', 'participation', 'accord', 'céréale', 'dirigeant', 'sénégalais', 'président', 'union', 'africain', 'macky', 'sall', 'sputnik', 'point', 'vue', 'égard', 'convention'], ['accord', 'blé'], ['arrêt', 'restriction', 'céréale', 'marché', 'normal', 'bléle', 'juillet', 'russie', 'turquie', 'ukraine', 'onu', 'accord', 'exportation', 'céréale', 'engrais', 'port', 'ukrainien'], ['septembre', 'vladimir', 'poutine', 'majorité', 'céréale', 'état', 'européen', 'pays', 'africain', 'octobre', 'russie', 'suspension', 'participation', 'accord', 'attaque', 'drone', 'ukrainien', 'navire', 'baie', 'sébastopol'], ['bâtiment', 'sécurité', 'couloir', 'céréalier', 'novembre', 'russie', 'reprise', 'participation', 'accord', 'kiev', 'garantie', 'corridor', 'céréalier', 'port', 'ukrainien', 'action', 'militaire']]]","[[['Russie'], [], ['M.Sall', 'Russie', 'Turquie', 'Ukraine'], ['Russie', 'baie de Sébastopol', 'Crimée'], ['Moscou', 'Russie', 'Kiev']]]","[[['Union africaine', 'Sputnik'], [], ['Onu'], [], []]]","[[['Macky Sall'], [], [], ['Vladimir Poutine'], []]]","{'jour': 1, 'russie': 4, 'participation': 3, 'accord': 5, 'céréale': 4, 'dirigeant': 1, 'sénégalais': 1, 'président': 1, 'union': 1, 'africain': 2, 'macky': 1, 'sall': 1, 'sputnik': 1, 'point': 1, 'vue': 1, 'égard': 1, 'convention': 1, 'blé': 1, 'arrêt': 1, 'restriction': 1, 'marché': 1, 'normal': 1, 'bléle': 1, 'juillet': 1, 'turquie': 1, 'ukraine': 1, 'onu': 1, 'exportation': 1, 'engrais': 1, 'port': 2, 'ukrainien': 3, 'septembre': 1, 'vladimir': 1, 'poutine': 1, 'majorité': 1, 'état': 1, 'européen': 1, 'pays': 1, 'octobre': 1, 'suspension': 1, 'attaque': 1, 'drone': 1, 'navire': 1, 'baie': 1, 'sébastopol': 1, 'bâtiment': 1, 'sécurité': 1, 'couloir': 1, 'céréalier': 2, 'novembre': 1, 'reprise': 1, 'kiev': 1, 'garantie': 1, 'corridor': 1, 'action': 1, 'militaire': 1}","{'Russie': 4, 'M.Sall': 1, 'Turquie': 1, 'Ukraine': 1, 'baie de Sébastopol': 1, 'Crimée': 1, 'Moscou': 1, 'Kiev': 1}","{'Union africaine': 1, 'Sputnik': 1, 'Onu': 1}","{'Macky Sall': 1, 'Vladimir Poutine': 1}",2022,11,7
1667862000,https://fr.sputniknews.africa/20221108/zelensky-doit-cesser-ses-caprices-et-negocier-lance-le-leader-des-patriotes-francais--1056760653.html,"""Zelensky doit cesser ses caprices et négocier"", lance le leader des Patriotes français","Florian Philippot, chef de file du parti français Les Patriotes (LP), a de nouveau exhorté le Président ukrainien Volodymyr Zelensky à négocier avec la Russie.","Le dirigeant ukrainien ""doit cesser ses caprices et négocier"", a lancé ce mardi 8 novembre le chef de file des Patriotes (LP) Florian Philippot.""Les gens n’en peuvent plus. Nos pays ne se suicideront pas pour lui et sa clique! On veut la Paix, pas la guerre perpétuelle!"", a-t-il écrit sur sa page Twitter.La veille, M.Philippot a estimé que les Américains avaient l'intention de se débarrasser de Zelensky dès qu'il n'auraient plus besoin de ses services en tant que marionnette, ""comme toujours"".Précédemment, le Washington Post avait rapporté que l'administration US demandait en privé aux autorités ukrainiennes de signaler leur ouverture à négocier avec la Russie et de renoncer au principe de ne pas le faire tant que Vladimir Poutine restera au pouvoir.","[[['Le dirigeant ukrainien ""doit cesser ses caprices et négocier"", a lancé ce mardi 8 novembre le chef de file des Patriotes (LP) Florian Philippot.', '""Les gens n’en peuvent plus.', 'Nos pays ne se suicideront pas pour lui et sa clique!', 'On veut la Paix, pas la guerre perpétuelle!', '"", a-t-il écrit sur sa page Twitter.La veille, M.Philippot a estimé que les Américains avaient l\'intention de se débarrasser de Zelensky dès qu\'il n\'auraient plus besoin de ses services en tant que marionnette, ""comme toujours"".Précédemment, le Washington Post avait rapporté que l\'administration US demandait en privé aux autorités ukrainiennes de signaler leur ouverture à négocier avec la Russie et de renoncer au principe de ne pas le faire tant que Vladimir Poutine restera au pouvoir.']]]","[[['dirigeant', 'ukrainien', 'caprice', 'mardi', 'novembre', 'chef', 'file', 'patriote', 'lp', 'florian', 'philippot'], [], ['pays', 'clique'], ['paix', 'guerre', 'perpétuel'], ['page', 'veille', 'américain', 'intention', 'zelensky', 'besoin', 'service', 'marionnette', 'washington', 'post', 'administration', 'priver', 'autorité', 'ukrainien', 'ouverture', 'russie', 'principe', 'vladimir', 'poutine']]]","[[[], [], [], [], ['États-Unis', 'US', 'Russie']]]","[[['Patriotes', 'LP'], [], [], [], ['M.Philippot', 'Washington Post']]]","[[['Florian Philippot'], [], [], [], ['Zelensky', 'Vladimir Poutine']]]","{'dirigeant': 1, 'ukrainien': 2, 'caprice': 1, 'mardi': 1, 'novembre': 1, 'chef': 1, 'file': 1, 'patriote': 1, 'lp': 1, 'florian': 1, 'philippot': 1, 'pays': 1, 'clique': 1, 'paix': 1, 'guerre': 1, 'perpétuel': 1, 'page': 1, 'veille': 1, 'américain': 1, 'intention': 1, 'zelensky': 1, 'besoin': 1, 'service': 1, 'marionnette': 1, 'washington': 1, 'post': 1, 'administration': 1, 'priver': 1, 'autorité': 1, 'ouverture': 1, 'russie': 1, 'principe': 1, 'vladimir': 1, 'poutine': 1}","{'États-Unis': 1, 'US': 1, 'Russie': 1}","{'Patriotes': 1, 'LP': 1, 'M.Philippot': 1, 'Washington Post': 1}","{'Florian Philippot': 1, 'Zelensky': 1, 'Vladimir Poutine': 1}",2022,11,7
1667862000,https://fr.sputniknews.africa/20221108/scrutin-de-mi-mandat-des-machines-a-voter-tombent-en-panne-aux-usa-1056760513.html,Scrutin de mi-mandat: des machines à voter tombent en panne aux USA,"Le jour des élections de mi-mandat a connu un début difficile. Des machines à voter sont tombées en panne dans les États du New Jersey et de l’Arizona, relate la presse américaine.","Depuis ce mardi matin, les bureaux de vote sont ouverts aux États-Unis pour les élections de mi-mandat, qui opposent les Républicains aux Démocrates. Pourtant, le scrutin est émaillé d’une panne d’envergure des machines à voter dans deux États, rapportent les médias locaux.Des problèmes techniques se sont notamment produits dans les comtés de Mercer (New Jersey) et de Maricopa (Arizona).Ainsi, afin de lutter contre les fraudes, les autorités du comté de Maricopa ont annoncé que les électeurs pouvaient soit placer leurs bulletins remplis dans une boîte sécurisée sur place pour être comptés plus tard, soit voter dans un autre lieu.La défaillance concerne environ 20% des bureaux de vote du comté de Maricopa, ont déclaré les responsables électoraux. Quant au comté de Mercer, toutes les machines à voter n’y fonctionnaient pas ""en raison d'un problème d'impression et de numérisation des bulletins de vote"".Les autorités de deux comptés ont assuré que les professionnels de l'informatique ont été sollicités pour régler le problème.Alerte à la bombeEn outre, un bureau de vote dans l'État de la Louisiane a été déplacé d'une école vers une autre à cause d'une alerte à la bombe, a rapporté NBC News, citant les autorités locales. Selon la police, l'établissement avait déjà reçu une menace similaire cinq jours plus tôt et les élèves avaient été évacués.","[[['Depuis ce mardi matin, les bureaux de vote sont ouverts aux États-Unis pour les élections de mi-mandat, qui opposent les Républicains aux Démocrates.', 'Pourtant, le scrutin est émaillé d’une panne d’envergure des machines à voter dans deux États, rapportent les médias locaux.Des problèmes techniques se sont notamment produits dans les comtés de Mercer (New Jersey) et de Maricopa (Arizona).Ainsi, afin de lutter contre les fraudes, les autorités du comté de Maricopa ont annoncé que les électeurs pouvaient soit placer leurs bulletins remplis dans une boîte sécurisée sur place pour être comptés plus tard, soit voter dans un autre lieu.La défaillance concerne environ 20% des bureaux de vote du comté de Maricopa, ont déclaré les responsables électoraux.', 'Quant au comté de Mercer, toutes les machines à voter n’y fonctionnaient pas ""en raison d\'un problème d\'impression et de numérisation des bulletins de vote"".Les autorités de deux comptés ont assuré que les professionnels de l\'informatique ont été sollicités pour régler le problème.Alerte à la bombeEn outre, un bureau de vote dans l\'État de la Louisiane a été déplacé d\'une école vers une autre à cause d\'une alerte à la bombe, a rapporté NBC News, citant les autorités locales.', ""Selon la police, l'établissement avait déjà reçu une menace similaire cinq jours plus tôt et les élèves avaient été évacués.""]]]","[[['mardi', 'matin', 'bureau', 'vote', 'élection', 'républicain', 'démocrate'], ['scrutin', 'panne', 'envergure', 'machine', 'état', 'média', 'problème', 'technique', 'comté', 'new', 'jersey', 'maricopa', 'fraude', 'autorité', 'comté', 'maricopa', 'électeur', 'bulletin', 'boîte', 'sécuriser', 'place', 'défaillance', 'bureau', 'vote', 'comté', 'maricopa', 'responsable', 'électoral'], ['comté', 'machine', 'raison', 'problème', 'impression', 'numérisation', 'bulletin', 'autorité', 'compté', 'professionnel', 'informatique', 'bombeen', 'bureau', 'vote', 'état', 'louisiane', 'école', 'cause', 'alerte', 'bombe', 'autorité', 'local'], ['police', 'établissement', 'menace', 'similaire', 'jour', 'élève']]]","[[['États-Unis'], ['États', 'Mercer', 'New Jersey', 'Maricopa', 'Maricopa', 'Maricopa'], ['comté de Mercer', 'État de la Louisiane'], []]]","[[['Républicains', 'Démocrates'], [], ['NBC News'], []]]","[[[], [], [], []]]","{'mardi': 1, 'matin': 1, 'bureau': 3, 'vote': 3, 'élection': 1, 'républicain': 1, 'démocrate': 1, 'scrutin': 1, 'panne': 1, 'envergure': 1, 'machine': 2, 'état': 2, 'média': 1, 'problème': 2, 'technique': 1, 'comté': 4, 'new': 1, 'jersey': 1, 'maricopa': 3, 'fraude': 1, 'autorité': 3, 'électeur': 1, 'bulletin': 2, 'boîte': 1, 'sécuriser': 1, 'place': 1, 'défaillance': 1, 'responsable': 1, 'électoral': 1, 'raison': 1, 'impression': 1, 'numérisation': 1, 'compté': 1, 'professionnel': 1, 'informatique': 1, 'bombeen': 1, 'louisiane': 1, 'école': 1, 'cause': 1, 'alerte': 1, 'bombe': 1, 'local': 1, 'police': 1, 'établissement': 1, 'menace': 1, 'similaire': 1, 'jour': 1, 'élève': 1}","{'États-Unis': 1, 'États': 1, 'Mercer': 1, 'New Jersey': 1, 'Maricopa': 3, 'comté de Mercer': 1, 'État de la Louisiane': 1}","{'Républicains': 1, 'Démocrates': 1, 'NBC News': 1}",{},2022,11,7
