timestamp,url,title,description,content,content-segmented,kws-l,loc-l,org-l,per-l,kws,loc,org,per,year,month,day
1662760800,https://fr.sputniknews.africa/20220910/lue-exhorte-la-serbie-a-se-positionner-face-a-la-russie-assure-vucic-1056133644.html,"L’UE exhorte la Serbie à se positionner face à la Russie, assure Vucic","Selon le Président serbe Aleksandar Vucic, l'UE, l'Allemagne et la France croient que ""Poutine a levé le rideau et qu'il reste maintenant à chacun de décider de quel côté il sera"". Depuis le début du conflit en Ukraine, la Serbie a...","L’UE continue de faire pression sur la Serbie concernant ses relations avec la Russie. Se prononçant le 10 septembre Aleksandar Vucic a déclaré que les représentants de l'UE, de l'Allemagne et de la France avaient soulevé lors de leur dernière rencontre la question de la détermination de Belgrade vis-à-vis de Moscou.""Ils croient que Poutine a levé le rideau et qu'il reste maintenant à chacun de décider de quel côté il sera - du côté où l'économie disparaît et n'existe pas, ou du côté du succès où ils se trouvent"", a raconté le Président serbe.Pas de sanctions malgré les pressions de l’UEDepuis le début du conflit en Ukraine, la Serbie a toujours refusé de s’aligner sur les sanctions occidentales. Bruxelles a pourtant sermonné plusieurs fois Belgrade, qui attend depuis plusieurs années dans l’antichambre européenne en vue d’une adhésion.Fin août Aleksandar Vucic a affirmé que la Serbie n'entendait pas changer sa position sur les sanctions antirusses.Belgrade continue notamment d’acheter des hydrocarbures à Moscou et a même renouvelé fin mai ses contrats sur le gaz russe pour trois ans.","[[['L’UE continue de faire pression sur la Serbie concernant ses relations avec la Russie.'], [""Se prononçant le 10 septembre Aleksandar Vucic a déclaré que les représentants de l'UE, de l'Allemagne et de la France avaient soulevé lors de leur dernière rencontre la question de la détermination de Belgrade vis-à-vis de Moscou.""], ['""Ils croient que Poutine a levé le rideau et qu\'il reste maintenant à chacun de décider de quel côté il sera - du côté où l\'économie disparaît et n\'existe pas, ou du côté du succès où ils se trouvent"", a raconté le Président serbe.Pas de sanctions malgré les pressions de l’UEDepuis le début du conflit en Ukraine, la Serbie a toujours refusé de s’aligner sur les sanctions occidentales.'], [""Bruxelles a pourtant sermonné plusieurs fois Belgrade, qui attend depuis plusieurs années dans l’antichambre européenne en vue d’une adhésion.Fin août Aleksandar Vucic a affirmé que la Serbie n'entendait pas changer sa position sur les sanctions antirusses.Belgrade continue notamment d’acheter des hydrocarbures à Moscou et a même renouvelé fin mai ses contrats sur le gaz russe pour trois ans.""]]]","[[['ue', 'pression', 'serbie', 'relations', 'russie'], ['septembre', 'aleksandar', 'vucic', 'représentants', 'ue', 'allemagne', 'france', 'dernière', 'question', 'détermination', 'belgrade', 'moscou'], ['poutine', 'rideau', 'côté', 'côté', 'économie', 'côté', 'succès', 'président', 'sanctions', 'pressions', 'uedepuis', 'début', 'conflit', 'ukraine', 'serbie', 'sanctions', 'occidentales'], ['bruxelles', 'fois', 'belgrade', 'années', 'antichambre', 'européenne', 'vue', 'août', 'aleksandar', 'vucic', 'serbie', 'position', 'sanctions', 'hydrocarbures', 'moscou', 'fin', 'mai', 'contrats', 'gaz', 'russe', 'ans']]]","[[['Serbie', 'Russie'], ['Allemagne', 'France', 'Belgrade', 'Moscou'], ['Ukraine', 'Serbie'], ['Bruxelles', 'Belgrade', 'Serbie', 'Belgrade', 'Moscou']]]","[[['UE'], ['UE'], [], []]]","[[[], ['Aleksandar Vucic'], ['Poutine', 'Président serbe'], ['Aleksandar Vucic']]]","{'ue': 2, 'pression': 1, 'serbie': 3, 'relations': 1, 'russie': 1, 'septembre': 1, 'aleksandar': 2, 'vucic': 2, 'représentants': 1, 'allemagne': 1, 'france': 1, 'dernière': 1, 'question': 1, 'détermination': 1, 'belgrade': 2, 'moscou': 2, 'poutine': 1, 'rideau': 1, 'côté': 3, 'économie': 1, 'succès': 1, 'président': 1, 'sanctions': 3, 'pressions': 1, 'uedepuis': 1, 'début': 1, 'conflit': 1, 'ukraine': 1, 'occidentales': 1, 'bruxelles': 1, 'fois': 1, 'années': 1, 'antichambre': 1, 'européenne': 1, 'vue': 1, 'août': 1, 'position': 1, 'hydrocarbures': 1, 'fin': 1, 'mai': 1, 'contrats': 1, 'gaz': 1, 'russe': 1, 'ans': 1}","{'Serbie': 3, 'Russie': 1, 'Allemagne': 1, 'France': 1, 'Belgrade': 3, 'Moscou': 2, 'Ukraine': 1, 'Bruxelles': 1}",{'UE': 2},"{'Aleksandar Vucic': 2, 'Poutine': 1, 'Président serbe': 1}",2022,9,9
1662760800,https://fr.sputniknews.africa/20220910/la-defense-russe-actualise-le-bilan-de-son-operation-militaire-en-ukraine-1056138677.html,Le bilan de l'opération militaire en Ukraine actualisé par l'armée russe,"Lors des dernières 24 heures de son opération militaire en Ukraine, l’armée russe a neutralisé 300 militaires ukrainiens dont des nationalistes. Parmi les équipements militaires figurent 13 drones, cinq obus HIMARS et un obusier américain...","En 24 heures, la Russie a utilisé des armes de haute précision contre les troupes de Kiev, a indiqué ce 10 septembre la Défense russe.Environ 300 militaires ukrainiens, dont des membres du groupe nationaliste Kraken ont été éliminés.De plus, 13 drones ukrainiens ont été abattus et cinq obus de lance-roquettes multiples HIMARS ont été interceptés.Sept batteries ukrainiennes d’artillerie et un obusier M777 de 155 mm de production américaine ont été détruits en République populaire de Donetsk (RPD), ainsi que sept postes de commandements, 48 détachements d’artillerie et six entrepôts de munitions dans la région de Zaporojié. Une station radar a été mise hors service dans la région de Nikolaïev.Regroupement des troupesLa Défense russe a aussi déclaré avoir regroupé certaines de ses forces en direction de la RPD au cours de ces trois derniers jours, en se retirant de la zone de Balakleïa et d’Izioum. Cela pour concentrer ses efforts à libérer le Donbass. Diverses manœuvres de diversion ont aussi été employées.Depuis le début de l’opération militaire en Ukraine, l’armée russe a abattu 293 avions, 152 hélicoptères, 1.929 drones, 374 systèmes de défense antiaérienne, 4.870 chars et autres véhicules blindés, 830 véhicules de lance-roquettes multiples, 3.375 équipements d’artillerie de terrain et de mortiers, ainsi que 5.432 unités de véhicules militaires.","[[['En 24 heures, la Russie a utilisé des armes de haute précision contre les troupes de Kiev, a indiqué ce 10 septembre la Défense russe.Environ 300 militaires ukrainiens, dont des membres du groupe nationaliste Kraken ont été éliminés.De plus, 13 drones ukrainiens ont été abattus et cinq obus de lance-roquettes multiples HIMARS ont été interceptés.Sept batteries ukrainiennes d’artillerie et un obusier M777 de 155 mm de production américaine ont été détruits en République populaire de Donetsk (RPD), ainsi que sept postes de commandements, 48 détachements d’artillerie et six entrepôts de munitions dans la région de Zaporojié.'], ['Une station radar a été mise hors service dans la région de Nikolaïev.Regroupement des troupesLa Défense russe a aussi déclaré avoir regroupé certaines de ses forces en direction de la RPD au cours de ces trois derniers jours, en se retirant de la zone de Balakleïa et d’Izioum.'], ['Cela pour concentrer ses efforts à libérer le Donbass.'], ['Diverses manœuvres de diversion ont aussi été employées.Depuis le début de l’opération militaire en Ukraine, l’armée russe a abattu 293 avions, 152 hélicoptères, 1.929 drones, 374 systèmes de défense antiaérienne, 4.870 chars et autres véhicules blindés, 830 véhicules de lance-roquettes multiples, 3.375 équipements d’artillerie de terrain et de mortiers, ainsi que 5.432 unités de véhicules militaires.']]]","[[['heures', 'russie', 'armes', 'haute', 'précision', 'troupes', 'kiev', 'septembre', 'défense', 'militaires', 'ukrainiens', 'membres', 'groupe', 'nationaliste', 'kraken', 'drones', 'ukrainiens', 'obus', 'lance', 'roquettes', 'multiples', 'himars', 'batteries', 'ukrainiennes', 'artillerie', 'obusier', 'mm', 'production', 'américaine', 'république', 'populaire', 'donetsk', 'rpd', 'postes', 'commandements', 'détachements', 'artillerie', 'entrepôts', 'munitions', 'région', 'zaporojié'], ['station', 'radar', 'service', 'région', 'troupesla', 'défense', 'russe', 'forces', 'direction', 'rpd', 'cours', 'derniers', 'jours', 'zone', 'balakleïa'], ['efforts', 'donbass'], ['manœuvres', 'diversion', 'début', 'opération', 'militaire', 'ukraine', 'armée', 'russe', 'avions', 'hélicoptères', 'drones', 'systèmes', 'défense', 'antiaérienne', 'chars', 'véhicules', 'blindés', 'véhicules', 'lance', 'roquettes', 'multiples', 'équipements', 'artillerie', 'terrain', 'mortiers', 'unités', 'véhicules', 'militaires']]]","[[['Russie', 'Kiev', 'Défense russe', 'République populaire de Donetsk', 'RPD', 'Zaporojié'], ['Nikolaïev', 'troupesLa Défense russe', 'Balakleïa'], ['Donbass'], ['Ukraine']]]","[[[], [], [], []]]","[[['Kraken'], ['Izioum'], [], []]]","{'heures': 1, 'russie': 1, 'armes': 1, 'haute': 1, 'précision': 1, 'troupes': 1, 'kiev': 1, 'septembre': 1, 'défense': 3, 'militaires': 2, 'ukrainiens': 2, 'membres': 1, 'groupe': 1, 'nationaliste': 1, 'kraken': 1, 'drones': 2, 'obus': 1, 'lance': 2, 'roquettes': 2, 'multiples': 2, 'himars': 1, 'batteries': 1, 'ukrainiennes': 1, 'artillerie': 3, 'obusier': 1, 'mm': 1, 'production': 1, 'américaine': 1, 'république': 1, 'populaire': 1, 'donetsk': 1, 'rpd': 2, 'postes': 1, 'commandements': 1, 'détachements': 1, 'entrepôts': 1, 'munitions': 1, 'région': 2, 'zaporojié': 1, 'station': 1, 'radar': 1, 'service': 1, 'troupesla': 1, 'russe': 2, 'forces': 1, 'direction': 1, 'cours': 1, 'derniers': 1, 'jours': 1, 'zone': 1, 'balakleïa': 1, 'efforts': 1, 'donbass': 1, 'manœuvres': 1, 'diversion': 1, 'début': 1, 'opération': 1, 'militaire': 1, 'ukraine': 1, 'armée': 1, 'avions': 1, 'hélicoptères': 1, 'systèmes': 1, 'antiaérienne': 1, 'chars': 1, 'véhicules': 3, 'blindés': 1, 'équipements': 1, 'terrain': 1, 'mortiers': 1, 'unités': 1}","{'Russie': 1, 'Kiev': 1, 'Défense russe': 1, 'République populaire de Donetsk': 1, 'RPD': 1, 'Zaporojié': 1, 'Nikolaïev': 1, 'troupesLa Défense russe': 1, 'Balakleïa': 1, 'Donbass': 1, 'Ukraine': 1}",{},"{'Kraken': 1, 'Izioum': 1}",2022,9,9
1662760800,https://fr.sputniknews.africa/20220910/lunion-africaine-choisit-ces-3-objectifs-pour-les-10-prochaines-annees-1056139450.html,L’Union africaine choisit ces 3 objectifs pour les 10 prochaines années,"Pour mettre en œuvre son second Plan décennal, l’Union africaine se concentrera sur trois objectifs majeurs: la construction de routes et d’infrastructures de communication, l’augmentation de la production agricole et la transition...","Le président de la Commission de l’Union africaine (UA), Moussa Faki Mahamat, a présenté сe vendredi 9 septembre le second Plan décennal de la mise en œuvre de l’Agenda 2063.""Le plan s’articulera autour de trois objectifs principaux: assurer une plus grande connectivité physique du continent par la construction de routes et d’autres infrastructures de communication, établir les conditions d’une production agricole continentale suffisante pour réduire les importations de denrées alimentaires et renforcer les capacités techniques pour que la transition énergétique puisse réussir"", a-t-il déclaré.M.Mahamat a ajouté que pour atteindre ces objectifs, les pays africains sont invités à ""mobiliser toutes les ressources intellectuelles, financières et matérielles"", ainsi qu’à ""être créatif, inventif et surtout audacieux"".La déclaration a été faite au siège de l’UA à Addis-Abeba à l’occasion du 23e anniversaire de l’adoption de la Déclaration de Syrte de 1999 visant à créer l’union.Agenda 2063 et ses cinq plans décennauxSelon l’UA, l’Agenda 2063 est ""le cadre stratégique du continent qui vise à atteindre son objectif de développement inclusif et durable"" en 50 ans.Il a été adopté par les chefs d’État et de gouvernement africains en 2013 et prévoit la mise en œuvre de cinq plans décennaux, dont le premier couvre la période 2013-2023 et le second débutera l’année prochaine.Pour chaque décennie, ces plans identifient les domaines prioritaires et des objectifs spécifiques, définissent les stratégies comme les mesures politiques nécessaires à leur réalisation et fournissent des informations à tous les acteurs clés aux niveaux national, régional et continental.","[[['Le président de la Commission de l’Union africaine (UA), Moussa Faki Mahamat, a présenté сe vendredi 9 septembre le second Plan décennal de la mise en œuvre de l’Agenda 2063.'], ['""Le plan s’articulera autour de trois objectifs principaux: assurer une plus grande connectivité physique du continent par la construction de routes et d’autres infrastructures de communication, établir les conditions d’une production agricole continentale suffisante pour réduire les importations de denrées alimentaires et renforcer les capacités techniques pour que la transition énergétique puisse réussir"", a-t-il déclaré.M.Mahamat a ajouté que pour atteindre ces objectifs, les pays africains sont invités à ""mobiliser toutes les ressources intellectuelles, financières et matérielles"", ainsi qu’à ""être créatif, inventif et surtout audacieux"".La déclaration a été faite au siège de l’UA à Addis-Abeba à l’occasion du 23e anniversaire de l’adoption de la Déclaration de Syrte de 1999 visant à créer l’union.Agenda 2063 et ses cinq plans décennauxSelon l’UA, l’Agenda 2063 est ""le cadre stratégique du continent qui vise à atteindre son objectif de développement inclusif et durable"" en 50 ans.Il a été adopté par les chefs d’État et de gouvernement africains en 2013 et prévoit la mise en œuvre de cinq plans décennaux, dont le premier couvre la période 2013-2023 et le second débutera l’année prochaine.Pour chaque décennie, ces plans identifient les domaines prioritaires et des objectifs spécifiques, définissent les stratégies comme les mesures politiques nécessaires à leur réalisation et fournissent des informations à tous les acteurs clés aux niveaux national, régional et continental.']]]","[[['président', 'commission', 'union', 'africaine', 'ua', 'faki', 'mahamat', 'vendredi', 'septembre', 'second', 'plan', 'décennal', 'mise', 'œuvre', 'agenda'], ['plan', 'objectifs', 'principaux', 'grande', 'connectivité', 'physique', 'continent', 'construction', 'routes', 'infrastructures', 'communication', 'conditions', 'production', 'agricole', 'continentale', 'importations', 'denrées', 'alimentaires', 'capacités', 'techniques', 'transition', 'énergétique', 'objectifs', 'pays', 'africains', 'ressources', 'intellectuelles', 'financières', 'matérielles', 'créatif', 'inventif', 'déclaration', 'siège', 'ua', 'addis', 'occasion', 'anniversaire', 'adoption', 'déclaration', 'syrte', 'plans', 'ua', 'agenda', 'cadre', 'stratégique', 'continent', 'objectif', 'développement', 'inclusif', 'durable', 'chefs', 'état', 'gouvernement', 'africains', 'mise', 'œuvre', 'plans', 'décennaux', 'période', 'second', 'année', 'décennie', 'plans', 'domaines', 'prioritaires', 'objectifs', 'stratégies', 'mesures', 'politiques', 'nécessaires', 'réalisation', 'informations', 'acteurs', 'clés', 'niveaux', 'national', 'régional', 'continental']]]","[[[], ['Addis-Abeba', 'État']]]","[[['Commission de l’Union africaine'], ['UA']]]","[[['Moussa Faki Mahamat'], []]]","{'président': 1, 'commission': 1, 'union': 1, 'africaine': 1, 'ua': 3, 'faki': 1, 'mahamat': 1, 'vendredi': 1, 'septembre': 1, 'second': 2, 'plan': 2, 'décennal': 1, 'mise': 2, 'œuvre': 2, 'agenda': 2, 'objectifs': 3, 'principaux': 1, 'grande': 1, 'connectivité': 1, 'physique': 1, 'continent': 2, 'construction': 1, 'routes': 1, 'infrastructures': 1, 'communication': 1, 'conditions': 1, 'production': 1, 'agricole': 1, 'continentale': 1, 'importations': 1, 'denrées': 1, 'alimentaires': 1, 'capacités': 1, 'techniques': 1, 'transition': 1, 'énergétique': 1, 'pays': 1, 'africains': 2, 'ressources': 1, 'intellectuelles': 1, 'financières': 1, 'matérielles': 1, 'créatif': 1, 'inventif': 1, 'déclaration': 2, 'siège': 1, 'addis': 1, 'occasion': 1, 'anniversaire': 1, 'adoption': 1, 'syrte': 1, 'plans': 3, 'cadre': 1, 'stratégique': 1, 'objectif': 1, 'développement': 1, 'inclusif': 1, 'durable': 1, 'chefs': 1, 'état': 1, 'gouvernement': 1, 'décennaux': 1, 'période': 1, 'année': 1, 'décennie': 1, 'domaines': 1, 'prioritaires': 1, 'stratégies': 1, 'mesures': 1, 'politiques': 1, 'nécessaires': 1, 'réalisation': 1, 'informations': 1, 'acteurs': 1, 'clés': 1, 'niveaux': 1, 'national': 1, 'régional': 1, 'continental': 1}","{'Addis-Abeba': 1, 'État': 1}","{'Commission de l’Union africaine': 1, 'UA': 1}",{'Moussa Faki Mahamat': 1},2022,9,9
1662760800,https://fr.sputniknews.africa/20220910/mort-de-28-enfants-en-gambie-les-autorites-sanitaires-soupconnent-un-medicament-1056131992.html,Mort de 28 enfants en Gambie: les autorités sanitaires soupçonnent un médicament,"""Nous avons des preuves cliniques pour soupçonner que le sirop de paracétamol pourrait être l'une des causes de l'épidémie"", a déclaré le directeur des services de santé.","Les autorités sanitaires gambiennes ont lancé une enquête sur la mort récente de 28 enfants pour insuffisance rénale aiguë et demandé aux hôpitaux et aux cliniques de ne plus utiliser du sirop de paracétamol, a indiqué, vendredi, un responsable du ministère de la santé.La bactérie E. coli a aussi été citée comme une cause possible des décès par Mustapha Bittaye, directeur des services de santé dans une lettre envoyée cette semaine aux directeurs régionaux de santé du pays, aux directeurs généraux des hôpitaux et aux responsables des cliniques, selon des médias.M. Bittaye, cité par des médias, a recommandé aux responsables de santé d'encourager le lavage des mains dans leurs cliniques et substituer le sirop incriminé par des comprimés de paracétamol.""Nous avons des preuves cliniques pour soupçonner que le sirop de paracétamol pourrait être l'une des causes de l'épidémie (...) Pour l'instant nous déconseillons le sirop de paracétamol jusqu'à ce que nous finalisions l'enquête, a déclaré M. Bittaye.Au moins 28 enfants sont décédés d'une insuffisance rénale aiguë (IRA) après une soudaine augmentation des cas d'IRA chez les enfants"" âgés de cinq mois à quatre ans, avait indiqué le ministère de la Santé dans un rapport du 8 août, sans préciser la date des décès.Une enquête sur cette affaire a été ouverte le 19 juillet.","[[['Les autorités sanitaires gambiennes ont lancé une enquête sur la mort récente de 28 enfants pour insuffisance rénale aiguë et demandé aux hôpitaux et aux cliniques de ne plus utiliser du sirop de paracétamol, a indiqué, vendredi, un responsable du ministère de la santé.La bactérie E. coli a aussi été citée comme une cause possible des décès par Mustapha Bittaye, directeur des services de santé dans une lettre envoyée cette semaine aux directeurs régionaux de santé du pays, aux directeurs généraux des hôpitaux et aux responsables des cliniques, selon des médias.M.'], [""Bittaye, cité par des médias, a recommandé aux responsables de santé d'encourager le lavage des mains dans leurs cliniques et substituer le sirop incriminé par des comprimés de paracétamol.""], ['""Nous avons des preuves cliniques pour soupçonner que le sirop de paracétamol pourrait être l\'une des causes de l\'épidémie (...) Pour l\'instant nous déconseillons le sirop de paracétamol jusqu\'à ce que nous finalisions l\'enquête, a déclaré M. Bittaye.Au moins 28 enfants sont décédés d\'une insuffisance rénale aiguë (IRA) après une soudaine augmentation des cas d\'IRA chez les enfants"" âgés de cinq mois à quatre ans, avait indiqué le ministère de la Santé dans un rapport du 8 août, sans préciser la date des décès.Une enquête sur cette affaire a été ouverte le 19 juillet.']]]","[[['autorités', 'sanitaires', 'gambiennes', 'enquête', 'mort', 'récente', 'enfants', 'insuffisance', 'rénale', 'aiguë', 'hôpitaux', 'cliniques', 'sirop', 'paracétamol', 'vendredi', 'responsable', 'ministère', 'bactérie', 'coli', 'cause', 'décès', 'mustapha', 'bittaye', 'directeur', 'services', 'santé', 'lettre', 'semaine', 'directeurs', 'régionaux', 'santé', 'pays', 'directeurs', 'généraux', 'hôpitaux', 'responsables', 'cliniques'], ['bittaye', 'cité', 'médias', 'responsables', 'santé', 'lavage', 'mains', 'cliniques', 'sirop', 'comprimés', 'paracétamol'], ['preuves', 'cliniques', 'sirop', 'paracétamol', 'causes', 'épidémie', 'instant', 'sirop', 'paracétamol', 'enquête', 'enfants', 'insuffisance', 'rénale', 'aiguë', 'soudaine', 'augmentation', 'cas', 'enfants', 'âgés', 'mois', 'ans', 'ministère', 'santé', 'rapport', 'août', 'date', 'enquête', 'affaire', 'juillet']]]","[[[], ['Bittaye'], []]]","[[[], [], ['IRA', 'IRA', 'ministère de la Santé']]]","[[['Mustapha Bittaye'], [], ['M. Bittaye']]]","{'autorités': 1, 'sanitaires': 1, 'gambiennes': 1, 'enquête': 3, 'mort': 1, 'récente': 1, 'enfants': 3, 'insuffisance': 2, 'rénale': 2, 'aiguë': 2, 'hôpitaux': 2, 'cliniques': 4, 'sirop': 4, 'paracétamol': 4, 'vendredi': 1, 'responsable': 1, 'ministère': 2, 'bactérie': 1, 'coli': 1, 'cause': 1, 'décès': 1, 'mustapha': 1, 'bittaye': 2, 'directeur': 1, 'services': 1, 'santé': 4, 'lettre': 1, 'semaine': 1, 'directeurs': 2, 'régionaux': 1, 'pays': 1, 'généraux': 1, 'responsables': 2, 'cité': 1, 'médias': 1, 'lavage': 1, 'mains': 1, 'comprimés': 1, 'preuves': 1, 'causes': 1, 'épidémie': 1, 'instant': 1, 'soudaine': 1, 'augmentation': 1, 'cas': 1, 'âgés': 1, 'mois': 1, 'ans': 1, 'rapport': 1, 'août': 1, 'date': 1, 'affaire': 1, 'juillet': 1}",{'Bittaye': 1},"{'IRA': 2, 'ministère de la Santé': 1}","{'Mustapha Bittaye': 1, 'M. Bittaye': 1}",2022,9,9
1662760800,https://fr.sputniknews.africa/20220910/quand-une-brebis-et-un-ane-volent-ton-petit-dej--1056134271.html,Quand une brebis et un âne volent ton petit-déj - vidéo,"La préparation d’un repas s’est terminée par un échec pour cet homme. La vidéo a été récemment diffusée sur Telegram. À en juger par l’émoji dans le poste, les faits se sont déroulés en Tunisie.","En cuisinant son petit-déjeuner sur un feu, l’homme, supposément un berger, ne s’attendait pas à ce qu’il soit volé.Toutefois, à un moment donné, une brebis a couru vers lui et a attrapé un morceau. Mais dès que l’homme l’a poursuivie, un âne a également décidé de se régaler. L’homme a ensuite essayé de le chasser mais il ne l’a pas laissé s’approcher de lui en ruant.Le destin du repas reste inconnu bien qu’il n’est pas difficile de l’imaginer.","[[['En cuisinant son petit-déjeuner sur un feu, l’homme, supposément un berger, ne s’attendait pas à ce qu’il soit volé.Toutefois, à un moment donné, une brebis a couru vers lui et a attrapé un morceau.'], ['Mais dès que l’homme l’a poursuivie, un âne a également décidé de se régaler.'], ['L’homme a ensuite essayé de le chasser mais il ne l’a pas laissé s’approcher de lui en ruant.Le destin du repas reste inconnu bien qu’il n’est pas difficile de l’imaginer.']]]","[[['feu', 'homme', 'berger', 'moment', 'brebis', 'morceau'], ['homme', 'âne'], ['homme', 'destin', 'repas', 'inconnu', 'difficile']]]","[[[], [], []]]","[[[], [], []]]","[[[], [], []]]","{'feu': 1, 'homme': 3, 'berger': 1, 'moment': 1, 'brebis': 1, 'morceau': 1, 'âne': 1, 'destin': 1, 'repas': 1, 'inconnu': 1, 'difficile': 1}",{},{},{},2022,9,9
