timestamp,url,title,description,content,content-segmented,kws-l,loc-l,org-l,per-l,kws,loc,org,per,year,month,day
1662760800,https://fr.sputniknews.africa/20220910/viols-a-lhopital-de-nanterre-un-suspect-mis-en-examen-1056140031.html,Viols à l'hôpital de Nanterre: un suspect mis en examen,"Soupçonné d'avoir violé fin juillet deux patientes de l'hôpital de Nanterre, situé près de la capitale française, et une adolescente de 12 ans quelques jours plus tard, un homme a été mis en examen et écroué.","Un homme soupçonné d'avoir violé fin juillet deux patientes de l'hôpital de Nanterre, puis une fillette deux jours plus tard dans un autre quartier de la ville, a été mis en examen et écroué samedi, selon le parquet de Nanterre sollicité par l'AFP.Le suspect, interpellé vendredi, puis placé en garde à vue dans les locaux de la police judiciaire de Nanterre, a été mis en examen samedi par un juge d'instruction, pour viol sur personne vulnérable et pour viol sur mineur de 15 ans.Il a ensuite été placé en détention provisoire tard dans la soirée.D'après le journal Le Parisien, qui avait révélé son interpellation, l'homme âgé de 27 ans, est de nationalité congolaise et sans domicile fixe.Il est soupçonné d'avoir violé deux patientes, âgées de 78 ans et de 70 ans, au sein de l'hôpital Max-Fourestier dans la matinée du 27 juillet, à trente minutes d'intervalle. Puis deux jours plus tard, une fillette de 12 ans dans le quartier Zilina-Chemin.A la suite des viols, l'hôpital de Nanterre avait assuré à l'AFP avoir pris ""des mesures complémentaires de sécurité"", notamment ""un renforcement des contrôles à l'entrée de l'hôpital"" et ""des rondes plus fréquentes des agents de sécurité"".","[[[""Un homme soupçonné d'avoir violé fin juillet deux patientes de l'hôpital de Nanterre, puis une fillette deux jours plus tard dans un autre quartier de la ville, a été mis en examen et écroué samedi, selon le parquet de Nanterre sollicité par l'AFP.Le suspect, interpellé vendredi, puis placé en garde à vue dans les locaux de la police judiciaire de Nanterre, a été mis en examen samedi par un juge d'instruction, pour viol sur personne vulnérable et pour viol sur mineur de 15 ans.Il a ensuite été placé en détention provisoire tard dans la soirée.D'après le journal Le Parisien, qui avait révélé son interpellation, l'homme âgé de 27 ans, est de nationalité congolaise et sans domicile fixe.Il est soupçonné d'avoir violé deux patientes, âgées de 78 ans et de 70 ans, au sein de l'hôpital Max-Fourestier dans la matinée du 27 juillet, à trente minutes d'intervalle.""], ['Puis deux jours plus tard, une fillette de 12 ans dans le quartier Zilina-Chemin.A la suite des viols, l\'hôpital de Nanterre avait assuré à l\'AFP avoir pris ""des mesures complémentaires de sécurité"", notamment ""un renforcement des contrôles à l\'entrée de l\'hôpital"" et ""des rondes plus fréquentes des agents de sécurité"".']]]","[[['homme', 'fin', 'juillet', 'patientes', 'hôpital', 'nanterre', 'fillette', 'jours', 'quartier', 'ville', 'examen', 'samedi', 'parquet', 'nanterre', 'suspect', 'vendredi', 'garde', 'vue', 'locaux', 'police', 'judiciaire', 'nanterre', 'examen', 'samedi', 'juge', 'instruction', 'viol', 'vulnérable', 'viol', 'mineur', 'détention', 'provisoire', 'journal', 'parisien', 'interpellation', 'homme', 'âgé', 'ans', 'nationalité', 'congolaise', 'domicile', 'patientes', 'âgées', 'ans', 'ans', 'sein', 'hôpital', 'max', 'fourestier', 'matinée', 'juillet', 'minutes', 'intervalle'], ['jours', 'fillette', 'ans', 'quartier', 'zilina', 'suite', 'viols', 'hôpital', 'nanterre', 'afp', 'mesures', 'complémentaires', 'sécurité', 'renforcement', 'contrôles', 'entrée', 'hôpital', 'rondes', 'fréquentes', 'agents', 'sécurité']]]","[[['hôpital de Nanterre', 'Nanterre', 'AFP.Le', 'Nanterre', 'hôpital Max-Fourestier'], ['Zilina-Chemin', 'hôpital de Nanterre']]]","[[['Parisien'], ['AFP']]]","[[[], []]]","{'homme': 2, 'fin': 1, 'juillet': 2, 'patientes': 2, 'hôpital': 4, 'nanterre': 4, 'fillette': 2, 'jours': 2, 'quartier': 2, 'ville': 1, 'examen': 2, 'samedi': 2, 'parquet': 1, 'suspect': 1, 'vendredi': 1, 'garde': 1, 'vue': 1, 'locaux': 1, 'police': 1, 'judiciaire': 1, 'juge': 1, 'instruction': 1, 'viol': 2, 'vulnérable': 1, 'mineur': 1, 'détention': 1, 'provisoire': 1, 'journal': 1, 'parisien': 1, 'interpellation': 1, 'âgé': 1, 'ans': 4, 'nationalité': 1, 'congolaise': 1, 'domicile': 1, 'âgées': 1, 'sein': 1, 'max': 1, 'fourestier': 1, 'matinée': 1, 'minutes': 1, 'intervalle': 1, 'zilina': 1, 'suite': 1, 'viols': 1, 'afp': 1, 'mesures': 1, 'complémentaires': 1, 'sécurité': 2, 'renforcement': 1, 'contrôles': 1, 'entrée': 1, 'rondes': 1, 'fréquentes': 1, 'agents': 1}","{'hôpital de Nanterre': 2, 'Nanterre': 2, 'AFP.Le': 1, 'hôpital Max-Fourestier': 1, 'Zilina-Chemin': 1}","{'Parisien': 1, 'AFP': 1}",{},2022,9,9
1662760800,https://fr.sputniknews.africa/20220910/un-ministre-tcheque-admet-que-la-hongrie-pourrait-quitter-lue--1056132390.html,Un ministre tchèque admet que la Hongrie pourrait quitter l'UE,"Le ministre tchèque des Affaires européennes a supposé que la Hongrie pourrait quitter l'UE à cause de sa position concernant la Russie. Il envisage de ""retenir"" Budapest ""dans le courant européen"".","La position du gouvernement hongrois sur les relations avec la Russie qui diffère de celle des autres membres du bloc, peut conduire à une sortie de l'Union européenne. Cette supposition a été émise sur la radio Český rozhlas Plus le 8 septembre par le ministre tchèque des Affaires européennes, Mikuláš Bek.""L'Union européenne négocie souvent durement et de nombreux pays peuvent le faire. Mais la Hongrie a parcouru un long chemin, à mon avis jusqu'au bord d'un précipice, et elle doit maintenant décider si elle doit revenir en arrière ou risquer un saut dont je ne veux pas spéculer sur les conséquences"", a-t-il dit.Le ministre a précisé que, théoriquement, il pourrait s'agir de la sortie de l'Union européenne.M.Bek prévoit de travailler dur dans les mois à venir pour que Budapest reste ""dans le courant européen"".Une question ""controversée""Les pays européens font face à la flambée des prix sur l’énergie. Réunis le 9 septembre, les ministres de l'Énergie se sont dits favorables à une série de mesures d'urgence pour enrayer la hausse des factures.Cependant, ils n’ont pas réussi à se mettre d’accord sur le plafonnement du prix du gaz russe, une mesure soutenue par seulement trois États membres sur les 27.La Hongrie a affiché son opposition à cette ""nouvelle sanction déguisée"" susceptible de causer une ""pénurie"". En outre, le ministre hongrois des Affaires étrangères, Peter Szijjarto, a déclaré le 9 septembre que l’initiative visant à instaurer ce plafonnement était ""absurde"" car elle rendait plus cher le gaz.Moscou a menacé de cesser ses livraisons si un tel mécanisme était appliqué.","[[[""La position du gouvernement hongrois sur les relations avec la Russie qui diffère de celle des autres membres du bloc, peut conduire à une sortie de l'Union européenne.""], ['Cette supposition a été émise sur la radio Český rozhlas Plus le 8 septembre par le ministre tchèque des Affaires européennes, Mikuláš Bek.'], ['""L\'Union européenne négocie souvent durement et de nombreux pays peuvent le faire.'], ['Mais la Hongrie a parcouru un long chemin, à mon avis jusqu\'au bord d\'un précipice, et elle doit maintenant décider si elle doit revenir en arrière ou risquer un saut dont je ne veux pas spéculer sur les conséquences"", a-t-il dit.Le ministre a précisé que, théoriquement, il pourrait s\'agir de la sortie de l\'Union européenne.M.Bek prévoit de travailler dur dans les mois à venir pour que Budapest reste ""dans le courant européen"".Une question ""controversée""Les pays européens font face à la flambée des prix sur l’énergie.'], ['Réunis le 9 septembre, les ministres de l\'Énergie se sont dits favorables à une série de mesures d\'urgence pour enrayer la hausse des factures.Cependant, ils n’ont pas réussi à se mettre d’accord sur le plafonnement du prix du gaz russe, une mesure soutenue par seulement trois États membres sur les 27.La Hongrie a affiché son opposition à cette ""nouvelle sanction déguisée"" susceptible de causer une ""pénurie"".'], ['En outre, le ministre hongrois des Affaires étrangères, Peter Szijjarto, a déclaré le 9 septembre que l’initiative visant à instaurer ce plafonnement était ""absurde"" car elle rendait plus cher le gaz.Moscou a menacé de cesser ses livraisons si un tel mécanisme était appliqué.']]]","[[['position', 'gouvernement', 'hongrois', 'relations', 'russie', 'membres', 'bloc', 'sortie', 'union', 'européenne'], ['supposition', 'radio', 'český', 'rozhlas', 'septembre', 'ministre', 'tchèque', 'affaires', 'européennes', 'mikuláš', 'bek'], ['union', 'européenne', 'pays'], ['hongrie', 'long', 'chemin', 'avis', 'bord', 'précipice', 'arrière', 'saut', 'conséquences', 'ministre', 'sortie', 'union', 'dur', 'mois', 'budapest', 'courant', 'question', 'pays', 'européens', 'face', 'flambée', 'prix', 'énergie'], ['septembre', 'ministres', 'énergie', 'favorables', 'série', 'mesures', 'urgence', 'hausse', 'accord', 'plafonnement', 'prix', 'gaz', 'russe', 'mesure', 'états', 'membres', 'hongrie', 'opposition', 'nouvelle', 'sanction', 'déguisée', 'susceptible', 'pénurie'], ['ministre', 'hongrois', 'affaires', 'étrangères', 'szijjarto', 'septembre', 'initiative', 'plafonnement', 'absurde', 'cher', 'livraisons', 'mécanisme']]]","[[['Russie'], [], [], ['Hongrie', 'Budapest'], ['Réunis', 'États', 'Hongrie'], ['Moscou']]]","[[['Union européenne'], ['ministre tchèque des Affaires européennes'], ['Union européenne'], ['Union européenne'], ['Énergie'], ['ministre hongrois des Affaires étrangères']]]","[[[], ['Mikuláš Bek'], [], [], [], ['Peter Szijjarto']]]","{'position': 1, 'gouvernement': 1, 'hongrois': 2, 'relations': 1, 'russie': 1, 'membres': 2, 'bloc': 1, 'sortie': 2, 'union': 3, 'européenne': 2, 'supposition': 1, 'radio': 1, 'český': 1, 'rozhlas': 1, 'septembre': 3, 'ministre': 3, 'tchèque': 1, 'affaires': 2, 'européennes': 1, 'mikuláš': 1, 'bek': 1, 'pays': 2, 'hongrie': 2, 'long': 1, 'chemin': 1, 'avis': 1, 'bord': 1, 'précipice': 1, 'arrière': 1, 'saut': 1, 'conséquences': 1, 'dur': 1, 'mois': 1, 'budapest': 1, 'courant': 1, 'question': 1, 'européens': 1, 'face': 1, 'flambée': 1, 'prix': 2, 'énergie': 2, 'ministres': 1, 'favorables': 1, 'série': 1, 'mesures': 1, 'urgence': 1, 'hausse': 1, 'accord': 1, 'plafonnement': 2, 'gaz': 1, 'russe': 1, 'mesure': 1, 'états': 1, 'opposition': 1, 'nouvelle': 1, 'sanction': 1, 'déguisée': 1, 'susceptible': 1, 'pénurie': 1, 'étrangères': 1, 'szijjarto': 1, 'initiative': 1, 'absurde': 1, 'cher': 1, 'livraisons': 1, 'mécanisme': 1}","{'Russie': 1, 'Hongrie': 2, 'Budapest': 1, 'Réunis': 1, 'États': 1, 'Moscou': 1}","{'Union européenne': 3, 'ministre tchèque des Affaires européennes': 1, 'Énergie': 1, 'ministre hongrois des Affaires étrangères': 1}","{'Mikuláš Bek': 1, 'Peter Szijjarto': 1}",2022,9,9
1662760800,https://fr.sputniknews.africa/20220910/vucic-la-france-et-lallemagne-demandent-a-belgrade-de-vite-resoudre-le-probleme-du-kosovo-1056132968.html,"Vucic: la France et l’Allemagne demandent à Belgrade de vite résoudre ""le problème du Kosovo""","Selon le Président serbe Aleksandar Vucic, ""les représentants des pays les plus puissants, avec le soutien des États-Unis et de la Turquie, plaident pour la nécessité de résoudre vite le ""problème du Kosovo"" pendant la guerre en Europe"".","Se prononçant le 10 septembre après une réunion du Conseil de sécurité nationale, le Président serbe a annoncé avoir reçu une nouvelle proposition de normalisation de la situation autour du Kosovo de la part de représentants européens.La réunion du Conseil de sécurité a eu lieu après les entretiens du Président Vucic avec le représentant spécial de l'UE pour les Balkans occidentaux Miroslav Lajcak, avec le conseiller du chancelier allemand Jens Plotner et le conseiller du Président français Emmanuel Bonn.""Cette conversation n'a certainement pas été facile du tout. Les représentants des pays les plus puissants, soutenus, comme ils l’ont dit, par les États-Unis et la Turquie, croient que dans les conditions de la guerre en Europe, il n'y a pas besoin de nouveaux conflits et qu'il est important de trouver vite une solution "", a déclaré Aleksandar Vucic.Auparavant, le Président français et le chancelier allemand avaient envoyé une lettre commune au Président serbe, appelant Belgrade à prendre des ""décisions difficiles"" sur le Kosovo-Métochie. La lettre a été publiée par le bureau de presse de la présidence serbe.Dernières tensions au KosovoLa situation à la frontière administrative entre la Serbie et le Kosovo-Métochie s’est tendue à l’approche du 1er août. Ce jour-là, Pristina avait l’intention d’interdire les papiers et numéros d’immatriculation serbes sur le territoire de la république autoproclamée.Les autorités du Kosovo ont finalement reporté la mise en pratique de cette décision au 1er septembre.","[[[""Se prononçant le 10 septembre après une réunion du Conseil de sécurité nationale, le Président serbe a annoncé avoir reçu une nouvelle proposition de normalisation de la situation autour du Kosovo de la part de représentants européens.La réunion du Conseil de sécurité a eu lieu après les entretiens du Président Vucic avec le représentant spécial de l'UE pour les Balkans occidentaux Miroslav Lajcak, avec le conseiller du chancelier allemand Jens Plotner et le conseiller du Président français Emmanuel Bonn.""], ['""Cette conversation n\'a certainement pas été facile du tout.'], ['Les représentants des pays les plus puissants, soutenus, comme ils l’ont dit, par les États-Unis et la Turquie, croient que dans les conditions de la guerre en Europe, il n\'y a pas besoin de nouveaux conflits et qu\'il est important de trouver vite une solution "", a déclaré Aleksandar Vucic.Auparavant, le Président français et le chancelier allemand avaient envoyé une lettre commune au Président serbe, appelant Belgrade à prendre des ""décisions difficiles"" sur le Kosovo-Métochie.'], ['La lettre a été publiée par le bureau de presse de la présidence serbe.Dernières tensions au KosovoLa situation à la frontière administrative entre la Serbie et le Kosovo-Métochie s’est tendue à l’approche du 1er août.'], ['Ce jour-là, Pristina avait l’intention d’interdire les papiers et numéros d’immatriculation serbes sur le territoire de la république autoproclamée.Les autorités du Kosovo ont finalement reporté la mise en pratique de cette décision au 1er septembre.']]]","[[['septembre', 'réunion', 'conseil', 'sécurité', 'nationale', 'président', 'serbe', 'nouvelle', 'proposition', 'normalisation', 'situation', 'kosovo', 'part', 'représentants', 'réunion', 'conseil', 'sécurité', 'lieu', 'entretiens', 'président', 'vucic', 'représentant', 'spécial', 'ue', 'balkans', 'occidentaux', 'miroslav', 'lajcak', 'conseiller', 'chancelier', 'allemand', 'jens', 'conseiller', 'président', 'français', 'emmanuel', 'bonn'], ['conversation', 'facile'], ['représentants', 'pays', 'puissants', 'turquie', 'conditions', 'guerre', 'europe', 'besoin', 'nouveaux', 'conflits', 'important', 'solution', 'président', 'français', 'chancelier', 'allemand', 'lettre', 'commune', 'président', 'serbe', 'belgrade', 'décisions', 'difficiles', 'kosovo', 'métochie'], ['lettre', 'bureau', 'presse', 'présidence', 'tensions', 'kosovola', 'situation', 'frontière', 'administrative', 'serbie', 'kosovo', 'approche', 'août'], ['jour', 'pristina', 'intention', 'papiers', 'numéros', 'immatriculation', 'serbes', 'territoire', 'république', 'autorités', 'kosovo', 'mise', 'pratique', 'décision', 'septembre']]]","[[['Kosovo', 'Balkans'], [], ['États-Unis', 'Turquie', 'Europe', 'Belgrade', 'Kosovo-Métochie'], ['Serbie', 'Kosovo'], ['Pristina', 'Kosovo']]]","[[['Conseil de sécurité nationale', 'Conseil de sécurité', 'UE'], [], ['Président français'], [], []]]","[[['Président serbe', 'Président Vucic', 'Miroslav Lajcak', 'Jens Plotner', 'Président', 'Emmanuel Bonn'], [], ['Aleksandar Vucic', 'Président serbe'], ['KosovoLa'], []]]","{'septembre': 2, 'réunion': 2, 'conseil': 2, 'sécurité': 2, 'nationale': 1, 'président': 5, 'serbe': 2, 'nouvelle': 1, 'proposition': 1, 'normalisation': 1, 'situation': 2, 'kosovo': 4, 'part': 1, 'représentants': 2, 'lieu': 1, 'entretiens': 1, 'vucic': 1, 'représentant': 1, 'spécial': 1, 'ue': 1, 'balkans': 1, 'occidentaux': 1, 'miroslav': 1, 'lajcak': 1, 'conseiller': 2, 'chancelier': 2, 'allemand': 2, 'jens': 1, 'français': 2, 'emmanuel': 1, 'bonn': 1, 'conversation': 1, 'facile': 1, 'pays': 1, 'puissants': 1, 'turquie': 1, 'conditions': 1, 'guerre': 1, 'europe': 1, 'besoin': 1, 'nouveaux': 1, 'conflits': 1, 'important': 1, 'solution': 1, 'lettre': 2, 'commune': 1, 'belgrade': 1, 'décisions': 1, 'difficiles': 1, 'métochie': 1, 'bureau': 1, 'presse': 1, 'présidence': 1, 'tensions': 1, 'kosovola': 1, 'frontière': 1, 'administrative': 1, 'serbie': 1, 'approche': 1, 'août': 1, 'jour': 1, 'pristina': 1, 'intention': 1, 'papiers': 1, 'numéros': 1, 'immatriculation': 1, 'serbes': 1, 'territoire': 1, 'république': 1, 'autorités': 1, 'mise': 1, 'pratique': 1, 'décision': 1}","{'Kosovo': 3, 'Balkans': 1, 'États-Unis': 1, 'Turquie': 1, 'Europe': 1, 'Belgrade': 1, 'Kosovo-Métochie': 1, 'Serbie': 1, 'Pristina': 1}","{'Conseil de sécurité nationale': 1, 'Conseil de sécurité': 1, 'UE': 1, 'Président français': 1}","{'Président serbe': 2, 'Président Vucic': 1, 'Miroslav Lajcak': 1, 'Jens Plotner': 1, 'Président': 1, 'Emmanuel Bonn': 1, 'Aleksandar Vucic': 1, 'KosovoLa': 1}",2022,9,9
1662760800,https://fr.sputniknews.africa/20220910/une-attaque-terroriste-repoussee-par-larmee-dans-le-nord-du-mali-1056131888.html,Une attaque terroriste repoussée par l'armée dans le nord du Mali,"Les Forces armées maliennes FAMa ont repoussé vendredi une attaque d'un groupe armé terroriste contre le poste de sécurité de Niafunké, dans le nord du Mali.","""Cela vient de se passer ce vendredi 09 septembre aux environs de 13h45 avec des tirs directs et indirects sur ledit poste"", annonce l'armée malienne dans un communiqué.""Les assaillants ont décroché après une réaction vigoureuse du poste et se sont dissipés dans la nature"", ajoute le communiqué, précisant que ""les recherches sont en cours pour déterminer le ou les zones de replis en vue d'éventuelles actions des FAMa"".""Les FAMa ne déplorent aucune perte en vie humaine ni de dégât matériel"", note le communiqué.","[[['""Cela vient de se passer ce vendredi 09 septembre aux environs de 13h45 avec des tirs directs et indirects sur ledit poste"", annonce l\'armée malienne dans un communiqué.'], ['""Les assaillants ont décroché après une réaction vigoureuse du poste et se sont dissipés dans la nature"", ajoute le communiqué, précisant que ""les recherches sont en cours pour déterminer le ou les zones de replis en vue d\'éventuelles actions des FAMa"".'], ['""Les FAMa ne déplorent aucune perte en vie humaine ni de dégât matériel"", note le communiqué.']]]","[[['vendredi', 'septembre', 'environs', 'tirs', 'directs', 'indirects', 'poste', 'armée', 'malienne', 'communiqué'], ['assaillants', 'réaction', 'vigoureuse', 'poste', 'nature', 'communiqué', 'recherches', 'cours', 'zones', 'replis', 'vue', 'éventuelles', 'actions', 'fama'], ['fama', 'perte', 'vie', 'humaine', 'dégât', 'matériel', 'note', 'communiqué']]]","[[[], ['FAMa'], ['FAMa']]]","[[[], [], []]]","[[[], [], []]]","{'vendredi': 1, 'septembre': 1, 'environs': 1, 'tirs': 1, 'directs': 1, 'indirects': 1, 'poste': 2, 'armée': 1, 'malienne': 1, 'communiqué': 3, 'assaillants': 1, 'réaction': 1, 'vigoureuse': 1, 'nature': 1, 'recherches': 1, 'cours': 1, 'zones': 1, 'replis': 1, 'vue': 1, 'éventuelles': 1, 'actions': 1, 'fama': 2, 'perte': 1, 'vie': 1, 'humaine': 1, 'dégât': 1, 'matériel': 1, 'note': 1}",{'FAMa': 2},{},{},2022,9,9
1662760800,https://fr.sputniknews.africa/20220910/sobriete-energetique-la-mairie-de-paris-veut-eteindre-la-tour-eiffel-plus-tot-1056138970.html,Sobriété énergétique: la mairie de Paris veut éteindre la Tour Eiffel plus tôt,"Pour réduire la consommation d'énergie, la Tour Eiffel s'éteindra une heure plus tôt le soir, a annoncé l'entourage de la maire de Paris, Anne Hidalgo.","La mairie de Paris doit annoncer une réduction de l'éclairage nocturne de la Tour Eiffel d'un peu plus d'une heure, dans le cadre de son plan de sobriété énergétique qui sera présenté mardi, a indiqué samedi l'entourage d'Anne Hidalgo, confirmant une information du JDD.Actuellement illuminée jusqu'à 01H00 du matin, la Tour Eiffel, qui fait partie des monuments les plus visités au monde, sera dorénavant éteinte à 23H45, heure de départ du dernier visiteur.Le scintillement de la Tour Eiffel a lieu tous les soirs dès la tombée de la nuit, au début de chaque heure, pendant cinq minutes. Jeudi soir, cette animation a été annulée en hommage à la reine Elizabeth II, décédée le jour-même, et la tour s'est éteinte à minuit au lieu de 01H00.L'illumination nocturne représente 4% de la consommation annuelle du monument, a confirmé la Société d'exploitation de la tour Eiffel (SETE). ""C'est un geste éminemment symbolique pour participer à la prise de conscience de la sobriété énergétique dont nous devons faire preuve"", a déclaré Jean-François Martins, le président de la SETE interrogé par l'AFP, soulignant que cela participait du ""rôle"" de ce monument mondialement connu.La Dame de Fer, chef d'oeuvre de l'ingénieur Gustave Eiffel, érigée il y a 133 ans, a retrouvé début 2022 un niveau de fréquentation pré-Covid, avec plus de 20.000 visiteurs par jour.","[[[""La mairie de Paris doit annoncer une réduction de l'éclairage nocturne de la Tour Eiffel d'un peu plus d'une heure, dans le cadre de son plan de sobriété énergétique qui sera présenté mardi, a indiqué samedi l'entourage d'Anne Hidalgo, confirmant une information du JDD.Actuellement illuminée jusqu'à 01H00 du matin, la Tour Eiffel, qui fait partie des monuments les plus visités au monde, sera dorénavant éteinte à 23H45, heure de départ du dernier visiteur.Le scintillement de la Tour Eiffel a lieu tous les soirs dès la tombée de la nuit, au début de chaque heure, pendant cinq minutes.""], [""Jeudi soir, cette animation a été annulée en hommage à la reine Elizabeth II, décédée le jour-même, et la tour s'est éteinte à minuit au lieu de 01H00.L'illumination nocturne représente 4% de la consommation annuelle du monument, a confirmé la Société d'exploitation de la tour Eiffel (SETE).""], ['""C\'est un geste éminemment symbolique pour participer à la prise de conscience de la sobriété énergétique dont nous devons faire preuve"", a déclaré Jean-François Martins, le président de la SETE interrogé par l\'AFP, soulignant que cela participait du ""rôle"" de ce monument mondialement connu.La Dame de Fer, chef d\'oeuvre de l\'ingénieur Gustave Eiffel, érigée il y a 133 ans, a retrouvé début 2022 un niveau de fréquentation pré-Covid, avec plus de 20.000 visiteurs par jour.']]]","[[['mairie', 'paris', 'réduction', 'éclairage', 'nocturne', 'tour', 'eiffel', 'heure', 'cadre', 'plan', 'sobriété', 'énergétique', 'mardi', 'samedi', 'entourage', 'anne', 'hidalgo', 'information', 'matin', 'tour', 'eiffel', 'partie', 'monuments', 'monde', 'heure', 'départ', 'dernier', 'tour', 'eiffel', 'lieu', 'soirs', 'tombée', 'nuit', 'début', 'heure', 'minutes'], ['jeudi', 'soir', 'animation', 'hommage', 'reine', 'elizabeth', 'ii', 'jour', 'tour', 'minuit', 'lieu', 'illumination', 'nocturne', 'consommation', 'annuelle', 'monument', 'société', 'exploitation', 'tour', 'eiffel'], ['geste', 'symbolique', 'prise', 'conscience', 'sobriété', 'énergétique', 'preuve', 'martins', 'président', 'sete', 'afp', 'rôle', 'monument', 'dame', 'fer', 'chef', 'oeuvre', 'ingénieur', 'gustave', 'eiffel', 'ans', 'début', 'niveau', 'fréquentation', 'visiteurs', 'jour']]]","[[['Paris', 'Tour Eiffel', 'Tour Eiffel', 'Tour Eiffel'], [""01H00.L'"", 'SETE'], []]]","[[[], [""Société d'exploitation de la tour Eiffel""], ['SETE', 'AFP']]]","[[['Anne Hidalgo'], ['Elizabeth II'], ['Jean-François Martins', 'Gustave Eiffel']]]","{'mairie': 1, 'paris': 1, 'réduction': 1, 'éclairage': 1, 'nocturne': 2, 'tour': 5, 'eiffel': 5, 'heure': 3, 'cadre': 1, 'plan': 1, 'sobriété': 2, 'énergétique': 2, 'mardi': 1, 'samedi': 1, 'entourage': 1, 'anne': 1, 'hidalgo': 1, 'information': 1, 'matin': 1, 'partie': 1, 'monuments': 1, 'monde': 1, 'départ': 1, 'dernier': 1, 'lieu': 2, 'soirs': 1, 'tombée': 1, 'nuit': 1, 'début': 2, 'minutes': 1, 'jeudi': 1, 'soir': 1, 'animation': 1, 'hommage': 1, 'reine': 1, 'elizabeth': 1, 'ii': 1, 'jour': 2, 'minuit': 1, 'illumination': 1, 'consommation': 1, 'annuelle': 1, 'monument': 2, 'société': 1, 'exploitation': 1, 'geste': 1, 'symbolique': 1, 'prise': 1, 'conscience': 1, 'preuve': 1, 'martins': 1, 'président': 1, 'sete': 1, 'afp': 1, 'rôle': 1, 'dame': 1, 'fer': 1, 'chef': 1, 'oeuvre': 1, 'ingénieur': 1, 'gustave': 1, 'ans': 1, 'niveau': 1, 'fréquentation': 1, 'visiteurs': 1}","{'Paris': 1, 'Tour Eiffel': 3, ""01H00.L'"": 1, 'SETE': 1}","{""Société d'exploitation de la tour Eiffel"": 1, 'SETE': 1, 'AFP': 1}","{'Anne Hidalgo': 1, 'Elizabeth II': 1, 'Jean-François Martins': 1, 'Gustave Eiffel': 1}",2022,9,9
