timestamp,url,title,description,content,content-segmented,kws-l,loc-l,org-l,per-l,kws,loc,org,per,year,month,day
1676847600,https://fr.sputniknews.africa/20230220/erdogan-donne-un-chiffre-ahurissant-de-personnes-sauvees-des-decombres-apres-le-seisme-1057971841.html,Erdogan donne un chiffre ahurissant de personnes sauvées des décombres après le séisme,"Le Président turc a dressé un nouveau bilan du séisme ayant ravagé le sud-est du pays, insistant sur le nombre de rescapés. La catastrophe avait donné lieu à un véritable élan de solidarité international.","Alors que les miraculés continuent encore d’être sortis des ruines, plus de dix jours après le séisme, la Turquie a donné quelques nouveaux chiffres illustrant l’ampleur de la catastrophe. En déplacement dans la province de Hatay, le Président Recep Tayyip Erdogan a ainsi déclaré que plus de 114.000 personnes avaient été secourues.""Pour le moment, 114.834 personnes ont été sauvés des décombres"", a-t-il annoncé, soulignant que des opérations de recherche étaient toujours en cours.Plus de 118.000 bâtiments répartis dans onze provinces ont par ailleurs été déclarés dangereux et seront démolis, a ajouté le dirigeant. Les autorités ont aussi l’intention d’interdire la construction d’habitats de plus de 3 ou 4 étages dans les zones les plus touchées par le tremblement de terre.Élan de solidaritéLe 6 février, des tremblements de terre de magnitude 7,6 et 7,7 avaient frappé la Turquie et la Syrie, faisant plus de 44.000 victimes. La catastrophe avait provoqué un électrochoc mondial, de nombreux pays dépêchant sur place des équipes de secours. Moscou avait ainsi envoyé plus de 20 tonnes d’aide humanitaire à la Syrie, mettant à contribution 300 secouristes.L’envoi d’aide en Syrie a néanmoins suscité des polémiques politiques, les États-Unis jouant d’abord la montre. Hussein Makhlouf, ministre syrien de l'Intérieur avait explicitement accusé Washington d’empêcher les autres pays occidentaux de fournir une assistance au peuple syrien. Face au tollé, les États-Unis avaient finalement annoncé que leurs sanctions ne concerneraient pas l’envoi d’aide en Syrie.D’autres observateurs ont encore déploré que Damas soit reléguée au second rang par rapport à Ankara, suite à la catastrophe. ""L’Occident ne voit que la Turquie"" avait ainsi regrettait auprès de Sputnik Bashar al-Jaafari, ambassadeur de la Syrie en Russie.","[[['Alors que les miraculés continuent encore d’être sortis des ruines, plus de dix jours après le séisme, la Turquie a donné quelques nouveaux chiffres illustrant l’ampleur de la catastrophe.'], ['En déplacement dans la province de Hatay, le Président Recep Tayyip Erdogan a ainsi déclaré que plus de 114.000 personnes avaient été secourues.'], ['""Pour le moment, 114.834 personnes ont été sauvés des décombres"", a-t-il annoncé, soulignant que des opérations de recherche étaient toujours en cours.Plus de 118.000 bâtiments répartis dans onze provinces ont par ailleurs été déclarés dangereux et seront démolis, a ajouté le dirigeant.'], ['Les autorités ont aussi l’intention d’interdire la construction d’habitats de plus de 3 ou 4 étages dans les zones les plus touchées par le tremblement de terre.Élan de solidaritéLe 6 février, des tremblements de terre de magnitude 7,6 et 7,7 avaient frappé la Turquie et la Syrie, faisant plus de 44.000 victimes.'], ['La catastrophe avait provoqué un électrochoc mondial, de nombreux pays dépêchant sur place des équipes de secours.'], ['Moscou avait ainsi envoyé plus de 20 tonnes d’aide humanitaire à la Syrie, mettant à contribution 300 secouristes.L’envoi d’aide en Syrie a néanmoins suscité des polémiques politiques, les États-Unis jouant d’abord la montre.'], [""Hussein Makhlouf, ministre syrien de l'Intérieur avait explicitement accusé Washington d’empêcher les autres pays occidentaux de fournir une assistance au peuple syrien.""], ['Face au tollé, les États-Unis avaient finalement annoncé que leurs sanctions ne concerneraient pas l’envoi d’aide en Syrie.D’autres observateurs ont encore déploré que Damas soit reléguée au second rang par rapport à Ankara, suite à la catastrophe.'], ['""L’Occident ne voit que la Turquie"" avait ainsi regrettait auprès de Sputnik Bashar al-Jaafari, ambassadeur de la Syrie en Russie.']]]","[[['miraculés', 'ruines', 'jours', 'séisme', 'turquie', 'nouveaux', 'chiffres', 'ampleur', 'catastrophe'], ['déplacement', 'province', 'hatay', 'président', 'recep', 'personnes'], ['moment', 'personnes', 'décombres', 'opérations', 'recherche', 'bâtiments', 'provinces', 'dangereux', 'dirigeant'], ['autorités', 'intention', 'construction', 'habitats', 'étages', 'zones', 'tremblement', 'solidaritéle', 'février', 'tremblements', 'terre', 'magnitude', 'turquie', 'syrie', 'victimes'], ['catastrophe', 'électrochoc', 'mondial', 'pays', 'place', 'équipes', 'secours'], ['moscou', 'tonnes', 'aide', 'humanitaire', 'syrie', 'contribution', 'envoi', 'aide', 'syrie', 'polémiques', 'politiques'], ['hussein', 'makhlouf', 'ministre', 'syrien', 'intérieur', 'washington', 'pays', 'occidentaux', 'assistance', 'peuple', 'syrien'], ['face', 'tollé', 'sanctions', 'envoi', 'aide', 'observateurs', 'damas', 'second', 'rang', 'rapport', 'ankara', 'suite', 'catastrophe'], ['occident', 'turquie', 'sputnik', 'al', 'jaafari', 'ambassadeur', 'syrie', 'russie']]]","[[['Turquie'], ['province de Hatay'], [], ['Turquie', 'Syrie'], [], ['Moscou', 'Syrie', 'Syrie', 'États-Unis'], [], ['États-Unis', 'Syrie', 'Damas', 'Ankara'], ['Occident', 'Turquie', 'Syrie', 'Russie']]]","[[[], [], [], [], [], [], [], [], []]]","[[[], ['Président Recep Tayyip Erdogan'], [], [], [], [], ['Hussein Makhlouf', 'Washington'], [], ['Sputnik Bashar al-Jaafari']]]","{'miraculés': 1, 'ruines': 1, 'jours': 1, 'séisme': 1, 'turquie': 3, 'nouveaux': 1, 'chiffres': 1, 'ampleur': 1, 'catastrophe': 3, 'déplacement': 1, 'province': 1, 'hatay': 1, 'président': 1, 'recep': 1, 'personnes': 2, 'moment': 1, 'décombres': 1, 'opérations': 1, 'recherche': 1, 'bâtiments': 1, 'provinces': 1, 'dangereux': 1, 'dirigeant': 1, 'autorités': 1, 'intention': 1, 'construction': 1, 'habitats': 1, 'étages': 1, 'zones': 1, 'tremblement': 1, 'solidaritéle': 1, 'février': 1, 'tremblements': 1, 'terre': 1, 'magnitude': 1, 'syrie': 4, 'victimes': 1, 'électrochoc': 1, 'mondial': 1, 'pays': 2, 'place': 1, 'équipes': 1, 'secours': 1, 'moscou': 1, 'tonnes': 1, 'aide': 3, 'humanitaire': 1, 'contribution': 1, 'envoi': 2, 'polémiques': 1, 'politiques': 1, 'hussein': 1, 'makhlouf': 1, 'ministre': 1, 'syrien': 2, 'intérieur': 1, 'washington': 1, 'occidentaux': 1, 'assistance': 1, 'peuple': 1, 'face': 1, 'tollé': 1, 'sanctions': 1, 'observateurs': 1, 'damas': 1, 'second': 1, 'rang': 1, 'rapport': 1, 'ankara': 1, 'suite': 1, 'occident': 1, 'sputnik': 1, 'al': 1, 'jaafari': 1, 'ambassadeur': 1, 'russie': 1}","{'Turquie': 3, 'province de Hatay': 1, 'Syrie': 5, 'Moscou': 1, 'États-Unis': 2, 'Damas': 1, 'Ankara': 1, 'Occident': 1, 'Russie': 1}",{},"{'Président Recep Tayyip Erdogan': 1, 'Hussein Makhlouf': 1, 'Washington': 1, 'Sputnik Bashar al-Jaafari': 1}",2023,2,19
1676847600,https://fr.sputniknews.africa/20230220/un-dubai-africain-le-zimbabwe-veut-creer-un-paradis-offshore-1057971282.html,"Un ""Dubaï africain"": le Zimbabwe veut créer un paradis offshore",Les autorités zimbabwéennes ont l’intention d’attirer les investisseurs en créant un centre financier extraterritorial dans la ville de Victoria Falls.,"Le Zimbabwe voit grand. Bien requinqué sur le front agricole grâce à de récentes récoltes records, le pays veut désormais développer son secteur des affaires. Les autorités envisagent ainsi d’ouvrir un centre financier offshore dans la ville balnéaire de Victoria Falls, rapporte Bloomberg.Cette place économique sera une zone à monnaie forte, basée sur le dollar et offrira des incitations fiscales pour attirer les investisseurs. Il s’agira à long terme de concurrencer les cadors du secteur comme Dubaï ou l’Île de Man, a expliqué le ministre des Finances zimbabwéen Mthuli Ncube au journal.Le projet s’appuie sur le succès de la petite bourse du Victoria Falls Stock Exchange (VFEX), qui a connu une hausse des cotations fin 2022. Cet endroit devrait finir par être inclus dans le centre financier.""Le déclencheur est le succès du VFEX. Nous voulons rivaliser avec n'importe quel centre financier offshore dans le monde. Le projet offrira aux investisseurs un environnement comparable à l'île de Man, à Maurice et à Dubaï"", explique ainsi Mthuli Ncube.La popularité du VFEX fait même désormais ombrage à la Bourse du Zimbabwe (ZSE), la principale du pays, qui a dû radier quelques titres. Les autorités se veulent cependant confiantes et n’essaieront pas de dicter aux entreprises sur quelle bourse s’inscrire.Le Zimbabwe surfe sur la vagueCes derniers mois le Zimbabwe a multiplié les initiatives économiques et technologiques. Harare a par exemple procédé à plusieurs lancements de nano-satellites en 2022 et devrait continuer sur sa lancée, en associant le géant russe Roscosmos à ses efforts.Le pays est aussi en discussion avec Minsk pour la création d’un hub commercial, permettant de distribuer des équipements et produits alimentaires biélorusses dans la région.Le Zimbabwe, dévasté par la famine dans les années 1990 à cause des réformes agraires désastreuses, est en outre parvenu à rétablir un certain équilibre alimentaire et pourrait exporter à nouveau du blé l’an prochain. L’inflation galopante a par ailleurs ralenti sa course en fin d’année dernière.","[[['Le Zimbabwe voit grand.'], ['Bien requinqué sur le front agricole grâce à de récentes récoltes records, le pays veut désormais développer son secteur des affaires.'], ['Les autorités envisagent ainsi d’ouvrir un centre financier offshore dans la ville balnéaire de Victoria Falls, rapporte Bloomberg.Cette place économique sera une zone à monnaie forte, basée sur le dollar et offrira des incitations fiscales pour attirer les investisseurs.'], ['Il s’agira à long terme de concurrencer les cadors du secteur comme Dubaï ou l’Île de Man, a expliqué le ministre des Finances zimbabwéen Mthuli Ncube au journal.Le projet s’appuie sur le succès de la petite bourse du Victoria Falls Stock Exchange (VFEX), qui a connu une hausse des cotations fin 2022.'], ['Cet endroit devrait finir par être inclus dans le centre financier.'], ['""Le déclencheur est le succès du VFEX.'], [""Nous voulons rivaliser avec n'importe quel centre financier offshore dans le monde.""], ['Le projet offrira aux investisseurs un environnement comparable à l\'île de Man, à Maurice et à Dubaï"", explique ainsi Mthuli Ncube.La popularité du VFEX fait même désormais ombrage à la Bourse du Zimbabwe (ZSE), la principale du pays, qui a dû radier quelques titres.'], ['Les autorités se veulent cependant confiantes et n’essaieront pas de dicter aux entreprises sur quelle bourse s’inscrire.Le Zimbabwe surfe sur la vagueCes derniers mois le Zimbabwe a multiplié les initiatives économiques et technologiques.'], ['Harare a par exemple procédé à plusieurs lancements de nano-satellites en 2022 et devrait continuer sur sa lancée, en associant le géant russe Roscosmos à ses efforts.Le pays est aussi en discussion avec Minsk pour la création d’un hub commercial, permettant de distribuer des équipements et produits alimentaires biélorusses dans la région.Le Zimbabwe, dévasté par la famine dans les années 1990 à cause des réformes agraires désastreuses, est en outre parvenu à rétablir un certain équilibre alimentaire et pourrait exporter à nouveau du blé l’an prochain.'], ['L’inflation galopante a par ailleurs ralenti sa course en fin d’année dernière.']]]","[[['zimbabwe', 'grand'], ['requinqué', 'front', 'agricole', 'grâce', 'récentes', 'récoltes', 'records', 'pays', 'secteur', 'affaires'], ['autorités', 'centre', 'financier', 'offshore', 'ville', 'balnéaire', 'victoria', 'place', 'économique', 'zone', 'monnaie', 'forte', 'dollar', 'incitations', 'fiscales', 'investisseurs'], ['long', 'terme', 'cadors', 'secteur', 'île', 'man', 'ministre', 'finances', 'zimbabwéen', 'ncube', 'projet', 'succès', 'petite', 'bourse', 'victoria', 'stock', 'vfex', 'hausse', 'cotations', 'fin'], ['endroit', 'centre', 'financier'], ['déclencheur', 'succès', 'vfex'], ['centre', 'financier', 'offshore', 'monde'], ['projet', 'investisseurs', 'environnement', 'comparable', 'île', 'man', 'maurice', 'dubaï', 'mthuli', 'popularité', 'vfex', 'ombrage', 'bourse', 'zimbabwe', 'zse', 'principale', 'pays', 'titres'], ['autorités', 'confiantes', 'entreprises', 'bourse', 'zimbabwe', 'vagueces', 'derniers', 'mois', 'zimbabwe', 'initiatives', 'économiques', 'technologiques'], ['harare', 'exemple', 'lancements', 'nano', 'satellites', 'lancée', 'géant', 'roscosmos', 'pays', 'discussion', 'création', 'hub', 'commercial', 'équipements', 'produits', 'alimentaires', 'zimbabwe', 'famine', 'années', 'cause', 'réformes', 'agraires', 'désastreuses', 'équilibre', 'alimentaire', 'blé', 'an', 'prochain'], ['inflation', 'galopante', 'course', 'fin', 'année', 'dernière']]]","[[['Zimbabwe'], [], ['Victoria Falls'], ['Dubaï', 'Île de Man', 'Victoria Falls Stock Exchange'], [], [], [], ['île de Man', 'Dubaï', 'ZSE'], ['Zimbabwe', 'Zimbabwe'], ['Harare', 'Roscosmos', 'Minsk', 'Zimbabwe'], []]]","[[[], [], [], ['ministre des Finances zimbabwéen', 'VFEX'], [], ['VFEX'], [], ['VFEX', 'Bourse du Zimbabwe'], [], [], []]]","[[[], [], ['Bloomberg'], ['Mthuli Ncube'], [], [], [], ['Maurice', 'Mthuli Ncube'], [], [], []]]","{'zimbabwe': 5, 'grand': 1, 'requinqué': 1, 'front': 1, 'agricole': 1, 'grâce': 1, 'récentes': 1, 'récoltes': 1, 'records': 1, 'pays': 3, 'secteur': 2, 'affaires': 1, 'autorités': 2, 'centre': 3, 'financier': 3, 'offshore': 2, 'ville': 1, 'balnéaire': 1, 'victoria': 2, 'place': 1, 'économique': 1, 'zone': 1, 'monnaie': 1, 'forte': 1, 'dollar': 1, 'incitations': 1, 'fiscales': 1, 'investisseurs': 2, 'long': 1, 'terme': 1, 'cadors': 1, 'île': 2, 'man': 2, 'ministre': 1, 'finances': 1, 'zimbabwéen': 1, 'ncube': 1, 'projet': 2, 'succès': 2, 'petite': 1, 'bourse': 3, 'stock': 1, 'vfex': 3, 'hausse': 1, 'cotations': 1, 'fin': 2, 'endroit': 1, 'déclencheur': 1, 'monde': 1, 'environnement': 1, 'comparable': 1, 'maurice': 1, 'dubaï': 1, 'mthuli': 1, 'popularité': 1, 'ombrage': 1, 'zse': 1, 'principale': 1, 'titres': 1, 'confiantes': 1, 'entreprises': 1, 'vagueces': 1, 'derniers': 1, 'mois': 1, 'initiatives': 1, 'économiques': 1, 'technologiques': 1, 'harare': 1, 'exemple': 1, 'lancements': 1, 'nano': 1, 'satellites': 1, 'lancée': 1, 'géant': 1, 'roscosmos': 1, 'discussion': 1, 'création': 1, 'hub': 1, 'commercial': 1, 'équipements': 1, 'produits': 1, 'alimentaires': 1, 'famine': 1, 'années': 1, 'cause': 1, 'réformes': 1, 'agraires': 1, 'désastreuses': 1, 'équilibre': 1, 'alimentaire': 1, 'blé': 1, 'an': 1, 'prochain': 1, 'inflation': 1, 'galopante': 1, 'course': 1, 'année': 1, 'dernière': 1}","{'Zimbabwe': 4, 'Victoria Falls': 1, 'Dubaï': 2, 'Île de Man': 1, 'Victoria Falls Stock Exchange': 1, 'île de Man': 1, 'ZSE': 1, 'Harare': 1, 'Roscosmos': 1, 'Minsk': 1}","{'ministre des Finances zimbabwéen': 1, 'VFEX': 3, 'Bourse du Zimbabwe': 1}","{'Bloomberg': 1, 'Mthuli Ncube': 2, 'Maurice': 1}",2023,2,19
1676847600,https://fr.sputniknews.africa/20230220/un-nouveau-seisme-de-64-secoue-la-turquie-1057970402.html,"Un nouveau séisme de 6,4 frappe la Turquie, des secousses ressenties à Damas - vidéo","Un nouveau tremblement de terre de 6,4 a été enregistré dans la province turque du Hatay. Les autorités ont fait état de six morts et près de 290 blessés. Des secousses ont été également ressenties en Syrie.","Un séisme de magnitude 6,4 a frappé ce lundi 20 février la province turque du Hatay, selon les autorités. Un correspondant de Sputnik dans la ville de Diyarbakır fait état de destructions. Le gouverneur de la région a par la suite annoncé que des gens se trouvaient sous les décombres.Selon les données des autorités, l'épicentre du séisme était situé dans la localité de Defne, située près d'Antakya. La secousse a suscité un mouvement de panique parmi la population déjà durement éprouvée.Plus tard, le ministère de l'Intérieur a fait état de six morts et de plus de 290 blessés dans le sinistre.Des secousses ont été également ressenties en Syrie voisine, elle aussi frappée par le séisme du 6 février:A Alep, une trentaine de personnes ont été hospitalisées avec des blessures légères, rapporte un correspondant de Sputnik.Des milliers de répliquesAu total, plus de 6.000 répliques ont été enregistrées depuis le tremblement de terre d'une magnitude de 7,8 qui a dévasté le sud de la Turquie et la Syrie.D'après les récentes données, le séisme du 6 février a fait plus de 41.000 morts en Turquie, alors que près de 115.000 personnes ensevelies sous les décombres ont été secourues. En Syrie, au moins 3.688 personnes ont trouvé la mort dans la catastrophe.","[[['Un séisme de magnitude 6,4 a frappé ce lundi 20 février la province turque du Hatay, selon les autorités.'], ['Un correspondant de Sputnik dans la ville de Diyarbakır fait état de destructions.'], [""Le gouverneur de la région a par la suite annoncé que des gens se trouvaient sous les décombres.Selon les données des autorités, l'épicentre du séisme était situé dans la localité de Defne, située près d'Antakya.""], [""La secousse a suscité un mouvement de panique parmi la population déjà durement éprouvée.Plus tard, le ministère de l'Intérieur a fait état de six morts et de plus de 290 blessés dans le sinistre.Des secousses ont été également ressenties en Syrie voisine, elle aussi frappée par le séisme du 6 février:A Alep, une trentaine de personnes ont été hospitalisées avec des blessures légères, rapporte un correspondant de Sputnik.Des milliers de répliquesAu total, plus de 6.000 répliques ont été enregistrées depuis le tremblement de terre d'une magnitude de 7,8 qui a dévasté le sud de la Turquie et la Syrie.D'après les récentes données, le séisme du 6 février a fait plus de 41.000 morts en Turquie, alors que près de 115.000 personnes ensevelies sous les décombres ont été secourues.""], ['En Syrie, au moins 3.688 personnes ont trouvé la mort dans la catastrophe.']]]","[[['séisme', 'magnitude', 'lundi', 'février', 'province', 'turque', 'hatay', 'autorités'], ['correspondant', 'sputnik', 'ville', 'diyarbakır', 'état', 'destructions'], ['gouverneur', 'région', 'suite', 'données', 'autorités', 'épicentre', 'séisme', 'localité', 'defne', 'antakya'], ['secousse', 'mouvement', 'panique', 'population', 'ministère', 'intérieur', 'état', 'morts', 'blessés', 'secousses', 'syrie', 'voisine', 'séisme', 'février', 'alep', 'trentaine', 'personnes', 'blessures', 'légères', 'correspondant', 'milliers', 'total', 'répliques', 'tremblement', 'terre', 'magnitude', 'sud', 'turquie', 'récentes', 'données', 'séisme', 'février', 'morts', 'turquie', 'personnes', 'décombres'], ['syrie', 'personnes', 'mort', 'catastrophe']]]","[[['Hatay'], ['Diyarbakır'], ['Defne', 'Antakya'], ['Syrie', 'Alep', 'Turquie', 'Syrie', 'Turquie'], ['Syrie']]]","[[[], ['Sputnik'], [], [""ministère de l'Intérieur"", 'Sputnik'], []]]","[[[], [], [], [], []]]","{'séisme': 4, 'magnitude': 2, 'lundi': 1, 'février': 3, 'province': 1, 'turque': 1, 'hatay': 1, 'autorités': 2, 'correspondant': 2, 'sputnik': 1, 'ville': 1, 'diyarbakır': 1, 'état': 2, 'destructions': 1, 'gouverneur': 1, 'région': 1, 'suite': 1, 'données': 2, 'épicentre': 1, 'localité': 1, 'defne': 1, 'antakya': 1, 'secousse': 1, 'mouvement': 1, 'panique': 1, 'population': 1, 'ministère': 1, 'intérieur': 1, 'morts': 2, 'blessés': 1, 'secousses': 1, 'syrie': 2, 'voisine': 1, 'alep': 1, 'trentaine': 1, 'personnes': 3, 'blessures': 1, 'légères': 1, 'milliers': 1, 'total': 1, 'répliques': 1, 'tremblement': 1, 'terre': 1, 'sud': 1, 'turquie': 2, 'récentes': 1, 'décombres': 1, 'mort': 1, 'catastrophe': 1}","{'Hatay': 1, 'Diyarbakır': 1, 'Defne': 1, 'Antakya': 1, 'Syrie': 3, 'Alep': 1, 'Turquie': 2}","{'Sputnik': 2, ""ministère de l'Intérieur"": 1}",{},2023,2,19
