timestamp,url,title,description,content,content-segmented,kws-l,loc-l,org-l,per-l,kws,loc,org,per,year,month,day
1677711600,https://fr.sputniknews.africa/20230302/des-migrants-africains-dans-les-rues-de-paris-contre-une-loi-sur-la-migration-1058087666.html,Des migrants africains dans les rues de Paris contre une loi sur la migration,"Pour protester contre le durcissement de la loi sur la politique migratoire, proposée par le ministre français de l'Intérieur, deux cents migrants d’Afrique ont manifesté ce 2 mars à Paris. D’autres protestations, plus importantes, contre...","Près de 200 migrants d’Afrique sont descendus dans les rues de Paris ce jeudi 2 mars pour faire part de leurs désarrois concernant la loi ""asile et migration"" initié par Gérald Darmanin, ministre français de l'Intérieur, annonce un correspondant de Sputnik sur place.L’action a débuté vers à 13 heures à Saint Lazare. Les manifestants ont brandi des banderoles appelant le gouvernement français à délivrer des documents aux migrants, en scandant des slogans comme ""À bas la loi Darmanin!, ""Donnez-nous des papiers"", ""Nous voulons travailler"".D’autres rassemblements, plus nombreux, contre la loi Darmanin sur l’immigration, seraient programmés pour le 4 et le 25 mars, selon les médias.La loi ""asile et migration""La loi sur l’immigration autrement appelée ""loi Darmanin"" prévoit de nombreuses mesures pour faciliter l'expulsion des migrants. Le gouvernement français entend aussi durcir les règles de séjour en France pour les tenants d’un visa familial avec l’introduction d’un examen de français obligatoire pour les membres de la famille de ceux qui viennent dans le pays dans le cadre du regroupement familial.En novembre, le ministère de l'Intérieur avait annoncé qu'il renforcerait le contrôle sur l'expulsion des migrants illégaux. Ceux-ci seraient ajoutés à une liste de personnes recherchées pour s'assurer qu'ils quittent effectivement le sol français.Le Sénat procédera à l’examen du projet de loi fin mars.","[[['Près de 200 migrants d’Afrique sont descendus dans les rues de Paris ce jeudi 2 mars pour faire part de leurs désarrois concernant la loi ""asile et migration"" initié par Gérald Darmanin, ministre français de l\'Intérieur, annonce un correspondant de Sputnik sur place.L’action a débuté vers à 13 heures à Saint Lazare.'], ['Les manifestants ont brandi des banderoles appelant le gouvernement français à délivrer des documents aux migrants, en scandant des slogans comme ""À bas la loi Darmanin!, ""Donnez-nous des papiers"", ""Nous voulons travailler"".D’autres rassemblements, plus nombreux, contre la loi Darmanin sur l’immigration, seraient programmés pour le 4 et le 25 mars, selon les médias.La loi ""asile et migration""La loi sur l’immigration autrement appelée ""loi Darmanin"" prévoit de nombreuses mesures pour faciliter l\'expulsion des migrants.'], [""Le gouvernement français entend aussi durcir les règles de séjour en France pour les tenants d’un visa familial avec l’introduction d’un examen de français obligatoire pour les membres de la famille de ceux qui viennent dans le pays dans le cadre du regroupement familial.En novembre, le ministère de l'Intérieur avait annoncé qu'il renforcerait le contrôle sur l'expulsion des migrants illégaux.""], [""Ceux-ci seraient ajoutés à une liste de personnes recherchées pour s'assurer qu'ils quittent effectivement le sol français.Le Sénat procédera à l’examen du projet de loi fin mars.""]]]","[[['migrants', 'afrique', 'rues', 'paris', 'jeudi', 'mars', 'part', 'désarrois', 'loi', 'asile', 'migration', 'gérald', 'darmanin', 'ministre', 'français', 'intérieur', 'correspondant', 'sputnik', 'action', 'heures', 'saint', 'lazare'], ['manifestants', 'banderoles', 'gouvernement', 'français', 'documents', 'migrants', 'slogans', 'loi', 'papiers', 'rassemblements', 'loi', 'darmanin', 'immigration', 'mars', 'loi', 'asile', 'loi', 'immigration', 'loi', 'darmanin', 'mesures', 'expulsion', 'migrants'], ['gouvernement', 'français', 'règles', 'séjour', 'france', 'tenants', 'visa', 'familial', 'introduction', 'examen', 'français', 'obligatoire', 'membres', 'famille', 'pays', 'cadre', 'regroupement', 'novembre', 'ministère', 'intérieur', 'contrôle', 'expulsion', 'migrants', 'illégaux'], ['liste', 'personnes', 'sol', 'sénat', 'examen', 'projet', 'loi', 'fin', 'mars']]]","[[['Afrique', 'Paris', 'Saint Lazare'], ['Darmanin'], ['France'], []]]","[[['Sputnik'], [], [""ministère de l'Intérieur""], ['Sénat']]]","[[['Gérald Darmanin'], ['Darmanin', 'Darmanin'], [], []]]","{'migrants': 4, 'afrique': 1, 'rues': 1, 'paris': 1, 'jeudi': 1, 'mars': 3, 'part': 1, 'désarrois': 1, 'loi': 7, 'asile': 2, 'migration': 1, 'gérald': 1, 'darmanin': 3, 'ministre': 1, 'français': 4, 'intérieur': 2, 'correspondant': 1, 'sputnik': 1, 'action': 1, 'heures': 1, 'saint': 1, 'lazare': 1, 'manifestants': 1, 'banderoles': 1, 'gouvernement': 2, 'documents': 1, 'slogans': 1, 'papiers': 1, 'rassemblements': 1, 'immigration': 2, 'mesures': 1, 'expulsion': 2, 'règles': 1, 'séjour': 1, 'france': 1, 'tenants': 1, 'visa': 1, 'familial': 1, 'introduction': 1, 'examen': 2, 'obligatoire': 1, 'membres': 1, 'famille': 1, 'pays': 1, 'cadre': 1, 'regroupement': 1, 'novembre': 1, 'ministère': 1, 'contrôle': 1, 'illégaux': 1, 'liste': 1, 'personnes': 1, 'sol': 1, 'sénat': 1, 'projet': 1, 'fin': 1}","{'Afrique': 1, 'Paris': 1, 'Saint Lazare': 1, 'Darmanin': 1, 'France': 1}","{'Sputnik': 1, ""ministère de l'Intérieur"": 1, 'Sénat': 1}","{'Gérald Darmanin': 1, 'Darmanin': 2}",2023,3,1
1677711600,https://fr.sputniknews.africa/20230302/madrid-enverrait-un-navire-pour-surveiller-la-cote-de-melilla-ville-frontaliere-avec-le-maroc-1058087452.html,"Madrid enverrait un navire pour surveiller la côte de Melilla, ville frontalière avec le Maroc","Dans le cadre de la surveillance maritime, le gouvernement espagnol aurait l’intention d’envoyer un navire militaire sur les côtes de Melilla, ville frontalière avec le Maroc, selon le quotidien espagnol ABC.","Les autorités espagnoles comptent envoyer un patrouilleur côtier pour la première fois à Melilla, exclave espagnole dans le territoire marocain, l’été prochain, relate le quotidien espagnol ABC.Le navire, une fois en service, aurait pour mission de surveiller sans interruption ses eaux, précise le journal.La zone de patrouille du bateau serait concentrée sur les eaux de la mer d’Alboran et, bien sûr, celles de la juridiction espagnole dans la ville autonome de Melilla. Celle-ci, revendiquée par le Maroc est considérée par Rabat comme étant occupée par les Espagnols. C’est l’un des plus importants endroits utilisés par les migrants pour entrer sur le territoire européen via le Maroc. Par conséquent, de fortes tensions s’exercent sur ce terrain.Les caractéristiques et la mission du navireSelon le quotidien, l’appellation du patrouilleur de type P-84 de la classe Rodman 101 est encore inconnue. Ce navire a été construit dans le chantier naval Rodman Polyships de Vigo. Avec une longueur de 31,3 mètres et un équipage de dix marins, ce type de bateau a une mitrailleuse de 12,70 mm comme armement principal.Le navire sera intégré à la Force d’action maritime de la marine espagnole. Des bâtiments de ce type font partie des services douaniers et des garde-côtes espagnols. Le Maroc en dispose aussi, tout comme le Cameroun, le Nicaragua, Oman, les Philippines, et le Suriname.","[[['Les autorités espagnoles comptent envoyer un patrouilleur côtier pour la première fois à Melilla, exclave espagnole dans le territoire marocain, l’été prochain, relate le quotidien espagnol ABC.Le navire, une fois en service, aurait pour mission de surveiller sans interruption ses eaux, précise le journal.La zone de patrouille du bateau serait concentrée sur les eaux de la mer d’Alboran et, bien sûr, celles de la juridiction espagnole dans la ville autonome de Melilla.'], ['Celle-ci, revendiquée par le Maroc est considérée par Rabat comme étant occupée par les Espagnols.'], ['C’est l’un des plus importants endroits utilisés par les migrants pour entrer sur le territoire européen via le Maroc.'], ['Par conséquent, de fortes tensions s’exercent sur ce terrain.Les caractéristiques et la mission du navireSelon le quotidien, l’appellation du patrouilleur de type P-84 de la classe Rodman 101 est encore inconnue.'], ['Ce navire a été construit dans le chantier naval Rodman Polyships de Vigo.'], ['Avec une longueur de 31,3 mètres et un équipage de dix marins, ce type de bateau a une mitrailleuse de 12,70 mm comme armement principal.Le navire sera intégré à la Force d’action maritime de la marine espagnole.'], ['Des bâtiments de ce type font partie des services douaniers et des garde-côtes espagnols.'], ['Le Maroc en dispose aussi, tout comme le Cameroun, le Nicaragua, Oman, les Philippines, et le Suriname.']]]","[[['autorités', 'espagnoles', 'patrouilleur', 'côtier', 'fois', 'melilla', 'exclave', 'espagnole', 'territoire', 'marocain', 'prochain', 'quotidien', 'espagnol', 'navire', 'fois', 'service', 'mission', 'interruption', 'eaux', 'zone', 'patrouille', 'bateau', 'eaux', 'mer', 'alboran', 'sûr', 'juridiction', 'espagnole', 'ville', 'autonome', 'melilla'], ['maroc', 'rabat', 'espagnols'], ['importants', 'endroits', 'migrants', 'territoire', 'européen', 'maroc'], ['conséquent', 'fortes', 'tensions', 'caractéristiques', 'mission', 'navireselon', 'quotidien', 'appellation', 'patrouilleur', 'type', 'classe', 'rodman', 'inconnue'], ['navire', 'chantier', 'naval', 'rodman', 'polyships', 'vigo'], ['longueur', 'mètres', 'équipage', 'marins', 'type', 'bateau', 'mitrailleuse', 'mm', 'armement', 'navire', 'force', 'action', 'maritime', 'marine', 'espagnole'], ['bâtiments', 'type', 'partie', 'services', 'douaniers', 'espagnols'], ['maroc', 'cameroun', 'nicaragua', 'oman', 'philippines', 'suriname']]]","[[['Melilla', 'mer d’Alboran', 'Melilla'], ['Maroc', 'Rabat', 'Espagne'], ['Maroc'], [], [], [], [], ['Maroc', 'Cameroun', 'Nicaragua', 'Oman', 'Philippines', 'Suriname']]]","[[[], [], [], [], [], [], [], []]]","[[['ABC.Le navire'], [], [], [], ['Rodman Polyships de Vigo'], [], [], []]]","{'autorités': 1, 'espagnoles': 1, 'patrouilleur': 2, 'côtier': 1, 'fois': 2, 'melilla': 2, 'exclave': 1, 'espagnole': 3, 'territoire': 2, 'marocain': 1, 'prochain': 1, 'quotidien': 2, 'espagnol': 1, 'navire': 3, 'service': 1, 'mission': 2, 'interruption': 1, 'eaux': 2, 'zone': 1, 'patrouille': 1, 'bateau': 2, 'mer': 1, 'alboran': 1, 'sûr': 1, 'juridiction': 1, 'ville': 1, 'autonome': 1, 'maroc': 3, 'rabat': 1, 'espagnols': 2, 'importants': 1, 'endroits': 1, 'migrants': 1, 'européen': 1, 'conséquent': 1, 'fortes': 1, 'tensions': 1, 'caractéristiques': 1, 'navireselon': 1, 'appellation': 1, 'type': 3, 'classe': 1, 'rodman': 2, 'inconnue': 1, 'chantier': 1, 'naval': 1, 'polyships': 1, 'vigo': 1, 'longueur': 1, 'mètres': 1, 'équipage': 1, 'marins': 1, 'mitrailleuse': 1, 'mm': 1, 'armement': 1, 'force': 1, 'action': 1, 'maritime': 1, 'marine': 1, 'bâtiments': 1, 'partie': 1, 'services': 1, 'douaniers': 1, 'cameroun': 1, 'nicaragua': 1, 'oman': 1, 'philippines': 1, 'suriname': 1}","{'Melilla': 2, 'mer d’Alboran': 1, 'Maroc': 3, 'Rabat': 1, 'Espagne': 1, 'Cameroun': 1, 'Nicaragua': 1, 'Oman': 1, 'Philippines': 1, 'Suriname': 1}",{},"{'ABC.Le navire': 1, 'Rodman Polyships de Vigo': 1}",2023,3,1
1677711600,https://fr.sputniknews.africa/20230302/les-femmes-ne-jouissent-que-des-trois-quarts-des-droits-juridiques-des-hommes-selon-la-bm-1058086874.html,"Les femmes ne jouissent que des trois quarts des droits juridiques des hommes, selon la BM","Les femmes ne jouissent que ""des trois quarts des droits juridiques des hommes et près de 2,4 milliards de femmes en âge de travailler n’ont toujours pas les mêmes droits juridiques que les hommes"", souligne un rapport publié jeudi par la...","""Les progrès en matière d’égalité de traitement pour les femmes ont été les plus faibles depuis 20 ans"", indique le rapport Les Femmes, l'Entreprise et le Droit 2023 de la Banque mondiale (BM). Le score moyen mondial de l’indice est de 77,1 sur 100 en 2022, soit seulement un demi-point de plus qu’en 2021, relève la même source.Réformes lancées dans 18 paysDepuis 2021, 18 économies ont introduit un total de 34 réformes en faveur de l’égalité entre les sexes dans tous les domaines mesurés par l’indice Les Femmes, l’Entreprise et le Droit, soit le nombre le plus faible depuis 2001, ajoute le rapport. La plupart des réformes ont porté sur l’augmentation des congés payés pour les deux parents, la suppression des restrictions relatives au travail des femmes et l’obligation de garantir l’égalité salariale. Au cours des cinq dernières décennies, la moyenne mondiale du score de l’indice Les Femmes, l’Entreprise et le Droit a progressé d’environ deux-tiers grâce à plus de 2.000 réformes visant à renforcer les droits juridiques des femmes, indique la Banque mondiale. En 53 ans, les économies ont introduit le nombre impressionnant de 2.151 réformes dans les 35 domaines mesurés, ce qui a permis de faire passer la moyenne mondiale du score de l’indice ""Les Femmes, l’Entreprise et le Droit"" de 45,8 à 77,1 points. Entre 2000 et 2009, plus de 600 réformes ont été introduites, avec un pic de 73 réformes annuelles observé en 2002 et en 2008, note le document. ""Cependant, depuis lors, le rythme des réformes s’est essoufflé et les économies semblent faire montre d’une certaine lassitude à l’égard des réformes dans des domaines juridiques notoirement épineux, tels que la mobilité et les actifs"", déplore le rapport.""En 2022, seules 34 réformes ont été enregistrées, un niveau historiquement bas depuis 2001"", fait remarquer le rapport, ajoutant qu'il faudra encore 1.549 réformes pour atteindre l’égalité entre les sexes aux yeux de la loi partout dans le monde. Parité entre les sexes dans 14 paysSelon la même source, seules 14 économies ont atteint la parité juridique entre les sexes en 2022, telle que mesurée par l’indice ""Les Femmes, l’Entreprise et le Droit"" et les progrès ont été inégaux d’une région à l’autre et sur la durée. À travers le monde, chaque économie a mis en œuvre au moins une réforme depuis 1970, permettant aux femmes dde se rapprocher de la parité selon la loi, souligne le dossier. ""Malgré ces progrès, les disparités entre les sexes persistent dans toutes les régions et à tous les niveaux de revenus"", note le document, ajoutant que 176 économies ont encore des progrès à faire. Sur l’ensemble des domaines mesurés, les réformes les plus nombreuses ont concerné la lutte contre la violence domestique, l’interdiction de la discrimination basée sur le sexe en matière d’emploi et la législation sur le harcèlement sexuel. ""Bien que des efforts de réformes soient entrepris dans le monde entier, il subsiste aujourd’hui des écarts considérables en matière de droits des femmes dans toutes les régions, notamment dans les domaines des politiques relatives aux congés et à l’égalité salariale.""Inégalités de salaires dans 93 pays""Quatre-vingt-treize économies n’imposent toujours pas l’égalité de rémunération pour un travail de valeur égale, et certaines économies reviennent même sur des droits pour lesquels les femmes se sont battues longtemps et âprement"", ajoute le rapport. Les Femmes, l’Entreprise et le Droit 2023 est la 9e d’une série d’études annuelles qui mesure les avancées vers la parité dans 190 économies en examinant les lois et réglementations qui affectent les opportunités économiques des femmes. Le projet présente huit indicateurs, structurés autour des interactions des femmes avec la loi au cours de leur vie et leur carrière: mobilité, travail, rémunération, mariage, parentalité, entrepreneuriat, actifs et retraite.","[[['""Les progrès en matière d’égalité de traitement pour les femmes ont été les plus faibles depuis 20 ans"", indique le rapport Les Femmes, l\'Entreprise et le Droit 2023 de la Banque mondiale (BM).'], ['Le score moyen mondial de l’indice est de 77,1 sur 100 en 2022, soit seulement un demi-point de plus qu’en 2021, relève la même source.Réformes lancées dans 18 paysDepuis 2021, 18 économies ont introduit un total de 34 réformes en faveur de l’égalité entre les sexes dans tous les domaines mesurés par l’indice Les Femmes, l’Entreprise et le Droit, soit le nombre le plus faible depuis 2001, ajoute le rapport.'], ['La plupart des réformes ont porté sur l’augmentation des congés payés pour les deux parents, la suppression des restrictions relatives au travail des femmes et l’obligation de garantir l’égalité salariale.'], ['Au cours des cinq dernières décennies, la moyenne mondiale du score de l’indice Les Femmes, l’Entreprise et le Droit a progressé d’environ deux-tiers grâce à plus de 2.000 réformes visant à renforcer les droits juridiques des femmes, indique la Banque mondiale.'], ['En 53 ans, les économies ont introduit le nombre impressionnant de 2.151 réformes dans les 35 domaines mesurés, ce qui a permis de faire passer la moyenne mondiale du score de l’indice ""Les Femmes, l’Entreprise et le Droit"" de 45,8 à 77,1 points.'], ['Entre 2000 et 2009, plus de 600 réformes ont été introduites, avec un pic de 73 réformes annuelles observé en 2002 et en 2008, note le document.'], ['""Cependant, depuis lors, le rythme des réformes s’est essoufflé et les économies semblent faire montre d’une certaine lassitude à l’égard des réformes dans des domaines juridiques notoirement épineux, tels que la mobilité et les actifs"", déplore le rapport.'], ['""En 2022, seules 34 réformes ont été enregistrées, un niveau historiquement bas depuis 2001"", fait remarquer le rapport, ajoutant qu\'il faudra encore 1.549 réformes pour atteindre l’égalité entre les sexes aux yeux de la loi partout dans le monde.'], ['Parité entre les sexes dans 14 paysSelon la même source, seules 14 économies ont atteint la parité juridique entre les sexes en 2022, telle que mesurée par l’indice ""Les Femmes, l’Entreprise et le Droit"" et les progrès ont été inégaux d’une région à l’autre et sur la durée.'], ['À travers le monde, chaque économie a mis en œuvre au moins une réforme depuis 1970, permettant aux femmes dde se rapprocher de la parité selon la loi, souligne le dossier.'], ['""Malgré ces progrès, les disparités entre les sexes persistent dans toutes les régions et à tous les niveaux de revenus"", note le document, ajoutant que 176 économies ont encore des progrès à faire.'], ['Sur l’ensemble des domaines mesurés, les réformes les plus nombreuses ont concerné la lutte contre la violence domestique, l’interdiction de la discrimination basée sur le sexe en matière d’emploi et la législation sur le harcèlement sexuel.'], ['""Bien que des efforts de réformes soient entrepris dans le monde entier, il subsiste aujourd’hui des écarts considérables en matière de droits des femmes dans toutes les régions, notamment dans les domaines des politiques relatives aux congés et à l’égalité salariale.'], ['""Inégalités de salaires dans 93 pays""Quatre-vingt-treize économies n’imposent toujours pas l’égalité de rémunération pour un travail de valeur égale, et certaines économies reviennent même sur des droits pour lesquels les femmes se sont battues longtemps et âprement"", ajoute le rapport.'], ['Les Femmes, l’Entreprise et le Droit 2023 est la 9e d’une série d’études annuelles qui mesure les avancées vers la parité dans 190 économies en examinant les lois et réglementations qui affectent les opportunités économiques des femmes.'], ['Le projet présente huit indicateurs, structurés autour des interactions des femmes avec la loi au cours de leur vie et leur carrière: mobilité, travail, rémunération, mariage, parentalité, entrepreneuriat, actifs et retraite.']]]","[[['progrès', 'matière', 'égalité', 'traitement', 'femmes', 'faibles', 'ans', 'rapport', 'femmes', 'entreprise', 'droit', 'banque', 'mondiale'], ['score', 'moyen', 'mondial', 'indice', 'paysdepuis', 'économies', 'total', 'réformes', 'faveur', 'égalité', 'sexes', 'domaines', 'indice', 'femmes', 'entreprise', 'droit', 'nombre', 'faible', 'rapport'], ['plupart', 'réformes', 'augmentation', 'congés', 'parents', 'suppression', 'restrictions', 'relatives', 'travail', 'femmes', 'obligation', 'égalité', 'salariale'], ['cours', 'dernières', 'décennies', 'moyenne', 'mondiale', 'score', 'indice', 'femmes', 'entreprise', 'droit', 'tiers', 'grâce', 'réformes', 'droits', 'juridiques', 'femmes', 'banque', 'mondiale'], ['ans', 'économies', 'nombre', 'impressionnant', 'réformes', 'domaines', 'moyenne', 'mondiale', 'score', 'indice', 'femmes', 'entreprise', 'droit', 'points'], ['réformes', 'pic', 'réformes', 'annuelles', 'note', 'document'], ['rythme', 'réformes', 'économies', 'lassitude', 'égard', 'réformes', 'domaines', 'juridiques', 'épineux', 'mobilité', 'actifs', 'rapport'], ['réformes', 'niveau', 'rapport', 'réformes', 'égalité', 'sexes', 'yeux', 'loi', 'monde'], ['parité', 'sexes', 'paysselon', 'source', 'économies', 'parité', 'juridique', 'sexes', 'indice', 'femmes', 'entreprise', 'droit', 'progrès', 'inégaux', 'région', 'durée'], ['travers', 'monde', 'économie', 'œuvre', 'réforme', 'femmes', 'dde', 'parité', 'loi', 'dossier'], ['progrès', 'disparités', 'sexes', 'régions', 'niveaux', 'revenus', 'note', 'document', 'économies', 'progrès'], ['ensemble', 'domaines', 'réformes', 'lutte', 'violence', 'domestique', 'interdiction', 'discrimination', 'sexe', 'matière', 'emploi', 'législation', 'harcèlement', 'sexuel'], ['efforts', 'réformes', 'monde', 'entier', 'écarts', 'considérables', 'matière', 'droits', 'femmes', 'régions', 'domaines', 'politiques', 'relatives', 'congés', 'égalité', 'salariale'], ['inégalités', 'salaires', 'économies', 'égalité', 'rémunération', 'travail', 'valeur', 'égale', 'économies', 'droits', 'femmes', 'rapport'], ['femmes', 'entreprise', 'droit', 'série', 'études', 'annuelles', 'avancées', 'parité', 'économies', 'lois', 'réglementations', 'opportunités', 'économiques', 'femmes'], ['projet', 'indicateurs', 'interactions', 'femmes', 'loi', 'cours', 'vie', 'carrière', 'mobilité', 'travail', 'rémunération', 'mariage', 'parentalité', 'entrepreneuriat', 'actifs', 'retraite']]]","[[[], [], [], [], [], [], [], [], [], [], [], [], [], [], [], []]]","[[['Banque mondiale', 'BM'], ['Entreprise et le Droit'], [], ['Entreprise et le Droit', 'Banque mondiale'], ['Femmes', 'Entreprise et le Droit'], [], [], [], ['Femmes', 'Entreprise et le Droit'], [], [], [], [], [], ['Femmes', 'Entreprise et le Droit 2023'], []]]","[[[], [], [], [], [], [], [], [], [], ['dde'], [], [], [], [], [], []]]","{'progrès': 4, 'matière': 3, 'égalité': 6, 'traitement': 1, 'femmes': 14, 'faibles': 1, 'ans': 2, 'rapport': 5, 'entreprise': 6, 'droit': 6, 'banque': 2, 'mondiale': 4, 'score': 3, 'moyen': 1, 'mondial': 1, 'indice': 5, 'paysdepuis': 1, 'économies': 8, 'total': 1, 'réformes': 12, 'faveur': 1, 'sexes': 5, 'domaines': 5, 'nombre': 2, 'faible': 1, 'plupart': 1, 'augmentation': 1, 'congés': 2, 'parents': 1, 'suppression': 1, 'restrictions': 1, 'relatives': 2, 'travail': 3, 'obligation': 1, 'salariale': 2, 'cours': 2, 'dernières': 1, 'décennies': 1, 'moyenne': 2, 'tiers': 1, 'grâce': 1, 'droits': 3, 'juridiques': 2, 'impressionnant': 1, 'points': 1, 'pic': 1, 'annuelles': 2, 'note': 2, 'document': 2, 'rythme': 1, 'lassitude': 1, 'égard': 1, 'épineux': 1, 'mobilité': 2, 'actifs': 2, 'niveau': 1, 'yeux': 1, 'loi': 3, 'monde': 3, 'parité': 4, 'paysselon': 1, 'source': 1, 'juridique': 1, 'inégaux': 1, 'région': 1, 'durée': 1, 'travers': 1, 'économie': 1, 'œuvre': 1, 'réforme': 1, 'dde': 1, 'dossier': 1, 'disparités': 1, 'régions': 2, 'niveaux': 1, 'revenus': 1, 'ensemble': 1, 'lutte': 1, 'violence': 1, 'domestique': 1, 'interdiction': 1, 'discrimination': 1, 'sexe': 1, 'emploi': 1, 'législation': 1, 'harcèlement': 1, 'sexuel': 1, 'efforts': 1, 'entier': 1, 'écarts': 1, 'considérables': 1, 'politiques': 1, 'inégalités': 1, 'salaires': 1, 'rémunération': 2, 'valeur': 1, 'égale': 1, 'série': 1, 'études': 1, 'avancées': 1, 'lois': 1, 'réglementations': 1, 'opportunités': 1, 'économiques': 1, 'projet': 1, 'indicateurs': 1, 'interactions': 1, 'vie': 1, 'carrière': 1, 'mariage': 1, 'parentalité': 1, 'entrepreneuriat': 1, 'retraite': 1}",{},"{'Banque mondiale': 2, 'BM': 1, 'Entreprise et le Droit': 4, 'Femmes': 3, 'Entreprise et le Droit 2023': 1}",{'dde': 1},2023,3,1
