timestamp,url,title,description,content,content-segmented,kws-l,loc-l,org-l,per-l,kws,loc,org,per,year,month,day
1676242800,https://fr.sputniknews.africa/20230213/afrique-du-sud-le-plus-grand-elevage-de-rhinoceros-au-monde-mis-aux-encheres-1057908973.html,Afrique du Sud: le plus grand élevage de rhinocéros au monde mis aux enchères,"Le plus grand élevage de rhinocéros au monde, situé en Afrique du Sud, sera mis aux enchères en avril par son propriétaire qui ploie sous des coûts exorbitants avec son projet visant à sauver l'espèce menacée par le braconnage, a annoncé...","Le richissime homme d'affaires sud-africain, John Hume, 81 ans, avait ouvert en 2009 cet élevage dans une propriété de 8.500 hectares dans le nord-ouest du pays. L'exploitation compte aujourd'hui de 2.000 rhinocéros blancs et emploie une centaine de personnes. L'an dernier, il avait annoncé prévoir de remettre chaque année à l'état sauvage une centaine de spécimens.""L'élevage de rhinocéros est un loisir coûteux"", a-t-il expliqué lundi à l'AFP. Ajoutant élever des rhinocéros ""depuis 30 ans sans réaliser de profit"", il a notamment expliqué que s'occuper d'un spécimen jusqu'à l'âge de quatre ans peut coûter plus de 500.000 rands (26.000 euros). L'organisation qui gère le projet, Platinum Rhino, a expliqué dans un communiqué être à la recherche ""idéalement d'un acheteur, une personne ou une fondation, avec une passion pour la conservation des rhinocéros et les moyens pour continuer leur élevage"". Les cornes, cible du braconnageL'Afrique du Sud abrite près de 80% de la population mondiale de rhinocéros. Le pays est devenu un haut lieu du braconnage, poussé par la demande asiatique, où les cornes sont utilisées en médecine traditionnelle pour leurs supposés effets thérapeutiques ou aphrodisiaques. En 2022, 448 rhinocéros ont été tués en Afrique du Sud, soit trois de moins que l'année précédente, selon le gouvernement, conséquence selon lui des mesures anti braconnage renforcées prises dans les parcs nationaux. En 2017, John Hume avait organisé une vente en ligne controversée de cornes de rhinocéros pour récolter des fonds pour financer leur conservation, provoquant l'indignation des défenseurs de l'environnement. Les cornes en vente étaient issues d'opérations d'écornage: pour éviter les attaques de braconniers, les gros mammifères terrestres sont anesthésiés et leur corne coupée par un vétérinaire. La procédure est indolore et la corne repousse ensuite. La corne de rhinocéros, composée que de kératine, s'arrache à 60.000 dollars le kilo sur le marché noir, soit plus que la cocaïne.","[[[""Le richissime homme d'affaires sud-africain, John Hume, 81 ans, avait ouvert en 2009 cet élevage dans une propriété de 8.500 hectares dans le nord-ouest du pays.""], [""L'exploitation compte aujourd'hui de 2.000 rhinocéros blancs et emploie une centaine de personnes.""], [""L'an dernier, il avait annoncé prévoir de remettre chaque année à l'état sauvage une centaine de spécimens.""], ['""L\'élevage de rhinocéros est un loisir coûteux"", a-t-il expliqué lundi à l\'AFP.'], ['Ajoutant élever des rhinocéros ""depuis 30 ans sans réaliser de profit"", il a notamment expliqué que s\'occuper d\'un spécimen jusqu\'à l\'âge de quatre ans peut coûter plus de 500.000 rands (26.000 euros).'], ['L\'organisation qui gère le projet, Platinum Rhino, a expliqué dans un communiqué être à la recherche ""idéalement d\'un acheteur, une personne ou une fondation, avec une passion pour la conservation des rhinocéros et les moyens pour continuer leur élevage"".'], [""Les cornes, cible du braconnageL'Afrique du Sud abrite près de 80% de la population mondiale de rhinocéros.""], ['Le pays est devenu un haut lieu du braconnage, poussé par la demande asiatique, où les cornes sont utilisées en médecine traditionnelle pour leurs supposés effets thérapeutiques ou aphrodisiaques.'], [""En 2022, 448 rhinocéros ont été tués en Afrique du Sud, soit trois de moins que l'année précédente, selon le gouvernement, conséquence selon lui des mesures anti braconnage renforcées prises dans les parcs nationaux.""], [""En 2017, John Hume avait organisé une vente en ligne controversée de cornes de rhinocéros pour récolter des fonds pour financer leur conservation, provoquant l'indignation des défenseurs de l'environnement.""], [""Les cornes en vente étaient issues d'opérations d'écornage: pour éviter les attaques de braconniers, les gros mammifères terrestres sont anesthésiés et leur corne coupée par un vétérinaire.""], ['La procédure est indolore et la corne repousse ensuite.'], [""La corne de rhinocéros, composée que de kératine, s'arrache à 60.000 dollars le kilo sur le marché noir, soit plus que la cocaïne.""]]]","[[['richissime', 'homme', 'affaires', 'john', 'hume', 'ans', 'élevage', 'propriété', 'hectares', 'pays'], ['exploitation', 'rhinocéros', 'blancs', 'centaine', 'personnes'], ['an', 'dernier', 'année', 'état', 'sauvage', 'centaine', 'spécimens'], ['élevage', 'rhinocéros', 'loisir', 'coûteux', 'lundi', 'afp'], ['rhinocéros', 'ans', 'profit', 'spécimen', 'âge', 'ans', 'rands', 'euros'], ['organisation', 'projet', 'platinum', 'rhino', 'communiqué', 'recherche', 'acheteur', 'fondation', 'passion', 'conservation', 'rhinocéros', 'moyens', 'élevage'], ['cornes', 'cible', 'afrique', 'sud', 'population', 'mondiale', 'rhinocéros'], ['pays', 'haut', 'lieu', 'braconnage', 'demande', 'asiatique', 'cornes', 'médecine', 'traditionnelle', 'supposés', 'effets', 'thérapeutiques', 'aphrodisiaques'], ['rhinocéros', 'afrique', 'sud', 'année', 'précédente', 'gouvernement', 'conséquence', 'mesures', 'anti', 'braconnage', 'parcs', 'nationaux'], ['john', 'hume', 'vente', 'ligne', 'cornes', 'rhinocéros', 'fonds', 'conservation', 'indignation', 'défenseurs', 'environnement'], ['cornes', 'vente', 'issues', 'opérations', 'écornage', 'attaques', 'braconniers', 'gros', 'mammifères', 'terrestres', 'corne', 'vétérinaire'], ['procédure', 'indolore', 'corne'], ['corne', 'rhinocéros', 'kératine', 'dollars', 'kilo', 'marché', 'noir', 'cocaïne']]]","[[[], [], [], [], [], [], ['Afrique du Sud'], [], ['Afrique du Sud'], [], [], [], []]]","[[[], [], [], ['AFP'], [], [], [], [], [], [], [], [], []]]","[[['John Hume'], [], [], [], [], [], [], [], [], ['John Hume'], [], [], []]]","{'richissime': 1, 'homme': 1, 'affaires': 1, 'john': 2, 'hume': 2, 'ans': 3, 'élevage': 3, 'propriété': 1, 'hectares': 1, 'pays': 2, 'exploitation': 1, 'rhinocéros': 8, 'blancs': 1, 'centaine': 2, 'personnes': 1, 'an': 1, 'dernier': 1, 'année': 2, 'état': 1, 'sauvage': 1, 'spécimens': 1, 'loisir': 1, 'coûteux': 1, 'lundi': 1, 'afp': 1, 'profit': 1, 'spécimen': 1, 'âge': 1, 'rands': 1, 'euros': 1, 'organisation': 1, 'projet': 1, 'platinum': 1, 'rhino': 1, 'communiqué': 1, 'recherche': 1, 'acheteur': 1, 'fondation': 1, 'passion': 1, 'conservation': 2, 'moyens': 1, 'cornes': 4, 'cible': 1, 'afrique': 2, 'sud': 2, 'population': 1, 'mondiale': 1, 'haut': 1, 'lieu': 1, 'braconnage': 2, 'demande': 1, 'asiatique': 1, 'médecine': 1, 'traditionnelle': 1, 'supposés': 1, 'effets': 1, 'thérapeutiques': 1, 'aphrodisiaques': 1, 'précédente': 1, 'gouvernement': 1, 'conséquence': 1, 'mesures': 1, 'anti': 1, 'parcs': 1, 'nationaux': 1, 'vente': 2, 'ligne': 1, 'fonds': 1, 'indignation': 1, 'défenseurs': 1, 'environnement': 1, 'issues': 1, 'opérations': 1, 'écornage': 1, 'attaques': 1, 'braconniers': 1, 'gros': 1, 'mammifères': 1, 'terrestres': 1, 'corne': 3, 'vétérinaire': 1, 'procédure': 1, 'indolore': 1, 'kératine': 1, 'dollars': 1, 'kilo': 1, 'marché': 1, 'noir': 1, 'cocaïne': 1}",{'Afrique du Sud': 2},{'AFP': 1},{'John Hume': 2},2023,2,12
1676242800,https://fr.sputniknews.africa/20230213/action-de-combat-dhelicopteres-ka-52-russes-en-ukraine-1057907035.html,Action de combat d'hélicoptères Ka-52 russes en Ukraine,"Au cours de leurs missions, des pilotes russes ont lancé des missiles sur des positions fortifiées ukrainiennes. Des véhicules blindés et un poste de commandement de l'ennemi ont été anéantis.","""Nous avons exécuté la tâche d'attaquer une cible de la zone nationaliste ukrainienne. Grâce à notre hélicoptère et aux actions habiles du personnel d'ingénierie, la tâche a été accomplie. Nous sommes revenus sains et saufs. Le mitrailleur aérien avancé a confirmé le travail,"" explique Dmitry, commandant de l'équipage du Ka-52.En outre, les pilotes de l'aviation militaire des forces aériennes russes ont remercié les enfants russes qui écrivent des lettres de soutien aux soldats impliqués dans l'opération militaire spéciale.""Je tiens à exprimer mon immense gratitude à nos enfants qui nous soutiennent dans un cas difficile en nous envoyant des lettres. Ils nous aident beaucoup"", a dit Dmitry.","[[['""Nous avons exécuté la tâche d\'attaquer une cible de la zone nationaliste ukrainienne.'], [""Grâce à notre hélicoptère et aux actions habiles du personnel d'ingénierie, la tâche a été accomplie.""], ['Nous sommes revenus sains et saufs.'], ['Le mitrailleur aérien avancé a confirmé le travail,"" explique Dmitry, commandant de l\'équipage du Ka-52.En outre, les pilotes de l\'aviation militaire des forces aériennes russes ont remercié les enfants russes qui écrivent des lettres de soutien aux soldats impliqués dans l\'opération militaire spéciale.'], ['""Je tiens à exprimer mon immense gratitude à nos enfants qui nous soutiennent dans un cas difficile en nous envoyant des lettres.'], ['Ils nous aident beaucoup"", a dit Dmitry.']]]","[[['tâche', 'cible', 'zone', 'nationaliste', 'ukrainienne'], ['grâce', 'hélicoptère', 'actions', 'habiles', 'personnel', 'ingénierie', 'tâche'], ['revenus', 'sains'], ['mitrailleur', 'aérien', 'travail', 'commandant', 'équipage', 'pilotes', 'aviation', 'militaire', 'forces', 'aériennes', 'russes', 'enfants', 'russes', 'lettres', 'soutien', 'soldats', 'opération', 'militaire', 'spéciale'], ['immense', 'gratitude', 'enfants', 'cas', 'difficile', 'lettres'], []]]","[[[], [], [], [], [], []]]","[[[], [], [], [], [], []]]","[[[], [], [], ['Dmitry', 'Ka-52.En'], [], ['Dmitry']]]","{'tâche': 2, 'cible': 1, 'zone': 1, 'nationaliste': 1, 'ukrainienne': 1, 'grâce': 1, 'hélicoptère': 1, 'actions': 1, 'habiles': 1, 'personnel': 1, 'ingénierie': 1, 'revenus': 1, 'sains': 1, 'mitrailleur': 1, 'aérien': 1, 'travail': 1, 'commandant': 1, 'équipage': 1, 'pilotes': 1, 'aviation': 1, 'militaire': 2, 'forces': 1, 'aériennes': 1, 'russes': 2, 'enfants': 2, 'lettres': 2, 'soutien': 1, 'soldats': 1, 'opération': 1, 'spéciale': 1, 'immense': 1, 'gratitude': 1, 'cas': 1, 'difficile': 1}",{},{},"{'Dmitry': 2, 'Ka-52.En': 1}",2023,2,12
1676242800,https://fr.sputniknews.africa/20230213/-arretez-de-boire-de-leau-puisquelle-est-europeenne-lambassadeur-francais-au-niger-sexcuse-1057908483.html,"""Arrêtez de boire de l’eau puisqu’elle est européenne"": l’ambassadeur français au Niger s’excuse","L’ambassadeur français au Niger a provoqué un tollé, en affirmant que l’eau collectée dans le pays était ""européenne"", car parfois traitée à l’aide des partenariats occidentaux. Le diplomate s’est par la suite excusé.","Sylvain Itté, ambassadeur de France au Niger, a dérapé dans les grandes largeurs. Voulant ironiser sur les collaborations russes en Afrique, le diplomate s’est pris les pieds dans le tapis, allant jusqu’à affirmer que l’eau collectée à Niamey était… européenne!Une sortie qui a évidemment suscité l’indignation sur les réseaux sociaux. La France ne prend même plus de pincettes pour afficher sa ""domination coloniale"", a ainsi déclaré sur Twitter Maikoul Zodi, coordinateur du mouvement Tournons la Page. #Niger on n'a plus besoin d'utiliser des gants pour nous dire qu'on est sous domination coloniale @SylvainItte c'est juste une question de temps vous allez quitter le Sahel la queue entre les jambes. @Ventoux5_Z soit heureuse pic.twitter.com/cgAzlYtiSO— Maikoul Zodi (@bougeangard) February 8, 2023 Si l’eau du Niger, parfois traitée à l’aide occidentale, est européenne, cela signifie que Bruxelles s’ingère dans les affaires de Niamey, a pour sa part ironisé l’ancien sénateur ivoirien Jean-Baptiste Pany. Il a rappelé que les centrales nucléaires françaises marchaient quant à elles à l’uranium nigérien. L’eau consommée à Niamey serait européenne, ce qui induirait une ingérences dans la vie politique du #Niger par @EU_Commission. C’est ce que laisse supposer le tweet de @SylvainItte oubliant que les centrales nucléaires européennes sont à l’uranium extorqué au Niger. #courtoisie— Jean-Baptiste PANY (@jean_pany) February 11, 2023 Le politologue Gnamien Attoubré a souligné qu’il ne fallait pas s’étonner de la flambée des ""sentiments anti-français"" en Afrique, après des propos si ""condescendants"". Ce sont ces genres de comportements condescendants qui alimentent ce que vous appelez ""sentiments anti-français"" vous ne vous rendez pas compte que chaque jour la France sort des cours en Afrique ? Remettez vous en cause.— Gnamien Attoubré (@AttoubreGnamien) February 10, 2023 Le lanceur d’alerte El Hadji Issa a pour sa part donné une petite leçon d’hydrographie, soulignant que les nappes phréatiques européennes n’avaient pas grand-chose à voir avec l’eau extraite au Niger. M.@SylvainItte, nous ne savons pas que l'eau consommée à Niamey provient de la nappe européenne. Quoi que vous fassiez, le peuple Nigerien a déjà vomi la politique désastreuse de la France au Niger et au Sahel en général.— El Hadji Issa (@IssaMou73131632) February 9, 2023 L’ambassadeur s’excuseFace à cette vague d’indignation, l’ambassadeur français a finalement fait machine arrière. Il a présenté ses excuses dans un nouveau message, expliquant que ""l’eau du Niger appartenait bien aux Nigériens"". Il a affirmé que ses propos avaient été déformés. Excuses auprès des Nigeriens que j'ai pu heurter.Ma volonté était de souligner que les européens travaillent avec leurs partenaires nigeriens au service de la population du Niger. Bien entendu l'eau du Niger appartient aux nigeriens. Mes propos ont été volontairement déformés.— Sylvain Itté (@SylvainItte) February 10, 2023 Des excuses qui n’ont visiblement pas suffi à apaiser les esprits. Le militant Nassirou Bodo a ainsi estimé que les propos du diplomate n’avaient en rien été détournés. Il a fustigé le ""complexe de colon"" du haut fonctionnaire, ajoutant que la France était désormais ""indésirable"" au Niger. M. @SylvainItte personne n'a déformé vos propos à la con, arrogants et méprisants. C'est le fruit de votre complexe de colon se croyant toujours en terrain colonial conquis. Vos excuses, nous n'en avons que cure. Dégagez de notre pays tout simplement. Vous y êtes indésirable. #NB pic.twitter.com/o1bN78BKB0— Nassirou Bodo (@4Bodo) February 10, 2023 Déterminé à combattre la recrudescence du terrorisme, qui sévit notamment dans la région des ""trois frontières"", le Niger a noué des partenariats sécuritaires avec Moscou. Plus d’une centaine d’officiers nigériens ont notamment profité de formations en Russie. Une ""coopération bénéfique"" avait souligné le ministre nigérien de la Défense Alkassoum Indatou mi-novembre.","[[['Sylvain Itté, ambassadeur de France au Niger, a dérapé dans les grandes largeurs.'], ['Voulant ironiser sur les collaborations russes en Afrique, le diplomate s’est pris les pieds dans le tapis, allant jusqu’à affirmer que l’eau collectée à Niamey était… européenne!Une sortie qui a évidemment suscité l’indignation sur les réseaux sociaux.'], ['La France ne prend même plus de pincettes pour afficher sa ""domination coloniale"", a ainsi déclaré sur Twitter Maikoul Zodi, coordinateur du mouvement Tournons la Page.'], [""#Niger on n'a plus besoin d'utiliser des gants pour nous dire qu'on est sous domination coloniale @SylvainItte c'est juste une question de temps vous allez quitter le Sahel la queue entre les jambes.""], ['@Ventoux5_Z soit heureuse pic.twitter.com/cgAzlYtiSO— Maikoul Zodi (@bougeangard) February 8, 2023 Si l’eau du Niger, parfois traitée à l’aide occidentale, est européenne, cela signifie que Bruxelles s’ingère dans les affaires de Niamey, a pour sa part ironisé l’ancien sénateur ivoirien Jean-Baptiste Pany.'], ['Il a rappelé que les centrales nucléaires françaises marchaient quant à elles à l’uranium nigérien.'], ['L’eau consommée à Niamey serait européenne, ce qui induirait une ingérences dans la vie politique du #Niger par @EU_Commission.'], ['C’est ce que laisse supposer le tweet de @SylvainItte oubliant que les centrales nucléaires européennes sont à l’uranium extorqué au Niger.'], ['#courtoisie— Jean-Baptiste PANY (@jean_pany) February 11, 2023 Le politologue Gnamien Attoubré a souligné qu’il ne fallait pas s’étonner de la flambée des ""sentiments anti-français"" en Afrique, après des propos si ""condescendants"".'], ['Ce sont ces genres de comportements condescendants qui alimentent ce que vous appelez ""sentiments anti-français"" vous ne vous rendez pas compte que chaque jour la France sort des cours en Afrique ?'], ['Remettez vous en cause.— Gnamien Attoubré (@AttoubreGnamien) February 10, 2023 Le lanceur d’alerte El Hadji Issa a pour sa part donné une petite leçon d’hydrographie, soulignant que les nappes phréatiques européennes n’avaient pas grand-chose à voir avec l’eau extraite au Niger.'], [""M.@SylvainItte, nous ne savons pas que l'eau consommée à Niamey provient de la nappe européenne.""], ['Quoi que vous fassiez, le peuple Nigerien a déjà vomi la politique désastreuse de la France au Niger et au Sahel en général.— El Hadji Issa (@IssaMou73131632) February 9, 2023 L’ambassadeur s’excuseFace à cette vague d’indignation, l’ambassadeur français a finalement fait machine arrière.'], ['Il a présenté ses excuses dans un nouveau message, expliquant que ""l’eau du Niger appartenait bien aux Nigériens"".'], ['Il a affirmé que ses propos avaient été déformés.'], [""Excuses auprès des Nigeriens que j'ai pu heurter.Ma volonté était de souligner que les européens travaillent avec leurs partenaires nigeriens au service de la population du Niger.""], [""Bien entendu l'eau du Niger appartient aux nigeriens.""], ['Mes propos ont été volontairement déformés.— Sylvain Itté (@SylvainItte) February 10, 2023 Des excuses qui n’ont visiblement pas suffi à apaiser les esprits.'], ['Le militant Nassirou Bodo a ainsi estimé que les propos du diplomate n’avaient en rien été détournés.'], ['Il a fustigé le ""complexe de colon"" du haut fonctionnaire, ajoutant que la France était désormais ""indésirable"" au Niger.'], [""M. @SylvainItte personne n'a déformé vos propos à la con, arrogants et méprisants.""], [""C'est le fruit de votre complexe de colon se croyant toujours en terrain colonial conquis.""], [""Vos excuses, nous n'en avons que cure.""], ['Dégagez de notre pays tout simplement.'], ['Vous y êtes indésirable.'], ['#NB pic.twitter.com/o1bN78BKB0— Nassirou Bodo (@4Bodo) February 10, 2023 Déterminé à combattre la recrudescence du terrorisme, qui sévit notamment dans la région des ""trois frontières"", le Niger a noué des partenariats sécuritaires avec Moscou.'], ['Plus d’une centaine d’officiers nigériens ont notamment profité de formations en Russie.'], ['Une ""coopération bénéfique"" avait souligné le ministre nigérien de la Défense Alkassoum Indatou mi-novembre.']]]","[[['sylvain', 'itté', 'ambassadeur', 'france', 'grandes', 'largeurs'], ['collaborations', 'russes', 'afrique', 'diplomate', 'pieds', 'tapis', 'eau', 'niamey', 'indignation', 'réseaux', 'sociaux'], ['france', 'pincettes', 'domination', 'coloniale', 'maikoul', 'zodi', 'coordinateur', 'mouvement', 'page'], ['besoin', 'gants', 'domination', 'coloniale', 'question', 'temps', 'sahel', 'queue', 'jambes'], ['heureuse', 'maikoul', 'zodi', 'eau', 'aide', 'occidentale', 'européenne', 'bruxelles', 'affaires', 'niamey', 'part', 'ancien', 'sénateur', 'ivoirien', 'pany'], ['centrales', 'nucléaires', 'françaises', 'uranium', 'nigérien'], ['eau', 'niamey', 'européenne', 'ingérences', 'vie', 'politique'], ['tweet', 'centrales', 'nucléaires', 'européennes', 'uranium'], ['pany', 'february', 'politologue', 'gnamien', 'attoubré', 'flambée', 'sentiments', 'afrique', 'propos', 'condescendants'], ['genres', 'comportements', 'condescendants', 'sentiments', 'compte', 'jour', 'france', 'cours', 'afrique'], ['gnamien', 'attoubré', 'february', 'lanceur', 'alerte', 'hadji', 'issa', 'part', 'petite', 'leçon', 'hydrographie', 'nappes', 'phréatiques', 'européennes', 'eau'], ['eau', 'niamey', 'nappe', 'européenne'], ['peuple', 'politique', 'désastreuse', 'france', 'sahel', 'hadji', 'issa', 'february', 'ambassadeur', 'vague', 'indignation', 'ambassadeur', 'français', 'machine', 'arrière'], ['excuses', 'message', 'eau', 'nigériens'], ['propos'], ['excuses', 'volonté', 'européens', 'partenaires', 'nigeriens', 'service', 'population'], ['eau', 'nigeriens'], ['propos', 'sylvain', 'itté', 'february', 'excuses', 'esprits'], ['militant', 'nassirou', 'bodo', 'propos', 'diplomate'], ['complexe', 'colon', 'haut', 'fonctionnaire', 'france', 'indésirable'], ['propos', 'con', 'arrogants', 'méprisants'], ['fruit', 'complexe', 'colon', 'terrain', 'colonial'], ['excuses', 'cure'], ['pays'], ['indésirable'], ['nassirou', 'bodo', 'recrudescence', 'terrorisme', 'région', 'frontières', 'partenariats', 'sécuritaires', 'moscou'], ['centaine', 'officiers', 'nigériens', 'formations', 'russie'], ['coopération', 'bénéfique', 'ministre', 'nigérien', 'défense']]]","[[['France', 'Niger'], ['Afrique', 'Niamey'], ['France'], ['Sahel'], ['Niger', 'Bruxelles', 'Niamey'], [], ['Niamey', 'Niger'], ['@SylvainItte', 'Niger'], ['Afrique'], ['France', 'Afrique'], ['El Hadji Issa', 'Niger'], ['M.@SylvainItte', 'Niamey'], ['Nigerien', 'France', 'Niger', 'Sahel', 'El Hadji'], ['Niger', 'Niger'], [], ['Nigeriens', 'Niger'], ['Niger'], [], [], ['France', 'Niger'], [], [], [], [], [], ['Déterminé', 'Niger', 'Moscou'], ['Russie'], []]]","[[[], [], ['mouvement Tournons la Page'], [], [], [], [], [], [], [], [], [], [], [], [], [], [], [], [], [], [], [], [], [], [], ['Nassirou Bodo'], [], ['ministre nigérien de la Défense']]]","[[['Sylvain Itté'], [], ['Twitter Maikoul Zodi'], [], ['Maikoul Zodi', '@bougeangard', 'Jean-Baptiste Pany'], [], [], [], ['Jean-Baptiste PANY', 'Gnamien Attoubré'], [], ['Gnamien Attoubré'], [], ['@IssaMou73131632'], [], [], [], [], ['Sylvain Itté'], ['Nassirou Bodo'], [], [], [], [], [], [], [], [], ['Alkassoum Indatou']]]","{'sylvain': 2, 'itté': 2, 'ambassadeur': 3, 'france': 5, 'grandes': 1, 'largeurs': 1, 'collaborations': 1, 'russes': 1, 'afrique': 3, 'diplomate': 2, 'pieds': 1, 'tapis': 1, 'eau': 7, 'niamey': 4, 'indignation': 2, 'réseaux': 1, 'sociaux': 1, 'pincettes': 1, 'domination': 2, 'coloniale': 2, 'maikoul': 2, 'zodi': 2, 'coordinateur': 1, 'mouvement': 1, 'page': 1, 'besoin': 1, 'gants': 1, 'question': 1, 'temps': 1, 'sahel': 2, 'queue': 1, 'jambes': 1, 'heureuse': 1, 'aide': 1, 'occidentale': 1, 'européenne': 3, 'bruxelles': 1, 'affaires': 1, 'part': 2, 'ancien': 1, 'sénateur': 1, 'ivoirien': 1, 'pany': 2, 'centrales': 2, 'nucléaires': 2, 'françaises': 1, 'uranium': 2, 'nigérien': 2, 'ingérences': 1, 'vie': 1, 'politique': 2, 'tweet': 1, 'européennes': 2, 'february': 4, 'politologue': 1, 'gnamien': 2, 'attoubré': 2, 'flambée': 1, 'sentiments': 2, 'propos': 5, 'condescendants': 2, 'genres': 1, 'comportements': 1, 'compte': 1, 'jour': 1, 'cours': 1, 'lanceur': 1, 'alerte': 1, 'hadji': 2, 'issa': 2, 'petite': 1, 'leçon': 1, 'hydrographie': 1, 'nappes': 1, 'phréatiques': 1, 'nappe': 1, 'peuple': 1, 'désastreuse': 1, 'vague': 1, 'français': 1, 'machine': 1, 'arrière': 1, 'excuses': 4, 'message': 1, 'nigériens': 2, 'volonté': 1, 'européens': 1, 'partenaires': 1, 'nigeriens': 2, 'service': 1, 'population': 1, 'esprits': 1, 'militant': 1, 'nassirou': 2, 'bodo': 2, 'complexe': 2, 'colon': 2, 'haut': 1, 'fonctionnaire': 1, 'indésirable': 2, 'con': 1, 'arrogants': 1, 'méprisants': 1, 'fruit': 1, 'terrain': 1, 'colonial': 1, 'cure': 1, 'pays': 1, 'recrudescence': 1, 'terrorisme': 1, 'région': 1, 'frontières': 1, 'partenariats': 1, 'sécuritaires': 1, 'moscou': 1, 'centaine': 1, 'officiers': 1, 'formations': 1, 'russie': 1, 'coopération': 1, 'bénéfique': 1, 'ministre': 1, 'défense': 1}","{'France': 5, 'Niger': 12, 'Afrique': 3, 'Niamey': 4, 'Sahel': 2, 'Bruxelles': 1, '@SylvainItte': 1, 'El Hadji Issa': 1, 'M.@SylvainItte': 1, 'Nigerien': 1, 'El Hadji': 1, 'Nigeriens': 1, 'Déterminé': 1, 'Moscou': 1, 'Russie': 1}","{'mouvement Tournons la Page': 1, 'Nassirou Bodo': 1, 'ministre nigérien de la Défense': 1}","{'Sylvain Itté': 2, 'Twitter Maikoul Zodi': 1, 'Maikoul Zodi': 1, '@bougeangard': 1, 'Jean-Baptiste Pany': 1, 'Jean-Baptiste PANY': 1, 'Gnamien Attoubré': 2, '@IssaMou73131632': 1, 'Nassirou Bodo': 1, 'Alkassoum Indatou': 1}",2023,2,12
