timestamp,url,title,description,content,content-segmented,kws-l,loc-l,org-l,per-l,kws,loc,org,per,year,month,day
1685743200,https://fr.sputniknews.africa/20230603/loccident-creve-denvie-devant-le-succes-de-larmement-russe-selon-moscou-1059697887.html,"L’Occident crève d’envie devant le succès de l’armement russe, selon Moscou","L’appel de Londres à ne plus acheter d’armements à Moscou trahit l’envie des Occidentaux devant la popularité du matériel russe sur les marchés, a déclaré le Service fédéral de coopération militaro-technique russe.","La jalousie est un vilain défaut. L'appel du secrétaire britannique à la Défense, Ben Wallace, ""à ne pas dépenser d'argent pour les armes russes"" est un aveu d’envie, a jugé le Service fédéral de coopération militaro-technique russe (FSVTS) dans un communiqué. Londres enrage face à la popularité des équipements russes sur les marchés et vise sous la ceinture, estime l’organe fédéral.""Nous considérons les propos du ministre britannique comme une nouvelle manifestation de concurrence déloyale et une marque d'envie de la part des États occidentaux qui, dans le contexte de la popularité croissante des armes russes, n'ont d'autre choix que de recourir au chantage politique et au tapage médiatique"", déclare ainsi le FSVTS dans son message.Le service affirme que le matériel suscite un intérêt grandissant à l’étranger, en particulier concernant les chasseurs, les hélicoptères de combat, les véhicules blindés et les systèmes de lance-roquettes multiples. Ce qui tend à confirmer que l’armement a fait ses preuves, en matière d’efficacité comme de fiabilité.Marché noirLe FSVTS se dit par ailleurs inquiet de l’approvisionnement en armes occidentales de l’Ukraine, soulignant que nombre d’entre elles atterrissent sur le marché noir. Un flux continu qui finit par alimenter la propagation du terrorisme international et de l’extrémisme, note le service.Certaines de ces armes ont déjà rejoint l'Afrique, avait d’ailleurs déploré le Président nigérian, Muhammadu Buhari, fin novembre. Une partie d’entre elles irrigue à présent le bassin du lac Tchad, avait-il précisé.La police criminelle finlandaise a pour sa part confirmé que des armes initialement livrées à l’Ukraine avaient été retrouvées en Suède, au Danemark et aux Pays-Bas.Plus tôt, Ben Wallace avait déclaré, au cours du dialogue de Shangri-La, que les importateurs d’armes russes devraient les retourner au vendeur et ""ne pas gaspiller d’argent"" en achetant du matériel à Moscou.","[[['La jalousie est un vilain défaut.'], ['L\'appel du secrétaire britannique à la Défense, Ben Wallace, ""à ne pas dépenser d\'argent pour les armes russes"" est un aveu d’envie, a jugé le Service fédéral de coopération militaro-technique russe (FSVTS) dans un communiqué.'], ['Londres enrage face à la popularité des équipements russes sur les marchés et vise sous la ceinture, estime l’organe fédéral.'], ['""Nous considérons les propos du ministre britannique comme une nouvelle manifestation de concurrence déloyale et une marque d\'envie de la part des États occidentaux qui, dans le contexte de la popularité croissante des armes russes, n\'ont d\'autre choix que de recourir au chantage politique et au tapage médiatique"", déclare ainsi le FSVTS dans son message.Le service affirme que le matériel suscite un intérêt grandissant à l’étranger, en particulier concernant les chasseurs, les hélicoptères de combat, les véhicules blindés et les systèmes de lance-roquettes multiples.'], ['Ce qui tend à confirmer que l’armement a fait ses preuves, en matière d’efficacité comme de fiabilité.Marché noirLe FSVTS se dit par ailleurs inquiet de l’approvisionnement en armes occidentales de l’Ukraine, soulignant que nombre d’entre elles atterrissent sur le marché noir.'], [""Un flux continu qui finit par alimenter la propagation du terrorisme international et de l’extrémisme, note le service.Certaines de ces armes ont déjà rejoint l'Afrique, avait d’ailleurs déploré le Président nigérian, Muhammadu Buhari, fin novembre.""], ['Une partie d’entre elles irrigue à présent le bassin du lac Tchad, avait-il précisé.La police criminelle finlandaise a pour sa part confirmé que des armes initialement livrées à l’Ukraine avaient été retrouvées en Suède, au Danemark et aux Pays-Bas.Plus tôt, Ben Wallace avait déclaré, au cours du dialogue de Shangri-La, que les importateurs d’armes russes devraient les retourner au vendeur et ""ne pas gaspiller d’argent"" en achetant du matériel à Moscou.']]]","[[['jalousie', 'vilain', 'défaut'], ['appel', 'secrétaire', 'britannique', 'défense', 'ben', 'wallace', 'argent', 'armes', 'russes', 'aveu', 'envie', 'service', 'fédéral', 'coopération', 'militaro', 'technique', 'russe', 'fsvts', 'communiqué'], ['enrage', 'face', 'popularité', 'équipements', 'russes', 'marchés', 'ceinture', 'organe', 'fédéral'], ['propos', 'ministre', 'britannique', 'nouvelle', 'manifestation', 'concurrence', 'déloyale', 'marque', 'envie', 'part', 'états', 'occidentaux', 'contexte', 'popularité', 'croissante', 'armes', 'russes', 'choix', 'chantage', 'politique', 'tapage', 'médiatique', 'fsvts', 'service', 'matériel', 'intérêt', 'étranger', 'particulier', 'chasseurs', 'hélicoptères', 'combat', 'véhicules', 'blindés', 'systèmes', 'roquettes', 'multiples'], ['armement', 'preuves', 'matière', 'efficacité', 'noirle', 'fsvts', 'inquiet', 'approvisionnement', 'armes', 'occidentales', 'ukraine', 'nombre', 'marché', 'noir'], ['flux', 'continu', 'propagation', 'terrorisme', 'international', 'extrémisme', 'note', 'armes', 'afrique', 'président', 'nigérian', 'muhammadu', 'buhari', 'fin', 'novembre'], ['partie', 'présent', 'bassin', 'lac', 'tchad', 'police', 'criminelle', 'finlandaise', 'part', 'armes', 'ukraine', 'suède', 'danemark', 'wallace', 'cours', 'dialogue', 'shangri', 'importateurs', 'armes', 'russes', 'vendeur', 'argent', 'matériel', 'moscou']]]","[[[], ['Défense'], ['Londres'], [], ['Ukraine'], ['Afrique'], ['lac Tchad', 'Ukraine', 'Suède', 'Danemark', 'Pays-Bas', 'Shangri-La', 'Moscou']]]","[[[], ['Service fédéral de coopération militaro-technique russe', 'FSVTS'], [], ['FSVTS'], [], [], []]]","[[[], ['Ben Wallace'], [], [], [], ['Président nigérian', 'Muhammadu Buhari'], ['Ben Wallace']]]","{'jalousie': 1, 'vilain': 1, 'défaut': 1, 'appel': 1, 'secrétaire': 1, 'britannique': 2, 'défense': 1, 'ben': 1, 'wallace': 2, 'argent': 2, 'armes': 6, 'russes': 4, 'aveu': 1, 'envie': 2, 'service': 2, 'fédéral': 2, 'coopération': 1, 'militaro': 1, 'technique': 1, 'russe': 1, 'fsvts': 3, 'communiqué': 1, 'enrage': 1, 'face': 1, 'popularité': 2, 'équipements': 1, 'marchés': 1, 'ceinture': 1, 'organe': 1, 'propos': 1, 'ministre': 1, 'nouvelle': 1, 'manifestation': 1, 'concurrence': 1, 'déloyale': 1, 'marque': 1, 'part': 2, 'états': 1, 'occidentaux': 1, 'contexte': 1, 'croissante': 1, 'choix': 1, 'chantage': 1, 'politique': 1, 'tapage': 1, 'médiatique': 1, 'matériel': 2, 'intérêt': 1, 'étranger': 1, 'particulier': 1, 'chasseurs': 1, 'hélicoptères': 1, 'combat': 1, 'véhicules': 1, 'blindés': 1, 'systèmes': 1, 'roquettes': 1, 'multiples': 1, 'armement': 1, 'preuves': 1, 'matière': 1, 'efficacité': 1, 'noirle': 1, 'inquiet': 1, 'approvisionnement': 1, 'occidentales': 1, 'ukraine': 2, 'nombre': 1, 'marché': 1, 'noir': 1, 'flux': 1, 'continu': 1, 'propagation': 1, 'terrorisme': 1, 'international': 1, 'extrémisme': 1, 'note': 1, 'afrique': 1, 'président': 1, 'nigérian': 1, 'muhammadu': 1, 'buhari': 1, 'fin': 1, 'novembre': 1, 'partie': 1, 'présent': 1, 'bassin': 1, 'lac': 1, 'tchad': 1, 'police': 1, 'criminelle': 1, 'finlandaise': 1, 'suède': 1, 'danemark': 1, 'cours': 1, 'dialogue': 1, 'shangri': 1, 'importateurs': 1, 'vendeur': 1, 'moscou': 1}","{'Défense': 1, 'Londres': 1, 'Ukraine': 2, 'Afrique': 1, 'lac Tchad': 1, 'Suède': 1, 'Danemark': 1, 'Pays-Bas': 1, 'Shangri-La': 1, 'Moscou': 1}","{'Service fédéral de coopération militaro-technique russe': 1, 'FSVTS': 2}","{'Ben Wallace': 2, 'Président nigérian': 1, 'Muhammadu Buhari': 1}",2023,6,2
1685743200,https://fr.sputniknews.africa/20230603/une-quinzaine-de-morts-dans-les-affrontements-entre-police-et-opposition-au-senegal---videos-1059697661.html,Une quinzaine de morts dans les affrontements entre police et opposition au Sénégal - vidéos,"Les violences enregistrées vendredi au Sénégal suite aux heurts entre les forces de l'ordre et des partisans de l'opposant Ousmane Sonko, condamné jeudi à deux ans de prison, ont fait six morts, portant à 15 le nombre de victimes depuis...","""On a enregistré dans la journée du 2 juin six décès, dont quatre dans la région de Dakar et deux dans la région de Ziguinchor (sud)"", a déclaré à des médias M. Maham Ka, porte-parole du ministre de l'Intérieur. Un bilan de 9 morts à Dakar et à Ziguinchor avait été annoncé jeudi soir par le ministre de l'Intérieur, Antoine Diome. Chaos généralisé au #Sénégal suite à la condamnation du principal opposant Ousmane Sonko à 2 ans de prison. Nombreuses scènes de pillages et d'affront*ments avec les forces de l'ordre. Les autorités viennent de couper l'accès à internet dans le pays #FreeSenegal pic.twitter.com/oNPP8n76Nj— Anonyme Citoyen (@AnonymeCitoyen) June 1, 2023 A signaler que depuis la condamnation par la Chambre criminelle du tribunal de grande instance de Dakar de Ousmane Sonko à 2 ans de prison ferme pour ""corruption de la jeunesse"", des heurts ont éclaté dans des quartiers de Dakar et d'autres villes et universités du pays, avec leurs lots de violences occasionnant des destructions massives de différentes infrastructures des ces établissements. Les FDS de Macky sall au Sénégal en action ici. #FreeSenegal. pic.twitter.com/GbQ9TkY0xr— Hayati Fall (@oumarzo10) June 3, 2023 Suite à ces violences, les Universités de Dakar, de Saint-Louis (nordl) et de Ziguinchor (sud) ont annoncé la suspension des activités pédagogiques jusqu'à nouvel ordre. Situation tendue dans la capitalePour rétablir l'ordre et le calme, les autorités sénégalaises ont déployé vendredi des soldats des Forces armées à Dakar, avec notamment deux blindés sur la place de l'Indépendance, à quelques mètres du Palais présidentiel et aussi des véhicules sur la Corniche et au quartier Plateau et dans d'autres zones de la ville. Par crainte des saccages, les commerces, les magasins et les banques sont restés fermés vendredi. Le gouvernement a annoncé avoir restreint les accès aux réseaux sociaux comme Facebook, WhatsApp ou Twitter pour faire cesser, selon le le ministre de l'Intérieur, ""la diffusion de messages haineux et subversifs"". Acquitté jeudi des charges de viols et menaces de mort contre une employée d'un salon de beauté où il allait se faire masser entre 2020 et 2021, Sonko a en revanche été condamné à deux ans de prison ferme pour avoir poussé à la ""débauche"" cette jeune femme de moins de 21 ans. A rappeler que Ousmane Sonko, candidat déclaré à la présidentielle de 2024, a été déjà condamné fin mars à six mois de prison avec sursis pour ""diffamation"" contre le ministre du tourisme. Cette condamnation à elle seule, si elle est maintenue en cassation, menace l'éligibilité de Ousmane Sonko à la Présidentielle du 25 février 2024.","[[['""On a enregistré dans la journée du 2 juin six décès, dont quatre dans la région de Dakar et deux dans la région de Ziguinchor (sud)"", a déclaré à des médias M. Maham Ka, porte-parole du ministre de l\'Intérieur.'], [""Un bilan de 9 morts à Dakar et à Ziguinchor avait été annoncé jeudi soir par le ministre de l'Intérieur, Antoine Diome.""], ['Chaos généralisé au #Sénégal suite à la condamnation du principal opposant Ousmane Sonko à 2 ans de prison.'], [""Nombreuses scènes de pillages et d'affront*ments avec les forces de l'ordre.""], ['Les autorités viennent de couper l\'accès à internet dans le pays #FreeSenegal pic.twitter.com/oNPP8n76Nj— Anonyme Citoyen (@AnonymeCitoyen) June 1, 2023 A signaler que depuis la condamnation par la Chambre criminelle du tribunal de grande instance de Dakar de Ousmane Sonko à 2 ans de prison ferme pour ""corruption de la jeunesse"", des heurts ont éclaté dans des quartiers de Dakar et d\'autres villes et universités du pays, avec leurs lots de violences occasionnant des destructions massives de différentes infrastructures des ces établissements.'], ['Les FDS de Macky sall au Sénégal en action ici.'], ['#FreeSenegal.'], [""pic.twitter.com/GbQ9TkY0xr— Hayati Fall (@oumarzo10) June 3, 2023 Suite à ces violences, les Universités de Dakar, de Saint-Louis (nordl) et de Ziguinchor (sud) ont annoncé la suspension des activités pédagogiques jusqu'à nouvel ordre.""], [""Situation tendue dans la capitalePour rétablir l'ordre et le calme, les autorités sénégalaises ont déployé vendredi des soldats des Forces armées à Dakar, avec notamment deux blindés sur la place de l'Indépendance, à quelques mètres du Palais présidentiel et aussi des véhicules sur la Corniche et au quartier Plateau et dans d'autres zones de la ville.""], ['Par crainte des saccages, les commerces, les magasins et les banques sont restés fermés vendredi.'], ['Le gouvernement a annoncé avoir restreint les accès aux réseaux sociaux comme Facebook, WhatsApp ou Twitter pour faire cesser, selon le le ministre de l\'Intérieur, ""la diffusion de messages haineux et subversifs"".'], ['Acquitté jeudi des charges de viols et menaces de mort contre une employée d\'un salon de beauté où il allait se faire masser entre 2020 et 2021, Sonko a en revanche été condamné à deux ans de prison ferme pour avoir poussé à la ""débauche"" cette jeune femme de moins de 21 ans.'], ['A rappeler que Ousmane Sonko, candidat déclaré à la présidentielle de 2024, a été déjà condamné fin mars à six mois de prison avec sursis pour ""diffamation"" contre le ministre du tourisme.'], [""Cette condamnation à elle seule, si elle est maintenue en cassation, menace l'éligibilité de Ousmane Sonko à la Présidentielle du 25 février 2024.""]]]","[[['journée', 'juin', 'décès', 'région', 'dakar', 'région', 'ziguinchor', 'sud', 'médias', 'maham', 'ka', 'ministre', 'intérieur'], ['bilan', 'morts', 'dakar', 'ziguinchor', 'jeudi', 'soir', 'ministre', 'intérieur', 'antoine', 'diome'], ['chaos', 'généralisé', 'sénégal', 'suite', 'condamnation', 'principal', 'ousmane', 'sonko', 'ans', 'prison'], ['scènes', 'pillages', 'forces', 'ordre'], ['autorités', 'accès', 'internet', 'pays', 'freesenegal', 'anonyme', 'citoyen', 'june', 'condamnation', 'chambre', 'criminelle', 'tribunal', 'grande', 'instance', 'dakar', 'ousmane', 'sonko', 'ans', 'prison', 'ferme', 'corruption', 'jeunesse', 'heurts', 'quartiers', 'dakar', 'villes', 'universités', 'pays', 'lots', 'violences', 'destructions', 'massives', 'infrastructures', 'établissements'], ['fds', 'macky', 'sall', 'sénégal', 'action'], ['freesenegal'], ['fall', 'june', 'suite', 'violences', 'universités', 'dakar', 'nordl', 'ziguinchor', 'sud', 'suspension', 'activités', 'pédagogiques', 'nouvel', 'ordre'], ['situation', 'tendue', 'capitalepour', 'ordre', 'calme', 'autorités', 'sénégalaises', 'vendredi', 'soldats', 'forces', 'armées', 'dakar', 'blindés', 'place', 'indépendance', 'mètres', 'palais', 'présidentiel', 'véhicules', 'corniche', 'quartier', 'plateau', 'zones', 'ville'], ['crainte', 'saccages', 'commerces', 'magasins', 'banques', 'vendredi'], ['gouvernement', 'accès', 'réseaux', 'sociaux', 'facebook', 'whatsapp', 'twitter', 'ministre', 'intérieur', 'diffusion', 'messages', 'haineux', 'subversifs'], ['jeudi', 'charges', 'viols', 'menaces', 'mort', 'employée', 'salon', 'beauté', 'revanche', 'ans', 'prison', 'ferme', 'débauche', 'jeune', 'femme', 'ans'], ['ousmane', 'sonko', 'candidat', 'présidentielle', 'fin', 'mars', 'mois', 'prison', 'sursis', 'diffamation', 'ministre', 'tourisme'], ['condamnation', 'cassation', 'éligibilité', 'ousmane', 'sonko', 'présidentielle', 'février']]]","[[['Dakar', 'Ziguinchor'], ['Dakar', 'Ziguinchor'], ['Sénégal'], [], ['A', 'Dakar'], ['Sénégal'], [], ['Universités de Dakar', 'Saint-Louis', 'nordl', 'Ziguinchor'], ['Dakar', ""place de l'Indépendance"", 'Palais présidentiel', 'Corniche', 'Plateau'], [], [], [], [], []]]","[[[""ministre de l'Intérieur""], [""ministre de l'Intérieur""], [], [], ['Chambre criminelle du tribunal de grande instance de Dakar'], ['FDS'], [], [], ['Forces armées'], [], [""ministre de l'Intérieur""], [], [], []]]","[[['M. Maham Ka'], ['Antoine Diome'], ['Ousmane'], [], ['Ousmane Sonko'], [], [], [], [], [], [], ['Sonko'], ['Ousmane Sonko'], ['Ousmane Sonko']]]","{'journée': 1, 'juin': 1, 'décès': 1, 'région': 2, 'dakar': 6, 'ziguinchor': 3, 'sud': 2, 'médias': 1, 'maham': 1, 'ka': 1, 'ministre': 4, 'intérieur': 3, 'bilan': 1, 'morts': 1, 'jeudi': 2, 'soir': 1, 'antoine': 1, 'diome': 1, 'chaos': 1, 'généralisé': 1, 'sénégal': 2, 'suite': 2, 'condamnation': 3, 'principal': 1, 'ousmane': 4, 'sonko': 4, 'ans': 4, 'prison': 4, 'scènes': 1, 'pillages': 1, 'forces': 2, 'ordre': 3, 'autorités': 2, 'accès': 2, 'internet': 1, 'pays': 2, 'freesenegal': 2, 'anonyme': 1, 'citoyen': 1, 'june': 2, 'chambre': 1, 'criminelle': 1, 'tribunal': 1, 'grande': 1, 'instance': 1, 'ferme': 2, 'corruption': 1, 'jeunesse': 1, 'heurts': 1, 'quartiers': 1, 'villes': 1, 'universités': 2, 'lots': 1, 'violences': 2, 'destructions': 1, 'massives': 1, 'infrastructures': 1, 'établissements': 1, 'fds': 1, 'macky': 1, 'sall': 1, 'action': 1, 'fall': 1, 'nordl': 1, 'suspension': 1, 'activités': 1, 'pédagogiques': 1, 'nouvel': 1, 'situation': 1, 'tendue': 1, 'capitalepour': 1, 'calme': 1, 'sénégalaises': 1, 'vendredi': 2, 'soldats': 1, 'armées': 1, 'blindés': 1, 'place': 1, 'indépendance': 1, 'mètres': 1, 'palais': 1, 'présidentiel': 1, 'véhicules': 1, 'corniche': 1, 'quartier': 1, 'plateau': 1, 'zones': 1, 'ville': 1, 'crainte': 1, 'saccages': 1, 'commerces': 1, 'magasins': 1, 'banques': 1, 'gouvernement': 1, 'réseaux': 1, 'sociaux': 1, 'facebook': 1, 'whatsapp': 1, 'twitter': 1, 'diffusion': 1, 'messages': 1, 'haineux': 1, 'subversifs': 1, 'charges': 1, 'viols': 1, 'menaces': 1, 'mort': 1, 'employée': 1, 'salon': 1, 'beauté': 1, 'revanche': 1, 'débauche': 1, 'jeune': 1, 'femme': 1, 'candidat': 1, 'présidentielle': 2, 'fin': 1, 'mars': 1, 'mois': 1, 'sursis': 1, 'diffamation': 1, 'tourisme': 1, 'cassation': 1, 'éligibilité': 1, 'février': 1}","{'Dakar': 4, 'Ziguinchor': 3, 'Sénégal': 2, 'A': 1, 'Universités de Dakar': 1, 'Saint-Louis': 1, 'nordl': 1, ""place de l'Indépendance"": 1, 'Palais présidentiel': 1, 'Corniche': 1, 'Plateau': 1}","{""ministre de l'Intérieur"": 3, 'Chambre criminelle du tribunal de grande instance de Dakar': 1, 'FDS': 1, 'Forces armées': 1}","{'M. Maham Ka': 1, 'Antoine Diome': 1, 'Ousmane': 1, 'Ousmane Sonko': 3, 'Sonko': 1}",2023,6,2
