timestamp,url,title,description,content,content-segmented,kws-l,loc-l,org-l,per-l,kws,loc,org,per,year,month,day
1685743200,https://fr.sputniknews.africa/20230603/la-russie-nomme-sa-condition-pour-un-dialogue-sur-le-controle-des-armes-nucleaires-1059690175.html,La Russie nomme sa condition pour un dialogue sur le contrôle des armes nucléaires,"Moscou n’a pas abandonné la voie du dialogue concernant le contrôle des armes nucléaires mais entend que chaque partie joue cartes sur table, a déclaré la porte-parole de la diplomatie russe Maria Zakharova.","Franc jeu. Moscou a toujours en tête de discuter d’un contrôle des armes nucléaires stratégiques, mais pose comme préalable que toutes les parties soient honnêtes dans ce débat, a déclaré la porte-parole du ministère des Affaires étrangères russe, Maria Zakharova.""La Russie n'a pas abandonné les méthodes politico-diplomatiques d'assurance de sécurité, qui peuvent être mises en œuvre sous divers formats. Cependant, la vie montre que de telles méthodes ne peuvent être efficaces que si toutes les parties s'engagent réellement dans une coopération égale et constructive, en respectant honnêtement les accords conclus, sans essayer de tricher et de les tordre en leur faveur"", a-t-elle ainsi affirmé.La responsable a notamment déploré l’attitude des États-Unis, qui ne sont pas prêts à dévier de leur logique agressive visant à ""infliger une défaite stratégique"" à la Russie afin de la faire disparaître de la scène internationale. Maria Zakharova a appelé les Occidentaux à prendre conscience que ""l'ère de la domination américaine"" était révolue, et à jeter les bases d’un nouveau système à l'échelle planétaire.""Si les États-Unis et leurs alliés de la coalition anti-russe sont vraiment intéressés par l'amélioration de la situation internationale et veulent reprendre le travail sur le contrôle des armements, ils devraient d'abord abandonner leur désir irresponsable de construire un monde selon le modèle américain et se détourner d’un chemin qui peut clairement conduire à une catastrophe mondiale"", a-t-elle expliqué.Le tango se danse à deuxCe 2 juin, le conseiller américain à la Sécurité nationale, Jake Sullivan, avait déclaré que les États-Unis étaient prêts à engager des discussions bilatérales sur le contrôle des armements avec la Russie mais aussi avec la Chine. Des débats en vue de remplacer le traité START, qui expirera en 2026.Début avril, Sergueï Lavrov avait déjà insisté sur le principe de réciprocité en matière nucléaire. ""Il faut être deux pour danser le tango"", avait résumé le ministre russe des Affaires étrangères.Fin mars, Moscou avait annoncé déployer des armes atomiques chez son voisin biélorusse. Le Président Vladimir Poutine avait expliqué que Moscou ne faisait que reproduire la logique de Washington, qui menace depuis des décennies la sécurité russe en plaçant des ogives dans ses bases européennes.","[[['Franc jeu.'], ['Moscou a toujours en tête de discuter d’un contrôle des armes nucléaires stratégiques, mais pose comme préalable que toutes les parties soient honnêtes dans ce débat, a déclaré la porte-parole du ministère des Affaires étrangères russe, Maria Zakharova.'], ['""La Russie n\'a pas abandonné les méthodes politico-diplomatiques d\'assurance de sécurité, qui peuvent être mises en œuvre sous divers formats.'], ['Cependant, la vie montre que de telles méthodes ne peuvent être efficaces que si toutes les parties s\'engagent réellement dans une coopération égale et constructive, en respectant honnêtement les accords conclus, sans essayer de tricher et de les tordre en leur faveur"", a-t-elle ainsi affirmé.La responsable a notamment déploré l’attitude des États-Unis, qui ne sont pas prêts à dévier de leur logique agressive visant à ""infliger une défaite stratégique"" à la Russie afin de la faire disparaître de la scène internationale.'], ['Maria Zakharova a appelé les Occidentaux à prendre conscience que ""l\'ère de la domination américaine"" était révolue, et à jeter les bases d’un nouveau système à l\'échelle planétaire.'], ['""Si les États-Unis et leurs alliés de la coalition anti-russe sont vraiment intéressés par l\'amélioration de la situation internationale et veulent reprendre le travail sur le contrôle des armements, ils devraient d\'abord abandonner leur désir irresponsable de construire un monde selon le modèle américain et se détourner d’un chemin qui peut clairement conduire à une catastrophe mondiale"", a-t-elle expliqué.Le tango se danse à deuxCe 2 juin, le conseiller américain à la Sécurité nationale, Jake Sullivan, avait déclaré que les États-Unis étaient prêts à engager des discussions bilatérales sur le contrôle des armements avec la Russie mais aussi avec la Chine.'], ['Des débats en vue de remplacer le traité START, qui expirera en 2026.Début avril, Sergueï Lavrov avait déjà insisté sur le principe de réciprocité en matière nucléaire.'], ['""Il faut être deux pour danser le tango"", avait résumé le ministre russe des Affaires étrangères.Fin mars, Moscou avait annoncé déployer des armes atomiques chez son voisin biélorusse.'], ['Le Président Vladimir Poutine avait expliqué que Moscou ne faisait que reproduire la logique de Washington, qui menace depuis des décennies la sécurité russe en plaçant des ogives dans ses bases européennes.']]]","[[['franc', 'jeu'], ['moscou', 'tête', 'contrôle', 'armes', 'nucléaires', 'stratégiques', 'parties', 'honnêtes', 'débat', 'ministère', 'affaires', 'étrangères', 'russe', 'zakharova'], ['russie', 'méthodes', 'politico', 'diplomatiques', 'assurance', 'sécurité', 'œuvre', 'formats'], ['vie', 'méthodes', 'efficaces', 'parties', 'coopération', 'égale', 'constructive', 'accords', 'faveur', 'responsable', 'attitude', 'prêts', 'logique', 'agressive', 'défaite', 'stratégique', 'russie', 'scène', 'internationale'], ['zakharova', 'occidentaux', 'conscience', 'ère', 'domination', 'américaine', 'bases', 'système', 'échelle', 'planétaire'], ['alliés', 'coalition', 'amélioration', 'situation', 'internationale', 'travail', 'contrôle', 'armements', 'désir', 'irresponsable', 'monde', 'modèle', 'américain', 'chemin', 'catastrophe', 'mondiale', 'tango', 'danse', 'deuxce', 'juin', 'conseiller', 'américain', 'sécurité', 'nationale', 'jake', 'sullivan', 'prêts', 'discussions', 'bilatérales', 'contrôle', 'armements', 'russie', 'chine'], ['débats', 'vue', 'traité', 'start', 'avril', 'sergueï', 'lavrov', 'principe', 'réciprocité', 'matière', 'nucléaire'], ['tango', 'résumé', 'ministre', 'russe', 'affaires', 'mars', 'moscou', 'armes', 'atomiques', 'voisin', 'biélorusse'], ['président', 'vladimir', 'poutine', 'moscou', 'logique', 'washington', 'décennies', 'sécurité', 'russe', 'ogives', 'bases', 'européennes']]]","[[['Franc'], ['Moscou'], ['Russie'], ['États-Unis', 'Russie'], [], ['États-Unis', 'États-Unis', 'Russie', 'Chine'], [], ['Moscou'], ['Moscou']]]","[[[], ['ministère des Affaires étrangères russe'], [], [], [], ['Sécurité nationale'], [], ['ministre russe des Affaires étrangères'], []]]","[[[], ['Maria Zakharova'], [], [], ['Maria Zakharova'], ['Jake Sullivan'], ['Sergueï Lavrov'], [], ['Vladimir Poutine', 'Washington']]]","{'franc': 1, 'jeu': 1, 'moscou': 3, 'tête': 1, 'contrôle': 3, 'armes': 2, 'nucléaires': 1, 'stratégiques': 1, 'parties': 2, 'honnêtes': 1, 'débat': 1, 'ministère': 1, 'affaires': 2, 'étrangères': 1, 'russe': 3, 'zakharova': 2, 'russie': 3, 'méthodes': 2, 'politico': 1, 'diplomatiques': 1, 'assurance': 1, 'sécurité': 3, 'œuvre': 1, 'formats': 1, 'vie': 1, 'efficaces': 1, 'coopération': 1, 'égale': 1, 'constructive': 1, 'accords': 1, 'faveur': 1, 'responsable': 1, 'attitude': 1, 'prêts': 2, 'logique': 2, 'agressive': 1, 'défaite': 1, 'stratégique': 1, 'scène': 1, 'internationale': 2, 'occidentaux': 1, 'conscience': 1, 'ère': 1, 'domination': 1, 'américaine': 1, 'bases': 2, 'système': 1, 'échelle': 1, 'planétaire': 1, 'alliés': 1, 'coalition': 1, 'amélioration': 1, 'situation': 1, 'travail': 1, 'armements': 2, 'désir': 1, 'irresponsable': 1, 'monde': 1, 'modèle': 1, 'américain': 2, 'chemin': 1, 'catastrophe': 1, 'mondiale': 1, 'tango': 2, 'danse': 1, 'deuxce': 1, 'juin': 1, 'conseiller': 1, 'nationale': 1, 'jake': 1, 'sullivan': 1, 'discussions': 1, 'bilatérales': 1, 'chine': 1, 'débats': 1, 'vue': 1, 'traité': 1, 'start': 1, 'avril': 1, 'sergueï': 1, 'lavrov': 1, 'principe': 1, 'réciprocité': 1, 'matière': 1, 'nucléaire': 1, 'résumé': 1, 'ministre': 1, 'mars': 1, 'atomiques': 1, 'voisin': 1, 'biélorusse': 1, 'président': 1, 'vladimir': 1, 'poutine': 1, 'washington': 1, 'décennies': 1, 'ogives': 1, 'européennes': 1}","{'Franc': 1, 'Moscou': 3, 'Russie': 3, 'États-Unis': 3, 'Chine': 1}","{'ministère des Affaires étrangères russe': 1, 'Sécurité nationale': 1, 'ministre russe des Affaires étrangères': 1}","{'Maria Zakharova': 2, 'Jake Sullivan': 1, 'Sergueï Lavrov': 1, 'Vladimir Poutine': 1, 'Washington': 1}",2023,6,2
1685743200,https://fr.sputniknews.africa/20230603/isaias-afwerki-tacle-le-desequilibre-mondial-provoque-par-loccident-qui-a-marginalise-lafrique-1059689374.html,"Isaias Afwerki tacle le ""déséquilibre mondial"" provoqué par l’Occident qui a ""marginalisé"" l'Afrique","Le ""nouvel ordre mondial"" où tous se respectent est ""une nécessité"", s’est dit convaincu auprès de Sputnik le Président érythréen. Et d’ajouter que la synergie du partenariat russo-africain permettra aux Africains de profiter de leurs...","Le Président érythréen a souligné au micro de Sputnik la nécessité d'aller au-delà des défis des 30 dernières années et de créer un environnement permettant à chacun de grandir et de travailler ensemble, dans le respect du droit international et de la souveraineté de chacun.La création de nouveaux formats de coopération comme les BRICS servira à ces fins, selon Isaias Afwerki.""Nous devons sortir de ce cycle d’endiguement, d’endiguement de la Russie, d’endiguement de la Chine, d’endiguement de l'Érythrée. Puis, punitions pour ceci et cela. Sanctionner ici, sanctionner là. Il ne s’agit pas seulement de relever le défi. [C’est] une chose, mais qu'en est-il au-delà du défi? Nous devons préparer le terrain pour créer un nouvel environnement. Ce nouvel environnement devra être là pour tout le monde.""Selon M.Afwerki, ce nouvel ordre mondial ""permettra à chacun d'apporter [...] des contributions, de participer, de coopérer, de travailler ensemble et de se respecter, ainsi que de respecter le droit international"".Un nouveau partenariat mondialIl s’est dit en outre convaincu que la politique hégémonique actuelle ne durera pas. Au lieu de cela, le monde doit s'unir pour structurer un partenariat propice aux générations futures. Le Président érythréen a de plus fait part de consultations et discussions bilatérales, multilatérales et continentales en cours en vue d’un nouvel ordre mondial.""Cela prendra fin à tout moment car il n'y a pas d’Otan. [Elle] ne survivra pas, ne sera pas là. D'autres ententes ou groupes hégémoniques ne prévaudront non plus"", a-t-il déclaré.Et d’ajouter que le ""déséquilibre mondial"" existant a fait de l'Afrique un continent marginalisé, bien que disposant de vastes ressources naturelles.Isaias Afwerki a souligné à cet égard la nécessité pour l'Afrique de sortir de cette situation et de se développer de sorte que tous les partenariats puissent être équilibrés. Ce, par le biais des programmes bilatéraux et continentaux.Un défi ""majeur""À ces fins, le partenariat entre la Russie et chaque nation souverain d'Afrique importe beaucoup, il créera une synergie qui changera la qualité de vie et permettra aux Africains de profiter de leurs ressources.""C'est majeur. Ce n'est pas une option. C'est une nécessité pour le moment"", a-t-il soutenu.Et d’ajouter que dans le cadre de ce partenariat croissant ils espèrent un sommet à Moscou ""dans les prochaines semaines afin que ces discussions se poursuivent pour voir comment la Russie peut éventuellement se rapporter à la situation sur le continent"".Le deuxième sommet Russie-Afrique, qui se tiendra à Saint-Pétersbourg fin juillet avec la participation de tous les chefs d'État et de gouvernement africains, pourrait servir de plate-forme pour les discussions autour de ces problèmes, a conclu le Président érythréen.","[[[""Le Président érythréen a souligné au micro de Sputnik la nécessité d'aller au-delà des défis des 30 dernières années et de créer un environnement permettant à chacun de grandir et de travailler ensemble, dans le respect du droit international et de la souveraineté de chacun.La création de nouveaux formats de coopération comme les BRICS servira à ces fins, selon Isaias Afwerki.""], ['""Nous devons sortir de ce cycle d’endiguement, d’endiguement de la Russie, d’endiguement de la Chine, d’endiguement de l\'Érythrée.'], ['Puis, punitions pour ceci et cela.'], ['Sanctionner ici, sanctionner là.'], ['Il ne s’agit pas seulement de relever le défi.'], [""[C’est] une chose, mais qu'en est-il au-delà du défi?""], ['Nous devons préparer le terrain pour créer un nouvel environnement.'], ['Ce nouvel environnement devra être là pour tout le monde.'], ['""Selon M.Afwerki, ce nouvel ordre mondial ""permettra à chacun d\'apporter [...] des contributions, de participer, de coopérer, de travailler ensemble et de se respecter, ainsi que de respecter le droit international"".Un nouveau partenariat mondialIl s’est dit en outre convaincu que la politique hégémonique actuelle ne durera pas.'], [""Au lieu de cela, le monde doit s'unir pour structurer un partenariat propice aux générations futures.""], ['Le Président érythréen a de plus fait part de consultations et discussions bilatérales, multilatérales et continentales en cours en vue d’un nouvel ordre mondial.'], ['""Cela prendra fin à tout moment car il n\'y a pas d’Otan.'], ['[Elle] ne survivra pas, ne sera pas là.'], ['D\'autres ententes ou groupes hégémoniques ne prévaudront non plus"", a-t-il déclaré.Et d’ajouter que le ""déséquilibre mondial"" existant a fait de l\'Afrique un continent marginalisé, bien que disposant de vastes ressources naturelles.Isaias Afwerki a souligné à cet égard la nécessité pour l\'Afrique de sortir de cette situation et de se développer de sorte que tous les partenariats puissent être équilibrés.'], ['Ce, par le biais des programmes bilatéraux et continentaux.Un défi ""majeur""À ces fins, le partenariat entre la Russie et chaque nation souverain d\'Afrique importe beaucoup, il créera une synergie qui changera la qualité de vie et permettra aux Africains de profiter de leurs ressources.'], ['""C\'est majeur.'], [""Ce n'est pas une option.""], ['C\'est une nécessité pour le moment"", a-t-il soutenu.Et d’ajouter que dans le cadre de ce partenariat croissant ils espèrent un sommet à Moscou ""dans les prochaines semaines afin que ces discussions se poursuivent pour voir comment la Russie peut éventuellement se rapporter à la situation sur le continent"".Le deuxième sommet Russie-Afrique, qui se tiendra à Saint-Pétersbourg fin juillet avec la participation de tous les chefs d\'État et de gouvernement africains, pourrait servir de plate-forme pour les discussions autour de ces problèmes, a conclu le Président érythréen.']]]","[[['président', 'érythréen', 'micro', 'sputnik', 'nécessité', 'défis', 'dernières', 'années', 'environnement', 'ensemble', 'respect', 'droit', 'international', 'souveraineté', 'création', 'nouveaux', 'formats', 'coopération', 'brics', 'fins', 'afwerki'], ['cycle', 'endiguement', 'endiguement', 'russie', 'endiguement', 'chine', 'endiguement', 'érythrée'], ['punitions'], [], ['défi'], ['chose', 'défi'], ['terrain', 'nouvel', 'environnement'], ['nouvel', 'environnement', 'monde'], ['nouvel', 'ordre', 'mondial', 'contributions', 'ensemble', 'droit', 'partenariat', 'politique', 'hégémonique', 'actuelle'], ['lieu', 'monde', 'partenariat', 'propice', 'générations', 'futures'], ['président', 'érythréen', 'part', 'consultations', 'discussions', 'bilatérales', 'multilatérales', 'continentales', 'cours', 'vue', 'nouvel', 'ordre', 'mondial'], ['fin', 'moment', 'otan'], [], ['ententes', 'groupes', 'hégémoniques', 'déséquilibre', 'mondial', 'afrique', 'continent', 'vastes', 'ressources', 'afwerki', 'égard', 'nécessité', 'afrique', 'situation', 'sorte', 'partenariats'], ['biais', 'programmes', 'bilatéraux', 'défi', 'fins', 'partenariat', 'russie', 'nation', 'souverain', 'afrique', 'synergie', 'qualité', 'vie', 'africains', 'ressources'], ['majeur'], ['option'], ['nécessité', 'moment', 'cadre', 'partenariat', 'sommet', 'moscou', 'prochaines', 'semaines', 'discussions', 'russie', 'situation', 'sommet', 'russie', 'afrique', 'fin', 'juillet', 'participation', 'chefs', 'état', 'gouvernement', 'africains', 'plate', 'forme', 'discussions', 'problèmes', 'président', 'érythréen']]]","[[[], ['Russie', 'Chine', 'Érythrée'], [], [], [], [], [], [], ['M.Afwerki'], [], [], [], [], ['Afrique', 'Afrique'], ['Russie', 'Afrique', 'Africains'], [], [], ['Moscou', 'Russie', 'Russie-Afrique', 'Saint-Pétersbourg', 'État']]]","[[['Sputnik', 'BRICS'], [], [], [], [], [], [], [], [], [], ['Président érythréen'], ['Otan'], [], [], [], [], [], ['Président érythréen']]]","[[['Président érythréen', 'Isaias Afwerki'], [], [], [], [], [], [], [], [], [], [], [], [], ['Isaias Afwerki'], [], [], [], []]]","{'président': 3, 'érythréen': 3, 'micro': 1, 'sputnik': 1, 'nécessité': 3, 'défis': 1, 'dernières': 1, 'années': 1, 'environnement': 3, 'ensemble': 2, 'respect': 1, 'droit': 2, 'international': 1, 'souveraineté': 1, 'création': 1, 'nouveaux': 1, 'formats': 1, 'coopération': 1, 'brics': 1, 'fins': 2, 'afwerki': 2, 'cycle': 1, 'endiguement': 4, 'russie': 4, 'chine': 1, 'érythrée': 1, 'punitions': 1, 'défi': 3, 'chose': 1, 'terrain': 1, 'nouvel': 4, 'monde': 2, 'ordre': 2, 'mondial': 3, 'contributions': 1, 'partenariat': 4, 'politique': 1, 'hégémonique': 1, 'actuelle': 1, 'lieu': 1, 'propice': 1, 'générations': 1, 'futures': 1, 'part': 1, 'consultations': 1, 'discussions': 3, 'bilatérales': 1, 'multilatérales': 1, 'continentales': 1, 'cours': 1, 'vue': 1, 'fin': 2, 'moment': 2, 'otan': 1, 'ententes': 1, 'groupes': 1, 'hégémoniques': 1, 'déséquilibre': 1, 'afrique': 4, 'continent': 1, 'vastes': 1, 'ressources': 2, 'égard': 1, 'situation': 2, 'sorte': 1, 'partenariats': 1, 'biais': 1, 'programmes': 1, 'bilatéraux': 1, 'nation': 1, 'souverain': 1, 'synergie': 1, 'qualité': 1, 'vie': 1, 'africains': 2, 'majeur': 1, 'option': 1, 'cadre': 1, 'sommet': 2, 'moscou': 1, 'prochaines': 1, 'semaines': 1, 'juillet': 1, 'participation': 1, 'chefs': 1, 'état': 1, 'gouvernement': 1, 'plate': 1, 'forme': 1, 'problèmes': 1}","{'Russie': 3, 'Chine': 1, 'Érythrée': 1, 'M.Afwerki': 1, 'Afrique': 3, 'Africains': 1, 'Moscou': 1, 'Russie-Afrique': 1, 'Saint-Pétersbourg': 1, 'État': 1}","{'Sputnik': 1, 'BRICS': 1, 'Président érythréen': 2, 'Otan': 1}","{'Président érythréen': 1, 'Isaias Afwerki': 2}",2023,6,2
1685743200,https://fr.sputniknews.africa/20230603/liran-compte-creer-une-coalition-navale-dans-locean-indien-1059688413.html,L'Iran compte créer une coalition navale dans l'océan Indien,"Téhéran a l'intention de créer une coalition navale pour assurer la sécurité dans la partie nord de l'océan Indien, a fait savoir le commandant en chef de la Marine iranienne.","La République islamique, ainsi que l'Arabie saoudite, le Pakistan et d'autres pays de la région envisagent de former une coalition pour assurer la sécurité maritime, a déclaré le contre-amiral iranien Shahram Irani cité par l'agence locale Mehr.Selon lui, la future alliance pourrait également compter parmi ses membres l'Inde, les Émirats arabes unis, le Qatar, Bahreïn et l'Irak.Evoquant l'émergence de nouvelles coalitions régionales et internationales, le contre-amiral a cité l'alliance navale réunissant l'Iran, la Fédération de Russie et la Chine, qui organise des exercices conjoints annuels.Auparavant, The Wall Street Journal a rapporté que les Émirats arabes unis s'étaient retirés de la coalition multinationale des Combined Maritime Forces dirigées par les États-Unis. Ces dernières sont actuellement déployées dans le Golfe, la mer Rouge et les détroits d’Ormuz et de Bab El-Mandeb.","[[[""La République islamique, ainsi que l'Arabie saoudite, le Pakistan et d'autres pays de la région envisagent de former une coalition pour assurer la sécurité maritime, a déclaré le contre-amiral iranien Shahram Irani cité par l'agence locale Mehr.Selon lui, la future alliance pourrait également compter parmi ses membres l'Inde, les Émirats arabes unis, le Qatar, Bahreïn et l'Irak.Evoquant l'émergence de nouvelles coalitions régionales et internationales, le contre-amiral a cité l'alliance navale réunissant l'Iran, la Fédération de Russie et la Chine, qui organise des exercices conjoints annuels.Auparavant, The Wall Street Journal a rapporté que les Émirats arabes unis s'étaient retirés de la coalition multinationale des Combined Maritime Forces dirigées par les États-Unis.""], ['Ces dernières sont actuellement déployées dans le Golfe, la mer Rouge et les détroits d’Ormuz et de Bab El-Mandeb.']]]","[[['république', 'islamique', 'arabie', 'saoudite', 'pakistan', 'pays', 'région', 'coalition', 'sécurité', 'maritime', 'iranien', 'shahram', 'irani', 'agence', 'locale', 'future', 'alliance', 'membres', 'inde', 'émirats', 'arabes', 'unis', 'qatar', 'bahreïn', 'émergence', 'nouvelles', 'coalitions', 'régionales', 'internationales', 'alliance', 'navale', 'iran', 'fédération', 'russie', 'chine', 'exercices', 'conjoints', 'émirats', 'arabes', 'unis', 'coalition', 'multinationale', 'combined', 'maritime', 'forces'], ['dernières', 'golfe', 'mer', 'rouge', 'détroits', 'ormuz', 'bab', 'el', 'mandeb']]]","[[['République islamique', 'Arabie saoudite', 'Pakistan', 'Mehr', 'Inde', 'Émirats arabes unis', 'Qatar', 'Bahreïn', 'Irak', 'Iran', 'Fédération de Russie', 'Chine', 'Émirats arabes unis', 'États-Unis'], ['Golfe', 'mer Rouge', 'Ormuz', 'Bab El-Mandeb']]]","[[['Combined Maritime'], []]]","[[['Shahram Irani'], []]]","{'république': 1, 'islamique': 1, 'arabie': 1, 'saoudite': 1, 'pakistan': 1, 'pays': 1, 'région': 1, 'coalition': 2, 'sécurité': 1, 'maritime': 2, 'iranien': 1, 'shahram': 1, 'irani': 1, 'agence': 1, 'locale': 1, 'future': 1, 'alliance': 2, 'membres': 1, 'inde': 1, 'émirats': 2, 'arabes': 2, 'unis': 2, 'qatar': 1, 'bahreïn': 1, 'émergence': 1, 'nouvelles': 1, 'coalitions': 1, 'régionales': 1, 'internationales': 1, 'navale': 1, 'iran': 1, 'fédération': 1, 'russie': 1, 'chine': 1, 'exercices': 1, 'conjoints': 1, 'multinationale': 1, 'combined': 1, 'forces': 1, 'dernières': 1, 'golfe': 1, 'mer': 1, 'rouge': 1, 'détroits': 1, 'ormuz': 1, 'bab': 1, 'el': 1, 'mandeb': 1}","{'République islamique': 1, 'Arabie saoudite': 1, 'Pakistan': 1, 'Mehr': 1, 'Inde': 1, 'Émirats arabes unis': 2, 'Qatar': 1, 'Bahreïn': 1, 'Irak': 1, 'Iran': 1, 'Fédération de Russie': 1, 'Chine': 1, 'États-Unis': 1, 'Golfe': 1, 'mer Rouge': 1, 'Ormuz': 1, 'Bab El-Mandeb': 1}",{'Combined Maritime': 1},{'Shahram Irani': 1},2023,6,2
