timestamp,url,title,description,content,content-segmented,kws-l,loc-l,org-l,per-l,kws,loc,org,per,year,month,day
1668380400,https://fr.sputniknews.africa/20221114/une-tesla-hors-de-controle-tue-deux-personnes-et-en-blesse-trois-autres-en-chine--video-1056818612.html,Une Tesla hors de contrôle tue deux personnes et en blesse trois autres en Chine – vidéo,"En Chine, une Tesla a brusquement accéléré alors que le conducteur tentait de se garer. L’accident a fait au moins deux morts et trois blessés.","Un spectaculaire accident impliquant une Tesla Model Y a fait deux morts et trois blessés dans la province du Guangdong, dans le sud de la Chine.Le média local Jimu News a rapporté qu’un motocycliste et une jeune étudiante avaient été tués dans cet accident survenu le 5 novembre.Des images de surveillance ont montré que le véhicule s'arrêtait pour se garer lorsqu'il a soudainement accéléré.D'autres caméras ont capturé des images du modèle Y roulant à vive allure sur environ 2 km avant de s'écraser.La voiture percute accidentellement des cyclistes et des motocyclistes à toute vitesse avant d’entrer en collision avec un autre véhicule.Le constructeur automobile américain Tesla a déclaré dimanche qu'il aiderait la police chinoise à enquêter sur cet accident.Il a cependant démenti les allégations sur une défaillance des freins.","[[[""Un spectaculaire accident impliquant une Tesla Model Y a fait deux morts et trois blessés dans la province du Guangdong, dans le sud de la Chine.Le média local Jimu News a rapporté qu’un motocycliste et une jeune étudiante avaient été tués dans cet accident survenu le 5 novembre.Des images de surveillance ont montré que le véhicule s'arrêtait pour se garer lorsqu'il a soudainement accéléré.D'autres caméras ont capturé des images du modèle Y roulant à vive allure sur environ 2 km avant de s'écraser.La voiture percute accidentellement des cyclistes et des motocyclistes à toute vitesse avant d’entrer en collision avec un autre véhicule.Le constructeur automobile américain Tesla a déclaré dimanche qu'il aiderait la police chinoise à enquêter sur cet accident.Il a cependant démenti les allégations sur une défaillance des freins.""]]]","[[['spectaculaire', 'accident', 'tesla', 'mort', 'blessé', 'province', 'guangdong', 'sud', 'média', 'local', 'motocycliste', 'jeune', 'étudiant', 'accident', 'image', 'surveillance', 'véhicule', 'caméra', 'image', 'modèle', 'vif', 'allure', 'kilomètre', 'voiture', 'cycliste', 'motocycliste', 'vitesse', 'collision', 'constructeur', 'automobile', 'américain', 'tesla', 'dimanche', 'police', 'chinois', 'allégation', 'défaillance', 'frein']]]","[[['Guangdong', 'Chine']]]","[[['Jimu News', 'Tesla']]]",[[[]]],"{'spectaculaire': 1, 'accident': 2, 'tesla': 2, 'mort': 1, 'blessé': 1, 'province': 1, 'guangdong': 1, 'sud': 1, 'média': 1, 'local': 1, 'motocycliste': 2, 'jeune': 1, 'étudiant': 1, 'image': 2, 'surveillance': 1, 'véhicule': 1, 'caméra': 1, 'modèle': 1, 'vif': 1, 'allure': 1, 'kilomètre': 1, 'voiture': 1, 'cycliste': 1, 'vitesse': 1, 'collision': 1, 'constructeur': 1, 'automobile': 1, 'américain': 1, 'dimanche': 1, 'police': 1, 'chinois': 1, 'allégation': 1, 'défaillance': 1, 'frein': 1}","{'Guangdong': 1, 'Chine': 1}","{'Jimu News': 1, 'Tesla': 1}",{},2022,11,13
1668380400,https://fr.sputniknews.africa/20221114/attentat-a-istanbul-ankara-fustige-la-reaction-insincere-de-washington-1056818412.html,"Attentat à Istanbul: Ankara fustige la réaction ""insincère"" de Washington","Pour Ankara, les condoléances que Washington lui a exprimées suite à l’attentat meurtrier à Istanbul sont dénouées de sincérité. ""Un assassin est toujours le premier à arriver sur les lieux du meurtre"", pointe le ministre turc de...","Le ministre turc de l’Intérieur ne s’est pas félicité des condoléances américaines suite à l’attentat meurtrier à Istanbul. Pour Süleyman Soylu, le message de Washington manque de sincérité.Tout en jugeant que les pays qui font semblant d’être les alliés de la Turquie cachent les terroristes chez eux ou leur permettent de vivre dans les territoires qu'ils occupent, et ""leur envoient officiellement de l'argent de leurs propres sénats"".""Je crois qu'il est essentiel d’évaluer le message de condoléances de l’Amérique, comme le fait qu’un assassin est toujours l’un des premiers à arriver sur les lieux du meurtre"", a estimé le ministre en s’exprimant quant à l’explosion ayant emporté la vie de six personnes et qui en a blessé plus de 80.Une réponse ""claire""Süleyman Soylu a en outre promis que la Turquie enverrait bientôt une réponse ""claire"". Ceux qui ""infligent cette douleur"" en éprouveront davantage.Le ministre turc n’a pas précisé quels propos de Washington ont été perçus négativement. Auparavant, la porte-parole de la Maison-Blanche Karine Jean-Pierre avait déclaré que les États-Unis dénonçaient résolument l’attentat et apportaient leurs condoléances à tous ceux ayant perdu des proches.Plus tôt dans la journée, le ministre turc de l’Intérieur avait fait part de l’arrestation ""de la personne qui a déposé la bombe"". Il a en outre accusé les forces kurdes contrôlant la majeure partie du nord-est de la Syrie, que la Turquie considère comme terroristes, d'être derrière le drame.","[[['Le ministre turc de l’Intérieur ne s’est pas félicité des condoléances américaines suite à l’attentat meurtrier à Istanbul.', 'Pour Süleyman Soylu, le message de Washington manque de sincérité.Tout en jugeant que les pays qui font semblant d’être les alliés de la Turquie cachent les terroristes chez eux ou leur permettent de vivre dans les territoires qu\'ils occupent, et ""leur envoient officiellement de l\'argent de leurs propres sénats"".', '""Je crois qu\'il est essentiel d’évaluer le message de condoléances de l’Amérique, comme le fait qu’un assassin est toujours l’un des premiers à arriver sur les lieux du meurtre"", a estimé le ministre en s’exprimant quant à l’explosion ayant emporté la vie de six personnes et qui en a blessé plus de 80.Une réponse ""claire""Süleyman Soylu a en outre promis que la Turquie enverrait bientôt une réponse ""claire"".', 'Ceux qui ""infligent cette douleur"" en éprouveront davantage.Le ministre turc n’a pas précisé quels propos de Washington ont été perçus négativement.', 'Auparavant, la porte-parole de la Maison-Blanche Karine Jean-Pierre avait déclaré que les États-Unis dénonçaient résolument l’attentat et apportaient leurs condoléances à tous ceux ayant perdu des proches.Plus tôt dans la journée, le ministre turc de l’Intérieur avait fait part de l’arrestation ""de la personne qui a déposé la bombe"".', ""Il a en outre accusé les forces kurdes contrôlant la majeure partie du nord-est de la Syrie, que la Turquie considère comme terroristes, d'être derrière le drame.""]]]","[[['ministre', 'turc', 'intérieur', 'condoléances', 'américain', 'suite', 'attentat', 'meurtrier', 'istanbul'], ['süleyman', 'soylu', 'message', 'washington', 'pays', 'allié', 'turquie', 'terroriste', 'territoire', 'argent', 'propre', 'sénat'], ['essentiel', 'message', 'condoléances', 'amérique', 'assassin', 'premier', 'lieu', 'meurtre', 'ministre', 'explosion', 'vie', 'personne', 'réponse', 'soylu', 'turquie', 'réponse', 'clair'], ['douleur', 'ministre', 'turc', 'propos', 'washington'], ['maison', 'blanc', 'karine', 'attentat', 'condoléances', 'journée', 'ministre', 'turc', 'intérieur', 'part', 'arrestation', 'bombe'], ['force', 'kurde', 'majeur', 'partie', 'syrie', 'turquie', 'terroriste', 'drame']]]","[[['Istanbul'], ['Turquie'], ['Turquie'], ['Washington'], ['Maison-Blanche Karine Jean-Pierre', 'États-Unis'], ['Syrie', 'Turquie']]]","[[[], [], [], [], [], []]]","[[[], ['Süleyman Soylu', 'Washington'], ['Soylu'], [], [], []]]","{'ministre': 4, 'turc': 3, 'intérieur': 2, 'condoléances': 3, 'américain': 1, 'suite': 1, 'attentat': 2, 'meurtrier': 1, 'istanbul': 1, 'süleyman': 1, 'soylu': 2, 'message': 2, 'washington': 2, 'pays': 1, 'allié': 1, 'turquie': 3, 'terroriste': 2, 'territoire': 1, 'argent': 1, 'propre': 1, 'sénat': 1, 'essentiel': 1, 'amérique': 1, 'assassin': 1, 'premier': 1, 'lieu': 1, 'meurtre': 1, 'explosion': 1, 'vie': 1, 'personne': 1, 'réponse': 2, 'clair': 1, 'douleur': 1, 'propos': 1, 'maison': 1, 'blanc': 1, 'karine': 1, 'journée': 1, 'part': 1, 'arrestation': 1, 'bombe': 1, 'force': 1, 'kurde': 1, 'majeur': 1, 'partie': 1, 'syrie': 1, 'drame': 1}","{'Istanbul': 1, 'Turquie': 3, 'Washington': 1, 'Maison-Blanche Karine Jean-Pierre': 1, 'États-Unis': 1, 'Syrie': 1}",{},"{'Süleyman Soylu': 1, 'Washington': 1, 'Soylu': 1}",2022,11,13
1668380400,https://fr.sputniknews.africa/20221114/lafrique-du-sud-va-faire-pression-pour-que-lunion-africaine-ait-un-siege-au-g20-1056818252.html,L'Afrique du Sud va faire pression pour que l'Union africaine ait un siège au G20,"L'Afrique du Sud a annoncé dimanche qu'elle allait faire pression pour que l'Union africaine (UA) obtienne un siège au G20, dont les dirigeants se réunissent la semaine prochaine en Indonésie.","Un porte-parole du président sud-africian Cyril Ramaphosa a expliqué que l'Afrique du Sud allait contribuer à mettre en place un cadre conduisant à l'adhésion de l'UA au club des pays les plus riches.""Il est important que la voix collective du continent soit représentée à cette tribune"", a déclaré le porte-parole Vincent Magqenya lors d'une conférence de presse. ""Nous avons l'espoir sincère que cette proposition trouvera du soutien et sera promue par les pays membres du G20"".L'Afrique du Sud est pour le moment le seul membre africain du G20.Le président sénégalais Macky Sall, qui préside l'Union africaine, avait récemment appelé à une refonte de la gouvernance internationale, demandant une plus grande représentation des Africains dans les organisations internationales comme le G20 ou le Conseil de sécurité de l'ONU.En octobre, M. Sall avait lancé que le multilatéralisme devrait ""servir les intérêts de tous"", sous peine de s'exposer à une ""perte de légitimité et d'autorité"".MM. Sall et Ramaphosa doivent tous deux participer au sommet du G20 prévu la semaine prochaine sur l'île de Bali, en Indonésie.","[[[""Un porte-parole du président sud-africian Cyril Ramaphosa a expliqué que l'Afrique du Sud allait contribuer à mettre en place un cadre conduisant à l'adhésion de l'UA au club des pays les plus riches."", '""Il est important que la voix collective du continent soit représentée à cette tribune"", a déclaré le porte-parole Vincent Magqenya lors d\'une conférence de presse.', '""Nous avons l\'espoir sincère que cette proposition trouvera du soutien et sera promue par les pays membres du G20"".L\'Afrique du Sud est pour le moment le seul membre africain du G20.Le président sénégalais Macky Sall, qui préside l\'Union africaine, avait récemment appelé à une refonte de la gouvernance internationale, demandant une plus grande représentation des Africains dans les organisations internationales comme le G20 ou le Conseil de sécurité de l\'ONU.En octobre, M. Sall avait lancé que le multilatéralisme devrait ""servir les intérêts de tous"", sous peine de s\'exposer à une ""perte de légitimité et d\'autorité"".MM.', ""Sall et Ramaphosa doivent tous deux participer au sommet du G20 prévu la semaine prochaine sur l'île de Bali, en Indonésie.""]]]","[[['président', 'cyril', 'ramaphosa', 'afrique', 'sud', 'place', 'cadre', 'adhésion', 'ua', 'club', 'pays', 'riche'], ['important', 'voix', 'collectif', 'continent', 'tribune', 'vincent', 'conférence', 'presse'], ['espoir', 'sincère', 'proposition', 'soutien', 'pays', 'membre', 'afrique', 'sud', 'moment', 'membre', 'africain', 'président', 'sénégalais', 'macky', 'sall', 'union', 'africain', 'refonte', 'gouvernance', 'international', 'grand', 'représentation', 'africain', 'organisation', 'international', 'conseil', 'sécurité', 'octobre', 'sall', 'multilatéralisme', 'intérêt', 'peine', 'perte', 'légitimité'], ['sall', 'ramaphosa', 'sommet', 'semaine', 'prochain', 'île', 'bali', 'indonésie']]]","[[['Afrique du Sud'], [], ['Afrique du Sud', 'Africains'], ['île de Bali', 'Indonésie']]]","[[['UA'], [], ['Union africaine', 'G20', ""Conseil de sécurité de l'"", 'ONU.En'], ['G20']]]","[[['Cyril Ramaphosa'], ['Vincent Magqenya'], ['Macky Sall', 'M. Sall'], ['Sall', 'Ramaphosa']]]","{'président': 2, 'cyril': 1, 'ramaphosa': 2, 'afrique': 2, 'sud': 2, 'place': 1, 'cadre': 1, 'adhésion': 1, 'ua': 1, 'club': 1, 'pays': 2, 'riche': 1, 'important': 1, 'voix': 1, 'collectif': 1, 'continent': 1, 'tribune': 1, 'vincent': 1, 'conférence': 1, 'presse': 1, 'espoir': 1, 'sincère': 1, 'proposition': 1, 'soutien': 1, 'membre': 2, 'moment': 1, 'africain': 3, 'sénégalais': 1, 'macky': 1, 'sall': 3, 'union': 1, 'refonte': 1, 'gouvernance': 1, 'international': 2, 'grand': 1, 'représentation': 1, 'organisation': 1, 'conseil': 1, 'sécurité': 1, 'octobre': 1, 'multilatéralisme': 1, 'intérêt': 1, 'peine': 1, 'perte': 1, 'légitimité': 1, 'sommet': 1, 'semaine': 1, 'prochain': 1, 'île': 1, 'bali': 1, 'indonésie': 1}","{'Afrique du Sud': 2, 'Africains': 1, 'île de Bali': 1, 'Indonésie': 1}","{'UA': 1, 'Union africaine': 1, 'G20': 2, ""Conseil de sécurité de l'"": 1, 'ONU.En': 1}","{'Cyril Ramaphosa': 1, 'Vincent Magqenya': 1, 'Macky Sall': 1, 'M. Sall': 1, 'Sall': 1, 'Ramaphosa': 1}",2022,11,13
1668380400,https://fr.sputniknews.africa/20221114/tel-aviv-reproche-a-lukraine-le-soutien-de-resolutions-anti-israeliennes-aupres-de-lonu--1056818031.html,Tel-Aviv reproche à l’Ukraine le soutien de résolutions anti-israéliennes auprès de l’Onu,"L’ambassadeur d’Israël en Ukraine s’est dit déçu par le soutien de Kiev envers les résolutions anti-israéliennes à l’Onu. Cela ""n’aide pas à instaurer la confiance"", selon lui.","L’ambassadeur d’Israël en Ukraine, Michael Brodsky, a dénoncé le soutien par Kiev d’une résolution de la 4e Commission de l’Assemblée générale des Nations unies. Celle-ci critique les pratiques israéliennes vis-à-vis des Palestiniens et demande à la Cour internationale de justice (CIJ) de statuer sur le conflit israélo-palestinien ainsi que ""l’occupation, la colonisation et l’annexion"" israéliennes.Dans la résolution, les États membres ont exhorté Israël à mettre fin aux pratiques et activités d’implantation affectant les droits du peuple palestinien et des autres Arabes au sein des territoires occupés.""Le soutien de l'Ukraine à la résolution de l'Onu Pratiques israéliennes, niant les liens juifs avec le mont du Temple et appelant à l'avis consultatif de la CIJ, est extrêmement décevant. Soutenir les initiatives anti-israéliennes à l'Onu n'aide pas à instaurer la confiance entre Israël et l’Ukraine"", a-t-il déploré via Twitter.Critique en IsraëlL’irritation du diplomate est tout à fait compréhensible étant donné l’état d’esprit général à l’égard du vote de l’Assemblée général.La résolution demandant une enquête de la CIJ sur les activités israélienne a attiré les foudres du Premier ministre sortant Yair Lapid.""Le chemin vers la résolution du conflit ne passe pas par les couloirs de l’Onu ou d’autres organismes internationaux"", a-t-il déclaré dimanche dans un communiqué de son cabinet, à l’issue d’une série de réunions avec les services diplomatiques et de sécurité. ""La décision palestinienne à l’Onu aura des conséquences.""L’idée de solliciter l’avis consultatif de la CIJ a été soutenue par 98 pays, y compris l’Ukraine, ce qui a désagréablement surpris les Israéliens.Deuxième vote anti-israélien en 15 joursCe vote ukrainien a été le deuxième au cours de ces deux dernières semaines sur des résolutions concernant les intérêts israéliens. Fin octobre, Kiev a soutenu la résolution sur le risque de la prolifération nucléaire au Moyen-Orient.Israël estime que ce comportement est pour le moins ingrat étant donné qu’il a constamment soutenu Kiev lors de tous les votes à l’Onu depuis le début de l’opération militaire spéciale russe le 24 février dernier.","[[['L’ambassadeur d’Israël en Ukraine, Michael Brodsky, a dénoncé le soutien par Kiev d’une résolution de la 4e Commission de l’Assemblée générale des Nations unies.', 'Celle-ci critique les pratiques israéliennes vis-à-vis des Palestiniens et demande à la Cour internationale de justice (CIJ) de statuer sur le conflit israélo-palestinien ainsi que ""l’occupation, la colonisation et l’annexion"" israéliennes.Dans la résolution, les États membres ont exhorté Israël à mettre fin aux pratiques et activités d’implantation affectant les droits du peuple palestinien et des autres Arabes au sein des territoires occupés.', '""Le soutien de l\'Ukraine à la résolution de l\'Onu Pratiques israéliennes, niant les liens juifs avec le mont du Temple et appelant à l\'avis consultatif de la CIJ, est extrêmement décevant.', 'Soutenir les initiatives anti-israéliennes à l\'Onu n\'aide pas à instaurer la confiance entre Israël et l’Ukraine"", a-t-il déploré via Twitter.Critique en IsraëlL’irritation du diplomate est tout à fait compréhensible étant donné l’état d’esprit général à l’égard du vote de l’Assemblée général.La résolution demandant une enquête de la CIJ sur les activités israélienne a attiré les foudres du Premier ministre sortant Yair Lapid.', '""Le chemin vers la résolution du conflit ne passe pas par les couloirs de l’Onu ou d’autres organismes internationaux"", a-t-il déclaré dimanche dans un communiqué de son cabinet, à l’issue d’une série de réunions avec les services diplomatiques et de sécurité.', '""La décision palestinienne à l’Onu aura des conséquences.', '""L’idée de solliciter l’avis consultatif de la CIJ a été soutenue par 98 pays, y compris l’Ukraine, ce qui a désagréablement surpris les Israéliens.Deuxième vote anti-israélien en 15 joursCe vote ukrainien a été le deuxième au cours de ces deux dernières semaines sur des résolutions concernant les intérêts israéliens.', 'Fin octobre, Kiev a soutenu la résolution sur le risque de la prolifération nucléaire au Moyen-Orient.Israël estime que ce comportement est pour le moins ingrat étant donné qu’il a constamment soutenu Kiev lors de tous les votes à l’Onu depuis le début de l’opération militaire spéciale russe le 24 février dernier.']]]","[[['ambassadeur', 'ukraine', 'michael', 'brodsky', 'soutien', 'kiev', 'résolution', 'quatrième', 'commission', 'assemblée', 'général', 'nation', 'uni'], ['critique', 'pratique', 'israélien', 'palestinien', 'cour', 'international', 'justice', 'cij', 'conflit', 'israélo', 'palestinien', 'occupation', 'colonisation', 'annexion', 'résolution', 'état', 'membre', 'fin', 'pratique', 'activité', 'implantation', 'droit', 'peuple', 'palestinien', 'arabe', 'sein', 'territoire'], ['soutien', 'ukraine', 'résolution', 'onu', 'pratique', 'israélien', 'lien', 'juif', 'mont', 'temple', 'avis', 'consultatif', 'cij', 'décevant'], ['initiative', 'onu', 'confiance', 'israël', 'ukraine', 'irritation', 'diplomate', 'compréhensible', 'état', 'esprit', 'général', 'égard', 'vote', 'assemblée', 'résolution', 'enquête', 'cij', 'activité', 'israélien', 'foudre', 'ministre', 'yair', 'lapid'], ['chemin', 'résolution', 'conflit', 'couloir', 'onu', 'organisme', 'international', 'dimanche', 'communiqué', 'cabinet', 'issue', 'série', 'réunion', 'service', 'diplomatique', 'sécurité'], ['décision', 'palestinien', 'onu', 'conséquence'], ['idée', 'avis', 'consultatif', 'cij', 'pays', 'ukraine', 'vote', 'joursc', 'vote', 'ukrainien', 'cours', 'dernier', 'semaine', 'résolution', 'intérêt', 'israélien'], ['fin', 'octobre', 'kiev', 'résolution', 'risque', 'prolifération', 'nucléaire', 'comportement', 'ingrat', 'kiev', 'vote', 'onu', 'début', 'opération', 'militaire', 'spécial', 'russe', 'février', 'dernier']]]","[[['Israël', 'Ukraine', 'Kiev'], ['États', 'Israël'], ['Ukraine', 'mont du Temple'], ['Israël', 'Ukraine'], [], [], ['Ukraine', 'Israël'], ['Kiev', 'Moyen-Orient', 'Israël', 'Kiev']]]","[[['Commission de l’Assemblée générale des Nations unies'], ['Cour internationale de justice', 'CIJ'], ['Onu Pratiques israéliennes', 'CIJ'], ['Onu', 'CIJ'], ['Onu'], ['Onu'], ['CIJ'], ['Onu']]]","[[['Michael Brodsky'], [], [], ['Premier', 'Yair Lapid'], [], [], [], []]]","{'ambassadeur': 1, 'ukraine': 4, 'michael': 1, 'brodsky': 1, 'soutien': 2, 'kiev': 3, 'résolution': 7, 'quatrième': 1, 'commission': 1, 'assemblée': 2, 'général': 2, 'nation': 1, 'uni': 1, 'critique': 1, 'pratique': 3, 'israélien': 4, 'palestinien': 4, 'cour': 1, 'international': 2, 'justice': 1, 'cij': 4, 'conflit': 2, 'israélo': 1, 'occupation': 1, 'colonisation': 1, 'annexion': 1, 'état': 2, 'membre': 1, 'fin': 2, 'activité': 2, 'implantation': 1, 'droit': 1, 'peuple': 1, 'arabe': 1, 'sein': 1, 'territoire': 1, 'onu': 5, 'lien': 1, 'juif': 1, 'mont': 1, 'temple': 1, 'avis': 2, 'consultatif': 2, 'décevant': 1, 'initiative': 1, 'confiance': 1, 'israël': 1, 'irritation': 1, 'diplomate': 1, 'compréhensible': 1, 'esprit': 1, 'égard': 1, 'vote': 4, 'enquête': 1, 'foudre': 1, 'ministre': 1, 'yair': 1, 'lapid': 1, 'chemin': 1, 'couloir': 1, 'organisme': 1, 'dimanche': 1, 'communiqué': 1, 'cabinet': 1, 'issue': 1, 'série': 1, 'réunion': 1, 'service': 1, 'diplomatique': 1, 'sécurité': 1, 'décision': 1, 'conséquence': 1, 'idée': 1, 'pays': 1, 'joursc': 1, 'ukrainien': 1, 'cours': 1, 'dernier': 2, 'semaine': 1, 'intérêt': 1, 'octobre': 1, 'risque': 1, 'prolifération': 1, 'nucléaire': 1, 'comportement': 1, 'ingrat': 1, 'début': 1, 'opération': 1, 'militaire': 1, 'spécial': 1, 'russe': 1, 'février': 1}","{'Israël': 5, 'Ukraine': 4, 'Kiev': 3, 'États': 1, 'mont du Temple': 1, 'Moyen-Orient': 1}","{'Commission de l’Assemblée générale des Nations unies': 1, 'Cour internationale de justice': 1, 'CIJ': 4, 'Onu Pratiques israéliennes': 1, 'Onu': 4}","{'Michael Brodsky': 1, 'Premier': 1, 'Yair Lapid': 1}",2022,11,13
