timestamp,url,title,description,content,content-segmented,kws-l,loc-l,org-l,per-l,kws,loc,org,per,year,month,day
1658354400,https://fr.sputniknews.africa/20220721/pour-paris-le-depart-annonce-de-draghi-ouvre-une-ere-dincertitudes-1055608255.html,"Pour Paris, le départ annoncé de Draghi ouvre une ère ""d'incertitudes""","Mario Draghi est attendu dans la journée chez le président de la République Sergio Mattarella, auquel il devrait remettre sa démission.","Le départ pressenti du Premier ministre italien Mario Draghi, ""pilier pour l'Europe"", ouvre une ""période d'incertitudes"", a estimé jeudi la secrétaire d'Etat française chargée de l'Europe Laurence Boone.Le président du Conseil italien est proche de la porte de sortie après la défection de trois partis importants de sa coalition qui scelle le sort de son gouvernement d'unité nationale. ""L'Italie va rentrer dans une période qui est peut être un peu moins stable que ce qu'on a vu auparavant"", a déclaré au micro de France Inter Mme Boone, ancienne cheffe économiste de l'Organisation de coopération et de développement économiques (OCDE). ""Je veux rendre ici hommage à Mario Draghi qui est un homme d'Etat exceptionnel, qui est un partenaire pour la France, on a bien travaillé ensemble, c'est un pilier pour l'Europe"", a-t-elle ajouté. ""Les périodes d'incertitudes"" ne rendent ""jamais tout le monde très à l'aise""A la question de savoir si son départ annoncé était une mauvaise nouvelle, Mme Boone a estimé qu'il s'agissait d'""une période d'incertitudes"" et que ""les périodes d'incertitudes"" ne rendent ""jamais tout le monde très à l'aise"".""Mais je vous rappelle que pendant la crise Covid qui était aussi pour le coup une incertitude maximale on a su faire un endettement commun et ça, ça donne un socle à l'Union européenne très très fort, un endettement commun et solidaire où on avait décidé d'aider les pays les plus touchés"", a-t-elle ajouté. Mario Draghi est attendu dans la journée chez le président de la République Sergio Mattarella, auquel il devrait remettre sa démission. M. Mattarella pourrait prononcer dans la foulée la dissolution du parlement et convoquer des élections anticipées pour cet automne.Dans cette hypothèse, Mario Draghi serait alors chargé d'expédier les affaires courantes jusqu'à la nomination de son successeur issu des urnes.Les marchés scrutent avec attention la situation. Le coût de la dette de l'Italie est reparti à la hausse et la Bourse de Milan était en berne mercredi, signe de la nervosité des marchés face à l'incertitude régnant dans la troisième économie de la zone euro.","[[['Le départ pressenti du Premier ministre italien Mario Draghi, ""pilier pour l\'Europe"", ouvre une ""période d\'incertitudes"", a estimé jeudi la secrétaire d\'Etat française chargée de l\'Europe Laurence Boone.Le président du Conseil italien est proche de la porte de sortie après la défection de trois partis importants de sa coalition qui scelle le sort de son gouvernement d\'unité nationale.'], ['""L\'Italie va rentrer dans une période qui est peut être un peu moins stable que ce qu\'on a vu auparavant"", a déclaré au micro de France Inter Mme Boone, ancienne cheffe économiste de l\'Organisation de coopération et de développement économiques (OCDE).'], ['""Je veux rendre ici hommage à Mario Draghi qui est un homme d\'Etat exceptionnel, qui est un partenaire pour la France, on a bien travaillé ensemble, c\'est un pilier pour l\'Europe"", a-t-elle ajouté.'], ['""Les périodes d\'incertitudes"" ne rendent ""jamais tout le monde très à l\'aise""A la question de savoir si son départ annoncé était une mauvaise nouvelle, Mme Boone a estimé qu\'il s\'agissait d\'""une période d\'incertitudes"" et que ""les périodes d\'incertitudes"" ne rendent ""jamais tout le monde très à l\'aise"".'], ['""Mais je vous rappelle que pendant la crise Covid qui était aussi pour le coup une incertitude maximale on a su faire un endettement commun et ça, ça donne un socle à l\'Union européenne très très fort, un endettement commun et solidaire où on avait décidé d\'aider les pays les plus touchés"", a-t-elle ajouté.'], ['Mario Draghi est attendu dans la journée chez le président de la République Sergio Mattarella, auquel il devrait remettre sa démission.'], [""M. Mattarella pourrait prononcer dans la foulée la dissolution du parlement et convoquer des élections anticipées pour cet automne.Dans cette hypothèse, Mario Draghi serait alors chargé d'expédier les affaires courantes jusqu'à la nomination de son successeur issu des urnes.Les marchés scrutent avec attention la situation.""], [""Le coût de la dette de l'Italie est reparti à la hausse et la Bourse de Milan était en berne mercredi, signe de la nervosité des marchés face à l'incertitude régnant dans la troisième économie de la zone euro.""]]]","[[['départ', 'ministre', 'italien', 'mario', 'draghi', 'pilier', 'europe', 'période', 'incertitudes', 'jeudi', 'secrétaire', 'etat', 'française', 'europe', 'laurence', 'président', 'conseil', 'italien', 'porte', 'sortie', 'défection', 'partis', 'importants', 'coalition', 'scelle', 'sort', 'gouvernement', 'unité', 'nationale'], ['italie', 'période', 'stable', 'micro', 'france', 'mme', 'ancienne', 'cheffe', 'économiste', 'organisation', 'coopération', 'développement', 'économiques', 'ocde'], ['hommage', 'mario', 'homme', 'etat', 'exceptionnel', 'partenaire', 'france', 'pilier', 'europe'], ['périodes', 'incertitudes', 'monde', 'question', 'départ', 'mauvaise', 'nouvelle', 'mme', 'période', 'incertitudes', 'périodes', 'incertitudes', 'monde', 'aise'], ['crise', 'covid', 'coup', 'incertitude', 'maximale', 'endettement', 'commun', 'socle', 'union', 'européenne', 'endettement', 'commun', 'solidaire', 'pays'], ['mario', 'draghi', 'journée', 'président', 'république', 'sergio', 'mattarella', 'démission'], ['foulée', 'dissolution', 'parlement', 'élections', 'anticipées', 'hypothèse', 'mario', 'draghi', 'affaires', 'courantes', 'nomination', 'successeur', 'marchés', 'attention', 'situation'], ['coût', 'dette', 'italie', 'hausse', 'bourse', 'milan', 'berne', 'mercredi', 'signe', 'nervosité', 'marchés', 'face', 'incertitude', 'économie', 'zone', 'euro']]]","[[['Europe', 'Etat française', 'Europe'], ['Italie'], ['Etat', 'France', 'Europe'], [], [], [], [], ['Italie']]]","[[['Conseil italien'], ['France Inter Mme Boone', 'Organisation de coopération et de développement économiques', 'OCDE'], [], [], ['Union européenne'], [], [], ['Bourse de Milan']]]","[[['Mario Draghi', 'Laurence Boone'], [], ['Mario Draghi'], ['Mme Boone'], ['Covid'], ['Mario Draghi', 'président de la', 'Sergio Mattarella'], ['M. Mattarella', 'Mario Draghi'], []]]","{'départ': 2, 'ministre': 1, 'italien': 2, 'mario': 4, 'draghi': 3, 'pilier': 2, 'europe': 3, 'période': 3, 'incertitudes': 4, 'jeudi': 1, 'secrétaire': 1, 'etat': 2, 'française': 1, 'laurence': 1, 'président': 2, 'conseil': 1, 'porte': 1, 'sortie': 1, 'défection': 1, 'partis': 1, 'importants': 1, 'coalition': 1, 'scelle': 1, 'sort': 1, 'gouvernement': 1, 'unité': 1, 'nationale': 1, 'italie': 2, 'stable': 1, 'micro': 1, 'france': 2, 'mme': 2, 'ancienne': 1, 'cheffe': 1, 'économiste': 1, 'organisation': 1, 'coopération': 1, 'développement': 1, 'économiques': 1, 'ocde': 1, 'hommage': 1, 'homme': 1, 'exceptionnel': 1, 'partenaire': 1, 'périodes': 2, 'monde': 2, 'question': 1, 'mauvaise': 1, 'nouvelle': 1, 'aise': 1, 'crise': 1, 'covid': 1, 'coup': 1, 'incertitude': 2, 'maximale': 1, 'endettement': 2, 'commun': 2, 'socle': 1, 'union': 1, 'européenne': 1, 'solidaire': 1, 'pays': 1, 'journée': 1, 'république': 1, 'sergio': 1, 'mattarella': 1, 'démission': 1, 'foulée': 1, 'dissolution': 1, 'parlement': 1, 'élections': 1, 'anticipées': 1, 'hypothèse': 1, 'affaires': 1, 'courantes': 1, 'nomination': 1, 'successeur': 1, 'marchés': 2, 'attention': 1, 'situation': 1, 'coût': 1, 'dette': 1, 'hausse': 1, 'bourse': 1, 'milan': 1, 'berne': 1, 'mercredi': 1, 'signe': 1, 'nervosité': 1, 'face': 1, 'économie': 1, 'zone': 1, 'euro': 1}","{'Europe': 3, 'Etat française': 1, 'Italie': 2, 'Etat': 1, 'France': 1}","{'Conseil italien': 1, 'France Inter Mme Boone': 1, 'Organisation de coopération et de développement économiques': 1, 'OCDE': 1, 'Union européenne': 1, 'Bourse de Milan': 1}","{'Mario Draghi': 4, 'Laurence Boone': 1, 'Mme Boone': 1, 'Covid': 1, 'président de la': 1, 'Sergio Mattarella': 1, 'M. Mattarella': 1}",2022,7,20
1658354400,https://fr.sputniknews.africa/20220721/poutine-qualifie-de-raciste-le-modele-de-domination-totale-de-loccident-aise-1055601598.html,Poutine qualifie de raciste le modèle de domination totale de l’Occident aisé,"L'ordre mondial unipolaire a été un frein au développement de la civilisation, le modèle de domination totale par le ""Milliard d’or"" [l’Occident riche, ndlr] a un caractère raciste et néocolonial, selon Poutine.","Le Président russe a participé le 20 juillet à la session plénière du forum ""Des idées fortes pour des temps nouveaux"", organisé par l'Agence pour les initiatives stratégiques (AIS) et la Fondation Roscongress. ""Pourquoi ce ""Milliard d’or"", parmi toute la population mondiale, devrait-il dominer tout le monde et imposer ses propres règles de conduite? L'exceptionnalisme, fondé sur une illusion, divise les peuples en deux classes, la première et la seconde, et est donc de nature raciste et néocoloniale"", a souligné le chef d’État.","[[['Le Président russe a participé le 20 juillet à la session plénière du forum ""Des idées fortes pour des temps nouveaux"", organisé par l\'Agence pour les initiatives stratégiques (AIS) et la Fondation Roscongress.'], ['""Pourquoi ce ""Milliard d’or"", parmi toute la population mondiale, devrait-il dominer tout le monde et imposer ses propres règles de conduite?'], ['L\'exceptionnalisme, fondé sur une illusion, divise les peuples en deux classes, la première et la seconde, et est donc de nature raciste et néocoloniale"", a souligné le chef d’État.']]]","[[['président', 'russe', 'juillet', 'session', 'plénière', 'forum', 'idées', 'fortes', 'temps', 'nouveaux', 'agence', 'initiatives', 'stratégiques', 'ais', 'fondation', 'roscongress'], ['milliard', 'population', 'mondiale', 'monde', 'propres', 'règles', 'conduite'], ['exceptionnalisme', 'illusion', 'peuples', 'classes', 'seconde', 'nature', 'raciste', 'néocoloniale', 'chef', 'état']]]","[[[], ['Milliard'], ['État']]]","[[['Agence pour les initiatives stratégiques', 'AIS', 'Fondation Roscongress'], [], []]]","[[['Président russe'], [], []]]","{'président': 1, 'russe': 1, 'juillet': 1, 'session': 1, 'plénière': 1, 'forum': 1, 'idées': 1, 'fortes': 1, 'temps': 1, 'nouveaux': 1, 'agence': 1, 'initiatives': 1, 'stratégiques': 1, 'ais': 1, 'fondation': 1, 'roscongress': 1, 'milliard': 1, 'population': 1, 'mondiale': 1, 'monde': 1, 'propres': 1, 'règles': 1, 'conduite': 1, 'exceptionnalisme': 1, 'illusion': 1, 'peuples': 1, 'classes': 1, 'seconde': 1, 'nature': 1, 'raciste': 1, 'néocoloniale': 1, 'chef': 1, 'état': 1}","{'Milliard': 1, 'État': 1}","{'Agence pour les initiatives stratégiques': 1, 'AIS': 1, 'Fondation Roscongress': 1}",{'Président russe': 1},2022,7,20
1658354400,https://fr.sputniknews.africa/20220721/washington-ne-permet-pas-a-lukraine-de-negocier-avec-la-russie-selon-lavrov-1055602365.html,"Washington ne permet pas à l’Ukraine de négocier avec la Russie, selon Lavrov","L'Ukraine ne sera pas autorisée à négocier avec la Russie tant que les États-Unis n'auront pas décidé de laisser les autorités ukrainiennes à elles-mêmes, a déclaré le ministre russe des Affaires étrangères Sergueï Lavrov.","Le chef de la diplomatie russe s’est montré sceptique quant à la possibilité de la reprise des pourparlers entre Kiev et Moscou. D’après lui, ""dans la situation actuelle, cela n'a aucun sens"".Il a rappelé qu’au cours des négociations du printemps, la Russie a constaté ""le manque de volonté de la partie ukrainienne de discuter sérieusement de quoi que ce soit"".""Nous étions prêts à conclure un accord sur la base de leurs principes. Nous leur avons remis un document qui, je le souligne encore une fois, a été rédigé selon leur logique. Et le 15 avril, ils ont reçu ce document, et depuis lors aucune nouvelle de leur part"", a déclaré Sergueï Lavrov dans une interview à Sputnik et à RT.Par ailleurs, le ministre estime que rien ne dépend de Kiev dans cette situation.""Je n'ai aucun doute que les Ukrainiens ne seront pas autorisés à négocier tant que les Américains n'auront pas décidé qu’ils [les Américains, ndlr] ont déjà fait suffisamment de scandale, ont semé le chaos et que maintenant ils peuvent les laisser à eux-mêmes pour voir comment ils s'en sortiront"", a conclu le diplomate.","[[['Le chef de la diplomatie russe s’est montré sceptique quant à la possibilité de la reprise des pourparlers entre Kiev et Moscou.'], ['D’après lui, ""dans la situation actuelle, cela n\'a aucun sens"".Il a rappelé qu’au cours des négociations du printemps, la Russie a constaté ""le manque de volonté de la partie ukrainienne de discuter sérieusement de quoi que ce soit"".'], ['""Nous étions prêts à conclure un accord sur la base de leurs principes.'], ['Nous leur avons remis un document qui, je le souligne encore une fois, a été rédigé selon leur logique.'], ['Et le 15 avril, ils ont reçu ce document, et depuis lors aucune nouvelle de leur part"", a déclaré Sergueï Lavrov dans une interview à Sputnik et à RT.Par ailleurs, le ministre estime que rien ne dépend de Kiev dans cette situation.'], ['""Je n\'ai aucun doute que les Ukrainiens ne seront pas autorisés à négocier tant que les Américains n\'auront pas décidé qu’ils [les Américains, ndlr] ont déjà fait suffisamment de scandale, ont semé le chaos et que maintenant ils peuvent les laisser à eux-mêmes pour voir comment ils s\'en sortiront"", a conclu le diplomate.']]]","[[['chef', 'diplomatie', 'russe', 'sceptique', 'possibilité', 'reprise', 'pourparlers', 'kiev', 'moscou'], ['situation', 'actuelle', 'cours', 'négociations', 'printemps', 'russie', 'manque', 'volonté', 'partie', 'ukrainienne'], ['accord', 'base', 'principes'], ['document', 'fois', 'logique'], ['avril', 'document', 'nouvelle', 'part', 'sergueï', 'lavrov', 'interview', 'sputnik', 'ministre', 'kiev', 'situation'], ['doute', 'ukrainiens', 'américains', 'américains', 'ndlr', 'scandale', 'chaos', 'diplomate']]]","[[['Kiev', 'Moscou'], ['Russie'], [], [], ['RT.Par', 'Kiev'], ['Ukraine', 'États-Unis', 'États-Unis']]]","[[[], [], [], [], ['Sputnik'], []]]","[[[], [], [], [], ['Sergueï Lavrov'], []]]","{'chef': 1, 'diplomatie': 1, 'russe': 1, 'sceptique': 1, 'possibilité': 1, 'reprise': 1, 'pourparlers': 1, 'kiev': 2, 'moscou': 1, 'situation': 2, 'actuelle': 1, 'cours': 1, 'négociations': 1, 'printemps': 1, 'russie': 1, 'manque': 1, 'volonté': 1, 'partie': 1, 'ukrainienne': 1, 'accord': 1, 'base': 1, 'principes': 1, 'document': 2, 'fois': 1, 'logique': 1, 'avril': 1, 'nouvelle': 1, 'part': 1, 'sergueï': 1, 'lavrov': 1, 'interview': 1, 'sputnik': 1, 'ministre': 1, 'doute': 1, 'ukrainiens': 1, 'américains': 2, 'ndlr': 1, 'scandale': 1, 'chaos': 1, 'diplomate': 1}","{'Kiev': 2, 'Moscou': 1, 'Russie': 1, 'RT.Par': 1, 'Ukraine': 1, 'États-Unis': 2}",{'Sputnik': 1},{'Sergueï Lavrov': 1},2022,7,20
1658354400,https://fr.sputniknews.africa/20220721/les-echanges-commerciaux-entre-inde-et-afrique-atteignent-des-sommets-1055611923.html,Les échanges commerciaux entre Inde et Afrique battent un record,"L’Inde est en passe de devenir un partenaire incontournable sur le continent africain, ses échanges avec les pays d'Afrique ont presque doublé sur un an. La levée des barrières douanières favorise le commerce avec New Delhi, qui veut...","Les échanges entre l’Afrique et l’Inde ont atteint un record de 89,5 milliards de dollars durant l’exercice fiscal 2020-2021 (1er avril-31 mars), contre 56 milliards pour l’exercice précédent, a déclaré le ministre indien des Affaires étrangères Subrahmanyam Jaishankar lors d’une récente conférence organisée par la banque indienne d'import-export (Exim Bank of India) et la Confédération de l’industrie indienne (CII).Les deux parties profitent des exemptions douanières mises en place, notamment du système de préférences tarifaires en franchise de droits (DFTP) lancé par l’Inde en faveur des pays les moins avancés. Trente-trois pays africains bénéficient de ce système. Mais New Delhi voit plus grand encore et plaide désormais pour un partenariat de libre-échange avec le continent africain.Mais New Delhi voit plus grand encore et plaide désormais pour un partenariat de libre-échange avec le continent africain.""Le moment est venu pour l’Inde et l’Afrique pour commencer à discuter d’un partenariat économique global ou d’un accord de libre-échange. Ce serait un accord gagnant-gagnant pour les deux parties"", a ainsi souligné le secrétaire d’État indien au Commerce, B. V. R. Subrahmanyam, lors de la même conférence.Depuis 15 ans, l’Inde mène d’importantes politiques d’investissements en Afrique, en particulier dans le domaine pharmaceutique et des télécommunications. Le pays des maharajas a investi 73,9 milliards de dollars sur le continent entre 1996 et 2021 et figure parmi les cinq premiers investisseurs sur le continent.","[[[""Les échanges entre l’Afrique et l’Inde ont atteint un record de 89,5 milliards de dollars durant l’exercice fiscal 2020-2021 (1er avril-31 mars), contre 56 milliards pour l’exercice précédent, a déclaré le ministre indien des Affaires étrangères Subrahmanyam Jaishankar lors d’une récente conférence organisée par la banque indienne d'import-export (Exim Bank of India) et la Confédération de l’industrie indienne (CII).Les deux parties profitent des exemptions douanières mises en place, notamment du système de préférences tarifaires en franchise de droits (DFTP) lancé par l’Inde en faveur des pays les moins avancés.""], ['Trente-trois pays africains bénéficient de ce système.'], ['Mais New Delhi voit plus grand encore et plaide désormais pour un partenariat de libre-échange avec le continent africain.Mais New Delhi voit plus grand encore et plaide désormais pour un partenariat de libre-échange avec le continent africain.'], ['""Le moment est venu pour l’Inde et l’Afrique pour commencer à discuter d’un partenariat économique global ou d’un accord de libre-échange.'], ['Ce serait un accord gagnant-gagnant pour les deux parties"", a ainsi souligné le secrétaire d’État indien au Commerce, B. V. R. Subrahmanyam, lors de la même conférence.Depuis 15 ans, l’Inde mène d’importantes politiques d’investissements en Afrique, en particulier dans le domaine pharmaceutique et des télécommunications.'], ['Le pays des maharajas a investi 73,9 milliards de dollars sur le continent entre 1996 et 2021 et figure parmi les cinq premiers investisseurs sur le continent.']]]","[[['échanges', 'afrique', 'inde', 'record', 'milliards', 'dollars', 'exercice', 'fiscal', 'mars', 'milliards', 'exercice', 'précédent', 'ministre', 'indien', 'affaires', 'étrangères', 'subrahmanyam', 'récente', 'conférence', 'banque', 'indienne', 'import', 'export', 'exim', 'confédération', 'industrie', 'indienne', 'parties', 'exemptions', 'douanières', 'place', 'système', 'préférences', 'tarifaires', 'franchise', 'droits', 'dftp', 'inde', 'faveur', 'pays', 'avancés'], ['pays', 'africains', 'système'], ['new', 'delhi', 'grand', 'partenariat', 'libre', 'échange', 'continent', 'new', 'delhi', 'grand', 'partenariat', 'libre', 'échange', 'continent', 'africain'], ['moment', 'inde', 'afrique', 'partenariat', 'économique', 'global', 'accord', 'libre', 'échange'], ['accord', 'gagnant', 'gagnant', 'parties', 'secrétaire', 'état', 'indien', 'commerce', 'ans', 'inde', 'importantes', 'politiques', 'investissements', 'afrique', 'particulier', 'domaine', 'pharmaceutique', 'télécommunications'], ['pays', 'maharajas', 'milliards', 'dollars', 'continent', 'premiers', 'investisseurs', 'continent']]]","[[['Afrique', 'Inde', 'Confédération de l’industrie indienne', 'CII).Les', 'Inde'], [], ['New Delhi'], ['Inde', 'Afrique'], ['État indien au Commerce', 'Inde', 'Afrique'], []]]","[[['ministre indien des Affaires', 'DFTP'], [], [], [], [], []]]","[[['Subrahmanyam Jaishankar'], [], [], [], ['B. V. R. Subrahmanyam'], []]]","{'échanges': 1, 'afrique': 3, 'inde': 4, 'record': 1, 'milliards': 3, 'dollars': 2, 'exercice': 2, 'fiscal': 1, 'mars': 1, 'précédent': 1, 'ministre': 1, 'indien': 2, 'affaires': 1, 'étrangères': 1, 'subrahmanyam': 1, 'récente': 1, 'conférence': 1, 'banque': 1, 'indienne': 2, 'import': 1, 'export': 1, 'exim': 1, 'confédération': 1, 'industrie': 1, 'parties': 2, 'exemptions': 1, 'douanières': 1, 'place': 1, 'système': 2, 'préférences': 1, 'tarifaires': 1, 'franchise': 1, 'droits': 1, 'dftp': 1, 'faveur': 1, 'pays': 3, 'avancés': 1, 'africains': 1, 'new': 2, 'delhi': 2, 'grand': 2, 'partenariat': 3, 'libre': 3, 'échange': 3, 'continent': 4, 'africain': 1, 'moment': 1, 'économique': 1, 'global': 1, 'accord': 2, 'gagnant': 2, 'secrétaire': 1, 'état': 1, 'commerce': 1, 'ans': 1, 'importantes': 1, 'politiques': 1, 'investissements': 1, 'particulier': 1, 'domaine': 1, 'pharmaceutique': 1, 'télécommunications': 1, 'maharajas': 1, 'premiers': 1, 'investisseurs': 1}","{'Afrique': 3, 'Inde': 4, 'Confédération de l’industrie indienne': 1, 'CII).Les': 1, 'New Delhi': 1, 'État indien au Commerce': 1}","{'ministre indien des Affaires': 1, 'DFTP': 1}","{'Subrahmanyam Jaishankar': 1, 'B. V. R. Subrahmanyam': 1}",2022,7,20
