timestamp,url,title,description,content,content-segmented,kws-l,loc-l,org-l,per-l,kws,loc,org,per,year,month,day
1676847600,https://fr.sputniknews.africa/20230220/alerte-aerienne-declenchee-a-kiev-ou-des-partenaires-importants-sont-attendus-1057967002.html,"Joe Biden est à Kiev, alors que l'alerte aérienne a été déclenchée partout en Ukraine","Les médias ukrainiens relatent que Joe Biden s'est rendu à Kiev où aujourd'hui des ""partenaires importants"", dont la directrice générale du FMI Kristalina Georgieva, sont attendus. Entre temps, l'alerte aérienne a résonné dans la capitale...","Volodymyr Zelensky a confirmé que Joe Biden était à Kiev après que cette information a été communiquée par les médias ukrainiens.Selon ces derniers, les deux Présidents se sont entretenus dans le monastère Saint-Michel-au-Dôme-d'Or à Kiev.Par la suite, des images les montrant quitter le site sous les sons de l’alerte aérienne ont été diffusées sur les réseaux sociaux.Après avoir été déclenchée à Kiev, l'alerte aérienne a été auparavant répandue ce lundi 20 février sur l'ensemble du territoire ukrainien. Cela, alors que des ""partenaires importants"" sont attendus, dont la directrice générale du Fonds monétaire international (FMI) Kristalina Georgieva. Moins d'une heure plus tard, l'alerte aérienne a été levée.Le Président ukrainien a publié une photo immortalisant sa poignée de main avec Joe Biden, qui porte une cravate aux couleurs du drapeau ukrainien. ""Votre visite est une manifestation très importante de soutien à tous les Ukrainiens"", a écrit Zelensky.Nouvelle aide, nouvelles sanctions...Le chef de l'État américain envisage d'annoncer de nouvelles livraisons d'armes, dont des munitions d'artillerie, des systèmes antichars et des radars, selon la Maison-Blanche. Ce nouveau lot d'aide militaire de 500 millions de dollars comprendra des Himars.En outre, il s'apprête à annoncer un nouveau paquet de sanctions antirusses qui toucheront des personnes et des entreprises liées à l'opération spéciale russe.Les États-Unis ont informé la Russie de la prochaine visite de Biden à Kiev quelques heures avant son départ, selon la Maison-Blanche, qui refuse de relater la réaction de Moscou.Le voyage de Joe Biden a été prévu pendant des mois par la Maison-Blanche, le Pentagone et les services secrets, a ajouté la présidence américaine.","[[[""Volodymyr Zelensky a confirmé que Joe Biden était à Kiev après que cette information a été communiquée par les médias ukrainiens.Selon ces derniers, les deux Présidents se sont entretenus dans le monastère Saint-Michel-au-Dôme-d'Or à Kiev.Par la suite, des images les montrant quitter le site sous les sons de l’alerte aérienne ont été diffusées sur les réseaux sociaux.Après avoir été déclenchée à Kiev, l'alerte aérienne a été auparavant répandue ce lundi 20 février sur l'ensemble du territoire ukrainien.""], ['Cela, alors que des ""partenaires importants"" sont attendus, dont la directrice générale du Fonds monétaire international (FMI) Kristalina Georgieva.'], [""Moins d'une heure plus tard, l'alerte aérienne a été levée.Le Président ukrainien a publié une photo immortalisant sa poignée de main avec Joe Biden, qui porte une cravate aux couleurs du drapeau ukrainien.""], ['""Votre visite est une manifestation très importante de soutien à tous les Ukrainiens"", a écrit Zelensky.Nouvelle aide, nouvelles sanctions...Le chef de l\'État américain envisage d\'annoncer de nouvelles livraisons d\'armes, dont des munitions d\'artillerie, des systèmes antichars et des radars, selon la Maison-Blanche.'], [""Ce nouveau lot d'aide militaire de 500 millions de dollars comprendra des Himars.En outre, il s'apprête à annoncer un nouveau paquet de sanctions antirusses qui toucheront des personnes et des entreprises liées à l'opération spéciale russe.Les États-Unis ont informé la Russie de la prochaine visite de Biden à Kiev quelques heures avant son départ, selon la Maison-Blanche, qui refuse de relater la réaction de Moscou.Le voyage de Joe Biden a été prévu pendant des mois par la Maison-Blanche, le Pentagone et les services secrets, a ajouté la présidence américaine.""]]]","[[['volodymyr', 'zelensky', 'joe', 'biden', 'information', 'médias', 'derniers', 'présidents', 'monastère', 'suite', 'images', 'site', 'sons', 'alerte', 'aérienne', 'réseaux', 'kiev', 'alerte', 'aérienne', 'lundi', 'février', 'ensemble', 'territoire', 'ukrainien'], ['partenaires', 'importants', 'directrice', 'générale', 'fonds', 'monétaire', 'international', 'fmi', 'kristalina', 'georgieva'], ['heure', 'alerte', 'aérienne', 'président', 'ukrainien', 'photo', 'poignée', 'main', 'joe', 'biden', 'cravate', 'couleurs', 'drapeau', 'ukrainien'], ['visite', 'manifestation', 'importante', 'soutien', 'ukrainiens', 'nouvelles', 'sanctions', 'chef', 'état', 'américain', 'nouvelles', 'livraisons', 'armes', 'munitions', 'artillerie', 'systèmes', 'antichars', 'radars', 'maison', 'blanche'], ['lot', 'aide', 'militaire', 'millions', 'dollars', 'paquet', 'sanctions', 'antirusses', 'personnes', 'entreprises', 'opération', 'spéciale', 'russie', 'prochaine', 'visite', 'biden', 'kiev', 'heures', 'départ', 'maison', 'blanche', 'réaction', 'voyage', 'joe', 'biden', 'mois', 'maison', 'blanche', 'pentagone', 'services', 'secrets', 'présidence', 'américaine']]]","[[['Kiev', ""Saint-Michel-au-Dôme-d'Or"", 'Kiev', 'Kiev'], [], [], ['Ukraine', 'Maison-Blanche'], ['États-Unis', 'Russie', 'Kiev', 'Maison-Blanche', 'Moscou', 'Maison-Blanche', 'Pentagone']]]","[[[], ['Fonds monétaire international', 'FMI'], [], [], []]]","[[['Volodymyr Zelensky', 'Joe Biden'], ['Kristalina Georgieva'], ['Président ukrainien', 'Joe Biden'], ['Zelensky'], ['Biden', 'Joe Biden']]]","{'volodymyr': 1, 'zelensky': 1, 'joe': 3, 'biden': 4, 'information': 1, 'médias': 1, 'derniers': 1, 'présidents': 1, 'monastère': 1, 'suite': 1, 'images': 1, 'site': 1, 'sons': 1, 'alerte': 3, 'aérienne': 3, 'réseaux': 1, 'kiev': 2, 'lundi': 1, 'février': 1, 'ensemble': 1, 'territoire': 1, 'ukrainien': 3, 'partenaires': 1, 'importants': 1, 'directrice': 1, 'générale': 1, 'fonds': 1, 'monétaire': 1, 'international': 1, 'fmi': 1, 'kristalina': 1, 'georgieva': 1, 'heure': 1, 'président': 1, 'photo': 1, 'poignée': 1, 'main': 1, 'cravate': 1, 'couleurs': 1, 'drapeau': 1, 'visite': 2, 'manifestation': 1, 'importante': 1, 'soutien': 1, 'ukrainiens': 1, 'nouvelles': 2, 'sanctions': 2, 'chef': 1, 'état': 1, 'américain': 1, 'livraisons': 1, 'armes': 1, 'munitions': 1, 'artillerie': 1, 'systèmes': 1, 'antichars': 1, 'radars': 1, 'maison': 3, 'blanche': 3, 'lot': 1, 'aide': 1, 'militaire': 1, 'millions': 1, 'dollars': 1, 'paquet': 1, 'antirusses': 1, 'personnes': 1, 'entreprises': 1, 'opération': 1, 'spéciale': 1, 'russie': 1, 'prochaine': 1, 'heures': 1, 'départ': 1, 'réaction': 1, 'voyage': 1, 'mois': 1, 'pentagone': 1, 'services': 1, 'secrets': 1, 'présidence': 1, 'américaine': 1}","{'Kiev': 4, ""Saint-Michel-au-Dôme-d'Or"": 1, 'Ukraine': 1, 'Maison-Blanche': 3, 'États-Unis': 1, 'Russie': 1, 'Moscou': 1, 'Pentagone': 1}","{'Fonds monétaire international': 1, 'FMI': 1}","{'Volodymyr Zelensky': 1, 'Joe Biden': 3, 'Kristalina Georgieva': 1, 'Président ukrainien': 1, 'Zelensky': 1, 'Biden': 1}",2023,2,19
1676847600,https://fr.sputniknews.africa/20230220/ndjamena-et-moscou-ensemble-contre-le-terrorisme-1057966842.html,"N'Djamena et Moscou, ensemble contre le terrorisme?","La Russie et le Tchad devraient signer un accord sur la lutte antiterroriste conjointe qui comporterait des ""points correspondant aux nouveaux défis"". C'est ce qu'a indiqué à Sputnik le chef de la diplomatie tchadienne.","Le Tchad a besoin de l'aide russe dans la lutte contre le terrorisme, a déclaré à Sputnik le ministre des Affaires étrangères de ce pays Mahamat Saleh Annadif.Lors de sa récente tournée en Afrique, le chef de la diplomatie russe Sergueï Lavrov avait déclaré que Moscou aiderait les pays du Sahara-Sahel, y compris le Tchad, en vue de combattre le terrorisme.""Oui, nous avons entendu la déclaration [de M.Lavrov], mais nous n'avons pas encore entendu de propositions concrètes de la part de la Russie. Oui, bien sûr, nous en avons besoin [d'un soutien dans la lutte antiterroriste].""Envoyer des étudiants en RussiePour le ministre, ce sont la lutte contre le terrorisme et la formation de spécialistes tchadiens en Russie qui constituent les principales tâches de la coopération bilatérale.Moscou et N'Djamena devraient, selon lui, signer un accord sur la lutte antiterroriste conjointe qui comporterait des ""points correspondant aux nouveaux défis"".Le Tchad espère également poursuivre la coopération avec la Russie dans le domaine militaro-technique, a ajouté Mahamat Saleh Annadif.La situation dans le pays reste tendue en raison des groupes armés agissant à ses frontières. Des militaires tchadiens participent notamment à la lutte contre le groupe islamiste radical Boko Haram* sur les territoires du Cameroun, du Nigeria et du Niger.* Organisation terroriste interdite en Russie","[[[""Le Tchad a besoin de l'aide russe dans la lutte contre le terrorisme, a déclaré à Sputnik le ministre des Affaires étrangères de ce pays Mahamat Saleh Annadif.Lors de sa récente tournée en Afrique, le chef de la diplomatie russe Sergueï Lavrov avait déclaré que Moscou aiderait les pays du Sahara-Sahel, y compris le Tchad, en vue de combattre le terrorisme.""], ['""Oui, nous avons entendu la déclaration [de M.Lavrov], mais nous n\'avons pas encore entendu de propositions concrètes de la part de la Russie.'], [""Oui, bien sûr, nous en avons besoin [d'un soutien dans la lutte antiterroriste].""], ['""Envoyer des étudiants en RussiePour le ministre, ce sont la lutte contre le terrorisme et la formation de spécialistes tchadiens en Russie qui constituent les principales tâches de la coopération bilatérale.Moscou et N\'Djamena devraient, selon lui, signer un accord sur la lutte antiterroriste conjointe qui comporterait des ""points correspondant aux nouveaux défis"".Le Tchad espère également poursuivre la coopération avec la Russie dans le domaine militaro-technique, a ajouté Mahamat Saleh Annadif.La situation dans le pays reste tendue en raison des groupes armés agissant à ses frontières.'], ['Des militaires tchadiens participent notamment à la lutte contre le groupe islamiste radical Boko Haram* sur les territoires du Cameroun, du Nigeria et du Niger.'], ['* Organisation terroriste interdite en Russie']]]","[[['tchad', 'besoin', 'aide', 'russe', 'lutte', 'terrorisme', 'sputnik', 'ministre', 'affaires', 'étrangères', 'pays', 'mahamat', 'récente', 'tournée', 'afrique', 'chef', 'diplomatie', 'russe', 'sergueï', 'lavrov', 'moscou', 'pays', 'sahara', 'sahel', 'tchad', 'vue', 'terrorisme'], ['oui', 'déclaration', 'propositions', 'concrètes', 'part', 'russie'], ['oui', 'sûr', 'besoin', 'soutien', 'lutte'], ['étudiants', 'ministre', 'lutte', 'terrorisme', 'formation', 'spécialistes', 'tchadiens', 'russie', 'principales', 'tâches', 'coopération', 'accord', 'lutte', 'antiterroriste', 'conjointe', 'points', 'nouveaux', 'tchad', 'coopération', 'russie', 'domaine', 'militaro', 'technique', 'situation', 'pays', 'tendue', 'raison', 'groupes', 'armés', 'frontières'], ['militaires', 'tchadiens', 'lutte', 'groupe', 'islamiste', 'radical', 'haram', 'territoires', 'cameroun', 'nigeria'], ['organisation', 'terroriste', 'russie']]]","[[['Tchad', 'Afrique', 'Moscou', 'Sahara-Sahel', 'Tchad'], ['Russie'], [], ['Russie', 'Moscou', ""N'Djamena"", 'Tchad', 'Russie'], ['Cameroun', 'Nigeria', 'Niger'], ['Russie']]]","[[['Sputnik', 'ministre des Affaires étrangères'], [], [], [], ['Boko Haram'], ['Organisation terroriste interdite']]]","[[['Mahamat Saleh Annadif', 'Sergueï Lavrov'], ['M.Lavrov'], [], ['Mahamat Saleh Annadif'], [], []]]","{'tchad': 3, 'besoin': 2, 'aide': 1, 'russe': 2, 'lutte': 5, 'terrorisme': 3, 'sputnik': 1, 'ministre': 2, 'affaires': 1, 'étrangères': 1, 'pays': 3, 'mahamat': 1, 'récente': 1, 'tournée': 1, 'afrique': 1, 'chef': 1, 'diplomatie': 1, 'sergueï': 1, 'lavrov': 1, 'moscou': 1, 'sahara': 1, 'sahel': 1, 'vue': 1, 'oui': 2, 'déclaration': 1, 'propositions': 1, 'concrètes': 1, 'part': 1, 'russie': 4, 'sûr': 1, 'soutien': 1, 'étudiants': 1, 'formation': 1, 'spécialistes': 1, 'tchadiens': 2, 'principales': 1, 'tâches': 1, 'coopération': 2, 'accord': 1, 'antiterroriste': 1, 'conjointe': 1, 'points': 1, 'nouveaux': 1, 'domaine': 1, 'militaro': 1, 'technique': 1, 'situation': 1, 'tendue': 1, 'raison': 1, 'groupes': 1, 'armés': 1, 'frontières': 1, 'militaires': 1, 'groupe': 1, 'islamiste': 1, 'radical': 1, 'haram': 1, 'territoires': 1, 'cameroun': 1, 'nigeria': 1, 'organisation': 1, 'terroriste': 1}","{'Tchad': 3, 'Afrique': 1, 'Moscou': 2, 'Sahara-Sahel': 1, 'Russie': 4, ""N'Djamena"": 1, 'Cameroun': 1, 'Nigeria': 1, 'Niger': 1}","{'Sputnik': 1, 'ministre des Affaires étrangères': 1, 'Boko Haram': 1, 'Organisation terroriste interdite': 1}","{'Mahamat Saleh Annadif': 2, 'Sergueï Lavrov': 1, 'M.Lavrov': 1}",2023,2,19
1676847600,https://fr.sputniknews.africa/20230220/les-appels-occidentaux-sur-lukraine-natteignent-pas-les-africains-et-les-sud-americains-1057966512.html,Les appels occidentaux sur l'Ukraine n’atteignent pas les Africains et les Sud-Américains,Les dirigeants américains et européens réunis à Munich ont essayé de convaincre le reste du monde que l'invasion russe était une menace pour tous. Leurs homologues africains et sud-américains ont fait la sourde oreille.,"Lors de la conférence de Munich sur la sécurité, les dirigeants occidentaux ont fait valoir que l’opération russe en Ukraine constituait une menace non seulement pour l'Europe, mais aussi pour le monde entier.""Il y a eu peu de preuves que leur message est passé"", résume le Financial Times.Le journal a noté qu’un groupe de hauts responsables américains et européens avaient cherché à convaincre le reste du monde de la menace que représentait pour eux l'opération de Vladimir Poutine. Ils ont également voulu leur montrer que la responsabilité de la hausse des prix mondiaux de l'alimentation et de l'énergie incombait à Moscou.La vice-présidente américaine Kamala Harris a notamment avancé qu'""aucune nation n'est en sécurité"" dans un monde où ""un pays peut violer la souveraineté et l'intégrité territoriale d'un autre"".Emmanuel Macron a déclaré que l'invasion russe ""néocoloniale, impérialiste"" n'était pas ""seulement une guerre européenne"". Le chancelier allemand Olaf Scholz a avancé que ce serait le problème de tout le monde si ""la loi du plus fort prévalait dans les relations internationales"".Frustration du Sud globalLeurs déclarations n’ont pas trouvé l’écho voulu.""Il y avait une frustration palpable parmi certains dirigeants de pays africains et sud-américains sur le fait que la guerre en Ukraine, qui entrera vendredi dans sa deuxième année, accaparait le temps, l'argent et l'attention de l'Occident au détriment d'autres problèmes urgents"", constate le Financial Times.L’Occident reconnaît son échecSelon le quotidien, les responsables occidentaux ont eux-mêmes avoué que les réunions bilatérales en marge de la conférence avaient révélé une préoccupation beaucoup plus grande des dirigeants africains et sud-américains sur des questions telles que l'inflation, la dette, la hausse des prix de l'énergie et la sécurité alimentaire que pour la guerre en Ukraine.S’y ajoute un ressentiment persistant à propos du bilan décevant de l'Occident en matière de partage de vaccins contre le coronavirus et d'indemnisation pour les dommages causés par le changement climatique.","[[[""Lors de la conférence de Munich sur la sécurité, les dirigeants occidentaux ont fait valoir que l’opération russe en Ukraine constituait une menace non seulement pour l'Europe, mais aussi pour le monde entier.""], ['""Il y a eu peu de preuves que leur message est passé"", résume le Financial Times.Le journal a noté qu’un groupe de hauts responsables américains et européens avaient cherché à convaincre le reste du monde de la menace que représentait pour eux l\'opération de Vladimir Poutine.'], ['Ils ont également voulu leur montrer que la responsabilité de la hausse des prix mondiaux de l\'alimentation et de l\'énergie incombait à Moscou.La vice-présidente américaine Kamala Harris a notamment avancé qu\'""aucune nation n\'est en sécurité"" dans un monde où ""un pays peut violer la souveraineté et l\'intégrité territoriale d\'un autre"".Emmanuel Macron a déclaré que l\'invasion russe ""néocoloniale, impérialiste"" n\'était pas ""seulement une guerre européenne"".'], ['Le chancelier allemand Olaf Scholz a avancé que ce serait le problème de tout le monde si ""la loi du plus fort prévalait dans les relations internationales"".Frustration du Sud globalLeurs déclarations n’ont pas trouvé l’écho voulu.'], ['""Il y avait une frustration palpable parmi certains dirigeants de pays africains et sud-américains sur le fait que la guerre en Ukraine, qui entrera vendredi dans sa deuxième année, accaparait le temps, l\'argent et l\'attention de l\'Occident au détriment d\'autres problèmes urgents"", constate le Financial Times.L’Occident reconnaît son échecSelon le quotidien, les responsables occidentaux ont eux-mêmes avoué que les réunions bilatérales en marge de la conférence avaient révélé une préoccupation beaucoup plus grande des dirigeants africains et sud-américains sur des questions telles que l\'inflation, la dette, la hausse des prix de l\'énergie et la sécurité alimentaire que pour la guerre en Ukraine.S’y ajoute un ressentiment persistant à propos du bilan décevant de l\'Occident en matière de partage de vaccins contre le coronavirus et d\'indemnisation pour les dommages causés par le changement climatique.']]]","[[['conférence', 'sécurité', 'dirigeants', 'occidentaux', 'opération', 'russe', 'ukraine', 'menace', 'europe', 'monde', 'entier'], ['preuves', 'message', 'financial', 'groupe', 'hauts', 'responsables', 'américains', 'européens', 'monde', 'menace', 'opération', 'vladimir', 'poutine'], ['responsabilité', 'hausse', 'prix', 'mondiaux', 'alimentation', 'énergie', 'américaine', 'harris', 'nation', 'sécurité', 'monde', 'pays', 'souveraineté', 'intégrité', 'territoriale', 'invasion', 'russe', 'néocoloniale', 'impérialiste', 'guerre', 'européenne'], ['chancelier', 'allemand', 'olaf', 'scholz', 'problème', 'monde', 'loi', 'relations', 'sud', 'globalleurs', 'déclarations', 'écho'], ['frustration', 'palpable', 'dirigeants', 'pays', 'africains', 'guerre', 'ukraine', 'vendredi', 'année', 'temps', 'argent', 'attention', 'occident', 'détriment', 'problèmes', 'urgents', 'financial', 'échecselon', 'quotidien', 'responsables', 'occidentaux', 'réunions', 'bilatérales', 'marge', 'conférence', 'préoccupation', 'grande', 'dirigeants', 'africains', 'questions', 'inflation', 'dette', 'hausse', 'prix', 'énergie', 'sécurité', 'alimentaire', 'guerre', 'ressentiment', 'persistant', 'propos', 'bilan', 'décevant', 'occident', 'matière', 'partage', 'vaccins', 'coronavirus', 'indemnisation', 'dommages', 'changement', 'climatique']]]","[[['Ukraine', 'Europe'], [], ['Moscou'], ['du Sud'], ['Ukraine', 'Occident', 'Occident', 'Ukraine', 'Occident']]]","[[[], ['Financial Times'], [], [], ['Financial Times']]]","[[[], ['Vladimir Poutine'], ['Kamala Harris', 'Emmanuel Macron'], ['Olaf Scholz'], []]]","{'conférence': 2, 'sécurité': 3, 'dirigeants': 3, 'occidentaux': 2, 'opération': 2, 'russe': 2, 'ukraine': 2, 'menace': 2, 'europe': 1, 'monde': 4, 'entier': 1, 'preuves': 1, 'message': 1, 'financial': 2, 'groupe': 1, 'hauts': 1, 'responsables': 2, 'américains': 1, 'européens': 1, 'vladimir': 1, 'poutine': 1, 'responsabilité': 1, 'hausse': 2, 'prix': 2, 'mondiaux': 1, 'alimentation': 1, 'énergie': 2, 'américaine': 1, 'harris': 1, 'nation': 1, 'pays': 2, 'souveraineté': 1, 'intégrité': 1, 'territoriale': 1, 'invasion': 1, 'néocoloniale': 1, 'impérialiste': 1, 'guerre': 3, 'européenne': 1, 'chancelier': 1, 'allemand': 1, 'olaf': 1, 'scholz': 1, 'problème': 1, 'loi': 1, 'relations': 1, 'sud': 1, 'globalleurs': 1, 'déclarations': 1, 'écho': 1, 'frustration': 1, 'palpable': 1, 'africains': 2, 'vendredi': 1, 'année': 1, 'temps': 1, 'argent': 1, 'attention': 1, 'occident': 2, 'détriment': 1, 'problèmes': 1, 'urgents': 1, 'échecselon': 1, 'quotidien': 1, 'réunions': 1, 'bilatérales': 1, 'marge': 1, 'préoccupation': 1, 'grande': 1, 'questions': 1, 'inflation': 1, 'dette': 1, 'alimentaire': 1, 'ressentiment': 1, 'persistant': 1, 'propos': 1, 'bilan': 1, 'décevant': 1, 'matière': 1, 'partage': 1, 'vaccins': 1, 'coronavirus': 1, 'indemnisation': 1, 'dommages': 1, 'changement': 1, 'climatique': 1}","{'Ukraine': 3, 'Europe': 1, 'Moscou': 1, 'du Sud': 1, 'Occident': 3}",{'Financial Times': 2},"{'Vladimir Poutine': 1, 'Kamala Harris': 1, 'Emmanuel Macron': 1, 'Olaf Scholz': 1}",2023,2,19
