timestamp,url,title,description,content,content-segmented,kws-l,loc-l,org-l,per-l,kws,loc,org,per,year,month,day
1682028000,https://fr.sputniknews.africa/20230421/lidee-de-nouvelles-sanctions-antirusses-rend-incertains-ces-pays-occidentaux-1058765749.html,L’idée de nouvelles sanctions antirusses rend incertains ces pays occidentaux,"L’UE se retrouve dans une impasse face à la volonté affichée d’imposer de nouvelles restrictions à la Russie, la Suisse refuse le gel d’actifs russes, un ministre japonais évite de commenter l’éventuelle interdiction d’exporter vers la...","Le ministre nippon de l’Énergie a refusé de commenter l’idée d’interdire les exportations vers la Russie qui serait évoquée au cours du prochain sommet du G7 programmé en mai à Hiroshima.""Cette question touche à des négociations diplomatiques, je préfère m’abstenir de commentaires"", a déclaré Yasutoshi Nishimura, cité par l’agence de presse nippone Kyodo.Cette hypothèse d’un nouvel embargo fait tourner la tête à plusieurs alliés de l’Ukraine dont les États-Unis, écrit Bloomberg. Les responsables du Groupe des Sept discuteraient de l'idée et envisageraient d’entraîner l’Union européenne dans cette discussion.Toujours selon Bloomberg, cette éventuelle restriction globale prévoit d’arrêter toutes les exportations vers la Russie -sauf celles de produits figurant dans la liste d’exceptions. Si les dirigeants du G7 approuvent la décision en mai, il faudrait alors convenir exactement de ce qui sera exclu –ce seraient probablement les médicaments et les produits agricoles, y compris les aliments.Prise de conscience des impacts?Devant la perspective de nouvelles restrictions économiques, qui ont déjà d’ailleurs montré leur effet boomerang, les voix hésitantes ou opposées semblent se multiplier en Occident.Par exemple, l’Union européenne évoque l’épuisement des possibilités de sanctionner la Russie sans qu’elles se répercutent gravement sur certains membres des Vingt-Sept, a rapporté le 20 avril le Financial Times, citant des responsables européens anonymes. Selon le journal, d'autres sanctions se heurteraient probablement au veto des États membres de l'UE qui ""ne peuvent pas vivre sans"" les industries russes, comme l'énergie nucléaire.De son côté, la Suisse a refusé le 19 avril l’idée de rejoindre un groupe international qui a pour mission de geler les actifs de citoyens russes. Il s’agit du groupe REPO (Russian Elites, Proxies and Oligarchs). Berne se réserve quand même le droit de l’intégrer si cela répond à ses intérêts à l’avenir. Autrement dit, ce gel d’argent russe nuirait à l’économie suisse, a minima dans un premier temps.Le seul pays du Vieux continent qui résiste aux sanctions antirusses depuis le début, la Serbie, avoue être saturé des demandes incessantes de l’UE d’y souscrire enfin. Le Président Aleksandar Vucic s’est dit ""fatigué"" de cette question de restrictions. ""Ils ne font que répéter [leur demande] que je soutienne les sanctions"", a-t-il indiqué.","[[['Le ministre nippon de l’Énergie a refusé de commenter l’idée d’interdire les exportations vers la Russie qui serait évoquée au cours du prochain sommet du G7 programmé en mai à Hiroshima.'], ['""Cette question touche à des négociations diplomatiques, je préfère m’abstenir de commentaires"", a déclaré Yasutoshi Nishimura, cité par l’agence de presse nippone Kyodo.Cette hypothèse d’un nouvel embargo fait tourner la tête à plusieurs alliés de l’Ukraine dont les États-Unis, écrit Bloomberg.'], [""Les responsables du Groupe des Sept discuteraient de l'idée et envisageraient d’entraîner l’Union européenne dans cette discussion.Toujours selon Bloomberg, cette éventuelle restriction globale prévoit d’arrêter toutes les exportations vers la Russie -sauf celles de produits figurant dans la liste d’exceptions.""], ['Si les dirigeants du G7 approuvent la décision en mai, il faudrait alors convenir exactement de ce qui sera exclu –ce seraient probablement les médicaments et les produits agricoles, y compris les aliments.Prise de conscience des impacts?Devant la perspective de nouvelles restrictions économiques, qui ont déjà d’ailleurs montré leur effet boomerang, les voix hésitantes ou opposées semblent se multiplier en Occident.Par exemple, l’Union européenne évoque l’épuisement des possibilités de sanctionner la Russie sans qu’elles se répercutent gravement sur certains membres des Vingt-Sept, a rapporté le 20 avril le Financial Times, citant des responsables européens anonymes.'], ['Selon le journal, d\'autres sanctions se heurteraient probablement au veto des États membres de l\'UE qui ""ne peuvent pas vivre sans"" les industries russes, comme l\'énergie nucléaire.De son côté, la Suisse a refusé le 19 avril l’idée de rejoindre un groupe international qui a pour mission de geler les actifs de citoyens russes.'], ['Il s’agit du groupe REPO (Russian Elites, Proxies and Oligarchs).'], ['Berne se réserve quand même le droit de l’intégrer si cela répond à ses intérêts à l’avenir.'], ['Autrement dit, ce gel d’argent russe nuirait à l’économie suisse, a minima dans un premier temps.Le seul pays du Vieux continent qui résiste aux sanctions antirusses depuis le début, la Serbie, avoue être saturé des demandes incessantes de l’UE d’y souscrire enfin.'], ['Le Président Aleksandar Vucic s’est dit ""fatigué"" de cette question de restrictions.'], ['""Ils ne font que répéter [leur demande] que je soutienne les sanctions"", a-t-il indiqué.']]]","[[['ministre', 'nippon', 'énergie', 'idée', 'exportations', 'russie', 'cours', 'prochain', 'sommet', 'mai', 'hiroshima'], ['question', 'négociations', 'diplomatiques', 'commentaires', 'yasutoshi', 'nishimura', 'cité', 'agence', 'presse', 'hypothèse', 'nouvel', 'embargo', 'tête', 'alliés', 'ukraine', 'bloomberg'], ['responsables', 'groupe', 'idée', 'union', 'européenne', 'bloomberg', 'éventuelle', 'restriction', 'globale', 'exportations', 'russie', 'produits', 'liste', 'exceptions'], ['dirigeants', 'décision', 'mai', 'médicaments', 'produits', 'agricoles', 'conscience', 'perspective', 'nouvelles', 'restrictions', 'économiques', 'boomerang', 'voix', 'hésitantes', 'exemple', 'union', 'européenne', 'épuisement', 'possibilités', 'russie', 'membres', 'avril', 'financial', 'responsables', 'européens', 'anonymes'], ['journal', 'sanctions', 'veto', 'états', 'membres', 'ue', 'industries', 'russes', 'énergie', 'côté', 'suisse', 'avril', 'idée', 'groupe', 'international', 'mission', 'actifs', 'citoyens', 'russes'], ['groupe', 'repo', 'elites', 'oligarchs'], ['berne', 'droit', 'intérêts', 'avenir'], ['gel', 'argent', 'russe', 'économie', 'suisse', 'pays', 'vieux', 'continent', 'sanctions', 'antirusses', 'début', 'serbie', 'demandes', 'incessantes', 'ue'], ['président', 'aleksandar', 'vucic', 'fatigué', 'question', 'restrictions'], ['demande', 'sanctions']]]","[[['Russie', 'Hiroshima'], ['Kyodo', 'Ukraine', 'États-Unis'], ['Russie'], ['Occident', 'Russie'], ['États', 'Suisse'], [], ['Berne'], ['Vieux', 'Serbie'], [], []]]","[[['Énergie', 'G7'], [], ['Groupe des Sept', 'Union européenne'], ['G7', 'Union européenne', 'Vingt-Sept', 'Financial Times'], ['UE'], ['REPO', 'Russian Elites', 'Proxies and Oligarchs'], [], ['UE'], [], []]]","[[[], ['Yasutoshi Nishimura', 'Bloomberg'], ['Bloomberg'], [], [], [], [], [], ['Aleksandar Vucic'], []]]","{'ministre': 1, 'nippon': 1, 'énergie': 2, 'idée': 3, 'exportations': 2, 'russie': 3, 'cours': 1, 'prochain': 1, 'sommet': 1, 'mai': 2, 'hiroshima': 1, 'question': 2, 'négociations': 1, 'diplomatiques': 1, 'commentaires': 1, 'yasutoshi': 1, 'nishimura': 1, 'cité': 1, 'agence': 1, 'presse': 1, 'hypothèse': 1, 'nouvel': 1, 'embargo': 1, 'tête': 1, 'alliés': 1, 'ukraine': 1, 'bloomberg': 2, 'responsables': 2, 'groupe': 3, 'union': 2, 'européenne': 2, 'éventuelle': 1, 'restriction': 1, 'globale': 1, 'produits': 2, 'liste': 1, 'exceptions': 1, 'dirigeants': 1, 'décision': 1, 'médicaments': 1, 'agricoles': 1, 'conscience': 1, 'perspective': 1, 'nouvelles': 1, 'restrictions': 2, 'économiques': 1, 'boomerang': 1, 'voix': 1, 'hésitantes': 1, 'exemple': 1, 'épuisement': 1, 'possibilités': 1, 'membres': 2, 'avril': 2, 'financial': 1, 'européens': 1, 'anonymes': 1, 'journal': 1, 'sanctions': 3, 'veto': 1, 'états': 1, 'ue': 2, 'industries': 1, 'russes': 2, 'côté': 1, 'suisse': 2, 'international': 1, 'mission': 1, 'actifs': 1, 'citoyens': 1, 'repo': 1, 'elites': 1, 'oligarchs': 1, 'berne': 1, 'droit': 1, 'intérêts': 1, 'avenir': 1, 'gel': 1, 'argent': 1, 'russe': 1, 'économie': 1, 'pays': 1, 'vieux': 1, 'continent': 1, 'antirusses': 1, 'début': 1, 'serbie': 1, 'demandes': 1, 'incessantes': 1, 'président': 1, 'aleksandar': 1, 'vucic': 1, 'fatigué': 1, 'demande': 1}","{'Russie': 3, 'Hiroshima': 1, 'Kyodo': 1, 'Ukraine': 1, 'États-Unis': 1, 'Occident': 1, 'États': 1, 'Suisse': 1, 'Berne': 1, 'Vieux': 1, 'Serbie': 1}","{'Énergie': 1, 'G7': 2, 'Groupe des Sept': 1, 'Union européenne': 2, 'Vingt-Sept': 1, 'Financial Times': 1, 'UE': 2, 'REPO': 1, 'Russian Elites': 1, 'Proxies and Oligarchs': 1}","{'Yasutoshi Nishimura': 1, 'Bloomberg': 2, 'Aleksandar Vucic': 1}",2023,4,20
1682028000,https://fr.sputniknews.africa/20230421/le-kremlin-indique-ce-qui-arrivera-si-certains-pays-arretent-leurs-exportations-vers-la-russie-1058765349.html,Le Kremlin indique ce qui arrivera si certains pays arrêtent leurs exportations vers la Russie,"D’éventuelles sanctions économiques de la part de pays du G7 impliquant l’interdiction quasi-totale de leurs exportations vers la Russie frapperont l’économie mondiale, considère le porte-parole du Kremlin. Ces restrictions pourraient même...","L’arrêt des exportations vers la Russie, qui serait à l’étude au sein du G7, aurait de graves conséquences pour l'économie mondiale, a déclaré ce vendredi 21 avril Dmitri Peskov, le porte-parole du Président russe.""En tout cas, les sanctions qu’on a déjà imposé à notre pays ainsi que des mesures supplémentaires qui seraient envisagées par Bruxelles et Washington, affecteront également l'économie mondiale"", a-t-il lancé.Ces restrictions pourraient augmenter le risque d’une crise économique à l’échelle mondiale, a ajouté M.Peskov.Moscou suit l’évolution de la situation et ""se rend compte"" que les États-Unis et l’Union européenne réfléchissent sur des sanctions supplémentaires à adopter, a-t-il ajouté.Vers un arrêt quasi-total des exportations vers la Russie?Le 20 avril, l’agence Bloomberg avait annoncé que les pays du G7 envisageaient d’interdire la quasi-totalité de leurs exportations vers la Russie, à part probablement les médicaments, produits agricoles et les aliments.La proposition, qui ferait toujours débat et pourrait changer, devrait être discutée lors du sommet du G7 au Japon en mai.Des trains et des trains de sanctions""Aucun pays au monde n'a jamais été confronté à un tel nombre de sanctions"" que la Russie, a souligné le porte-parole du Kremlin.Depuis 2014, l’UE, les États-Unis et d’autres pays adoptent des sanctions contre la Russie. Cette pression s‘est accentuée après le début de l’opération militaire spéciale russe dans le Donbass, en février 2022. Les sanctions visent des individus et des organisations et prévoient des restrictions économiques et financières -y compris les contrôles des exportations et importations- et des mesures en matière de visas.","[[[""L’arrêt des exportations vers la Russie, qui serait à l’étude au sein du G7, aurait de graves conséquences pour l'économie mondiale, a déclaré ce vendredi 21 avril Dmitri Peskov, le porte-parole du Président russe.""], ['""En tout cas, les sanctions qu’on a déjà imposé à notre pays ainsi que des mesures supplémentaires qui seraient envisagées par Bruxelles et Washington, affecteront également l\'économie mondiale"", a-t-il lancé.Ces restrictions pourraient augmenter le risque d’une crise économique à l’échelle mondiale, a ajouté M.Peskov.Moscou suit l’évolution de la situation et ""se rend compte"" que les États-Unis et l’Union européenne réfléchissent sur des sanctions supplémentaires à adopter, a-t-il ajouté.Vers un arrêt quasi-total des exportations vers la Russie?Le 20 avril, l’agence Bloomberg avait annoncé que les pays du G7 envisageaient d’interdire la quasi-totalité de leurs exportations vers la Russie, à part probablement les médicaments, produits agricoles et les aliments.La proposition, qui ferait toujours débat et pourrait changer, devrait être discutée lors du sommet du G7 au Japon en mai.Des trains et des trains de sanctions""Aucun pays au monde n\'a jamais été confronté à un tel nombre de sanctions"" que la Russie, a souligné le porte-parole du Kremlin.Depuis 2014, l’UE, les États-Unis et d’autres pays adoptent des sanctions contre la Russie.'], ['Cette pression s‘est accentuée après le début de l’opération militaire spéciale russe dans le Donbass, en février 2022.'], ['Les sanctions visent des individus et des organisations et prévoient des restrictions économiques et financières -y compris les contrôles des exportations et importations- et des mesures en matière de visas.']]]","[[['arrêt', 'exportations', 'russie', 'étude', 'sein', 'graves', 'conséquences', 'économie', 'mondiale', 'vendredi', 'avril', 'peskov', 'président'], ['cas', 'sanctions', 'pays', 'mesures', 'supplémentaires', 'bruxelles', 'washington', 'économie', 'mondiale', 'restrictions', 'risque', 'crise', 'économique', 'échelle', 'mondiale', 'évolution', 'situation', 'compte', 'union', 'européenne', 'sanctions', 'supplémentaires', 'arrêt', 'exportations', 'avril', 'agence', 'bloomberg', 'pays', 'exportations', 'russie', 'part', 'médicaments', 'produits', 'agricoles', 'proposition', 'débat', 'sommet', 'japon', 'trains', 'trains', 'pays', 'monde', 'nombre', 'sanctions', 'russie', 'ue', 'pays', 'sanctions', 'russie'], ['pression', 'accentuée', 'début', 'opération', 'militaire', 'spéciale', 'russe', 'donbass', 'février'], ['sanctions', 'individus', 'organisations', 'restrictions', 'économiques', 'financières', 'contrôles', 'exportations', 'mesures', 'matière', 'visas']]]","[[['Russie'], ['Bruxelles', 'Washington', 'Moscou', 'États-Unis', 'Russie', 'Japon', 'sanctions""Aucun', 'Russie', 'Kremlin', 'États-Unis', 'Russie'], ['Donbass'], []]]","[[['G7'], ['M.Peskov', 'Union européenne', 'Russie?Le', 'G7', 'G7', 'UE'], [], []]]","[[['Dmitri Peskov', 'Président russe'], ['Bloomberg'], [], []]]","{'arrêt': 2, 'exportations': 4, 'russie': 4, 'étude': 1, 'sein': 1, 'graves': 1, 'conséquences': 1, 'économie': 2, 'mondiale': 3, 'vendredi': 1, 'avril': 2, 'peskov': 1, 'président': 1, 'cas': 1, 'sanctions': 5, 'pays': 4, 'mesures': 2, 'supplémentaires': 2, 'bruxelles': 1, 'washington': 1, 'restrictions': 2, 'risque': 1, 'crise': 1, 'économique': 1, 'échelle': 1, 'évolution': 1, 'situation': 1, 'compte': 1, 'union': 1, 'européenne': 1, 'agence': 1, 'bloomberg': 1, 'part': 1, 'médicaments': 1, 'produits': 1, 'agricoles': 1, 'proposition': 1, 'débat': 1, 'sommet': 1, 'japon': 1, 'trains': 2, 'monde': 1, 'nombre': 1, 'ue': 1, 'pression': 1, 'accentuée': 1, 'début': 1, 'opération': 1, 'militaire': 1, 'spéciale': 1, 'russe': 1, 'donbass': 1, 'février': 1, 'individus': 1, 'organisations': 1, 'économiques': 1, 'financières': 1, 'contrôles': 1, 'matière': 1, 'visas': 1}","{'Russie': 4, 'Bruxelles': 1, 'Washington': 1, 'Moscou': 1, 'États-Unis': 2, 'Japon': 1, 'sanctions""Aucun': 1, 'Kremlin': 1, 'Donbass': 1}","{'G7': 3, 'M.Peskov': 1, 'Union européenne': 1, 'Russie?Le': 1, 'UE': 1}","{'Dmitri Peskov': 1, 'Président russe': 1, 'Bloomberg': 1}",2023,4,20
1682028000,https://fr.sputniknews.africa/20230421/combats-a-artiomovsk-525-soldats-ukrainiens-neutralisesla-defense-russe-publie-son-nouveau-bilan-1058765069.html,"Combats à Artiomovsk, 525 soldats ukrainiens neutralisés…La Défense russe publie son nouveau bilan","Ces dernières 24 heures, les militaires russes ont éliminé 525 soldats ukrainiens dont 310 sur l’axe de Donetsk, indique la Défense russe dans son nouveau bilan. Ils poursuivent leur fixation à Artiomovsk et déjouent les tentatives de...","Les forces armées ukrainiennes ont perdu environ 525 militaires en ces dernières 24 heures, rapporte ce vendredi 21 avril le ministère russe de la Défense dans son bilan quotidien.Jusqu’à 310 soldats ont été tués sur l’axe de Donetsk, en proie à des combats intenses notamment à Artiomovsk (Bakhmout).Des commandos russes continuent de mener des actions dans la partie ouest de la ville. Les unités aéroportées contrecarrent les tentatives de l’ennemi d’attaquer depuis les flancs et appuient les troupes d’assaut.Ces manœuvres terrestres ont été appuyées par l’aviation et l’artillerie du groupement Sud. Ces unités ont réussi 69 missions de tir en 24 heures et huit sorties aériennes.Les forces armées de Kiev ont également perdu plus de 60 soldats sur l’axe de Koupiansk, et jusqu’à 90 autres dans les zones du sud de Donetsk et de Zaporojié. Enfin, plus de 55 hommes ont été éliminés sur l’axe de Krasny Liman et une dizaine sur l’axe de Kherson.Quatre groupes ukrainiens de sabotage et de reconnaissance ont été mis en échec dans la république populaire de Lougansk (RPL) et dans la région de Kharkov.Armes détruitesParmi les obusiers mis hors service figurent deux D-20, deux Msta-B, un canon automoteur Akatsiya et deux Gvozdika, ainsi qu’un lance-roquettes multiple Grad.Trois entrepôts de munitions et un stock de carburant ont aussi été bombardés.L’armée russe a intercepté trois projectiles de lance-roquettes multiples HIMARS de production américaine et abattu trois drones.Au total, en 24 heures, les frappes russes ont visé 94 postes d’artillerie ainsi que du personnel et du matériel militaires dans 135 zones.Depuis le début de l’opération militaire spéciale en Ukraine, l’armée russe a abattu 411 avions, 228 hélicoptères et 3.782 drones. Elle a détruit 415 systèmes de défense sol-air, 8.773 chars et autres blindés, 1.091 lance-roquettes multiples, 4.633 pièces d’artillerie de terrain et de mortiers, et 9.650 autres équipements militaires.","[[['Les forces armées ukrainiennes ont perdu environ 525 militaires en ces dernières 24 heures, rapporte ce vendredi 21 avril le ministère russe de la Défense dans son bilan quotidien.Jusqu’à 310 soldats ont été tués sur l’axe de Donetsk, en proie à des combats intenses notamment à Artiomovsk (Bakhmout).Des commandos russes continuent de mener des actions dans la partie ouest de la ville.'], ['Les unités aéroportées contrecarrent les tentatives de l’ennemi d’attaquer depuis les flancs et appuient les troupes d’assaut.Ces manœuvres terrestres ont été appuyées par l’aviation et l’artillerie du groupement Sud.'], ['Ces unités ont réussi 69 missions de tir en 24 heures et huit sorties aériennes.Les forces armées de Kiev ont également perdu plus de 60 soldats sur l’axe de Koupiansk, et jusqu’à 90 autres dans les zones du sud de Donetsk et de Zaporojié.'], ['Enfin, plus de 55 hommes ont été éliminés sur l’axe de Krasny Liman et une dizaine sur l’axe de Kherson.Quatre groupes ukrainiens de sabotage et de reconnaissance ont été mis en échec dans la république populaire de Lougansk (RPL) et dans la région de Kharkov.Armes détruitesParmi les obusiers mis hors service figurent deux D-20, deux Msta-B, un canon automoteur Akatsiya et deux Gvozdika, ainsi qu’un lance-roquettes multiple Grad.Trois entrepôts de munitions et un stock de carburant ont aussi été bombardés.L’armée russe a intercepté trois projectiles de lance-roquettes multiples HIMARS de production américaine et abattu trois drones.Au total, en 24 heures, les frappes russes ont visé 94 postes d’artillerie ainsi que du personnel et du matériel militaires dans 135 zones.Depuis le début de l’opération militaire spéciale en Ukraine, l’armée russe a abattu 411 avions, 228 hélicoptères et 3.782 drones.'], ['Elle a détruit 415 systèmes de défense sol-air, 8.773 chars et autres blindés, 1.091 lance-roquettes multiples, 4.633 pièces d’artillerie de terrain et de mortiers, et 9.650 autres équipements militaires.']]]","[[['forces', 'armées', 'ukrainiennes', 'militaires', 'dernières', 'heures', 'vendredi', 'avril', 'ministère', 'russe', 'défense', 'bilan', 'soldats', 'axe', 'donetsk', 'proie', 'combats', 'intenses', 'artiomovsk', 'commandos', 'russes', 'actions', 'partie', 'ouest', 'ville'], ['unités', 'aéroportées', 'tentatives', 'ennemi', 'flancs', 'troupes', 'manœuvres', 'terrestres', 'aviation', 'artillerie', 'groupement', 'sud'], ['unités', 'missions', 'tir', 'heures', 'sorties', 'forces', 'armées', 'kiev', 'soldats', 'axe', 'koupiansk', 'zones', 'sud', 'donetsk', 'zaporojié'], ['hommes', 'axe', 'krasny', 'liman', 'dizaine', 'axe', 'groupes', 'ukrainiens', 'sabotage', 'reconnaissance', 'échec', 'république', 'populaire', 'lougansk', 'rpl', 'région', 'obusiers', 'service', 'msta', 'b', 'canon', 'automoteur', 'akatsiya', 'gvozdika', 'lance', 'roquettes', 'multiple', 'entrepôts', 'munitions', 'stock', 'carburant', 'armée', 'russe', 'projectiles', 'roquettes', 'multiples', 'himars', 'production', 'américaine', 'total', 'heures', 'frappes', 'russes', 'postes', 'artillerie', 'personnel', 'matériel', 'militaires', 'début', 'opération', 'militaire', 'spéciale', 'ukraine', 'armée', 'russe', 'avions', 'hélicoptères', 'drones'], ['systèmes', 'défense', 'sol', 'air', 'chars', 'blindés', 'roquettes', 'multiples', 'pièces', 'artillerie', 'terrain', 'mortiers', 'équipements', 'militaires']]]","[[['Donetsk', 'Artiomovsk', 'Bakhmout).Des'], ['Sud'], ['Kiev', 'Koupiansk', 'Donetsk', 'Zaporojié'], ['Krasny Liman', 'Kherson', 'république populaire de Lougansk', 'RPL', 'Kharkov', 'Msta-B', 'Grad', 'Ukraine'], []]]","[[['ministère russe de la Défense'], [], [], [], []]]","[[[], [], [], ['Gvozdika'], []]]","{'forces': 2, 'armées': 2, 'ukrainiennes': 1, 'militaires': 3, 'dernières': 1, 'heures': 3, 'vendredi': 1, 'avril': 1, 'ministère': 1, 'russe': 3, 'défense': 2, 'bilan': 1, 'soldats': 2, 'axe': 4, 'donetsk': 2, 'proie': 1, 'combats': 1, 'intenses': 1, 'artiomovsk': 1, 'commandos': 1, 'russes': 2, 'actions': 1, 'partie': 1, 'ouest': 1, 'ville': 1, 'unités': 2, 'aéroportées': 1, 'tentatives': 1, 'ennemi': 1, 'flancs': 1, 'troupes': 1, 'manœuvres': 1, 'terrestres': 1, 'aviation': 1, 'artillerie': 3, 'groupement': 1, 'sud': 2, 'missions': 1, 'tir': 1, 'sorties': 1, 'kiev': 1, 'koupiansk': 1, 'zones': 1, 'zaporojié': 1, 'hommes': 1, 'krasny': 1, 'liman': 1, 'dizaine': 1, 'groupes': 1, 'ukrainiens': 1, 'sabotage': 1, 'reconnaissance': 1, 'échec': 1, 'république': 1, 'populaire': 1, 'lougansk': 1, 'rpl': 1, 'région': 1, 'obusiers': 1, 'service': 1, 'msta': 1, 'b': 1, 'canon': 1, 'automoteur': 1, 'akatsiya': 1, 'gvozdika': 1, 'lance': 1, 'roquettes': 3, 'multiple': 1, 'entrepôts': 1, 'munitions': 1, 'stock': 1, 'carburant': 1, 'armée': 2, 'projectiles': 1, 'multiples': 2, 'himars': 1, 'production': 1, 'américaine': 1, 'total': 1, 'frappes': 1, 'postes': 1, 'personnel': 1, 'matériel': 1, 'début': 1, 'opération': 1, 'militaire': 1, 'spéciale': 1, 'ukraine': 1, 'avions': 1, 'hélicoptères': 1, 'drones': 1, 'systèmes': 1, 'sol': 1, 'air': 1, 'chars': 1, 'blindés': 1, 'pièces': 1, 'terrain': 1, 'mortiers': 1, 'équipements': 1}","{'Donetsk': 2, 'Artiomovsk': 1, 'Bakhmout).Des': 1, 'Sud': 1, 'Kiev': 1, 'Koupiansk': 1, 'Zaporojié': 1, 'Krasny Liman': 1, 'Kherson': 1, 'république populaire de Lougansk': 1, 'RPL': 1, 'Kharkov': 1, 'Msta-B': 1, 'Grad': 1, 'Ukraine': 1}",{'ministère russe de la Défense': 1},{'Gvozdika': 1},2023,4,20
