timestamp,url,title,description,content,content-segmented,kws-l,loc-l,org-l,per-l,kws,loc,org,per,year,month,day
1668380400,https://fr.sputniknews.africa/20221114/la-plupart-des-entreprises-russes-se-sont-adaptees-aux-sanctions-occidentales-revele-un-sondage-1056822611.html,"La plupart des entreprises russes se sont adaptées aux sanctions occidentales, révèle un sondage","Plus de la moitié des entrepreneurs russes affirment s’être habitués aux mesures restrictives décrétées par l’Occident, leurs sociétés fonctionnent normalement, selon une récente enquête.","Au total, 55,4% des hommes d’affaires russes se sont adaptés aux sanctions occidentales imposées contre Moscou après le début de l'opération militaire en Ukraine, indique une enquête réalisée par le bureau du commissaire pour la Protection des droits des entrepreneurs auprès du Président russe.5.760 chefs d'entreprise de toutes les régions du pays y ont pris part.""Seuls 10,5% des personnes consultées ont assuré ne pas pouvoir faire face aux conséquences des restrictions, tandis que 16,3% affirment ne pas les avoir remarquées du tout"", constate le sondage.De nouveaux fournisseursAlors que 9% des entrepreneurs ont dit avoir conservé une croissance stable de leurs recettes, 30,4% ont enregistré une baisse. Ils ont toutefois souligné que la situation était ""sous contrôle"". L'enquête a révélé que seuls 6% avaient fermé leur entreprise ou envisageaient de le faire.En outre, la majorité des personnes interrogées ont indiqué qu'elles avaient réussi à trouver de nouveaux fournisseurs pour les mêmes produits ou des produits similaires, que ce soit en Russie ou à l'étranger.","[[[""Au total, 55,4% des hommes d’affaires russes se sont adaptés aux sanctions occidentales imposées contre Moscou après le début de l'opération militaire en Ukraine, indique une enquête réalisée par le bureau du commissaire pour la Protection des droits des entrepreneurs auprès du Président russe.5.760 chefs d'entreprise de toutes les régions du pays y ont pris part."", '""Seuls 10,5% des personnes consultées ont assuré ne pas pouvoir faire face aux conséquences des restrictions, tandis que 16,3% affirment ne pas les avoir remarquées du tout"", constate le sondage.De nouveaux fournisseursAlors que 9% des entrepreneurs ont dit avoir conservé une croissance stable de leurs recettes, 30,4% ont enregistré une baisse.', 'Ils ont toutefois souligné que la situation était ""sous contrôle"".', ""L'enquête a révélé que seuls 6% avaient fermé leur entreprise ou envisageaient de le faire.En outre, la majorité des personnes interrogées ont indiqué qu'elles avaient réussi à trouver de nouveaux fournisseurs pour les mêmes produits ou des produits similaires, que ce soit en Russie ou à l'étranger.""]]]","[[['total', 'homme', 'affaire', 'russe', 'sanction', 'occidental', 'moscou', 'début', 'opération', 'militaire', 'ukraine', 'enquête', 'bureau', 'commissaire', 'protection', 'droit', 'entrepreneur', 'président', 'chef', 'entreprise', 'région', 'pays', 'part'], ['personne', 'face', 'conséquence', 'restriction', 'nouveau', 'fournisseursalor', 'entrepreneur', 'croissance', 'stable', 'recette', 'baisse'], ['situation', 'contrôle'], ['enquête', 'entreprise', 'majorité', 'personne', 'nouveau', 'fournisseur', 'produit', 'produit', 'similaire', 'russie', 'étranger']]]","[[['Moscou', 'Ukraine'], [], [], ['Russie']]]","[[['Protection des droits des entrepreneurs'], [], [], []]]","[[['Président'], [], [], []]]","{'total': 1, 'homme': 1, 'affaire': 1, 'russe': 1, 'sanction': 1, 'occidental': 1, 'moscou': 1, 'début': 1, 'opération': 1, 'militaire': 1, 'ukraine': 1, 'enquête': 2, 'bureau': 1, 'commissaire': 1, 'protection': 1, 'droit': 1, 'entrepreneur': 2, 'président': 1, 'chef': 1, 'entreprise': 2, 'région': 1, 'pays': 1, 'part': 1, 'personne': 2, 'face': 1, 'conséquence': 1, 'restriction': 1, 'nouveau': 2, 'fournisseursalor': 1, 'croissance': 1, 'stable': 1, 'recette': 1, 'baisse': 1, 'situation': 1, 'contrôle': 1, 'majorité': 1, 'fournisseur': 1, 'produit': 2, 'similaire': 1, 'russie': 1, 'étranger': 1}","{'Moscou': 1, 'Ukraine': 1, 'Russie': 1}",{'Protection des droits des entrepreneurs': 1},{'Président': 1},2022,11,13
1668380400,https://fr.sputniknews.africa/20221114/lafrique-sabstient-massivement-lors-du-vote-a-lonu-sur-les-reparations-russes-a-lukraine-1056822343.html,L'Afrique s'abstient massivement lors du vote à l'Onu sur les réparations russes à l'Ukraine,Une trentaine de pays africains ont refusé de soutenir le projet de résolution de l'Assemblée générale de l'Onu portant sur les réparations à payer par la Russie à l'Ukraine. Le document a néanmoins fini par été adopté.,"L'Assemblée générale des Nations unies a adopté ce lundi 14 novembre un projet de résolution qui porte sur la mise en place d'un mécanisme de versement de réparations à l'Ukraine par la partie russe.Moscou, qui a voté contre le document, a qualifié son adoption de ""tentative de légaliser ce qui est illégal du point de vue du droit international"". Selon son représentant permanent auprès de l'Onu Vassili Nebenzia, le document vise à autoriser l'accès ""aux fonds souverains russes évalués à des centaines de milliards de dollars"" qui ont été ""volés"" à Moscou.Au total, 94 pays ont soutenu la résolution, 14 ont voté contre et 73 autres se sont abstenus.Ce sont bien les pays africains qui se sont montrés les moins enthousiastes lors du vote: la RCA, l'Érythrée, l'Éthiopie, le Mali et le Zimbabwe ont rejeté le document, tandis que 27 autres, notamment l'Algérie, le Burundi, l'Égypte, le Nigeria, les deux Soudans ou l'Afrique du Sud, ont préféré de s'abstenir.En réaction au vote, le vice-président du Conseil de sécurité de Russie Dmitri Medvedev a invité l'Assemblée générale ""à adopter une recommandation similaire sur les réparations américaines pour la Corée, au Vietnam, à l'Irak ou à la Yougoslavie"".","[[['L\'Assemblée générale des Nations unies a adopté ce lundi 14 novembre un projet de résolution qui porte sur la mise en place d\'un mécanisme de versement de réparations à l\'Ukraine par la partie russe.Moscou, qui a voté contre le document, a qualifié son adoption de ""tentative de légaliser ce qui est illégal du point de vue du droit international"".', 'Selon son représentant permanent auprès de l\'Onu Vassili Nebenzia, le document vise à autoriser l\'accès ""aux fonds souverains russes évalués à des centaines de milliards de dollars"" qui ont été ""volés"" à Moscou.Au total, 94 pays ont soutenu la résolution, 14 ont voté contre et 73 autres se sont abstenus.Ce sont bien les pays africains qui se sont montrés les moins enthousiastes lors du vote: la RCA, l\'Érythrée, l\'Éthiopie, le Mali et le Zimbabwe ont rejeté le document, tandis que 27 autres, notamment l\'Algérie, le Burundi, l\'Égypte, le Nigeria, les deux Soudans ou l\'Afrique du Sud, ont préféré de s\'abstenir.En réaction au vote, le vice-président du Conseil de sécurité de Russie Dmitri Medvedev a invité l\'Assemblée générale ""à adopter une recommandation similaire sur les réparations américaines pour la Corée, au Vietnam, à l\'Irak ou à la Yougoslavie"".']]]","[[['assemblée', 'général', 'nation', 'lundi', 'novembre', 'projet', 'résolution', 'mise', 'place', 'mécanisme', 'versement', 'réparation', 'ukraine', 'partie', 'document', 'adoption', 'tentative', 'illégal', 'point', 'vue', 'droit', 'international'], ['représentant', 'permanent', 'onu', 'vassili', 'nebenzia', 'document', 'accès', 'fonds', 'souverain', 'russe', 'centaine', 'milliard', 'dollar', 'volé', 'total', 'pays', 'résolution', 'pays', 'africain', 'enthousiaste', 'vote', 'rca', 'érythrée', 'éthiopie', 'mali', 'zimbabwe', 'document', 'algérie', 'burundi', 'égypte', 'nigeria', 'soudan', 'afrique', 'sud', 'réaction', 'vote', 'conseil', 'sécurité', 'russie', 'assemblée', 'général', 'recommandation', 'similaire', 'réparation', 'américain', 'corée', 'vietnam', 'irak', 'yougoslavie']]]","[[['Ukraine', 'Moscou'], ['Moscou', 'Érythrée', 'Éthiopie', 'Mali', 'Zimbabwe', 'Algérie', 'Burundi', 'Égypte', 'Nigeria', 'Soudans', 'Afrique du Sud', 'Russie', 'Corée', 'Vietnam', 'Irak']]]","[[['Assemblée générale des Nations unies'], ['Onu', 'RCA', 'Conseil de sécurité de', 'Assemblée générale', 'Yougoslavie']]]","[[[], ['Vassili Nebenzia', 'Dmitri Medvedev']]]","{'assemblée': 2, 'général': 2, 'nation': 1, 'lundi': 1, 'novembre': 1, 'projet': 1, 'résolution': 2, 'mise': 1, 'place': 1, 'mécanisme': 1, 'versement': 1, 'réparation': 2, 'ukraine': 1, 'partie': 1, 'document': 3, 'adoption': 1, 'tentative': 1, 'illégal': 1, 'point': 1, 'vue': 1, 'droit': 1, 'international': 1, 'représentant': 1, 'permanent': 1, 'onu': 1, 'vassili': 1, 'nebenzia': 1, 'accès': 1, 'fonds': 1, 'souverain': 1, 'russe': 1, 'centaine': 1, 'milliard': 1, 'dollar': 1, 'volé': 1, 'total': 1, 'pays': 2, 'africain': 1, 'enthousiaste': 1, 'vote': 2, 'rca': 1, 'érythrée': 1, 'éthiopie': 1, 'mali': 1, 'zimbabwe': 1, 'algérie': 1, 'burundi': 1, 'égypte': 1, 'nigeria': 1, 'soudan': 1, 'afrique': 1, 'sud': 1, 'réaction': 1, 'conseil': 1, 'sécurité': 1, 'russie': 1, 'recommandation': 1, 'similaire': 1, 'américain': 1, 'corée': 1, 'vietnam': 1, 'irak': 1, 'yougoslavie': 1}","{'Ukraine': 1, 'Moscou': 2, 'Érythrée': 1, 'Éthiopie': 1, 'Mali': 1, 'Zimbabwe': 1, 'Algérie': 1, 'Burundi': 1, 'Égypte': 1, 'Nigeria': 1, 'Soudans': 1, 'Afrique du Sud': 1, 'Russie': 1, 'Corée': 1, 'Vietnam': 1, 'Irak': 1}","{'Assemblée générale des Nations unies': 1, 'Onu': 1, 'RCA': 1, 'Conseil de sécurité de': 1, 'Assemblée générale': 1, 'Yougoslavie': 1}","{'Vassili Nebenzia': 1, 'Dmitri Medvedev': 1}",2022,11,13
1668380400,https://fr.sputniknews.africa/20221114/la-police-ivoirienne-fait-la-chasse-aux-vehicules-affubles-de-plaques-fantaisistes-1056822183.html,La police ivoirienne fait la chasse aux véhicules affublés de plaques fantaisistes,"En Côte d'Ivoire, une vaste opération de contrôle des véhicules a démarré le 14 novembre. Elle se focalise sur les plaques d'immatriculation fantaisistes, les contrôles techniques, les assurances ou encore les vignettes et les vitres...","La Direction générale de la police nationale (DGPN) de Côte d'Ivoire a annoncé dans un communiqué avoir entamé ce lundi des contrôles des moyens de transport d’envergure.L’opération cible les plaques d’immatriculations fantaisistes, les contrôles techniques, les assurances, les vignettes et les vitres teintées. Selon de nombreux témoins, les voies de circulation étaient fluides à l'annonce de cette mesure. 0 embouteillage ce matin à Jules verne après l’annonce de la police d’une opération de contrôle des pièces des véhicules…. pic.twitter.com/eLWLskNJhq— La Côte d’Ivoire Est Chic: Infos🇨🇮 (@Cotedivoireoff_) November 14, 2022 Lutte contre les véhicules volésAvant les contrôles, la police ivoirienne avait incité les conducteurs à respecter les règles et à enlever les plaques d'immatriculation fantaisistes. Celles-ci entravent la lutte des policiers contre les véhicules déclarés volés. Côte d'Ivoire : La police se lance à nouveau en guerre les plaques d'immatriculation fantaisistes https://t.co/JC5btv5WnQ pic.twitter.com/9M3m4PicfD— koaci.com (@Koaci) November 14, 2022 En juillet 2021, la DGPN avait déjà mené une opération similaire.","[[[""La Direction générale de la police nationale (DGPN) de Côte d'Ivoire a annoncé dans un communiqué avoir entamé ce lundi des contrôles des moyens de transport d’envergure.L’opération cible les plaques d’immatriculations fantaisistes, les contrôles techniques, les assurances, les vignettes et les vitres teintées."", ""Selon de nombreux témoins, les voies de circulation étaient fluides à l'annonce de cette mesure."", '0 embouteillage ce matin à Jules verne après l’annonce de la police d’une opération de contrôle des pièces des véhicules….', ""pic.twitter.com/eLWLskNJhq— La Côte d’Ivoire Est Chic: Infos🇨🇮 (@Cotedivoireoff_) November 14, 2022 Lutte contre les véhicules volésAvant les contrôles, la police ivoirienne avait incité les conducteurs à respecter les règles et à enlever les plaques d'immatriculation fantaisistes."", 'Celles-ci entravent la lutte des policiers contre les véhicules déclarés volés.', ""Côte d'Ivoire : La police se lance à nouveau en guerre les plaques d'immatriculation fantaisistes https://t.co/JC5btv5WnQ pic.twitter.com/9M3m4PicfD— koaci.com (@Koaci) November 14, 2022 En juillet 2021, la DGPN avait déjà mené une opération similaire.""]]]","[[['direction', 'général', 'police', 'national', 'côte', 'ivoire', 'communiqué', 'lundi', 'contrôle', 'moyen', 'transport', 'opération', 'cible', 'plaque', 'immatriculation', 'fantaisiste', 'contrôle', 'technique', 'assurance', 'vignette', 'vitre', 'teinter'], ['témoin', 'voie', 'circulation', 'fluide', 'annonce', 'mesure'], ['embouteillage', 'matin', 'jules', 'verne', 'annonce', 'police', 'opération', 'contrôle', 'pièce', 'véhicule'], ['côte', 'ivoire', 'chic', 'info', 'november', 'lutte', 'véhicule', 'contrôle', 'police', 'ivoirien', 'conducteur', 'règle', 'plaque', 'immatriculation', 'fantaisiste'], ['lutte', 'policier', 'véhicule', 'voler'], ['côte', 'ivoire', 'police', 'guerre', 'plaque', 'immatriculation', 'fantaisiste', 'november', 'juillet', 'dgpn', 'opération', 'similaire']]]","[[[""Côte d'Ivoire""], [], [], ['Côte d’Ivoire'], [], [""Côte d'Ivoire""]]]","[[['Direction générale de la police nationale', 'DGPN'], [], [], ['Infos🇨🇮', 'Lutte'], [], ['DGPN']]]","[[[], [], ['Jules verne'], [], [], []]]","{'direction': 1, 'général': 1, 'police': 4, 'national': 1, 'côte': 3, 'ivoire': 3, 'communiqué': 1, 'lundi': 1, 'contrôle': 4, 'moyen': 1, 'transport': 1, 'opération': 3, 'cible': 1, 'plaque': 3, 'immatriculation': 3, 'fantaisiste': 3, 'technique': 1, 'assurance': 1, 'vignette': 1, 'vitre': 1, 'teinter': 1, 'témoin': 1, 'voie': 1, 'circulation': 1, 'fluide': 1, 'annonce': 2, 'mesure': 1, 'embouteillage': 1, 'matin': 1, 'jules': 1, 'verne': 1, 'pièce': 1, 'véhicule': 3, 'chic': 1, 'info': 1, 'november': 2, 'lutte': 2, 'ivoirien': 1, 'conducteur': 1, 'règle': 1, 'policier': 1, 'voler': 1, 'guerre': 1, 'juillet': 1, 'dgpn': 1, 'similaire': 1}","{""Côte d'Ivoire"": 2, 'Côte d’Ivoire': 1}","{'Direction générale de la police nationale': 1, 'DGPN': 2, 'Infos🇨🇮': 1, 'Lutte': 1}",{'Jules verne': 1},2022,11,13
1668380400,https://fr.sputniknews.africa/20221114/lex-patron-syndical-proche-de-bouteflika-condamne-a-10-ans-de-prison-en-algerie-1056822001.html,L'ex-patron syndical proche de Bouteflika condamné à 10 ans de prison en Algérie,"L'ancien dirigeant de l'Union générale des travailleurs algériens (UGTA), Abdelmadjid Sidi Said, défenseur enthousiaste du défunt ex-président Abdelaziz Bouteflika, a été condamné lundi à dix ans de prison pour corruption, selon son...","A la tête depuis 1997 de l'ancien syndicat, unique et seule organisation syndicale considérée comme représentative par les autorités, M.Sidi Said avait quitté ses fonctions en juin 2019 en plein Hirak, le mouvement de contestation antirégime, qui a contraint M.Bouteflika à la démission en avril 2019.Abdelmadjid Sidi Said, 76 ans, était contesté par les travailleurs car il a longtemps été l'un des défenseurs les plus enthousiastes d'Abdelaziz Bouteflika, décédé en septembre 2021.Poursuivi pour des affaires de corruption avec ses trois fils après la mort de Bouteflika, il a été placé en détention provisoire en mai avant d'être condamné lundi à l'issue de son procès à dix ans de prison ferme, a indiqué à l'AFP son avocat Miloud Brahimi.Ses deux fils également condamnésSes fils Djamil et Hanafi ont écopé de trois et cinq ans de prison ferme respectivement alors qu'un troisième, Ramine, en fuite à l'étranger, s'est vu infliger une peine de 12 ans de prison ferme, selon la même source.Ils étaient poursuivis pour plusieurs chefs d'inculpation, dont incitation d'agents publics à des abus de fonction pour bénéficier d'avantages indus, et blanchiment d'argent.L'avocat a indiqué qu'il ferait appel de ces verdicts.Après la démission de M.Bouteflika, la justice algérienne a condamné, notamment pour des faits de corruption, des dizaines de responsables politiques et puissants hommes d'affaires réputés proches de l'ex-chef d'Etat.","[[[""A la tête depuis 1997 de l'ancien syndicat, unique et seule organisation syndicale considérée comme représentative par les autorités, M.Sidi Said avait quitté ses fonctions en juin 2019 en plein Hirak, le mouvement de contestation antirégime, qui a contraint M.Bouteflika à la démission en avril 2019.Abdelmadjid Sidi Said, 76 ans, était contesté par les travailleurs car il a longtemps été l'un des défenseurs les plus enthousiastes d'Abdelaziz Bouteflika, décédé en septembre 2021.Poursuivi pour des affaires de corruption avec ses trois fils après la mort de Bouteflika, il a été placé en détention provisoire en mai avant d'être condamné lundi à l'issue de son procès à dix ans de prison ferme, a indiqué à l'AFP son avocat Miloud Brahimi.Ses deux fils également condamnésSes fils Djamil et Hanafi ont écopé de trois et cinq ans de prison ferme respectivement alors qu'un troisième, Ramine, en fuite à l'étranger, s'est vu infliger une peine de 12 ans de prison ferme, selon la même source.Ils étaient poursuivis pour plusieurs chefs d'inculpation, dont incitation d'agents publics à des abus de fonction pour bénéficier d'avantages indus, et blanchiment d'argent.L'avocat a indiqué qu'il ferait appel de ces verdicts.Après la démission de M.Bouteflika, la justice algérienne a condamné, notamment pour des faits de corruption, des dizaines de responsables politiques et puissants hommes d'affaires réputés proches de l'ex-chef d'Etat.""]]]","[[['tête', 'ancien', 'syndicat', 'unique', 'organisation', 'syndical', 'représentative', 'autorité', 'fonction', 'juin', 'plein', 'hirak', 'mouvement', 'contestation', 'antirégim', 'démission', 'avril', 'sidi', 'an', 'travailleur', 'défenseur', 'enthousiaste', 'abdelaziz', 'bouteflika', 'septembre', 'affaire', 'corruption', 'fils', 'mort', 'bouteflika', 'détention', 'provisoire', 'mai', 'lundi', 'issue', 'procès', 'an', 'prison', 'ferme', 'afp', 'avocat', 'miloud', 'fils', 'condamnésse', 'fils', 'djamil', 'hanafi', 'an', 'prison', 'ferme', 'ramine', 'fuite', 'étranger', 'peine', 'an', 'prison', 'ferme', 'chef', 'inculpation', 'incitation', 'agent', 'public', 'abus', 'fonction', 'avantage', 'indu', 'blanchiment', 'avocat', 'appel', 'démission', 'justice', 'algérien', 'fait', 'corruption', 'dizaine', 'responsable', 'politique', 'puissant', 'homme', 'affaire', 'proche', 'etat']]]",[[['Etat']]],"[[['AFP', 'M.Bouteflika']]]","[[['M.Sidi Said', 'Hirak', 'Abdelaziz Bouteflika', 'Bouteflika', 'Miloud Brahimi', 'Djamil', 'Hanafi', 'Ramine']]]","{'tête': 1, 'ancien': 1, 'syndicat': 1, 'unique': 1, 'organisation': 1, 'syndical': 1, 'représentative': 1, 'autorité': 1, 'fonction': 2, 'juin': 1, 'plein': 1, 'hirak': 1, 'mouvement': 1, 'contestation': 1, 'antirégim': 1, 'démission': 2, 'avril': 1, 'sidi': 1, 'an': 4, 'travailleur': 1, 'défenseur': 1, 'enthousiaste': 1, 'abdelaziz': 1, 'bouteflika': 2, 'septembre': 1, 'affaire': 2, 'corruption': 2, 'fils': 3, 'mort': 1, 'détention': 1, 'provisoire': 1, 'mai': 1, 'lundi': 1, 'issue': 1, 'procès': 1, 'prison': 3, 'ferme': 3, 'afp': 1, 'avocat': 2, 'miloud': 1, 'condamnésse': 1, 'djamil': 1, 'hanafi': 1, 'ramine': 1, 'fuite': 1, 'étranger': 1, 'peine': 1, 'chef': 1, 'inculpation': 1, 'incitation': 1, 'agent': 1, 'public': 1, 'abus': 1, 'avantage': 1, 'indu': 1, 'blanchiment': 1, 'appel': 1, 'justice': 1, 'algérien': 1, 'fait': 1, 'dizaine': 1, 'responsable': 1, 'politique': 1, 'puissant': 1, 'homme': 1, 'proche': 1, 'etat': 1}",{'Etat': 1},"{'AFP': 1, 'M.Bouteflika': 1}","{'M.Sidi Said': 1, 'Hirak': 1, 'Abdelaziz Bouteflika': 1, 'Bouteflika': 1, 'Miloud Brahimi': 1, 'Djamil': 1, 'Hanafi': 1, 'Ramine': 1}",2022,11,13
