timestamp,url,title,description,content,content-segmented,kws-l,loc-l,org-l,per-l,kws,loc,org,per,year,month,day
1658354400,https://fr.sputniknews.africa/20220721/le-president-bielorusse-affirme-que-deux-canons-caesar-francais-ont-ete-vendus-a-la-russie-1055612120.html,Le Président biélorusse affirme que deux canons Caesar français ont été vendus à la Russie,Le Président biélorusse Alexandre Loukachenko a déclaré à l'AFP que deux des canons Caesar français livrés à l'Ukraine avaient été vendus à Moscou.,"Deux des 12 canons Caesar que la France a livré à Kiev ont été vendus à la Russie, a déclaré le Président biélorusse Alexandre Loukachenko à l'AFP.""Vous savez, non, que deux systèmes Caesar ont été vendus par les autorités ukrainiennes à la Russie? En Russie, ils ont déjà été démontés dans une usine de chars, et on y regarde ce qui peut être utilisé. C'est un fait"", a indiqué M.Loukachenko.Entretemps, six autres systèmes Caesar sont en route pour l'Ukraine. Le Président biélorusse a estimé qu'ils seront détruits dès leur arrivée dans le pays.""La Russie sait comment vous livrez vos Caesar là-bas, et dès qu'ils arriveront, ils seront couverts par les armes de haute précision (russes). Réfléchissez si ça vaut le coup"", a ajouté le chef d'État dans le Palais de l'Indépendance de Minsk.","[[[""Deux des 12 canons Caesar que la France a livré à Kiev ont été vendus à la Russie, a déclaré le Président biélorusse Alexandre Loukachenko à l'AFP.""], ['""Vous savez, non, que deux systèmes Caesar ont été vendus par les autorités ukrainiennes à la Russie?'], ['En Russie, ils ont déjà été démontés dans une usine de chars, et on y regarde ce qui peut être utilisé.'], ['C\'est un fait"", a indiqué M.Loukachenko.Entretemps, six autres systèmes Caesar sont en route pour l\'Ukraine.'], [""Le Président biélorusse a estimé qu'ils seront détruits dès leur arrivée dans le pays.""], ['""La Russie sait comment vous livrez vos Caesar là-bas, et dès qu\'ils arriveront, ils seront couverts par les armes de haute précision (russes).'], ['Réfléchissez si ça vaut le coup"", a ajouté le chef d\'État dans le Palais de l\'Indépendance de Minsk.']]]","[[['canons', 'france', 'kiev', 'russie', 'président', 'biélorusse', 'alexandre', 'loukachenko', 'afp'], ['systèmes', 'autorités', 'ukrainiennes', 'russie'], ['russie', 'usine', 'chars'], ['systèmes', 'caesar', 'route', 'ukraine'], ['président', 'biélorusse', 'arrivée', 'pays'], ['russie', 'armes', 'haute', 'précision', 'russes'], ['réfléchissez', 'coup', 'chef', 'état', 'palais', 'indépendance']]]","[[['France', 'Kiev', 'Russie'], ['Russie'], ['Russie'], ['Ukraine'], [], ['Russie'], ['État', ""Palais de l'Indépendance de Minsk""]]]","[[['AFP'], [], [], [], [], [], []]]","[[['Caesar', 'Président', 'Alexandre Loukachenko'], ['Caesar'], [], ['Caesar'], ['Président biélorusse'], ['Caesar'], []]]","{'canons': 1, 'france': 1, 'kiev': 1, 'russie': 4, 'président': 2, 'biélorusse': 2, 'alexandre': 1, 'loukachenko': 1, 'afp': 1, 'systèmes': 2, 'autorités': 1, 'ukrainiennes': 1, 'usine': 1, 'chars': 1, 'caesar': 1, 'route': 1, 'ukraine': 1, 'arrivée': 1, 'pays': 1, 'armes': 1, 'haute': 1, 'précision': 1, 'russes': 1, 'réfléchissez': 1, 'coup': 1, 'chef': 1, 'état': 1, 'palais': 1, 'indépendance': 1}","{'France': 1, 'Kiev': 1, 'Russie': 4, 'Ukraine': 1, 'État': 1, ""Palais de l'Indépendance de Minsk"": 1}",{'AFP': 1},"{'Caesar': 4, 'Président': 1, 'Alexandre Loukachenko': 1, 'Président biélorusse': 1}",2022,7,20
1658354400,https://fr.sputniknews.africa/20220721/esclavage-moderne-des-tchadiennes-exploitees-a-oman-1055610255.html,Esclavage moderne: des Tchadiennes exploitées à Oman,La police nationale tchadienne a rendu publics des témoignages selon lesquels de jeunes femmes du pays seraient séquestrées à Oman et contraintes à du travail forcé et épuisant en tant que domestiques.,"Sur l’une des vidéos relayées le 19 juillet par la police tchadienne sur Facebook*, un homme raconte le schéma d’arnaque que subissent certaines Tchadiennes. Des intermédiaires leur promettent du travail dans une société, alors qu’en réalité elles sont emmenées à Oman pour y être forcées de travailler de manière clandestine comme domestiques s’occupant du bétail, des volailles, des personnes âgées.Les victimes ne peuvent pas retourner au Tchad, car leurs passeports leur sont retirés. Elles sont conduites dans des maisons et forcées à travailler jusqu'à 23 heures.""On travaille de 4 heures jusqu'à 13 heures. On déjeune, on se repose puis on travaille jusqu'à une heure du matin [...]. On souffre, en plus nous n'avons pas d'ambassade à Oman"", raconte une victime dans un autre enregistrement audio, également rendu public par la police du Tchad.Selon elle, le prix de ""vente"" des jeunes femmes, pratiqué par des intermédiaires à N'Djamena, va de 10 à 15 millions de francs CFA (de 15.500 à 23.300 dollars américains).Comment contrer ce flux migratoireD’après des témoignages, environ 400 Tchadiennes pourraient se trouver dans cette situation à Oman. Ce phénomène d’esclavagisme existe depuis 2017, a expliqué le 21 juillet à TchadInfos Idriss Dokony Adiker, ministre de la Sécurité publique et de l'Immigration.Le 19 juillet, le ministre a publié une note de service où il a averti les ""compagnies aériennes et autres agences que le transport des jeunes filles est strictement interdit"". Idriss Dokony Adiker a expliqué, toujours à TchadInfos, que les filles de moins de 18 ans, apparemment censées être les victimes principales de ce trafic, doivent avoir une autorisation parentale avant de voyager.* Meta (Facebook et Instagram) est interdite en Russie pour activités extrémistes.","[[['Sur l’une des vidéos relayées le 19 juillet par la police tchadienne sur Facebook*, un homme raconte le schéma d’arnaque que subissent certaines Tchadiennes.'], ['Des intermédiaires leur promettent du travail dans une société, alors qu’en réalité elles sont emmenées à Oman pour y être forcées de travailler de manière clandestine comme domestiques s’occupant du bétail, des volailles, des personnes âgées.Les victimes ne peuvent pas retourner au Tchad, car leurs passeports leur sont retirés.'], [""Elles sont conduites dans des maisons et forcées à travailler jusqu'à 23 heures.""], ['""On travaille de 4 heures jusqu\'à 13 heures.'], [""On déjeune, on se repose puis on travaille jusqu'à une heure du matin [...].""], ['On souffre, en plus nous n\'avons pas d\'ambassade à Oman"", raconte une victime dans un autre enregistrement audio, également rendu public par la police du Tchad.Selon elle, le prix de ""vente"" des jeunes femmes, pratiqué par des intermédiaires à N\'Djamena, va de 10 à 15 millions de francs CFA (de 15.500 à 23.300 dollars américains).Comment contrer ce flux migratoireD’après des témoignages, environ 400 Tchadiennes pourraient se trouver dans cette situation à Oman.'], ['Ce phénomène d’esclavagisme existe depuis 2017, a expliqué le 21 juillet à TchadInfos Idriss Dokony Adiker, ministre de la Sécurité publique et de l\'Immigration.Le 19 juillet, le ministre a publié une note de service où il a averti les ""compagnies aériennes et autres agences que le transport des jeunes filles est strictement interdit"".'], ['Idriss Dokony Adiker a expliqué, toujours à TchadInfos, que les filles de moins de 18 ans, apparemment censées être les victimes principales de ce trafic, doivent avoir une autorisation parentale avant de voyager.'], ['* Meta (Facebook et Instagram) est interdite en Russie pour activités extrémistes.']]]","[[['vidéos', 'juillet', 'police', 'tchadienne', 'facebook', 'homme', 'schéma', 'arnaque', 'tchadiennes'], ['intermédiaires', 'travail', 'société', 'réalité', 'oman', 'manière', 'clandestine', 'domestiques', 'bétail', 'volailles', 'personnes', 'victimes', 'tchad', 'passeports'], ['maisons', 'heures'], ['heures', 'heures'], ['déjeune', 'heure', 'matin'], ['ambassade', 'oman', 'victime', 'enregistrement', 'audio', 'public', 'police', 'prix', 'vente', 'jeunes', 'femmes', 'intermédiaires', 'millions', 'francs', 'dollars', 'flux', 'témoignages', 'tchadiennes', 'situation', 'oman'], ['phénomène', 'esclavagisme', 'juillet', 'tchadinfos', 'idriss', 'adiker', 'ministre', 'sécurité', 'publique', 'juillet', 'ministre', 'note', 'service', 'compagnies', 'aériennes', 'agences', 'transport', 'jeunes', 'filles'], ['idriss', 'adiker', 'filles', 'ans', 'censées', 'victimes', 'principales', 'trafic', 'autorisation', 'parentale'], ['meta', 'facebook', 'instagram', 'russie', 'activités', 'extrémistes']]]","[[[], ['Oman', 'Tchad'], [], [], [], ['Oman', 'Tchad', ""N'Djamena"", 'Tchad', 'Oman'], [], [], ['Russie']]]","[[[], [], [], [], [], [], ['ministre de la Sécurité publique', 'Immigration'], [], ['Meta', 'Instagram']]]","[[[], [], [], [], [], [], ['TchadInfos Idriss Dokony'], ['Idriss'], []]]","{'vidéos': 1, 'juillet': 3, 'police': 2, 'tchadienne': 1, 'facebook': 2, 'homme': 1, 'schéma': 1, 'arnaque': 1, 'tchadiennes': 2, 'intermédiaires': 2, 'travail': 1, 'société': 1, 'réalité': 1, 'oman': 3, 'manière': 1, 'clandestine': 1, 'domestiques': 1, 'bétail': 1, 'volailles': 1, 'personnes': 1, 'victimes': 2, 'tchad': 1, 'passeports': 1, 'maisons': 1, 'heures': 3, 'déjeune': 1, 'heure': 1, 'matin': 1, 'ambassade': 1, 'victime': 1, 'enregistrement': 1, 'audio': 1, 'public': 1, 'prix': 1, 'vente': 1, 'jeunes': 2, 'femmes': 1, 'millions': 1, 'francs': 1, 'dollars': 1, 'flux': 1, 'témoignages': 1, 'situation': 1, 'phénomène': 1, 'esclavagisme': 1, 'tchadinfos': 1, 'idriss': 2, 'adiker': 2, 'ministre': 2, 'sécurité': 1, 'publique': 1, 'note': 1, 'service': 1, 'compagnies': 1, 'aériennes': 1, 'agences': 1, 'transport': 1, 'filles': 2, 'ans': 1, 'censées': 1, 'principales': 1, 'trafic': 1, 'autorisation': 1, 'parentale': 1, 'meta': 1, 'instagram': 1, 'russie': 1, 'activités': 1, 'extrémistes': 1}","{'Oman': 3, 'Tchad': 3, ""N'Djamena"": 1, 'Russie': 1}","{'ministre de la Sécurité publique': 1, 'Immigration': 1, 'Meta': 1, 'Instagram': 1}","{'TchadInfos Idriss Dokony': 1, 'Idriss': 1}",2022,7,20
1658354400,https://fr.sputniknews.africa/20220721/lavrov-nous-retablissons-nos-positions-les-africains-rendent-la-pareille-1055606670.html,"Lavrov: ""Nous rétablissons nos positions, les Africains rendent la pareille""","Dans un entretien accordé le 20 juillet à la rédactrice en chef de Rossiya Segodnya, Margarita Simonian, Sergueï Lavrov a évoqué les ""bonnes relations"" que la Russie entretient depuis longtemps avec le continent africain et les liens entre...","""Depuis de nombreuses années, nous rétablissons nos positions. Les Africains rendent la pareille. Ils sont intéressés à ce que nous venions chez eux"", a-t-il souligné.Le ministre russe des Affaires étrangères a également déclaré qu'il prévoyait de se rendre en Égypte, en Éthiopie, en Ouganda et en République du Congo cette année.","[[['""Depuis de nombreuses années, nous rétablissons nos positions.'], ['Les Africains rendent la pareille.'], ['Ils sont intéressés à ce que nous venions chez eux"", a-t-il souligné.Le ministre russe des Affaires étrangères a également déclaré qu\'il prévoyait de se rendre en Égypte, en Éthiopie, en Ouganda et en République du Congo cette année.']]]","[[['années', 'positions'], ['africains', 'pareille'], ['ministre', 'russe', 'affaires', 'étrangères', 'égypte', 'éthiopie', 'ouganda', 'république', 'congo', 'année']]]","[[[], ['Africains'], ['Égypte', 'Éthiopie', 'Ouganda', 'République du Congo']]]","[[[], [], ['ministre russe des Affaires étrangères']]]","[[[], [], []]]","{'années': 1, 'positions': 1, 'africains': 1, 'pareille': 1, 'ministre': 1, 'russe': 1, 'affaires': 1, 'étrangères': 1, 'égypte': 1, 'éthiopie': 1, 'ouganda': 1, 'république': 1, 'congo': 1, 'année': 1}","{'Africains': 1, 'Égypte': 1, 'Éthiopie': 1, 'Ouganda': 1, 'République du Congo': 1}",{'ministre russe des Affaires étrangères': 1},{},2022,7,20
1658354400,https://fr.sputniknews.africa/20220721/la-hongrie-veut-plus-de-gaz-russe-la-russie-est-prete-a-examiner-la-demande-1055610630.html,"La Hongrie veut plus de gaz russe, la Russie est prête à examiner la demande","Alors que Bruxelles vient de présenter un plan visant à diminuer de 15% la demande européenne de gaz pour surmonter la chute des livraisons russes, la Hongrie veut acheter des volumes supplémentaires de ce combustible à la Russie.","La Russie est prête à étudier la demande de la Hongrie d’acheter des volumes supplémentaires de son gaz. Cette demande sera immédiatement examinée, a déclaré le ministre russe des Affaires étrangères Sergueï Lavrov.""Aujourd'hui, nos collègues ont manifesté l'intérêt du gouvernement hongrois d'acheter des quantités supplémentaires de gaz cette année. Cette demande sera immédiatement transmise et examinée"", a déclaré ce 21 juillet le chef de la diplomatie russe à la suite d’une rencontre avec son homologue hongrois Peter Szijjarto à Moscou.La Russie veut développer sa relation ""stratégique"" avec la Hongrie malgré les sanctions, a ajouté le ministre russe.La Hongrie discuterait d'achats supplémentaires pour 700 millions de mètres cubes de gaz pour son pays, a précédemment fait savoir le ministère hongrois des Affaires étrangères.En septembre 2021, la société hongroise MVM a signé deux contrats à long terme avec Gazprom, qui prévoient la fourniture d'un total de 4,5 milliards de mètres cubes de carburant par an via des pipelines à travers la Serbie et l'Autriche, en contournant l'Ukraine.La Hongrie importe 65% de son pétrole de Russie et 80% de son gaz. Dans le contexte de la crise énergétique et géopolitique actuelle, un ""état d'urgence"" a été décrété la semaine dernière.","[[['La Russie est prête à étudier la demande de la Hongrie d’acheter des volumes supplémentaires de son gaz.'], ['Cette demande sera immédiatement examinée, a déclaré le ministre russe des Affaires étrangères Sergueï Lavrov.'], ['""Aujourd\'hui, nos collègues ont manifesté l\'intérêt du gouvernement hongrois d\'acheter des quantités supplémentaires de gaz cette année.'], ['Cette demande sera immédiatement transmise et examinée"", a déclaré ce 21 juillet le chef de la diplomatie russe à la suite d’une rencontre avec son homologue hongrois Peter Szijjarto à Moscou.La Russie veut développer sa relation ""stratégique"" avec la Hongrie malgré les sanctions, a ajouté le ministre russe.La Hongrie discuterait d\'achats supplémentaires pour 700 millions de mètres cubes de gaz pour son pays, a précédemment fait savoir le ministère hongrois des Affaires étrangères.En septembre 2021, la société hongroise MVM a signé deux contrats à long terme avec Gazprom, qui prévoient la fourniture d\'un total de 4,5 milliards de mètres cubes de carburant par an via des pipelines à travers la Serbie et l\'Autriche, en contournant l\'Ukraine.La Hongrie importe 65% de son pétrole de Russie et 80% de son gaz.'], ['Dans le contexte de la crise énergétique et géopolitique actuelle, un ""état d\'urgence"" a été décrété la semaine dernière.']]]","[[['russie', 'prête', 'demande', 'hongrie', 'volumes', 'supplémentaires', 'gaz'], ['demande', 'ministre', 'russe', 'affaires', 'étrangères', 'sergueï', 'lavrov'], ['collègues', 'intérêt', 'gouvernement', 'hongrois', 'quantités', 'supplémentaires', 'gaz', 'année'], ['demande', 'juillet', 'chef', 'diplomatie', 'russe', 'suite', 'rencontre', 'homologue', 'hongrois', 'relation', 'stratégique', 'hongrie', 'sanctions', 'ministre', 'hongrie', 'achats', 'supplémentaires', 'millions', 'mètres', 'cubes', 'gaz', 'pays', 'ministère', 'hongrois', 'affaires', 'septembre', 'société', 'hongroise', 'mvm', 'contrats', 'long', 'terme', 'gazprom', 'fourniture', 'total', 'milliards', 'mètres', 'cubes', 'carburant', 'an', 'pipelines', 'travers', 'serbie', 'autriche', 'hongrie', 'pétrole', 'russie', 'gaz'], ['contexte', 'crise', 'énergétique', 'géopolitique', 'actuelle', 'état', 'urgence', 'semaine', 'dernière']]]","[[['Russie', 'Hongrie'], [], [], ['Moscou', 'Russie', 'Hongrie', 'Hongrie', 'Serbie', 'Autriche', 'Ukraine', 'Hongrie', 'Russie'], []]]","[[[], ['ministre russe des Affaires'], [], ['ministère hongrois des Affaires étrangères', 'MVM', 'Gazprom'], []]]","[[[], ['Sergueï Lavrov'], [], ['Peter Szijjarto'], []]]","{'russie': 2, 'prête': 1, 'demande': 3, 'hongrie': 4, 'volumes': 1, 'supplémentaires': 3, 'gaz': 4, 'ministre': 2, 'russe': 2, 'affaires': 2, 'étrangères': 1, 'sergueï': 1, 'lavrov': 1, 'collègues': 1, 'intérêt': 1, 'gouvernement': 1, 'hongrois': 3, 'quantités': 1, 'année': 1, 'juillet': 1, 'chef': 1, 'diplomatie': 1, 'suite': 1, 'rencontre': 1, 'homologue': 1, 'relation': 1, 'stratégique': 1, 'sanctions': 1, 'achats': 1, 'millions': 1, 'mètres': 2, 'cubes': 2, 'pays': 1, 'ministère': 1, 'septembre': 1, 'société': 1, 'hongroise': 1, 'mvm': 1, 'contrats': 1, 'long': 1, 'terme': 1, 'gazprom': 1, 'fourniture': 1, 'total': 1, 'milliards': 1, 'carburant': 1, 'an': 1, 'pipelines': 1, 'travers': 1, 'serbie': 1, 'autriche': 1, 'pétrole': 1, 'contexte': 1, 'crise': 1, 'énergétique': 1, 'géopolitique': 1, 'actuelle': 1, 'état': 1, 'urgence': 1, 'semaine': 1, 'dernière': 1}","{'Russie': 3, 'Hongrie': 4, 'Moscou': 1, 'Serbie': 1, 'Autriche': 1, 'Ukraine': 1}","{'ministre russe des Affaires': 1, 'ministère hongrois des Affaires étrangères': 1, 'MVM': 1, 'Gazprom': 1}","{'Sergueï Lavrov': 1, 'Peter Szijjarto': 1}",2022,7,20
1658354400,https://fr.sputniknews.africa/20220721/des-veterinaires-russes-sauvent-un-ours-polaire-avec-une-boite-metallique-dans-sa-bouche-1055611256.html,Des vétérinaires russes sauvent un ours polaire avec une boîte métallique dans sa bouche,Cette histoire n’est pas passée inaperçue. De nombreuses images ont été partagées sur la Toile montrant une ourse polaire avec une boîte en métal bloquant sa bouche qui était sortie de son habitat pour chercher de l’aide.,"Une boîte de lait concentré s’est coincée dans la bouche d’un ours polaire après que celui-ci aurait voulu se régaler de son contenu. La jeune femelle, épuisée, s’est même approchée des habitants du village de Dikson, port le plus septentrional de Russie.Les témoins, qui en ont pris des images, ont essayé de sortir la boîte de la bouche eux-mêmes, mais ils n’y sont pas parvenus.Afin de sauver la vie de la bête, une équipe de vétérinaires de Moscou est partie pour rejoindre la ville, a rapporté le 21 juillet la chef du service de protection de l’environnement Rosprirodnadsor, Radionova.Les spécialistes ont dû endormir l’animal et au bout de quelques minutes la boîte a été retirée de sa bouche. Ils ont également constaté que la femelle n’avait pas mangé ou bu d’eau depuis déjà plusieurs jours.Après avoir reçu le traitement nécessaire, l’ours sera ramené dans son habitat naturel et recevra un stock de poissons pour reprendre des forces.","[[['Une boîte de lait concentré s’est coincée dans la bouche d’un ours polaire après que celui-ci aurait voulu se régaler de son contenu.'], ['La jeune femelle, épuisée, s’est même approchée des habitants du village de Dikson, port le plus septentrional de Russie.Les témoins, qui en ont pris des images, ont essayé de sortir la boîte de la bouche eux-mêmes, mais ils n’y sont pas parvenus.Afin de sauver la vie de la bête, une équipe de vétérinaires de Moscou est partie pour rejoindre la ville, a rapporté le 21 juillet la chef du service de protection de l’environnement Rosprirodnadsor, Radionova.Les spécialistes ont dû endormir l’animal et au bout de quelques minutes la boîte a été retirée de sa bouche.'], ['Ils ont également constaté que la femelle n’avait pas mangé ou bu d’eau depuis déjà plusieurs jours.Après avoir reçu le traitement nécessaire, l’ours sera ramené dans son habitat naturel et recevra un stock de poissons pour reprendre des forces.']]]","[[['boîte', 'lait', 'bouche', 'ours', 'polaire', 'contenu'], ['jeune', 'femelle', 'habitants', 'village', 'dikson', 'port', 'septentrional', 'témoins', 'images', 'boîte', 'bouche', 'vie', 'bête', 'équipe', 'vétérinaires', 'moscou', 'ville', 'juillet', 'chef', 'service', 'protection', 'environnement', 'rosprirodnadsor', 'spécialistes', 'animal', 'bout', 'minutes', 'boîte', 'bouche'], ['femelle', 'eau', 'traitement', 'nécessaire', 'ours', 'habitat', 'naturel', 'stock', 'poissons', 'forces']]]","[[[], ['Dikson', 'Russie', 'Moscou', 'Radionova'], []]]","[[[], [], []]]","[[[], [], []]]","{'boîte': 3, 'lait': 1, 'bouche': 3, 'ours': 2, 'polaire': 1, 'contenu': 1, 'jeune': 1, 'femelle': 2, 'habitants': 1, 'village': 1, 'dikson': 1, 'port': 1, 'septentrional': 1, 'témoins': 1, 'images': 1, 'vie': 1, 'bête': 1, 'équipe': 1, 'vétérinaires': 1, 'moscou': 1, 'ville': 1, 'juillet': 1, 'chef': 1, 'service': 1, 'protection': 1, 'environnement': 1, 'rosprirodnadsor': 1, 'spécialistes': 1, 'animal': 1, 'bout': 1, 'minutes': 1, 'eau': 1, 'traitement': 1, 'nécessaire': 1, 'habitat': 1, 'naturel': 1, 'stock': 1, 'poissons': 1, 'forces': 1}","{'Dikson': 1, 'Russie': 1, 'Moscou': 1, 'Radionova': 1}",{},{},2022,7,20
