timestamp,url,title,description,content,content-segmented,kws-l,loc-l,org-l,per-l,kws,loc,org,per,year,month,day
1658354400,https://fr.sputniknews.africa/20220721/assuree-par-la-russie-legypte-lance-la-construction-de-sa-premiere-centrale-nucleaire-1055603070.html,"Assurée par la Russie, l’Égypte lance la construction de sa première centrale nucléaire","Avec le début de la construction de sa première centrale nucléaire, l’Égypte, qui en rêvait depuis des décennies, pourra rejoindre le club atomique mondial dans quelques années. Le projet a été confié à la Russie.","L’Égypte a entamé la construction du premier bloc de la centrale d’El-Dabaa, sa première centrale nucléaire.Le 20 juillet, suite à l’autorisation de l’Autorité nationale de régulation nucléaire et radiologique (ENRRA), le coulage du béton du premier réacteur a été lancé en présence d’Alexeï Likhatchev, chef de l’entreprise publique russe Rosatom à qui la construction a été confiée, et du ministre égyptien de l'Électricité et des Énergies renouvelables Mohamed Chaker, selon le communiqué de l'Autorité égyptienne des centrales nucléaires (NPPA).Nouvelle ère égyptienne""Le début de la construction du premier bloc de la centrale d’El-Dabaa marque l’entrée de l’Égypte dans le club atomique mondial"", a déclaré le chef de Rosatom, selon le communiqué de l’entreprise russe.L'Égypte a nourri l’idée pendant environ 60 ans, tandis que pour Rosatom cela représentera un projet pilote sur le continent africain.Le site de construction se trouve dans le gouvernorat de Matrouh sur la Méditerranée, à environ 300 kilomètres au nord-ouest du Caire. La centrale d'El-Dabaa comprendra quatre unités équipées chacune d'un réacteur VVER-1200 de génération III+ de 1200 MW. La mise en œuvre du premier réacteur est prévue à partir de 2028.L’accord prévoyant la construction date de 2015 et a été finalisé en 2017. Sa valeur a été estimée à une trentaine de milliards de dollars, dont une partie sera apportée par la Russie sous forme de prêts. Actuellement, seule l’Afrique du Sud possède une centrale nucléaire sur le continent.","[[['L’Égypte a entamé la construction du premier bloc de la centrale d’El-Dabaa, sa première centrale nucléaire.Le 20 juillet, suite à l’autorisation de l’Autorité nationale de régulation nucléaire et radiologique (ENRRA), le coulage du béton du premier réacteur a été lancé en présence d’Alexeï Likhatchev, chef de l’entreprise publique russe Rosatom à qui la construction a été confiée, et du ministre égyptien de l\'Électricité et des Énergies renouvelables Mohamed Chaker, selon le communiqué de l\'Autorité égyptienne des centrales nucléaires (NPPA).Nouvelle ère égyptienne""Le début de la construction du premier bloc de la centrale d’El-Dabaa marque l’entrée de l’Égypte dans le club atomique mondial"", a déclaré le chef de Rosatom, selon le communiqué de l’entreprise russe.L\'Égypte a nourri l’idée pendant environ 60 ans, tandis que pour Rosatom cela représentera un projet pilote sur le continent africain.Le site de construction se trouve dans le gouvernorat de Matrouh sur la Méditerranée, à environ 300 kilomètres au nord-ouest du Caire.'], [""La centrale d'El-Dabaa comprendra quatre unités équipées chacune d'un réacteur VVER-1200 de génération III+ de 1200 MW.""], ['La mise en œuvre du premier réacteur est prévue à partir de 2028.L’accord prévoyant la construction date de 2015 et a été finalisé en 2017.'], ['Sa valeur a été estimée à une trentaine de milliards de dollars, dont une partie sera apportée par la Russie sous forme de prêts.'], ['Actuellement, seule l’Afrique du Sud possède une centrale nucléaire sur le continent.']]]","[[['égypte', 'construction', 'bloc', 'centrale', 'dabaa', 'centrale', 'juillet', 'suite', 'autorisation', 'autorité', 'nationale', 'régulation', 'nucléaire', 'radiologique', 'enrra', 'coulage', 'béton', 'réacteur', 'présence', 'likhatchev', 'chef', 'entreprise', 'publique', 'russe', 'rosatom', 'construction', 'ministre', 'égyptien', 'électricité', 'énergies', 'renouvelables', 'mohamed', 'chaker', 'communiqué', 'autorité', 'égyptienne', 'centrales', 'nucléaires', 'ère', 'début', 'construction', 'bloc', 'centrale', 'dabaa', 'entrée', 'égypte', 'club', 'atomique', 'mondial', 'chef', 'rosatom', 'communiqué', 'entreprise', 'idée', 'ans', 'rosatom', 'projet', 'pilote', 'continent', 'site', 'construction', 'gouvernorat', 'matrouh', 'méditerranée', 'kilomètres', 'caire'], ['centrale', 'dabaa', 'unités', 'réacteur', 'génération', 'mw'], ['mise', 'œuvre', 'réacteur', 'accord', 'construction', 'date'], ['valeur', 'trentaine', 'milliards', 'dollars', 'partie', 'russie', 'forme', 'prêts'], ['afrique', 'sud', 'centrale', 'nucléaire', 'continent']]]","[[['Égypte', 'El-Dabaa', 'ENRRA', 'El-Dabaa', 'Égypte', 'Égypte', 'Méditerranée', 'Caire'], ['El-Dabaa'], [], ['Russie'], ['Afrique du Sud']]]","[[['Autorité nationale de régulation nucléaire et radiologique', 'Électricité et des', 'Autorité égyptienne des centrales nucléaires', 'NPPA).Nouvelle ère'], ['VVER-1200'], [], [], []]]","[[['Alexeï', 'Rosatom', 'Mohamed Chaker', 'Rosatom', 'Rosatom', 'Matrouh'], [], [], [], []]]","{'égypte': 2, 'construction': 5, 'bloc': 2, 'centrale': 5, 'dabaa': 3, 'juillet': 1, 'suite': 1, 'autorisation': 1, 'autorité': 2, 'nationale': 1, 'régulation': 1, 'nucléaire': 2, 'radiologique': 1, 'enrra': 1, 'coulage': 1, 'béton': 1, 'réacteur': 3, 'présence': 1, 'likhatchev': 1, 'chef': 2, 'entreprise': 2, 'publique': 1, 'russe': 1, 'rosatom': 3, 'ministre': 1, 'égyptien': 1, 'électricité': 1, 'énergies': 1, 'renouvelables': 1, 'mohamed': 1, 'chaker': 1, 'communiqué': 2, 'égyptienne': 1, 'centrales': 1, 'nucléaires': 1, 'ère': 1, 'début': 1, 'entrée': 1, 'club': 1, 'atomique': 1, 'mondial': 1, 'idée': 1, 'ans': 1, 'projet': 1, 'pilote': 1, 'continent': 2, 'site': 1, 'gouvernorat': 1, 'matrouh': 1, 'méditerranée': 1, 'kilomètres': 1, 'caire': 1, 'unités': 1, 'génération': 1, 'mw': 1, 'mise': 1, 'œuvre': 1, 'accord': 1, 'date': 1, 'valeur': 1, 'trentaine': 1, 'milliards': 1, 'dollars': 1, 'partie': 1, 'russie': 1, 'forme': 1, 'prêts': 1, 'afrique': 1, 'sud': 1}","{'Égypte': 3, 'El-Dabaa': 3, 'ENRRA': 1, 'Méditerranée': 1, 'Caire': 1, 'Russie': 1, 'Afrique du Sud': 1}","{'Autorité nationale de régulation nucléaire et radiologique': 1, 'Électricité et des': 1, 'Autorité égyptienne des centrales nucléaires': 1, 'NPPA).Nouvelle ère': 1, 'VVER-1200': 1}","{'Alexeï': 1, 'Rosatom': 3, 'Mohamed Chaker': 1, 'Matrouh': 1}",2022,7,20
1658354400,https://fr.sputniknews.africa/20220721/boude-par-loccident-le-petrole-russe-de-plus-en-plus-demande-en-chine-1055600849.html,"Boudé par l’Occident, le pétrole russe de plus en plus demandé en Chine","Au mois de juin, les importations de pétrole russe en Chine se sont élevées à 7,29 millions de tonnes, soit 10% de plus que l’année dernière. Des chiffres qui permettent à la Russie de maintenir sa position de leader des livraisons de fuel...","Pour le deuxième mois consécutif, la Russie garde sa place de premier fournisseur de pétrole de la Chine, annonce l’agence Reuters, citant les données de la douane chinoise. Une réussite qui a été possible notamment grâce aux réductions proposées.Comme le précise l’agence, les importations de pétrole russe, via l’oléoduc Sibérie orientale – océan Pacifique et les fournitures depuis les ports russes d’Europe et d’Extrême-Orient, ont constitué 7,29 millions de tonnes, 10% de plus qu’il y a un an. Cependant, le record de mai n’a pas été battu.Ainsi, les exportations du fournisseur le plus onéreux, l’Arabie saoudite, ont baissé. En guise de comparaison, au mois de juin, le premier exportateur de pétrole au monde a livré à la Chine 5,06 millions de tonnes, soit 1,23 million de barils en 24h, soit 30% de moins qu’en juin 2021.Crise énergétiqueL’Europe qui traverse sa ""première crise énergétique globale"", avec la montée des prix sur le gaz dans le monde, met la responsabilité sur la Russie. Moscou épingle pour sa part le choix fait par les pays européens eux-mêmes. Qui plus est, les restrictions sur l'achat de pétrole russe pourraient provoquer les mêmes conséquences, selon Vladimir Poutine.""C’est même étonnant que des gens ayant fait des études supérieures l’évoquent. Le résultat sera le même: les prix sur le pétrole atteindront des sommets"", a-t-il déclaré lors de sa visite de travail en Iran le 19 juillet.","[[['Pour le deuxième mois consécutif, la Russie garde sa place de premier fournisseur de pétrole de la Chine, annonce l’agence Reuters, citant les données de la douane chinoise.'], ['Une réussite qui a été possible notamment grâce aux réductions proposées.Comme le précise l’agence, les importations de pétrole russe, via l’oléoduc Sibérie orientale – océan Pacifique et les fournitures depuis les ports russes d’Europe et d’Extrême-Orient, ont constitué 7,29 millions de tonnes, 10% de plus qu’il y a un an.'], ['Cependant, le record de mai n’a pas été battu.Ainsi, les exportations du fournisseur le plus onéreux, l’Arabie saoudite, ont baissé.'], ['En guise de comparaison, au mois de juin, le premier exportateur de pétrole au monde a livré à la Chine 5,06 millions de tonnes, soit 1,23 million de barils en 24h, soit 30% de moins qu’en juin 2021.Crise énergétiqueL’Europe qui traverse sa ""première crise énergétique globale"", avec la montée des prix sur le gaz dans le monde, met la responsabilité sur la Russie.'], ['Moscou épingle pour sa part le choix fait par les pays européens eux-mêmes.'], [""Qui plus est, les restrictions sur l'achat de pétrole russe pourraient provoquer les mêmes conséquences, selon Vladimir Poutine.""], ['""C’est même étonnant que des gens ayant fait des études supérieures l’évoquent.'], ['Le résultat sera le même: les prix sur le pétrole atteindront des sommets"", a-t-il déclaré lors de sa visite de travail en Iran le 19 juillet.']]]","[[['mois', 'consécutif', 'russie', 'place', 'fournisseur', 'pétrole', 'chine', 'agence', 'reuters', 'données', 'douane', 'chinoise'], ['réussite', 'grâce', 'réductions', 'agence', 'importations', 'pétrole', 'russe', 'oléoduc', 'sibérie', 'orientale', 'océan', 'pacifique', 'fournitures', 'ports', 'russes', 'europe', 'millions', 'tonnes', 'an'], ['record', 'mai', 'exportations', 'fournisseur', 'onéreux', 'arabie', 'saoudite'], ['guise', 'comparaison', 'mois', 'juin', 'exportateur', 'pétrole', 'monde', 'chine', 'millions', 'tonnes', 'million', 'barils', 'juin', 'europe', 'crise', 'énergétique', 'globale', 'montée', 'prix', 'gaz', 'monde', 'responsabilité', 'russie'], ['moscou', 'part', 'choix', 'pays', 'européens'], ['restrictions', 'achat', 'pétrole', 'russe', 'conséquences', 'vladimir', 'poutine'], ['étonnant', 'études', 'supérieures'], ['résultat', 'prix', 'pétrole', 'sommets', 'visite', 'travail', 'iran', 'juillet']]]","[[['Russie', 'Chine'], ['Sibérie', 'océan Pacifique', 'Europe', 'Extrême-Orient'], ['Arabie saoudite'], ['Chine', 'Russie'], ['Moscou'], [], [], ['Iran']]]","[[['Reuters'], [], [], [], [], [], [], []]]","[[[], [], [], ['2021.Crise énergétiqueL’Europe'], [], ['Vladimir Poutine'], [], []]]","{'mois': 2, 'consécutif': 1, 'russie': 2, 'place': 1, 'fournisseur': 2, 'pétrole': 5, 'chine': 2, 'agence': 2, 'reuters': 1, 'données': 1, 'douane': 1, 'chinoise': 1, 'réussite': 1, 'grâce': 1, 'réductions': 1, 'importations': 1, 'russe': 2, 'oléoduc': 1, 'sibérie': 1, 'orientale': 1, 'océan': 1, 'pacifique': 1, 'fournitures': 1, 'ports': 1, 'russes': 1, 'europe': 2, 'millions': 2, 'tonnes': 2, 'an': 1, 'record': 1, 'mai': 1, 'exportations': 1, 'onéreux': 1, 'arabie': 1, 'saoudite': 1, 'guise': 1, 'comparaison': 1, 'juin': 2, 'exportateur': 1, 'monde': 2, 'million': 1, 'barils': 1, 'crise': 1, 'énergétique': 1, 'globale': 1, 'montée': 1, 'prix': 2, 'gaz': 1, 'responsabilité': 1, 'moscou': 1, 'part': 1, 'choix': 1, 'pays': 1, 'européens': 1, 'restrictions': 1, 'achat': 1, 'conséquences': 1, 'vladimir': 1, 'poutine': 1, 'étonnant': 1, 'études': 1, 'supérieures': 1, 'résultat': 1, 'sommets': 1, 'visite': 1, 'travail': 1, 'iran': 1, 'juillet': 1}","{'Russie': 2, 'Chine': 2, 'Sibérie': 1, 'océan Pacifique': 1, 'Europe': 1, 'Extrême-Orient': 1, 'Arabie saoudite': 1, 'Moscou': 1, 'Iran': 1}",{'Reuters': 1},"{'2021.Crise énergétiqueL’Europe': 1, 'Vladimir Poutine': 1}",2022,7,20
1658354400,https://fr.sputniknews.africa/20220721/cette-appli-de-rencontres-musulmanes-prend-en-charge-des-amendes-pour-port-du-burkini-en-france-1055609165.html,Cette appli de rencontres musulmanes prend en charge des amendes pour port du burkini en France,"Basée au Royaume-Uni, l’association ""Muzz"" a annoncé prendre en charge des amendes pour port du burkini. L’initiative arrive après la confirmation par le Conseil d’État en France de l’interdiction de cette tenue religieuse dans les...","Après que le Conseil d’État français a confirmé le 21 juin l’interdiction du burkini dans les piscines municipales de Grenoble, une nouvelle polémique est apparue sur le sujet.L’application de rencontres entre personnes de confession musulmane Muzz propose de rembourser les amendes des femmes qui portent ce maillot de bain et se voient verbaliser, selon le site de l’application.""Sœurs musulmanes, il fait chaud dehors, allez nager tranquillement. Ne vous inquiétez pas, Muzz vous remboursera si vous êtes verbalisées pour port de burkini"", écrit la source.Pour être remboursées, les intéressées doivent remplir un formulaire relatant les conditions dans lesquelles l’amende a été dressée. Elles doivent envoyer ""un document officiel issu d’une entité gouvernementale, attestant de l’amende et incluant nom et adresse"" ainsi qu'une ""attestation officielle de votre banque indiquant que vous avez déjà payé l'amende"".Le service compte plus de six millions de membres, ""dont plusieurs centaines de milliers en France"" et indique avoir ""un budget de 25.000 euros dédié aux amendes pour port du Burkini"".L’initiative a rapidement provoqué l’indignation du ministre de l’Intérieur, Gérald Darmanin, qui a tweeté le 20 juillet avoir signalé ""ces agissements à la justice"". Nous ne laisserons pas des organisations communautaristes structurer des dérives séparatistes au sein de notre République. Je signale ces agissements à la justice. https://t.co/9I0ZuEUCsa— Gérald DARMANIN (@GDarmanin) July 20, 2022 Polémique à GrenobleFin mai, le nouveau règlement des piscines de la ville dont Éric Piolli est maire avait autorisé l’usage de maillots de bain de type burkini. Mais l’autorisation avait alors été suspendue par le tribunal administratif de Grenoble. La commune a ainsi déposé un recours devant le Conseil d’État qui a, à son tour, fermé la porte à cette tenue dans les piscines municipales de la ville.","[[['Après que le Conseil d’État français a confirmé le 21 juin l’interdiction du burkini dans les piscines municipales de Grenoble, une nouvelle polémique est apparue sur le sujet.L’application de rencontres entre personnes de confession musulmane Muzz propose de rembourser les amendes des femmes qui portent ce maillot de bain et se voient verbaliser, selon le site de l’application.'], ['""Sœurs musulmanes, il fait chaud dehors, allez nager tranquillement.'], ['Ne vous inquiétez pas, Muzz vous remboursera si vous êtes verbalisées pour port de burkini"", écrit la source.Pour être remboursées, les intéressées doivent remplir un formulaire relatant les conditions dans lesquelles l’amende a été dressée.'], ['Elles doivent envoyer ""un document officiel issu d’une entité gouvernementale, attestant de l’amende et incluant nom et adresse"" ainsi qu\'une ""attestation officielle de votre banque indiquant que vous avez déjà payé l\'amende"".Le service compte plus de six millions de membres, ""dont plusieurs centaines de milliers en France"" et indique avoir ""un budget de 25.000 euros dédié aux amendes pour port du Burkini"".L’initiative a rapidement provoqué l’indignation du ministre de l’Intérieur, Gérald Darmanin, qui a tweeté le 20 juillet avoir signalé ""ces agissements à la justice"".'], ['Nous ne laisserons pas des organisations communautaristes structurer des dérives séparatistes au sein de notre République.'], ['Je signale ces agissements à la justice.'], ['https://t.co/9I0ZuEUCsa— Gérald DARMANIN (@GDarmanin) July 20, 2022 Polémique à GrenobleFin mai, le nouveau règlement des piscines de la ville dont Éric Piolli est maire avait autorisé l’usage de maillots de bain de type burkini.'], ['Mais l’autorisation avait alors été suspendue par le tribunal administratif de Grenoble.'], ['La commune a ainsi déposé un recours devant le Conseil d’État qui a, à son tour, fermé la porte à cette tenue dans les piscines municipales de la ville.']]]","[[['conseil', 'état', 'français', 'juin', 'interdiction', 'burkini', 'piscines', 'municipales', 'grenoble', 'nouvelle', 'polémique', 'application', 'rencontres', 'personnes', 'confession', 'musulmane', 'amendes', 'femmes', 'maillot', 'bain', 'site', 'application'], ['sœurs', 'musulmanes', 'chaud'], ['port', 'burkini', 'intéressées', 'formulaire', 'conditions', 'amende'], ['document', 'officiel', 'issu', 'entité', 'gouvernementale', 'amende', 'nom', 'adresse', 'attestation', 'officielle', 'banque', 'service', 'millions', 'membres', 'centaines', 'milliers', 'france', 'budget', 'euros', 'dédié', 'amendes', 'port', 'initiative', 'indignation', 'ministre', 'intérieur', 'gérald', 'darmanin', 'juillet', 'agissements', 'justice'], ['organisations', 'communautaristes', 'dérives', 'séparatistes', 'sein', 'république'], ['agissements', 'justice'], ['gérald', 'darmanin', 'july', 'polémique', 'grenoblefin', 'mai', 'règlement', 'piscines', 'ville', 'éric', 'maire', 'usage', 'maillots', 'bain', 'type', 'burkini'], ['autorisation', 'tribunal', 'administratif', 'grenoble'], ['commune', 'recours', 'conseil', 'état', 'tour', 'porte', 'tenue', 'piscines', 'municipales', 'ville']]]","[[['Grenoble'], [], [], ['France', 'Burkini""'], [], [], ['Polémique'], ['Grenoble'], []]]","[[['Conseil d’État français'], ['Sœurs musulmanes'], [], ['ministre de l’Intérieur'], [], [], [], [], ['Conseil d’État']]]","[[['Muzz'], [], ['Muzz', 'burkini'], ['Gérald Darmanin'], [], [], ['Gérald DARMANIN', 'GrenobleFin mai', 'Éric Piolli'], [], []]]","{'conseil': 2, 'état': 2, 'français': 1, 'juin': 1, 'interdiction': 1, 'burkini': 3, 'piscines': 3, 'municipales': 2, 'grenoble': 2, 'nouvelle': 1, 'polémique': 2, 'application': 2, 'rencontres': 1, 'personnes': 1, 'confession': 1, 'musulmane': 1, 'amendes': 2, 'femmes': 1, 'maillot': 1, 'bain': 2, 'site': 1, 'sœurs': 1, 'musulmanes': 1, 'chaud': 1, 'port': 2, 'intéressées': 1, 'formulaire': 1, 'conditions': 1, 'amende': 2, 'document': 1, 'officiel': 1, 'issu': 1, 'entité': 1, 'gouvernementale': 1, 'nom': 1, 'adresse': 1, 'attestation': 1, 'officielle': 1, 'banque': 1, 'service': 1, 'millions': 1, 'membres': 1, 'centaines': 1, 'milliers': 1, 'france': 1, 'budget': 1, 'euros': 1, 'dédié': 1, 'initiative': 1, 'indignation': 1, 'ministre': 1, 'intérieur': 1, 'gérald': 2, 'darmanin': 2, 'juillet': 1, 'agissements': 2, 'justice': 2, 'organisations': 1, 'communautaristes': 1, 'dérives': 1, 'séparatistes': 1, 'sein': 1, 'république': 1, 'july': 1, 'grenoblefin': 1, 'mai': 1, 'règlement': 1, 'ville': 2, 'éric': 1, 'maire': 1, 'usage': 1, 'maillots': 1, 'type': 1, 'autorisation': 1, 'tribunal': 1, 'administratif': 1, 'commune': 1, 'recours': 1, 'tour': 1, 'porte': 1, 'tenue': 1}","{'Grenoble': 2, 'France': 1, 'Burkini""': 1, 'Polémique': 1}","{'Conseil d’État français': 1, 'Sœurs musulmanes': 1, 'ministre de l’Intérieur': 1, 'Conseil d’État': 1}","{'Muzz': 2, 'burkini': 1, 'Gérald Darmanin': 1, 'Gérald DARMANIN': 1, 'GrenobleFin mai': 1, 'Éric Piolli': 1}",2022,7,20
