timestamp,url,title,description,content,content-segmented,kws-l,loc-l,org-l,per-l,kws,loc,org,per,year,month,day
1677711600,https://fr.sputniknews.africa/20230302/poutine-qualifie-dattentat-lattaque-dun-groupe-ukrainien-dans-une-region-frontaliere-russe-1058079582.html,Poutine qualifie d’attentat l’attaque d'un groupe ukrainien dans une région frontalière russe,"Des saboteurs ukrainiens qui ont pénétré ce jeudi dans la région russe frontalière de Briansk ont ciblé délibérément des civils, y compris des enfants, a souligné le Président russe qui a dénoncé un ""nouvel acte terroriste"" du régime de...","Le Président russe a commenté l'attaque de saboteurs ukrainiens survenu ce jeudi 2 mars dans laquelle un homme a été tué et un enfant a été blessé.""Un nouvel acte terroriste, un nouveau crime a été commis. Ils ont pénétré dans le territoire frontalier et ont ouvert le feu sur des civils. Ils ont vu que c’était un véhicule civil et qu’il y avait des civils et des enfants"", a-t-il indiqué.D’après le Président russe, ""les patrons"" des néonazis ukrainiens sont également impliqués dans ce crime. Vladimir Poutine a toutefois souligné que les objectifs de la Russie seraient atteints. ""Ils ne réussiront pas, nous irons jusqu’au bout"", a-t-il conclu.Une attaque de saboteursUn groupe de saboteurs ukrainiens s’est introduit ce 2 mars dans la région russe de Briansk, voisine de l’Ukraine. Au cours de l’attaque, les assaillants ont tiré sur un véhicule dans le village de Lubetchané et ont tué son conducteur. Un enfant de 10 ans a également été blessé, sa vie est hors de danger.","[[[""Le Président russe a commenté l'attaque de saboteurs ukrainiens survenu ce jeudi 2 mars dans laquelle un homme a été tué et un enfant a été blessé.""], ['""Un nouvel acte terroriste, un nouveau crime a été commis.'], ['Ils ont pénétré dans le territoire frontalier et ont ouvert le feu sur des civils.'], ['Ils ont vu que c’était un véhicule civil et qu’il y avait des civils et des enfants"", a-t-il indiqué.D’après le Président russe, ""les patrons"" des néonazis ukrainiens sont également impliqués dans ce crime.'], ['Vladimir Poutine a toutefois souligné que les objectifs de la Russie seraient atteints.'], ['""Ils ne réussiront pas, nous irons jusqu’au bout"", a-t-il conclu.Une attaque de saboteursUn groupe de saboteurs ukrainiens s’est introduit ce 2 mars dans la région russe de Briansk, voisine de l’Ukraine.'], ['Au cours de l’attaque, les assaillants ont tiré sur un véhicule dans le village de Lubetchané et ont tué son conducteur.'], ['Un enfant de 10 ans a également été blessé, sa vie est hors de danger.']]]","[[['président', 'russe', 'attaque', 'saboteurs', 'ukrainiens', 'jeudi', 'mars', 'homme', 'enfant'], ['nouvel', 'acte', 'terroriste', 'crime'], ['territoire', 'frontalier', 'feu', 'civils'], ['véhicule', 'civil', 'civils', 'enfants', 'président', 'russe', 'patrons', 'néonazis', 'ukrainiens', 'crime'], ['vladimir', 'poutine', 'objectifs', 'russie'], ['bout', 'attaque', 'saboteursun', 'groupe', 'saboteurs', 'ukrainiens', 'mars', 'région', 'russe', 'briansk', 'voisine', 'ukraine'], ['cours', 'attaque', 'assaillants', 'véhicule', 'village', 'lubetchané', 'conducteur'], ['enfant', 'ans', 'vie', 'danger']]]","[[[], [], [], [], ['Russie'], ['Briansk', 'Ukraine'], ['Lubetchané'], []]]","[[[], [], [], [], [], [], [], []]]","[[['Président russe'], [], [], [], ['Vladimir Poutine'], [], [], []]]","{'président': 2, 'russe': 3, 'attaque': 3, 'saboteurs': 2, 'ukrainiens': 3, 'jeudi': 1, 'mars': 2, 'homme': 1, 'enfant': 2, 'nouvel': 1, 'acte': 1, 'terroriste': 1, 'crime': 2, 'territoire': 1, 'frontalier': 1, 'feu': 1, 'civils': 2, 'véhicule': 2, 'civil': 1, 'enfants': 1, 'patrons': 1, 'néonazis': 1, 'vladimir': 1, 'poutine': 1, 'objectifs': 1, 'russie': 1, 'bout': 1, 'saboteursun': 1, 'groupe': 1, 'région': 1, 'briansk': 1, 'voisine': 1, 'ukraine': 1, 'cours': 1, 'assaillants': 1, 'village': 1, 'lubetchané': 1, 'conducteur': 1, 'ans': 1, 'vie': 1, 'danger': 1}","{'Russie': 1, 'Briansk': 1, 'Ukraine': 1, 'Lubetchané': 1}",{},"{'Président russe': 1, 'Vladimir Poutine': 1}",2023,3,1
1677711600,https://fr.sputniknews.africa/20230302/ce-virus-risque-de-susciter-une-nouvelle-pandemie-en-cas-de-mutation-alerte-loms-1058079261.html,"Ce virus risque de susciter une nouvelle pandémie en cas de mutation, alerte l’OMS","La grippe aviaire, dont la mortalité atteint 50% chez les humains, préoccupe les autorités sanitaires mondiales. Si le virus mute et se transmet entre êtres humains, il pourrait provoquer une pandémie, indique un responsable de l’OMS...","L’humanité doit être préparée à une nouvelle pandémie si le virus de la grippe aviaire mute, prévient un épidémiologiste de l’Organisation mondiale de la santé (OMS).La grippe aviaire a déjà tué des millions d’oiseaux sauvages partout dans le monde. La moitié des personnes ayant attrapé le virus via des animaux infectés sont décédées. Même si le virus ne se transmet aux humains que par contact direct avec des animaux infectés, les médecins redoutent le pire:""On craint que le virus acquière la capacité de se propager durablement d'une personne à l'autre et puisse déclencher une nouvelle pandémie. Nous devons nous y préparer"", a estimé Richard Pebody, responsable de l’OMS, interrogé par El Pais.Et d’ajouter que la situation ""est inquiétante, car il y a un risque potentiel pour l'homme"".Mesures de préventionPour l’heure, il n’y a ""aucune preuve de propagation entre êtres humains"". Mais le spécialiste juge nécessaire de rester ""vigilant"".""Nous devons mettre en place un système de surveillance robuste afin de pouvoir détecter rapidement toute mutation préoccupante et de nous assurer que nous disposons de vaccins candidats en cas de besoin"", a estimé M.Pebody.Et d’ajouter qu’il ne faut pas ramasser d’oiseaux ou d’autres animaux morts ou mourants. Enfin, les travailleurs des élevages de volailles doivent être bien protégés, conclut-il.Depuis octobre 2021, l'Europe subit une flambée de grippe aviaire hautement pathogène la plus dévastatrice qu’elle n’ait jamais connue, selon les autorités sanitaires françaises.Cette épizootie touche pratiquement tous les continents, dont l’Europe, l’Asie, les Amériques et l’Afrique. Depuis 2003, près de 900 personnes ont été contaminées via des animaux dont plus de la moitié est morte.","[[['L’humanité doit être préparée à une nouvelle pandémie si le virus de la grippe aviaire mute, prévient un épidémiologiste de l’Organisation mondiale de la santé (OMS).La grippe aviaire a déjà tué des millions d’oiseaux sauvages partout dans le monde.'], ['La moitié des personnes ayant attrapé le virus via des animaux infectés sont décédées.'], ['Même si le virus ne se transmet aux humains que par contact direct avec des animaux infectés, les médecins redoutent le pire:""On craint que le virus acquière la capacité de se propager durablement d\'une personne à l\'autre et puisse déclencher une nouvelle pandémie.'], ['Nous devons nous y préparer"", a estimé Richard Pebody, responsable de l’OMS, interrogé par El Pais.Et d’ajouter que la situation ""est inquiétante, car il y a un risque potentiel pour l\'homme"".Mesures de préventionPour l’heure, il n’y a ""aucune preuve de propagation entre êtres humains"".'], ['Mais le spécialiste juge nécessaire de rester ""vigilant"".'], ['""Nous devons mettre en place un système de surveillance robuste afin de pouvoir détecter rapidement toute mutation préoccupante et de nous assurer que nous disposons de vaccins candidats en cas de besoin"", a estimé M.Pebody.Et d’ajouter qu’il ne faut pas ramasser d’oiseaux ou d’autres animaux morts ou mourants.'], [""Enfin, les travailleurs des élevages de volailles doivent être bien protégés, conclut-il.Depuis octobre 2021, l'Europe subit une flambée de grippe aviaire hautement pathogène la plus dévastatrice qu’elle n’ait jamais connue, selon les autorités sanitaires françaises.Cette épizootie touche pratiquement tous les continents, dont l’Europe, l’Asie, les Amériques et l’Afrique.""], ['Depuis 2003, près de 900 personnes ont été contaminées via des animaux dont plus de la moitié est morte.']]]","[[['humanité', 'nouvelle', 'pandémie', 'virus', 'grippe', 'aviaire', 'mute', 'épidémiologiste', 'organisation', 'mondiale', 'santé', 'grippe', 'aviaire', 'millions', 'oiseaux', 'sauvages', 'monde'], ['moitié', 'personnes', 'virus', 'animaux'], ['virus', 'humains', 'contact', 'direct', 'animaux', 'médecins', 'virus', 'acquière', 'capacité', 'nouvelle', 'pandémie'], ['richard', 'pebody', 'responsable', 'oms', 'situation', 'inquiétante', 'risque', 'potentiel', 'heure', 'preuve', 'propagation', 'êtres', 'humains'], ['spécialiste', 'juge', 'nécessaire', 'vigilant'], ['place', 'système', 'surveillance', 'robuste', 'mutation', 'préoccupante', 'vaccins', 'candidats', 'cas', 'besoin', 'oiseaux', 'animaux', 'morts', 'mourants'], ['travailleurs', 'élevages', 'volailles', 'octobre', 'europe', 'flambée', 'grippe', 'aviaire', 'pathogène', 'dévastatrice', 'autorités', 'sanitaires', 'épizootie', 'continents', 'europe', 'asie', 'amériques', 'afrique'], ['personnes', 'animaux', 'moitié']]]","[[['OMS).La'], [], [], [], [], [], ['Europe', 'Europe', 'Asie', 'Amériques', 'Afrique'], []]]","[[['Organisation mondiale de la santé'], [], [], ['OMS', 'El Pais'], [], [], [], []]]","[[[], [], [], ['Richard Pebody'], [], [], [], []]]","{'humanité': 1, 'nouvelle': 2, 'pandémie': 2, 'virus': 4, 'grippe': 3, 'aviaire': 3, 'mute': 1, 'épidémiologiste': 1, 'organisation': 1, 'mondiale': 1, 'santé': 1, 'millions': 1, 'oiseaux': 2, 'sauvages': 1, 'monde': 1, 'moitié': 2, 'personnes': 2, 'animaux': 4, 'humains': 2, 'contact': 1, 'direct': 1, 'médecins': 1, 'acquière': 1, 'capacité': 1, 'richard': 1, 'pebody': 1, 'responsable': 1, 'oms': 1, 'situation': 1, 'inquiétante': 1, 'risque': 1, 'potentiel': 1, 'heure': 1, 'preuve': 1, 'propagation': 1, 'êtres': 1, 'spécialiste': 1, 'juge': 1, 'nécessaire': 1, 'vigilant': 1, 'place': 1, 'système': 1, 'surveillance': 1, 'robuste': 1, 'mutation': 1, 'préoccupante': 1, 'vaccins': 1, 'candidats': 1, 'cas': 1, 'besoin': 1, 'morts': 1, 'mourants': 1, 'travailleurs': 1, 'élevages': 1, 'volailles': 1, 'octobre': 1, 'europe': 2, 'flambée': 1, 'pathogène': 1, 'dévastatrice': 1, 'autorités': 1, 'sanitaires': 1, 'épizootie': 1, 'continents': 1, 'asie': 1, 'amériques': 1, 'afrique': 1}","{'OMS).La': 1, 'Europe': 2, 'Asie': 1, 'Amériques': 1, 'Afrique': 1}","{'Organisation mondiale de la santé': 1, 'OMS': 1, 'El Pais': 1}",{'Richard Pebody': 1},2023,3,1
1677711600,https://fr.sputniknews.africa/20230302/le-kremlin-qualifie-de-terroristes-les-eclaireurs-ukrainiens-qui-ont-attaque-une-region-russe-1058052653.html,"Le Kremlin qualifie de ""terroristes"" les éclaireurs ukrainiens qui ont attaqué une région russe","Menée contre des civils dans une région russe voisine de l’Ukraine, l’attaque a été commise ce 2 mars par des ""terroristes"" ukrainiens, a annoncé le porte-parole du Président russe. La Russie continuera d’attirer l'attention de la...","Le Kremlin a qualifié de ""terroristes"" les éclaireurs ukrainiens qui ont attaqué ce 2 mars la région russe de Briansk, frontalière de l’Ukraine.""Il s’agit d’une attaque terroriste. Actuellement, des mesures sont entreprises visant à les éliminer"", a déclaré le porte-parole du Président russe.""Nous allons continuer d'attirer l'attention de la communauté internationale sur ces attentats que ces gens commettent"", a ajouté Dmitri Peskov.Tous les détails concernant cette opération seront communiqués par les forces de l’ordre dans le cadre d’une enquête, poursuit-il.Ce que l’on sait de cette attaque Un groupe d’éclaireurs ukrainiens s’est introduit ce 2 mars dans la région russe de Briansk, voisine de l’Ukraine, pour attaquer la population civile. Les assaillants ont tiré sur un véhicule dans le village de Lubetchané. Un civil a été tué et un garçon de 10 ans blessé. Ce dernier a été hospitalisé. Les forces armées russes mènent toutes les actions nécessaires pour neutraliser le groupe.","[[['Le Kremlin a qualifié de ""terroristes"" les éclaireurs ukrainiens qui ont attaqué ce 2 mars la région russe de Briansk, frontalière de l’Ukraine.'], ['""Il s’agit d’une attaque terroriste.'], ['Actuellement, des mesures sont entreprises visant à les éliminer"", a déclaré le porte-parole du Président russe.'], ['""Nous allons continuer d\'attirer l\'attention de la communauté internationale sur ces attentats que ces gens commettent"", a ajouté Dmitri Peskov.Tous les détails concernant cette opération seront communiqués par les forces de l’ordre dans le cadre d’une enquête, poursuit-il.Ce que l’on sait de cette attaque Un groupe d’éclaireurs ukrainiens s’est introduit ce 2 mars dans la région russe de Briansk, voisine de l’Ukraine, pour attaquer la population civile.'], ['Les assaillants ont tiré sur un véhicule dans le village de Lubetchané.'], ['Un civil a été tué et un garçon de 10 ans blessé.'], ['Ce dernier a été hospitalisé.'], ['Les forces armées russes mènent toutes les actions nécessaires pour neutraliser le groupe.']]]","[[['kremlin', 'terroristes', 'éclaireurs', 'ukrainiens', 'mars', 'région', 'russe', 'frontalière', 'ukraine'], ['attaque', 'terroriste'], ['mesures', 'président'], ['attention', 'communauté', 'internationale', 'attentats', 'détails', 'opération', 'forces', 'ordre', 'cadre', 'enquête', 'attaque', 'groupe', 'éclaireurs', 'ukrainiens', 'mars', 'région', 'russe', 'briansk', 'voisine', 'ukraine', 'population', 'civile'], ['assaillants', 'véhicule', 'village', 'lubetchané'], ['civil', 'garçon', 'ans'], ['dernier'], ['forces', 'armées', 'russes', 'actions', 'nécessaires', 'groupe']]]","[[['Kremlin', 'Briansk', 'Ukraine'], [], [], ['Briansk', 'Ukraine'], ['Lubetchané'], [], [], []]]","[[[], [], [], [], [], [], [], []]]","[[[], [], ['Président russe'], ['Dmitri Peskov'], [], [], [], []]]","{'kremlin': 1, 'terroristes': 1, 'éclaireurs': 2, 'ukrainiens': 2, 'mars': 2, 'région': 2, 'russe': 2, 'frontalière': 1, 'ukraine': 2, 'attaque': 2, 'terroriste': 1, 'mesures': 1, 'président': 1, 'attention': 1, 'communauté': 1, 'internationale': 1, 'attentats': 1, 'détails': 1, 'opération': 1, 'forces': 2, 'ordre': 1, 'cadre': 1, 'enquête': 1, 'groupe': 2, 'briansk': 1, 'voisine': 1, 'population': 1, 'civile': 1, 'assaillants': 1, 'véhicule': 1, 'village': 1, 'lubetchané': 1, 'civil': 1, 'garçon': 1, 'ans': 1, 'dernier': 1, 'armées': 1, 'russes': 1, 'actions': 1, 'nécessaires': 1}","{'Kremlin': 1, 'Briansk': 2, 'Ukraine': 2, 'Lubetchané': 1}",{},"{'Président russe': 1, 'Dmitri Peskov': 1}",2023,3,1
1677711600,https://fr.sputniknews.africa/20230302/lunion-africaine-sera-un-membre-a-part-entiere-du-g20-dit-lavrov--1058052589.html,"L’Union africaine sera un membre à part entière du G20, dit Lavrov","Lors de la réunion des ministres des Affaires étrangères du G20, qui a eu lieu ce 2 mars dans la capitale de l’Inde, les participants à l’événement se sont mis d’accord pour que l'Union africaine soit membre du Groupe.","L’Union africaine sera un membre à part entière du G20. C’est ce qui a été convenu au sommet des ministres des Affaires étrangères du Groupe, réuni ce 2 mars à New Delhi, a déclaré le chef de la diplomatie russe.""Il a été décidé que l'Union africaine sera désormais un membre à part entière du G20, tout comme l'Union européenne y participe depuis plusieurs années"", a précisé Sergueï Lavrov lors d'une conférence de presse à l'issue de la réunion.Cette déclaration a été faite alors que le ministre russe se trouvait ce jour même en visite officielle de deux jours pour le forum du G20, où il a déjà eu des entretiens avec le Premier ministre indien Narendra Modi, son homologue indien Subrahmanyam Jaishankar, le ministre turc des Affaires étrangères Mevlut Cavusoglu et de nombreux autres diplomates de haut niveau.Lors de la séance de clôture du Sommet USA-Afrique, qui s’est tenu du 13 au 15 décembre à Washington, le Président américain avait lui aussi apporté son soutien à l'idée d'un siège pour l’UA, organisation composée de 55 pays, au sein du Groupe. Aujourd’hui, seule l’Afrique du Sud en est membre.","[[['L’Union africaine sera un membre à part entière du G20.'], ['C’est ce qui a été convenu au sommet des ministres des Affaires étrangères du Groupe, réuni ce 2 mars à New Delhi, a déclaré le chef de la diplomatie russe.'], ['""Il a été décidé que l\'Union africaine sera désormais un membre à part entière du G20, tout comme l\'Union européenne y participe depuis plusieurs années"", a précisé Sergueï Lavrov lors d\'une conférence de presse à l\'issue de la réunion.Cette déclaration a été faite alors que le ministre russe se trouvait ce jour même en visite officielle de deux jours pour le forum du G20, où il a déjà eu des entretiens avec le Premier ministre indien Narendra Modi, son homologue indien Subrahmanyam Jaishankar, le ministre turc des Affaires étrangères Mevlut Cavusoglu et de nombreux autres diplomates de haut niveau.Lors de la séance de clôture du Sommet USA-Afrique, qui s’est tenu du 13 au 15 décembre à Washington, le Président américain avait lui aussi apporté son soutien à l\'idée d\'un siège pour l’UA, organisation composée de 55 pays, au sein du Groupe.'], ['Aujourd’hui, seule l’Afrique du Sud en est membre.']]]","[[['union', 'africaine', 'membre', 'part', 'entière'], ['sommet', 'ministres', 'affaires', 'étrangères', 'groupe', 'mars', 'new', 'delhi', 'chef', 'diplomatie', 'russe'], ['union', 'africaine', 'membre', 'part', 'entière', 'union', 'européenne', 'années', 'sergueï', 'lavrov', 'conférence', 'presse', 'issue', 'déclaration', 'ministre', 'russe', 'jour', 'visite', 'officielle', 'jours', 'forum', 'entretiens', 'ministre', 'indien', 'narendra', 'modi', 'homologue', 'indien', 'ministre', 'turc', 'affaires', 'étrangères', 'mevlut', 'cavusoglu', 'diplomates', 'haut', 'séance', 'clôture', 'sommet', 'usa', 'afrique', 'décembre', 'washington', 'président', 'américain', 'soutien', 'idée', 'siège', 'ua', 'organisation', 'pays', 'sein', 'groupe'], ['afrique', 'sud', 'membre']]]","[[[], ['New Delhi'], ['Washington'], ['l’Afrique du Sud']]]","[[['Union africaine', 'G20'], ['Affaires étrangères du Groupe'], ['Union africaine', 'G20', 'Union européenne', 'G20', 'ministre turc des Affaires', 'UA', 'Groupe'], []]]","[[[], [], ['Sergueï Lavrov', 'Narendra Modi', 'Subrahmanyam Jaishankar', 'Mevlut Cavusoglu', 'Président américain'], []]]","{'union': 3, 'africaine': 2, 'membre': 3, 'part': 2, 'entière': 2, 'sommet': 2, 'ministres': 1, 'affaires': 2, 'étrangères': 2, 'groupe': 2, 'mars': 1, 'new': 1, 'delhi': 1, 'chef': 1, 'diplomatie': 1, 'russe': 2, 'européenne': 1, 'années': 1, 'sergueï': 1, 'lavrov': 1, 'conférence': 1, 'presse': 1, 'issue': 1, 'déclaration': 1, 'ministre': 3, 'jour': 1, 'visite': 1, 'officielle': 1, 'jours': 1, 'forum': 1, 'entretiens': 1, 'indien': 2, 'narendra': 1, 'modi': 1, 'homologue': 1, 'turc': 1, 'mevlut': 1, 'cavusoglu': 1, 'diplomates': 1, 'haut': 1, 'séance': 1, 'clôture': 1, 'usa': 1, 'afrique': 2, 'décembre': 1, 'washington': 1, 'président': 1, 'américain': 1, 'soutien': 1, 'idée': 1, 'siège': 1, 'ua': 1, 'organisation': 1, 'pays': 1, 'sein': 1, 'sud': 1}","{'New Delhi': 1, 'Washington': 1, 'l’Afrique du Sud': 1}","{'Union africaine': 2, 'G20': 3, 'Affaires étrangères du Groupe': 1, 'Union européenne': 1, 'ministre turc des Affaires': 1, 'UA': 1, 'Groupe': 1}","{'Sergueï Lavrov': 1, 'Narendra Modi': 1, 'Subrahmanyam Jaishankar': 1, 'Mevlut Cavusoglu': 1, 'Président américain': 1}",2023,3,1
1677711600,https://fr.sputniknews.africa/20230302/serguei-lavrov-tient-une-conference-de-presse-en-marge-du-g20-a-new-delhi--video-1058052393.html,Sergueï Lavrov tient une conférence de presse en marge du G20 à New Delhi – vidéo,"Le sommet des ministres des Affaires étrangères du G20 se tient à New Delhi, en Inde, pays qui préside cette année ce groupe des plus grandes économies mondiales.","Le ministre russe des Affaires étrangères tient ce 2 mars une conférence de presse à l'issue de sa rencontre avec le Premier ministre indien Narendra Modi à New Delhi. Le ministre russe y est en visite officielle de deux jours pour le forum du G20, où il a déjà eu des entretiens avec son homologue indien Subrahmanyam Jaishankar, le ministre turc des Affaires étrangères Mevlut Cavusoglu et de nombreux autres diplomates de haut niveau.","[[[""Le ministre russe des Affaires étrangères tient ce 2 mars une conférence de presse à l'issue de sa rencontre avec le Premier ministre indien Narendra Modi à New Delhi.""], ['Le ministre russe y est en visite officielle de deux jours pour le forum du G20, où il a déjà eu des entretiens avec son homologue indien Subrahmanyam Jaishankar, le ministre turc des Affaires étrangères Mevlut Cavusoglu et de nombreux autres diplomates de haut niveau.']]]","[[['ministre', 'russe', 'affaires', 'étrangères', 'mars', 'conférence', 'presse', 'issue', 'rencontre', 'ministre', 'indien', 'narendra', 'modi', 'new', 'delhi'], ['ministre', 'russe', 'visite', 'officielle', 'jours', 'forum', 'entretiens', 'homologue', 'indien', 'ministre', 'turc', 'affaires', 'étrangères', 'mevlut', 'cavusoglu', 'diplomates', 'haut', 'niveau']]]","[[['New Delhi'], []]]","[[['ministre russe des Affaires étrangères'], ['G20', 'ministre turc des Affaires']]]","[[['Narendra Modi'], ['Subrahmanyam Jaishankar', 'Mevlut Cavusoglu']]]","{'ministre': 4, 'russe': 2, 'affaires': 2, 'étrangères': 2, 'mars': 1, 'conférence': 1, 'presse': 1, 'issue': 1, 'rencontre': 1, 'indien': 2, 'narendra': 1, 'modi': 1, 'new': 1, 'delhi': 1, 'visite': 1, 'officielle': 1, 'jours': 1, 'forum': 1, 'entretiens': 1, 'homologue': 1, 'turc': 1, 'mevlut': 1, 'cavusoglu': 1, 'diplomates': 1, 'haut': 1, 'niveau': 1}",{'New Delhi': 1},"{'ministre russe des Affaires étrangères': 1, 'G20': 1, 'ministre turc des Affaires': 1}","{'Narendra Modi': 1, 'Subrahmanyam Jaishankar': 1, 'Mevlut Cavusoglu': 1}",2023,3,1
