timestamp,url,title,description,content,content-segmented,kws-l,loc-l,org-l,per-l,kws,loc,org,per,year,month,day
1680904800,https://fr.sputniknews.africa/20230408/fuite-du-pentagone-le-fruit-de-frustrations-face-a-ladministration-biden-1058450478.html,"Fuite du Pentagone: le fruit de ""frustrations face à l’administration Biden""","La récente fuite de documents du Pentagone témoigne de l’agacement de certaines personnes face aux desiderata de l’administration Biden sur le dossier ukrainien, explique à Sputnik Karen Kwiatkowski, gradée à la retraite et ancienne...","Alors que plusieurs documents du Pentagone relatifs au conflit ukrainien ont filtré sur les réseaux sociaux, les observateurs s’interrogent sur les sources de cette fuite et leurs motivations. Pour Karen Kwiatkowski, ancienne analyste du département américain de la Défense, l’incident symbolise surtout une forme de mécontentement vis-à-vis de Washington.""Cette fuite m’évoque une frustration de militaires ou d’employés vis-à-vis de l'administration Biden et de son exigence d'une victoire américaine contre la Russie, laquelle n’est aucunement possible. Cela pourrait aussi être la frustration d’agents des renseignements face aux exigences d'une production façonnée et adaptée, une production qui élimine l'analyse objective pour s'aligner sur les désirs politiques de l'administration et les soutenir"", déclare-t-elle ainsi à Sputnik.L’officier à la retraite estime que ces fuites pourraient bénéficier à la Russie, lui permettant de confirmer ou de corriger les données de ses services de renseignement sur l’état des forces ukrainiennes. Cela permet aussi à Moscou d’évaluer la qualité des renseignements américains.""Sur le plan du contenu, les fuites peuvent confirmer ou infirmer les données russes sur les livraisons d’armes à l’Ukraine, sur leur état, sur le statut de formation des opérateurs ukrainiens, et elles peuvent donner une idée de l'intérêt stratégique des États-Unis pour le champ de bataille ukrainien"", explique ainsi Karen Kwiatkowski.Rien sur une contre-offensive printanièreL’ancienne analyste note encore que les fuites ne parlent d’aucun soutien américain à une contre-offensive ukrainienne au printemps, alors que ce scénario a été évoqué dans les médias occidentaux. Les fuites précisent simplement que l’état des sols reste boueux d’avril à début mai en Ukraine.La fuite renseigne également sur l’état de SIPRNet, le système reliant les réseaux du Pentagone et du département d'État, qui permettent d’échanger des informations confidentielles, souligne Karen Kwiatkowski. Si les informations ont été sorties en copie papier, cela signifierait que la sécurité du système est efficace. SIPRNet reste en effet scruté de près après une mise à jour récente confiée à Booz Allen Hamilton, société dont le lanceur d’alerte Edward Snowden fut un temps employé.Dans tous les cas, le Pentagone risque désormais de se lancer dans une ""chasse aux sorcières"" pour trouver le ou les responsable(s) de la fuite, affirme Mme Kwiatkowski.Le 6 avril dernier, des documents confidentiels détaillant les plans de l’Otan et des États-Unis en Ukraine étaient apparus sur les réseaux sociaux Twitter et Telegram. Ils dévoilaient notamment un calendrier de livraisons d’armes et affirmaient que 12 brigades de combat ukrainiennes étaient en cours de formation, comptant 4.000 à 5.000 hommes chacune.De nouvelles fuites ont été constatées le 7 avril, ayant trait encore une fois à l’Ukraine mais aussi au Moyen-Orient et à la Chine.","[[['Alors que plusieurs documents du Pentagone relatifs au conflit ukrainien ont filtré sur les réseaux sociaux, les observateurs s’interrogent sur les sources de cette fuite et leurs motivations.'], ['Pour Karen Kwiatkowski, ancienne analyste du département américain de la Défense, l’incident symbolise surtout une forme de mécontentement vis-à-vis de Washington.'], ['""Cette fuite m’évoque une frustration de militaires ou d’employés vis-à-vis de l\'administration Biden et de son exigence d\'une victoire américaine contre la Russie, laquelle n’est aucunement possible.'], ['Cela pourrait aussi être la frustration d’agents des renseignements face aux exigences d\'une production façonnée et adaptée, une production qui élimine l\'analyse objective pour s\'aligner sur les désirs politiques de l\'administration et les soutenir"", déclare-t-elle ainsi à Sputnik.L’officier à la retraite estime que ces fuites pourraient bénéficier à la Russie, lui permettant de confirmer ou de corriger les données de ses services de renseignement sur l’état des forces ukrainiennes.'], ['Cela permet aussi à Moscou d’évaluer la qualité des renseignements américains.'], ['""Sur le plan du contenu, les fuites peuvent confirmer ou infirmer les données russes sur les livraisons d’armes à l’Ukraine, sur leur état, sur le statut de formation des opérateurs ukrainiens, et elles peuvent donner une idée de l\'intérêt stratégique des États-Unis pour le champ de bataille ukrainien"", explique ainsi Karen Kwiatkowski.Rien sur une contre-offensive printanièreL’ancienne analyste note encore que les fuites ne parlent d’aucun soutien américain à une contre-offensive ukrainienne au printemps, alors que ce scénario a été évoqué dans les médias occidentaux.'], [""Les fuites précisent simplement que l’état des sols reste boueux d’avril à début mai en Ukraine.La fuite renseigne également sur l’état de SIPRNet, le système reliant les réseaux du Pentagone et du département d'État, qui permettent d’échanger des informations confidentielles, souligne Karen Kwiatkowski.""], ['Si les informations ont été sorties en copie papier, cela signifierait que la sécurité du système est efficace.'], ['SIPRNet reste en effet scruté de près après une mise à jour récente confiée à Booz Allen Hamilton, société dont le lanceur d’alerte Edward Snowden fut un temps employé.Dans tous les cas, le Pentagone risque désormais de se lancer dans une ""chasse aux sorcières"" pour trouver le ou les responsable(s) de la fuite, affirme Mme Kwiatkowski.Le 6 avril dernier, des documents confidentiels détaillant les plans de l’Otan et des États-Unis en Ukraine étaient apparus sur les réseaux sociaux Twitter et Telegram.'], ['Ils dévoilaient notamment un calendrier de livraisons d’armes et affirmaient que 12 brigades de combat ukrainiennes étaient en cours de formation, comptant 4.000 à 5.000 hommes chacune.De nouvelles fuites ont été constatées le 7 avril, ayant trait encore une fois à l’Ukraine mais aussi au Moyen-Orient et à la Chine.']]]","[[['documents', 'pentagone', 'relatifs', 'conflit', 'ukrainien', 'réseaux', 'sociaux', 'observateurs', 'sources', 'fuite', 'motivations'], ['karen', 'kwiatkowski', 'ancienne', 'analyste', 'département', 'américain', 'défense', 'incident', 'forme', 'mécontentement', 'washington'], ['fuite', 'frustration', 'militaires', 'employés', 'administration', 'biden', 'exigence', 'victoire', 'américaine', 'russie'], ['frustration', 'agents', 'renseignements', 'face', 'exigences', 'production', 'production', 'analyse', 'objective', 'désirs', 'politiques', 'administration', 'officier', 'retraite', 'fuites', 'russie', 'données', 'services', 'renseignement', 'état', 'forces', 'ukrainiennes'], ['moscou', 'qualité', 'renseignements', 'américains'], ['plan', 'contenu', 'fuites', 'données', 'russes', 'livraisons', 'armes', 'ukraine', 'état', 'statut', 'formation', 'opérateurs', 'ukrainiens', 'idée', 'intérêt', 'stratégique', 'champ', 'bataille', 'ukrainien', 'karen', 'ancienne', 'analyste', 'fuites', 'soutien', 'américain', 'ukrainienne', 'printemps', 'scénario', 'médias', 'occidentaux'], ['fuites', 'état', 'sols', 'boueux', 'avril', 'début', 'mai', 'fuite', 'état', 'siprnet', 'système', 'réseaux', 'pentagone', 'département', 'état', 'informations', 'confidentielles', 'karen', 'kwiatkowski'], ['informations', 'copie', 'papier', 'sécurité', 'système', 'efficace'], ['siprnet', 'mise', 'jour', 'récente', 'booz', 'allen', 'hamilton', 'société', 'lanceur', 'alerte', 'temps', 'cas', 'pentagone', 'chasse', 'sorcières', 'fuite', 'mme', 'avril', 'dernier', 'documents', 'confidentiels', 'plans', 'otan', 'ukraine', 'réseaux', 'sociaux', 'twitter', 'telegram'], ['calendrier', 'livraisons', 'armes', 'brigades', 'combat', 'ukrainiennes', 'cours', 'formation', 'hommes', 'nouvelles', 'fuites', 'avril', 'trait', 'fois', 'ukraine', 'chine']]]","[[['Pentagone'], ['Washington'], ['Russie'], ['Russie'], ['Moscou'], ['Ukraine', 'États-Unis'], ['Ukraine', 'Pentagone', ""département d'État""], [], ['Pentagone', 'États-Unis', 'Ukraine'], ['Ukraine', 'Moyen-Orient', 'Chine']]]","[[[], [], [], ['Sputnik'], [], [], [], [], ['Otan'], []]]","[[[], ['Karen Kwiatkowski'], ['Biden'], [], [], ['Karen Kwiatkowski'], ['Karen Kwiatkowski'], [], ['Booz Allen Hamilton', 'Edward Snowden', 'Mme Kwiatkowski'], []]]","{'documents': 2, 'pentagone': 3, 'relatifs': 1, 'conflit': 1, 'ukrainien': 2, 'réseaux': 3, 'sociaux': 2, 'observateurs': 1, 'sources': 1, 'fuite': 4, 'motivations': 1, 'karen': 3, 'kwiatkowski': 2, 'ancienne': 2, 'analyste': 2, 'département': 2, 'américain': 2, 'défense': 1, 'incident': 1, 'forme': 1, 'mécontentement': 1, 'washington': 1, 'frustration': 2, 'militaires': 1, 'employés': 1, 'administration': 2, 'biden': 1, 'exigence': 1, 'victoire': 1, 'américaine': 1, 'russie': 2, 'agents': 1, 'renseignements': 2, 'face': 1, 'exigences': 1, 'production': 2, 'analyse': 1, 'objective': 1, 'désirs': 1, 'politiques': 1, 'officier': 1, 'retraite': 1, 'fuites': 5, 'données': 2, 'services': 1, 'renseignement': 1, 'état': 5, 'forces': 1, 'ukrainiennes': 2, 'moscou': 1, 'qualité': 1, 'américains': 1, 'plan': 1, 'contenu': 1, 'russes': 1, 'livraisons': 2, 'armes': 2, 'ukraine': 3, 'statut': 1, 'formation': 2, 'opérateurs': 1, 'ukrainiens': 1, 'idée': 1, 'intérêt': 1, 'stratégique': 1, 'champ': 1, 'bataille': 1, 'soutien': 1, 'ukrainienne': 1, 'printemps': 1, 'scénario': 1, 'médias': 1, 'occidentaux': 1, 'sols': 1, 'boueux': 1, 'avril': 3, 'début': 1, 'mai': 1, 'siprnet': 2, 'système': 2, 'informations': 2, 'confidentielles': 1, 'copie': 1, 'papier': 1, 'sécurité': 1, 'efficace': 1, 'mise': 1, 'jour': 1, 'récente': 1, 'booz': 1, 'allen': 1, 'hamilton': 1, 'société': 1, 'lanceur': 1, 'alerte': 1, 'temps': 1, 'cas': 1, 'chasse': 1, 'sorcières': 1, 'mme': 1, 'dernier': 1, 'confidentiels': 1, 'plans': 1, 'otan': 1, 'twitter': 1, 'telegram': 1, 'calendrier': 1, 'brigades': 1, 'combat': 1, 'cours': 1, 'hommes': 1, 'nouvelles': 1, 'trait': 1, 'fois': 1, 'chine': 1}","{'Pentagone': 3, 'Washington': 1, 'Russie': 2, 'Moscou': 1, 'Ukraine': 4, 'États-Unis': 2, ""département d'État"": 1, 'Moyen-Orient': 1, 'Chine': 1}","{'Sputnik': 1, 'Otan': 1}","{'Karen Kwiatkowski': 3, 'Biden': 1, 'Booz Allen Hamilton': 1, 'Edward Snowden': 1, 'Mme Kwiatkowski': 1}",2023,4,7
1680904800,https://fr.sputniknews.africa/20230408/la-flambee-des-prix-de-loignon-fait-pleurer-les-algeriens-1058443840.html,La flambée des prix de l’oignon fait pleurer les Algériens,Certains produits alimentaires sont devenus inabordables en Algérie depuis plusieurs jours. La sécheresse a notamment mis à rude épreuve les plantations d’oignons.,"Un Ramadan placé sous le signe de l’inflation. Alors que le jeûne rituel musulman a débuté fin mars, les Algériens ont de quoi pleurer devant le prix de certains fruits et légumes. L’inflation touche en effet plusieurs produits agricoles, dont l’oignon, devenus inabordables, rapporte le média Tout Sur l’Algérie (TSA).L’oignon rouge a ainsi dépassé la barre des 300 dinars (près de deux euros), contre 60 dinars l’an dernier durant la période du Ramadan. Une augmentation qui s’explique par la sécheresse qui a réduit le rendement des cultures.""La culture de l’oignon a besoin de beaucoup d’eau. Avec la sécheresse qui sévit dans le pays et le manque d’eau, la production devient difficile. Il faut trouver des solutions au manque d’eau, comme par exemple, la création de retenues colinéaires pour capter et stocker la pluie. Se contenter des barrages uniquement pour l’irrigation et l’alimentation en eau potable des populations est insuffisant"", explique un agriculteur à TSA.Un mois de janvier pauvre en précipitations, en particulier dans le nord du pays, n’a ainsi pas permis de reconstituer les nappes phréatiques ou de remplir suffisamment les retenues d’eau des barrages. Les spécialistes espèrent désormais que les oignons de printemps, dont la récolte arrivera en avril, pourront faire baisser un peu les prix.Le Maghreb entier face à la sécheresseLa sécheresse actuelle a un impact certain sur l’Afrique du nord entière, au-delà des frontières algériennes. La Tunisie est notamment durement frappée et a dû instaurer des restrictions d’eau, fin mars. Le nettoyage des rues et l’arrosage de certains espaces verts y est désormais prohibé. Tunis s’attend en outre à des récoltes céréalières très difficiles, sans doute inférieures d’un tiers à l’an dernier.Déjà rudement frappé l’an dernier, le Maroc tente pour sa part de miser sur de nouvelles variétés de blé et d’orge, plus résistantes à la chaleur. Un programme scientifique en ce sens a été lancé par le Centre international de recherche agricole dans les zones arides (l’ICARDA).Rabat a également investi dans le dessalement, espérant bientôt traiter un milliard de m3 d’eau de mer par an. En août dernier, le taux de remplissage des barrages du Royaume chérifien n’atteignait même pas 30%. Le Maroc avait alors vécu sa pire sécheresse depuis près de 40 ans.","[[['Un Ramadan placé sous le signe de l’inflation.'], ['Alors que le jeûne rituel musulman a débuté fin mars, les Algériens ont de quoi pleurer devant le prix de certains fruits et légumes.'], ['L’inflation touche en effet plusieurs produits agricoles, dont l’oignon, devenus inabordables, rapporte le média Tout Sur l’Algérie (TSA).L’oignon rouge a ainsi dépassé la barre des 300 dinars (près de deux euros), contre 60 dinars l’an dernier durant la période du Ramadan.'], ['Une augmentation qui s’explique par la sécheresse qui a réduit le rendement des cultures.'], ['""La culture de l’oignon a besoin de beaucoup d’eau.'], ['Avec la sécheresse qui sévit dans le pays et le manque d’eau, la production devient difficile.'], ['Il faut trouver des solutions au manque d’eau, comme par exemple, la création de retenues colinéaires pour capter et stocker la pluie.'], ['Se contenter des barrages uniquement pour l’irrigation et l’alimentation en eau potable des populations est insuffisant"", explique un agriculteur à TSA.Un mois de janvier pauvre en précipitations, en particulier dans le nord du pays, n’a ainsi pas permis de reconstituer les nappes phréatiques ou de remplir suffisamment les retenues d’eau des barrages.'], ['Les spécialistes espèrent désormais que les oignons de printemps, dont la récolte arrivera en avril, pourront faire baisser un peu les prix.Le Maghreb entier face à la sécheresseLa sécheresse actuelle a un impact certain sur l’Afrique du nord entière, au-delà des frontières algériennes.'], ['La Tunisie est notamment durement frappée et a dû instaurer des restrictions d’eau, fin mars.'], ['Le nettoyage des rues et l’arrosage de certains espaces verts y est désormais prohibé.'], ['Tunis s’attend en outre à des récoltes céréalières très difficiles, sans doute inférieures d’un tiers à l’an dernier.Déjà rudement frappé l’an dernier, le Maroc tente pour sa part de miser sur de nouvelles variétés de blé et d’orge, plus résistantes à la chaleur.'], ['Un programme scientifique en ce sens a été lancé par le Centre international de recherche agricole dans les zones arides (l’ICARDA).Rabat a également investi dans le dessalement, espérant bientôt traiter un milliard de m3 d’eau de mer par an.'], ['En août dernier, le taux de remplissage des barrages du Royaume chérifien n’atteignait même pas 30%.'], ['Le Maroc avait alors vécu sa pire sécheresse depuis près de 40 ans.']]]","[[['ramadan', 'signe', 'inflation'], ['jeûne', 'rituel', 'musulman', 'fin', 'mars', 'algériens', 'prix', 'fruits', 'légumes'], ['inflation', 'touche', 'produits', 'agricoles', 'oignon', 'inabordables', 'média', 'algérie', 'rouge', 'barre', 'dinars', 'euros', 'dinars', 'an', 'dernier', 'période', 'ramadan'], ['augmentation', 'sécheresse', 'rendement', 'cultures'], ['culture', 'oignon', 'besoin', 'eau'], ['sécheresse', 'pays', 'manque', 'eau', 'production', 'difficile'], ['solutions', 'manque', 'eau', 'exemple', 'création', 'retenues', 'colinéaires', 'pluie'], ['barrages', 'irrigation', 'alimentation', 'eau', 'potable', 'populations', 'insuffisant', 'agriculteur', 'mois', 'janvier', 'pauvre', 'précipitations', 'particulier', 'nord', 'pays', 'nappes', 'phréatiques', 'retenues', 'eau', 'barrages'], ['spécialistes', 'oignons', 'printemps', 'récolte', 'avril', 'maghreb', 'entier', 'face', 'sécheressela', 'sécheresse', 'actuelle', 'impact', 'afrique', 'nord', 'entière', 'frontières', 'algériennes'], ['tunisie', 'restrictions', 'eau', 'fin', 'mars'], ['nettoyage', 'rues', 'arrosage', 'espaces', 'verts'], ['tunis', 'récoltes', 'céréalières', 'difficiles', 'doute', 'inférieures', 'tiers', 'an', 'an', 'dernier', 'maroc', 'part', 'nouvelles', 'variétés', 'blé', 'orge', 'résistantes', 'chaleur'], ['programme', 'scientifique', 'sens', 'centre', 'international', 'recherche', 'agricole', 'zones', 'arides', 'milliard', 'eau', 'mer', 'an'], ['août', 'dernier', 'taux', 'remplissage', 'barrages', 'royaume', 'chérifien'], ['maroc', 'pire', 'ans']]]","[[[], ['Algérie'], [], [], [], [], [], ['TSA.Un'], ['Maghreb', 'sécheresseLa', 'l’Afrique'], ['Tunisie'], [], ['Tunis', 'Maroc'], [], ['Royaume'], ['Maroc']]]","[[[], [], [], [], [], [], [], [], [], [], [], [], ['Centre international de recherche agricole'], [], []]]","[[['Ramadan'], [], ['Ramadan'], [], [], [], [], [], [], [], [], [], ['ICARDA).Rabat'], [], []]]","{'ramadan': 2, 'signe': 1, 'inflation': 2, 'jeûne': 1, 'rituel': 1, 'musulman': 1, 'fin': 2, 'mars': 2, 'algériens': 1, 'prix': 1, 'fruits': 1, 'légumes': 1, 'touche': 1, 'produits': 1, 'agricoles': 1, 'oignon': 2, 'inabordables': 1, 'média': 1, 'algérie': 1, 'rouge': 1, 'barre': 1, 'dinars': 2, 'euros': 1, 'an': 4, 'dernier': 3, 'période': 1, 'augmentation': 1, 'sécheresse': 3, 'rendement': 1, 'cultures': 1, 'culture': 1, 'besoin': 1, 'eau': 7, 'pays': 2, 'manque': 2, 'production': 1, 'difficile': 1, 'solutions': 1, 'exemple': 1, 'création': 1, 'retenues': 2, 'colinéaires': 1, 'pluie': 1, 'barrages': 3, 'irrigation': 1, 'alimentation': 1, 'potable': 1, 'populations': 1, 'insuffisant': 1, 'agriculteur': 1, 'mois': 1, 'janvier': 1, 'pauvre': 1, 'précipitations': 1, 'particulier': 1, 'nord': 2, 'nappes': 1, 'phréatiques': 1, 'spécialistes': 1, 'oignons': 1, 'printemps': 1, 'récolte': 1, 'avril': 1, 'maghreb': 1, 'entier': 1, 'face': 1, 'sécheressela': 1, 'actuelle': 1, 'impact': 1, 'afrique': 1, 'entière': 1, 'frontières': 1, 'algériennes': 1, 'tunisie': 1, 'restrictions': 1, 'nettoyage': 1, 'rues': 1, 'arrosage': 1, 'espaces': 1, 'verts': 1, 'tunis': 1, 'récoltes': 1, 'céréalières': 1, 'difficiles': 1, 'doute': 1, 'inférieures': 1, 'tiers': 1, 'maroc': 2, 'part': 1, 'nouvelles': 1, 'variétés': 1, 'blé': 1, 'orge': 1, 'résistantes': 1, 'chaleur': 1, 'programme': 1, 'scientifique': 1, 'sens': 1, 'centre': 1, 'international': 1, 'recherche': 1, 'agricole': 1, 'zones': 1, 'arides': 1, 'milliard': 1, 'mer': 1, 'août': 1, 'taux': 1, 'remplissage': 1, 'royaume': 1, 'chérifien': 1, 'pire': 1, 'ans': 1}","{'Algérie': 1, 'TSA.Un': 1, 'Maghreb': 1, 'sécheresseLa': 1, 'l’Afrique': 1, 'Tunisie': 1, 'Tunis': 1, 'Maroc': 2, 'Royaume': 1}",{'Centre international de recherche agricole': 1},"{'Ramadan': 2, 'ICARDA).Rabat': 1}",2023,4,7
