timestamp,url,title,description,content,content-segmented,kws-l,loc-l,org-l,per-l,kws,loc,org,per,year,month,day
1673996400,https://fr.sputniknews.africa/20230118/coupe-gorges-les-pays-les-plus-dangereux-en-2023-1057639780.html,Coupe-gorges: les pays les plus dangereux en 2023,Les pays ayant le plus haut taux de criminalité en 2023 ont été répertoriés par une étude du portail World Population Review. L’Afrique compte un très mauvais élève.,"Un classement des pays les plus dangereux du monde, en se fondant sur leur taux de criminalité, a été révélé par le portail World Population Review. Parmi ces lieux pas toujours paradisiaques, le Venezuela arrive en tête avec 83,76 crimes pour 100.000 habitants. Le système judiciaire défectueux et la corruption galopante explique en partie ce résultat, selon le portail.Sur le podium, on retrouve également la Papouasie-Nouvelle-Guinée (80,7 crimes), gangrénée par le trafic de drogue. La troisième place est occupée par un pays africain: l’Afrique du Sud (76,8 crimes). La Nation arc-en-ciel souffre d’un nombre très élevé d’agressions, d’homicides et de viols. C’est même la championne du monde dans cette dernière catégorie. En 2009, une étude du Conseil sud-africain de la recherche médicale révélait qu’un habitant du pays sur quatre admettait avoir commis un viol.D’autres pays d’Amérique du Sud et centrale monopolise le top-10, comme le Honduras, le Salvador ou le Brésil. Là encore, le trafic de drogues et les crimes commis par les cartels ou les bandes organisées font décoller les statistiques.Pauvreté, âge et… lumière?S’il est toujours délicat de circonscrire les causes de la criminalité, World Population Review souligne que des taux élevés de chômage et de pauvreté accentuent généralement la tendance. L’âge est aussi une donnée importante, les crimes violents étant souvent commis par des individus âgés de 20 à 30 ans. Une police efficace et une application stricte des peines peuvent au contraire réduire le taux de criminalité.La limitation de l’accès aux armes à feu est aussi une variante importante. Le Danemark, la Norvège et le Japon ont ainsi des taux de criminalités très bas et disposent de lois sur les armes parmi les plus restrictives du monde.Enfin, d’autres facteurs plus insolites entrent parfois en jeu. L’actuelle crise de l’énergie inquiète par exemple la police espagnole, qui estime que l’extinction de lumières dans les rues pose un problème de sécurité, particulièrement pour les femmes.","[[['Un classement des pays les plus dangereux du monde, en se fondant sur leur taux de criminalité, a été révélé par le portail World Population Review.'], ['Parmi ces lieux pas toujours paradisiaques, le Venezuela arrive en tête avec 83,76 crimes pour 100.000 habitants.'], ['Le système judiciaire défectueux et la corruption galopante explique en partie ce résultat, selon le portail.Sur le podium, on retrouve également la Papouasie-Nouvelle-Guinée (80,7 crimes), gangrénée par le trafic de drogue.'], ['La troisième place est occupée par un pays africain: l’Afrique du Sud (76,8 crimes).'], ['La Nation arc-en-ciel souffre d’un nombre très élevé d’agressions, d’homicides et de viols.'], ['C’est même la championne du monde dans cette dernière catégorie.'], ['En 2009, une étude du Conseil sud-africain de la recherche médicale révélait qu’un habitant du pays sur quatre admettait avoir commis un viol.D’autres pays d’Amérique du Sud et centrale monopolise le top-10, comme le Honduras, le Salvador ou le Brésil.'], ['Là encore, le trafic de drogues et les crimes commis par les cartels ou les bandes organisées font décoller les statistiques.Pauvreté, âge et… lumière?S’il est toujours délicat de circonscrire les causes de la criminalité, World Population Review souligne que des taux élevés de chômage et de pauvreté accentuent généralement la tendance.'], ['L’âge est aussi une donnée importante, les crimes violents étant souvent commis par des individus âgés de 20 à 30 ans.'], ['Une police efficace et une application stricte des peines peuvent au contraire réduire le taux de criminalité.La limitation de l’accès aux armes à feu est aussi une variante importante.'], ['Le Danemark, la Norvège et le Japon ont ainsi des taux de criminalités très bas et disposent de lois sur les armes parmi les plus restrictives du monde.Enfin, d’autres facteurs plus insolites entrent parfois en jeu.'], ['L’actuelle crise de l’énergie inquiète par exemple la police espagnole, qui estime que l’extinction de lumières dans les rues pose un problème de sécurité, particulièrement pour les femmes.']]]","[[['classement', 'pays', 'dangereux', 'monde', 'taux', 'criminalité', 'portail', 'population', 'review'], ['lieux', 'paradisiaques', 'venezuela', 'tête', 'crimes', 'habitants'], ['système', 'judiciaire', 'défectueux', 'corruption', 'galopante', 'partie', 'résultat', 'podium', 'papouasie', 'nouvelle', 'guinée', 'crimes', 'trafic', 'drogue'], ['place', 'pays', 'africain', 'afrique', 'sud', 'crimes'], ['nation', 'nombre', 'élevé', 'agressions', 'homicides', 'viols'], ['championne', 'monde', 'dernière', 'catégorie'], ['étude', 'conseil', 'recherche', 'médicale', 'habitant', 'pays', 'pays', 'amérique', 'sud', 'centrale', 'honduras', 'salvador', 'brésil'], ['trafic', 'drogues', 'crimes', 'cartels', 'bandes', 'âge', 'délicat', 'causes', 'criminalité', 'world', 'population', 'taux', 'élevés', 'chômage', 'pauvreté', 'tendance'], ['âge', 'donnée', 'importante', 'crimes', 'violents', 'individus', 'âgés', 'ans'], ['police', 'efficace', 'application', 'stricte', 'peines', 'contraire', 'taux', 'limitation', 'accès', 'armes', 'feu', 'variante', 'importante'], ['danemark', 'norvège', 'japon', 'taux', 'criminalités', 'lois', 'armes', 'restrictives', 'facteurs', 'insolites', 'jeu'], ['actuelle', 'crise', 'énergie', 'inquiète', 'exemple', 'police', 'espagnole', 'extinction', 'lumières', 'rues', 'problème', 'sécurité', 'femmes']]]","[[[], ['Venezuela'], ['Papouasie-Nouvelle-Guinée'], ['Afrique du Sud'], [], [], ['Amérique du Sud', 'Honduras', 'Salvador', 'Brésil'], [], [], [], ['Danemark', 'Norvège'], []]]","[[['World Population Review'], [], [], [], ['Nation arc-en-ciel'], [], ['Conseil sud-africain de la recherche médicale'], ['World Population Review'], [], [], [], []]]","[[[], [], [], [], [], [], [], [], [], [], [], []]]","{'classement': 1, 'pays': 4, 'dangereux': 1, 'monde': 2, 'taux': 4, 'criminalité': 2, 'portail': 1, 'population': 2, 'review': 1, 'lieux': 1, 'paradisiaques': 1, 'venezuela': 1, 'tête': 1, 'crimes': 5, 'habitants': 1, 'système': 1, 'judiciaire': 1, 'défectueux': 1, 'corruption': 1, 'galopante': 1, 'partie': 1, 'résultat': 1, 'podium': 1, 'papouasie': 1, 'nouvelle': 1, 'guinée': 1, 'trafic': 2, 'drogue': 1, 'place': 1, 'africain': 1, 'afrique': 1, 'sud': 2, 'nation': 1, 'nombre': 1, 'élevé': 1, 'agressions': 1, 'homicides': 1, 'viols': 1, 'championne': 1, 'dernière': 1, 'catégorie': 1, 'étude': 1, 'conseil': 1, 'recherche': 1, 'médicale': 1, 'habitant': 1, 'amérique': 1, 'centrale': 1, 'honduras': 1, 'salvador': 1, 'brésil': 1, 'drogues': 1, 'cartels': 1, 'bandes': 1, 'âge': 2, 'délicat': 1, 'causes': 1, 'world': 1, 'élevés': 1, 'chômage': 1, 'pauvreté': 1, 'tendance': 1, 'donnée': 1, 'importante': 2, 'violents': 1, 'individus': 1, 'âgés': 1, 'ans': 1, 'police': 2, 'efficace': 1, 'application': 1, 'stricte': 1, 'peines': 1, 'contraire': 1, 'limitation': 1, 'accès': 1, 'armes': 2, 'feu': 1, 'variante': 1, 'danemark': 1, 'norvège': 1, 'japon': 1, 'criminalités': 1, 'lois': 1, 'restrictives': 1, 'facteurs': 1, 'insolites': 1, 'jeu': 1, 'actuelle': 1, 'crise': 1, 'énergie': 1, 'inquiète': 1, 'exemple': 1, 'espagnole': 1, 'extinction': 1, 'lumières': 1, 'rues': 1, 'problème': 1, 'sécurité': 1, 'femmes': 1}","{'Venezuela': 1, 'Papouasie-Nouvelle-Guinée': 1, 'Afrique du Sud': 1, 'Amérique du Sud': 1, 'Honduras': 1, 'Salvador': 1, 'Brésil': 1, 'Danemark': 1, 'Norvège': 1}","{'World Population Review': 2, 'Nation arc-en-ciel': 1, 'Conseil sud-africain de la recherche médicale': 1}",{},2023,1,17
1673996400,https://fr.sputniknews.africa/20230118/le-patron-de-larmee-algerienne-a-paris-fin-janvier-selon-une-source-militaire-1057639446.html,"Le patron de l'armée algérienne à Paris fin janvier, selon une source militaire","Le chef d'état-major algérien Saïd Chengriha est attendu ""à la fin du mois de janvier"" à Paris, où il rencontrera son homologue Thierry Burkhard pour préparer la visite du président algérien prévue en mai, a indiqué mercredi à l'AFP une...","Cette rencontre est hautement symbolique alors qu'aucun patron de l'armée algérienne ne s'est rendu en France en visite officielle depuis près de 17 ans. La dernière visite d'un chef d'état-major algérien en France remonte en effet à Gaïd Saleh en mai 2006.M.Burkhard avait rencontré son homologue algérien les 25 et 26 août 2022 lors du voyage du président français Emmanuel Macron en Algérie. Les généraux avaient alors évoqué la situation sécuritaire au Sahel et abordé le renforcement de la coopération entre les armées algérienne et française.Outre la visite d'Etat du Président algérien, les deux chefs d'état-major devraient une nouvelle fois discuter fin janvier de la situation au Sahel.Parallèlement à cette rencontre, la secrétaire générale du ministère des Affaires étrangères Anne-Marie Descôtes se rendra en Algérie le 25 janvier ""à l'invitation de son homologue algérien, Amar Belani"", a indiqué mercredi le Quai d'Orsay à l'AFP. Le Président algérien Abdelmadjid Tebboune et son homologue français ont convenu dimanche, lors d'un entretien téléphonique, d'une visite à Paris en mai.Le chef d'Etat français espère poursuivre le travail de mémoire et de réconciliation entre les deux pays.","[[[""Cette rencontre est hautement symbolique alors qu'aucun patron de l'armée algérienne ne s'est rendu en France en visite officielle depuis près de 17 ans.""], [""La dernière visite d'un chef d'état-major algérien en France remonte en effet à Gaïd Saleh en mai 2006.M.Burkhard avait rencontré son homologue algérien les 25 et 26 août 2022 lors du voyage du président français Emmanuel Macron en Algérie.""], ['Les généraux avaient alors évoqué la situation sécuritaire au Sahel et abordé le renforcement de la coopération entre les armées algérienne et française.Outre la visite d\'Etat du Président algérien, les deux chefs d\'état-major devraient une nouvelle fois discuter fin janvier de la situation au Sahel.Parallèlement à cette rencontre, la secrétaire générale du ministère des Affaires étrangères Anne-Marie Descôtes se rendra en Algérie le 25 janvier ""à l\'invitation de son homologue algérien, Amar Belani"", a indiqué mercredi le Quai d\'Orsay à l\'AFP.'], [""Le Président algérien Abdelmadjid Tebboune et son homologue français ont convenu dimanche, lors d'un entretien téléphonique, d'une visite à Paris en mai.Le chef d'Etat français espère poursuivre le travail de mémoire et de réconciliation entre les deux pays.""]]]","[[['rencontre', 'symbolique', 'patron', 'armée', 'algérienne', 'france', 'visite', 'officielle', 'ans'], ['dernière', 'visite', 'chef', 'état', 'major', 'algérien', 'france', 'gaïd', 'mai', 'homologue', 'algérien', 'août', 'voyage', 'président', 'français', 'emmanuel', 'algérie'], ['généraux', 'situation', 'sécuritaire', 'sahel', 'renforcement', 'coopération', 'armées', 'algérienne', 'visite', 'etat', 'président', 'algérien', 'chefs', 'état', 'major', 'nouvelle', 'fois', 'fin', 'janvier', 'situation', 'rencontre', 'secrétaire', 'générale', 'ministère', 'affaires', 'étrangères', 'anne', 'algérie', 'janvier', 'invitation', 'homologue', 'algérien', 'belani', 'mercredi', 'quai', 'orsay', 'afp'], ['président', 'algérien', 'abdelmadjid', 'tebboune', 'homologue', 'français', 'dimanche', 'entretien', 'téléphonique', 'visite', 'paris', 'chef', 'etat', 'français', 'travail', 'mémoire', 'réconciliation', 'pays']]]","[[['France'], ['France', 'Algérie'], ['Sahel', 'Etat', 'Sahel', 'Algérie', ""Quai d'Orsay""], ['Paris']]]","[[[], [], ['ministère des Affaires', 'AFP'], ['Etat français']]]","[[[], ['Gaïd Saleh', 'Emmanuel Macron'], ['Anne-Marie Descôtes', 'Amar Belani'], ['Président', 'Abdelmadjid Tebboune']]]","{'rencontre': 2, 'symbolique': 1, 'patron': 1, 'armée': 1, 'algérienne': 2, 'france': 2, 'visite': 4, 'officielle': 1, 'ans': 1, 'dernière': 1, 'chef': 2, 'état': 2, 'major': 2, 'algérien': 5, 'gaïd': 1, 'mai': 1, 'homologue': 3, 'août': 1, 'voyage': 1, 'président': 3, 'français': 3, 'emmanuel': 1, 'algérie': 2, 'généraux': 1, 'situation': 2, 'sécuritaire': 1, 'sahel': 1, 'renforcement': 1, 'coopération': 1, 'armées': 1, 'etat': 2, 'chefs': 1, 'nouvelle': 1, 'fois': 1, 'fin': 1, 'janvier': 2, 'secrétaire': 1, 'générale': 1, 'ministère': 1, 'affaires': 1, 'étrangères': 1, 'anne': 1, 'invitation': 1, 'belani': 1, 'mercredi': 1, 'quai': 1, 'orsay': 1, 'afp': 1, 'abdelmadjid': 1, 'tebboune': 1, 'dimanche': 1, 'entretien': 1, 'téléphonique': 1, 'paris': 1, 'travail': 1, 'mémoire': 1, 'réconciliation': 1, 'pays': 1}","{'France': 2, 'Algérie': 2, 'Sahel': 2, 'Etat': 1, ""Quai d'Orsay"": 1, 'Paris': 1}","{'ministère des Affaires': 1, 'AFP': 1, 'Etat français': 1}","{'Gaïd Saleh': 1, 'Emmanuel Macron': 1, 'Anne-Marie Descôtes': 1, 'Amar Belani': 1, 'Président': 1, 'Abdelmadjid Tebboune': 1}",2023,1,17
1673996400,https://fr.sputniknews.africa/20230118/quels-ont-ete-les-meilleurs-footballeurs-africains-en-2022-1057639276.html,Quels ont été les meilleurs footballeurs africains en 2022?,"L’équipe-type de foot pour le continent africain en 2022 a été dévoilée par la Fédération internationale de l'histoire et des statistiques du football (IFFHS). Les Marocains sont plébiscités, dans le sillage de leur excellente Coupe du...","Après une année 2022 riche en rebondissements, conclue en apothéose par une Coupe du monde, l’heure est au bilan pour le petit monde du football. Les récompenses tombent et les ""meilleurs onze"" ont été dévoilés par la Fédération internationale de l'histoire et des statistiques du football (IFFHS).Sur le continent africain, l’équipe rêvée contient quelques surprises. Quatre Marocains font ainsi partie de la composition, après une Coupe du monde qui aura vu les Lions de l’Atlas se hisser en demi-finale, une première pour un pays africain. Sofyan Amrabat et Romain Saiss accompagnent ainsi la star du PSG Achraf Hakimi et le gardien Yassine Bounou, héros de la séance de tirs au but contre l’Espagne lors du mondial. Africa team of the year according to IFFHS. Thoughts? pic.twitter.com/bN7m64A1Ne— Eric Njiru (@EricNjiiru) January 17, 2023 Pas de surprise en attaque, où Mohamed Salah et Sadio Mané font presque partie des meubles. Le Sénégalais y trouvera peut-être une consolation après être passé tout près du Ballon d’Or (2e).Le meilleur buteur africain joue… en Serbie!À l’heure des comptes, l’IFFHS a aussi rendu hommage au meilleur buteur africain cette année, toutes compétitions confondues. Et surprise… il ne joue dans aucun des ""grands"" championnats européens, mais en Serbie! Le Capverdien de 31 ans Ricardo Gomes a ainsi totalisé 35 buts en 2022, tous avec son club du Partizan Belgrade.C’est donc plus que les pointures Mohamed Salah (29 buts) et Sadio Mané (33 buts), lequel doit décidément regretter d’avoir manqué le Mondial pour cause de blessure.Du côté des coaches, le sélectionneur marocain Walid Regragui fait très fort. Il est le troisième meilleur entraîneur national avec les Lions de l’Atlas, mais aussi le troisième entraîneur de club avec le Wydad Casablanca. Une double casquette qui lui permet de côtoyer des stars comme Pep Guardiola, Carlo Ancelotti ou Didier Deschamps au sommet de ces classements.Enfin, mention spéciale à l’Égyptien Mohamed Abdel Monsef, qui était en 2022 le second plus vieux joueur à évoluer dans les championnats notables. Le gardien de 45 ans garde encore et toujours les cages du club de l’Ittihad Alexandrie.","[[['Après une année 2022 riche en rebondissements, conclue en apothéose par une Coupe du monde, l’heure est au bilan pour le petit monde du football.'], ['Les récompenses tombent et les ""meilleurs onze"" ont été dévoilés par la Fédération internationale de l\'histoire et des statistiques du football (IFFHS).Sur le continent africain, l’équipe rêvée contient quelques surprises.'], ['Quatre Marocains font ainsi partie de la composition, après une Coupe du monde qui aura vu les Lions de l’Atlas se hisser en demi-finale, une première pour un pays africain.'], ['Sofyan Amrabat et Romain Saiss accompagnent ainsi la star du PSG Achraf Hakimi et le gardien Yassine Bounou, héros de la séance de tirs au but contre l’Espagne lors du mondial.'], ['Africa team of the year according to IFFHS.'], ['Thoughts?'], ['pic.twitter.com/bN7m64A1Ne— Eric Njiru (@EricNjiiru) January 17, 2023 Pas de surprise en attaque, où Mohamed Salah et Sadio Mané font presque partie des meubles.'], ['Le Sénégalais y trouvera peut-être une consolation après être passé tout près du Ballon d’Or (2e).Le meilleur buteur africain joue… en Serbie!À l’heure des comptes, l’IFFHS a aussi rendu hommage au meilleur buteur africain cette année, toutes compétitions confondues.'], ['Et surprise… il ne joue dans aucun des ""grands"" championnats européens, mais en Serbie!'], ['Le Capverdien de 31 ans Ricardo Gomes a ainsi totalisé 35 buts en 2022, tous avec son club du Partizan Belgrade.C’est donc plus que les pointures Mohamed Salah (29 buts) et Sadio Mané (33 buts), lequel doit décidément regretter d’avoir manqué le Mondial pour cause de blessure.Du côté des coaches, le sélectionneur marocain Walid Regragui fait très fort.'], ['Il est le troisième meilleur entraîneur national avec les Lions de l’Atlas, mais aussi le troisième entraîneur de club avec le Wydad Casablanca.'], ['Une double casquette qui lui permet de côtoyer des stars comme Pep Guardiola, Carlo Ancelotti ou Didier Deschamps au sommet de ces classements.Enfin, mention spéciale à l’Égyptien Mohamed Abdel Monsef, qui était en 2022 le second plus vieux joueur à évoluer dans les championnats notables.'], ['Le gardien de 45 ans garde encore et toujours les cages du club de l’Ittihad Alexandrie.']]]","[[['année', 'riche', 'rebondissements', 'apothéose', 'coupe', 'monde', 'heure', 'bilan', 'petit', 'monde', 'football'], ['récompenses', 'meilleurs', 'fédération', 'internationale', 'histoire', 'statistiques', 'football', 'continent', 'africain', 'équipe', 'rêvée', 'surprises'], ['marocains', 'partie', 'composition', 'coupe', 'monde', 'lions', 'atlas', 'pays', 'africain'], ['sofyan', 'amrabat', 'romain', 'saiss', 'star', 'psg', 'hakimi', 'gardien', 'yassine', 'bounou', 'héros', 'séance', 'tirs', 'but', 'espagne', 'mondial'], ['team'], ['thoughts'], ['eric', 'njiru', 'january', 'surprise', 'attaque', 'mohamed', 'salah', 'mané', 'partie', 'meubles'], ['sénégalais', 'consolation', 'ballon', 'meilleur', 'buteur', 'africain', 'heure', 'comptes', 'iffhs', 'hommage', 'meilleur', 'buteur', 'africain', 'année', 'compétitions'], ['surprise', 'grands', 'championnats', 'européens', 'serbie'], ['capverdien', 'ans', 'ricardo', 'gomes', 'buts', 'club', 'partizan', 'pointures', 'mohamed', 'salah', 'buts', 'sadio', 'mané', 'buts', 'mondial', 'cause', 'côté', 'coaches', 'sélectionneur', 'marocain', 'walid', 'regragui'], ['meilleur', 'entraîneur', 'national', 'lions', 'atlas', 'entraîneur', 'club', 'wydad', 'casablanca'], ['double', 'casquette', 'stars', 'pep', 'guardiola', 'carlo', 'ancelotti', 'didier', 'deschamps', 'sommet', 'mention', 'spéciale', 'égyptien', 'mohamed', 'second', 'vieux', 'joueur', 'championnats', 'notables'], ['gardien', 'ans', 'cages', 'club', 'ittihad', 'alexandrie']]]","[[[], [], ['Maroc'], ['l’Espagne'], [], [], [], ['Sénégal', 'Ballon d’Or', 'Serbie!À'], ['Serbie!'], ['Cabo Verde'], ['Wydad Casablanca'], ['Égypte'], []]]","[[[], [""Fédération internationale de l'histoire""], [], ['PSG'], ['Africa team of the year according to IFFHS'], [], [], [], [], ['Partizan Belgrade', 'Mondial'], ['Lions de l’Atlas'], [], ['club de l’Ittihad Alexandrie']]]","[[[], [], [], ['Romain Saiss', 'Achraf Hakimi', 'Yassine Bounou'], [], [], ['Eric Njiru', 'Mohamed Salah', 'Sadio Mané'], [], [], ['Ricardo Gomes', 'Mohamed Salah', 'Sadio Mané', 'Walid Regragui'], [], ['Pep Guardiola', 'Carlo Ancelotti', 'Didier Deschamps', 'Mohamed Abdel Monsef'], []]]","{'année': 2, 'riche': 1, 'rebondissements': 1, 'apothéose': 1, 'coupe': 2, 'monde': 3, 'heure': 2, 'bilan': 1, 'petit': 1, 'football': 2, 'récompenses': 1, 'meilleurs': 1, 'fédération': 1, 'internationale': 1, 'histoire': 1, 'statistiques': 1, 'continent': 1, 'africain': 4, 'équipe': 1, 'rêvée': 1, 'surprises': 1, 'marocains': 1, 'partie': 2, 'composition': 1, 'lions': 2, 'atlas': 2, 'pays': 1, 'sofyan': 1, 'amrabat': 1, 'romain': 1, 'saiss': 1, 'star': 1, 'psg': 1, 'hakimi': 1, 'gardien': 2, 'yassine': 1, 'bounou': 1, 'héros': 1, 'séance': 1, 'tirs': 1, 'but': 1, 'espagne': 1, 'mondial': 2, 'team': 1, 'thoughts': 1, 'eric': 1, 'njiru': 1, 'january': 1, 'surprise': 2, 'attaque': 1, 'mohamed': 3, 'salah': 2, 'mané': 2, 'meubles': 1, 'sénégalais': 1, 'consolation': 1, 'ballon': 1, 'meilleur': 3, 'buteur': 2, 'comptes': 1, 'iffhs': 1, 'hommage': 1, 'compétitions': 1, 'grands': 1, 'championnats': 2, 'européens': 1, 'serbie': 1, 'capverdien': 1, 'ans': 2, 'ricardo': 1, 'gomes': 1, 'buts': 3, 'club': 3, 'partizan': 1, 'pointures': 1, 'sadio': 1, 'cause': 1, 'côté': 1, 'coaches': 1, 'sélectionneur': 1, 'marocain': 1, 'walid': 1, 'regragui': 1, 'entraîneur': 2, 'national': 1, 'wydad': 1, 'casablanca': 1, 'double': 1, 'casquette': 1, 'stars': 1, 'pep': 1, 'guardiola': 1, 'carlo': 1, 'ancelotti': 1, 'didier': 1, 'deschamps': 1, 'sommet': 1, 'mention': 1, 'spéciale': 1, 'égyptien': 1, 'second': 1, 'vieux': 1, 'joueur': 1, 'notables': 1, 'cages': 1, 'ittihad': 1, 'alexandrie': 1}","{'Maroc': 1, 'l’Espagne': 1, 'Sénégal': 1, 'Ballon d’Or': 1, 'Serbie!À': 1, 'Serbie!': 1, 'Cabo Verde': 1, 'Wydad Casablanca': 1, 'Égypte': 1}","{""Fédération internationale de l'histoire"": 1, 'PSG': 1, 'Africa team of the year according to IFFHS': 1, 'Partizan Belgrade': 1, 'Mondial': 1, 'Lions de l’Atlas': 1, 'club de l’Ittihad Alexandrie': 1}","{'Romain Saiss': 1, 'Achraf Hakimi': 1, 'Yassine Bounou': 1, 'Eric Njiru': 1, 'Mohamed Salah': 2, 'Sadio Mané': 2, 'Ricardo Gomes': 1, 'Walid Regragui': 1, 'Pep Guardiola': 1, 'Carlo Ancelotti': 1, 'Didier Deschamps': 1, 'Mohamed Abdel Monsef': 1}",2023,1,17
