timestamp,url,title,description,content,content-segmented,kws-l,loc-l,org-l,per-l,kws,loc,org,per,year,month,day
1668380400,https://fr.sputniknews.africa/20221114/cop27-lafrique-du-sud-veut-une-application-rapide-du-principe-de-pertes-et-prejudices-1056820322.html,"COP27: l'Afrique du Sud veut une application rapide du principe de ""pertes et préjudices""",La ministre sud-africaine de l'Environnement a appelé les pays occidentaux à fournir un financement immédiat pour lutter contre les effets du changement climatique dans les pays d'Afrique.,"En marge de la Conférence sur le climat (COP27) qui bat son plein en Égypte, la ministre sud-africaine de l'Environnement, des Forêts et des Pêches, Barbara Creecy, a alerté ses confrères sur la nécessité de fournir immédiatement des financements dans le cadre de l'approche ""pertes et préjudices"". Ce sont les pays les plus riches de la planète qui devraient donner cet argent, et au plus vite, selon elle. Les nations industrialisées devraient tenir leurs engagements de mobiliser chaque année 100 milliards de dollars pour soutenir les financements climatiques dans les pays en développement et ""rétablir la confiance"", relate l'agence Ecofin. Elle les a aussi exhortées à assurer la restructuration de la dette internationale des pays africains en vue de leur faciliter l'accès aux marchés des capitaux. Un financement est également nécessaire pour soutenir les infrastructures endommagées par les intempéries et irriguer les cultures, selon Mme Creecy. Chine et Inde épargnées Cependant, la Chine et l'Inde, en tant qu'économies encore en développement, devraient être exclues de l'indemnisation des ""pertes et dommages"", a-t-elle souligné. Selon l'organisation Climate Policy Initiative, l'Afrique aurait besoin d'au moins 277 milliards de dollars par an en termes de financements climatiques. En réalité, elle n'arrive à mobiliser aujourd’hui que 30 milliards. Le continent a du mal à conquérir le marché international des capitaux en raison des notes peu optimistes des agences de notation. Celles-ci jugent risquées la majorité des entreprises africaines. L'expression ""pertes et préjudices"" climatiques englobe toutes les catastrophes résultant du réchauffement climatique, allant des cyclones et ouragans destructeurs aux sécheresses, désertifications et à la salinisation des sols.","[[['En marge de la Conférence sur le climat (COP27) qui bat son plein en Égypte, la ministre sud-africaine de l\'Environnement, des Forêts et des Pêches, Barbara Creecy, a alerté ses confrères sur la nécessité de fournir immédiatement des financements dans le cadre de l\'approche ""pertes et préjudices"".', 'Ce sont les pays les plus riches de la planète qui devraient donner cet argent, et au plus vite, selon elle.', 'Les nations industrialisées devraient tenir leurs engagements de mobiliser chaque année 100 milliards de dollars pour soutenir les financements climatiques dans les pays en développement et ""rétablir la confiance"", relate l\'agence Ecofin.', ""Elle les a aussi exhortées à assurer la restructuration de la dette internationale des pays africains en vue de leur faciliter l'accès aux marchés des capitaux."", 'Un financement est également nécessaire pour soutenir les infrastructures endommagées par les intempéries et irriguer les cultures, selon Mme Creecy.', 'Chine et Inde épargnées Cependant, la Chine et l\'Inde, en tant qu\'économies encore en développement, devraient être exclues de l\'indemnisation des ""pertes et dommages"", a-t-elle souligné.', ""Selon l'organisation Climate Policy Initiative, l'Afrique aurait besoin d'au moins 277 milliards de dollars par an en termes de financements climatiques."", ""En réalité, elle n'arrive à mobiliser aujourd’hui que 30 milliards."", 'Le continent a du mal à conquérir le marché international des capitaux en raison des notes peu optimistes des agences de notation.', 'Celles-ci jugent risquées la majorité des entreprises africaines.', 'L\'expression ""pertes et préjudices"" climatiques englobe toutes les catastrophes résultant du réchauffement climatique, allant des cyclones et ouragans destructeurs aux sécheresses, désertifications et à la salinisation des sols.']]]","[[['marge', 'conférence', 'climat', 'plein', 'égypte', 'ministre', 'environnement', 'forêt', 'pêche', 'barbara', 'creecy', 'confrère', 'nécessité', 'financement', 'cadre', 'approche', 'perte', 'préjudice'], ['pays', 'riche', 'planète', 'argent'], ['nation', 'engagement', 'année', 'milliard', 'dollar', 'financement', 'climatique', 'pays', 'développement', 'confiance', 'agence', 'ecofin'], ['restructuration', 'dette', 'international', 'pays', 'africain', 'vue', 'accès', 'marché', 'capital'], ['financement', 'nécessaire', 'infrastructure', 'intempérie', 'culture', 'mme', 'creecy'], ['chine', 'ind', 'chine', 'inde', 'économie', 'développement', 'indemnisation', 'perte', 'dommage'], ['organisation', 'climat', 'initiative', 'afrique', 'besoin', 'milliard', 'dollar', 'an', 'terme', 'financement', 'climatique'], ['réalité', 'milliard'], ['continent', 'mal', 'marché', 'international', 'capital', 'raison', 'note', 'optimiste', 'agence', 'notation'], ['risquer', 'majorité', 'entreprise', 'africain'], ['expression', 'perte', 'préjudice', 'climatique', 'catastrophe', 'réchauffement', 'climatique', 'cyclone', 'ouragan', 'destructeur', 'sécheresse', 'désertification', 'salinisation', 'sol']]]","[[['Égypte', 'Forêts', 'Pêches'], [], [], [], [], ['Chine', 'Inde', 'Chine', 'Inde'], ['Afrique'], [], [], [], []]]","[[['Conférence sur le climat'], [], [], [], [], [], ['Climate Policy'], [], [], [], []]]","[[['Barbara Creecy'], [], [], [], ['Mme Creecy'], [], [], [], [], [], []]]","{'marge': 1, 'conférence': 1, 'climat': 2, 'plein': 1, 'égypte': 1, 'ministre': 1, 'environnement': 1, 'forêt': 1, 'pêche': 1, 'barbara': 1, 'creecy': 2, 'confrère': 1, 'nécessité': 1, 'financement': 4, 'cadre': 1, 'approche': 1, 'perte': 3, 'préjudice': 2, 'pays': 3, 'riche': 1, 'planète': 1, 'argent': 1, 'nation': 1, 'engagement': 1, 'année': 1, 'milliard': 3, 'dollar': 2, 'climatique': 4, 'développement': 2, 'confiance': 1, 'agence': 2, 'ecofin': 1, 'restructuration': 1, 'dette': 1, 'international': 2, 'africain': 2, 'vue': 1, 'accès': 1, 'marché': 2, 'capital': 2, 'nécessaire': 1, 'infrastructure': 1, 'intempérie': 1, 'culture': 1, 'mme': 1, 'chine': 2, 'ind': 1, 'inde': 1, 'économie': 1, 'indemnisation': 1, 'dommage': 1, 'organisation': 1, 'initiative': 1, 'afrique': 1, 'besoin': 1, 'an': 1, 'terme': 1, 'réalité': 1, 'continent': 1, 'mal': 1, 'raison': 1, 'note': 1, 'optimiste': 1, 'notation': 1, 'risquer': 1, 'majorité': 1, 'entreprise': 1, 'expression': 1, 'catastrophe': 1, 'réchauffement': 1, 'cyclone': 1, 'ouragan': 1, 'destructeur': 1, 'sécheresse': 1, 'désertification': 1, 'salinisation': 1, 'sol': 1}","{'Égypte': 1, 'Forêts': 1, 'Pêches': 1, 'Chine': 2, 'Inde': 2, 'Afrique': 1}","{'Conférence sur le climat': 1, 'Climate Policy': 1}","{'Barbara Creecy': 1, 'Mme Creecy': 1}",2022,11,13
1668380400,https://fr.sputniknews.africa/20221114/un-sapeur-pompier-tombe-sur-un-boa-constrictor-dans-un-parking-a-auch---images-1056820139.html,Un sapeur-pompier tombe sur un boa constrictor dans un parking à Auch - images,"Une découverte plus qu’inattendue a été faite samedi dernier aux abords du bowling d’Auch, en Occitanie: un boa gigantesque. Сe serpent de 2,5 m rampait dans le parking de l’établissement.","La police nationale de Gers a eu besoin d’un coup de main de la part de l’équipe animalière pour une opération peu habituelle dans la commune française d’Auch. Un officier de direction du Sdis 32 ainsi qu’un sapeur-pompier volontaire sont tombés sur… un boa dans le parking du bowling local, raconte La Dépêche.Après s’être garé, il a aperçu une masse indistincte à l’entrée de l’établissement. En se rapprochant, l’homme a compris qu’il s’agissait d’un serpent.""D’après l’un de nos spécialistes, il s’agirait d’un boa empereur"", a expliqué le commandant Benjamin Gadal du Sdis 32.Autrement appelé boa constrictor, le serpent mesurait 2,5 mètres. Il a été transféré à l’ENVT, l’école nationale vétérinaire de Toulouse. On ignore pour le moment comment l’animal s’est retrouvé libre dans la ville. (https://t.co/d2nXwBhKEy): #Gers : Un boa empereur se baladait près du bowling, à Auch : Le premier qui est tombé nez à nez avec le serpent a dû avoir une belle frayeur. Ce samedi, la police nationale du Gers a été appelée à Auch après la.. https://t.co/WO7n6xywGr pic.twitter.com/G8VUldBnhK— Titrespresse.com (@titrespresse) November 13, 2022 Une détention légale?Si ce type de serpents est plus habitué à la chaleur de l’Amérique centrale qu’au temps de Gers, ces animaux sont en vente libre en France. Leur détention est toutefois réglementée.En lien avec l’arrêté du 8 octobre 2018, il est autorisé de détenir jusqu’à trois serpents de ce type librement, à condition qu’ils ne se retrouvent dans la nature. En outre, les propriétaires doivent disposer d’""un certificat de capacité"" et d’une autorisation spécifique.","[[['La police nationale de Gers a eu besoin d’un coup de main de la part de l’équipe animalière pour une opération peu habituelle dans la commune française d’Auch.', 'Un officier de direction du Sdis 32 ainsi qu’un sapeur-pompier volontaire sont tombés sur… un boa dans le parking du bowling local, raconte La Dépêche.Après s’être garé, il a aperçu une masse indistincte à l’entrée de l’établissement.', 'En se rapprochant, l’homme a compris qu’il s’agissait d’un serpent.', '""D’après l’un de nos spécialistes, il s’agirait d’un boa empereur"", a expliqué le commandant Benjamin Gadal du Sdis 32.Autrement appelé boa constrictor, le serpent mesurait 2,5 mètres.', 'Il a été transféré à l’ENVT, l’école nationale vétérinaire de Toulouse.', 'On ignore pour le moment comment l’animal s’est retrouvé libre dans la ville.', '(https://t.co/d2nXwBhKEy): #Gers : Un boa empereur se baladait près du bowling, à Auch : Le premier qui est tombé nez à nez avec le serpent a dû avoir une belle frayeur.', 'Ce samedi, la police nationale du Gers a été appelée à Auch après la.. https://t.co/WO7n6xywGr pic.twitter.com/G8VUldBnhK— Titrespresse.com (@titrespresse) November 13, 2022 Une détention légale?Si ce type de serpents est plus habitué à la chaleur de l’Amérique centrale qu’au temps de Gers, ces animaux sont en vente libre en France.', 'Leur détention est toutefois réglementée.En lien avec l’arrêté du 8 octobre 2018, il est autorisé de détenir jusqu’à trois serpents de ce type librement, à condition qu’ils ne se retrouvent dans la nature.', 'En outre, les propriétaires doivent disposer d’""un certificat de capacité"" et d’une autorisation spécifique.']]]","[[['police', 'national', 'ger', 'besoin', 'coup', 'main', 'part', 'équipe', 'animalier', 'opération', 'habituel', 'commune', 'français', 'auch'], ['officier', 'direction', 'sdis', 'sapeur', 'pompier', 'volontaire', 'boa', 'parking', 'bowling', 'local', 'masse', 'indistinct', 'entrée', 'établissement'], ['homme', 'serpent'], ['spécialiste', 'boa', 'empereur', 'commandant', 'benjamin', 'gadal', 'sdis', 'boa', 'constrictor', 'serpent', 'mètre'], ['envt', 'école', 'national', 'vétérinaire', 'toulouse'], ['moment', 'animal', 'libre', 'ville'], ['ger', 'boa', 'empereur', 'bowling', 'auch', 'nez', 'nez', 'serpent', 'bel', 'frayeur'], ['samedi', 'police', 'national', 'gers', 'auch', 'november', 'détention', 'type', 'serpent', 'habitué', 'chaleur', 'amérique', 'central', 'temps', 'ger', 'animal', 'vente', 'libre', 'france'], ['détention', 'lien', 'arrêté', 'octobre', 'serpent', 'type', 'condition', 'nature'], ['propriétaire', 'certificat', 'capacité', 'autorisation']]]","[[['Auch'], [], [], [], ['ENVT', 'Toulouse'], [], ['Gers', 'Auch'], ['Auch', 'l’Amérique', 'Gers', 'France'], [], []]]","[[['police nationale de Gers'], ['Sdis 32'], [], ['Sdis 32.Autrement'], [], [], [], ['Titrespresse.com'], [], []]]","[[[], [], [], ['Benjamin Gadal'], [], [], [], [], [], []]]","{'police': 2, 'national': 3, 'ger': 3, 'besoin': 1, 'coup': 1, 'main': 1, 'part': 1, 'équipe': 1, 'animalier': 1, 'opération': 1, 'habituel': 1, 'commune': 1, 'français': 1, 'auch': 3, 'officier': 1, 'direction': 1, 'sdis': 2, 'sapeur': 1, 'pompier': 1, 'volontaire': 1, 'boa': 4, 'parking': 1, 'bowling': 2, 'local': 1, 'masse': 1, 'indistinct': 1, 'entrée': 1, 'établissement': 1, 'homme': 1, 'serpent': 5, 'spécialiste': 1, 'empereur': 2, 'commandant': 1, 'benjamin': 1, 'gadal': 1, 'constrictor': 1, 'mètre': 1, 'envt': 1, 'école': 1, 'vétérinaire': 1, 'toulouse': 1, 'moment': 1, 'animal': 2, 'libre': 2, 'ville': 1, 'nez': 2, 'bel': 1, 'frayeur': 1, 'samedi': 1, 'gers': 1, 'november': 1, 'détention': 2, 'type': 2, 'habitué': 1, 'chaleur': 1, 'amérique': 1, 'central': 1, 'temps': 1, 'vente': 1, 'france': 1, 'lien': 1, 'arrêté': 1, 'octobre': 1, 'condition': 1, 'nature': 1, 'propriétaire': 1, 'certificat': 1, 'capacité': 1, 'autorisation': 1}","{'Auch': 3, 'ENVT': 1, 'Toulouse': 1, 'Gers': 2, 'l’Amérique': 1, 'France': 1}","{'police nationale de Gers': 1, 'Sdis 32': 1, 'Sdis 32.Autrement': 1, 'Titrespresse.com': 1}",{'Benjamin Gadal': 1},2022,11,13
1668380400,https://fr.sputniknews.africa/20221114/le-chef-de-lotan-appelle-a-ne-pas-commettre-lerreur-de-sous-estimer-la-russie-et-son-armee-1056819830.html,"Le chef de l’Otan appelle à ne pas ""commettre l'erreur de sous-estimer la Russie"" et son armée","Le secrétaire général de l’Otan prévient contre la sous-estimation des capacités des forces armées russes après leur retrait de Kherson. Il estime également que l’hiver pourrait être ""froid et sombre"" en Ukraine.","Le retrait russe de la ville de Kherson a fait réagir le secrétaire général de l’Otan Jens Stoltenberg, en déplacement aux Pays-Bas.""Nous ne devons pas commettre l'erreur de sous-estimer la Russie"", a-t-il déclaré lors d’une conférence de presse conjointe avec les ministres néerlandais des Affaires étrangères, Wopke Hoekstra, et de la Défense, Kajsa Ollongren.Il a ajouté que les forces armées russes conservaient des capacités importantes, ainsi qu'un grand nombre de soldats.Il a affirmé que l’objectif de Moscou était de ""laisser l'Ukraine froide et sombre cet hiver"".""Les mois à venir seront difficiles.""Après avoir fait traditionnellement l’éloge de ""l'incroyable courage des forces armées ukrainiennes"", M.Stoltenberg a insisté sur l'importance du soutien continu à Kiev.Il a remercié les Pays-Bas pour leurs généreuses contributions au programme global d'assistance de l'Otan.""Je salue également le fait que les Pays-Bas fourniront 120 millions d'euros supplémentaires d'aide à l'Ukraine, y compris pour la modernisation des chars de combat tchèques.""Mises en garde de la RussieLa Russie avait mis en garde les pays de l’Otan contre les livraisons d’armes à l’Ukraine. Le chef de la diplomatie russe Sergueï Lavrov avait signalé que toute cargaison en contenant serait une cible légitime.Le ministère russe des Affaires étrangères avait déclaré que les pays de l’Otan ""badinaient avec le feu"" en fournissant des armes.Le porte-parole du Kremlin Dmitri Peskov avait indiqué que saturer l’Ukraine en armes du côté occidental ne contribuait pas au succès des négociations russo-ukrainiennes et aurait un effet négatif.","[[['Le retrait russe de la ville de Kherson a fait réagir le secrétaire général de l’Otan Jens Stoltenberg, en déplacement aux Pays-Bas.', '""Nous ne devons pas commettre l\'erreur de sous-estimer la Russie"", a-t-il déclaré lors d’une conférence de presse conjointe avec les ministres néerlandais des Affaires étrangères, Wopke Hoekstra, et de la Défense, Kajsa Ollongren.Il a ajouté que les forces armées russes conservaient des capacités importantes, ainsi qu\'un grand nombre de soldats.Il a affirmé que l’objectif de Moscou était de ""laisser l\'Ukraine froide et sombre cet hiver"".', '""Les mois à venir seront difficiles.', '""Après avoir fait traditionnellement l’éloge de ""l\'incroyable courage des forces armées ukrainiennes"", M.Stoltenberg a insisté sur l\'importance du soutien continu à Kiev.Il a remercié les Pays-Bas pour leurs généreuses contributions au programme global d\'assistance de l\'Otan.', '""Je salue également le fait que les Pays-Bas fourniront 120 millions d\'euros supplémentaires d\'aide à l\'Ukraine, y compris pour la modernisation des chars de combat tchèques.', '""Mises en garde de la RussieLa Russie avait mis en garde les pays de l’Otan contre les livraisons d’armes à l’Ukraine.', 'Le chef de la diplomatie russe Sergueï Lavrov avait signalé que toute cargaison en contenant serait une cible légitime.Le ministère russe des Affaires étrangères avait déclaré que les pays de l’Otan ""badinaient avec le feu"" en fournissant des armes.Le porte-parole du Kremlin Dmitri Peskov avait indiqué que saturer l’Ukraine en armes du côté occidental ne contribuait pas au succès des négociations russo-ukrainiennes et aurait un effet négatif.']]]","[[['retrait', 'russe', 'ville', 'kherson', 'secrétaire', 'général', 'otan', 'jens', 'stoltenberg', 'déplacement', 'pays'], ['erreur', 'russie', 'conférence', 'presse', 'conjoint', 'ministre', 'néerlandais', 'affaire', 'étranger', 'wopke', 'hoekstra', 'défense', 'force', 'armée', 'russe', 'capacité', 'important', 'grand', 'nombre', 'objectif', 'moscou', 'ukraine', 'froid', 'sombre', 'hiver'], ['mois', 'difficile'], ['éloge', 'incroyable', 'courage', 'force', 'armée', 'ukrainien', 'importance', 'soutien', 'continu', 'pays', 'généreux', 'contribution', 'programme', 'global', 'assistance', 'otan'], ['pays', 'million', 'euro', 'supplémentaire', 'aide', 'ukraine', 'modernisation', 'char', 'combat', 'tchèque'], ['garde', 'russiela', 'russi', 'garde', 'pays', 'otan', 'livraison', 'arme', 'ukraine'], ['chef', 'diplomatie', 'russe', 'sergueï', 'lavrov', 'cargaison', 'cible', 'ministère', 'russe', 'affaire', 'étranger', 'pays', 'otan', 'feu', 'kremlin', 'peskov', 'ukraine', 'arme', 'côté', 'occidental', 'succès', 'négociation', 'russo', 'ukrainien', 'négatif']]]","[[['Kherson', 'Pays-Bas'], ['Russie', 'Moscou', 'Ukraine'], [], ['M.Stoltenberg', 'Kiev', 'Pays-Bas'], ['Pays-Bas', 'Ukraine'], ['RussieLa Russie', 'Ukraine'], ['Kremlin', 'Ukraine']]]","[[['Otan Jens Stoltenberg'], ['Affaires étrangères'], [], ['Otan'], [], ['Otan'], ['ministère russe des Affaires étrangères', 'Otan']]]","[[[], ['Wopke Hoekstra', 'Kajsa Ollongren'], [], [], [], [], ['Sergueï Lavrov', 'Dmitri Peskov']]]","{'retrait': 1, 'russe': 4, 'ville': 1, 'kherson': 1, 'secrétaire': 1, 'général': 1, 'otan': 4, 'jens': 1, 'stoltenberg': 1, 'déplacement': 1, 'pays': 5, 'erreur': 1, 'russie': 1, 'conférence': 1, 'presse': 1, 'conjoint': 1, 'ministre': 1, 'néerlandais': 1, 'affaire': 2, 'étranger': 2, 'wopke': 1, 'hoekstra': 1, 'défense': 1, 'force': 2, 'armée': 2, 'capacité': 1, 'important': 1, 'grand': 1, 'nombre': 1, 'objectif': 1, 'moscou': 1, 'ukraine': 4, 'froid': 1, 'sombre': 1, 'hiver': 1, 'mois': 1, 'difficile': 1, 'éloge': 1, 'incroyable': 1, 'courage': 1, 'ukrainien': 2, 'importance': 1, 'soutien': 1, 'continu': 1, 'généreux': 1, 'contribution': 1, 'programme': 1, 'global': 1, 'assistance': 1, 'million': 1, 'euro': 1, 'supplémentaire': 1, 'aide': 1, 'modernisation': 1, 'char': 1, 'combat': 1, 'tchèque': 1, 'garde': 2, 'russiela': 1, 'russi': 1, 'livraison': 1, 'arme': 2, 'chef': 1, 'diplomatie': 1, 'sergueï': 1, 'lavrov': 1, 'cargaison': 1, 'cible': 1, 'ministère': 1, 'feu': 1, 'kremlin': 1, 'peskov': 1, 'côté': 1, 'occidental': 1, 'succès': 1, 'négociation': 1, 'russo': 1, 'négatif': 1}","{'Kherson': 1, 'Pays-Bas': 3, 'Russie': 1, 'Moscou': 1, 'Ukraine': 4, 'M.Stoltenberg': 1, 'Kiev': 1, 'RussieLa Russie': 1, 'Kremlin': 1}","{'Otan Jens Stoltenberg': 1, 'Affaires étrangères': 1, 'Otan': 3, 'ministère russe des Affaires étrangères': 1}","{'Wopke Hoekstra': 1, 'Kajsa Ollongren': 1, 'Sergueï Lavrov': 1, 'Dmitri Peskov': 1}",2022,11,13
1668380400,https://fr.sputniknews.africa/20221114/un-francais-et-plusieurs-franco-algeriens-lies-a-daech-condamnes-en-algerie-1056819622.html,Un Français et plusieurs Franco-Algériens liés à Daech condamnés en Algérie,"Accusés de multiples crimes, huit membres d'un ""réseau terroriste lié à Daech*"", agissant en Algérie avec des connexions en France et en Afghanistan, feront de la prison ferme.","Le tribunal de première instance d'Oran, dans l'Ouest algérien, a condamné à de la prison ferme (entre 5 et 10 ans) huit personnes présentées par les enquêteurs comme les membres d'un réseau terroriste en rapport avec Daech*, relate Le Point. Trois autres membres présumés de cette cellule seraient en fuite.Il s’agit notamment d’un Français et de plusieurs Franco-Algériens qui agissaient en Algérie et avaient des connexions en France comme en Afghanistan.Divers crimesLes chefs d'inculpation sont multiples: tentative d'attaque à l'explosif, déplacement à l'étranger pour participer à des attentats terroristes, recours à des moyens technologiques en vue de recruter au profit de Daech*.En outre, d’après les enquêteurs, certains membres de ce groupe étaient chargés de trouver des armes (quatre pistolets, une centaine de cartouches de fusils de chasse ont notamment été saisis) ou de fournir aux terroristes des médicaments via un contact à l'hôpital de Mostaganem.Ils organisaient également des visionnages de vidéos de propagande de Daech* et s'échangeaient, via Telegram, des tutoriels pour la fabrication de bombes.*Organisation terroriste interdite en Russie","[[[""Le tribunal de première instance d'Oran, dans l'Ouest algérien, a condamné à de la prison ferme (entre 5 et 10 ans) huit personnes présentées par les enquêteurs comme les membres d'un réseau terroriste en rapport avec Daech*, relate Le Point."", ""Trois autres membres présumés de cette cellule seraient en fuite.Il s’agit notamment d’un Français et de plusieurs Franco-Algériens qui agissaient en Algérie et avaient des connexions en France comme en Afghanistan.Divers crimesLes chefs d'inculpation sont multiples: tentative d'attaque à l'explosif, déplacement à l'étranger pour participer à des attentats terroristes, recours à des moyens technologiques en vue de recruter au profit de Daech*.En outre, d’après les enquêteurs, certains membres de ce groupe étaient chargés de trouver des armes (quatre pistolets, une centaine de cartouches de fusils de chasse ont notamment été saisis) ou de fournir aux terroristes des médicaments via un contact à l'hôpital de Mostaganem.Ils organisaient également des visionnages de vidéos de propagande de Daech* et s'échangeaient, via Telegram, des tutoriels pour la fabrication de bombes."", '*Organisation terroriste interdite en Russie']]]","[[['tribunal', 'instance', 'oran', 'ouest', 'algérien', 'prison', 'ferme', 'an', 'personne', 'enquêteur', 'membre', 'réseau', 'terroriste', 'rapport', 'daech', 'point'], ['membre', 'présumer', 'cellule', 'français', 'algérie', 'connexion', 'france', 'crimesle', 'chef', 'inculpation', 'multiple', 'tentative', 'attaque', 'explosif', 'déplacement', 'étranger', 'attentat', 'terroriste', 'recours', 'moyen', 'technologique', 'vue', 'profit', 'enquêteur', 'membre', 'groupe', 'arme', 'pistolet', 'centaine', 'cartouche', 'fusil', 'chasse', 'terroriste', 'médicament', 'contact', 'hôpital', 'visionnage', 'vidéo', 'propagande', 'daech', 'telegram', 'tutoriel', 'fabrication', 'bombe'], ['organisation', 'terroriste', 'russie']]]","[[['Oran', 'Ouest'], ['France', 'Franco-Algériens', 'Algérie', 'France', 'Afghanistan', 'crimesLes', 'Mostaganem'], ['Russie']]]","[[['Daech'], ['Daech'], ['Organisation terroriste interdite']]]","[[[], ['Daech*.En'], []]]","{'tribunal': 1, 'instance': 1, 'oran': 1, 'ouest': 1, 'algérien': 1, 'prison': 1, 'ferme': 1, 'an': 1, 'personne': 1, 'enquêteur': 2, 'membre': 3, 'réseau': 1, 'terroriste': 4, 'rapport': 1, 'daech': 2, 'point': 1, 'présumer': 1, 'cellule': 1, 'français': 1, 'algérie': 1, 'connexion': 1, 'france': 1, 'crimesle': 1, 'chef': 1, 'inculpation': 1, 'multiple': 1, 'tentative': 1, 'attaque': 1, 'explosif': 1, 'déplacement': 1, 'étranger': 1, 'attentat': 1, 'recours': 1, 'moyen': 1, 'technologique': 1, 'vue': 1, 'profit': 1, 'groupe': 1, 'arme': 1, 'pistolet': 1, 'centaine': 1, 'cartouche': 1, 'fusil': 1, 'chasse': 1, 'médicament': 1, 'contact': 1, 'hôpital': 1, 'visionnage': 1, 'vidéo': 1, 'propagande': 1, 'telegram': 1, 'tutoriel': 1, 'fabrication': 1, 'bombe': 1, 'organisation': 1, 'russie': 1}","{'Oran': 1, 'Ouest': 1, 'France': 2, 'Franco-Algériens': 1, 'Algérie': 1, 'Afghanistan': 1, 'crimesLes': 1, 'Mostaganem': 1, 'Russie': 1}","{'Daech': 2, 'Organisation terroriste interdite': 1}",{'Daech*.En': 1},2022,11,13
