timestamp,url,title,description,content,content-segmented,kws-l,loc-l,org-l,per-l,kws,loc,org,per,year,month,day
1682028000,https://fr.sputniknews.africa/20230421/paris-aurait-refuse-de-fournir-a-kiev-des-cartes-numeriques-de-la-bielorussie-1058767187.html,Paris aurait refusé de fournir à Kiev des cartes numériques de la Biélorussie,"La France a refusé de fournir des cartes numériques de la Biélorussie à Kiev qui aurait déjà formulé en vain cette demande à d’autres pays de l’Otan, selon le journal français Le Monde. L’Ukraine souhaiterait obtenir ces documents pour...","Le gouvernement français a signifié une fin de non-recevoir à l'Ukraine concernant sa demande d’acquisition d’une cartographie numérique de la Biélorussie qui aurait permis aux avions de guerre ukrainiens d'effectuer des vols de reconnaissance en Biélorussie, pays voisin de la Russie, a annoncé ce 21 avril le journal Le Monde.""Les autorités ukrainiennes ont sollicité Paris pour obtenir une cartographie numérique du territoire biélorusse, un outil indispensable pour permettre à des avions de combat ou à des drones de mener des missions à basse altitude. Mais la France a refusé"", indique le quotidien.Des refus à la chaîneSelon Le Monde, Paris a justifié son refus par le fait que cette carte serait utilisée pour des opérations sur un territoire étranger, tout en réitérant son soutien sans faille tant qu’il s’agit de défendre le seul sol ukrainienKiev ne se serait adressé à la France qu’après avoir essuyé des refus d’autres membres de la coalition soutenant ses efforts face à l’opération militaire spéciale russe, précise le journal.Le ministère des Armées n’a pas souhaité commenter cette information.Une carte avec beaucoup de détails sensiblesLa carte en question consiste en un modèle numérique de terrain montrant des obstacles tels que des lignes électriques, des parcs éoliens, mais aussi des installations militaires comme les radars ou les systèmes de défense sol-air. Dans le jargon des pilotes, de telles cartes établies grâce à des satellites s’appellent ""données d'élévation du terrain (DTED).""Cela intègre toutes les données tactiques nécessaires à une pénétration de très basse altitude, de nuit ou avec une mauvaise visibilité"", explique Le Monde.Selon un expert cité par Le Monde, ces cartographies, établies grâce à des satellites et mises à jour en permanence, permettraient à Kiev de configurer des drones pour frapper des sites se trouvant en Biélorussie, comme ce qui a déjà été fait à plusieurs reprises en Russie, notamment dans la région frontalière de Belgorod.","[[[""Le gouvernement français a signifié une fin de non-recevoir à l'Ukraine concernant sa demande d’acquisition d’une cartographie numérique de la Biélorussie qui aurait permis aux avions de guerre ukrainiens d'effectuer des vols de reconnaissance en Biélorussie, pays voisin de la Russie, a annoncé ce 21 avril le journal Le Monde.""], ['""Les autorités ukrainiennes ont sollicité Paris pour obtenir une cartographie numérique du territoire biélorusse, un outil indispensable pour permettre à des avions de combat ou à des drones de mener des missions à basse altitude.'], ['Mais la France a refusé"", indique le quotidien.Des refus à la chaîneSelon Le Monde, Paris a justifié son refus par le fait que cette carte serait utilisée pour des opérations sur un territoire étranger, tout en réitérant son soutien sans faille tant qu’il s’agit de défendre le seul sol ukrainienKiev ne se serait adressé à la France qu’après avoir essuyé des refus d’autres membres de la coalition soutenant ses efforts face à l’opération militaire spéciale russe, précise le journal.Le ministère des Armées n’a pas souhaité commenter cette information.Une carte avec beaucoup de détails sensiblesLa carte en question consiste en un modèle numérique de terrain montrant des obstacles tels que des lignes électriques, des parcs éoliens, mais aussi des installations militaires comme les radars ou les systèmes de défense sol-air.'], ['Dans le jargon des pilotes, de telles cartes établies grâce à des satellites s’appellent ""données d\'élévation du terrain (DTED).'], ['""Cela intègre toutes les données tactiques nécessaires à une pénétration de très basse altitude, de nuit ou avec une mauvaise visibilité"", explique Le Monde.Selon un expert cité par Le Monde, ces cartographies, établies grâce à des satellites et mises à jour en permanence, permettraient à Kiev de configurer des drones pour frapper des sites se trouvant en Biélorussie, comme ce qui a déjà été fait à plusieurs reprises en Russie, notamment dans la région frontalière de Belgorod.']]]","[[['gouvernement', 'français', 'fin', 'ukraine', 'demande', 'acquisition', 'cartographie', 'numérique', 'biélorussie', 'avions', 'guerre', 'ukrainiens', 'vols', 'reconnaissance', 'biélorussie', 'pays', 'voisin', 'russie', 'avril', 'journal', 'monde'], ['autorités', 'ukrainiennes', 'paris', 'cartographie', 'numérique', 'territoire', 'biélorusse', 'outil', 'indispensable', 'avions', 'combat', 'drones', 'missions', 'basse', 'altitude'], ['france', 'refus', 'chaîneselon', 'monde', 'paris', 'refus', 'carte', 'opérations', 'territoire', 'étranger', 'soutien', 'faille', 'sol', 'france', 'refus', 'membres', 'coalition', 'efforts', 'face', 'opération', 'militaire', 'spéciale', 'russe', 'ministère', 'armées', 'carte', 'détails', 'carte', 'question', 'modèle', 'numérique', 'terrain', 'obstacles', 'lignes', 'électriques', 'parcs', 'éoliens', 'installations', 'militaires', 'radars', 'systèmes', 'défense', 'sol', 'air'], ['jargon', 'pilotes', 'cartes', 'grâce', 'satellites', 'données', 'élévation', 'terrain'], ['données', 'tactiques', 'nécessaires', 'pénétration', 'basse', 'altitude', 'nuit', 'mauvaise', 'visibilité', 'expert', 'monde', 'cartographies', 'grâce', 'satellites', 'jour', 'permanence', 'kiev', 'drones', 'sites', 'reprises', 'russie', 'région', 'frontalière', 'belgorod']]]","[[['Ukraine', 'Biélorussie', 'Biélorussie', 'Russie'], ['Paris'], ['France', 'Paris', 'France'], ['DTED'], ['Kiev', 'Biélorussie', 'Russie', 'Belgorod']]]","[[['Monde'], [], ['Monde', 'ministère des Armées'], [], ['Monde', 'Monde']]]","[[[], [], [], [], []]]","{'gouvernement': 1, 'français': 1, 'fin': 1, 'ukraine': 1, 'demande': 1, 'acquisition': 1, 'cartographie': 2, 'numérique': 3, 'biélorussie': 2, 'avions': 2, 'guerre': 1, 'ukrainiens': 1, 'vols': 1, 'reconnaissance': 1, 'pays': 1, 'voisin': 1, 'russie': 2, 'avril': 1, 'journal': 1, 'monde': 3, 'autorités': 1, 'ukrainiennes': 1, 'paris': 2, 'territoire': 2, 'biélorusse': 1, 'outil': 1, 'indispensable': 1, 'combat': 1, 'drones': 2, 'missions': 1, 'basse': 2, 'altitude': 2, 'france': 2, 'refus': 3, 'chaîneselon': 1, 'carte': 3, 'opérations': 1, 'étranger': 1, 'soutien': 1, 'faille': 1, 'sol': 2, 'membres': 1, 'coalition': 1, 'efforts': 1, 'face': 1, 'opération': 1, 'militaire': 1, 'spéciale': 1, 'russe': 1, 'ministère': 1, 'armées': 1, 'détails': 1, 'question': 1, 'modèle': 1, 'terrain': 2, 'obstacles': 1, 'lignes': 1, 'électriques': 1, 'parcs': 1, 'éoliens': 1, 'installations': 1, 'militaires': 1, 'radars': 1, 'systèmes': 1, 'défense': 1, 'air': 1, 'jargon': 1, 'pilotes': 1, 'cartes': 1, 'grâce': 2, 'satellites': 2, 'données': 2, 'élévation': 1, 'tactiques': 1, 'nécessaires': 1, 'pénétration': 1, 'nuit': 1, 'mauvaise': 1, 'visibilité': 1, 'expert': 1, 'cartographies': 1, 'jour': 1, 'permanence': 1, 'kiev': 1, 'sites': 1, 'reprises': 1, 'région': 1, 'frontalière': 1, 'belgorod': 1}","{'Ukraine': 1, 'Biélorussie': 3, 'Russie': 2, 'Paris': 2, 'France': 2, 'DTED': 1, 'Kiev': 1, 'Belgorod': 1}","{'Monde': 4, 'ministère des Armées': 1}",{},2023,4,20
1682028000,https://fr.sputniknews.africa/20230421/la-course-aux-armements-devient-incontrolable-moscou-propose-un-mecanisme-special-1058766928.html,"La ""course aux armements devient incontrôlable"", Moscou propose un mécanisme spécial","Toutes les nations sont maintenant conscientes qu’elles doivent être prêtes à la guerre afin d’avoir la paix. Dans ce contexte, un diplomate russe estime qu’il est impossible de contrôler l’acquisition d’armes par chaque pays et qu’il...","La course aux armements, y compris dans le domaine des missiles, devient incontrôlable, a déclaré Grigori Machkov, ambassadeur itinérant du ministère russe des Affaires étrangères, qui avait présidé le groupe international du Régime de contrôle de la technologie des missiles (MTCR) en 2021 et 2022.""Nous assistons à une course aux armements balistiques dont les conséquences sont difficiles à prévoir. Des dizaines de milliards de dollars sont investis dans l’amélioration de la technologie des missiles. Ce processus devient incontrôlable"", a indiqué M.Machkov dans un article publié par la revue russe Vie internationale.Le club des pays possédant des ICBM s’élargitPlusieurs pays modernisent leurs armes stratégiques offensives, a-t-il constaté. La Chine augmente son arsenal de missiles, la Corée du Nord s’est dotée de missiles balistiques intercontinentaux, alors que les pays comme Israël, l’Inde et le Pakistan n’abandonnent pas l’idée de créer des missiles d’une portée supérieure à 5.500 km. Le nombre de pays possédant des missiles balistiques et de croisière à moyenne portée, y compris ceux capables d’atteindre le territoire russe, est en hausse.Qui plus est, la plupart des accords russo-américains qui avaient réglementé le domaine des armements n’existent plus.""Le Traité ABM a cessé d’exister en 2002 et le Traité sur les forces nucléaires à portée intermédiaire (FNI) en août 2019. Le Traité russo-américain de réduction des armes stratégiques (New START), qui expire le 5 février 2026, est sur le point de disparaître"", a énuméré M.Machkov.Être prêt à n’importe quel scénarioAprès la disparition du Traité New START, il y aura un ""vide"" dans le domaine du maintien de la stabilité stratégique et il faut alors se préparer à tous les scénarios, estime M.Machkov. D’autant plus que les États-Unis et leurs alliés renforcent leurs arsenaux de missiles pour s’assurer la supériorité sur leurs adversaires potentiels: la Russie et la Chine.""L'ancienne formule de la stabilité stratégique, basée sur la parité bipolaire du nombre de missiles nucléaires, s'est épuisée"", constate le diplomate.La Russie se voit déjà obligée d’augmenter son potentiel de missiles tactiques et d’accumuler des missiles pour être prête à relever n’importe quel défi.Créer un nouveau mécanisme au sein de l’OnuDans cette optique, il est nécessaire de lancer un mécanisme au sein de l’Onu pour discuter de tout l'éventail des questions relatives aux missiles.""La Russie pourrait adresser une telle proposition au secrétaire général de l'Onu tout en exprimant sa volonté de jouer un rôle de premier plan dans ce processus"", a poursuivi M.Machkov.Le message principal devrait être qu'il ne peut y avoir de gagnants dans la course aux armements.""L'accumulation effrénée de missiles conduira inévitablement à l'épuisement des économies des pays, tandis que les problèmes de sécurité nationale ne feront qu'empirer à mesure que les parties belligérantes accumulent d'énormes stocks de missiles"", a conclu le diplomate.","[[['La course aux armements, y compris dans le domaine des missiles, devient incontrôlable, a déclaré Grigori Machkov, ambassadeur itinérant du ministère russe des Affaires étrangères, qui avait présidé le groupe international du Régime de contrôle de la technologie des missiles (MTCR) en 2021 et 2022.'], ['""Nous assistons à une course aux armements balistiques dont les conséquences sont difficiles à prévoir.'], ['Des dizaines de milliards de dollars sont investis dans l’amélioration de la technologie des missiles.'], ['Ce processus devient incontrôlable"", a indiqué M.Machkov dans un article publié par la revue russe Vie internationale.Le club des pays possédant des ICBM s’élargitPlusieurs pays modernisent leurs armes stratégiques offensives, a-t-il constaté.'], ['La Chine augmente son arsenal de missiles, la Corée du Nord s’est dotée de missiles balistiques intercontinentaux, alors que les pays comme Israël, l’Inde et le Pakistan n’abandonnent pas l’idée de créer des missiles d’une portée supérieure à 5.500 km.'], ['Le nombre de pays possédant des missiles balistiques et de croisière à moyenne portée, y compris ceux capables d’atteindre le territoire russe, est en hausse.Qui plus est, la plupart des accords russo-américains qui avaient réglementé le domaine des armements n’existent plus.'], ['""Le Traité ABM a cessé d’exister en 2002 et le Traité sur les forces nucléaires à portée intermédiaire (FNI) en août 2019.'], ['Le Traité russo-américain de réduction des armes stratégiques (New START), qui expire le 5 février 2026, est sur le point de disparaître"", a énuméré M.Machkov.Être prêt à n’importe quel scénarioAprès la disparition du Traité New START, il y aura un ""vide"" dans le domaine du maintien de la stabilité stratégique et il faut alors se préparer à tous les scénarios, estime M.Machkov.'], ['D’autant plus que les États-Unis et leurs alliés renforcent leurs arsenaux de missiles pour s’assurer la supériorité sur leurs adversaires potentiels: la Russie et la Chine.'], ['""L\'ancienne formule de la stabilité stratégique, basée sur la parité bipolaire du nombre de missiles nucléaires, s\'est épuisée"", constate le diplomate.La Russie se voit déjà obligée d’augmenter son potentiel de missiles tactiques et d’accumuler des missiles pour être prête à relever n’importe quel défi.Créer un nouveau mécanisme au sein de l’OnuDans cette optique, il est nécessaire de lancer un mécanisme au sein de l’Onu pour discuter de tout l\'éventail des questions relatives aux missiles.'], ['""La Russie pourrait adresser une telle proposition au secrétaire général de l\'Onu tout en exprimant sa volonté de jouer un rôle de premier plan dans ce processus"", a poursuivi M.Machkov.Le message principal devrait être qu\'il ne peut y avoir de gagnants dans la course aux armements.'], ['""L\'accumulation effrénée de missiles conduira inévitablement à l\'épuisement des économies des pays, tandis que les problèmes de sécurité nationale ne feront qu\'empirer à mesure que les parties belligérantes accumulent d\'énormes stocks de missiles"", a conclu le diplomate.']]]","[[['course', 'armements', 'domaine', 'missiles', 'incontrôlable', 'machkov', 'ambassadeur', 'itinérant', 'ministère', 'russe', 'affaires', 'étrangères', 'groupe', 'international', 'régime', 'contrôle', 'technologie', 'missiles', 'mtcr'], ['course', 'armements', 'balistiques', 'conséquences', 'difficiles'], ['dizaines', 'milliards', 'dollars', 'amélioration', 'technologie', 'missiles'], ['processus', 'incontrôlable', 'article', 'revue', 'russe', 'vie', 'club', 'pays', 'icbm', 'élargitplusieurs', 'pays', 'armes', 'stratégiques', 'offensives'], ['chine', 'arsenal', 'missiles', 'corée', 'nord', 'missiles', 'balistiques', 'intercontinentaux', 'pays', 'inde', 'pakistan', 'idée', 'missiles', 'portée', 'supérieure', 'km'], ['nombre', 'pays', 'missiles', 'balistiques', 'croisière', 'moyenne', 'capables', 'territoire', 'russe', 'plupart', 'accords', 'américains', 'domaine', 'armements'], ['traité', 'abm', 'traité', 'forces', 'nucléaires', 'portée', 'intermédiaire', 'fni', 'août'], ['traité', 'américain', 'réduction', 'armes', 'stratégiques', 'février', 'point', 'prêt', 'scénarioaprès', 'disparition', 'traité', 'new', 'vide', 'domaine', 'maintien', 'stabilité', 'stratégique', 'scénarios'], ['alliés', 'arsenaux', 'missiles', 'supériorité', 'adversaires', 'potentiels', 'russie', 'chine'], ['ancienne', 'formule', 'stabilité', 'stratégique', 'parité', 'bipolaire', 'nombre', 'missiles', 'nucléaires', 'russie', 'potentiel', 'missiles', 'tactiques', 'missiles', 'prête', 'mécanisme', 'sein', 'onudans', 'optique', 'nécessaire', 'mécanisme', 'sein', 'onu', 'éventail', 'questions', 'relatives', 'missiles'], ['russie', 'proposition', 'secrétaire', 'général', 'onu', 'volonté', 'rôle', 'plan', 'processus', 'message', 'principal', 'gagnants', 'course', 'armements'], ['accumulation', 'missiles', 'épuisement', 'économies', 'pays', 'problèmes', 'sécurité', 'nationale', 'mesure', 'parties', 'belligérantes', 'énormes', 'stocks', 'missiles', 'diplomate']]]","[[[], [], [], [], ['Chine', 'Corée du Nord', 'Israël', 'Inde', 'Pakistan'], [], [], [], ['États-Unis', 'Russie', 'Chine'], ['Russie'], ['Russie'], []]]","[[['ministère russe des Affaires étrangères', 'Régime de contrôle de la technologie des missiles'], [], [], ['M.Machkov', 'Vie internationale'], [], [], ['Traité ABM', 'FNI'], ['M.Machkov', 'M.Machkov'], [], ['Onu'], ['M.Machkov'], []]]","[[['Grigori Machkov'], [], [], [], [], [], [], [], [], [], [], []]]","{'course': 3, 'armements': 4, 'domaine': 3, 'missiles': 14, 'incontrôlable': 2, 'machkov': 1, 'ambassadeur': 1, 'itinérant': 1, 'ministère': 1, 'russe': 3, 'affaires': 1, 'étrangères': 1, 'groupe': 1, 'international': 1, 'régime': 1, 'contrôle': 1, 'technologie': 2, 'mtcr': 1, 'balistiques': 3, 'conséquences': 1, 'difficiles': 1, 'dizaines': 1, 'milliards': 1, 'dollars': 1, 'amélioration': 1, 'processus': 2, 'article': 1, 'revue': 1, 'vie': 1, 'club': 1, 'pays': 5, 'icbm': 1, 'élargitplusieurs': 1, 'armes': 2, 'stratégiques': 2, 'offensives': 1, 'chine': 2, 'arsenal': 1, 'corée': 1, 'nord': 1, 'intercontinentaux': 1, 'inde': 1, 'pakistan': 1, 'idée': 1, 'portée': 2, 'supérieure': 1, 'km': 1, 'nombre': 2, 'croisière': 1, 'moyenne': 1, 'capables': 1, 'territoire': 1, 'plupart': 1, 'accords': 1, 'américains': 1, 'traité': 4, 'abm': 1, 'forces': 1, 'nucléaires': 2, 'intermédiaire': 1, 'fni': 1, 'août': 1, 'américain': 1, 'réduction': 1, 'février': 1, 'point': 1, 'prêt': 1, 'scénarioaprès': 1, 'disparition': 1, 'new': 1, 'vide': 1, 'maintien': 1, 'stabilité': 2, 'stratégique': 2, 'scénarios': 1, 'alliés': 1, 'arsenaux': 1, 'supériorité': 1, 'adversaires': 1, 'potentiels': 1, 'russie': 3, 'ancienne': 1, 'formule': 1, 'parité': 1, 'bipolaire': 1, 'potentiel': 1, 'tactiques': 1, 'prête': 1, 'mécanisme': 2, 'sein': 2, 'onudans': 1, 'optique': 1, 'nécessaire': 1, 'onu': 2, 'éventail': 1, 'questions': 1, 'relatives': 1, 'proposition': 1, 'secrétaire': 1, 'général': 1, 'volonté': 1, 'rôle': 1, 'plan': 1, 'message': 1, 'principal': 1, 'gagnants': 1, 'accumulation': 1, 'épuisement': 1, 'économies': 1, 'problèmes': 1, 'sécurité': 1, 'nationale': 1, 'mesure': 1, 'parties': 1, 'belligérantes': 1, 'énormes': 1, 'stocks': 1, 'diplomate': 1}","{'Chine': 2, 'Corée du Nord': 1, 'Israël': 1, 'Inde': 1, 'Pakistan': 1, 'États-Unis': 1, 'Russie': 3}","{'ministère russe des Affaires étrangères': 1, 'Régime de contrôle de la technologie des missiles': 1, 'M.Machkov': 4, 'Vie internationale': 1, 'Traité ABM': 1, 'FNI': 1, 'Onu': 1}",{'Grigori Machkov': 1},2023,4,20
1682028000,https://fr.sputniknews.africa/20230421/en-guinee-une-cinquantaine-de-pecheurs-atteints-dune-mysterieuse-maladie-de-peau-1058766728.html,"En Guinée, une cinquantaine de pêcheurs atteints d'une mystérieuse maladie de peau",Les autorités guinéennes ont créé une commission de gestion de crise après qu'une cinquantaine de pêcheurs souffrant d'une maladie de peau inconnue ont été hospitalisés.,"Une cinquantaine de pêcheurs ont été admis à l'hôpital en Guinée à cause d'une mystérieuse éruption cutanée, a indiqué vendredi 21 avril le porte-parole du gouvernement.Des photos d'hommes, tous des pêcheurs, avec le visage, la bouche ou les membres présentant de nombreux boutons ont été diffusées sur les réseaux sociaux. ""Face à ce phénomène étrange, le gouvernement a mis en place une commission interministérielle de gestion de la crise composée des représentants des ministères en charge de l'Environnement, des Pêches, de la Santé, des Transports, des Mines ainsi que la préfecture maritime"", a précisé Ousmane Gaoual Diallo dans un communiqué.M.Diallo a souligné qu'un comité de scientifiques avait prélevé dans les zones suspectes des échantillons d'eau de mer, actuellement analysés dans des laboratoires en Guinée et à l'étranger. ""En attendant les résultats des analyses, le gouvernement invite les pêcheurs à la prudence et à éviter les zones de pêche présentant une nappe d'eau compacte de couleur ocre"", a-t-il dit. Il a aussi assuré à la population que les analyses réalisées sur les produits de pêche débarqués par les pêcheurs victimes de brûlures sur la peau n'avaient révélé aucun risque pour la consommation.","[[[""Une cinquantaine de pêcheurs ont été admis à l'hôpital en Guinée à cause d'une mystérieuse éruption cutanée, a indiqué vendredi 21 avril le porte-parole du gouvernement.Des photos d'hommes, tous des pêcheurs, avec le visage, la bouche ou les membres présentant de nombreux boutons ont été diffusées sur les réseaux sociaux.""], ['""Face à ce phénomène étrange, le gouvernement a mis en place une commission interministérielle de gestion de la crise composée des représentants des ministères en charge de l\'Environnement, des Pêches, de la Santé, des Transports, des Mines ainsi que la préfecture maritime"", a précisé Ousmane Gaoual Diallo dans un communiqué.M.Diallo a souligné qu\'un comité de scientifiques avait prélevé dans les zones suspectes des échantillons d\'eau de mer, actuellement analysés dans des laboratoires en Guinée et à l\'étranger.'], ['""En attendant les résultats des analyses, le gouvernement invite les pêcheurs à la prudence et à éviter les zones de pêche présentant une nappe d\'eau compacte de couleur ocre"", a-t-il dit.'], [""Il a aussi assuré à la population que les analyses réalisées sur les produits de pêche débarqués par les pêcheurs victimes de brûlures sur la peau n'avaient révélé aucun risque pour la consommation.""]]]","[[['pêcheurs', 'hôpital', 'guinée', 'cause', 'mystérieuse', 'éruption', 'cutanée', 'vendredi', 'avril', 'photos', 'hommes', 'pêcheurs', 'visage', 'bouche', 'membres', 'boutons', 'réseaux', 'sociaux'], ['face', 'phénomène', 'étrange', 'gouvernement', 'place', 'commission', 'interministérielle', 'gestion', 'crise', 'représentants', 'ministères', 'charge', 'environnement', 'pêches', 'santé', 'transports', 'mines', 'préfecture', 'maritime', 'gaoual', 'diallo', 'comité', 'scientifiques', 'zones', 'suspectes', 'échantillons', 'eau', 'mer', 'laboratoires', 'guinée', 'étranger'], ['résultats', 'analyses', 'gouvernement', 'pêcheurs', 'prudence', 'zones', 'pêche', 'nappe', 'eau', 'compacte', 'couleur', 'ocre'], ['population', 'analyses', 'produits', 'pêche', 'pêcheurs', 'victimes', 'brûlures', 'peau', 'risque', 'consommation']]]","[[['Guinée'], ['Pêches', 'Santé', 'Mines', 'Guinée'], [], []]]","[[[], ['Environnement', 'Transports', 'M.Diallo'], [], []]]","[[[], ['Ousmane Gaoual Diallo'], [], []]]","{'pêcheurs': 4, 'hôpital': 1, 'guinée': 2, 'cause': 1, 'mystérieuse': 1, 'éruption': 1, 'cutanée': 1, 'vendredi': 1, 'avril': 1, 'photos': 1, 'hommes': 1, 'visage': 1, 'bouche': 1, 'membres': 1, 'boutons': 1, 'réseaux': 1, 'sociaux': 1, 'face': 1, 'phénomène': 1, 'étrange': 1, 'gouvernement': 2, 'place': 1, 'commission': 1, 'interministérielle': 1, 'gestion': 1, 'crise': 1, 'représentants': 1, 'ministères': 1, 'charge': 1, 'environnement': 1, 'pêches': 1, 'santé': 1, 'transports': 1, 'mines': 1, 'préfecture': 1, 'maritime': 1, 'gaoual': 1, 'diallo': 1, 'comité': 1, 'scientifiques': 1, 'zones': 2, 'suspectes': 1, 'échantillons': 1, 'eau': 2, 'mer': 1, 'laboratoires': 1, 'étranger': 1, 'résultats': 1, 'analyses': 2, 'prudence': 1, 'pêche': 2, 'nappe': 1, 'compacte': 1, 'couleur': 1, 'ocre': 1, 'population': 1, 'produits': 1, 'victimes': 1, 'brûlures': 1, 'peau': 1, 'risque': 1, 'consommation': 1}","{'Guinée': 2, 'Pêches': 1, 'Santé': 1, 'Mines': 1}","{'Environnement': 1, 'Transports': 1, 'M.Diallo': 1}",{'Ousmane Gaoual Diallo': 1},2023,4,20
