timestamp,url,title,description,content,content-segmented,kws-l,loc-l,org-l,per-l,kws,loc,org,per,year,month,day
1687471200,https://fr.sputniknews.africa/20230623/les-maliens-ont-vote-en-faveur-de-la-nouvelle-constitution-1060119749.html,Les Maliens ont voté en faveur de la nouvelle Constitution,"Plus de 97% des Maliens se sont prononcés pour le projet de la quatrième Constitution du Mali lors du référendum tenu le 18 juin. Le vote a été validé, le taux de participation étant proche de 40%, a rapporté l’organisme de gestion...","Le projet de la nouvelle Constitution du Mali a été approuvé par plus de 97% des citoyens ayant participé au référendum du 18 juin, a annoncé ce 23 juin le responsable du comité national de gestion électorale du Mali.""J’annonce solennellement les résultats du référendum constitutionnel tenu le 18 juin 2023. La répartition des votes: ""pour"" - 3.154.644 votes, ainsi le résultat obtenu représente 97,06%"", a déclaré le responsable du comité de gestion électorale à la chaîne de télévision publique ORTM.Ce vendredi également, l’institution indépendante de gestion électorale Aige a annoncé le référendum valide, avec un taux de participation estimé à 38,72%. Au total, huit millions de Maliens ont été appelés à prendre part au vote.Référendum repoussé de trois moisFixée initialement pour le 19 mars, la date du référendum avait été décalée en raison de la nécessité d’installer les bureaux de vote dans toutes les régions du pays. C’est au mois de mai que le gouvernement malien par intérim a établi la nouvelle date du référendum du 18 juin.Pour procéder au vote, chaque personne interrogée devait répondre ‘oui’ ou ‘non’ à la question si elle soutient le projet de la Constitution proposée par les autorités de la transition au Mali.Nouvelle Constitution malienneLa troisième version de la Constitution malienne, actuellement en vigueur, date de 1974.La nouvelle Constitution, approuvée le 18 juin dernier, vise à renforcer les pouvoirs du futur Président, qui déterminera la politique de la Nation, et affirme l'attachement à la forme républicaine et à la laïcité de l'État. Le chef du gouvernement sera élu pour cinq ans et ne pourra pas effectuer plus de deux mandats, selon le projet de Constitution.Selon la nouvelle Loi nationale, ""le gouvernement est responsable devant le Président"", et non plus devant l'Assemblée nationale. L'initiative des lois appartiendrait au Président et aux parlementaires, et non plus au gouvernement et à l'Assemblée nationale. Le Président obtient également le droit de dissoudre le parlement.La nouvelle Constitution prévoit la création d’une deuxième chambre du parlement - le Sénat, ainsi que de la Chambre des comptes.Les 13 principales langues du Mali deviennent étatiques. Dans le même temps, le français reçoit le statut d’une ""langue de travail"".","[[['Le projet de la nouvelle Constitution du Mali a été approuvé par plus de 97% des citoyens ayant participé au référendum du 18 juin, a annoncé ce 23 juin le responsable du comité national de gestion électorale du Mali.'], ['""J’annonce solennellement les résultats du référendum constitutionnel tenu le 18 juin 2023.'], ['La répartition des votes: ""pour"" - 3.154.644 votes, ainsi le résultat obtenu représente 97,06%"", a déclaré le responsable du comité de gestion électorale à la chaîne de télévision publique ORTM.Ce vendredi également, l’institution indépendante de gestion électorale Aige a annoncé le référendum valide, avec un taux de participation estimé à 38,72%.'], ['Au total, huit millions de Maliens ont été appelés à prendre part au vote.Référendum repoussé de trois moisFixée initialement pour le 19 mars, la date du référendum avait été décalée en raison de la nécessité d’installer les bureaux de vote dans toutes les régions du pays.'], [""C’est au mois de mai que le gouvernement malien par intérim a établi la nouvelle date du référendum du 18 juin.Pour procéder au vote, chaque personne interrogée devait répondre ‘oui’ ou ‘non’ à la question si elle soutient le projet de la Constitution proposée par les autorités de la transition au Mali.Nouvelle Constitution malienneLa troisième version de la Constitution malienne, actuellement en vigueur, date de 1974.La nouvelle Constitution, approuvée le 18 juin dernier, vise à renforcer les pouvoirs du futur Président, qui déterminera la politique de la Nation, et affirme l'attachement à la forme républicaine et à la laïcité de l'État.""], ['Le chef du gouvernement sera élu pour cinq ans et ne pourra pas effectuer plus de deux mandats, selon le projet de Constitution.Selon la nouvelle Loi nationale, ""le gouvernement est responsable devant le Président"", et non plus devant l\'Assemblée nationale.'], [""L'initiative des lois appartiendrait au Président et aux parlementaires, et non plus au gouvernement et à l'Assemblée nationale.""], ['Le Président obtient également le droit de dissoudre le parlement.La nouvelle Constitution prévoit la création d’une deuxième chambre du parlement - le Sénat, ainsi que de la Chambre des comptes.Les 13 principales langues du Mali deviennent étatiques.'], ['Dans le même temps, le français reçoit le statut d’une ""langue de travail"".']]]","[[['projet', 'nouvelle', 'constitution', 'mali', 'citoyens', 'référendum', 'juin', 'juin', 'responsable', 'comité', 'national', 'gestion', 'électorale', 'mali'], ['résultats', 'référendum', 'constitutionnel', 'juin'], ['répartition', 'votes', 'votes', 'résultat', 'responsable', 'comité', 'gestion', 'électorale', 'chaîne', 'télévision', 'publique', 'vendredi', 'institution', 'indépendante', 'gestion', 'électorale', 'aige', 'référendum', 'valide', 'taux', 'participation'], ['total', 'millions', 'maliens', 'part', 'moisfixée', 'mars', 'date', 'référendum', 'raison', 'nécessité', 'bureaux', 'vote', 'régions', 'pays'], ['mois', 'mai', 'gouvernement', 'malien', 'intérim', 'nouvelle', 'date', 'référendum', 'vote', 'oui', 'question', 'projet', 'constitution', 'autorités', 'transition', 'constitution', 'maliennela', 'version', 'constitution', 'malienne', 'vigueur', 'date', 'nouvelle', 'constitution', 'juin', 'dernier', 'pouvoirs', 'futur', 'président', 'politique', 'nation', 'attachement', 'forme', 'républicaine', 'laïcité', 'état'], ['chef', 'gouvernement', 'ans', 'mandats', 'projet', 'nouvelle', 'loi', 'nationale', 'gouvernement', 'responsable', 'président', 'assemblée', 'nationale'], ['initiative', 'lois', 'président', 'parlementaires', 'gouvernement', 'assemblée', 'nationale'], ['président', 'droit', 'nouvelle', 'constitution', 'création', 'chambre', 'parlement', 'sénat', 'chambre', 'principales', 'langues', 'mali', 'étatiques'], ['temps', 'français', 'statut', 'langue', 'travail']]]","[[['Mali'], [], ['Aige'], ['Mali'], ['Mali', 'État'], [], [], ['Mali'], []]]","[[[], [], [], [], ['Constitution', 'Constitution malienne', '1974.La nouvelle Constitution'], ['Assemblée nationale'], ['Assemblée nationale'], ['Chambre des comptes'], []]]","[[[], [], [], [], ['Président'], ['Président'], ['Président'], ['Président'], []]]","{'projet': 3, 'nouvelle': 5, 'constitution': 6, 'mali': 3, 'citoyens': 1, 'référendum': 5, 'juin': 4, 'responsable': 3, 'comité': 2, 'national': 1, 'gestion': 3, 'électorale': 3, 'résultats': 1, 'constitutionnel': 1, 'répartition': 1, 'votes': 2, 'résultat': 1, 'chaîne': 1, 'télévision': 1, 'publique': 1, 'vendredi': 1, 'institution': 1, 'indépendante': 1, 'aige': 1, 'valide': 1, 'taux': 1, 'participation': 1, 'total': 1, 'millions': 1, 'maliens': 1, 'part': 1, 'moisfixée': 1, 'mars': 1, 'date': 3, 'raison': 1, 'nécessité': 1, 'bureaux': 1, 'vote': 2, 'régions': 1, 'pays': 1, 'mois': 1, 'mai': 1, 'gouvernement': 4, 'malien': 1, 'intérim': 1, 'oui': 1, 'question': 1, 'autorités': 1, 'transition': 1, 'maliennela': 1, 'version': 1, 'malienne': 1, 'vigueur': 1, 'dernier': 1, 'pouvoirs': 1, 'futur': 1, 'président': 4, 'politique': 1, 'nation': 1, 'attachement': 1, 'forme': 1, 'républicaine': 1, 'laïcité': 1, 'état': 1, 'chef': 1, 'ans': 1, 'mandats': 1, 'loi': 1, 'nationale': 3, 'assemblée': 2, 'initiative': 1, 'lois': 1, 'parlementaires': 1, 'droit': 1, 'création': 1, 'chambre': 2, 'parlement': 1, 'sénat': 1, 'principales': 1, 'langues': 1, 'étatiques': 1, 'temps': 1, 'français': 1, 'statut': 1, 'langue': 1, 'travail': 1}","{'Mali': 4, 'Aige': 1, 'État': 1}","{'Constitution': 1, 'Constitution malienne': 1, '1974.La nouvelle Constitution': 1, 'Assemblée nationale': 2, 'Chambre des comptes': 1}",{'Président': 4},2023,6,22
1687471200,https://fr.sputniknews.africa/20230623/le-titan-perdu-pres-du-titanic-et-les-sous-marinsnucleaires-us-controles-par-les-memes-manettes-1060119971.html,Le Titan perdu près du Titanic et les sous-marins nucléaires US contrôlés par les mêmes manettes?,"Le petit submersible de tourisme scientifique Titan, qui a implosé dans l’Atlantique près de l’épave du Titanic, aurait les mêmes manettes de contrôle que les sous-marins nucléaires américains, selon l’hebdomadaire américain Newsweek.","Les sous-marins nucléaires de la marine américaine utilisent les mêmes manettes de commande que le bathyscaphe de tourisme Titan d’Ocean Gate, qui a fait naufrage dans l’Atlantique à proximité de l’épave du Titanic, a relaté l’hebdomadaire américain Newsweek.Un correspondant de CBS News, David Pogue, qui avait voyagé à bord du Titan en 2022, a fait part à l'hebdomadaire de son étonnement sur le fait que le submersible soit contrôlé à l'aide d'une manette de jeu Logitech F710 Bluetooth. Il note également le fait que le bathyscaphe ne possédait aucune nacelle de secours.""Je ne pouvais m'empêcher de remarquer combien de pièces de ce sous-marin semblaient improvisées [...]. Il semble que ce submersible ait des éléments de MacGyver jerry-riggedness"", a-t-il indiqué.Un accessoire à bon prix et facilement maniableSelon le Newsweek, l’US Navy utilise des manettes Xbox 360 sur certains sous-marins depuis 2018. Le commandant Reed Koepp, ancien commandant de l'USS Colorado, a déclaré que les manettes coûtaient moins cher et étaient plus faciles à prendre en main pour les jeunes marins, grâce à leur expérience dans les jeux vidéo. Ces outils serviraient à manier les mâts photoniques qui ont remplacé les périscopes.Le joystick et le panneau de commande développés par Lockheed Martin, qui coûtent environ 38.000 dollars, seraient lourds et maladroits. Pour les remplacer, Lockheed Martin avait travaillé avec les responsables de la marine en vue d’adapter les manettes de jeu, qui peuvent coûter moins de 30 dollars, a écrit Newsweek.Le naufrage du submersibleLa communication avec le submersible exploité par OceanGate Expeditions, conçu pour emmener des touristes sur le site du naufrage du Titanic, a été perdue à partir du 18 juin, environ une heure et 45 minutes après la plongée.Les garde-côtes américains avaient annoncé le 22 juin avoir découvert un ""champ de débris"" dans l'Atlantique nord près de l'épave du Titanic grâce à un robot participant aux recherches internationales.L'équipage, qui comprenait le milliardaire britannique Hamish Harding, le vétéran français de l'exploration des fonds marins Paul-Henri Nargeolet, le fondateur d'une société américaine qui organise des visites de l'épave du Titanic, Stockton Rush, ainsi que l'homme d'affaires pakistanais Shahzada Dawood et son fils, ont été déclarés morts.","[[[""Les sous-marins nucléaires de la marine américaine utilisent les mêmes manettes de commande que le bathyscaphe de tourisme Titan d’Ocean Gate, qui a fait naufrage dans l’Atlantique à proximité de l’épave du Titanic, a relaté l’hebdomadaire américain Newsweek.Un correspondant de CBS News, David Pogue, qui avait voyagé à bord du Titan en 2022, a fait part à l'hebdomadaire de son étonnement sur le fait que le submersible soit contrôlé à l'aide d'une manette de jeu Logitech F710 Bluetooth.""], ['Il note également le fait que le bathyscaphe ne possédait aucune nacelle de secours.'], ['""Je ne pouvais m\'empêcher de remarquer combien de pièces de ce sous-marin semblaient improvisées [...].'], ['Il semble que ce submersible ait des éléments de MacGyver jerry-riggedness"", a-t-il indiqué.Un accessoire à bon prix et facilement maniableSelon le Newsweek, l’US Navy utilise des manettes Xbox 360 sur certains sous-marins depuis 2018.'], [""Le commandant Reed Koepp, ancien commandant de l'USS Colorado, a déclaré que les manettes coûtaient moins cher et étaient plus faciles à prendre en main pour les jeunes marins, grâce à leur expérience dans les jeux vidéo.""], ['Ces outils serviraient à manier les mâts photoniques qui ont remplacé les périscopes.Le joystick et le panneau de commande développés par Lockheed Martin, qui coûtent environ 38.000 dollars, seraient lourds et maladroits.'], ['Pour les remplacer, Lockheed Martin avait travaillé avec les responsables de la marine en vue d’adapter les manettes de jeu, qui peuvent coûter moins de 30 dollars, a écrit Newsweek.Le naufrage du submersibleLa communication avec le submersible exploité par OceanGate Expeditions, conçu pour emmener des touristes sur le site du naufrage du Titanic, a été perdue à partir du 18 juin, environ une heure et 45 minutes après la plongée.Les garde-côtes américains avaient annoncé le 22 juin avoir découvert un ""champ de débris"" dans l\'Atlantique nord près de l\'épave du Titanic grâce à un robot participant aux recherches internationales.L\'équipage, qui comprenait le milliardaire britannique Hamish Harding, le vétéran français de l\'exploration des fonds marins Paul-Henri Nargeolet, le fondateur d\'une société américaine qui organise des visites de l\'épave du Titanic, Stockton Rush, ainsi que l\'homme d\'affaires pakistanais Shahzada Dawood et son fils, ont été déclarés morts.']]]","[[['nucléaires', 'marine', 'américaine', 'manettes', 'commande', 'bathyscaphe', 'tourisme', 'titan', 'ocean', 'naufrage', 'atlantique', 'proximité', 'épave', 'titanic', 'hebdomadaire', 'américain', 'cbs', 'david', 'pogue', 'bord', 'titan', 'part', 'hebdomadaire', 'étonnement', 'submersible', 'aide', 'manette', 'jeu', 'logitech', 'bluetooth'], ['bathyscaphe', 'nacelle', 'secours'], ['pièces', 'improvisées'], ['submersible', 'éléments', 'jerry', 'accessoire', 'bon', 'prix', 'newsweek', 'us', 'navy', 'manettes', 'xbox'], ['commandant', 'koepp', 'ancien', 'commandant', 'uss', 'colorado', 'manettes', 'cher', 'faciles', 'main', 'jeunes', 'marins', 'grâce', 'expérience', 'jeux', 'vidéo'], ['outils', 'mâts', 'photoniques', 'joystick', 'panneau', 'commande', 'lockheed', 'martin', 'dollars', 'lourds', 'maladroits'], ['lockheed', 'martin', 'responsables', 'marine', 'vue', 'manettes', 'jeu', 'dollars', 'naufrage', 'submersiblela', 'communication', 'submersible', 'oceangate', 'expeditions', 'touristes', 'site', 'naufrage', 'titanic', 'juin', 'heure', 'minutes', 'américains', 'juin', 'champ', 'débris', 'atlantique', 'nord', 'épave', 'titanic', 'grâce', 'robot', 'recherches', 'équipage', 'milliardaire', 'britannique', 'hamish', 'harding', 'vétéran', 'français', 'exploration', 'fonds', 'marins', 'paul', 'henri', 'nargeolet', 'fondateur', 'société', 'américaine', 'visites', 'épave', 'titanic', 'stockton', 'rush', 'homme', 'affaires', 'pakistanais', 'fils', 'morts']]]","[[['Ocean Gate', 'Atlantique', 'Titan'], [], [], [], ['USS Colorado'], [], ['Atlantique']]]","[[['Newsweek', 'CBS News'], [], [], ['Newsweek', 'US Navy'], [], ['Lockheed Martin'], ['Lockheed Martin', 'OceanGate Expeditions']]]","[[['David Pogue'], [], [], [], ['Reed Koepp'], [], ['Hamish Harding', 'Paul-Henri Nargeolet', 'Shahzada Dawood']]]","{'nucléaires': 1, 'marine': 2, 'américaine': 2, 'manettes': 4, 'commande': 2, 'bathyscaphe': 2, 'tourisme': 1, 'titan': 2, 'ocean': 1, 'naufrage': 3, 'atlantique': 2, 'proximité': 1, 'épave': 3, 'titanic': 4, 'hebdomadaire': 2, 'américain': 1, 'cbs': 1, 'david': 1, 'pogue': 1, 'bord': 1, 'part': 1, 'étonnement': 1, 'submersible': 3, 'aide': 1, 'manette': 1, 'jeu': 2, 'logitech': 1, 'bluetooth': 1, 'nacelle': 1, 'secours': 1, 'pièces': 1, 'improvisées': 1, 'éléments': 1, 'jerry': 1, 'accessoire': 1, 'bon': 1, 'prix': 1, 'newsweek': 1, 'us': 1, 'navy': 1, 'xbox': 1, 'commandant': 2, 'koepp': 1, 'ancien': 1, 'uss': 1, 'colorado': 1, 'cher': 1, 'faciles': 1, 'main': 1, 'jeunes': 1, 'marins': 2, 'grâce': 2, 'expérience': 1, 'jeux': 1, 'vidéo': 1, 'outils': 1, 'mâts': 1, 'photoniques': 1, 'joystick': 1, 'panneau': 1, 'lockheed': 2, 'martin': 2, 'dollars': 2, 'lourds': 1, 'maladroits': 1, 'responsables': 1, 'vue': 1, 'submersiblela': 1, 'communication': 1, 'oceangate': 1, 'expeditions': 1, 'touristes': 1, 'site': 1, 'juin': 2, 'heure': 1, 'minutes': 1, 'américains': 1, 'champ': 1, 'débris': 1, 'nord': 1, 'robot': 1, 'recherches': 1, 'équipage': 1, 'milliardaire': 1, 'britannique': 1, 'hamish': 1, 'harding': 1, 'vétéran': 1, 'français': 1, 'exploration': 1, 'fonds': 1, 'paul': 1, 'henri': 1, 'nargeolet': 1, 'fondateur': 1, 'société': 1, 'visites': 1, 'stockton': 1, 'rush': 1, 'homme': 1, 'affaires': 1, 'pakistanais': 1, 'fils': 1, 'morts': 1}","{'Ocean Gate': 1, 'Atlantique': 2, 'Titan': 1, 'USS Colorado': 1}","{'Newsweek': 2, 'CBS News': 1, 'US Navy': 1, 'Lockheed Martin': 2, 'OceanGate Expeditions': 1}","{'David Pogue': 1, 'Reed Koepp': 1, 'Hamish Harding': 1, 'Paul-Henri Nargeolet': 1, 'Shahzada Dawood': 1}",2023,6,22
1687471200,https://fr.sputniknews.africa/20230623/un-fusil-amphibie-russe-sapprete-a-conquerir-des-marches-dafrique-et-dasie-1060119337.html,Un fusil-amphibie russe s’apprête à conquérir des marchés d’Afrique et d’Asie,"Le groupe Rostec russe lorgne les marchés des pays amicaux d’Afrique et d’Asie où il compte proposer le fusil-amphibie ADS pour les plongeurs de combat, a annoncé à Sputnik un responsable du Bureau d'études d'ingénierie instrumentale...","Les pays amicaux d’Afrique et d’Asie, qui ont de longues frontières maritimes, pourraient s’intéresser au nouveau fusil d’assaut russe pour les plongeurs de combat ADS, autrement appelé le ""fusil-amphibie"", a annoncé ce 23 juin à Sputnik le Bureau d'études d'ingénierie instrumentale (KBP), membre du groupe Rostec, au Salon international militaro-maritime à Kronstadt près de Saint-PétersbourgKBP fait la promotion de cette arme avec le concours de Rosoboronexport, l’agence russe d’exportation d’armements.""La priorité est réservée aux pays amicaux, y compris en Afrique et en Asie"", a indiqué un porte-parole de KBP.Conçu par le KBP spécialement pour les plongeurs de combat, le fusil d’assaut ADS de type Bullpup peut être utilisé tant sur terre que sous l’eau. Ses essais ayant terminé en 2016, l’arme est livrée aux Forces spéciales russes depuis 2019. Le fusil pèse 4,6 kg, sa longueur est de 685 mm. L’ADS est muni d’un lance-grenades.","[[['Les pays amicaux d’Afrique et d’Asie, qui ont de longues frontières maritimes, pourraient s’intéresser au nouveau fusil d’assaut russe pour les plongeurs de combat ADS, autrement appelé le ""fusil-amphibie"", a annoncé ce 23 juin à Sputnik le Bureau d\'études d\'ingénierie instrumentale (KBP), membre du groupe Rostec, au Salon international militaro-maritime à Kronstadt près de Saint-PétersbourgKBP fait la promotion de cette arme avec le concours de Rosoboronexport, l’agence russe d’exportation d’armements.'], ['""La priorité est réservée aux pays amicaux, y compris en Afrique et en Asie"", a indiqué un porte-parole de KBP.Conçu par le KBP spécialement pour les plongeurs de combat, le fusil d’assaut ADS de type Bullpup peut être utilisé tant sur terre que sous l’eau.'], ['Ses essais ayant terminé en 2016, l’arme est livrée aux Forces spéciales russes depuis 2019.'], ['Le fusil pèse 4,6 kg, sa longueur est de 685 mm.'], ['L’ADS est muni d’un lance-grenades.']]]","[[['pays', 'amicaux', 'afrique', 'asie', 'longues', 'frontières', 'maritimes', 'fusil', 'assaut', 'russe', 'plongeurs', 'combat', 'fusil', 'amphibie', 'juin', 'sputnik', 'bureau', 'études', 'ingénierie', 'instrumentale', 'kbp', 'membre', 'groupe', 'rostec', 'salon', 'international', 'militaro', 'maritime', 'kronstadt', 'promotion', 'arme', 'concours', 'rosoboronexport', 'agence', 'russe', 'exportation', 'armements'], ['priorité', 'pays', 'amicaux', 'afrique', 'asie', 'kbp', 'plongeurs', 'combat', 'fusil', 'assaut', 'ads', 'type', 'bullpup', 'terre', 'eau'], ['essais', 'arme', 'forces', 'spéciales', 'russes'], ['fusil', 'kg', 'longueur', 'mm'], ['ads', 'lance', 'grenades']]]","[[['Afrique', 'Asie', 'Kronstadt'], ['Afrique', 'Asie', 'KBP.Conçu', 'Bullpup'], [], [], []]]","[[['Sputnik', ""Bureau d'études d'ingénierie instrumentale"", 'Rostec', 'Salon international militaro-maritime', 'Saint-PétersbourgKBP'], [], ['Forces spéciales russes'], [], ['ADS']]]","[[[], [], [], [], []]]","{'pays': 2, 'amicaux': 2, 'afrique': 2, 'asie': 2, 'longues': 1, 'frontières': 1, 'maritimes': 1, 'fusil': 4, 'assaut': 2, 'russe': 2, 'plongeurs': 2, 'combat': 2, 'amphibie': 1, 'juin': 1, 'sputnik': 1, 'bureau': 1, 'études': 1, 'ingénierie': 1, 'instrumentale': 1, 'kbp': 2, 'membre': 1, 'groupe': 1, 'rostec': 1, 'salon': 1, 'international': 1, 'militaro': 1, 'maritime': 1, 'kronstadt': 1, 'promotion': 1, 'arme': 2, 'concours': 1, 'rosoboronexport': 1, 'agence': 1, 'exportation': 1, 'armements': 1, 'priorité': 1, 'ads': 2, 'type': 1, 'bullpup': 1, 'terre': 1, 'eau': 1, 'essais': 1, 'forces': 1, 'spéciales': 1, 'russes': 1, 'kg': 1, 'longueur': 1, 'mm': 1, 'lance': 1, 'grenades': 1}","{'Afrique': 2, 'Asie': 2, 'Kronstadt': 1, 'KBP.Conçu': 1, 'Bullpup': 1}","{'Sputnik': 1, ""Bureau d'études d'ingénierie instrumentale"": 1, 'Rostec': 1, 'Salon international militaro-maritime': 1, 'Saint-PétersbourgKBP': 1, 'Forces spéciales russes': 1, 'ADS': 1}",{},2023,6,22
