timestamp,url,title,description,content,content-segmented,kws-l,loc-l,org-l,per-l,kws,loc,org,per,year,month,day
1676156400,https://fr.sputniknews.africa/20230212/rechauffement-climatique-les-cactus-remplacent-la-neige-en-suisse-1057900154.html,Réchauffement climatique: les cactus remplacent la neige en Suisse,"Le manque de neige à basse altitude a favorisé la prolifération des cactus en Suisse. Les autorités s’inquiètent, car certaines espèces représentent une menace pour la biodiversité.","""Le monde entier est un cactus"", chantait en son temps Jacques Dutronc. Le célébré chanteur français ne croyait pas si bien dire, puisque les espèces de cactées invasives prolifèrent désormais dans les coins les plus insoupçonnés d’Europe.Dans le canton du Valais, en Suisse, les plantes épineuses remplacent ainsi peu à peu les edelweiss, rapporte le Guardian à Sion, capitale de la région, les figuiers de barbarie couvrent ainsi 23 à 30% de la couverture végétale basse. Le Tessin, les Grisons et même l’Italie voisine sont sous la menace.Ces cactus, importés en Suisse dès le XVIIIe siècle en provenance d’Amérique du Nord, profitent de la diminution de la couverture neigeuse pour prospérer. Contrairement aux idées reçues, les plantes ne souffrent pas du froid et ont ainsi pu s’acclimater au terrain helvète.""Ces espèces supportent -10°C ou -15°C sans aucun problème. Mais elle spréfèrent les endroits sec et n'aiment pas la couverture de neige"", explique au Guardian Peter Oliver Baumgartner, professeur de géologie à la retraite.Une aubaine, puisque la neige se fait de plus en plus rare à basse altitude ces dernières décennies, même dans les Alpes. Le nombre de jours de neige à 800 mètres a ainsi diminué de moitié en Suisse depuis 1970, selon MeteoSwiss.Cactus coriacesSi cette prolifération insolite peut faire sourire les touristes, elle n’en inquiète pas moins les autorités. Les cactus envahissent en effet les zones naturelles et certaines espèces représentent une menace pour la biodiversité. Elles monopolisent les sols, au détriment d’autres végétaux.""Lorsque vous avez ces cactus, rien d'autre ne pousse. Chaque rameau recouvre le sol et empêche les autres plantes de pousser à travers"", explique Yann Triponez, biologiste travaillant au service de la protection de la nature du Valais.Des campagnes de déracinement sont désormais à l’ordre du jour, mais le figuier de barbarie est une espèce coriace, qui se reproduit facilement et repousse lorsqu’elle est piétinée par des randonneurs ou laissée au sec pendant des mois.L’an dernier, les campagnes d’éradication avait d’ailleurs échoué aux alentours de Sion. Les plants arrachés avaient été laissés à l’abandon dans des espaces boisés, les autorités pensant que l’humidité et l’ombre les feraient pourrir. Mais les cactus avaient au contraire repris de plus belle. Les biologistes comme Oliver Baumgartner doutent désormais que l’espèce puisse être totalement éradiquée.","[[['""Le monde entier est un cactus"", chantait en son temps Jacques Dutronc.'], ['Le célébré chanteur français ne croyait pas si bien dire, puisque les espèces de cactées invasives prolifèrent désormais dans les coins les plus insoupçonnés d’Europe.Dans le canton du Valais, en Suisse, les plantes épineuses remplacent ainsi peu à peu les edelweiss, rapporte le Guardian à Sion, capitale de la région, les figuiers de barbarie couvrent ainsi 23 à 30% de la couverture végétale basse.'], ['Le Tessin, les Grisons et même l’Italie voisine sont sous la menace.Ces cactus, importés en Suisse dès le XVIIIe siècle en provenance d’Amérique du Nord, profitent de la diminution de la couverture neigeuse pour prospérer.'], ['Contrairement aux idées reçues, les plantes ne souffrent pas du froid et ont ainsi pu s’acclimater au terrain helvète.'], ['""Ces espèces supportent -10°C ou -15°C sans aucun problème.'], ['Mais elle spréfèrent les endroits sec et n\'aiment pas la couverture de neige"", explique au Guardian Peter Oliver Baumgartner, professeur de géologie à la retraite.Une aubaine, puisque la neige se fait de plus en plus rare à basse altitude ces dernières décennies, même dans les Alpes.'], ['Le nombre de jours de neige à 800 mètres a ainsi diminué de moitié en Suisse depuis 1970, selon MeteoSwiss.Cactus coriacesSi cette prolifération insolite peut faire sourire les touristes, elle n’en inquiète pas moins les autorités.'], ['Les cactus envahissent en effet les zones naturelles et certaines espèces représentent une menace pour la biodiversité.'], ['Elles monopolisent les sols, au détriment d’autres végétaux.'], ['""Lorsque vous avez ces cactus, rien d\'autre ne pousse.'], ['Chaque rameau recouvre le sol et empêche les autres plantes de pousser à travers"", explique Yann Triponez, biologiste travaillant au service de la protection de la nature du Valais.Des campagnes de déracinement sont désormais à l’ordre du jour, mais le figuier de barbarie est une espèce coriace, qui se reproduit facilement et repousse lorsqu’elle est piétinée par des randonneurs ou laissée au sec pendant des mois.L’an dernier, les campagnes d’éradication avait d’ailleurs échoué aux alentours de Sion.'], ['Les plants arrachés avaient été laissés à l’abandon dans des espaces boisés, les autorités pensant que l’humidité et l’ombre les feraient pourrir.'], ['Mais les cactus avaient au contraire repris de plus belle.'], ['Les biologistes comme Oliver Baumgartner doutent désormais que l’espèce puisse être totalement éradiquée.']]]","[[['monde', 'entier', 'cactus', 'temps', 'jacques'], ['chanteur', 'français', 'espèces', 'cactées', 'invasives', 'coins', 'insoupçonnés', 'canton', 'suisse', 'plantes', 'épineuses', 'edelweiss', 'guardian', 'sion', 'capitale', 'région', 'figuiers', 'barbarie', 'couverture', 'végétale', 'basse'], ['tessin', 'grisons', 'italie', 'voisine', 'cactus', 'suisse', 'xviiie', 'siècle', 'provenance', 'amérique', 'nord', 'diminution', 'couverture', 'neigeuse'], ['idées', 'plantes', 'froid', 'terrain', 'helvète'], ['espèces', 'c', 'c', 'problème'], ['endroits', 'sec', 'couverture', 'neige', 'baumgartner', 'professeur', 'géologie', 'aubaine', 'neige', 'rare', 'basse', 'altitude', 'dernières', 'décennies', 'alpes'], ['nombre', 'jours', 'neige', 'mètres', 'moitié', 'suisse', 'prolifération', 'insolite', 'touristes', 'inquiète', 'autorités'], ['cactus', 'zones', 'naturelles', 'espèces', 'menace', 'biodiversité'], ['sols', 'détriment', 'végétaux'], ['cactus'], ['rameau', 'sol', 'plantes', 'travers', 'yann', 'triponez', 'biologiste', 'service', 'protection', 'nature', 'campagnes', 'déracinement', 'ordre', 'jour', 'figuier', 'barbarie', 'espèce', 'coriace', 'randonneurs', 'sec', 'an', 'dernier', 'campagnes', 'éradication', 'alentours', 'sion'], ['plants', 'abandon', 'espaces', 'boisés', 'autorités', 'humidité', 'ombre'], ['cactus', 'contraire', 'belle'], ['biologistes', 'baumgartner', 'espèce']]]","[[[], ['Europe', 'canton du Valais', 'Suisse', 'Sion'], ['Tessin', 'Grisons', 'l’Italie', 'Suisse', 'Amérique du Nord'], [], [], ['Alpes'], ['Suisse'], [], [], [], ['Valais', 'Sion'], [], [], []]]","[[[], ['Guardian'], [], [], [], ['Guardian'], [], [], [], [], [], [], [], []]]","[[['Jacques Dutronc'], [], [], [], [], ['Peter Oliver Baumgartner'], [], [], [], [], ['rameau', 'Yann Triponez'], [], [], ['Oliver Baumgartner']]]","{'monde': 1, 'entier': 1, 'cactus': 5, 'temps': 1, 'jacques': 1, 'chanteur': 1, 'français': 1, 'espèces': 3, 'cactées': 1, 'invasives': 1, 'coins': 1, 'insoupçonnés': 1, 'canton': 1, 'suisse': 3, 'plantes': 3, 'épineuses': 1, 'edelweiss': 1, 'guardian': 1, 'sion': 2, 'capitale': 1, 'région': 1, 'figuiers': 1, 'barbarie': 2, 'couverture': 3, 'végétale': 1, 'basse': 2, 'tessin': 1, 'grisons': 1, 'italie': 1, 'voisine': 1, 'xviiie': 1, 'siècle': 1, 'provenance': 1, 'amérique': 1, 'nord': 1, 'diminution': 1, 'neigeuse': 1, 'idées': 1, 'froid': 1, 'terrain': 1, 'helvète': 1, 'c': 2, 'problème': 1, 'endroits': 1, 'sec': 2, 'neige': 3, 'baumgartner': 2, 'professeur': 1, 'géologie': 1, 'aubaine': 1, 'rare': 1, 'altitude': 1, 'dernières': 1, 'décennies': 1, 'alpes': 1, 'nombre': 1, 'jours': 1, 'mètres': 1, 'moitié': 1, 'prolifération': 1, 'insolite': 1, 'touristes': 1, 'inquiète': 1, 'autorités': 2, 'zones': 1, 'naturelles': 1, 'menace': 1, 'biodiversité': 1, 'sols': 1, 'détriment': 1, 'végétaux': 1, 'rameau': 1, 'sol': 1, 'travers': 1, 'yann': 1, 'triponez': 1, 'biologiste': 1, 'service': 1, 'protection': 1, 'nature': 1, 'campagnes': 2, 'déracinement': 1, 'ordre': 1, 'jour': 1, 'figuier': 1, 'espèce': 2, 'coriace': 1, 'randonneurs': 1, 'an': 1, 'dernier': 1, 'éradication': 1, 'alentours': 1, 'plants': 1, 'abandon': 1, 'espaces': 1, 'boisés': 1, 'humidité': 1, 'ombre': 1, 'contraire': 1, 'belle': 1, 'biologistes': 1}","{'Europe': 1, 'canton du Valais': 1, 'Suisse': 3, 'Sion': 2, 'Tessin': 1, 'Grisons': 1, 'l’Italie': 1, 'Amérique du Nord': 1, 'Alpes': 1, 'Valais': 1}",{'Guardian': 2},"{'Jacques Dutronc': 1, 'Peter Oliver Baumgartner': 1, 'rameau': 1, 'Yann Triponez': 1, 'Oliver Baumgartner': 1}",2023,2,11
1676156400,https://fr.sputniknews.africa/20230212/sabotage-des-nord-stream-un-eurodepute-explique-les-mobiles-des-etats-unis-1057899848.html,Sabotage des Nord Stream: un eurodéputé explique les mobiles des États-Unis,"Les États-Unis ont organisé le sabotage des Nord Stream afin de rompre les liens économiques entre Moscou et Berlin, avance l’eurodéputé allemand Gunnar Beck (AfD).","Le sujet du sabotage des gazoducs Nord Stream refait surface après les récentes révélations du journaliste d’investigation américain Seymour Hersh affirmant que les États-Unis seraient à son origine.L’eurodéputé Gunnar Beck (Alternative pour l’Allemagne, AfD) a livré sa vision des mobiles américains au quotidien Izvestia.Ces Russes étranges qui font des choses étrangesSelon lui, les pays occidentaux ne s’intéressent pas à l’enquête ouverte pour sabotage. Pour eux, la version d’après laquelle la Russie a fait sauter les gazoducs serait la plus convenable.""Personne ne sait pourquoi ils [les Russes, ndlr] se sont fait du tort, mais ce sont des hommes étranges et ils font des choses étranges. Nous devons les craindre"", a détaillé le député.Mais beaucoup en Allemagne n’y croient pas, malgré toutes les tentatives de diabolisation de Moscou.Les raisons de Washington""Les États-Unis n’ont pas aimé le rapprochement économique entre l’Allemagne et la Russie. Ils font quelque chose ou ont tenté de faire quelque chose qui puisse rompre ces relations. Ils font comprendre à tous leurs alliés que c’est ce qu’ils ont fait et qu’ils ne veulent aucun bruit à ce sujet"", a-t-il indiqué.M.Beck estime également que le but était non seulement de rompre les liens énergétiques entre la Russie et l’Allemagne, mais aussi entre la Russie et la plupart des pays d’Europe occidentale et orientale.Seymour Hersh accuseÀ l'automne dernier, les pays occidentaux avaient accusé la Russie d’avoir fait sauter trois tronçons des gazoducs Nord Stream 1 et Nord Stream 2. Moscou en avait accusé les Anglo-Saxons.Le 8 février, le journaliste américain Seymour Hersh a affirmé dans un article que des plongeurs de l’US Navy avaient posé des explosifs sur les pipelines et que ces explosifs avaient été activés trois mois plus tard par des Norvégiens.La Maison-Blanche, la CIA et la Norvège ont démenti dans la foulée les mises en cause du journaliste.","[[['Le sujet du sabotage des gazoducs Nord Stream refait surface après les récentes révélations du journaliste d’investigation américain Seymour Hersh affirmant que les États-Unis seraient à son origine.L’eurodéputé Gunnar Beck (Alternative pour l’Allemagne, AfD) a livré sa vision des mobiles américains au quotidien Izvestia.Ces Russes étranges qui font des choses étrangesSelon lui, les pays occidentaux ne s’intéressent pas à l’enquête ouverte pour sabotage.'], ['Pour eux, la version d’après laquelle la Russie a fait sauter les gazoducs serait la plus convenable.'], ['""Personne ne sait pourquoi ils [les Russes, ndlr] se sont fait du tort, mais ce sont des hommes étranges et ils font des choses étranges.'], ['Nous devons les craindre"", a détaillé le député.Mais beaucoup en Allemagne n’y croient pas, malgré toutes les tentatives de diabolisation de Moscou.Les raisons de Washington""Les États-Unis n’ont pas aimé le rapprochement économique entre l’Allemagne et la Russie.'], ['Ils font quelque chose ou ont tenté de faire quelque chose qui puisse rompre ces relations.'], ['Ils font comprendre à tous leurs alliés que c’est ce qu’ils ont fait et qu’ils ne veulent aucun bruit à ce sujet"", a-t-il indiqué.M.Beck estime également que le but était non seulement de rompre les liens énergétiques entre la Russie et l’Allemagne, mais aussi entre la Russie et la plupart des pays d’Europe occidentale et orientale.Seymour Hersh accuseÀ l\'automne dernier, les pays occidentaux avaient accusé la Russie d’avoir fait sauter trois tronçons des gazoducs Nord Stream 1 et Nord Stream 2.'], ['Moscou en avait accusé les Anglo-Saxons.Le 8 février, le journaliste américain Seymour Hersh a affirmé dans un article que des plongeurs de l’US Navy avaient posé des explosifs sur les pipelines et que ces explosifs avaient été activés trois mois plus tard par des Norvégiens.La Maison-Blanche, la CIA et la Norvège ont démenti dans la foulée les mises en cause du journaliste.']]]","[[['sujet', 'sabotage', 'gazoducs', 'nord', 'stream', 'surface', 'récentes', 'révélations', 'journaliste', 'investigation', 'américain', 'seymour', 'hersh', 'eurodéputé', 'gunnar', 'beck', 'alternative', 'allemagne', 'afd', 'vision', 'mobiles', 'américains', 'quotidien', 'russes', 'étranges', 'choses', 'étrangesselon', 'pays', 'occidentaux', 'enquête', 'sabotage'], ['version', 'russie', 'gazoducs', 'convenable'], ['russes', 'ndlr', 'tort', 'hommes', 'étranges', 'choses', 'étranges'], ['allemagne', 'tentatives', 'diabolisation', 'raisons', 'rapprochement', 'économique', 'allemagne', 'russie'], ['chose', 'chose', 'relations'], ['alliés', 'bruit', 'sujet', 'but', 'liens', 'énergétiques', 'russie', 'allemagne', 'russie', 'plupart', 'pays', 'europe', 'occidentale', 'hersh', 'automne', 'dernier', 'pays', 'occidentaux', 'russie', 'tronçons', 'gazoducs', 'nord', 'stream', 'nord', 'stream'], ['moscou', 'février', 'journaliste', 'américain', 'seymour', 'hersh', 'article', 'plongeurs', 'us', 'explosifs', 'pipelines', 'explosifs', 'mois', 'maison', 'blanche', 'cia', 'norvège', 'foulée', 'mises', 'cause', 'journaliste']]]","[[['Nord', 'États-Unis'], ['Russie'], [], ['Allemagne', 'Moscou', 'Washington""Les États-Unis', 'Allemagne', 'Russie'], [], ['Russie', 'Allemagne', 'Russie', 'Europe', 'Russie', 'Nord'], ['Moscou', 'Norvège', 'Maison-Blanche', 'Norvège']]]","[[['Alternative pour l’Allemagne', 'AfD'], [], [], [], [], [], ['Anglo-Saxons', 'US Navy', 'CIA']]]","[[['Seymour Hersh', 'Gunnar Beck'], [], [], [], [], ['M.Beck', 'Seymour Hersh'], ['Seymour Hersh']]]","{'sujet': 2, 'sabotage': 2, 'gazoducs': 3, 'nord': 3, 'stream': 3, 'surface': 1, 'récentes': 1, 'révélations': 1, 'journaliste': 3, 'investigation': 1, 'américain': 2, 'seymour': 2, 'hersh': 3, 'eurodéputé': 1, 'gunnar': 1, 'beck': 1, 'alternative': 1, 'allemagne': 4, 'afd': 1, 'vision': 1, 'mobiles': 1, 'américains': 1, 'quotidien': 1, 'russes': 2, 'étranges': 3, 'choses': 2, 'étrangesselon': 1, 'pays': 3, 'occidentaux': 2, 'enquête': 1, 'version': 1, 'russie': 5, 'convenable': 1, 'ndlr': 1, 'tort': 1, 'hommes': 1, 'tentatives': 1, 'diabolisation': 1, 'raisons': 1, 'rapprochement': 1, 'économique': 1, 'chose': 2, 'relations': 1, 'alliés': 1, 'bruit': 1, 'but': 1, 'liens': 1, 'énergétiques': 1, 'plupart': 1, 'europe': 1, 'occidentale': 1, 'automne': 1, 'dernier': 1, 'tronçons': 1, 'moscou': 1, 'février': 1, 'article': 1, 'plongeurs': 1, 'us': 1, 'explosifs': 2, 'pipelines': 1, 'mois': 1, 'maison': 1, 'blanche': 1, 'cia': 1, 'norvège': 1, 'foulée': 1, 'mises': 1, 'cause': 1}","{'Nord': 2, 'États-Unis': 1, 'Russie': 5, 'Allemagne': 3, 'Moscou': 2, 'Washington""Les États-Unis': 1, 'Europe': 1, 'Norvège': 2, 'Maison-Blanche': 1}","{'Alternative pour l’Allemagne': 1, 'AfD': 1, 'Anglo-Saxons': 1, 'US Navy': 1, 'CIA': 1}","{'Seymour Hersh': 3, 'Gunnar Beck': 1, 'M.Beck': 1}",2023,2,11
1676156400,https://fr.sputniknews.africa/20230212/lunion-africaine-etend-le-projet-de-grande-muraille-verte-a-lafrique-australe-1057899690.html,L’Union africaine étend le projet de Grande muraille verte à l’Afrique australe,"Le projet de Grande muraille verte n’a atteint, depuis 2007, que 20% de ses objectifs. En cause, conflits et manque de financement. L’initiative sera désormais étendue vers des zones australes.","L'Union africaine (UA) a décidé d’étendre le projet de Grande muraille verte pour le Sahara et le Sahel, qui réunit onze pays du Sénégal à Djibouti, à l’Afrique australe, relate Bloomberg. L'initiative vise à planter des millions d'arbres sur le continent pour lutter contre les effets de la désertification.Cette décision a été prise en raison des défis sécuritaires rencontrés dans certaines régions. Ainsi, il est presque impossible de travailler au Mali, au Burkina Faso, au Niger, au Tchad, au Nigeria, en Éthiopie, en Érythrée et dans le nord du Cameroun en raison de l'insécurité et du détournement de fonds, a expliqué à l'agence Paul Tangem, coordinateur de l'Union africaine pour l'initiative.Impossible d'appliquer le programme""Nous nous tournons maintenant vers des zones qui présentent moins de menaces pour la sécurité et sont moins sujettes aux conflits, a-t-il déclaré. Nous nous dirigeons également vers la partie sud de l'Afrique. Nous sommes conscients que Madagascar, l'Angola, la Namibie et l'Afrique du Sud ont subi ces dernières années de graves sécheresses et la désertification. La Grande muraille verte s'étend désormais jusqu'à ces pays.""Selon lui, le changement climatique, les migrations, le manque de financement et les conflits ont entravé les efforts de plantation d'arbres dans les zones concernées au départ par le projet.20% des objectifs atteintsLancée en 2007 par l’UA, l'initiative prévoyait initialement de planter des millions d’arbres sur une bande de 15 km de large traversant tout le continent en passant par 11 pays. D’ici 2030, plus de 95 millions d’hectares de terres devaient être restaurés. En 2013, le concept a été revu à un vaste programme de gestion durable des écosystèmes et d’amélioration des conditions de vie des populations rurales touchées par la dégradation des terres.Selon une étude de l’Onu publiée en 2020, la Grande muraille verte n’avait atteint qu’environ 20% de ses objectifs.","[[[""L'Union africaine (UA) a décidé d’étendre le projet de Grande muraille verte pour le Sahara et le Sahel, qui réunit onze pays du Sénégal à Djibouti, à l’Afrique australe, relate Bloomberg.""], [""L'initiative vise à planter des millions d'arbres sur le continent pour lutter contre les effets de la désertification.Cette décision a été prise en raison des défis sécuritaires rencontrés dans certaines régions.""], ['Ainsi, il est presque impossible de travailler au Mali, au Burkina Faso, au Niger, au Tchad, au Nigeria, en Éthiopie, en Érythrée et dans le nord du Cameroun en raison de l\'insécurité et du détournement de fonds, a expliqué à l\'agence Paul Tangem, coordinateur de l\'Union africaine pour l\'initiative.Impossible d\'appliquer le programme""Nous nous tournons maintenant vers des zones qui présentent moins de menaces pour la sécurité et sont moins sujettes aux conflits, a-t-il déclaré.'], [""Nous nous dirigeons également vers la partie sud de l'Afrique.""], [""Nous sommes conscients que Madagascar, l'Angola, la Namibie et l'Afrique du Sud ont subi ces dernières années de graves sécheresses et la désertification.""], [""La Grande muraille verte s'étend désormais jusqu'à ces pays.""], ['""Selon lui, le changement climatique, les migrations, le manque de financement et les conflits ont entravé les efforts de plantation d\'arbres dans les zones concernées au départ par le projet.20% des objectifs atteintsLancée en 2007 par l’UA, l\'initiative prévoyait initialement de planter des millions d’arbres sur une bande de 15 km de large traversant tout le continent en passant par 11 pays.'], ['D’ici 2030, plus de 95 millions d’hectares de terres devaient être restaurés.'], ['En 2013, le concept a été revu à un vaste programme de gestion durable des écosystèmes et d’amélioration des conditions de vie des populations rurales touchées par la dégradation des terres.Selon une étude de l’Onu publiée en 2020, la Grande muraille verte n’avait atteint qu’environ 20% de ses objectifs.']]]","[[['union', 'africaine', 'ua', 'projet', 'grande', 'muraille', 'verte', 'sahara', 'sahel', 'pays', 'sénégal', 'djibouti', 'afrique', 'australe', 'bloomberg'], ['initiative', 'millions', 'arbres', 'continent', 'effets', 'décision', 'raison', 'défis', 'sécuritaires', 'régions'], ['impossible', 'mali', 'burkina', 'faso', 'tchad', 'nigeria', 'éthiopie', 'érythrée', 'nord', 'cameroun', 'raison', 'insécurité', 'détournement', 'fonds', 'agence', 'paul', 'tangem', 'coordinateur', 'union', 'africaine', 'zones', 'menaces', 'sécurité', 'sujettes', 'conflits'], ['partie', 'sud', 'afrique'], ['conscients', 'madagascar', 'angola', 'namibie', 'afrique', 'sud', 'dernières', 'années', 'graves', 'sécheresses', 'désertification'], ['grande', 'muraille', 'verte', 'pays'], ['changement', 'climatique', 'migrations', 'manque', 'financement', 'conflits', 'efforts', 'plantation', 'arbres', 'zones', 'départ', 'objectifs', 'initiative', 'millions', 'arbres', 'bande', 'km', 'large', 'continent', 'pays'], ['millions', 'hectares', 'terres'], ['concept', 'vaste', 'programme', 'gestion', 'durable', 'écosystèmes', 'amélioration', 'conditions', 'vie', 'populations', 'rurales', 'dégradation', 'étude', 'onu', 'grande', 'muraille', 'verte', 'objectifs']]]","[[['Sahara', 'Sahel', 'Sénégal', 'Djibouti', 'l’Afrique'], [], ['Mali', 'Burkina Faso', 'Niger', 'Tchad', 'Nigeria', 'Éthiopie', 'Érythrée', 'Cameroun'], ['Afrique'], ['Madagascar', 'Angola', 'Namibie', 'Afrique du Sud'], [], [], [], []]]","[[['Union africaine', 'UA'], [], ['Union africaine'], [], [], [], ['UA'], [], ['Onu']]]","[[['Bloomberg'], [], ['Paul Tangem'], [], [], [], [], [], []]]","{'union': 2, 'africaine': 2, 'ua': 1, 'projet': 1, 'grande': 3, 'muraille': 3, 'verte': 3, 'sahara': 1, 'sahel': 1, 'pays': 3, 'sénégal': 1, 'djibouti': 1, 'afrique': 3, 'australe': 1, 'bloomberg': 1, 'initiative': 2, 'millions': 3, 'arbres': 3, 'continent': 2, 'effets': 1, 'décision': 1, 'raison': 2, 'défis': 1, 'sécuritaires': 1, 'régions': 1, 'impossible': 1, 'mali': 1, 'burkina': 1, 'faso': 1, 'tchad': 1, 'nigeria': 1, 'éthiopie': 1, 'érythrée': 1, 'nord': 1, 'cameroun': 1, 'insécurité': 1, 'détournement': 1, 'fonds': 1, 'agence': 1, 'paul': 1, 'tangem': 1, 'coordinateur': 1, 'zones': 2, 'menaces': 1, 'sécurité': 1, 'sujettes': 1, 'conflits': 2, 'partie': 1, 'sud': 2, 'conscients': 1, 'madagascar': 1, 'angola': 1, 'namibie': 1, 'dernières': 1, 'années': 1, 'graves': 1, 'sécheresses': 1, 'désertification': 1, 'changement': 1, 'climatique': 1, 'migrations': 1, 'manque': 1, 'financement': 1, 'efforts': 1, 'plantation': 1, 'départ': 1, 'objectifs': 2, 'bande': 1, 'km': 1, 'large': 1, 'hectares': 1, 'terres': 1, 'concept': 1, 'vaste': 1, 'programme': 1, 'gestion': 1, 'durable': 1, 'écosystèmes': 1, 'amélioration': 1, 'conditions': 1, 'vie': 1, 'populations': 1, 'rurales': 1, 'dégradation': 1, 'étude': 1, 'onu': 1}","{'Sahara': 1, 'Sahel': 1, 'Sénégal': 1, 'Djibouti': 1, 'l’Afrique': 1, 'Mali': 1, 'Burkina Faso': 1, 'Niger': 1, 'Tchad': 1, 'Nigeria': 1, 'Éthiopie': 1, 'Érythrée': 1, 'Cameroun': 1, 'Afrique': 1, 'Madagascar': 1, 'Angola': 1, 'Namibie': 1, 'Afrique du Sud': 1}","{'Union africaine': 2, 'UA': 2, 'Onu': 1}","{'Bloomberg': 1, 'Paul Tangem': 1}",2023,2,11
