timestamp,url,title,description,content,content-segmented,kws-l,loc-l,org-l,per-l,kws,loc,org,per,year,month,day
1685743200,https://fr.sputniknews.africa/20230603/souhaitant-rejoindre-les-brics-riyad-constate-la-croissance-de-ses-echanges-commerciaux-avec-eux-1059696448.html,"Souhaitant rejoindre les BRICS, Riyad constate la croissance de ses échanges commerciaux avec eux","En 2022, Riyad a justifié son titre de plus grand partenaire commercial au Moyen-Orient des pays des BRICS. Le ministre saoudien des Affaires étrangères a fait part d’une croissance de 32 milliards de dollars des échanges commerciaux avec...","Aspirant à adhérer aux BRICS, l’Arabie saoudite a constaté la croissance considérable de ses échanges commerciaux avec les pays membres.""Le royaume reste le plus grand partenaire commercial du groupe des BRICS au Moyen-Orient. La valeur totale du commerce bilatéral avec [les pays membres] est passée de 81 milliards de dollars en 2017 à 128 milliards en 2021"", a fait savoir le 2 juin le chef de la diplomatie saoudienne.Ainsi, le volume total a dépassé les 160 milliards de dollars en 2022.Selon le ministre saoudien des Affaires étrangères, le prince Faisal ben Farhane ben Abdoullah, l'Arabie saoudite partage les valeurs fondamentales avec les BRICS. Le royaume estime que les relations entre les pays doivent être fondées sur les principes de respect de la souveraineté, de non-ingérence et d'adhésion au droit international.Vers l’élargissement des BRICSComprenant actuellement cinq pays -à savoir le Brésil, la Russie, l'Inde, la Chine et l'Afrique du Sud-, les BRICS représentent à eux seuls 40% de la population mondiale et près d'un tiers de l'économie mondiale. Leur dernier évènement a réuni les ministres des Affaires étrangères de ses membres et ceux de 12 pays du Sud global qui souhaitent rejoindre le groupe.Outre l’Arabie saoudite, figurent par exemple l'Iran, le Gabon, la République démocratique du Congo ou encore l'Égypte et les Émirats arabes unis.","[[['Aspirant à adhérer aux BRICS, l’Arabie saoudite a constaté la croissance considérable de ses échanges commerciaux avec les pays membres.'], ['""Le royaume reste le plus grand partenaire commercial du groupe des BRICS au Moyen-Orient.'], ['La valeur totale du commerce bilatéral avec [les pays membres] est passée de 81 milliards de dollars en 2017 à 128 milliards en 2021"", a fait savoir le 2 juin le chef de la diplomatie saoudienne.Ainsi, le volume total a dépassé les 160 milliards de dollars en 2022.Selon le ministre saoudien des Affaires étrangères, le prince Faisal ben Farhane ben Abdoullah, l\'Arabie saoudite partage les valeurs fondamentales avec les BRICS.'], [""Le royaume estime que les relations entre les pays doivent être fondées sur les principes de respect de la souveraineté, de non-ingérence et d'adhésion au droit international.Vers l’élargissement des BRICSComprenant actuellement cinq pays -à savoir le Brésil, la Russie, l'Inde, la Chine et l'Afrique du Sud-, les BRICS représentent à eux seuls 40% de la population mondiale et près d'un tiers de l'économie mondiale.""], [""Leur dernier évènement a réuni les ministres des Affaires étrangères de ses membres et ceux de 12 pays du Sud global qui souhaitent rejoindre le groupe.Outre l’Arabie saoudite, figurent par exemple l'Iran, le Gabon, la République démocratique du Congo ou encore l'Égypte et les Émirats arabes unis.""]]]","[[['brics', 'arabie', 'saoudite', 'croissance', 'considérable', 'échanges', 'commerciaux', 'pays', 'membres'], ['royaume', 'grand', 'partenaire', 'commercial', 'groupe', 'brics'], ['valeur', 'totale', 'commerce', 'bilatéral', 'pays', 'membres', 'milliards', 'dollars', 'milliards', 'juin', 'chef', 'diplomatie', 'volume', 'total', 'milliards', 'dollars', 'ministre', 'saoudien', 'affaires', 'étrangères', 'prince', 'ben', 'farhane', 'ben', 'abdoullah', 'arabie', 'saoudite', 'partage', 'valeurs', 'fondamentales', 'brics'], ['royaume', 'relations', 'pays', 'principes', 'respect', 'souveraineté', 'adhésion', 'droit', 'élargissement', 'pays', 'brésil', 'russie', 'inde', 'chine', 'afrique', 'brics', 'population', 'mondiale', 'tiers', 'économie', 'mondiale'], ['dernier', 'évènement', 'ministres', 'affaires', 'étrangères', 'membres', 'pays', 'sud', 'global', 'arabie', 'saoudite', 'exemple', 'iran', 'gabon', 'république', 'démocratique', 'congo', 'égypte', 'émirats', 'arabes', 'unis']]]","[[['Arabie saoudite'], [], ['Arabie saoudite'], ['Brésil', 'Russie', 'Inde', 'Chine', 'Afrique du Sud-'], ['du Sud', 'Arabie saoudite', 'Iran', 'Gabon', 'République démocratique du Congo', 'Égypte', 'Émirats arabes unis']]]","[[['BRICS'], ['BRICS', 'Moyen-Orient'], ['ministre saoudien des Affaires étrangères', 'BRICS'], ['BRICS'], ['Affaires étrangères de ses membres']]]","[[[], [], ['Faisal ben'], [], []]]","{'brics': 4, 'arabie': 3, 'saoudite': 3, 'croissance': 1, 'considérable': 1, 'échanges': 1, 'commerciaux': 1, 'pays': 5, 'membres': 3, 'royaume': 2, 'grand': 1, 'partenaire': 1, 'commercial': 1, 'groupe': 1, 'valeur': 1, 'totale': 1, 'commerce': 1, 'bilatéral': 1, 'milliards': 3, 'dollars': 2, 'juin': 1, 'chef': 1, 'diplomatie': 1, 'volume': 1, 'total': 1, 'ministre': 1, 'saoudien': 1, 'affaires': 2, 'étrangères': 2, 'prince': 1, 'ben': 2, 'farhane': 1, 'abdoullah': 1, 'partage': 1, 'valeurs': 1, 'fondamentales': 1, 'relations': 1, 'principes': 1, 'respect': 1, 'souveraineté': 1, 'adhésion': 1, 'droit': 1, 'élargissement': 1, 'brésil': 1, 'russie': 1, 'inde': 1, 'chine': 1, 'afrique': 1, 'population': 1, 'mondiale': 2, 'tiers': 1, 'économie': 1, 'dernier': 1, 'évènement': 1, 'ministres': 1, 'sud': 1, 'global': 1, 'exemple': 1, 'iran': 1, 'gabon': 1, 'république': 1, 'démocratique': 1, 'congo': 1, 'égypte': 1, 'émirats': 1, 'arabes': 1, 'unis': 1}","{'Arabie saoudite': 3, 'Brésil': 1, 'Russie': 1, 'Inde': 1, 'Chine': 1, 'Afrique du Sud-': 1, 'du Sud': 1, 'Iran': 1, 'Gabon': 1, 'République démocratique du Congo': 1, 'Égypte': 1, 'Émirats arabes unis': 1}","{'BRICS': 4, 'Moyen-Orient': 1, 'ministre saoudien des Affaires étrangères': 1, 'Affaires étrangères de ses membres': 1}",{'Faisal ben': 1},2023,6,2
1685743200,https://fr.sputniknews.africa/20230603/su-27-mi-8-munitions-etrangeres-ce-que-lukraine-a-perdu-en-24h-1059693080.html,"Su-27, Mi-8, munitions étrangères: ce que l’Ukraine a perdu en 24h","Les combats n’ont pas cessé pendant ces dernières 24h sur l’axe de Donetsk, les plus intenses ayant marqué les directions de Maryinka et d’Avdeïevka, selon le récent bilan de la Défense russe. Les forces ukrainiennes ont notamment perdu un...","Durant ces dernières 24h, les forces russes ont détruit un campement d’une formation nationaliste ukrainienne et un point d’observation des forces de Kiev. En outre, l’aviation russe a abattu un Su-27, un hélicoptère Mi-8, alors que la défense antiaérienne a intercepté deux missiles de croisière Storm Shadow, sept projectiles de HIMARS.Les forces ukrainiennes ont perdu plus de 580 militaires, dont le plus grand nombre sur l’axe de Donetsk. Dans cette zone, les combats les plus intenses sont menés par l’unité spéciale Akhmat dans la direction tactique de Maryinka et par les unités du 1er corps d’armée dans la zone d’Avdeïevka en république populaire de Donetsk (RPD).En ces dernières 24h, les forces russes ont détruit un char, un véhicule de personnel, huit autres véhicules, des obusier Msta-B et D-30, ainsi qu’un canon automoteur Gvozdika. Un stock de munitions a également été anéantie.Destructions axe par axe:Axe de Koupiansk: les forces russes ont mis fin aux activités de deux groupes de sabotage et de renseignement ukrainien, elles ont détruit un char, un véhicule, ainsi que deux lance-roquettes multiples Grad.Axe de Krasny Liman: les activités d’un groupe de sabotage et de renseignement ukrainien ont été coupées court. L’armée russe a en outre anéanti deux pickups, deux canons automoteurs (Gvozdika et Akatsiya), ainsi que des obusiers D-20 et D-30. Un stock de munitions a été détruit.Axe de Donetsk-Sud et de Zaporojié: les forces ukrainiennes ont perdu un char, un véhicule de combat blindé, 13 autres véhicules, un canon d’artillerie automoteur Krab de fabrication polonaise, deux obusiers D-30, un obusier Msta-B et un canon automoteur Gvozdika.Axe de Kherson: les pertes de Kiev se montent à deux pickup, un canon automoteur Akatsiya et un stock de munitions.","[[['Durant ces dernières 24h, les forces russes ont détruit un campement d’une formation nationaliste ukrainienne et un point d’observation des forces de Kiev.'], ['En outre, l’aviation russe a abattu un Su-27, un hélicoptère Mi-8, alors que la défense antiaérienne a intercepté deux missiles de croisière Storm Shadow, sept projectiles de HIMARS.Les forces ukrainiennes ont perdu plus de 580 militaires, dont le plus grand nombre sur l’axe de Donetsk.'], ['Dans cette zone, les combats les plus intenses sont menés par l’unité spéciale Akhmat dans la direction tactique de Maryinka et par les unités du 1er corps d’armée dans la zone d’Avdeïevka en république populaire de Donetsk (RPD).En ces dernières 24h, les forces russes ont détruit un char, un véhicule de personnel, huit autres véhicules, des obusier Msta-B et D-30, ainsi qu’un canon automoteur Gvozdika.'], ['Un stock de munitions a également été anéantie.Destructions axe par axe:Axe de Koupiansk: les forces russes ont mis fin aux activités de deux groupes de sabotage et de renseignement ukrainien, elles ont détruit un char, un véhicule, ainsi que deux lance-roquettes multiples Grad.Axe de Krasny Liman: les activités d’un groupe de sabotage et de renseignement ukrainien ont été coupées court.'], ['L’armée russe a en outre anéanti deux pickups, deux canons automoteurs (Gvozdika et Akatsiya), ainsi que des obusiers D-20 et D-30.'], ['Un stock de munitions a été détruit.Axe de Donetsk-Sud et de Zaporojié: les forces ukrainiennes ont perdu un char, un véhicule de combat blindé, 13 autres véhicules, un canon d’artillerie automoteur Krab de fabrication polonaise, deux obusiers D-30, un obusier Msta-B et un canon automoteur Gvozdika.Axe de Kherson: les pertes de Kiev se montent à deux pickup, un canon automoteur Akatsiya et un stock de munitions.']]]","[[['dernières', 'forces', 'russes', 'campement', 'formation', 'nationaliste', 'ukrainienne', 'point', 'observation', 'forces', 'kiev'], ['aviation', 'russe', 'hélicoptère', 'défense', 'antiaérienne', 'missiles', 'croisière', 'shadow', 'projectiles', 'forces', 'ukrainiennes', 'militaires', 'grand', 'nombre', 'axe', 'donetsk'], ['zone', 'combats', 'intenses', 'unité', 'spéciale', 'akhmat', 'direction', 'tactique', 'maryinka', 'unités', 'corps', 'armée', 'zone', 'avdeïevka', 'république', 'populaire', 'donetsk', 'dernières', 'forces', 'russes', 'char', 'véhicule', 'personnel', 'véhicules', 'obusier', 'msta', 'b', 'canon', 'automoteur', 'gvozdika'], ['stock', 'munitions', 'axe', 'axe', 'axe', 'koupiansk', 'forces', 'russes', 'fin', 'activités', 'groupes', 'sabotage', 'renseignement', 'ukrainien', 'char', 'véhicule', 'roquettes', 'multiples', 'liman', 'activités', 'groupe', 'sabotage', 'renseignement', 'ukrainien', 'court'], ['armée', 'russe', 'pickups', 'canons', 'automoteurs', 'gvozdika', 'akatsiya', 'obusiers'], ['stock', 'munitions', 'donetsk', 'sud', 'zaporojié', 'forces', 'ukrainiennes', 'char', 'véhicule', 'combat', 'blindé', 'véhicules', 'canon', 'artillerie', 'automoteur', 'krab', 'fabrication', 'polonaise', 'obusiers', 'obusier', 'msta', 'b', 'canon', 'automoteur', 'kherson', 'pertes', 'kiev', 'pickup', 'canon', 'automoteur', 'akatsiya', 'stock', 'munitions']]]","[[['Kiev'], ['HIMARS.Les', 'Donetsk'], ['zone d’Avdeïevka', 'république populaire de Donetsk', 'RPD).En', 'D-30'], ['Koupiansk'], ['Akatsiya'], ['Donetsk-Sud', 'Zaporojié', 'Krab', 'Kherson', 'Kiev']]]","[[[], [], [], ['Axe'], ['Gvozdika'], ['Gvozdika']]]","[[[], [], ['Msta-B'], ['Krasny Liman'], [], ['Msta-B']]]","{'dernières': 2, 'forces': 6, 'russes': 3, 'campement': 1, 'formation': 1, 'nationaliste': 1, 'ukrainienne': 1, 'point': 1, 'observation': 1, 'kiev': 2, 'aviation': 1, 'russe': 2, 'hélicoptère': 1, 'défense': 1, 'antiaérienne': 1, 'missiles': 1, 'croisière': 1, 'shadow': 1, 'projectiles': 1, 'ukrainiennes': 2, 'militaires': 1, 'grand': 1, 'nombre': 1, 'axe': 4, 'donetsk': 3, 'zone': 2, 'combats': 1, 'intenses': 1, 'unité': 1, 'spéciale': 1, 'akhmat': 1, 'direction': 1, 'tactique': 1, 'maryinka': 1, 'unités': 1, 'corps': 1, 'armée': 2, 'avdeïevka': 1, 'république': 1, 'populaire': 1, 'char': 3, 'véhicule': 3, 'personnel': 1, 'véhicules': 2, 'obusier': 2, 'msta': 2, 'b': 2, 'canon': 4, 'automoteur': 4, 'gvozdika': 2, 'stock': 3, 'munitions': 3, 'koupiansk': 1, 'fin': 1, 'activités': 2, 'groupes': 1, 'sabotage': 2, 'renseignement': 2, 'ukrainien': 2, 'roquettes': 1, 'multiples': 1, 'liman': 1, 'groupe': 1, 'court': 1, 'pickups': 1, 'canons': 1, 'automoteurs': 1, 'akatsiya': 2, 'obusiers': 2, 'sud': 1, 'zaporojié': 1, 'combat': 1, 'blindé': 1, 'artillerie': 1, 'krab': 1, 'fabrication': 1, 'polonaise': 1, 'kherson': 1, 'pertes': 1, 'pickup': 1}","{'Kiev': 2, 'HIMARS.Les': 1, 'Donetsk': 1, 'zone d’Avdeïevka': 1, 'république populaire de Donetsk': 1, 'RPD).En': 1, 'D-30': 1, 'Koupiansk': 1, 'Akatsiya': 1, 'Donetsk-Sud': 1, 'Zaporojié': 1, 'Krab': 1, 'Kherson': 1}","{'Axe': 1, 'Gvozdika': 2}","{'Msta-B': 2, 'Krasny Liman': 1}",2023,6,2
1685743200,https://fr.sputniknews.africa/20230603/comment-la-taxe-carbone-europeenne-pourrait-plomber-lafrique-1059692163.html,Comment la taxe carbone européenne pourrait plomber l’Afrique,"Le mécanisme d'ajustement carbone aux frontières européennes (MACF) risque de porter un grave coup aux exportations africaines comme l’aluminium ou le ciment, rapporte une étude de l’African Climate Foundation.","Un torpillage en règle. Le mécanisme d'ajustement carbone aux frontières européennes (MACF) qui doit entrer en vigueur début octobre va mettre à mal l’économie africaine, selon un rapport de l’African Climate Foundation. Les restrictions introduites sur certains produits pourraient faire perdre 25 milliards de dollars par an au continent.Certaines exportations seront particulièrement touchées, car leur production dégage plus de carbone. Les engrais africains, exportés à 26% vers l’Europe, l’aluminium (12%), le ciment (12%) seront parmi les domaines les plus handicapés par cette nouvelle taxe carbone.Le mécanisme européen, qui s’appliquera dans un premier temps à sept secteurs, fera reculer les exportations africaines vers l’UE de 5,75%, en considérant que la tonne de carbone soit taxée à hauteur de 87 euros. Cela amputerait le PIB du continent de 0,91%, d’après l’African Climate Foundation.Pire encore: si une telle taxe carbone était étendue à tous les pans de l’activité économique, les exportations chuteraient alors de 7,13% par an, privant le PIB africain de 31 milliards de dollars par an.Chine, Russie et BRICS vent deboutCe mécanisme écologique a essuyé plusieurs critiques depuis que la Commission européenne a annoncé vouloir le mettre en place. Fin 2021, la Russie avait déjà mis en cause le MACF. Le ministre russe des Affaires étrangères, Sergueï Lavrov, avait fait remarquer que l’UE imaginait une taxe carbone alors que sa propre empreinte carbone dépassait tous les standards.Même indignation côté chinois, puisque Pékin avait affirmé que le mécanisme européen violait tout bonnement les principes de l’Organisation mondiale du commerce (OMC). La décision européenne va en outre ""compromettre la confiance mutuelle au sein de la communauté internationale et les perspectives de croissance"", avait souligné Liu Youbin, porte-parole du ministère de l'Écologie et de l'Environnement.Réunis le 1er juin en Afrique du Sud, les ministres des Affaires étrangères des BRICS avaient pour leur part mis en garde contre les mesures ""protectionnistes unilatérales sous couvert de considérations environnementales"", comme ce type de taxe carbone.","[[['Un torpillage en règle.'], [""Le mécanisme d'ajustement carbone aux frontières européennes (MACF) qui doit entrer en vigueur début octobre va mettre à mal l’économie africaine, selon un rapport de l’African Climate Foundation.""], ['Les restrictions introduites sur certains produits pourraient faire perdre 25 milliards de dollars par an au continent.Certaines exportations seront particulièrement touchées, car leur production dégage plus de carbone.'], ['Les engrais africains, exportés à 26% vers l’Europe, l’aluminium (12%), le ciment (12%) seront parmi les domaines les plus handicapés par cette nouvelle taxe carbone.Le mécanisme européen, qui s’appliquera dans un premier temps à sept secteurs, fera reculer les exportations africaines vers l’UE de 5,75%, en considérant que la tonne de carbone soit taxée à hauteur de 87 euros.'], ['Cela amputerait le PIB du continent de 0,91%, d’après l’African Climate Foundation.Pire encore: si une telle taxe carbone était étendue à tous les pans de l’activité économique, les exportations chuteraient alors de 7,13% par an, privant le PIB africain de 31 milliards de dollars par an.Chine, Russie et BRICS vent deboutCe mécanisme écologique a essuyé plusieurs critiques depuis que la Commission européenne a annoncé vouloir le mettre en place.'], ['Fin 2021, la Russie avait déjà mis en cause le MACF.'], ['Le ministre russe des Affaires étrangères, Sergueï Lavrov, avait fait remarquer que l’UE imaginait une taxe carbone alors que sa propre empreinte carbone dépassait tous les standards.Même indignation côté chinois, puisque Pékin avait affirmé que le mécanisme européen violait tout bonnement les principes de l’Organisation mondiale du commerce (OMC).'], ['La décision européenne va en outre ""compromettre la confiance mutuelle au sein de la communauté internationale et les perspectives de croissance"", avait souligné Liu Youbin, porte-parole du ministère de l\'Écologie et de l\'Environnement.Réunis le 1er juin en Afrique du Sud, les ministres des Affaires étrangères des BRICS avaient pour leur part mis en garde contre les mesures ""protectionnistes unilatérales sous couvert de considérations environnementales"", comme ce type de taxe carbone.']]]","[[['torpillage', 'règle'], ['mécanisme', 'ajustement', 'carbone', 'frontières', 'européennes', 'macf', 'vigueur', 'début', 'octobre', 'mal', 'économie', 'africaine', 'rapport', 'african', 'foundation'], ['restrictions', 'produits', 'milliards', 'dollars', 'an', 'exportations', 'production', 'carbone'], ['engrais', 'africains', 'europe', 'aluminium', 'ciment', 'domaines', 'handicapés', 'nouvelle', 'taxe', 'mécanisme', 'européen', 'temps', 'secteurs', 'exportations', 'africaines', 'ue', 'tonne', 'carbone', 'hauteur', 'euros'], ['pib', 'continent', 'african', 'climate', 'taxe', 'carbone', 'pans', 'activité', 'économique', 'exportations', 'chuteraient', 'an', 'pib', 'africain', 'milliards', 'dollars', 'russie', 'vent', 'mécanisme', 'écologique', 'critiques', 'commission', 'européenne', 'place'], ['fin', 'russie', 'cause', 'macf'], ['ministre', 'russe', 'affaires', 'étrangères', 'sergueï', 'lavrov', 'ue', 'taxe', 'carbone', 'propre', 'empreinte', 'carbone', 'indignation', 'côté', 'chinois', 'pékin', 'mécanisme', 'européen', 'principes', 'organisation', 'mondiale', 'commerce'], ['décision', 'européenne', 'confiance', 'mutuelle', 'sein', 'communauté', 'internationale', 'perspectives', 'croissance', 'liu', 'youbin', 'ministère', 'écologie', 'juin', 'afrique', 'sud', 'ministres', 'affaires', 'étrangères', 'brics', 'part', 'garde', 'mesures', 'protectionnistes', 'unilatérales', 'couvert', 'considérations', 'environnementales', 'type', 'taxe', 'carbone']]]","[[[], [], [], ['Europe'], ['Chine', 'Russie'], ['Russie'], ['Pékin'], ['Réunis', 'Afrique du Sud']]]","[[[], ['African Climate Foundation'], [], ['UE'], ['African Climate Foundation', 'BRICS', 'Commission européenne'], [], ['ministre russe des Affaires étrangères', 'UE', 'Organisation mondiale du commerce', 'OMC'], [""ministère de l'Écologie et de l'Environnement"", 'Affaires étrangères des BRICS']]]","[[[], [], [], [], [], [], ['Sergueï Lavrov'], ['Liu Youbin']]]","{'torpillage': 1, 'règle': 1, 'mécanisme': 4, 'ajustement': 1, 'carbone': 7, 'frontières': 1, 'européennes': 1, 'macf': 2, 'vigueur': 1, 'début': 1, 'octobre': 1, 'mal': 1, 'économie': 1, 'africaine': 1, 'rapport': 1, 'african': 2, 'foundation': 1, 'restrictions': 1, 'produits': 1, 'milliards': 2, 'dollars': 2, 'an': 2, 'exportations': 3, 'production': 1, 'engrais': 1, 'africains': 1, 'europe': 1, 'aluminium': 1, 'ciment': 1, 'domaines': 1, 'handicapés': 1, 'nouvelle': 1, 'taxe': 4, 'européen': 2, 'temps': 1, 'secteurs': 1, 'africaines': 1, 'ue': 2, 'tonne': 1, 'hauteur': 1, 'euros': 1, 'pib': 2, 'continent': 1, 'climate': 1, 'pans': 1, 'activité': 1, 'économique': 1, 'chuteraient': 1, 'africain': 1, 'russie': 2, 'vent': 1, 'écologique': 1, 'critiques': 1, 'commission': 1, 'européenne': 2, 'place': 1, 'fin': 1, 'cause': 1, 'ministre': 1, 'russe': 1, 'affaires': 2, 'étrangères': 2, 'sergueï': 1, 'lavrov': 1, 'propre': 1, 'empreinte': 1, 'indignation': 1, 'côté': 1, 'chinois': 1, 'pékin': 1, 'principes': 1, 'organisation': 1, 'mondiale': 1, 'commerce': 1, 'décision': 1, 'confiance': 1, 'mutuelle': 1, 'sein': 1, 'communauté': 1, 'internationale': 1, 'perspectives': 1, 'croissance': 1, 'liu': 1, 'youbin': 1, 'ministère': 1, 'écologie': 1, 'juin': 1, 'afrique': 1, 'sud': 1, 'ministres': 1, 'brics': 1, 'part': 1, 'garde': 1, 'mesures': 1, 'protectionnistes': 1, 'unilatérales': 1, 'couvert': 1, 'considérations': 1, 'environnementales': 1, 'type': 1}","{'Europe': 1, 'Chine': 1, 'Russie': 2, 'Pékin': 1, 'Réunis': 1, 'Afrique du Sud': 1}","{'African Climate Foundation': 2, 'UE': 2, 'BRICS': 1, 'Commission européenne': 1, 'ministre russe des Affaires étrangères': 1, 'Organisation mondiale du commerce': 1, 'OMC': 1, ""ministère de l'Écologie et de l'Environnement"": 1, 'Affaires étrangères des BRICS': 1}","{'Sergueï Lavrov': 1, 'Liu Youbin': 1}",2023,6,2
