timestamp,url,title,description,content,content-segmented,kws-l,loc-l,org-l,per-l,kws,loc,org,per,year,month,day
1662760800,https://fr.sputniknews.africa/20220910/engage-pour-la-cause-sahraouie-amar-belani-serait-nomme-sg-de-la-diplomatie-algerienne-1056134485.html,"Engagé pour la cause sahraouie, Amar Belani serait nommé SG de la diplomatie algérienne","Suite au remaniement opéré le 8 septembre par le Président Tebboune, Amar Belani serait le nouveau secrétaire général du ministère algérien des Affaires étrangères. Connu pour son engagement envers la cause sahraouie, il a occupé plusieurs...","Amar Belani a été nommé nouveau secrétaire général du ministère algérien des Affaires étrangères, en remplacement de Chakib Rachid Kaid, a annoncé TSA en se référant à ses sources.Selon le média, il ne devrait pas cumuler ses nouvelles fonctions avec celle d’envoyé spécial chargé du Sahara occidental et des pays du Maghreb qu’il occupe depuis septembre 2021.Remaniement ministérielLe Président algérien a procédé le 8 septembre à un remaniement ministériel. La liste des nouvelles nominations a été publiée par l’Algérie presse service.","[[['Amar Belani a été nommé nouveau secrétaire général du ministère algérien des Affaires étrangères, en remplacement de Chakib Rachid Kaid, a annoncé TSA en se référant à ses sources.Selon le média, il ne devrait pas cumuler ses nouvelles fonctions avec celle d’envoyé spécial chargé du Sahara occidental et des pays du Maghreb qu’il occupe depuis septembre 2021.Remaniement ministérielLe Président algérien a procédé le 8 septembre à un remaniement ministériel.'], ['La liste des nouvelles nominations a été publiée par l’Algérie presse service.']]]","[[['amar', 'belani', 'secrétaire', 'général', 'ministère', 'algérien', 'affaires', 'étrangères', 'remplacement', 'chakib', 'rachid', 'kaid', 'média', 'nouvelles', 'fonctions', 'spécial', 'sahara', 'occidental', 'pays', 'maghreb', 'septembre', 'ministérielle', 'président', 'algérien', 'septembre', 'remaniement', 'ministériel'], ['liste', 'nouvelles', 'nominations', 'algérie', 'presse', 'service']]]","[[['Sahara occidental', 'Maghreb'], ['Algérie']]]","[[['ministère algérien des Affaires étrangères', 'TSA'], []]]","[[['Amar Belani', 'Chakib Rachid Kaid'], []]]","{'amar': 1, 'belani': 1, 'secrétaire': 1, 'général': 1, 'ministère': 1, 'algérien': 2, 'affaires': 1, 'étrangères': 1, 'remplacement': 1, 'chakib': 1, 'rachid': 1, 'kaid': 1, 'média': 1, 'nouvelles': 2, 'fonctions': 1, 'spécial': 1, 'sahara': 1, 'occidental': 1, 'pays': 1, 'maghreb': 1, 'septembre': 2, 'ministérielle': 1, 'président': 1, 'remaniement': 1, 'ministériel': 1, 'liste': 1, 'nominations': 1, 'algérie': 1, 'presse': 1, 'service': 1}","{'Sahara occidental': 1, 'Maghreb': 1, 'Algérie': 1}","{'ministère algérien des Affaires étrangères': 1, 'TSA': 1}","{'Amar Belani': 1, 'Chakib Rachid Kaid': 1}",2022,9,9
1662760800,https://fr.sputniknews.africa/20220910/il-installe-une-distillerie-artisanale-dans-la-cave-de-sa-maison-et-meurt-asphyxie-1056133254.html,Il installe une distillerie artisanale dans la cave de sa maison et meurt asphyxié,"Un Allemand de 75 ans est décédé après une intoxication au dioxyde de carbone. Elle aurait été provoquée par l’alambic artisanal de schnaps qui se trouvait dans sa cave. Sa femme, venue à son aide, a failli mourir.","Un couple de septuagénaires a été retrouvé le 7 septembre dans la cave d’une maison à Neidlingen, en Allemagne, relate le site Stuttgarter Nachrichten.Selon le média, ils ont été victimes d’une intoxication au dioxyde de carbone.La source rapporte que des proches du couple ont alerté les secours après les avoir découverts inconscients.Si la femme de 74 ans a pu être sauvée et hospitalisée, son mari de 75 ans n’a pas survécu.Un dysfonctionnement en cause?Cité par le média, un porte-parole de la police a indiqué que l’homme exploitait une distillerie artisanale de schnaps dans le sous-sol de son domicile. Il s’y est rendu et a rapidement perdu connaissance. Peu de temps après, sa femme a voulu aller le voir, mais elle s’est aussi évanouie.Les analyses ont révélé qu’une concentration dangereuse de dioxyde de carbone, qui se forme notamment lors des processus de fermentation, s’était accumulée dans leur cave.La raison de la présence du gaz à cet endroit fait encore l'objet d'une enquête policière. Mais il y a une hypothèse: un dysfonctionnement de l’appareil artisanal.","[[['Un couple de septuagénaires a été retrouvé le 7 septembre dans la cave d’une maison à Neidlingen, en Allemagne, relate le site Stuttgarter Nachrichten.Selon le média, ils ont été victimes d’une intoxication au dioxyde de carbone.La source rapporte que des proches du couple ont alerté les secours après les avoir découverts inconscients.Si la femme de 74 ans a pu être sauvée et hospitalisée, son mari de 75 ans n’a pas survécu.Un dysfonctionnement en cause?Cité par le média, un porte-parole de la police a indiqué que l’homme exploitait une distillerie artisanale de schnaps dans le sous-sol de son domicile.'], ['Il s’y est rendu et a rapidement perdu connaissance.'], [""Peu de temps après, sa femme a voulu aller le voir, mais elle s’est aussi évanouie.Les analyses ont révélé qu’une concentration dangereuse de dioxyde de carbone, qui se forme notamment lors des processus de fermentation, s’était accumulée dans leur cave.La raison de la présence du gaz à cet endroit fait encore l'objet d'une enquête policière.""], ['Mais il y a une hypothèse: un dysfonctionnement de l’appareil artisanal.']]]","[[['couple', 'septuagénaires', 'septembre', 'cave', 'maison', 'neidlingen', 'allemagne', 'site', 'média', 'victimes', 'intoxication', 'dioxyde', 'source', 'proches', 'couple', 'secours', 'femme', 'ans', 'mari', 'ans', 'dysfonctionnement', 'média', 'police', 'homme', 'distillerie', 'artisanale', 'domicile'], ['connaissance'], ['temps', 'femme', 'analyses', 'concentration', 'dangereuse', 'dioxyde', 'carbone', 'processus', 'fermentation', 'raison', 'présence', 'gaz', 'endroit', 'objet', 'enquête', 'policière'], ['hypothèse', 'dysfonctionnement', 'appareil', 'artisanal']]]","[[['Neidlingen', 'Allemagne'], [], [], []]]","[[[], [], [], []]]","[[[], [], [], []]]","{'couple': 2, 'septuagénaires': 1, 'septembre': 1, 'cave': 1, 'maison': 1, 'neidlingen': 1, 'allemagne': 1, 'site': 1, 'média': 2, 'victimes': 1, 'intoxication': 1, 'dioxyde': 2, 'source': 1, 'proches': 1, 'secours': 1, 'femme': 2, 'ans': 2, 'mari': 1, 'dysfonctionnement': 2, 'police': 1, 'homme': 1, 'distillerie': 1, 'artisanale': 1, 'domicile': 1, 'connaissance': 1, 'temps': 1, 'analyses': 1, 'concentration': 1, 'dangereuse': 1, 'carbone': 1, 'processus': 1, 'fermentation': 1, 'raison': 1, 'présence': 1, 'gaz': 1, 'endroit': 1, 'objet': 1, 'enquête': 1, 'policière': 1, 'hypothèse': 1, 'appareil': 1, 'artisanal': 1}","{'Neidlingen': 1, 'Allemagne': 1}",{},{},2022,9,9
1662760800,https://fr.sputniknews.africa/20220910/lessai-dune-fusee-americaine-spacex-provoque-un-fort-incendie--images-1056137247.html,L’essai d’une fusée américaine SpaceX provoque un fort incendie – images,"Un essai de la fusée Starship a provoqué un incendie prés de sa base de lancement, au Texas. Près de 30 hectares de broussailles sont partis en fumée.","Un incendie s’est déclaré près de la base de lancement SpaceX de Boca Chica Village, au Texas, rapporte le département local des parcs et de la faune. Le feu s’est déclaré durant l’essai de la fusée Starship, qui a pour la première fois allumée ses six moteurs pour un test statique.Le feu de broussailles a duré cinq heures et s’est étendu sur environ 27 hectares. Plusieurs camions de pompiers ont été déployés et les flammes ont finalement pu être maîtrisées. (1/3) Today, #Starship24 performed:Static Fire 🤯+ Brushfire 🫢 + Dumpster Fire😅🎥:@LabPadre pic.twitter.com/u0FcrJ2JWb— Zack Golden (@CSI_Starbase) September 9, 2022 Road has reopened for SpaceXers to return to the pad.Fire trucks seem OK with the grass fire just burning itself out.https://t.co/OqT9wDX7ER pic.twitter.com/O2wY16XprV— Chris Bergin - NSF (@NASASpaceflight) September 9, 2022 Le feu a cependant laissés des traces, des crabes morts ayant été retrouvés parmi les cendres.""C'est une préoccupation et je pense que SpaceX doit prendre des mesures d'atténuation à cet égard, pour s'assurer que cela ne se produise pas régulièrement. De petits incendies dans la région peuvent très rapidement se transformer en grands incendies"" a déclaré la biologiste Stéphanie Bilodeau à ABC.C’est le deuxième incendie de cette ampleur causé par les essais de Starship, depuis 2019.La fusée du futur?Starship est le dernier lanceur spatial super-lourd sorti des usines SpaceX. Le vaisseau a été sélectionné par la NASA pour devenir l'atterrisseur lunaire du programme Artemis. Le lanceur a pour particularité d’être multifonctions, il est censé pouvoir envoyer des satellites en orbite tout comme transporter des astronautes.Sa conception n’a cependant pas été de tout repos et a même failli tourner au fiasco. Les premiers essais des moteurs Raptor, censés alimenter la fusée, ont en effet été un désastre. Elon Musk, l’excentrique patron de SpaceX, avait même avoué que sa société aurait pu faire faillite à cause de ce problème, fin 2021.","[[['Un incendie s’est déclaré près de la base de lancement SpaceX de Boca Chica Village, au Texas, rapporte le département local des parcs et de la faune.'], ['Le feu s’est déclaré durant l’essai de la fusée Starship, qui a pour la première fois allumée ses six moteurs pour un test statique.Le feu de broussailles a duré cinq heures et s’est étendu sur environ 27 hectares.'], ['Plusieurs camions de pompiers ont été déployés et les flammes ont finalement pu être maîtrisées.'], ['(1/3) Today, #Starship24 performed:Static Fire 🤯+ Brushfire 🫢 + Dumpster Fire😅🎥:@LabPadre pic.twitter.com/u0FcrJ2JWb— Zack Golden (@CSI_Starbase) September 9, 2022 Road has reopened for SpaceXers to return to the pad.Fire trucks seem OK with the grass fire just burning itself out.https://t.co/OqT9wDX7ER pic.twitter.com/O2wY16XprV— Chris Bergin - NSF (@NASASpaceflight) September 9, 2022 Le feu a cependant laissés des traces, des crabes morts ayant été retrouvés parmi les cendres.'], ['""C\'est une préoccupation et je pense que SpaceX doit prendre des mesures d\'atténuation à cet égard, pour s\'assurer que cela ne se produise pas régulièrement.'], ['De petits incendies dans la région peuvent très rapidement se transformer en grands incendies"" a déclaré la biologiste Stéphanie Bilodeau à ABC.C’est le deuxième incendie de cette ampleur causé par les essais de Starship, depuis 2019.La fusée du futur?Starship est le dernier lanceur spatial super-lourd sorti des usines SpaceX.'], [""Le vaisseau a été sélectionné par la NASA pour devenir l'atterrisseur lunaire du programme Artemis.""], ['Le lanceur a pour particularité d’être multifonctions, il est censé pouvoir envoyer des satellites en orbite tout comme transporter des astronautes.Sa conception n’a cependant pas été de tout repos et a même failli tourner au fiasco.'], ['Les premiers essais des moteurs Raptor, censés alimenter la fusée, ont en effet été un désastre.'], ['Elon Musk, l’excentrique patron de SpaceX, avait même avoué que sa société aurait pu faire faillite à cause de ce problème, fin 2021.']]]","[[['incendie', 'base', 'lancement', 'spacex', 'boca', 'chica', 'village', 'texas', 'département', 'local', 'parcs', 'faune'], ['feu', 'essai', 'fusée', 'fois', 'moteurs', 'test', 'feu', 'broussailles', 'heures', 'hectares'], ['camions', 'pompiers', 'flammes'], ['performed', 'brushfire', 'zack', 'golden', 'september', 'reopened', 'spacexers', 'chris', 'nsf', 'september', 'feu', 'traces', 'crabes', 'morts', 'cendres'], ['préoccupation', 'spacex', 'mesures', 'atténuation', 'égard'], ['petits', 'incendies', 'région', 'grands', 'incendies', 'biologiste', 'stéphanie', 'incendie', 'ampleur', 'essais', 'starship', 'fusée', 'dernier', 'lanceur', 'spatial', 'usines', 'spacex'], ['vaisseau', 'nasa', 'atterrisseur', 'lunaire', 'programme', 'artemis'], ['lanceur', 'particularité', 'multifonctions', 'censé', 'satellites', 'orbite', 'conception', 'repos', 'fiasco'], ['premiers', 'essais', 'moteurs', 'raptor', 'censés', 'fusée', 'désastre'], ['elon', 'musk', 'excentrique', 'patron', 'spacex', 'société', 'faillite', 'cause', 'problème', 'fin']]]","[[['Texas'], [], [], [], [], ['ABC.C’', '2019.La'], [], [], [], []]]","[[['SpaceX'], [], [], ['Today'], ['SpaceX'], ['SpaceX.'], ['NASA'], [], [], ['SpaceX']]]","[[[], [], [], ['Zack Golden', 'Chris Bergin - NSF'], [], ['Stéphanie Bilodeau'], [], [], [], ['Elon Musk']]]","{'incendie': 2, 'base': 1, 'lancement': 1, 'spacex': 4, 'boca': 1, 'chica': 1, 'village': 1, 'texas': 1, 'département': 1, 'local': 1, 'parcs': 1, 'faune': 1, 'feu': 3, 'essai': 1, 'fusée': 3, 'fois': 1, 'moteurs': 2, 'test': 1, 'broussailles': 1, 'heures': 1, 'hectares': 1, 'camions': 1, 'pompiers': 1, 'flammes': 1, 'performed': 1, 'brushfire': 1, 'zack': 1, 'golden': 1, 'september': 2, 'reopened': 1, 'spacexers': 1, 'chris': 1, 'nsf': 1, 'traces': 1, 'crabes': 1, 'morts': 1, 'cendres': 1, 'préoccupation': 1, 'mesures': 1, 'atténuation': 1, 'égard': 1, 'petits': 1, 'incendies': 2, 'région': 1, 'grands': 1, 'biologiste': 1, 'stéphanie': 1, 'ampleur': 1, 'essais': 2, 'starship': 1, 'dernier': 1, 'lanceur': 2, 'spatial': 1, 'usines': 1, 'vaisseau': 1, 'nasa': 1, 'atterrisseur': 1, 'lunaire': 1, 'programme': 1, 'artemis': 1, 'particularité': 1, 'multifonctions': 1, 'censé': 1, 'satellites': 1, 'orbite': 1, 'conception': 1, 'repos': 1, 'fiasco': 1, 'premiers': 1, 'raptor': 1, 'censés': 1, 'désastre': 1, 'elon': 1, 'musk': 1, 'excentrique': 1, 'patron': 1, 'société': 1, 'faillite': 1, 'cause': 1, 'problème': 1, 'fin': 1}","{'Texas': 1, 'ABC.C’': 1, '2019.La': 1}","{'SpaceX': 3, 'Today': 1, 'SpaceX.': 1, 'NASA': 1}","{'Zack Golden': 1, 'Chris Bergin - NSF': 1, 'Stéphanie Bilodeau': 1, 'Elon Musk': 1}",2022,9,9
1662760800,https://fr.sputniknews.africa/20220910/maroc-des-manifestants-protestent-contre-la-normalisation-des-liens-avec-israel--images-1056137451.html,Maroc: des manifestants protestent contre la normalisation des liens avec Israël – images,"Une manifestation contre la normalisation des liens entre le Maroc et Israël s’est tenu à Rabat, le 9 septembre. Les manifestants ont exprimé leur opposition à la normalisation des liens avec l’État hébreu, dont l’ambassadeur a récemment...","Sur fond de tensions diplomatiques entre le Maroc et Israël, une centaine de manifestants est descendue le 9 septembre dans les rues de Rabat. From a demonstration in front of the Moroccan Parliament in Rabat, rejecting normalization with ""Israel"".#Morocco(FADEL SENNA/ Getty) 1/ pic.twitter.com/zdXKDI8u7X— Palestine News 24/7 (@PaliNewsBot) September 10, 2022 L’événement a eu lieu après que l’ambassadeur israélien David Govrin, qui fait face à plusieurs chefs d’accusation dont l’exploitation de femmes marocaines, a été rappelé le temps d'une enquête. Protestors marched outside Morocco's parliament against the kingdom's normalisation of ties with Israeli apartheid after 'Israel' recalled its top envoy from Rabat amid a probe into allegations of sexual misconduct pic.twitter.com/napAhBRitc— PALESTINE ONLINE 🇵🇸 (@OnlinePalEng) September 10, 2022 Parmi les manifestants, nombreux sont ceux qui brandissaient des drapeaux palestiniens, comme on peut le constater sur les images relayées sur les réseaux sociaux.""Aujourd'hui, nous sommes devant le parlement pour protester contre les actes hideux"", a déclaré un manifestant cité par l’AFP. ""La dignité du Maroc n'est pas à vendre, la normalisation doit cesser"".À en juger les images, un drapeau israélien a été brûlé. end/ pic.twitter.com/U5ZeBL9zTC— Palestine News 24/7 (@PaliNewsBot) September 10, 2022 AccusationsLe média israélien Kan a révélé le 5 septembre que le ministère des Affaires étrangères avait ouvert une enquête sur des soupçons d’irrégularités graves au sein de sa mission diplomatique. Le média précise que des femmes marocaines auraient été exploitées par un haut fonctionnaire de la représentation.Il est aussi accusé de harcèlement sexuel, d’atteintes à la pudeur et d’une histoire de cadeau de valeur. Celui-ci avait été offert par la maison royale marocaine à l’occasion de la célébration de l'anniversaire de la fondation d'Israël, ce que les Israéliens appellent le ""Jour de l'Indépendance"". Ce présent, qui aurait disparu, n’a pas été déclaré au ministère.","[[['Sur fond de tensions diplomatiques entre le Maroc et Israël, une centaine de manifestants est descendue le 9 septembre dans les rues de Rabat.'], ['From a demonstration in front of the Moroccan Parliament in Rabat, rejecting normalization with ""Israel"".#Morocco(FADEL SENNA/ Getty) 1/ pic.twitter.com/zdXKDI8u7X— Palestine News 24/7 (@PaliNewsBot) September 10, 2022 L’événement a eu lieu après que l’ambassadeur israélien David Govrin, qui fait face à plusieurs chefs d’accusation dont l’exploitation de femmes marocaines, a été rappelé le temps d\'une enquête.'], [""Protestors marched outside Morocco's parliament against the kingdom's normalisation of ties with Israeli apartheid after 'Israel' recalled its top envoy from Rabat amid a probe into allegations of sexual misconduct pic.twitter.com/napAhBRitc— PALESTINE ONLINE 🇵🇸 (@OnlinePalEng) September 10, 2022 Parmi les manifestants, nombreux sont ceux qui brandissaient des drapeaux palestiniens, comme on peut le constater sur les images relayées sur les réseaux sociaux.""], ['""Aujourd\'hui, nous sommes devant le parlement pour protester contre les actes hideux"", a déclaré un manifestant cité par l’AFP.'], ['""La dignité du Maroc n\'est pas à vendre, la normalisation doit cesser"".À en juger les images, un drapeau israélien a été brûlé.'], ['end/ pic.twitter.com/U5ZeBL9zTC— Palestine News 24/7 (@PaliNewsBot) September 10, 2022 AccusationsLe média israélien Kan a révélé le 5 septembre que le ministère des Affaires étrangères avait ouvert une enquête sur des soupçons d’irrégularités graves au sein de sa mission diplomatique.'], ['Le média précise que des femmes marocaines auraient été exploitées par un haut fonctionnaire de la représentation.Il est aussi accusé de harcèlement sexuel, d’atteintes à la pudeur et d’une histoire de cadeau de valeur.'], ['Celui-ci avait été offert par la maison royale marocaine à l’occasion de la célébration de l\'anniversaire de la fondation d\'Israël, ce que les Israéliens appellent le ""Jour de l\'Indépendance"".'], ['Ce présent, qui aurait disparu, n’a pas été déclaré au ministère.']]]","[[['fond', 'tensions', 'diplomatiques', 'maroc', 'israël', 'centaine', 'manifestants', 'septembre', 'rues', 'rabat'], ['demonstration', 'rabat', 'rejecting', 'getty', 'palestine', 'september', 'événement', 'lieu', 'ambassadeur', 'israélien', 'david', 'govrin', 'face', 'chefs', 'accusation', 'exploitation', 'femmes', 'marocaines', 'temps', 'enquête'], ['protestors', 'marched', 'outside', 'normalisation', 'ties', 'israel', 'recalled', 'rabat', 'amid', 'allegations', 'misconduct', 'palestine', 'online', 'september', 'manifestants', 'drapeaux', 'palestiniens', 'images', 'réseaux', 'sociaux'], ['parlement', 'actes', 'hideux', 'manifestant', 'cité', 'afp'], ['dignité', 'maroc', 'normalisation', 'images', 'drapeau', 'israélien'], ['palestine', 'september', 'média', 'israélien', 'kan', 'septembre', 'ministère', 'affaires', 'étrangères', 'enquête', 'soupçons', 'irrégularités', 'graves', 'sein', 'mission', 'diplomatique'], ['média', 'femmes', 'marocaines', 'haut', 'fonctionnaire', 'harcèlement', 'sexuel', 'pudeur', 'histoire', 'cadeau', 'valeur'], ['maison', 'royale', 'marocaine', 'occasion', 'célébration', 'anniversaire', 'fondation', 'israël', 'israéliens', 'jour', 'indépendance'], ['présent', 'ministère']]]","[[['Maroc', 'Israël', 'Rabat'], [], ['🇸'], [], ['Maroc'], ['AccusationsLe'], [], ['Israël', 'Israël'], []]]","[[[], ['@PaliNewsBot'], ['Israel'], ['AFP'], [], ['Palestine News', '@PaliNewsBot', 'ministère des Affaires étrangères'], [], [], []]]","[[[], ['rejecting normalization with', 'SENNA/ Getty', 'David Govrin'], [""Morocco'""], [], [], ['Kan'], [], [], []]]","{'fond': 1, 'tensions': 1, 'diplomatiques': 1, 'maroc': 2, 'israël': 2, 'centaine': 1, 'manifestants': 2, 'septembre': 2, 'rues': 1, 'rabat': 3, 'demonstration': 1, 'rejecting': 1, 'getty': 1, 'palestine': 3, 'september': 3, 'événement': 1, 'lieu': 1, 'ambassadeur': 1, 'israélien': 3, 'david': 1, 'govrin': 1, 'face': 1, 'chefs': 1, 'accusation': 1, 'exploitation': 1, 'femmes': 2, 'marocaines': 2, 'temps': 1, 'enquête': 2, 'protestors': 1, 'marched': 1, 'outside': 1, 'normalisation': 2, 'ties': 1, 'israel': 1, 'recalled': 1, 'amid': 1, 'allegations': 1, 'misconduct': 1, 'online': 1, 'drapeaux': 1, 'palestiniens': 1, 'images': 2, 'réseaux': 1, 'sociaux': 1, 'parlement': 1, 'actes': 1, 'hideux': 1, 'manifestant': 1, 'cité': 1, 'afp': 1, 'dignité': 1, 'drapeau': 1, 'média': 2, 'kan': 1, 'ministère': 2, 'affaires': 1, 'étrangères': 1, 'soupçons': 1, 'irrégularités': 1, 'graves': 1, 'sein': 1, 'mission': 1, 'diplomatique': 1, 'haut': 1, 'fonctionnaire': 1, 'harcèlement': 1, 'sexuel': 1, 'pudeur': 1, 'histoire': 1, 'cadeau': 1, 'valeur': 1, 'maison': 1, 'royale': 1, 'marocaine': 1, 'occasion': 1, 'célébration': 1, 'anniversaire': 1, 'fondation': 1, 'israéliens': 1, 'jour': 1, 'indépendance': 1, 'présent': 1}","{'Maroc': 2, 'Israël': 3, 'Rabat': 1, '🇸': 1, 'AccusationsLe': 1}","{'@PaliNewsBot': 2, 'Israel': 1, 'AFP': 1, 'Palestine News': 1, 'ministère des Affaires étrangères': 1}","{'rejecting normalization with': 1, 'SENNA/ Getty': 1, 'David Govrin': 1, ""Morocco'"": 1, 'Kan': 1}",2022,9,9
