timestamp,url,title,description,content,content-segmented,kws-l,loc-l,org-l,per-l,kws,loc,org,per,year,month,day
1680386400,https://fr.sputniknews.africa/20230402/russie-afrique-la-relance-doit-se-faire-maintenant-ou-jamais-1058384290.html,"Russie-Afrique: la ""relance doit se faire maintenant ou jamais""","Les sanctions occidentales ont eu des effets positifs sur l’économie russe, selon un expert béninois. Grâce à elles, ""les autorités russes ont compris le rôle que le continent africain peut jouer dans le renforcement de l’économie russe"".","Après la longue pause dans les échanges avec l’Afrique qui a suivi l’effondrement de l’URSS, la Russie s’est de nouveau tournée vers le continent. Avant le début de l’opération militaire spéciale, le commerce entre la Russie et les pays africains se faisait par l’intermédiaire des Bourses occidentales. Désormais elle peut commercer directement avec les pays africains sans recourir à ces services, comme l’a indiqué le chef du secrétariat de la conférence Russie-Afrique et ambassadeur itinérant du ministère russe des Affaires étrangères.""Les sanctions occidentales ont permis enfin aux autorités russes, de comprendre le rôle que peut jouer le continent africain dans le renforcement de l’économie de la Russie"", se réjouit auprès de Sputnik Victorien Aloma, docteur béninois en sciences économiques et spécialiste des relations économiques internationales.Il rappelle que, suite aux premières sanctions occidentales datant de 2014, Moscou a énoncé sa volonté de coopérer directement avec les pays africains, bien que ces déclarations n’aient pas été concrétisées. ""La relance de la coopération économique entre la Russie et le continent africain doit se faire maintenant ou jamais"", avance-t-il à Sputnik.Les conditions pour se lier à l’AfriqueCependant, pour ""se reconnecter à l’Afrique"", il lui faut créer un ""réseau d’affaires avec les différents pays du continent"".Cela implique la définition d’une ""base conceptuelle de sa politique économique extérieure vis-à-vis de l’Afrique"" favorisant un partenariat économique et stratégique gagnant-gagnant.Il faut également soutenir les entreprises russes pour investir dans les secteurs clés de l’économie africaine.""Cette initiative ne pourra se concrétiser que si la Russie cherche à respecter les intérêts économiques des États africains et à ne pas chercher à faire comme les partenaires traditionnels du continent"", explique l’expert à Sputnik.Comment s’enraciner sur le marché africainIl signale cependant que des produits d’origine russe pourraient prendre pied sur le marché africain à condition de présenter un avantage compétitif par rapport aux produits concurrents.Étant donné l’intérêt en Afrique pour toute sorte de biens, ""il revient aux entreprises russes de choisir la cible pour le positionnement de leurs produits sur les marchés du continent"".Victorien Aloma estime que la Russie devra comprendre que les pays occidentaux l’ont toujours perçue comme un adversaire et non comme un partenaire et qu’elle doit donc chercher ailleurs ses alliés.Les BRICS comme porte s’ouvrant sur l’AfriqueSelon lui, sa coopération au sein des BRICS revêt pour Moscou une grande importance.""La montée en puissance des BRICS serait effective à condition que les pays membres du bloc renouent avec leurs objectifs initiaux. Cependant, la Banque de Développement de ce bloc doit savoir jouer le rôle qui lui revient en tant qu’Institution économique et financière internationale pour la concrétisation d’un monde multipolaire et l’instauration d’un nouvel ordre géopolitique"", conclut l’expert.""À travers la coopération économique dans le cadre des BRICS, la Russie pourra davantage renforcer sa présence non seulement sur le continent africain, mais aussi dans les autres pays du monde"".","[[['Après la longue pause dans les échanges avec l’Afrique qui a suivi l’effondrement de l’URSS, la Russie s’est de nouveau tournée vers le continent.'], ['Avant le début de l’opération militaire spéciale, le commerce entre la Russie et les pays africains se faisait par l’intermédiaire des Bourses occidentales.'], ['Désormais elle peut commercer directement avec les pays africains sans recourir à ces services, comme l’a indiqué le chef du secrétariat de la conférence Russie-Afrique et ambassadeur itinérant du ministère russe des Affaires étrangères.'], ['""Les sanctions occidentales ont permis enfin aux autorités russes, de comprendre le rôle que peut jouer le continent africain dans le renforcement de l’économie de la Russie"", se réjouit auprès de Sputnik Victorien Aloma, docteur béninois en sciences économiques et spécialiste des relations économiques internationales.Il rappelle que, suite aux premières sanctions occidentales datant de 2014, Moscou a énoncé sa volonté de coopérer directement avec les pays africains, bien que ces déclarations n’aient pas été concrétisées.'], ['""La relance de la coopération économique entre la Russie et le continent africain doit se faire maintenant ou jamais"", avance-t-il à Sputnik.Les conditions pour se lier à l’AfriqueCependant, pour ""se reconnecter à l’Afrique"", il lui faut créer un ""réseau d’affaires avec les différents pays du continent"".Cela implique la définition d’une ""base conceptuelle de sa politique économique extérieure vis-à-vis de l’Afrique"" favorisant un partenariat économique et stratégique gagnant-gagnant.Il faut également soutenir les entreprises russes pour investir dans les secteurs clés de l’économie africaine.'], ['""Cette initiative ne pourra se concrétiser que si la Russie cherche à respecter les intérêts économiques des États africains et à ne pas chercher à faire comme les partenaires traditionnels du continent"", explique l’expert à Sputnik.Comment s’enraciner sur le marché africainIl signale cependant que des produits d’origine russe pourraient prendre pied sur le marché africain à condition de présenter un avantage compétitif par rapport aux produits concurrents.Étant donné l’intérêt en Afrique pour toute sorte de biens, ""il revient aux entreprises russes de choisir la cible pour le positionnement de leurs produits sur les marchés du continent"".Victorien Aloma estime que la Russie devra comprendre que les pays occidentaux l’ont toujours perçue comme un adversaire et non comme un partenaire et qu’elle doit donc chercher ailleurs ses alliés.Les BRICS comme porte s’ouvrant sur l’AfriqueSelon lui, sa coopération au sein des BRICS revêt pour Moscou une grande importance.'], ['""La montée en puissance des BRICS serait effective à condition que les pays membres du bloc renouent avec leurs objectifs initiaux.'], ['Cependant, la Banque de Développement de ce bloc doit savoir jouer le rôle qui lui revient en tant qu’Institution économique et financière internationale pour la concrétisation d’un monde multipolaire et l’instauration d’un nouvel ordre géopolitique"", conclut l’expert.'], ['""À travers la coopération économique dans le cadre des BRICS, la Russie pourra davantage renforcer sa présence non seulement sur le continent africain, mais aussi dans les autres pays du monde"".']]]","[[['longue', 'pause', 'échanges', 'afrique', 'effondrement', 'urss', 'russie', 'tournée', 'continent'], ['début', 'opération', 'militaire', 'spéciale', 'commerce', 'russie', 'pays', 'africains', 'intermédiaire', 'bourses', 'occidentales'], ['pays', 'africains', 'services', 'chef', 'secrétariat', 'conférence', 'russie', 'afrique', 'ambassadeur', 'itinérant', 'ministère', 'russe', 'affaires', 'étrangères'], ['sanctions', 'occidentales', 'autorités', 'russes', 'rôle', 'continent', 'africain', 'renforcement', 'économie', 'russie', 'sputnik', 'victorien', 'aloma', 'docteur', 'béninois', 'sciences', 'économiques', 'spécialiste', 'relations', 'économiques', 'suite', 'premières', 'sanctions', 'occidentales', 'moscou', 'volonté', 'pays', 'africains', 'déclarations'], ['relance', 'coopération', 'économique', 'russie', 'continent', 'africain', 'conditions', 'afriquecependant', 'afrique', 'réseau', 'affaires', 'pays', 'définition', 'base', 'conceptuelle', 'politique', 'économique', 'extérieure', 'afrique', 'partenariat', 'économique', 'stratégique', 'entreprises', 'russes', 'secteurs', 'clés', 'économie', 'africaine'], ['initiative', 'russie', 'intérêts', 'économiques', 'états', 'africains', 'partenaires', 'traditionnels', 'continent', 'expert', 'marché', 'africainil', 'produits', 'origine', 'russe', 'pied', 'marché', 'africain', 'condition', 'avantage', 'compétitif', 'rapport', 'produits', 'intérêt', 'afrique', 'sorte', 'biens', 'entreprises', 'russes', 'cible', 'positionnement', 'produits', 'marchés', 'aloma', 'russie', 'pays', 'occidentaux', 'adversaire', 'partenaire', 'afriqueselon', 'coopération', 'sein', 'brics', 'moscou', 'grande', 'importance'], ['montée', 'puissance', 'brics', 'effective', 'condition', 'pays', 'membres', 'bloc', 'objectifs', 'initiaux'], ['banque', 'développement', 'bloc', 'rôle', 'institution', 'économique', 'financière', 'internationale', 'concrétisation', 'monde', 'multipolaire', 'instauration', 'nouvel', 'ordre', 'géopolitique', 'expert'], ['travers', 'coopération', 'économique', 'cadre', 'brics', 'russie', 'présence', 'continent', 'africain', 'pays', 'monde']]]","[[['l’Afrique', 'Russie'], ['Russie'], ['Russie-Afrique'], ['Russie', 'Moscou'], ['Russie', 'l’Afrique', 'l’Afrique'], ['Russie', 'États africains', 'Afrique', 'Russie', 'Moscou'], [], [], ['Russie']]]","[[['URSS'], [], ['ministère russe des Affaires étrangères'], ['Sputnik'], ['Sputnik'], ['Sputnik', 'BRICS', 'BRICS'], ['BRICS'], ['Banque de Développement', 'Institution économique'], ['BRICS']]]","[[[], [], [], ['Victorien Aloma'], [], ['Victorien Aloma'], [], [], []]]","{'longue': 1, 'pause': 1, 'échanges': 1, 'afrique': 5, 'effondrement': 1, 'urss': 1, 'russie': 8, 'tournée': 1, 'continent': 5, 'début': 1, 'opération': 1, 'militaire': 1, 'spéciale': 1, 'commerce': 1, 'pays': 7, 'africains': 4, 'intermédiaire': 1, 'bourses': 1, 'occidentales': 3, 'services': 1, 'chef': 1, 'secrétariat': 1, 'conférence': 1, 'ambassadeur': 1, 'itinérant': 1, 'ministère': 1, 'russe': 2, 'affaires': 2, 'étrangères': 1, 'sanctions': 2, 'autorités': 1, 'russes': 3, 'rôle': 2, 'africain': 4, 'renforcement': 1, 'économie': 2, 'sputnik': 1, 'victorien': 1, 'aloma': 2, 'docteur': 1, 'béninois': 1, 'sciences': 1, 'économiques': 3, 'spécialiste': 1, 'relations': 1, 'suite': 1, 'premières': 1, 'moscou': 2, 'volonté': 1, 'déclarations': 1, 'relance': 1, 'coopération': 3, 'économique': 5, 'conditions': 1, 'afriquecependant': 1, 'réseau': 1, 'définition': 1, 'base': 1, 'conceptuelle': 1, 'politique': 1, 'extérieure': 1, 'partenariat': 1, 'stratégique': 1, 'entreprises': 2, 'secteurs': 1, 'clés': 1, 'africaine': 1, 'initiative': 1, 'intérêts': 1, 'états': 1, 'partenaires': 1, 'traditionnels': 1, 'expert': 2, 'marché': 2, 'africainil': 1, 'produits': 3, 'origine': 1, 'pied': 1, 'condition': 2, 'avantage': 1, 'compétitif': 1, 'rapport': 1, 'intérêt': 1, 'sorte': 1, 'biens': 1, 'cible': 1, 'positionnement': 1, 'marchés': 1, 'occidentaux': 1, 'adversaire': 1, 'partenaire': 1, 'afriqueselon': 1, 'sein': 1, 'brics': 3, 'grande': 1, 'importance': 1, 'montée': 1, 'puissance': 1, 'effective': 1, 'membres': 1, 'bloc': 2, 'objectifs': 1, 'initiaux': 1, 'banque': 1, 'développement': 1, 'institution': 1, 'financière': 1, 'internationale': 1, 'concrétisation': 1, 'monde': 2, 'multipolaire': 1, 'instauration': 1, 'nouvel': 1, 'ordre': 1, 'géopolitique': 1, 'travers': 1, 'cadre': 1, 'présence': 1}","{'l’Afrique': 3, 'Russie': 7, 'Russie-Afrique': 1, 'Moscou': 2, 'États africains': 1, 'Afrique': 1}","{'URSS': 1, 'ministère russe des Affaires étrangères': 1, 'Sputnik': 3, 'BRICS': 4, 'Banque de Développement': 1, 'Institution économique': 1}",{'Victorien Aloma': 2},2023,4,1
1680386400,https://fr.sputniknews.africa/20230402/lavrov-sest-entretenu-avec-blinken-au-telephone-1058383837.html,Sergueï Lavrov s'est entretenu avec Antony Blinken au téléphone,"Le chef de la diplomatie américaine Antony Blinken a téléphoné à son homologue russe Sergueï Lavrov, a annoncé le ministère russe des Affaires étrangères.","Le ministre russe des Affaires étrangères Sergueï Lavrov vient de s'entretenir au téléphone avec le secrétaire d'État US Antony Blinken, a fait savoir la diplomatie russe ce dimanche 2 avril.Selon la partie russe, les deux ministres ont notamment évoqué la récente arrestation du journaliste du Wall Street Journal Evan Gershkovich dans l'Oural russe. M.Lavrov a ainsi déclaré à son homologue US que l'intéressé ""essayait d'obtenir des informations relevant du secret d'État"".Le ministre russe a également qualifié d'""inacceptables"" les tentatives ""de Washington et des médias occidentaux"" en vue de ""conférer un caractère politique à cette affaire"".Pour sa part, Antony Blinken a demandé à Moscou la ""libération immédiate"" de M.Gershkovich mais aussi de l'Américano-Britannique Paul Whelan, condamné en Russie à 16 ans de prison pour espionnage, a indiqué le département d'État.Toujours d'après les Américains, MM Blinken et Lavrov ont d'ailleurs discuté de la mise en place de ""conditions favorables à la poursuite du travail des missions diplomatiques des États-Unis et de la Fédération de Russie"".","[[[""Le ministre russe des Affaires étrangères Sergueï Lavrov vient de s'entretenir au téléphone avec le secrétaire d'État US Antony Blinken, a fait savoir la diplomatie russe ce dimanche 2 avril.Selon la partie russe, les deux ministres ont notamment évoqué la récente arrestation du journaliste du Wall Street Journal Evan Gershkovich dans l'Oural russe.""], ['M.Lavrov a ainsi déclaré à son homologue US que l\'intéressé ""essayait d\'obtenir des informations relevant du secret d\'État"".Le ministre russe a également qualifié d\'""inacceptables"" les tentatives ""de Washington et des médias occidentaux"" en vue de ""conférer un caractère politique à cette affaire"".Pour sa part, Antony Blinken a demandé à Moscou la ""libération immédiate"" de M.Gershkovich mais aussi de l\'Américano-Britannique Paul Whelan, condamné en Russie à 16 ans de prison pour espionnage, a indiqué le département d\'État.Toujours d\'après les Américains, MM Blinken et Lavrov ont d\'ailleurs discuté de la mise en place de ""conditions favorables à la poursuite du travail des missions diplomatiques des États-Unis et de la Fédération de Russie"".']]]","[[['ministre', 'russe', 'affaires', 'étrangères', 'sergueï', 'lavrov', 'téléphone', 'secrétaire', 'état', 'antony', 'blinken', 'diplomatie', 'russe', 'dimanche', 'partie', 'russe', 'ministres', 'récente', 'arrestation', 'journaliste', 'wall', 'street', 'journal', 'evan', 'gershkovich', 'oural', 'russe'], ['homologue', 'informations', 'secret', 'ministre', 'russe', 'tentatives', 'washington', 'médias', 'occidentaux', 'vue', 'caractère', 'politique', 'part', 'antony', 'blinken', 'moscou', 'libération', 'immédiate', 'paul', 'whelan', 'russie', 'ans', 'prison', 'espionnage', 'département', 'américains', 'mm', 'blinken', 'lavrov', 'mise', 'place', 'conditions', 'favorables', 'poursuite', 'travail', 'missions', 'diplomatiques', 'fédération', 'russie']]]","[[['Oural russe'], ['US', 'Washington', 'Moscou', 'Américano-Britannique', 'Russie', ""département d'État"", 'États-Unis', 'MM Blinken', 'États-Unis', 'Fédération de Russie']]]","[[['ministre russe des Affaires', 'État US'], []]]","[[['Sergueï Lavrov', 'Antony Blinken'], ['M.Lavrov', 'Antony Blinken', 'M.Gershkovich', 'Paul Whelan', 'Lavrov']]]","{'ministre': 2, 'russe': 5, 'affaires': 1, 'étrangères': 1, 'sergueï': 1, 'lavrov': 2, 'téléphone': 1, 'secrétaire': 1, 'état': 1, 'antony': 2, 'blinken': 3, 'diplomatie': 1, 'dimanche': 1, 'partie': 1, 'ministres': 1, 'récente': 1, 'arrestation': 1, 'journaliste': 1, 'wall': 1, 'street': 1, 'journal': 1, 'evan': 1, 'gershkovich': 1, 'oural': 1, 'homologue': 1, 'informations': 1, 'secret': 1, 'tentatives': 1, 'washington': 1, 'médias': 1, 'occidentaux': 1, 'vue': 1, 'caractère': 1, 'politique': 1, 'part': 1, 'moscou': 1, 'libération': 1, 'immédiate': 1, 'paul': 1, 'whelan': 1, 'russie': 2, 'ans': 1, 'prison': 1, 'espionnage': 1, 'département': 1, 'américains': 1, 'mm': 1, 'mise': 1, 'place': 1, 'conditions': 1, 'favorables': 1, 'poursuite': 1, 'travail': 1, 'missions': 1, 'diplomatiques': 1, 'fédération': 1}","{'Oural russe': 1, 'US': 1, 'Washington': 1, 'Moscou': 1, 'Américano-Britannique': 1, 'Russie': 1, ""département d'État"": 1, 'États-Unis': 2, 'MM Blinken': 1, 'Fédération de Russie': 1}","{'ministre russe des Affaires': 1, 'État US': 1}","{'Sergueï Lavrov': 1, 'Antony Blinken': 2, 'M.Lavrov': 1, 'M.Gershkovich': 1, 'Paul Whelan': 1, 'Lavrov': 1}",2023,4,1
1680386400,https://fr.sputniknews.africa/20230402/la-france-pense-que-la-chine-est-la-seule-a-pouvoir-renverser-la-table-a-propos-de-lukraine-1058383596.html,La France pense que la Chine est la seule à pouvoir renverser la table à propos de l’Ukraine,"Seule une intervention de Pékin sur le dossier ukrainien peut rebattre les cartes, a déclaré à CNN une source proche du Président français. Emmanuel Macron doit se rendre en Chine la semaine prochaine.","La diplomatie chinoise boxe dans la catégorie poids lourds. C’est en tout cas le constat qui semble s’imposer du côté de Paris, où certains responsables voient Pékin comme la clef de futures négociations, rapporte CNN.""Il est évident que la Chine est l'un des rares pays sur Terre - peut-être le seul pays au monde - à pouvoir changer la donne sur le conflit, pour les deux parties"" a ainsi déclaré une source de l’Elysée à la chaîne américaine.Des propos qui éclairent d’un jour nouveau la prochaine visite d’Emmanuel Macron en Chine. Le Président français doit en effet se rendre sur place du 5 au 7 avril, alors que les liens entre l’UE et l’Empire du milieu se sont relâchés ces dernières années.Ursula von der Leyen, présidente de la Commission européenne a admis que les relations étaient devenues ""plus distantes et difficiles"", appelant à les ""rééquilibrer"". La responsable accompagnera d’ailleurs le Président français dans son déplacement.Plan de paix chinoisPékin a montré sa volonté de s’investir sur le dossier ukrainien ces derniers mois, en proposant notamment un plan pour la paix en douze points, tentant de concilier le respect de la souveraineté ukrainienne et les garanties de sécurité réclamées par la Russie.Ce document a été accueilli favorablement par Moscou. Le Président russe Vladimir Poutine a ainsi affirmé que les propositions chinoises pouvaient ""servir de base pour un règlement pacifique"" du conflit. Washington s’est montré beaucoup plus circonspect, le Département d'État américain considérant ce plan comme une ""manœuvre tactique"" de Pékin.Le Président chinois Xi Jinping s’était par ailleurs rendu à Moscou fin mars, pour discuter avec son homologue russe. Une série d’accords pour renforcer le partenariat géostratégique entre les deux pays avaient été signés. Les relations entre Moscou et Pékin revêtent une ""importance vitale pour l’ordre mondial moderne et le destin de l’humanité"", avait déclaré le dirigeant chinois à cette occasion.Avant cette visite, Pékin avait déjà souligné que les relations entre les deux pays étaient ""solides comme un roc"".","[[['La diplomatie chinoise boxe dans la catégorie poids lourds.'], ['C’est en tout cas le constat qui semble s’imposer du côté de Paris, où certains responsables voient Pékin comme la clef de futures négociations, rapporte CNN.'], ['""Il est évident que la Chine est l\'un des rares pays sur Terre - peut-être le seul pays au monde - à pouvoir changer la donne sur le conflit, pour les deux parties"" a ainsi déclaré une source de l’Elysée à la chaîne américaine.Des propos qui éclairent d’un jour nouveau la prochaine visite d’Emmanuel Macron en Chine.'], ['Le Président français doit en effet se rendre sur place du 5 au 7 avril, alors que les liens entre l’UE et l’Empire du milieu se sont relâchés ces dernières années.Ursula von der Leyen, présidente de la Commission européenne a admis que les relations étaient devenues ""plus distantes et difficiles"", appelant à les ""rééquilibrer"".'], ['La responsable accompagnera d’ailleurs le Président français dans son déplacement.Plan de paix chinoisPékin a montré sa volonté de s’investir sur le dossier ukrainien ces derniers mois, en proposant notamment un plan pour la paix en douze points, tentant de concilier le respect de la souveraineté ukrainienne et les garanties de sécurité réclamées par la Russie.Ce document a été accueilli favorablement par Moscou.'], ['Le Président russe Vladimir Poutine a ainsi affirmé que les propositions chinoises pouvaient ""servir de base pour un règlement pacifique"" du conflit.'], ['Washington s’est montré beaucoup plus circonspect, le Département d\'État américain considérant ce plan comme une ""manœuvre tactique"" de Pékin.Le Président chinois Xi Jinping s’était par ailleurs rendu à Moscou fin mars, pour discuter avec son homologue russe.'], ['Une série d’accords pour renforcer le partenariat géostratégique entre les deux pays avaient été signés.'], ['Les relations entre Moscou et Pékin revêtent une ""importance vitale pour l’ordre mondial moderne et le destin de l’humanité"", avait déclaré le dirigeant chinois à cette occasion.Avant cette visite, Pékin avait déjà souligné que les relations entre les deux pays étaient ""solides comme un roc"".']]]","[[['diplomatie', 'chinoise', 'boxe', 'catégorie', 'poids', 'lourds'], ['cas', 'constat', 'côté', 'paris', 'responsables', 'pékin', 'clef', 'futures', 'négociations'], ['évident', 'chine', 'rares', 'pays', 'terre', 'pays', 'monde', 'conflit', 'parties', 'source', 'elysée', 'chaîne', 'propos', 'jour', 'prochaine', 'visite', 'emmanuel', 'chine'], ['président', 'français', 'place', 'avril', 'liens', 'ue', 'empire', 'milieu', 'dernières', 'von', 'leyen', 'présidente', 'commission', 'européenne', 'relations', 'distantes', 'difficiles'], ['responsable', 'président', 'français', 'paix', 'volonté', 'dossier', 'ukrainien', 'derniers', 'mois', 'plan', 'paix', 'points', 'respect', 'souveraineté', 'ukrainienne', 'garanties', 'sécurité', 'document', 'moscou'], ['président', 'russe', 'vladimir', 'poutine', 'propositions', 'chinoises', 'base', 'règlement', 'pacifique', 'conflit'], ['washington', 'circonspect', 'département', 'état', 'américain', 'plan', 'manœuvre', 'tactique', 'président', 'chinois', 'jinping', 'moscou', 'fin', 'mars', 'homologue', 'russe'], ['série', 'accords', 'partenariat', 'géostratégique', 'pays'], ['relations', 'moscou', 'pékin', 'importance', 'vitale', 'ordre', 'mondial', 'moderne', 'destin', 'humanité', 'dirigeant', 'chinois', 'visite', 'pékin', 'relations', 'pays', 'solides', 'roc']]]","[[[], ['Paris', 'Pékin'], ['Chine', 'Terre', 'Elysée', 'Chine'], [], ['Russie', 'Moscou'], [], ['Washington', 'Pékin', 'Moscou'], [], ['Moscou', 'Pékin', 'Pékin']]]","[[[], ['CNN'], [], ['UE', 'Commission européenne'], ['Président français'], [], [""Département d'État américain""], [], []]]","[[[], [], ['Emmanuel Macron'], ['Ursula von der Leyen'], [], ['Vladimir Poutine'], ['Xi Jinping'], [], []]]","{'diplomatie': 1, 'chinoise': 1, 'boxe': 1, 'catégorie': 1, 'poids': 1, 'lourds': 1, 'cas': 1, 'constat': 1, 'côté': 1, 'paris': 1, 'responsables': 1, 'pékin': 3, 'clef': 1, 'futures': 1, 'négociations': 1, 'évident': 1, 'chine': 2, 'rares': 1, 'pays': 4, 'terre': 1, 'monde': 1, 'conflit': 2, 'parties': 1, 'source': 1, 'elysée': 1, 'chaîne': 1, 'propos': 1, 'jour': 1, 'prochaine': 1, 'visite': 2, 'emmanuel': 1, 'président': 4, 'français': 2, 'place': 1, 'avril': 1, 'liens': 1, 'ue': 1, 'empire': 1, 'milieu': 1, 'dernières': 1, 'von': 1, 'leyen': 1, 'présidente': 1, 'commission': 1, 'européenne': 1, 'relations': 3, 'distantes': 1, 'difficiles': 1, 'responsable': 1, 'paix': 2, 'volonté': 1, 'dossier': 1, 'ukrainien': 1, 'derniers': 1, 'mois': 1, 'plan': 2, 'points': 1, 'respect': 1, 'souveraineté': 1, 'ukrainienne': 1, 'garanties': 1, 'sécurité': 1, 'document': 1, 'moscou': 3, 'russe': 2, 'vladimir': 1, 'poutine': 1, 'propositions': 1, 'chinoises': 1, 'base': 1, 'règlement': 1, 'pacifique': 1, 'washington': 1, 'circonspect': 1, 'département': 1, 'état': 1, 'américain': 1, 'manœuvre': 1, 'tactique': 1, 'chinois': 2, 'jinping': 1, 'fin': 1, 'mars': 1, 'homologue': 1, 'série': 1, 'accords': 1, 'partenariat': 1, 'géostratégique': 1, 'importance': 1, 'vitale': 1, 'ordre': 1, 'mondial': 1, 'moderne': 1, 'destin': 1, 'humanité': 1, 'dirigeant': 1, 'solides': 1, 'roc': 1}","{'Paris': 1, 'Pékin': 4, 'Chine': 2, 'Terre': 1, 'Elysée': 1, 'Russie': 1, 'Moscou': 3, 'Washington': 1}","{'CNN': 1, 'UE': 1, 'Commission européenne': 1, 'Président français': 1, ""Département d'État américain"": 1}","{'Emmanuel Macron': 1, 'Ursula von der Leyen': 1, 'Vladimir Poutine': 1, 'Xi Jinping': 1}",2023,4,1
