timestamp,url,title,description,content,content-segmented,kws-l,loc-l,org-l,per-l,kws,loc,org,per,year,month,day
1658354400,https://fr.sputniknews.africa/20220721/letat-francais-compte-renationaliser-le-geant-de-lenergie-nucleaire-edf-1055608082.html,"L’État français compte renationaliser le géant de l'énergie nucléaire ""EDF""","L'Etat français compte débourser 9,7 milliards d'euros pour renationaliser le géant du nucléaire EDF, a annoncé le ministère de l'Economie et des Finances dans un communiqué publié mardi.","La première ministre Elisabeth Borne avait annoncé le 6 juillet, lors de sa déclaration de politique générale devant le parlement, l’intention de l’Etat de détenir 100% d’EDF, dans le but d’”assurer notre souveraineté face aux conséquences de la guerre en Ukraine"" et face aux défis colossaux en lien avec l’urgence climatique.L'Etat, actionnaire majoritaire, détient pour l'instant 84% du capital d'EDF, qui est très endettée. Il entend débourser 12 euros par action et de 15,64 euros par obligation convertible.“Ce projet s’inscrit dans un contexte d’urgence climatique et alors que la situation géopolitique impose des décisions fortes pour assurer l’indépendance et la souveraineté énergétique de la France, dont celle de pouvoir planifier sur le très long terme les moyens de production, de transport et de distribution d’électricité”, relève le communiqué.Dans ce nouveau contexte, où l’Etat serait le seul actionnaire, EDF serait en capacité de mener de manière accélérée plusieurs chantiers décisifs annoncés par le président de la République dans son discours de Belfort, notamment le programme de construction de six réacteurs de technologie EPR2 d’ici 2050, explique-t-on.L'action d'EDF bondit en bourseCes chantiers engageront l’entreprise pour les décennies à venir, au long desquelles EDF continuera de jouer un “rôle critique” pour l’approvisionnement énergétique de la France.Dans cette perspective, l’Etat a l’intention d’acquérir aussi 60% des obligations à option de conversion et/ou d’échange en actions nouvelles ou existantes (OCEANEs) qu’il ne détient pas, par le biais d’une offre publique d’achat simplifiée (l’Offre) qui serait déposée auprès de l’Autorité des Marchés Financiers (AMF) sous réserve de la promulgation d’une loi de finances rectificative pour 2022 (actuellement en cours d’examen devant l’Assemblée nationale) portant les crédits budgétaires nécessaires à l’Offre, note Bercy.En réaction à l'annonce, l'action d'EDF, suspendue en Bourse depuis le 13 juillet à sa demande, a repris sa cotation mardi et son cours a bondi de près de 15%, proche du prix proposé par l'Etat, rapportent les médias de l’hexagone.","[[['La première ministre Elisabeth Borne avait annoncé le 6 juillet, lors de sa déclaration de politique générale devant le parlement, l’intention de l’Etat de détenir 100% d’EDF, dans le but d’”assurer notre souveraineté face aux conséquences de la guerre en Ukraine"" et face aux défis colossaux en lien avec l’urgence climatique.L\'Etat, actionnaire majoritaire, détient pour l\'instant 84% du capital d\'EDF, qui est très endettée.'], [""Il entend débourser 12 euros par action et de 15,64 euros par obligation convertible.“Ce projet s’inscrit dans un contexte d’urgence climatique et alors que la situation géopolitique impose des décisions fortes pour assurer l’indépendance et la souveraineté énergétique de la France, dont celle de pouvoir planifier sur le très long terme les moyens de production, de transport et de distribution d’électricité”, relève le communiqué.Dans ce nouveau contexte, où l’Etat serait le seul actionnaire, EDF serait en capacité de mener de manière accélérée plusieurs chantiers décisifs annoncés par le président de la République dans son discours de Belfort, notamment le programme de construction de six réacteurs de technologie EPR2 d’ici 2050, explique-t-on.L'action d'EDF bondit en bourseCes chantiers engageront l’entreprise pour les décennies à venir, au long desquelles EDF continuera de jouer un “rôle critique” pour l’approvisionnement énergétique de la France.Dans cette perspective, l’Etat a l’intention d’acquérir aussi 60% des obligations à option de conversion et/ou d’échange en actions nouvelles ou existantes (OCEANEs) qu’il ne détient pas, par le biais d’une offre publique d’achat simplifiée (l’Offre) qui serait déposée auprès de l’Autorité des Marchés Financiers (AMF) sous réserve de la promulgation d’une loi de finances rectificative pour 2022 (actuellement en cours d’examen devant l’Assemblée nationale) portant les crédits budgétaires nécessaires à l’Offre, note Bercy.En réaction à l'annonce, l'action d'EDF, suspendue en Bourse depuis le 13 juillet à sa demande, a repris sa cotation mardi et son cours a bondi de près de 15%, proche du prix proposé par l'Etat, rapportent les médias de l’hexagone.""]]]","[[['ministre', 'elisabeth', 'borne', 'juillet', 'déclaration', 'politique', 'générale', 'parlement', 'intention', 'etat', 'edf', 'but', 'souveraineté', 'face', 'conséquences', 'guerre', 'ukraine', 'face', 'défis', 'colossaux', 'lien', 'urgence', 'etat', 'actionnaire', 'majoritaire', 'instant', 'capital', 'edf'], ['euros', 'action', 'euros', 'obligation', 'convertible', 'projet', 'contexte', 'urgence', 'climatique', 'situation', 'géopolitique', 'décisions', 'fortes', 'indépendance', 'souveraineté', 'énergétique', 'france', 'long', 'terme', 'moyens', 'production', 'transport', 'distribution', 'électricité', 'contexte', 'etat', 'actionnaire', 'edf', 'capacité', 'manière', 'chantiers', 'décisifs', 'président', 'république', 'discours', 'belfort', 'programme', 'construction', 'réacteurs', 'technologie', 'action', 'edf', 'bourseces', 'chantiers', 'entreprise', 'décennies', 'long', 'edf', 'rôle', 'critique', 'approvisionnement', 'énergétique', 'perspective', 'etat', 'intention', 'obligations', 'option', 'conversion', 'échange', 'actions', 'nouvelles', 'existantes', 'oceanes', 'biais', 'publique', 'achat', 'autorité', 'marchés', 'financiers', 'amf', 'réserve', 'promulgation', 'loi', 'finances', 'rectificative', 'cours', 'examen', 'assemblée', 'nationale', 'crédits', 'budgétaires', 'nécessaires', 'note', 'réaction', 'annonce', 'action', 'edf', 'bourse', 'juillet', 'demande', 'cotation', 'mardi', 'cours', 'prix', 'etat', 'médias', 'hexagone']]]","[[['Etat', 'Ukraine', 'Etat'], ['“Ce', 'France', 'Etat', 'Belfort', 'Etat', 'Bercy', 'Bourse', 'Etat']]]","[[['EDF', 'EDF'], ['EDF', 'EDF', 'EDF', 'Autorité des Marchés Financiers', 'AMF', 'Assemblée nationale', 'EDF']]]","[[['Elisabeth Borne'], ['président de la République']]]","{'ministre': 1, 'elisabeth': 1, 'borne': 1, 'juillet': 2, 'déclaration': 1, 'politique': 1, 'générale': 1, 'parlement': 1, 'intention': 2, 'etat': 5, 'edf': 6, 'but': 1, 'souveraineté': 2, 'face': 2, 'conséquences': 1, 'guerre': 1, 'ukraine': 1, 'défis': 1, 'colossaux': 1, 'lien': 1, 'urgence': 2, 'actionnaire': 2, 'majoritaire': 1, 'instant': 1, 'capital': 1, 'euros': 2, 'action': 3, 'obligation': 1, 'convertible': 1, 'projet': 1, 'contexte': 2, 'climatique': 1, 'situation': 1, 'géopolitique': 1, 'décisions': 1, 'fortes': 1, 'indépendance': 1, 'énergétique': 2, 'france': 1, 'long': 2, 'terme': 1, 'moyens': 1, 'production': 1, 'transport': 1, 'distribution': 1, 'électricité': 1, 'capacité': 1, 'manière': 1, 'chantiers': 2, 'décisifs': 1, 'président': 1, 'république': 1, 'discours': 1, 'belfort': 1, 'programme': 1, 'construction': 1, 'réacteurs': 1, 'technologie': 1, 'bourseces': 1, 'entreprise': 1, 'décennies': 1, 'rôle': 1, 'critique': 1, 'approvisionnement': 1, 'perspective': 1, 'obligations': 1, 'option': 1, 'conversion': 1, 'échange': 1, 'actions': 1, 'nouvelles': 1, 'existantes': 1, 'oceanes': 1, 'biais': 1, 'publique': 1, 'achat': 1, 'autorité': 1, 'marchés': 1, 'financiers': 1, 'amf': 1, 'réserve': 1, 'promulgation': 1, 'loi': 1, 'finances': 1, 'rectificative': 1, 'cours': 2, 'examen': 1, 'assemblée': 1, 'nationale': 1, 'crédits': 1, 'budgétaires': 1, 'nécessaires': 1, 'note': 1, 'réaction': 1, 'annonce': 1, 'bourse': 1, 'demande': 1, 'cotation': 1, 'mardi': 1, 'prix': 1, 'médias': 1, 'hexagone': 1}","{'Etat': 5, 'Ukraine': 1, '“Ce': 1, 'France': 1, 'Belfort': 1, 'Bercy': 1, 'Bourse': 1}","{'EDF': 6, 'Autorité des Marchés Financiers': 1, 'AMF': 1, 'Assemblée nationale': 1}","{'Elisabeth Borne': 1, 'président de la République': 1}",2022,7,20
1658354400,https://fr.sputniknews.africa/20220721/des-enfants-figurent-dans-la-liste-noire-ukrainienne-1055610516.html,"Des enfants figurent dans la ""liste noire"" ukrainienne","Une militante des droits de l’homme a déclaré à Sputnik que parmi les victimes dont les données ont été diffusées sur le site ukrainien ""Mirotvorets"" se trouvent des enfants. Le plus jeune n’a même pas 10 ans.","Il y a des blessés et des morts, dont des enfants, parmi les personnes dont les coordonnées ont été inscrites sur le site Internet ukrainien ""Mirotvorets"" (""Pacificateur""), qui publie les noms et adresses des Ukrainiens et citoyens étrangers considérés comme des ""ennemis de l’Ukraine"", a déclaré à Sputnik Mira Terada, responsable du groupe de défense des droits de l’homme Fondation de lutte contre les représailles.La militante des droits de l’homme a indiqué que plusieurs personnes ont déjà été victimes d’attaques à cause de ces publications.""Il y a parmi eux ceux qui sont morts à cause de ce site"", a-t-elle déclaré en notant que le plus jeune des enfants dont les données y ont été diffusées n’avait même pas 10 ans.Mme Terada a alors indiqué qu’une ""jeune fille née en 2012 a été incluse dans la base de données du site nationaliste parce qu'elle est l'une des plus jeunes élèves du quartier général de la Jeune Garde Younarmia à Gorlovka, et elle a pris part à une action dédiée au 76e anniversaire de la Grande Victoire"".","[[['Il y a des blessés et des morts, dont des enfants, parmi les personnes dont les coordonnées ont été inscrites sur le site Internet ukrainien ""Mirotvorets"" (""Pacificateur""), qui publie les noms et adresses des Ukrainiens et citoyens étrangers considérés comme des ""ennemis de l’Ukraine"", a déclaré à Sputnik Mira Terada, responsable du groupe de défense des droits de l’homme Fondation de lutte contre les représailles.La militante des droits de l’homme a indiqué que plusieurs personnes ont déjà été victimes d’attaques à cause de ces publications.'], ['""Il y a parmi eux ceux qui sont morts à cause de ce site"", a-t-elle déclaré en notant que le plus jeune des enfants dont les données y ont été diffusées n’avait même pas 10 ans.Mme Terada a alors indiqué qu’une ""jeune fille née en 2012 a été incluse dans la base de données du site nationaliste parce qu\'elle est l\'une des plus jeunes élèves du quartier général de la Jeune Garde Younarmia à Gorlovka, et elle a pris part à une action dédiée au 76e anniversaire de la Grande Victoire"".']]]","[[['blessés', 'morts', 'enfants', 'personnes', 'coordonnées', 'site', 'internet', 'ukrainien', 'mirotvorets', 'pacificateur', 'noms', 'adresses', 'ukrainiens', 'citoyens', 'étrangers', 'ennemis', 'ukraine', 'sputnik', 'terada', 'responsable', 'groupe', 'défense', 'droits', 'homme', 'lutte', 'militante', 'droits', 'homme', 'personnes', 'victimes', 'attaques', 'cause', 'publications'], ['morts', 'cause', 'site', 'jeune', 'enfants', 'données', 'terada', 'jeune', 'fille', 'base', 'données', 'site', 'nationaliste', 'jeunes', 'élèves', 'quartier', 'général', 'jeune', 'garde', 'younarmia', 'gorlovka', 'part', 'action', 'anniversaire', 'grande', 'victoire']]]","[[['Ukraine', 'Ukraine'], ['Gorlovka']]]","[[['Fondation de lutte'], []]]","[[[], ['Mme Terada']]]","{'blessés': 1, 'morts': 2, 'enfants': 2, 'personnes': 2, 'coordonnées': 1, 'site': 3, 'internet': 1, 'ukrainien': 1, 'mirotvorets': 1, 'pacificateur': 1, 'noms': 1, 'adresses': 1, 'ukrainiens': 1, 'citoyens': 1, 'étrangers': 1, 'ennemis': 1, 'ukraine': 1, 'sputnik': 1, 'terada': 2, 'responsable': 1, 'groupe': 1, 'défense': 1, 'droits': 2, 'homme': 2, 'lutte': 1, 'militante': 1, 'victimes': 1, 'attaques': 1, 'cause': 2, 'publications': 1, 'jeune': 3, 'données': 2, 'fille': 1, 'base': 1, 'nationaliste': 1, 'jeunes': 1, 'élèves': 1, 'quartier': 1, 'général': 1, 'garde': 1, 'younarmia': 1, 'gorlovka': 1, 'part': 1, 'action': 1, 'anniversaire': 1, 'grande': 1, 'victoire': 1}","{'Ukraine': 2, 'Gorlovka': 1}",{'Fondation de lutte': 1},{'Mme Terada': 1},2022,7,20
1658354400,https://fr.sputniknews.africa/20220721/engrais-russes-et-ble-ukrainien-un-jeu-douteux-de-loccident-selon-lavrov-1055600707.html,"Engrais russes et blé ukrainien, un jeu douteux de l’Occident, selon Lavrov","Face au risque de pénurie de blé, l’Occident mène un jeu ""malpropre"" autour des céréales ukrainiennes en spéculant sur les sanctions indirectes imposées à la Russie, regrette le ministre russe des Affaires étrangères.","L’Occident tente d’entraîner le secrétaire général de l’Onu Antonio Guterres dans ses jeux autour du blé ukrainien, a déclaré ce mercredi le chef de la diplomatie russe Sergueï Lavrov dans une interview à Sputnik et à RT.Selon lui, Moscou a plusieurs fois souligné que les sanctions indirectes de l’UE avaient un impact négatif sur les exportations d’engrais russes. En effet, l'Union européenne importe de Russie non seulement du gaz mais aussi des engrais. Or, la Russie, à côté de l'Ukraine, est un producteur clé des engrais phosphatés nécessaires pour de nombreux pays pour assurer de bonnes récoltes.Un jeu ""malpropre""""Nous avons expliqué durant de longs mois que oui, les engrais mêmes ne tombent pas sous le coup des sanctions mais le fret, l’assurance et la visite par nos navires les transportant dans les ports étrangers, ainsi que la visite de nos ports des navires étrangers en vue de récupérer ces marchandises, tout cela est tombé ensemble sous le premier ou le deuxième paquet [de sanctions]. C’est pourquoi on nous ment en pleine face en déclarant que tout cela est faux, c’est malpropre. Malheureusement, ils ont essayé et essaient toujours d’impliquer dans leurs jeux le secrétaire général de l’Onu"", a indiqué le ministre.Les navires russes sont en effet autorisés à entrer dans les ports de l'UE s'ils transportent de la nourriture ou des médicaments. Cependant, les exportations de produits alimentaires en provenance de certains ports russes ont été bloquées par des courtiers car des ports pourraient appartenir indirectement à des entreprises publiques russes que Bruxelles a sanctionnées.La famine en Ukraine ne fait pas peur à l’UEEn mai dernier, les réserves de blé qui y étaient conservées ont commencé à être exportées vers les pays d’Europe par des itinéraires alternatifs à la mer Noire, minée par l’armée ukrainienne près du littoral de ce port important. Ce sont l’UE et les États-Unis qui ont insisté sur cette exportation, en impliquant l’Onu dans ce processus. Les Nations unies ont ainsi prié le Kremlin d’organiser des couloirs humanitaires pour ces céréales, en échange d’un desserrement des sanctions concernant les exportations d’engrais potassiques.En attendant, en Ukraine, la menace d’un manque de blé à l’intérieur du pays reste réelle, vu que la récolte risque d’être dérisoire sur fond des hostilités en cours.","[[['L’Occident tente d’entraîner le secrétaire général de l’Onu Antonio Guterres dans ses jeux autour du blé ukrainien, a déclaré ce mercredi le chef de la diplomatie russe Sergueï Lavrov dans une interview à Sputnik et à RT.Selon lui, Moscou a plusieurs fois souligné que les sanctions indirectes de l’UE avaient un impact négatif sur les exportations d’engrais russes.'], [""En effet, l'Union européenne importe de Russie non seulement du gaz mais aussi des engrais.""], ['Or, la Russie, à côté de l\'Ukraine, est un producteur clé des engrais phosphatés nécessaires pour de nombreux pays pour assurer de bonnes récoltes.Un jeu ""malpropre""""Nous avons expliqué durant de longs mois que oui, les engrais mêmes ne tombent pas sous le coup des sanctions mais le fret, l’assurance et la visite par nos navires les transportant dans les ports étrangers, ainsi que la visite de nos ports des navires étrangers en vue de récupérer ces marchandises, tout cela est tombé ensemble sous le premier ou le deuxième paquet [de sanctions].'], ['C’est pourquoi on nous ment en pleine face en déclarant que tout cela est faux, c’est malpropre.'], ['Malheureusement, ils ont essayé et essaient toujours d’impliquer dans leurs jeux le secrétaire général de l’Onu"", a indiqué le ministre.Les navires russes sont en effet autorisés à entrer dans les ports de l\'UE s\'ils transportent de la nourriture ou des médicaments.'], ['Cependant, les exportations de produits alimentaires en provenance de certains ports russes ont été bloquées par des courtiers car des ports pourraient appartenir indirectement à des entreprises publiques russes que Bruxelles a sanctionnées.La famine en Ukraine ne fait pas peur à l’UEEn mai dernier, les réserves de blé qui y étaient conservées ont commencé à être exportées vers les pays d’Europe par des itinéraires alternatifs à la mer Noire, minée par l’armée ukrainienne près du littoral de ce port important.'], ['Ce sont l’UE et les États-Unis qui ont insisté sur cette exportation, en impliquant l’Onu dans ce processus.'], ['Les Nations unies ont ainsi prié le Kremlin d’organiser des couloirs humanitaires pour ces céréales, en échange d’un desserrement des sanctions concernant les exportations d’engrais potassiques.En attendant, en Ukraine, la menace d’un manque de blé à l’intérieur du pays reste réelle, vu que la récolte risque d’être dérisoire sur fond des hostilités en cours.']]]","[[['occident', 'secrétaire', 'général', 'onu', 'antonio', 'guterres', 'jeux', 'blé', 'ukrainien', 'mercredi', 'chef', 'diplomatie', 'russe', 'sergueï', 'lavrov', 'interview', 'sputnik', 'moscou', 'fois', 'sanctions', 'indirectes', 'ue', 'impact', 'négatif', 'exportations', 'engrais', 'russes'], ['union', 'européenne', 'russie', 'gaz', 'engrais'], ['russie', 'côté', 'ukraine', 'producteur', 'engrais', 'phosphatés', 'nécessaires', 'pays', 'bonnes', 'jeu', 'longs', 'mois', 'oui', 'engrais', 'coup', 'sanctions', 'fret', 'assurance', 'visite', 'navires', 'ports', 'étrangers', 'visite', 'ports', 'navires', 'étrangers', 'vue', 'marchandises', 'ensemble', 'paquet'], ['ment', 'pleine', 'face', 'faux', 'malpropre'], ['jeux', 'secrétaire', 'général', 'onu', 'navires', 'russes', 'ports', 'ue', 'nourriture', 'médicaments'], ['exportations', 'produits', 'alimentaires', 'provenance', 'ports', 'russes', 'courtiers', 'ports', 'indirectement', 'entreprises', 'publiques', 'russes', 'bruxelles', 'famine', 'ukraine', 'peur', 'ueen', 'mai', 'dernier', 'réserves', 'blé', 'pays', 'europe', 'itinéraires', 'alternatifs', 'mer', 'noire', 'armée', 'ukrainienne', 'littoral', 'port', 'important'], ['ue', 'exportation', 'onu', 'processus'], ['nations', 'unies', 'kremlin', 'couloirs', 'humanitaires', 'céréales', 'échange', 'desserrement', 'sanctions', 'exportations', 'engrais', 'ukraine', 'menace', 'manque', 'blé', 'intérieur', 'pays', 'réelle', 'récolte', 'dérisoire', 'fond', 'hostilités', 'cours']]]","[[['Occident', 'RT.Selon', 'Moscou'], ['Russie'], ['Russie', 'Ukraine'], [], [], ['Bruxelles', 'Ukraine', 'Europe', 'mer Noire'], ['États-Unis'], ['Kremlin', 'Ukraine']]]","[[['Sputnik', 'UE'], ['Union européenne'], [], [], ['Onu', 'UE'], [], ['UE', 'Onu'], ['Nations unies']]]","[[['Antonio Guterres', 'Sergueï Lavrov'], [], [], [], [], [], [], []]]","{'occident': 1, 'secrétaire': 2, 'général': 2, 'onu': 3, 'antonio': 1, 'guterres': 1, 'jeux': 2, 'blé': 3, 'ukrainien': 1, 'mercredi': 1, 'chef': 1, 'diplomatie': 1, 'russe': 1, 'sergueï': 1, 'lavrov': 1, 'interview': 1, 'sputnik': 1, 'moscou': 1, 'fois': 1, 'sanctions': 3, 'indirectes': 1, 'ue': 3, 'impact': 1, 'négatif': 1, 'exportations': 3, 'engrais': 5, 'russes': 4, 'union': 1, 'européenne': 1, 'russie': 2, 'gaz': 1, 'côté': 1, 'ukraine': 3, 'producteur': 1, 'phosphatés': 1, 'nécessaires': 1, 'pays': 3, 'bonnes': 1, 'jeu': 1, 'longs': 1, 'mois': 1, 'oui': 1, 'coup': 1, 'fret': 1, 'assurance': 1, 'visite': 2, 'navires': 3, 'ports': 5, 'étrangers': 2, 'vue': 1, 'marchandises': 1, 'ensemble': 1, 'paquet': 1, 'ment': 1, 'pleine': 1, 'face': 1, 'faux': 1, 'malpropre': 1, 'nourriture': 1, 'médicaments': 1, 'produits': 1, 'alimentaires': 1, 'provenance': 1, 'courtiers': 1, 'indirectement': 1, 'entreprises': 1, 'publiques': 1, 'bruxelles': 1, 'famine': 1, 'peur': 1, 'ueen': 1, 'mai': 1, 'dernier': 1, 'réserves': 1, 'europe': 1, 'itinéraires': 1, 'alternatifs': 1, 'mer': 1, 'noire': 1, 'armée': 1, 'ukrainienne': 1, 'littoral': 1, 'port': 1, 'important': 1, 'exportation': 1, 'processus': 1, 'nations': 1, 'unies': 1, 'kremlin': 1, 'couloirs': 1, 'humanitaires': 1, 'céréales': 1, 'échange': 1, 'desserrement': 1, 'menace': 1, 'manque': 1, 'intérieur': 1, 'réelle': 1, 'récolte': 1, 'dérisoire': 1, 'fond': 1, 'hostilités': 1, 'cours': 1}","{'Occident': 1, 'RT.Selon': 1, 'Moscou': 1, 'Russie': 2, 'Ukraine': 3, 'Bruxelles': 1, 'Europe': 1, 'mer Noire': 1, 'États-Unis': 1, 'Kremlin': 1}","{'Sputnik': 1, 'UE': 3, 'Union européenne': 1, 'Onu': 2, 'Nations unies': 1}","{'Antonio Guterres': 1, 'Sergueï Lavrov': 1}",2022,7,20
