timestamp,url,title,description,content,content-segmented,kws-l,loc-l,org-l,per-l,kws,loc,org,per,year,month,day
1673996400,https://fr.sputniknews.africa/20230118/regard-sur-lordre-du-jour-des-discussions-turco-americaines-a-washington-1057633318.html,Regard sur l'ordre du jour des discussions turco-américaines à Washington,La Turquie et les États-Unis se rencontrent ce mercredi 18 janvier pour tenter de régler une série de désaccords au sein de l'Otan. Le ministre turc des Affaires étrangères est en visite à Washington cette semaine. Voici les thèmes majeurs...,"Le chef de la diplomatie turque, Mevlut Cavusoglu, est en visite à Washington où il doit rencontrer son homologue américain, Antony Blinken. Leur entretien a lieu sur fond de divergences majeures entre la Turquie et les États-Unis.L'agenda de la rencontre comporte des sujets sensibles comme la demande d'Ankara d’acheter des chasseurs F-16, l'adhésion à l'Otan de la Suède et de la Finlande, le dialogue avec Damas ou encore la crise ukrainienne.Les F-16La demande turque d'acquérir auprès de Washington 40 chasseurs F-16 Block 70 et 79 kits de modernisation des avions existants est l'un des thèmes majeurs. Ankara l'avait adressée au Congrès. Le sénateur démocrate Robert Menendez s'oppose systématiquement à cette vente. La Turquie, de son côté, espère une approbation et ne veut pas acheter ""à un pays qui pose des conditions inadmissibles"".La Suède et la FinlandeL'entrée dans l'Otan de la Suède et de la Finlande est un autre sujet à traiter. Ankara a en effet posé des conditions préalables à son approbation dans ce dossier. La Suède, la Finlande et la Turquie avaient signé en juin un mémorandum d'accord sur le soutien d'Ankara à l'adhésion des deux pays scandinaves.Le texte confirmait notamment que Stockholm et Helsinki considéraient le Parti des travailleurs kurdes (PKK) comme une organisation terroriste. Les deux capitales s'y engageaient aussi à ne pas soutenir divers groupes honnis par Ankara, dont le mouvement armé kurde YPG en Syrie. La Turquie exige également l’extradition de nombreux militants.Ankara considère que ces conditions n'ont pas été remplies, en premier lieu par la Suède. Washington, pour sa part, essaie de faire pression sur la Turquie pour élargir l'Otan à deux nouveaux membres.Dialogue avec DamasDe retour des États-Unis, Mevlut Cavusoglu devrait assister à une rencontre tripartite avec ses homologues syrien et russe. Les pas turcs en vue de renouer le dialogue avec la Syrie préoccupent Washington. Cette question doit également être soulevée lors de son entretien avec Antony Blinken.Celui-ci porterait aussi sur le conflit en Ukraine et les multiples sanctions américaines à l’encontre d’Ankara et de Moscou. Mais aussi sur les préoccupations turques concernant le soutien américain aux Unités de protection du peuple kurdes en Syrie (YPG). Ainsi que le refus de remplir les exigences d'Ankara concernant les membres de l'organisation FETO, reconnue comme terroriste en Turquie, se trouvant aux États-Unis.","[[['Le chef de la diplomatie turque, Mevlut Cavusoglu, est en visite à Washington où il doit rencontrer son homologue américain, Antony Blinken.'], [""Leur entretien a lieu sur fond de divergences majeures entre la Turquie et les États-Unis.L'agenda de la rencontre comporte des sujets sensibles comme la demande d'Ankara d’acheter des chasseurs F-16, l'adhésion à l'Otan de la Suède et de la Finlande, le dialogue avec Damas ou encore la crise ukrainienne.Les F-16La demande turque d'acquérir auprès de Washington 40 chasseurs F-16 Block 70 et 79 kits de modernisation des avions existants est l'un des thèmes majeurs.""], [""Ankara l'avait adressée au Congrès.""], [""Le sénateur démocrate Robert Menendez s'oppose systématiquement à cette vente.""], ['La Turquie, de son côté, espère une approbation et ne veut pas acheter ""à un pays qui pose des conditions inadmissibles"".La Suède et la FinlandeL\'entrée dans l\'Otan de la Suède et de la Finlande est un autre sujet à traiter.'], ['Ankara a en effet posé des conditions préalables à son approbation dans ce dossier.'], [""La Suède, la Finlande et la Turquie avaient signé en juin un mémorandum d'accord sur le soutien d'Ankara à l'adhésion des deux pays scandinaves.Le texte confirmait notamment que Stockholm et Helsinki considéraient le Parti des travailleurs kurdes (PKK) comme une organisation terroriste.""], [""Les deux capitales s'y engageaient aussi à ne pas soutenir divers groupes honnis par Ankara, dont le mouvement armé kurde YPG en Syrie.""], [""La Turquie exige également l’extradition de nombreux militants.Ankara considère que ces conditions n'ont pas été remplies, en premier lieu par la Suède.""], [""Washington, pour sa part, essaie de faire pression sur la Turquie pour élargir l'Otan à deux nouveaux membres.Dialogue avec DamasDe retour des États-Unis, Mevlut Cavusoglu devrait assister à une rencontre tripartite avec ses homologues syrien et russe.""], ['Les pas turcs en vue de renouer le dialogue avec la Syrie préoccupent Washington.'], ['Cette question doit également être soulevée lors de son entretien avec Antony Blinken.Celui-ci porterait aussi sur le conflit en Ukraine et les multiples sanctions américaines à l’encontre d’Ankara et de Moscou.'], ['Mais aussi sur les préoccupations turques concernant le soutien américain aux Unités de protection du peuple kurdes en Syrie (YPG).'], [""Ainsi que le refus de remplir les exigences d'Ankara concernant les membres de l'organisation FETO, reconnue comme terroriste en Turquie, se trouvant aux États-Unis.""]]]","[[['chef', 'diplomatie', 'turque', 'cavusoglu', 'visite', 'washington', 'homologue', 'américain', 'antony', 'blinken'], ['entretien', 'lieu', 'fond', 'divergences', 'majeures', 'turquie', 'états', 'agenda', 'rencontre', 'sujets', 'sensibles', 'demande', 'ankara', 'chasseurs', 'adhésion', 'otan', 'suède', 'finlande', 'dialogue', 'damas', 'crise', 'turque', 'washington', 'chasseurs', 'block', 'kits', 'modernisation', 'avions', 'existants', 'thèmes', 'majeurs'], ['ankara', 'congrès'], ['sénateur', 'démocrate', 'robert', 'menendez', 'vente'], ['turquie', 'côté', 'approbation', 'pays', 'conditions', 'suède', 'entrée', 'otan', 'suède', 'finlande', 'sujet'], ['ankara', 'conditions', 'préalables', 'approbation', 'dossier'], ['suède', 'finlande', 'turquie', 'juin', 'mémorandum', 'accord', 'soutien', 'ankara', 'adhésion', 'pays', 'texte', 'stockholm', 'parti', 'travailleurs', 'kurdes', 'pkk', 'organisation', 'terroriste'], ['capitales', 'groupes', 'ankara', 'mouvement', 'kurde', 'ypg', 'syrie'], ['turquie', 'extradition', 'conditions', 'lieu', 'suède'], ['washington', 'part', 'pression', 'turquie', 'otan', 'nouveaux', 'damasde', 'mevlut', 'cavusoglu', 'rencontre', 'homologues', 'syrien', 'russe'], ['turcs', 'vue', 'dialogue', 'syrie', 'washington'], ['question', 'entretien', 'antony', 'conflit', 'ukraine', 'multiples', 'sanctions', 'américaines', 'encontre', 'ankara', 'moscou'], ['préoccupations', 'turques', 'soutien', 'américain', 'unités', 'protection', 'peuple', 'kurdes', 'syrie', 'ypg'], ['refus', 'exigences', 'ankara', 'membres', 'organisation', 'feto', 'terroriste', 'turquie']]]","[[['Washington'], ['Turquie', 'États-Unis', 'Ankara', 'Finlande', 'Damas', 'Washington'], ['Ankara'], [], ['Turquie', 'Suède', 'Finlande'], ['Ankara'], ['Suède', 'Finlande', 'Turquie', 'Ankara', 'Stockholm', 'Helsinki'], ['Ankara', 'Syrie'], ['Turquie', 'Ankara', 'Suède'], ['Turquie', 'États-Unis'], ['Syrie', 'Washington'], ['Ukraine', 'Ankara', 'Moscou'], ['Syrie'], ['Ankara', 'Turquie', 'États-Unis']]]","[[[], ['Otan de la Suède'], ['Congrès'], [], [""FinlandeL'"", 'Otan de la Suède'], [], ['Parti des travailleurs kurdes', 'PKK'], ['YPG'], [], ['Otan'], [], [], ['Unités de protection du peuple kurdes', 'YPG'], ['FETO']]]","[[['Mevlut Cavusoglu', 'Antony Blinken'], [], [], [], [], [], [], [], [], ['Washington', 'DamasDe', 'Mevlut Cavusoglu'], [], ['Antony Blinken'], [], []]]","{'chef': 1, 'diplomatie': 1, 'turque': 2, 'cavusoglu': 2, 'visite': 1, 'washington': 4, 'homologue': 1, 'américain': 2, 'antony': 2, 'blinken': 1, 'entretien': 2, 'lieu': 2, 'fond': 1, 'divergences': 1, 'majeures': 1, 'turquie': 6, 'états': 1, 'agenda': 1, 'rencontre': 2, 'sujets': 1, 'sensibles': 1, 'demande': 1, 'ankara': 7, 'chasseurs': 2, 'adhésion': 2, 'otan': 3, 'suède': 5, 'finlande': 3, 'dialogue': 2, 'damas': 1, 'crise': 1, 'block': 1, 'kits': 1, 'modernisation': 1, 'avions': 1, 'existants': 1, 'thèmes': 1, 'majeurs': 1, 'congrès': 1, 'sénateur': 1, 'démocrate': 1, 'robert': 1, 'menendez': 1, 'vente': 1, 'côté': 1, 'approbation': 2, 'pays': 2, 'conditions': 3, 'entrée': 1, 'sujet': 1, 'préalables': 1, 'dossier': 1, 'juin': 1, 'mémorandum': 1, 'accord': 1, 'soutien': 2, 'texte': 1, 'stockholm': 1, 'parti': 1, 'travailleurs': 1, 'kurdes': 2, 'pkk': 1, 'organisation': 2, 'terroriste': 2, 'capitales': 1, 'groupes': 1, 'mouvement': 1, 'kurde': 1, 'ypg': 2, 'syrie': 3, 'extradition': 1, 'part': 1, 'pression': 1, 'nouveaux': 1, 'damasde': 1, 'mevlut': 1, 'homologues': 1, 'syrien': 1, 'russe': 1, 'turcs': 1, 'vue': 1, 'question': 1, 'conflit': 1, 'ukraine': 1, 'multiples': 1, 'sanctions': 1, 'américaines': 1, 'encontre': 1, 'moscou': 1, 'préoccupations': 1, 'turques': 1, 'unités': 1, 'protection': 1, 'peuple': 1, 'refus': 1, 'exigences': 1, 'membres': 1, 'feto': 1}","{'Washington': 3, 'Turquie': 6, 'États-Unis': 3, 'Ankara': 8, 'Finlande': 3, 'Damas': 1, 'Suède': 3, 'Stockholm': 1, 'Helsinki': 1, 'Syrie': 3, 'Ukraine': 1, 'Moscou': 1}","{'Otan de la Suède': 2, 'Congrès': 1, ""FinlandeL'"": 1, 'Parti des travailleurs kurdes': 1, 'PKK': 1, 'YPG': 2, 'Otan': 1, 'Unités de protection du peuple kurdes': 1, 'FETO': 1}","{'Mevlut Cavusoglu': 2, 'Antony Blinken': 2, 'Washington': 1, 'DamasDe': 1}",2023,1,17
1673996400,https://fr.sputniknews.africa/20230118/une-monnaie-numerique-bientot-lancee-en-tanzanie-1057632804.html,Une monnaie numérique bientôt lancée en Tanzanie?,"La Bank of Tanzania étudie la possibilité d'adopter une monnaie numérique, en collaboration avec d'autres banques centrales. À savoir que six pays se sont déjà lancés dans une aventure similaire, mais ont finalement abandonné.","La Banque centrale tanzanienne annonce dans un communiqué publié samedi 14 janvier préparer le lancement de sa monnaie numérique. La date du début de l'émission n’est pour autant pas précisée.Afin de mener à bien ce projet, la Bank of Tanzania œuvre à surveiller, rechercher et collaborer avec divers associés, dont certaines banques centrales. L’objectif: créer une technologie adaptée à l’unité monétaire tanzanienne, en version numérique.La banque a décidé d’opter pour une insertion progressive, prudente et basée sur le calcul des risques qui y seront associés tout en déterminant la possibilité d’émission, de distribution et d’utilisation de cette monnaie, ainsi que les probabilités de contrefaçon.La MNBC est une version numérique des pièces et des billets de banque, elle est plus sûre et moins volatile que les crypto actifs, car elle est émise et régulée par une banque centrale.Un défi de tailleIl est à signaler que six pays se sont déjà engagés sur le même terrain, mais ont finalement décidé d’abandonné, en raison des défis structurels et technologiques. Parmi eux, la prédominance de l'argent liquide pour les transactions, les systèmes de paiement inefficaces, les taux d'intérêt élevés, et également les coûts de transaction prohibitifs.Le Nigéria est le deuxième pays après les Bahamas à avoir adopté une MNBC, en 2021. L’Afrique du Sud et le Ghana ont entamé un projet expérimental, pendant qu’une dizaine d'autres pays tels que le Rwanda, le Kenya, Maurice et la Namibie sont encore dans la phase de recherche.","[[['La Banque centrale tanzanienne annonce dans un communiqué publié samedi 14 janvier préparer le lancement de sa monnaie numérique.'], [""La date du début de l'émission n’est pour autant pas précisée.Afin de mener à bien ce projet, la Bank of Tanzania œuvre à surveiller, rechercher et collaborer avec divers associés, dont certaines banques centrales.""], ['L’objectif: créer une technologie adaptée à l’unité monétaire tanzanienne, en version numérique.La banque a décidé d’opter pour une insertion progressive, prudente et basée sur le calcul des risques qui y seront associés tout en déterminant la possibilité d’émission, de distribution et d’utilisation de cette monnaie, ainsi que les probabilités de contrefaçon.La MNBC est une version numérique des pièces et des billets de banque, elle est plus sûre et moins volatile que les crypto actifs, car elle est émise et régulée par une banque centrale.Un défi de tailleIl est à signaler que six pays se sont déjà engagés sur le même terrain, mais ont finalement décidé d’abandonné, en raison des défis structurels et technologiques.'], [""Parmi eux, la prédominance de l'argent liquide pour les transactions, les systèmes de paiement inefficaces, les taux d'intérêt élevés, et également les coûts de transaction prohibitifs.Le Nigéria est le deuxième pays après les Bahamas à avoir adopté une MNBC, en 2021.""], [""L’Afrique du Sud et le Ghana ont entamé un projet expérimental, pendant qu’une dizaine d'autres pays tels que le Rwanda, le Kenya, Maurice et la Namibie sont encore dans la phase de recherche.""]]]","[[['banque', 'centrale', 'tanzanienne', 'communiqué', 'samedi', 'janvier', 'lancement', 'monnaie', 'numérique'], ['date', 'début', 'émission', 'projet', 'bank', 'tanzania', 'œuvre', 'associés', 'banques', 'centrales'], ['objectif', 'technologie', 'unité', 'monétaire', 'tanzanienne', 'version', 'banque', 'insertion', 'progressive', 'prudente', 'basée', 'calcul', 'risques', 'associés', 'possibilité', 'émission', 'distribution', 'utilisation', 'monnaie', 'probabilités', 'mnbc', 'version', 'numérique', 'pièces', 'billets', 'banque', 'volatile', 'crypto', 'actifs', 'banque', 'défi', 'tailleil', 'pays', 'terrain', 'raison', 'défis', 'structurels', 'technologiques'], ['prédominance', 'argent', 'liquide', 'transactions', 'systèmes', 'paiement', 'inefficaces', 'taux', 'intérêt', 'élevés', 'coûts', 'transaction', 'nigéria', 'pays', 'bahamas', 'mnbc'], ['afrique', 'sud', 'ghana', 'projet', 'expérimental', 'dizaine', 'pays', 'rwanda', 'kenya', 'maurice', 'namibie', 'phase', 'recherche']]]","[[[], [], [], ['Nigéria', 'Bahamas'], ['L’Afrique du Sud', 'Ghana', 'Rwanda', 'Kenya', 'Maurice', 'Namibie']]]","[[['Banque centrale tanzanienne'], ['Bank of Tanzania'], ['MNBC'], [], []]]","[[[], [], [], [], []]]","{'banque': 4, 'centrale': 1, 'tanzanienne': 2, 'communiqué': 1, 'samedi': 1, 'janvier': 1, 'lancement': 1, 'monnaie': 2, 'numérique': 2, 'date': 1, 'début': 1, 'émission': 2, 'projet': 2, 'bank': 1, 'tanzania': 1, 'œuvre': 1, 'associés': 2, 'banques': 1, 'centrales': 1, 'objectif': 1, 'technologie': 1, 'unité': 1, 'monétaire': 1, 'version': 2, 'insertion': 1, 'progressive': 1, 'prudente': 1, 'basée': 1, 'calcul': 1, 'risques': 1, 'possibilité': 1, 'distribution': 1, 'utilisation': 1, 'probabilités': 1, 'mnbc': 2, 'pièces': 1, 'billets': 1, 'volatile': 1, 'crypto': 1, 'actifs': 1, 'défi': 1, 'tailleil': 1, 'pays': 3, 'terrain': 1, 'raison': 1, 'défis': 1, 'structurels': 1, 'technologiques': 1, 'prédominance': 1, 'argent': 1, 'liquide': 1, 'transactions': 1, 'systèmes': 1, 'paiement': 1, 'inefficaces': 1, 'taux': 1, 'intérêt': 1, 'élevés': 1, 'coûts': 1, 'transaction': 1, 'nigéria': 1, 'bahamas': 1, 'afrique': 1, 'sud': 1, 'ghana': 1, 'expérimental': 1, 'dizaine': 1, 'rwanda': 1, 'kenya': 1, 'maurice': 1, 'namibie': 1, 'phase': 1, 'recherche': 1}","{'Nigéria': 1, 'Bahamas': 1, 'L’Afrique du Sud': 1, 'Ghana': 1, 'Rwanda': 1, 'Kenya': 1, 'Maurice': 1, 'Namibie': 1}","{'Banque centrale tanzanienne': 1, 'Bank of Tanzania': 1, 'MNBC': 1}",{},2023,1,17
1673996400,https://fr.sputniknews.africa/20230118/-il-y-a-80-ans-larmee-rouge-percait-le-blocus-de-leningrad---1057631764.html,"Il y a 80 ans, l'Armée rouge perçait le blocus de Leningrad","Le 18 janvier 1943, les forces soviétiques brisaient le blocus de Leningrad, aujourd’hui Saint-Pétersbourg. Depuis le 8 septembre 1941, la deuxième ville de l’URSS était assiégée par les troupes allemandes, finlandaises et espagnoles. La...","En 1941, année de l’entrée en guerre de l’URSS contre l’Allemagne nazie, Leningrad (actuellement Saint-Pétersbourg) était la deuxième plus grande ville du pays avec 12% de l’industrie nationale et 30% de l’industrie de guerre.Julia Bouïanova, une responsable du Musée de la défense et du siège de Leningrad, a raconté à Sputnik que le commandement allemand prévoyait de la prendre avant Moscou. Son contrôle compliquait en effet considérablement la défense de la capitale.Un siège de 872 joursL’importance de Leningrad était indéniable. Située au bord de la Baltique, sa prise aurait permis aux Allemands de contrôler complètement cette mer, une voie importante de ravitaillement des troupes. L’occupation de la ville ouvrait la voie vers le nord, vers le port de Mourmansk, mais aussi vers le sud, vers Moscou.Le 8 septembre 1941, la ville a été prise en tenaille par les troupes allemandes et finlandaises.Le siège a duré 872 jours, jusqu’au 27 janvier 1944.Leningrad n’était pas préparée à un blocus long et ne disposait pas de suffisamment de nourriture et de carburant.Tout au long du siège, la ville était pilonnée et bombardée.Plus d’un million de mortsLe seul moyen de communiquer avec Leningrad était le lac Ladoga, mais la capacité de cette voie de transport était insuffisante pour subvenir aux besoins. En été, la ville était approvisionnée par des bateaux, en hiver, la voie passait par la glace.Ces 872 jours de siège ont tué plus d'un million de personnes, essentiellement de faim. 17.000 habitants ont trouvé la mort dans les bombardements.Le 18 janvier 1943, le siège a été brisé et les Allemands ont été repoussés à plusieurs kilomètres des rives du lac. Cela a permis de construire en 17 jours une voie ferrée de 33 kilomètres et d’organiser le ravitaillement de la ville.Poutine rend hommageIl va de soi que la percée du siège a été une véritable fête pour les habitants. Il est devenu clair que la victoire définitive à Leningrad n’était pas loin.Ce mercredi 18 janvier, Vladimir Poutine s’est rendu à Saint-Pétersbourg pour célébrer l’événement.Son père a participé à la défense de Leningrad et a été grièvement blessé au combat. Sa mère est restée dans la ville pendant toute la durée du siège. Son frère aîné y est mort en hiver 1942 de la diphtérie.","[[['En 1941, année de l’entrée en guerre de l’URSS contre l’Allemagne nazie, Leningrad (actuellement Saint-Pétersbourg) était la deuxième plus grande ville du pays avec 12% de l’industrie nationale et 30% de l’industrie de guerre.Julia Bouïanova, une responsable du Musée de la défense et du siège de Leningrad, a raconté à Sputnik que le commandement allemand prévoyait de la prendre avant Moscou.'], ['Son contrôle compliquait en effet considérablement la défense de la capitale.Un siège de 872 joursL’importance de Leningrad était indéniable.'], ['Située au bord de la Baltique, sa prise aurait permis aux Allemands de contrôler complètement cette mer, une voie importante de ravitaillement des troupes.'], ['L’occupation de la ville ouvrait la voie vers le nord, vers le port de Mourmansk, mais aussi vers le sud, vers Moscou.Le 8 septembre 1941, la ville a été prise en tenaille par les troupes allemandes et finlandaises.Le siège a duré 872 jours, jusqu’au 27 janvier 1944.Leningrad n’était pas préparée à un blocus long et ne disposait pas de suffisamment de nourriture et de carburant.Tout au long du siège, la ville était pilonnée et bombardée.Plus d’un million de mortsLe seul moyen de communiquer avec Leningrad était le lac Ladoga, mais la capacité de cette voie de transport était insuffisante pour subvenir aux besoins.'], [""En été, la ville était approvisionnée par des bateaux, en hiver, la voie passait par la glace.Ces 872 jours de siège ont tué plus d'un million de personnes, essentiellement de faim.""], ['17.000 habitants ont trouvé la mort dans les bombardements.Le 18 janvier 1943, le siège a été brisé et les Allemands ont été repoussés à plusieurs kilomètres des rives du lac.'], ['Cela a permis de construire en 17 jours une voie ferrée de 33 kilomètres et d’organiser le ravitaillement de la ville.Poutine rend hommageIl va de soi que la percée du siège a été une véritable fête pour les habitants.'], ['Il est devenu clair que la victoire définitive à Leningrad n’était pas loin.Ce mercredi 18 janvier, Vladimir Poutine s’est rendu à Saint-Pétersbourg pour célébrer l’événement.Son père a participé à la défense de Leningrad et a été grièvement blessé au combat.'], ['Sa mère est restée dans la ville pendant toute la durée du siège.'], ['Son frère aîné y est mort en hiver 1942 de la diphtérie.']]]","[[['année', 'entrée', 'guerre', 'urss', 'allemagne', 'nazie', 'leningrad', 'grande', 'ville', 'pays', 'industrie', 'nationale', 'industrie', 'bouïanova', 'responsable', 'musée', 'défense', 'siège', 'leningrad', 'sputnik', 'commandement', 'allemand', 'moscou'], ['contrôle', 'défense', 'siège', 'importance', 'leningrad', 'indéniable'], ['bord', 'baltique', 'prise', 'allemands', 'mer', 'voie', 'importante', 'troupes'], ['occupation', 'ville', 'voie', 'nord', 'port', 'mourmansk', 'sud', 'septembre', 'ville', 'tenaille', 'troupes', 'allemandes', 'siège', 'jours', 'janvier', 'blocus', 'long', 'nourriture', 'long', 'siège', 'ville', 'million', 'mortsle', 'moyen', 'leningrad', 'lac', 'ladoga', 'capacité', 'voie', 'transport', 'insuffisante', 'besoins'], ['ville', 'bateaux', 'hiver', 'voie', 'jours', 'siège', 'million', 'personnes', 'faim'], ['habitants', 'mort', 'janvier', 'siège', 'allemands', 'kilomètres', 'rives', 'lac'], ['jours', 'voie', 'ferrée', 'kilomètres', 'ravitaillement', 'hommageil', 'percée', 'siège', 'véritable', 'fête', 'habitants'], ['clair', 'victoire', 'définitive', 'leningrad', 'mercredi', 'janvier', 'vladimir', 'poutine', 'père', 'défense', 'leningrad', 'combat'], ['mère', 'ville', 'durée', 'siège'], ['frère', 'aîné', 'hiver', 'diphtérie']]]","[[['Leningrad', 'Saint-Pétersbourg', 'Musée de la défense et du siège de Leningrad', 'Moscou'], ['Leningrad'], ['Baltique', 'Allemagne'], ['Mourmansk', 'Moscou', 'mortsLe', 'Leningrad', 'lac Ladoga'], [], ['Allemagne'], [], ['Leningrad', 'Saint-Pétersbourg', 'Leningrad'], [], []]]","[[['URSS', 'Allemagne nazie', 'Sputnik'], [], [], [], [], [], [], [], [], []]]","[[['Julia Bouïanova'], [], [], [], [], [], ['Poutine', 'hommageIl'], ['Vladimir Poutine'], [], []]]","{'année': 1, 'entrée': 1, 'guerre': 1, 'urss': 1, 'allemagne': 1, 'nazie': 1, 'leningrad': 6, 'grande': 1, 'ville': 6, 'pays': 1, 'industrie': 2, 'nationale': 1, 'bouïanova': 1, 'responsable': 1, 'musée': 1, 'défense': 3, 'siège': 8, 'sputnik': 1, 'commandement': 1, 'allemand': 1, 'moscou': 1, 'contrôle': 1, 'importance': 1, 'indéniable': 1, 'bord': 1, 'baltique': 1, 'prise': 1, 'allemands': 2, 'mer': 1, 'voie': 5, 'importante': 1, 'troupes': 2, 'occupation': 1, 'nord': 1, 'port': 1, 'mourmansk': 1, 'sud': 1, 'septembre': 1, 'tenaille': 1, 'allemandes': 1, 'jours': 3, 'janvier': 3, 'blocus': 1, 'long': 2, 'nourriture': 1, 'million': 2, 'mortsle': 1, 'moyen': 1, 'lac': 2, 'ladoga': 1, 'capacité': 1, 'transport': 1, 'insuffisante': 1, 'besoins': 1, 'bateaux': 1, 'hiver': 2, 'personnes': 1, 'faim': 1, 'habitants': 2, 'mort': 1, 'kilomètres': 2, 'rives': 1, 'ferrée': 1, 'ravitaillement': 1, 'hommageil': 1, 'percée': 1, 'véritable': 1, 'fête': 1, 'clair': 1, 'victoire': 1, 'définitive': 1, 'mercredi': 1, 'vladimir': 1, 'poutine': 1, 'père': 1, 'combat': 1, 'mère': 1, 'durée': 1, 'frère': 1, 'aîné': 1, 'diphtérie': 1}","{'Leningrad': 5, 'Saint-Pétersbourg': 2, 'Musée de la défense et du siège de Leningrad': 1, 'Moscou': 2, 'Baltique': 1, 'Allemagne': 2, 'Mourmansk': 1, 'mortsLe': 1, 'lac Ladoga': 1}","{'URSS': 1, 'Allemagne nazie': 1, 'Sputnik': 1}","{'Julia Bouïanova': 1, 'Poutine': 1, 'hommageIl': 1, 'Vladimir Poutine': 1}",2023,1,17
