timestamp,url,title,description,content,content-segmented,kws-l,loc-l,org-l,per-l,kws,loc,org,per,year,month,day
1680386400,https://fr.sputniknews.africa/20230402/debut-en-2025-26-de-la-fabrication-du-nouveau-porte-avions-francais-1058383442.html,Début en 2025-26 de la fabrication du nouveau porte-avions français,"La construction du nouveau porte-avions à propulsion nucléaire français, censé remplacer le Charles-de-Gaulle, débutera entre fin 2025 et début 2026 avec les premiers essais en mer en 2036-37, a annoncé samedi le ministre français des...","Dans une interview au quotidien Le Parisien, Sébastien Lecornu a indiqué que le gouvernement allait ""enclencher définitivement le début de sa réalisation fin 2025/début 2026"". Le processus sera acté dans la prochaine Loi de programmation militaire (LPM) 2024-2030, d'un montant total de 413 milliards d'euros, qui doit être présentée mardi en Conseil des ministres.""Les sociétés Naval Group, Technicatome et les chantiers de l'Atlantique pourront démarrer sa construction"", a ajouté le ministre.""Les essais à la mer devront avoir lieu en 2036-2037"", a-t-il précisé, en décrivant ""une cathédrale de technologie et de compétences humaines""de 75.000 tonnes. ""Il n'y a plus que deux pays au monde qui savent construire et mettre en œuvre des porte-avions nucléaires: les Américains et nous"", a-t-il encore affirmé, revendiquant sa nécessité dans un environnement mondial marqué par le conflit en Ukraine et de multiples tensions internationales.""Avoir un groupe aéronaval renforce notre présence bien au-delà de notre propre espace maritime"", a estimé Sébastien Lecornu. ""Renoncer à cette capacité, c'est perdre des savoir-faire uniques chez nos marins, et assumer un déclassement durable parmi les autres nations"".Selon lui, une première somme de 5 milliards d'euros sera consacrée au porte-avions dans la future LPM. Il a par ailleurs affirmé avoir ""demandé au président de la République et à la Première ministre de présenter prochainement au parlement une demande de dépense supplémentaire de 1,5 milliard d'euros en 2023"" pour ""amortir les effets de l'inflation mais aussi accélérer la réparation de nos armées"". Dans les discussions sur la LPM, Élisabeth Borne a plaidé pour de petites marches annuelles, afin de repousser le plus gros de l'effort budgétaire après 2027, soit à la fin du quinquennat.En cas de vote par le Parlement, l'augmentation budgétaire pour 2023 passerait donc de 3 à 4,5 milliards d'euros.""Il y a des urgences opérationnelles"", a-t-il martelé évoquant en particulier ""nos capacités en matière de drones et de lutte anti-drone"", selon lui des enjeux clés de sécurité notamment avant les Jeux olympiques et Paralympiques de Paris-2024.","[[['Dans une interview au quotidien Le Parisien, Sébastien Lecornu a indiqué que le gouvernement allait ""enclencher définitivement le début de sa réalisation fin 2025/début 2026"".'], [""Le processus sera acté dans la prochaine Loi de programmation militaire (LPM) 2024-2030, d'un montant total de 413 milliards d'euros, qui doit être présentée mardi en Conseil des ministres.""], ['""Les sociétés Naval Group, Technicatome et les chantiers de l\'Atlantique pourront démarrer sa construction"", a ajouté le ministre.'], ['""Les essais à la mer devront avoir lieu en 2036-2037"", a-t-il précisé, en décrivant ""une cathédrale de technologie et de compétences humaines""de 75.000 tonnes.'], ['""Il n\'y a plus que deux pays au monde qui savent construire et mettre en œuvre des porte-avions nucléaires: les Américains et nous"", a-t-il encore affirmé, revendiquant sa nécessité dans un environnement mondial marqué par le conflit en Ukraine et de multiples tensions internationales.'], ['""Avoir un groupe aéronaval renforce notre présence bien au-delà de notre propre espace maritime"", a estimé Sébastien Lecornu.'], ['""Renoncer à cette capacité, c\'est perdre des savoir-faire uniques chez nos marins, et assumer un déclassement durable parmi les autres nations"".Selon lui, une première somme de 5 milliards d\'euros sera consacrée au porte-avions dans la future LPM.'], ['Il a par ailleurs affirmé avoir ""demandé au président de la République et à la Première ministre de présenter prochainement au parlement une demande de dépense supplémentaire de 1,5 milliard d\'euros en 2023"" pour ""amortir les effets de l\'inflation mais aussi accélérer la réparation de nos armées"".'], [""Dans les discussions sur la LPM, Élisabeth Borne a plaidé pour de petites marches annuelles, afin de repousser le plus gros de l'effort budgétaire après 2027, soit à la fin du quinquennat.En cas de vote par le Parlement, l'augmentation budgétaire pour 2023 passerait donc de 3 à 4,5 milliards d'euros.""], ['""Il y a des urgences opérationnelles"", a-t-il martelé évoquant en particulier ""nos capacités en matière de drones et de lutte anti-drone"", selon lui des enjeux clés de sécurité notamment avant les Jeux olympiques et Paralympiques de Paris-2024.']]]","[[['interview', 'quotidien', 'parisien', 'sébastien', 'lecornu', 'gouvernement', 'début', 'réalisation', 'fin', 'début'], ['processus', 'prochaine', 'loi', 'programmation', 'militaire', 'lpm', 'montant', 'total', 'milliards', 'euros', 'mardi', 'conseil', 'ministres'], ['sociétés', 'naval', 'technicatome', 'chantiers', 'atlantique', 'construction', 'ministre'], ['essais', 'mer', 'lieu', 'cathédrale', 'technologie', 'compétences', 'tonnes'], ['pays', 'monde', 'œuvre', 'nucléaires', 'américains', 'nécessité', 'environnement', 'mondial', 'conflit', 'ukraine', 'multiples', 'tensions', 'internationales'], ['groupe', 'aéronaval', 'présence', 'propre', 'espace', 'maritime', 'sébastien', 'lecornu'], ['capacité', 'savoir', 'uniques', 'marins', 'déclassement', 'durable', 'somme', 'milliards', 'euros', 'future', 'lpm'], ['président', 'république', 'ministre', 'parlement', 'demande', 'dépense', 'supplémentaire', 'milliard', 'euros', 'effets', 'inflation', 'réparation', 'armées'], ['discussions', 'lpm', 'borne', 'petites', 'marches', 'annuelles', 'gros', 'effort', 'budgétaire', 'fin', 'cas', 'vote', 'parlement', 'augmentation', 'budgétaire', 'milliards', 'euros'], ['urgences', 'opérationnelles', 'particulier', 'capacités', 'matière', 'drones', 'lutte', 'enjeux', 'clés', 'sécurité', 'jeux', 'olympiques', 'paralympiques']]]","[[[], [], ['Atlantique'], [], ['États-Unis', 'Ukraine'], [], [], [], [], []]]","[[['Parisien'], ['LPM', 'Conseil'], ['Naval Group'], [], [], [], [], [], ['Parlement'], ['Paris-2024']]]","[[['Sébastien Lecornu'], [], [], [], [], ['Sébastien Lecornu'], [], ['président de la République'], ['Élisabeth Borne'], []]]","{'interview': 1, 'quotidien': 1, 'parisien': 1, 'sébastien': 2, 'lecornu': 2, 'gouvernement': 1, 'début': 2, 'réalisation': 1, 'fin': 2, 'processus': 1, 'prochaine': 1, 'loi': 1, 'programmation': 1, 'militaire': 1, 'lpm': 3, 'montant': 1, 'total': 1, 'milliards': 3, 'euros': 4, 'mardi': 1, 'conseil': 1, 'ministres': 1, 'sociétés': 1, 'naval': 1, 'technicatome': 1, 'chantiers': 1, 'atlantique': 1, 'construction': 1, 'ministre': 2, 'essais': 1, 'mer': 1, 'lieu': 1, 'cathédrale': 1, 'technologie': 1, 'compétences': 1, 'tonnes': 1, 'pays': 1, 'monde': 1, 'œuvre': 1, 'nucléaires': 1, 'américains': 1, 'nécessité': 1, 'environnement': 1, 'mondial': 1, 'conflit': 1, 'ukraine': 1, 'multiples': 1, 'tensions': 1, 'internationales': 1, 'groupe': 1, 'aéronaval': 1, 'présence': 1, 'propre': 1, 'espace': 1, 'maritime': 1, 'capacité': 1, 'savoir': 1, 'uniques': 1, 'marins': 1, 'déclassement': 1, 'durable': 1, 'somme': 1, 'future': 1, 'président': 1, 'république': 1, 'parlement': 2, 'demande': 1, 'dépense': 1, 'supplémentaire': 1, 'milliard': 1, 'effets': 1, 'inflation': 1, 'réparation': 1, 'armées': 1, 'discussions': 1, 'borne': 1, 'petites': 1, 'marches': 1, 'annuelles': 1, 'gros': 1, 'effort': 1, 'budgétaire': 2, 'cas': 1, 'vote': 1, 'augmentation': 1, 'urgences': 1, 'opérationnelles': 1, 'particulier': 1, 'capacités': 1, 'matière': 1, 'drones': 1, 'lutte': 1, 'enjeux': 1, 'clés': 1, 'sécurité': 1, 'jeux': 1, 'olympiques': 1, 'paralympiques': 1}","{'Atlantique': 1, 'États-Unis': 1, 'Ukraine': 1}","{'Parisien': 1, 'LPM': 1, 'Conseil': 1, 'Naval Group': 1, 'Parlement': 1, 'Paris-2024': 1}","{'Sébastien Lecornu': 2, 'président de la République': 1, 'Élisabeth Borne': 1}",2023,4,1
1680386400,https://fr.sputniknews.africa/20230402/en-24-heures-la-russie-a-detruit-11-drones-et-un-depot-de-munitions-ukrainiens-1058383277.html,"En 24 heures, la Russie a détruit 11 drones et un dépôt de munitions ukrainiens",La Défense russe a présenté son bilan actualisé des pertes essuyées par l'Ukraine durant ces dernières 24 heures. L’instance énumère notamment 11 drones et plusieurs pièces d'artillerie.,"Lors de l'opération militaire spéciale menée en Ukraine, l'armée russe a abattu 11 drones et détruit un dépôt de munitions, selon le nouveau bilan quotidien du ministère russe de la Défense. Kiev a également perdu des blindés et d'autres véhicules, ainsi que des canons et des obusiers.Les pertes de l'Ukraine sur les axes principaux:Sur l’axe de Koupiansk, trois blindés, deux véhicules et un obusier D-30 ont été détruits.Sur l’axe de Krasny Liman, Kiev a perdu deux blindés, quatre pick-up, un canon automoteur Akatsiya et un obusier D-30.Sur l’axe de Donetsk, trois véhicules blindés de transport de troupes turcs Kirpi, trois blindés, quatre autres véhicules, trois pick-up et un obusier Msta-B.Sur les axes de Donetsk-Sud et de Zaporojié, les pertes de l'ennemi se chiffrent à deux blindés, trois pick-up, un obusier D-30 et un D-20. Un radar à contre-batterie mobile américain AN/TPQ-36 a été mis hors d'état de nuire.Sur l’axe de Kherson, l'armée ukrainienne a perdu sept véhicules et un canon automoteur Akatsiya.","[[[""Lors de l'opération militaire spéciale menée en Ukraine, l'armée russe a abattu 11 drones et détruit un dépôt de munitions, selon le nouveau bilan quotidien du ministère russe de la Défense.""], [""Kiev a également perdu des blindés et d'autres véhicules, ainsi que des canons et des obusiers.Les pertes de l'Ukraine sur les axes principaux:Sur l’axe de Koupiansk, trois blindés, deux véhicules et un obusier D-30 ont été détruits.Sur l’axe de Krasny Liman, Kiev a perdu deux blindés, quatre pick-up, un canon automoteur Akatsiya et un obusier D-30.Sur l’axe de Donetsk, trois véhicules blindés de transport de troupes turcs Kirpi, trois blindés, quatre autres véhicules, trois pick-up et un obusier Msta-B.Sur les axes de Donetsk-Sud et de Zaporojié, les pertes de l'ennemi se chiffrent à deux blindés, trois pick-up, un obusier D-30 et un D-20.""], [""Un radar à contre-batterie mobile américain AN/TPQ-36 a été mis hors d'état de nuire.Sur l’axe de Kherson, l'armée ukrainienne a perdu sept véhicules et un canon automoteur Akatsiya.""]]]","[[['opération', 'militaire', 'spéciale', 'ukraine', 'armée', 'russe', 'drones', 'dépôt', 'munitions', 'bilan', 'quotidien', 'ministère', 'russe', 'défense'], ['kiev', 'blindés', 'véhicules', 'canons', 'pertes', 'ukraine', 'axes', 'principaux', 'axe', 'koupiansk', 'blindés', 'véhicules', 'obusier', 'axe', 'krasny', 'liman', 'kiev', 'blindés', 'pick', 'canon', 'automoteur', 'akatsiya', 'obusier', 'axe', 'donetsk', 'véhicules', 'blindés', 'transport', 'troupes', 'turcs', 'kirpi', 'blindés', 'véhicules', 'pick', 'obusier', 'axes', 'donetsk', 'sud', 'zaporojié', 'pertes', 'ennemi', 'blindés', 'pick', 'obusier'], ['radar', 'mobile', 'américain', 'an', 'état', 'axe', 'kherson', 'armée', 'ukrainienne', 'véhicules', 'canon', 'automoteur', 'akatsiya']]]","[[['Ukraine'], ['Kiev', 'Ukraine', 'Koupiansk', 'Krasny Liman', 'Kiev', 'Donetsk', 'Donetsk-Sud', 'Zaporojié', 'D-20'], ['Kherson']]]","[[['ministère russe de la Défense'], ['D-30.Sur', 'Kirpi'], ['AN']]]","[[[], [], []]]","{'opération': 1, 'militaire': 1, 'spéciale': 1, 'ukraine': 2, 'armée': 2, 'russe': 2, 'drones': 1, 'dépôt': 1, 'munitions': 1, 'bilan': 1, 'quotidien': 1, 'ministère': 1, 'défense': 1, 'kiev': 2, 'blindés': 6, 'véhicules': 5, 'canons': 1, 'pertes': 2, 'axes': 2, 'principaux': 1, 'axe': 4, 'koupiansk': 1, 'obusier': 4, 'krasny': 1, 'liman': 1, 'pick': 3, 'canon': 2, 'automoteur': 2, 'akatsiya': 2, 'donetsk': 2, 'transport': 1, 'troupes': 1, 'turcs': 1, 'kirpi': 1, 'sud': 1, 'zaporojié': 1, 'ennemi': 1, 'radar': 1, 'mobile': 1, 'américain': 1, 'an': 1, 'état': 1, 'kherson': 1, 'ukrainienne': 1}","{'Ukraine': 2, 'Kiev': 2, 'Koupiansk': 1, 'Krasny Liman': 1, 'Donetsk': 1, 'Donetsk-Sud': 1, 'Zaporojié': 1, 'D-20': 1, 'Kherson': 1}","{'ministère russe de la Défense': 1, 'D-30.Sur': 1, 'Kirpi': 1, 'AN': 1}",{},2023,4,1
1680386400,https://fr.sputniknews.africa/20230402/lukraine-tire-sur-des-ouvrages-civils-a-melitopol-six-blesses-1058383003.html,"L'Ukraine tire sur des ouvrages civils à Melitopol, six blessés","L'artillerie ukrainienne a pilonné ce dimanche la ville de Melitopol. Selon les autorités, seuls des sites civils ont été visés. Six personnes ont été blessées et un immeuble fortement endommagé.","Lors des tirs réalisés ce dimanche par l'artillerie ukrainienne sur la ville de Melitopol, un immeuble a été endommagé. Le tir a également touché un dépôt de chemin de fer, indiquent les autorités municipales.Selon celles-ci, les tirs ont visé uniquement des ouvrages civils. Aucun site militaire ne se trouve à proximité des endroits concernés. Six personnes ont été blessées, toutes des civils, une femme est dans un état très grave. Les blessés ont été pris en charge par des médecins.Uniquement des civils touchésUne partie du toit et les vitres de l'immeuble ont été détruites, a fait savoir sur Telegram Vladimir Rogov, membre de l'administration de la région de Zaporojié.D'après lui, une partie des roquettes a été interceptée par la défense antiaérienne. Au total, trois roquettes ont touché la ville. Il s'agit de lance-roquettes HIMARS et Olkha.Les services techniques municipaux travaillent actuellement à rétablir le fonctionnement des systèmes d'approvisionnement en électricité et en gaz.","[[[""Lors des tirs réalisés ce dimanche par l'artillerie ukrainienne sur la ville de Melitopol, un immeuble a été endommagé.""], ['Le tir a également touché un dépôt de chemin de fer, indiquent les autorités municipales.Selon celles-ci, les tirs ont visé uniquement des ouvrages civils.'], ['Aucun site militaire ne se trouve à proximité des endroits concernés.'], ['Six personnes ont été blessées, toutes des civils, une femme est dans un état très grave.'], [""Les blessés ont été pris en charge par des médecins.Uniquement des civils touchésUne partie du toit et les vitres de l'immeuble ont été détruites, a fait savoir sur Telegram Vladimir Rogov, membre de l'administration de la région de Zaporojié.D'après lui, une partie des roquettes a été interceptée par la défense antiaérienne.""], ['Au total, trois roquettes ont touché la ville.'], [""Il s'agit de lance-roquettes HIMARS et Olkha.Les services techniques municipaux travaillent actuellement à rétablir le fonctionnement des systèmes d'approvisionnement en électricité et en gaz.""]]]","[[['tirs', 'dimanche', 'artillerie', 'ukrainienne', 'ville', 'melitopol', 'immeuble'], ['tir', 'dépôt', 'chemin', 'fer', 'autorités', 'tirs', 'ouvrages', 'civils'], ['site', 'militaire', 'proximité', 'endroits'], ['personnes', 'civils', 'femme', 'état', 'grave'], ['blessés', 'charge', 'civils', 'touchésune', 'partie', 'toit', 'vitres', 'immeuble', 'telegram', 'vladimir', 'rogov', 'membre', 'administration', 'région', 'partie', 'roquettes', 'défense', 'antiaérienne'], ['total', 'roquettes', 'ville'], ['lance', 'roquettes', 'himars', 'services', 'techniques', 'municipaux', 'fonctionnement', 'systèmes', 'approvisionnement', 'électricité', 'gaz']]]","[[['Melitopol'], [], [], [], ['Zaporojié'], [], []]]","[[[], [], [], [], ['touchésUne'], [], []]]","[[[], [], [], [], ['Telegram Vladimir Rogov'], [], []]]","{'tirs': 2, 'dimanche': 1, 'artillerie': 1, 'ukrainienne': 1, 'ville': 2, 'melitopol': 1, 'immeuble': 2, 'tir': 1, 'dépôt': 1, 'chemin': 1, 'fer': 1, 'autorités': 1, 'ouvrages': 1, 'civils': 3, 'site': 1, 'militaire': 1, 'proximité': 1, 'endroits': 1, 'personnes': 1, 'femme': 1, 'état': 1, 'grave': 1, 'blessés': 1, 'charge': 1, 'touchésune': 1, 'partie': 2, 'toit': 1, 'vitres': 1, 'telegram': 1, 'vladimir': 1, 'rogov': 1, 'membre': 1, 'administration': 1, 'région': 1, 'roquettes': 3, 'défense': 1, 'antiaérienne': 1, 'total': 1, 'lance': 1, 'himars': 1, 'services': 1, 'techniques': 1, 'municipaux': 1, 'fonctionnement': 1, 'systèmes': 1, 'approvisionnement': 1, 'électricité': 1, 'gaz': 1}","{'Melitopol': 1, 'Zaporojié': 1}",{'touchésUne': 1},{'Telegram Vladimir Rogov': 1},2023,4,1
1680386400,https://fr.sputniknews.africa/20230402/en-roumanie-les-refugies-ukrainiens-chasses-a-cause-de-nouvelles-regles-1058382316.html,"En Roumanie, les réfugiés ukrainiens chassés à cause de nouvelles règles","Face aux arriérés de paiements de la part de l'État, les familles hébergeant des réfugiés ukrainiens s'insurgent. Les nouvelles règles proposées par le gouvernement leur déplaisent également. Elles commencent ainsi à pousser leurs hôtes à...","Certains habitants de Roumanie ayant hébergé des réfugiés ukrainiens ont commencé à exiger leur départ ou le paiement d'un loyer à cause des nouvelles règles de soutien proposées par les législateurs, relate le média roumain Adevarul.Selon la réforme prévue, l'État accorderait mensuellement à chaque famille d'Ukrainiens l’équivalent de 438 dollars US, mais pour une période de quatre mois seulement, pendant laquelle les réfugiés doivent chercher du travail en Roumanie. Avec cet argent, les Ukrainiens devront également s’acquitter de leurs frais d'hébergement.Selon le programme de soutien en vigueur, ""50/20"", pour chaque réfugié, l'État verse à la famille d'accueil 11 dollars par jour pour le logement et un peu plus de 4 dollars par jour pour la nourriture (50 et 20 leu respectivement).Des cris de désespoirDepuis le début de 2023, cependant, l'État n'a effectué qu'un seul paiement aux propriétaires, et ce pour décembre 2022.La nouvelle situation ne convient plus aux propriétaires qui n'offrent leurs toits qu'à des familles nombreuses. À présent, ils essaient de se débarrasser de leurs hôtes, ou leur demandent de payer des loyers exorbitants. Depuis quelques jours, des messages de réfugiés demandant de l'aide apparaissent de plus en plus souvent sur les réseaux sociaux. Des mères désespérées disent qu'elles n'ont rien pour nourrir leurs enfants ou demandent de l'aide pour acheter des vêtements et des chaussures, précise la source.Selon les autorités roumaines, le pays a dépensé 614 millions de dollars pour aider les Ukrainiens, dont près de 109 millions pour leur nourriture et leur logement.","[[[""Certains habitants de Roumanie ayant hébergé des réfugiés ukrainiens ont commencé à exiger leur départ ou le paiement d'un loyer à cause des nouvelles règles de soutien proposées par les législateurs, relate le média roumain Adevarul.Selon la réforme prévue, l'État accorderait mensuellement à chaque famille d'Ukrainiens l’équivalent de 438 dollars US, mais pour une période de quatre mois seulement, pendant laquelle les réfugiés doivent chercher du travail en Roumanie.""], ['Avec cet argent, les Ukrainiens devront également s’acquitter de leurs frais d\'hébergement.Selon le programme de soutien en vigueur, ""50/20"", pour chaque réfugié, l\'État verse à la famille d\'accueil 11 dollars par jour pour le logement et un peu plus de 4 dollars par jour pour la nourriture (50 et 20 leu respectivement).Des cris de désespoirDepuis le début de 2023, cependant, l\'État n\'a effectué qu\'un seul paiement aux propriétaires, et ce pour décembre 2022.La nouvelle situation ne convient plus aux propriétaires qui n\'offrent leurs toits qu\'à des familles nombreuses.'], ['À présent, ils essaient de se débarrasser de leurs hôtes, ou leur demandent de payer des loyers exorbitants.'], [""Depuis quelques jours, des messages de réfugiés demandant de l'aide apparaissent de plus en plus souvent sur les réseaux sociaux.""], [""Des mères désespérées disent qu'elles n'ont rien pour nourrir leurs enfants ou demandent de l'aide pour acheter des vêtements et des chaussures, précise la source.Selon les autorités roumaines, le pays a dépensé 614 millions de dollars pour aider les Ukrainiens, dont près de 109 millions pour leur nourriture et leur logement.""]]]","[[['habitants', 'roumanie', 'réfugiés', 'ukrainiens', 'départ', 'paiement', 'loyer', 'cause', 'nouvelles', 'règles', 'soutien', 'législateurs', 'média', 'roumain', 'réforme', 'état', 'famille', 'ukrainiens', 'équivalent', 'dollars', 'période', 'mois', 'réfugiés', 'travail', 'roumanie'], ['argent', 'ukrainiens', 'frais', 'programme', 'soutien', 'vigueur', 'réfugié', 'état', 'famille', 'accueil', 'dollars', 'jour', 'logement', 'dollars', 'jour', 'nourriture', 'cris', 'début', 'état', 'paiement', 'propriétaires', 'décembre', 'nouvelle', 'situation', 'propriétaires', 'toits', 'familles'], ['présent', 'hôtes', 'loyers', 'exorbitants'], ['jours', 'messages', 'réfugiés', 'aide', 'réseaux', 'sociaux'], ['mères', 'désespérées', 'enfants', 'aide', 'vêtements', 'chaussures', 'autorités', 'roumaines', 'pays', 'millions', 'dollars', 'ukrainiens', 'millions', 'nourriture', 'logement']]]","[[['Roumanie', 'Adevarul', 'État', 'Ukraine', 'US', 'Roumanie'], ['Ukraine', 'État', 'État'], [], [], ['Ukraine']]]","[[[], [], [], [], []]]","[[[], ['2022.La'], [], [], []]]","{'habitants': 1, 'roumanie': 2, 'réfugiés': 3, 'ukrainiens': 4, 'départ': 1, 'paiement': 2, 'loyer': 1, 'cause': 1, 'nouvelles': 1, 'règles': 1, 'soutien': 2, 'législateurs': 1, 'média': 1, 'roumain': 1, 'réforme': 1, 'état': 3, 'famille': 2, 'équivalent': 1, 'dollars': 4, 'période': 1, 'mois': 1, 'travail': 1, 'argent': 1, 'frais': 1, 'programme': 1, 'vigueur': 1, 'réfugié': 1, 'accueil': 1, 'jour': 2, 'logement': 2, 'nourriture': 2, 'cris': 1, 'début': 1, 'propriétaires': 2, 'décembre': 1, 'nouvelle': 1, 'situation': 1, 'toits': 1, 'familles': 1, 'présent': 1, 'hôtes': 1, 'loyers': 1, 'exorbitants': 1, 'jours': 1, 'messages': 1, 'aide': 2, 'réseaux': 1, 'sociaux': 1, 'mères': 1, 'désespérées': 1, 'enfants': 1, 'vêtements': 1, 'chaussures': 1, 'autorités': 1, 'roumaines': 1, 'pays': 1, 'millions': 2}","{'Roumanie': 2, 'Adevarul': 1, 'État': 3, 'Ukraine': 3, 'US': 1}",{},{'2022.La': 1},2023,4,1
