timestamp,url,title,description,content,content-segmented,kws-l,loc-l,org-l,per-l,kws,loc,org,per,year,month,day
1677711600,https://fr.sputniknews.africa/20230302/la-majorite-des-francais-pour-fermer-les-bases-militaires-de-leur-pays-en-afrique-selon-un-sondage-1058083488.html,"La majorité des Français pour fermer les bases militaires de leur pays en Afrique, selon un sondage","Après que le Président Macron a annoncé fin février une nouvelle politique de la France envers l'Afrique, qui prévoit la diminution de sa présence militaire sur le continent, 55% des Français ont prôné la fermeture de toutes les bases...","Plus de la moitié des Français se sont prononcés en faveur de la fermeture de toutes les bases militaires de leur pays en Afrique, indique un sondage de l’Institut français de l’opinion publique (Ifop).Concrètement, 55% sont pour et 45% s’y opposent.Selon les résultats de l’enquête, cette idée est majoritairement soutenue par les habitants des zones rurales (60% des personnes interrogées), ainsi que par les personnes de plus de 65 ans (57%).La veille du début de sa tournée dans les pays de l’Afrique centrale, Emmanuel Macron a promis de réduire considérablement le contingent militaire français ""dans les prochains mois"". Cependant, aucun chiffre concret n’a été communiqué. Il a également évoqué l’objectif de réduire et transformer les bases françaises sur le continent.L’enquête a été menée en ligne auprès d’un échantillon de 1.004 personnes, entre le 28 février et le 1er mars 2023.Contre la présence françaiseCette déclaration intervient sur fond de sentiments antifrançais forts dans plusieurs pays africains. En effet, le Burkina Faso a demandé le 18 février le départ de la force française Sabre, dans un délai d’un mois. Le lendemain, l'armée burkinabè a annoncé la fin de cette opération, et le 1er mars, Ouagadougou a dénoncé un accord militaire de 1961 avec la France.En août 2022, les unités françaises ont quitté le Mali en conformité avec les exigences de Bamako.Au total, plus de 4.000 effectifs militaires français sont déployés dans plusieurs pays africains. En Afrique de l’Ouest, c’est la Côte d’Ivoire qui abrite une importante base de 900 personnes. Près de 700 militaires sont répartis au Sénégal et au Gabon. Enfin, le Niger et le Tchad accueillent 2.500 soldats.AP","[[['Plus de la moitié des Français se sont prononcés en faveur de la fermeture de toutes les bases militaires de leur pays en Afrique, indique un sondage de l’Institut français de l’opinion publique (Ifop).Concrètement, 55% sont pour et 45% s’y opposent.Selon les résultats de l’enquête, cette idée est majoritairement soutenue par les habitants des zones rurales (60% des personnes interrogées), ainsi que par les personnes de plus de 65 ans (57%).La veille du début de sa tournée dans les pays de l’Afrique centrale, Emmanuel Macron a promis de réduire considérablement le contingent militaire français ""dans les prochains mois"".'], ['Cependant, aucun chiffre concret n’a été communiqué.'], ['Il a également évoqué l’objectif de réduire et transformer les bases françaises sur le continent.L’enquête a été menée en ligne auprès d’un échantillon de 1.004 personnes, entre le 28 février et le 1er mars 2023.Contre la présence françaiseCette déclaration intervient sur fond de sentiments antifrançais forts dans plusieurs pays africains.'], ['En effet, le Burkina Faso a demandé le 18 février le départ de la force française Sabre, dans un délai d’un mois.'], [""Le lendemain, l'armée burkinabè a annoncé la fin de cette opération, et le 1er mars, Ouagadougou a dénoncé un accord militaire de 1961 avec la France.En août 2022, les unités françaises ont quitté le Mali en conformité avec les exigences de Bamako.Au total, plus de 4.000 effectifs militaires français sont déployés dans plusieurs pays africains.""], ['En Afrique de l’Ouest, c’est la Côte d’Ivoire qui abrite une importante base de 900 personnes.'], ['Près de 700 militaires sont répartis au Sénégal et au Gabon.'], ['Enfin, le Niger et le Tchad accueillent 2.500 soldats.AP']]]","[[['moitié', 'français', 'faveur', 'fermeture', 'bases', 'militaires', 'pays', 'afrique', 'sondage', 'institut', 'français', 'opinion', 'publique', 'résultats', 'enquête', 'idée', 'habitants', 'zones', 'rurales', 'personnes', 'personnes', 'ans', 'veille', 'début', 'tournée', 'pays', 'afrique', 'centrale', 'emmanuel', 'contingent', 'militaire', 'français', 'prochains', 'mois'], ['chiffre', 'concret'], ['objectif', 'bases', 'françaises', 'enquête', 'ligne', 'échantillon', 'personnes', 'février', 'mars', 'présence', 'françaisecette', 'déclaration', 'fond', 'sentiments', 'antifrançais', 'forts', 'pays', 'africains'], ['burkina', 'faso', 'février', 'départ', 'force', 'française', 'délai', 'mois'], ['lendemain', 'armée', 'fin', 'opération', 'mars', 'ouagadougou', 'accord', 'militaire', 'août', 'unités', 'françaises', 'mali', 'conformité', 'exigences', 'total', 'effectifs', 'militaires', 'français', 'pays', 'africains'], ['afrique', 'ouest', 'côte', 'ivoire', 'importante', 'base', 'personnes'], ['militaires', 'sénégal', 'gabon'], ['niger', 'tchad']]]","[[['France', 'Afrique', 'l’Afrique'], [], [], ['Burkina Faso'], ['Ouagadougou', 'France', 'Mali', 'Bamako'], ['Afrique de l’Ouest', 'Côte d’Ivoire'], ['Sénégal', 'Gabon'], ['Niger', 'Tchad']]]","[[['Institut français', 'Ifop).Concrètement'], [], [], ['Sabre'], [], [], [], ['AP']]]","[[['Emmanuel Macron'], [], [], [], [], [], [], []]]","{'moitié': 1, 'français': 4, 'faveur': 1, 'fermeture': 1, 'bases': 2, 'militaires': 3, 'pays': 4, 'afrique': 3, 'sondage': 1, 'institut': 1, 'opinion': 1, 'publique': 1, 'résultats': 1, 'enquête': 2, 'idée': 1, 'habitants': 1, 'zones': 1, 'rurales': 1, 'personnes': 4, 'ans': 1, 'veille': 1, 'début': 1, 'tournée': 1, 'centrale': 1, 'emmanuel': 1, 'contingent': 1, 'militaire': 2, 'prochains': 1, 'mois': 2, 'chiffre': 1, 'concret': 1, 'objectif': 1, 'françaises': 2, 'ligne': 1, 'échantillon': 1, 'février': 2, 'mars': 2, 'présence': 1, 'françaisecette': 1, 'déclaration': 1, 'fond': 1, 'sentiments': 1, 'antifrançais': 1, 'forts': 1, 'africains': 2, 'burkina': 1, 'faso': 1, 'départ': 1, 'force': 1, 'française': 1, 'délai': 1, 'lendemain': 1, 'armée': 1, 'fin': 1, 'opération': 1, 'ouagadougou': 1, 'accord': 1, 'août': 1, 'unités': 1, 'mali': 1, 'conformité': 1, 'exigences': 1, 'total': 1, 'effectifs': 1, 'ouest': 1, 'côte': 1, 'ivoire': 1, 'importante': 1, 'base': 1, 'sénégal': 1, 'gabon': 1, 'niger': 1, 'tchad': 1}","{'France': 2, 'Afrique': 1, 'l’Afrique': 1, 'Burkina Faso': 1, 'Ouagadougou': 1, 'Mali': 1, 'Bamako': 1, 'Afrique de l’Ouest': 1, 'Côte d’Ivoire': 1, 'Sénégal': 1, 'Gabon': 1, 'Niger': 1, 'Tchad': 1}","{'Institut français': 1, 'Ifop).Concrètement': 1, 'Sabre': 1, 'AP': 1}",{'Emmanuel Macron': 1},2023,3,1
1677711600,https://fr.sputniknews.africa/20230302/bamako-retire-a-paris-le-statut-de-porte-plume-des-resolutions-du-cs-de-lonu-relatives-au-mali-1058079934.html,Bamako retire à Paris le statut de porte-plume des résolutions du CS de l’Onu relatives au Mali,Le gouvernement malien a annoncé sa décision de retirer le statut de la France en tant que porte-plume des résolutions concernant le Mali au Conseil de sécurité de l’Onu.,"La France ne peut plus rédiger les résolutions et déclarations concernant le Mali au sein du Conseil de sécurité de l’Onu, a déclaré le gouvernement malien dans une lettre adressée le 1er mars à Pedro Comissario Afonso, président en exercice du Conseil de sécurité et ambassadeur du Mozambique auprès de l’Onu.""En attendant la réunion spéciale du Conseil de sécurité sollicitée par le Mali, le gouvernement de la république du Mali récuse officiellement le statut de porte-plume de la France sur toutes questions examinées par le Conseil de sécurité concernant le Mali"", a indiqué le cabinet des ministres. La déconstruction coloniale continue: “Le Gouvernement de la République du Mali, par la présente correspondance, récuse officiellement le statut de porte-plume de la France sur toutes questions examinées par le Conseil de sécurité concernant le Mali.“ Merci @AbdoulayeDiop8 🙏🏽🙏🏽✊🏽 pic.twitter.com/fHzyS6E8el— Nathalie Yamb (@Nath_Yamb) March 2, 2023 La France a porté la plume sur tous les sujets concernant le Mali au Conseil de sécurité depuis décembre 2012, lorsque la situation dans ce pays était inscrite à l’agenda du Conseil.En août 2022, le Mali a porté plainte auprès du Conseil de sécurité pour actes d’agression, de subversion, de déstabilisation et de violation de l’espace aérien malien par des aéronefs des forces armées françaises. Début 2022, les autorités maliennes ont alerté à deux reprises la communauté internationale sur les actes hostiles de la France.""Ces faits, pour le moins, interrogent sur l’objectivité et l’impartialité de la République française"", note le gouvernement malien.","[[['La France ne peut plus rédiger les résolutions et déclarations concernant le Mali au sein du Conseil de sécurité de l’Onu, a déclaré le gouvernement malien dans une lettre adressée le 1er mars à Pedro Comissario Afonso, président en exercice du Conseil de sécurité et ambassadeur du Mozambique auprès de l’Onu.'], ['""En attendant la réunion spéciale du Conseil de sécurité sollicitée par le Mali, le gouvernement de la république du Mali récuse officiellement le statut de porte-plume de la France sur toutes questions examinées par le Conseil de sécurité concernant le Mali"", a indiqué le cabinet des ministres.'], ['La déconstruction coloniale continue: “Le Gouvernement de la République du Mali, par la présente correspondance, récuse officiellement le statut de porte-plume de la France sur toutes questions examinées par le Conseil de sécurité concernant le Mali.“ Merci @AbdoulayeDiop8 🙏🏽🙏🏽✊🏽 pic.twitter.com/fHzyS6E8el— Nathalie Yamb (@Nath_Yamb) March 2, 2023 La France a porté la plume sur tous les sujets concernant le Mali au Conseil de sécurité depuis décembre 2012, lorsque la situation dans ce pays était inscrite à l’agenda du Conseil.En août 2022, le Mali a porté plainte auprès du Conseil de sécurité pour actes d’agression, de subversion, de déstabilisation et de violation de l’espace aérien malien par des aéronefs des forces armées françaises.'], ['Début 2022, les autorités maliennes ont alerté à deux reprises la communauté internationale sur les actes hostiles de la France.'], ['""Ces faits, pour le moins, interrogent sur l’objectivité et l’impartialité de la République française"", note le gouvernement malien.']]]","[[['france', 'résolutions', 'déclarations', 'mali', 'sein', 'conseil', 'sécurité', 'onu', 'gouvernement', 'malien', 'lettre', 'mars', 'pedro', 'comissario', 'afonso', 'président', 'exercice', 'conseil', 'sécurité', 'ambassadeur', 'mozambique', 'onu'], ['réunion', 'spéciale', 'conseil', 'sécurité', 'mali', 'gouvernement', 'république', 'mali', 'statut', 'france', 'questions', 'conseil', 'sécurité', 'mali', 'cabinet', 'ministres'], ['déconstruction', 'coloniale', 'gouvernement', 'république', 'mali', 'présente', 'correspondance', 'statut', 'france', 'questions', 'conseil', 'sécurité', 'mali', 'nathalie', 'yamb', 'march', 'france', 'plume', 'sujets', 'mali', 'conseil', 'sécurité', 'décembre', 'situation', 'pays', 'agenda', 'août', 'mali', 'plainte', 'conseil', 'sécurité', 'actes', 'agression', 'subversion', 'déstabilisation', 'violation', 'espace', 'aérien', 'malien', 'aéronefs', 'forces', 'armées', 'françaises'], ['début', 'autorités', 'maliennes', 'reprises', 'communauté', 'internationale', 'actes', 'hostiles', 'france'], ['faits', 'objectivité', 'impartialité', 'république', 'française', 'note', 'gouvernement', 'malien']]]","[[['France', 'Mali', 'Mozambique'], ['Mali', 'république du Mali', 'France', 'Mali'], ['France', 'Mali', 'France', 'Mali', 'Mali'], ['France'], ['République française']]]","[[['Conseil de sécurité de l’Onu', 'Conseil de sécurité', 'Onu'], ['Conseil de sécurité', 'Conseil de sécurité'], ['Conseil de sécurité', 'Conseil de sécurité', 'Conseil', 'Conseil de sécurité'], [], []]]","[[['Pedro Comissario Afonso'], [], ['Nathalie Yamb'], [], []]]","{'france': 5, 'résolutions': 1, 'déclarations': 1, 'mali': 8, 'sein': 1, 'conseil': 7, 'sécurité': 7, 'onu': 2, 'gouvernement': 4, 'malien': 3, 'lettre': 1, 'mars': 1, 'pedro': 1, 'comissario': 1, 'afonso': 1, 'président': 1, 'exercice': 1, 'ambassadeur': 1, 'mozambique': 1, 'réunion': 1, 'spéciale': 1, 'république': 3, 'statut': 2, 'questions': 2, 'cabinet': 1, 'ministres': 1, 'déconstruction': 1, 'coloniale': 1, 'présente': 1, 'correspondance': 1, 'nathalie': 1, 'yamb': 1, 'march': 1, 'plume': 1, 'sujets': 1, 'décembre': 1, 'situation': 1, 'pays': 1, 'agenda': 1, 'août': 1, 'plainte': 1, 'actes': 2, 'agression': 1, 'subversion': 1, 'déstabilisation': 1, 'violation': 1, 'espace': 1, 'aérien': 1, 'aéronefs': 1, 'forces': 1, 'armées': 1, 'françaises': 1, 'début': 1, 'autorités': 1, 'maliennes': 1, 'reprises': 1, 'communauté': 1, 'internationale': 1, 'hostiles': 1, 'faits': 1, 'objectivité': 1, 'impartialité': 1, 'française': 1, 'note': 1}","{'France': 5, 'Mali': 6, 'Mozambique': 1, 'république du Mali': 1, 'République française': 1}","{'Conseil de sécurité de l’Onu': 1, 'Conseil de sécurité': 6, 'Onu': 1, 'Conseil': 1}","{'Pedro Comissario Afonso': 1, 'Nathalie Yamb': 1}",2023,3,1
1677711600,https://fr.sputniknews.africa/20230302/nord-stream-la-russie-ne-permettra-pas-de-cacher-la-poussiere-sous-le-tapis-dit-lavrov-a-sputnik-1058079680.html,"Nord Stream: la Russie ne permettra pas de ""cacher la poussière sous le tapis"", dit Lavrov à Sputnik","En répondant à une question d’un correspondant de Sputnik, Sergueï Lavrov a affirmé que Moscou insisterait sur l’enquête concernant les sabotages des gazoducs Nord Stream.","La Russie continuera à demander une enquête sur les explosions survenues sur les Nord Stream et ne permettra pas de ""cacher la poussière sous le tapis"" sur cette situation. C'est ce qu'a déclaré le chef de la diplomatie russe ce 2 mars à un correspondant de Sputnik lors d'une conférence de presse à l'issue de la réunion du sommet des ministres des Affaires étrangères du G20 à New Delhi.""Mais vous vous souvenez de la réaction de l'Occident aux révélations publiées par Seymour Hersh - une réaction nerveuse et, immédiatement après la publication des révélations, des expressions telles que 'c'est absurde' et 'nous ne discuterons même pas de cela'. Je pense que tout est compréhensible ici, mais nous allons parvenir à cette enquête, nous ne permettrons pas de cacher la poussière sous le tapis, comme l'Occident l'a fait à maintes reprises auparavant"", a noté le ministre russe.Sergueï Lavrov a aussi souligné que la Chine, ainsi que la Russie, avaient cherché au cours de la rencontre du Groupe à inclure un paragraphe sur les pipelines dans la déclaration finale, sans que celle-ci ne soit approuvée.Selon lui, ""la majorité des nations en développement du G20 ont exprimé leur compréhension"" envers l’initiative russe.La ""nature provocatrice"" des actions de l’OccidentM.Lavrov a comparé le manque de coopération des États-Unis et de leurs alliés sur le sabotage des Nord Stream aux allégations occidentales concernant l'""empoisonnement"" du blogueur d'opposition Alexeï Navalny. Il a ainsi rappelé que l'Allemagne ""refuse toujours de nous envoyer les résultats des tests médicaux"".Le ministre russe a rappelé aussi le présumé incident sous faux drapeau de Boutcha, lorsque les forces russes ont été accusées de crimes de guerre contre des civils ukrainiens quelques jours seulement après que Moscou et Kiev avaient atteint les grandes lignes d'un projet d'accord de paix. La Russie ""n'a reçu aucune réponse"" à ses ""nombreuses demandes d'informations sur cet incident"", notamment les listes des personnes tuées.""L'Occident ne veut pas réagir aux questions qui montrent la nature provocatrice de leurs actions"", a-t-il noté.Des révélations particulièresLes Nord Stream ont été la cible d’un sabotage le 26 septembre. Une des conduites du Nord Stream 2 et les deux du Nord Stream 1 ont été endommagées. Une fuite massive de gaz a été constatée. Vladimir Poutine a fustigé un ""acte de terrorisme international"".Début février, Seymour Hersh a livré des révélations détonantes sur les explosions, accusant des plongeurs américains d’avoir posé des explosifs sur les pipelines, avec l’aide de la Norvège.Son enquête a été corroborée par le travail d’un autre journaliste américain, John Dougan, qui a affirmé avoir reçu une lettre d’un participant aux exercices BALTOPS 22 de l’Otan, en marge desquels les explosifs auraient été posés.Ces révélations ont relancé les débats sur la nécessité d’une enquête internationale. Pékin a encore récemment déploré le silence et la passivité des Occidentaux sur le sujet, incitant l’Onu à lancer des investigations.","[[['La Russie continuera à demander une enquête sur les explosions survenues sur les Nord Stream et ne permettra pas de ""cacher la poussière sous le tapis"" sur cette situation.'], [""C'est ce qu'a déclaré le chef de la diplomatie russe ce 2 mars à un correspondant de Sputnik lors d'une conférence de presse à l'issue de la réunion du sommet des ministres des Affaires étrangères du G20 à New Delhi.""], ['""Mais vous vous souvenez de la réaction de l\'Occident aux révélations publiées par Seymour Hersh - une réaction nerveuse et, immédiatement après la publication des révélations, des expressions telles que \'c\'est absurde\' et \'nous ne discuterons même pas de cela\'.'], ['Je pense que tout est compréhensible ici, mais nous allons parvenir à cette enquête, nous ne permettrons pas de cacher la poussière sous le tapis, comme l\'Occident l\'a fait à maintes reprises auparavant"", a noté le ministre russe.Sergueï Lavrov a aussi souligné que la Chine, ainsi que la Russie, avaient cherché au cours de la rencontre du Groupe à inclure un paragraphe sur les pipelines dans la déclaration finale, sans que celle-ci ne soit approuvée.Selon lui, ""la majorité des nations en développement du G20 ont exprimé leur compréhension"" envers l’initiative russe.La ""nature provocatrice"" des actions de l’OccidentM.Lavrov a comparé le manque de coopération des États-Unis et de leurs alliés sur le sabotage des Nord Stream aux allégations occidentales concernant l\'""empoisonnement"" du blogueur d\'opposition Alexeï Navalny.'], ['Il a ainsi rappelé que l\'Allemagne ""refuse toujours de nous envoyer les résultats des tests médicaux"".Le ministre russe a rappelé aussi le présumé incident sous faux drapeau de Boutcha, lorsque les forces russes ont été accusées de crimes de guerre contre des civils ukrainiens quelques jours seulement après que Moscou et Kiev avaient atteint les grandes lignes d\'un projet d\'accord de paix.'], ['La Russie ""n\'a reçu aucune réponse"" à ses ""nombreuses demandes d\'informations sur cet incident"", notamment les listes des personnes tuées.'], ['""L\'Occident ne veut pas réagir aux questions qui montrent la nature provocatrice de leurs actions"", a-t-il noté.Des révélations particulièresLes Nord Stream ont été la cible d’un sabotage le 26 septembre.'], ['Une des conduites du Nord Stream 2 et les deux du Nord Stream 1 ont été endommagées.'], ['Une fuite massive de gaz a été constatée.'], ['Vladimir Poutine a fustigé un ""acte de terrorisme international"".Début février, Seymour Hersh a livré des révélations détonantes sur les explosions, accusant des plongeurs américains d’avoir posé des explosifs sur les pipelines, avec l’aide de la Norvège.Son enquête a été corroborée par le travail d’un autre journaliste américain, John Dougan, qui a affirmé avoir reçu une lettre d’un participant aux exercices BALTOPS 22 de l’Otan, en marge desquels les explosifs auraient été posés.Ces révélations ont relancé les débats sur la nécessité d’une enquête internationale.'], ['Pékin a encore récemment déploré le silence et la passivité des Occidentaux sur le sujet, incitant l’Onu à lancer des investigations.']]]","[[['russie', 'enquête', 'explosions', 'nord', 'stream', 'poussière', 'tapis', 'situation'], ['chef', 'diplomatie', 'russe', 'mars', 'correspondant', 'sputnik', 'conférence', 'presse', 'issue', 'réunion', 'sommet', 'ministres', 'affaires', 'étrangères', 'new', 'delhi'], ['réaction', 'occident', 'révélations', 'seymour', 'hersh', 'réaction', 'nerveuse', 'publication', 'révélations', 'expressions'], ['compréhensible', 'enquête', 'poussière', 'tapis', 'occident', 'maintes', 'reprises', 'ministre', 'lavrov', 'chine', 'russie', 'cours', 'rencontre', 'groupe', 'paragraphe', 'pipelines', 'déclaration', 'finale', 'majorité', 'nations', 'développement', 'compréhension', 'initiative', 'nature', 'provocatrice', 'actions', 'manque', 'coopération', 'alliés', 'sabotage', 'nord', 'stream', 'allégations', 'occidentales', 'blogueur', 'opposition', 'alexeï'], ['allemagne', 'résultats', 'tests', 'ministre', 'russe', 'présumé', 'incident', 'faux', 'drapeau', 'boutcha', 'forces', 'russes', 'crimes', 'guerre', 'civils', 'ukrainiens', 'jours', 'moscou', 'kiev', 'grandes', 'lignes', 'projet', 'accord', 'paix'], ['russie', 'réponse', 'demandes', 'informations', 'incident', 'listes', 'personnes'], ['occident', 'questions', 'nature', 'provocatrice', 'actions', 'révélations', 'particulièresles', 'nord', 'stream', 'cible', 'sabotage', 'septembre'], ['conduites', 'nord', 'stream', 'nord'], ['fuite', 'massive', 'gaz'], ['vladimir', 'poutine', 'acte', 'terrorisme', 'février', 'seymour', 'hersh', 'révélations', 'détonantes', 'explosions', 'plongeurs', 'américains', 'explosifs', 'pipelines', 'aide', 'enquête', 'travail', 'journaliste', 'américain', 'john', 'dougan', 'lettre', 'participant', 'exercices', 'otan', 'marge', 'explosifs', 'révélations', 'débats', 'nécessité', 'enquête', 'internationale'], ['pékin', 'silence', 'passivité', 'occidentaux', 'sujet', 'onu', 'investigations']]]","[[['Russie', 'Nord'], ['New Delhi'], ['Occident'], ['Occident', 'Chine', 'Russie', 'États-Unis', 'Nord'], ['Allemagne', 'Boutcha', 'Moscou', 'Kiev'], ['Russie'], ['Occident'], ['Nord'], [], ['Norvège'], ['Pékin']]]","[[[], ['Sputnik', 'Affaires étrangères', 'G20'], [], ['Groupe', 'G20', 'OccidentM.Lavrov'], [], [], ['particulièresLes'], [], [], ['Otan'], ['Onu']]]","[[[], [], ['Seymour Hersh'], ['Sergueï Lavrov', 'Alexeï Navalny'], [], [], [], [], [], ['Vladimir Poutine', 'Seymour Hersh', 'John Dougan'], []]]","{'russie': 3, 'enquête': 4, 'explosions': 2, 'nord': 5, 'stream': 4, 'poussière': 2, 'tapis': 2, 'situation': 1, 'chef': 1, 'diplomatie': 1, 'russe': 2, 'mars': 1, 'correspondant': 1, 'sputnik': 1, 'conférence': 1, 'presse': 1, 'issue': 1, 'réunion': 1, 'sommet': 1, 'ministres': 1, 'affaires': 1, 'étrangères': 1, 'new': 1, 'delhi': 1, 'réaction': 2, 'occident': 3, 'révélations': 5, 'seymour': 2, 'hersh': 2, 'nerveuse': 1, 'publication': 1, 'expressions': 1, 'compréhensible': 1, 'maintes': 1, 'reprises': 1, 'ministre': 2, 'lavrov': 1, 'chine': 1, 'cours': 1, 'rencontre': 1, 'groupe': 1, 'paragraphe': 1, 'pipelines': 2, 'déclaration': 1, 'finale': 1, 'majorité': 1, 'nations': 1, 'développement': 1, 'compréhension': 1, 'initiative': 1, 'nature': 2, 'provocatrice': 2, 'actions': 2, 'manque': 1, 'coopération': 1, 'alliés': 1, 'sabotage': 2, 'allégations': 1, 'occidentales': 1, 'blogueur': 1, 'opposition': 1, 'alexeï': 1, 'allemagne': 1, 'résultats': 1, 'tests': 1, 'présumé': 1, 'incident': 2, 'faux': 1, 'drapeau': 1, 'boutcha': 1, 'forces': 1, 'russes': 1, 'crimes': 1, 'guerre': 1, 'civils': 1, 'ukrainiens': 1, 'jours': 1, 'moscou': 1, 'kiev': 1, 'grandes': 1, 'lignes': 1, 'projet': 1, 'accord': 1, 'paix': 1, 'réponse': 1, 'demandes': 1, 'informations': 1, 'listes': 1, 'personnes': 1, 'questions': 1, 'particulièresles': 1, 'cible': 1, 'septembre': 1, 'conduites': 1, 'fuite': 1, 'massive': 1, 'gaz': 1, 'vladimir': 1, 'poutine': 1, 'acte': 1, 'terrorisme': 1, 'février': 1, 'détonantes': 1, 'plongeurs': 1, 'américains': 1, 'explosifs': 2, 'aide': 1, 'travail': 1, 'journaliste': 1, 'américain': 1, 'john': 1, 'dougan': 1, 'lettre': 1, 'participant': 1, 'exercices': 1, 'otan': 1, 'marge': 1, 'débats': 1, 'nécessité': 1, 'internationale': 1, 'pékin': 1, 'silence': 1, 'passivité': 1, 'occidentaux': 1, 'sujet': 1, 'onu': 1, 'investigations': 1}","{'Russie': 3, 'Nord': 3, 'New Delhi': 1, 'Occident': 3, 'Chine': 1, 'États-Unis': 1, 'Allemagne': 1, 'Boutcha': 1, 'Moscou': 1, 'Kiev': 1, 'Norvège': 1, 'Pékin': 1}","{'Sputnik': 1, 'Affaires étrangères': 1, 'G20': 2, 'Groupe': 1, 'OccidentM.Lavrov': 1, 'particulièresLes': 1, 'Otan': 1, 'Onu': 1}","{'Seymour Hersh': 2, 'Sergueï Lavrov': 1, 'Alexeï Navalny': 1, 'Vladimir Poutine': 1, 'John Dougan': 1}",2023,3,1
