timestamp,url,title,description,content,content-segmented,kws-l,loc-l,org-l,per-l,kws,loc,org,per,year,month,day
1676156400,https://fr.sputniknews.africa/20230212/ukraine-dans-lotan-bruxelles-a-franchi-la-ligne-rouge-admet-un-ancien-commissaire-europeen-1057902754.html,"Ukraine dans l’Otan: Bruxelles a franchi la ligne rouge, admet un ancien commissaire européen","Bruxelles a dépassé les bornes en poussant l’Ukraine à entrer dans l’Otan en 2008, a déclaré à Sputnik l’ancien commissaire européen Günter Verheugen. L’UE n’a jamais tenu compte de la Russie dans ses propositions.","Les langues se délient peu à peu à propos des errements qui ont pu conduire à l’escalade en Ukraine. Après les aveux de plusieurs dirigeants au sujet des accords de Minsk, c’est désormais l’ex-commissaire européen Günter Verheugen qui pointe du doigt l’attitude de Bruxelles et de l’Otan vis-à-vis de Kiev.Dans un entretien au Berliner Zeitung, l’ancien responsable a ainsi critiqué les résultats du sommet de Bucarest de 2008, qui proposait à l’Ukraine un plan d’action pour intégrer l’Otan. L’Alliance atlantique a ainsi balayé d’un revers de main les considérations de sécurité russe.""Je suis convaincu qu'en 2008, la proposition faite à l'Ukraine de devenir membre de l'Otan a délibérément franchi la ligne. C'était inacceptable pour la Russie en raison de ses intérêts de sécurité"", a déclaré Günter Verheugen.Bruxelles a par ailleurs joué un jeu trouble, en promettant à Kiev une adhésion à l’UE, sans en avertir Moscou, a ajouté l’ex-commissaire. Une erreur au vu de la proximité entre la Russie et l’Ukraine.""Les Russes et les Ukrainiens ont de nombreux liens culturels, économiques et sociaux. Nous n'avons pas donné à la Russie son mot à dire dans l'élargissement de l'UE à l'Est"", a ainsi regretté celui qui fut aussi vice-président de la Commission européenne.Washington avait le plus à perdreGünter Verheugen a encore regretté l’attitude de Washington, qui cherche selon lui à tout prix à affaiblir la Russie depuis les années 1990. Les États-Unis ont notamment profité de la présidence de Boris Eltsine pour exploiter le pays, rappelle le responsable. Par ailleurs, Washington avait tout à perdre à voir la Russie et l’Allemagne ""adopter un langage commun"", souligne-t-il.Finalement, l’ex-commissaire regrette le rendez-vous raté entre la Russie et l’Europe. Selon lui, Bruxelles n’aurait jamais dû proposer à Kiev un simple choix entre l’UE et l’Union eurasienne. Avec plus de liberté, l’Ukraine aurait sans doute pu jouer un rôle pivot dans la création d’un grand espace économique, s’étendant de Lisbonne à Vladivostok. Une idée que Vladimir Poutine avait d’ailleurs soulevé en 2010, dans une tribune au Süddeutsche Zeitung.Début février s’était encore tenu un sommet UE-Ukraine, visant à planifier l’adhésion de Kiev aux Vingt-Sept, à court terme. Le processus pourrait aboutir ""dans les deux ans"", à en croire le Premier ministre ukrainien, Denys Shmyhal. Certains observateurs sont cependant plus sceptiques, en particulier au sujet de la corruption qui règne dans le pays, loin des standards européens prévus dans ce domaine.","[[['Les langues se délient peu à peu à propos des errements qui ont pu conduire à l’escalade en Ukraine.'], ['Après les aveux de plusieurs dirigeants au sujet des accords de Minsk, c’est désormais l’ex-commissaire européen Günter Verheugen qui pointe du doigt l’attitude de Bruxelles et de l’Otan vis-à-vis de Kiev.Dans un entretien au Berliner Zeitung, l’ancien responsable a ainsi critiqué les résultats du sommet de Bucarest de 2008, qui proposait à l’Ukraine un plan d’action pour intégrer l’Otan.'], ['L’Alliance atlantique a ainsi balayé d’un revers de main les considérations de sécurité russe.'], ['""Je suis convaincu qu\'en 2008, la proposition faite à l\'Ukraine de devenir membre de l\'Otan a délibérément franchi la ligne.'], ['C\'était inacceptable pour la Russie en raison de ses intérêts de sécurité"", a déclaré Günter Verheugen.Bruxelles a par ailleurs joué un jeu trouble, en promettant à Kiev une adhésion à l’UE, sans en avertir Moscou, a ajouté l’ex-commissaire.'], ['Une erreur au vu de la proximité entre la Russie et l’Ukraine.'], ['""Les Russes et les Ukrainiens ont de nombreux liens culturels, économiques et sociaux.'], ['Nous n\'avons pas donné à la Russie son mot à dire dans l\'élargissement de l\'UE à l\'Est"", a ainsi regretté celui qui fut aussi vice-président de la Commission européenne.Washington avait le plus à perdreGünter Verheugen a encore regretté l’attitude de Washington, qui cherche selon lui à tout prix à affaiblir la Russie depuis les années 1990.'], ['Les États-Unis ont notamment profité de la présidence de Boris Eltsine pour exploiter le pays, rappelle le responsable.'], ['Par ailleurs, Washington avait tout à perdre à voir la Russie et l’Allemagne ""adopter un langage commun"", souligne-t-il.Finalement, l’ex-commissaire regrette le rendez-vous raté entre la Russie et l’Europe.'], ['Selon lui, Bruxelles n’aurait jamais dû proposer à Kiev un simple choix entre l’UE et l’Union eurasienne.'], ['Avec plus de liberté, l’Ukraine aurait sans doute pu jouer un rôle pivot dans la création d’un grand espace économique, s’étendant de Lisbonne à Vladivostok.'], ['Une idée que Vladimir Poutine avait d’ailleurs soulevé en 2010, dans une tribune au Süddeutsche Zeitung.Début février s’était encore tenu un sommet UE-Ukraine, visant à planifier l’adhésion de Kiev aux Vingt-Sept, à court terme.'], ['Le processus pourrait aboutir ""dans les deux ans"", à en croire le Premier ministre ukrainien, Denys Shmyhal.'], ['Certains observateurs sont cependant plus sceptiques, en particulier au sujet de la corruption qui règne dans le pays, loin des standards européens prévus dans ce domaine.']]]","[[['langues', 'propos', 'errements', 'escalade', 'ukraine'], ['aveux', 'dirigeants', 'sujet', 'accords', 'minsk', 'européen', 'verheugen', 'pointe', 'doigt', 'attitude', 'bruxelles', 'otan', 'entretien', 'berliner', 'zeitung', 'ancien', 'responsable', 'résultats', 'sommet', 'bucarest', 'ukraine', 'plan', 'action', 'otan'], ['alliance', 'atlantique', 'revers', 'main', 'considérations', 'sécurité', 'russe'], ['proposition', 'ukraine', 'membre', 'otan', 'ligne'], ['inacceptable', 'russie', 'raison', 'intérêts', 'sécurité', 'günter', 'jeu', 'trouble', 'adhésion', 'ue', 'moscou'], ['erreur', 'proximité', 'russie', 'ukraine'], ['russes', 'ukrainiens', 'liens', 'culturels', 'économiques', 'sociaux'], ['russie', 'mot', 'élargissement', 'ue', 'commission', 'perdregünter', 'attitude', 'washington', 'prix', 'russie', 'années'], ['présidence', 'boris', 'eltsine', 'pays', 'responsable'], ['washington', 'russie', 'allemagne', 'langage', 'commun', 'russie', 'europe'], ['bruxelles', 'kiev', 'simple', 'choix', 'ue', 'union', 'eurasienne'], ['liberté', 'ukraine', 'doute', 'rôle', 'pivot', 'création', 'grand', 'espace', 'économique', 'lisbonne', 'vladivostok'], ['idée', 'vladimir', 'poutine', 'tribune', 'süddeutsche', 'février', 'sommet', 'ue', 'ukraine', 'adhésion', 'kiev', 'court', 'terme'], ['processus', 'ans', 'ministre', 'ukrainien', 'shmyhal'], ['observateurs', 'sceptiques', 'particulier', 'sujet', 'corruption', 'pays', 'standards', 'européens', 'domaine']]]","[[['Ukraine'], ['Minsk', 'Bruxelles', 'Kiev', 'Bucarest', 'Ukraine'], [], ['Ukraine'], ['Russie', 'Bruxelles', 'Kiev', 'Moscou'], ['Russie', 'Ukraine'], ['Russie', 'Ukraine'], ['Russie', 'Russie'], ['États-Unis'], ['Russie', 'Allemagne', 'Russie', 'Europe'], ['Bruxelles', 'Kiev'], ['Ukraine', 'Lisbonne', 'Vladivostok'], ['UE-Ukraine', 'Kiev'], [], []]]","[[[], ['Otan', 'Berliner Zeitung', 'Otan'], ['Alliance atlantique'], ['Otan'], ['UE'], [], [], ['UE', 'Commission européenne'], [], [], ['UE', 'Union eurasienne'], [], ['Süddeutsche Zeitung', 'Vingt-Sept'], [], []]]","[[[], ['Günter Verheugen'], [], [], ['Günter Verheugen'], [], [], ['Washington', 'Verheugen', 'Washington'], ['Boris Eltsine'], ['Washington'], [], [], ['Vladimir Poutine'], ['Denys Shmyhal'], []]]","{'langues': 1, 'propos': 1, 'errements': 1, 'escalade': 1, 'ukraine': 6, 'aveux': 1, 'dirigeants': 1, 'sujet': 2, 'accords': 1, 'minsk': 1, 'européen': 1, 'verheugen': 1, 'pointe': 1, 'doigt': 1, 'attitude': 2, 'bruxelles': 2, 'otan': 3, 'entretien': 1, 'berliner': 1, 'zeitung': 1, 'ancien': 1, 'responsable': 2, 'résultats': 1, 'sommet': 2, 'bucarest': 1, 'plan': 1, 'action': 1, 'alliance': 1, 'atlantique': 1, 'revers': 1, 'main': 1, 'considérations': 1, 'sécurité': 2, 'russe': 1, 'proposition': 1, 'membre': 1, 'ligne': 1, 'inacceptable': 1, 'russie': 6, 'raison': 1, 'intérêts': 1, 'günter': 1, 'jeu': 1, 'trouble': 1, 'adhésion': 2, 'ue': 4, 'moscou': 1, 'erreur': 1, 'proximité': 1, 'russes': 1, 'ukrainiens': 1, 'liens': 1, 'culturels': 1, 'économiques': 1, 'sociaux': 1, 'mot': 1, 'élargissement': 1, 'commission': 1, 'perdregünter': 1, 'washington': 2, 'prix': 1, 'années': 1, 'présidence': 1, 'boris': 1, 'eltsine': 1, 'pays': 2, 'allemagne': 1, 'langage': 1, 'commun': 1, 'europe': 1, 'kiev': 2, 'simple': 1, 'choix': 1, 'union': 1, 'eurasienne': 1, 'liberté': 1, 'doute': 1, 'rôle': 1, 'pivot': 1, 'création': 1, 'grand': 1, 'espace': 1, 'économique': 1, 'lisbonne': 1, 'vladivostok': 1, 'idée': 1, 'vladimir': 1, 'poutine': 1, 'tribune': 1, 'süddeutsche': 1, 'février': 1, 'court': 1, 'terme': 1, 'processus': 1, 'ans': 1, 'ministre': 1, 'ukrainien': 1, 'shmyhal': 1, 'observateurs': 1, 'sceptiques': 1, 'particulier': 1, 'corruption': 1, 'standards': 1, 'européens': 1, 'domaine': 1}","{'Ukraine': 6, 'Minsk': 1, 'Bruxelles': 3, 'Kiev': 4, 'Bucarest': 1, 'Russie': 7, 'Moscou': 1, 'États-Unis': 1, 'Allemagne': 1, 'Europe': 1, 'Lisbonne': 1, 'Vladivostok': 1, 'UE-Ukraine': 1}","{'Otan': 3, 'Berliner Zeitung': 1, 'Alliance atlantique': 1, 'UE': 3, 'Commission européenne': 1, 'Union eurasienne': 1, 'Süddeutsche Zeitung': 1, 'Vingt-Sept': 1}","{'Günter Verheugen': 2, 'Washington': 3, 'Verheugen': 1, 'Boris Eltsine': 1, 'Vladimir Poutine': 1, 'Denys Shmyhal': 1}",2023,2,11
1676156400,https://fr.sputniknews.africa/20230212/des-francais-manifestent-contre-les-livraisons-darmes-a-lukraine---video-1057902644.html,Des Français manifestent contre les livraisons d'armes à l'Ukraine - vidéo,Des Français ont manifesté ce dimanche 12 février à l'appel du président des Patriotes Florian Philippot pour la sortie de leur pays de l'Otan et contre les livraisons d'armes à l'Ukraine.,"""Macron ta guerre on n’en veut pas!"": une marche en faveur de la sortie de la France de l'Alliance atlantique s'est déroulée à Paris à l'initiative du président des Patriotes Florian Philippot qui assure que ""des milliers et milliers"" de personnes y ont pris part.Les manifestants réclamaient également la fin des livraisons d'armes occidentales aux autorités ukrainiennes. Sur son Twitter, M.Philippot a qualifié cette ""première marche nationale pour la paix"" de ""très très gros succès"".Auparavant, dans un entretien accordé à Sputnik, l'ancien député européen a accusé les États-Unis de pousser les pays européens en première ligne sur le dossier ukrainien, leur faisant prendre sciemment tous les risques.Armes françaises pour KievDepuis le début de l'opération militaire spéciale russe en Ukraine, la France a notamment livré à Kiev 18 canons Caesar de 155 mm et s'est engagée fin janvier à en fournir 12 unités supplémentaires.Paris a également promis de livrer à l'Ukraine un radar Ground Master 200 (GM200) produit par le français Thales. De moyenne portée, il permet de détecter les aéronefs à 250 km et de les engager à 100 kilomètres.La France a par ailleurs ""engagé des discussions"" avec ses alliés afin d'avoir un stock toujours suffisant de missiles français sol-air français Crotale pour l'Ukraine, a annoncé le ministre français des Armées Sébastien Lecornu.","[[['""Macron ta guerre on n’en veut pas!'], ['"": une marche en faveur de la sortie de la France de l\'Alliance atlantique s\'est déroulée à Paris à l\'initiative du président des Patriotes Florian Philippot qui assure que ""des milliers et milliers"" de personnes y ont pris part.Les manifestants réclamaient également la fin des livraisons d\'armes occidentales aux autorités ukrainiennes.'], ['Sur son Twitter, M.Philippot a qualifié cette ""première marche nationale pour la paix"" de ""très très gros succès"".Auparavant, dans un entretien accordé à Sputnik, l\'ancien député européen a accusé les États-Unis de pousser les pays européens en première ligne sur le dossier ukrainien, leur faisant prendre sciemment tous les risques.Armes françaises pour KievDepuis le début de l\'opération militaire spéciale russe en Ukraine, la France a notamment livré à Kiev 18 canons Caesar de 155 mm et s\'est engagée fin janvier à en fournir 12 unités supplémentaires.Paris a également promis de livrer à l\'Ukraine un radar Ground Master 200 (GM200) produit par le français Thales.'], ['De moyenne portée, il permet de détecter les aéronefs à 250 km et de les engager à 100 kilomètres.La France a par ailleurs ""engagé des discussions"" avec ses alliés afin d\'avoir un stock toujours suffisant de missiles français sol-air français Crotale pour l\'Ukraine, a annoncé le ministre français des Armées Sébastien Lecornu.']]]","[[['guerre'], ['marche', 'faveur', 'sortie', 'france', 'alliance', 'atlantique', 'paris', 'initiative', 'président', 'patriotes', 'florian', 'philippot', 'milliers', 'milliers', 'personnes', 'manifestants', 'fin', 'livraisons', 'armes', 'occidentales', 'autorités', 'ukrainiennes'], ['twitter', 'marche', 'nationale', 'paix', 'gros', 'entretien', 'sputnik', 'ancien', 'député', 'européen', 'pays', 'européens', 'ligne', 'dossier', 'ukrainien', 'françaises', 'kievdepuis', 'début', 'opération', 'militaire', 'spéciale', 'russe', 'ukraine', 'france', 'canons', 'mm', 'janvier', 'unités', 'ukraine', 'radar', 'ground', 'master', 'français', 'thales'], ['moyenne', 'aéronefs', 'km', 'france', 'discussions', 'alliés', 'stock', 'missiles', 'français', 'sol', 'air', 'français', 'crotale', 'ukraine', 'ministre', 'français', 'armées', 'sébastien', 'lecornu']]]","[[[], ['France', 'Paris'], ['États-Unis', 'Ukraine', 'France', 'Kiev', 'Paris', 'Ukraine'], ['France']]]","[[[], ['Alliance atlantique', 'Patriotes'], ['M.Philippot', 'Sputnik', 'Thales'], [""Crotale pour l'Ukraine"", 'Armées Sébastien Lecornu']]]","[[[], ['Florian Philippot'], ['Caesar'], []]]","{'guerre': 1, 'marche': 2, 'faveur': 1, 'sortie': 1, 'france': 3, 'alliance': 1, 'atlantique': 1, 'paris': 1, 'initiative': 1, 'président': 1, 'patriotes': 1, 'florian': 1, 'philippot': 1, 'milliers': 2, 'personnes': 1, 'manifestants': 1, 'fin': 1, 'livraisons': 1, 'armes': 1, 'occidentales': 1, 'autorités': 1, 'ukrainiennes': 1, 'twitter': 1, 'nationale': 1, 'paix': 1, 'gros': 1, 'entretien': 1, 'sputnik': 1, 'ancien': 1, 'député': 1, 'européen': 1, 'pays': 1, 'européens': 1, 'ligne': 1, 'dossier': 1, 'ukrainien': 1, 'françaises': 1, 'kievdepuis': 1, 'début': 1, 'opération': 1, 'militaire': 1, 'spéciale': 1, 'russe': 1, 'ukraine': 3, 'canons': 1, 'mm': 1, 'janvier': 1, 'unités': 1, 'radar': 1, 'ground': 1, 'master': 1, 'français': 4, 'thales': 1, 'moyenne': 1, 'aéronefs': 1, 'km': 1, 'discussions': 1, 'alliés': 1, 'stock': 1, 'missiles': 1, 'sol': 1, 'air': 1, 'crotale': 1, 'ministre': 1, 'armées': 1, 'sébastien': 1, 'lecornu': 1}","{'France': 3, 'Paris': 2, 'États-Unis': 1, 'Ukraine': 2, 'Kiev': 1}","{'Alliance atlantique': 1, 'Patriotes': 1, 'M.Philippot': 1, 'Sputnik': 1, 'Thales': 1, ""Crotale pour l'Ukraine"": 1, 'Armées Sébastien Lecornu': 1}","{'Florian Philippot': 1, 'Caesar': 1}",2023,2,11
