timestamp,url,title,description,content,content-segmented,kws-l,loc-l,org-l,per-l,kws,loc,org,per,year,month,day
1676242800,https://fr.sputniknews.africa/20230213/ce-que-lukraine-a-perdu-en-24h-bilan-quotidien-de-la-defense-russe-1057910290.html,Ce que l’Ukraine a perdu en 24h: bilan quotidien de la Défense russe,"L’armée russe a éliminé plus de 320 soldats ukrainiens ces dernières 24 heures, selon le bilan du ministère russe de la Défense. La localité de Krasnaïa Gora, non loin d’Artiomovsk (Bakhmout), est passée sous le contrôle russe.","Dans la direction de Koupiansk, les tirs d’artilleries russes ont notamment éliminé trente soldats ukrainiens, deux véhicules blindés et un obusier D-20. Les localités de Timkovka, Grianikovka et Krakhmalnoïé ont en particulier été le théâtre de combats.Sur l’axe de Krasny Liman, plus de 80 militaires ukrainiens ont été neutralisés, ainsi que trois véhicules blindés de combat et un obusier D-30.Dans la région de Donetsk, l’armée ukrainienne déplore la perte de 150 soldats, six camionnettes et deux obusiers D-30. Des volontaires des détachements d'assaut ont en outre pris la localité de Krasnaïa Gora, point important en vue de l’encerclement de la ville d’Artiomovsk (Bakhmout), toujours détenue par l’armée ukrainienne.Au sud de Donetsk, les forces russes ont éliminé plus de 60 soldats ukrainiens, un obusier D-20, deux obusiers D-30 et trois véhicules blindés de combat. Ces dégâts ont été infligés dans les zones de Pretchistovka et d’Ougledar.Près de Kherson, des combats de contre-batterie ont eu lieu, permettant aux forces russes de détruire deux lance-roquettes multiples Grad, deux canons automoteurs 2S1 Gvozdika. L’aviation et l’artillerie russe ont éliminé 82 soldats ukrainiens dans ce secteur.Un atelier d’entretien de véhicules a en outre été touché près de la ville de Slaviansk. Six roquettes HIMARS ont été interceptées.","[[['Dans la direction de Koupiansk, les tirs d’artilleries russes ont notamment éliminé trente soldats ukrainiens, deux véhicules blindés et un obusier D-20.'], ['Les localités de Timkovka, Grianikovka et Krakhmalnoïé ont en particulier été le théâtre de combats.Sur l’axe de Krasny Liman, plus de 80 militaires ukrainiens ont été neutralisés, ainsi que trois véhicules blindés de combat et un obusier D-30.Dans la région de Donetsk, l’armée ukrainienne déplore la perte de 150 soldats, six camionnettes et deux obusiers D-30.'], [""Des volontaires des détachements d'assaut ont en outre pris la localité de Krasnaïa Gora, point important en vue de l’encerclement de la ville d’Artiomovsk (Bakhmout), toujours détenue par l’armée ukrainienne.Au sud de Donetsk, les forces russes ont éliminé plus de 60 soldats ukrainiens, un obusier D-20, deux obusiers D-30 et trois véhicules blindés de combat.""], ['Ces dégâts ont été infligés dans les zones de Pretchistovka et d’Ougledar.Près de Kherson, des combats de contre-batterie ont eu lieu, permettant aux forces russes de détruire deux lance-roquettes multiples Grad, deux canons automoteurs 2S1 Gvozdika.'], ['L’aviation et l’artillerie russe ont éliminé 82 soldats ukrainiens dans ce secteur.Un atelier d’entretien de véhicules a en outre été touché près de la ville de Slaviansk.'], ['Six roquettes HIMARS ont été interceptées.']]]","[[['direction', 'koupiansk', 'tirs', 'artilleries', 'russes', 'soldats', 'ukrainiens', 'véhicules', 'blindés', 'obusier'], ['localités', 'timkovka', 'grianikovka', 'krakhmalnoïé', 'particulier', 'théâtre', 'axe', 'krasny', 'liman', 'militaires', 'ukrainiens', 'véhicules', 'blindés', 'combat', 'obusier', 'région', 'donetsk', 'armée', 'ukrainienne', 'perte', 'soldats', 'camionnettes', 'obusiers'], ['volontaires', 'détachements', 'assaut', 'localité', 'krasnaïa', 'gora', 'point', 'important', 'vue', 'encerclement', 'ville', 'artiomovsk', 'bakhmout', 'armée', 'sud', 'donetsk', 'forces', 'russes', 'soldats', 'ukrainiens', 'obusier', 'obusiers', 'véhicules', 'blindés', 'combat'], ['dégâts', 'zones', 'pretchistovka', 'kherson', 'combats', 'lieu', 'forces', 'russes', 'roquettes', 'multiples', 'grad', 'canons', 'automoteurs', 'gvozdika'], ['aviation', 'artillerie', 'russe', 'soldats', 'ukrainiens', 'atelier', 'entretien', 'véhicules', 'ville', 'slaviansk'], ['roquettes', 'himars']]]","[[['Koupiansk'], ['Timkovka', 'Krasny Liman', 'Donetsk'], ['Krasnaïa Gora', 'Artiomovsk', 'Bakhmout', 'Donetsk'], ['Pretchistovka', 'Ougledar', 'Kherson'], ['Slaviansk'], []]]","[[[], ['D-30.Dans'], [], ['Gvozdika'], [], []]]","[[[], [], [], [], [], []]]","{'direction': 1, 'koupiansk': 1, 'tirs': 1, 'artilleries': 1, 'russes': 3, 'soldats': 4, 'ukrainiens': 4, 'véhicules': 4, 'blindés': 3, 'obusier': 3, 'localités': 1, 'timkovka': 1, 'grianikovka': 1, 'krakhmalnoïé': 1, 'particulier': 1, 'théâtre': 1, 'axe': 1, 'krasny': 1, 'liman': 1, 'militaires': 1, 'combat': 2, 'région': 1, 'donetsk': 2, 'armée': 2, 'ukrainienne': 1, 'perte': 1, 'camionnettes': 1, 'obusiers': 2, 'volontaires': 1, 'détachements': 1, 'assaut': 1, 'localité': 1, 'krasnaïa': 1, 'gora': 1, 'point': 1, 'important': 1, 'vue': 1, 'encerclement': 1, 'ville': 2, 'artiomovsk': 1, 'bakhmout': 1, 'sud': 1, 'forces': 2, 'dégâts': 1, 'zones': 1, 'pretchistovka': 1, 'kherson': 1, 'combats': 1, 'lieu': 1, 'roquettes': 2, 'multiples': 1, 'grad': 1, 'canons': 1, 'automoteurs': 1, 'gvozdika': 1, 'aviation': 1, 'artillerie': 1, 'russe': 1, 'atelier': 1, 'entretien': 1, 'slaviansk': 1, 'himars': 1}","{'Koupiansk': 1, 'Timkovka': 1, 'Krasny Liman': 1, 'Donetsk': 2, 'Krasnaïa Gora': 1, 'Artiomovsk': 1, 'Bakhmout': 1, 'Pretchistovka': 1, 'Ougledar': 1, 'Kherson': 1, 'Slaviansk': 1}","{'D-30.Dans': 1, 'Gvozdika': 1}",{},2023,2,12
1676242800,https://fr.sputniknews.africa/20230213/roscosmos-devoile-limage-dun-impact-de-meteorite-dans-la-coque-du-vaisseau-soyouz-1057910135.html,Roscosmos dévoile l'image d’un impact de météorite dans la coque du vaisseau Soyouz,L'agence spatiale russe a dévoilé l'image de l'impact détecté en décembre 2022 sur l'enveloppe externe du système de refroidissement du vaisseau Soyouz MS-22.,"Roscosmos a publié sur ses réseaux sociaux la photo de l'impact de météorite détecté sur l'enveloppe externe du système de refroidissement du vaisseau Soyouz MS-22. L'image de l'impact, qui s'était produit en décembre dernier, a été prise par le manipulateur du segment américain de la Station spatiale internationale.L'agence spatiale a annoncé ce lundi 13 février le report du lancement d'un vaisseau censé ramener sur Terre trois spationautes après la découverte d'une nouvelle fuite à bord d'un autre vaisseau, arrimé à l'ISS. Auparavant, Roscosmos avait indiqué dans un communiqué avoir détecté ""une chute de la pression dans le cargo Progress MS-21, qui doit se désamarrer de l'ISS le 18 février"" et en ""étudier les raisons"".Lundi, le chef de Roscosmos, Youri Borissov, a déclaré qu'en raison de cet incident dont l'origine est vérifiée par une ""commission d'urgence"", ""le lancement du vaisseau Soyouz MS-23 sans pilote a été reporté à la première décade de mars au plus tard"".","[[[""Roscosmos a publié sur ses réseaux sociaux la photo de l'impact de météorite détecté sur l'enveloppe externe du système de refroidissement du vaisseau Soyouz MS-22.""], [""L'image de l'impact, qui s'était produit en décembre dernier, a été prise par le manipulateur du segment américain de la Station spatiale internationale.L'agence spatiale a annoncé ce lundi 13 février le report du lancement d'un vaisseau censé ramener sur Terre trois spationautes après la découverte d'une nouvelle fuite à bord d'un autre vaisseau, arrimé à l'ISS.""], ['Auparavant, Roscosmos avait indiqué dans un communiqué avoir détecté ""une chute de la pression dans le cargo Progress MS-21, qui doit se désamarrer de l\'ISS le 18 février"" et en ""étudier les raisons"".Lundi, le chef de Roscosmos, Youri Borissov, a déclaré qu\'en raison de cet incident dont l\'origine est vérifiée par une ""commission d\'urgence"", ""le lancement du vaisseau Soyouz MS-23 sans pilote a été reporté à la première décade de mars au plus tard"".']]]","[[['roscosmos', 'réseaux', 'sociaux', 'photo', 'impact', 'météorite', 'enveloppe', 'externe', 'système', 'refroidissement', 'vaisseau', 'soyouz'], ['image', 'impact', 'décembre', 'dernier', 'manipulateur', 'segment', 'américain', 'station', 'spatiale', 'agence', 'spatiale', 'lundi', 'février', 'report', 'lancement', 'vaisseau', 'censé', 'terre', 'spationautes', 'découverte', 'nouvelle', 'fuite', 'bord', 'vaisseau', 'iss'], ['roscosmos', 'communiqué', 'chute', 'pression', 'cargo', 'progress', 'iss', 'février', 'chef', 'roscosmos', 'youri', 'borissov', 'raison', 'incident', 'origine', 'commission', 'urgence', 'lancement', 'vaisseau', 'soyouz', 'pilote', 'décade', 'mars']]]","[[['Roscosmos'], ['Terre'], ['Roscosmos', 'Roscosmos']]]","[[[], [], []]]","[[[], [], ['Lundi', 'Youri Borissov']]]","{'roscosmos': 3, 'réseaux': 1, 'sociaux': 1, 'photo': 1, 'impact': 2, 'météorite': 1, 'enveloppe': 1, 'externe': 1, 'système': 1, 'refroidissement': 1, 'vaisseau': 4, 'soyouz': 2, 'image': 1, 'décembre': 1, 'dernier': 1, 'manipulateur': 1, 'segment': 1, 'américain': 1, 'station': 1, 'spatiale': 2, 'agence': 1, 'lundi': 1, 'février': 2, 'report': 1, 'lancement': 2, 'censé': 1, 'terre': 1, 'spationautes': 1, 'découverte': 1, 'nouvelle': 1, 'fuite': 1, 'bord': 1, 'iss': 2, 'communiqué': 1, 'chute': 1, 'pression': 1, 'cargo': 1, 'progress': 1, 'chef': 1, 'youri': 1, 'borissov': 1, 'raison': 1, 'incident': 1, 'origine': 1, 'commission': 1, 'urgence': 1, 'pilote': 1, 'décade': 1, 'mars': 1}","{'Roscosmos': 3, 'Terre': 1}",{},"{'Lundi': 1, 'Youri Borissov': 1}",2023,2,12
1676242800,https://fr.sputniknews.africa/20230213/une-fuite-radioactive-detectee-pres-de-lyon-1057909943.html,Une fuite radioactive détectée près de Lyon,"Un élément radioactif a été rejeté dans les eaux souterraines de la centrale nucléaire du Bugey, près de Lyon. Si EDF se veut rassurant, le parc atomique français traîne sa misère depuis plusieurs mois.","Le secteur nucléaire français n’en finit plus d’inquiéter. Alors que plusieurs réacteurs sont encore à l’arrêt pour maintenance, la centrale de Bugey (Ain) a été victime d’une fuite radioactive. Du tritium a en effet été détecté dans les eaux souterraines de la structure, rapporte l’Autorité de sûreté nucléaire (Asn).L’élément a été retrouvé dans des proportions jusqu’à huit fois supérieures au seuil normal. L’incident est dû à un débordement de puisard, estime l’institution dans un communiqué. La fuite ne s’est cependant pas répandue hors du site et n’a contaminé aucune nappe phréatique.""EDF a renforcé le suivi des eaux souterraines et a mené des investigations afin d’identifier l’origine de l’événement. Celui-ci serait dû au débordement, le 10 novembre 2022, de l’un des puisards recueillant les eaux pluviales et des effluents collectés en rétention"", explique ainsi l’Asn.Parc nucléaire à la ramasseLe parc nucléaire français a été mis à rude épreuve ces derniers mois. En novembre, seuls 27 des 56 réacteurs étaient en état de marche, tous les autres étant en maintenance. Des fermetures qui ont eu un impact direct sur la production d’électricité. En octobre 2022, 20,2 térawattheures étaient ainsi sortis des centrales françaises, contre plus de 30 un an plus tôt. Au total, 29 réacteurs nucléaires sur 56 sont à l'arrêt en France, d'après les données de production de la journée d'hier. pic.twitter.com/uqJNYg0QMd— EnergieBot (@energiebot) October 30, 2022 Un sacré handicap au beau milieu de la crise énergétique qui a frappé l’Europe, sevrée de gaz russe. Pour la première fois depuis des décennies, la France a même dû se résoudre à importer de l’électricité. Sur les onze premiers mois de 2022, le pays avait ainsi un solde déficitaire de 14,5 térawattheures avec ses voisins. Une première depuis l’an 2000.Ce fiasco a entraîné la création d’une commission d’enquête sur ""la perte de souveraineté énergétique"" française. Ministres, ingénieurs, représentants syndicaux se sont succédés devant l'Assemblée nationale, pour tenter d’expliquer les dérives de la politique énergétique ces dernières années.Le gouvernement tente depuis lors de redresser la barre. Alors qu’il souhaitait arrêter 14 réacteurs nucléaires en 2018, Emmanuel Macron a désormais retourné sa veste. Le Président français souhaite maintenant construire six nouveaux réacteurs de type EPR2 d’ici 2035, à en croire la feuille de route pour la relance de l'énergie nucléaire dévoilée début février. #CoupuresElectricite c'est lui.Pourquoi ? La réponse est là 👇#Fessenheim c'est lui.#Astrid c'est lui.#Alstom c'est lui.Les 14 réacteurs #nucléaire à fermer c'est lui, la loi est d'ailleurs toujours en vigueur. #Macron pic.twitter.com/8WOMHoZuMW— Dubief Marc (@DubiefMarc) December 3, 2022","[[['Le secteur nucléaire français n’en finit plus d’inquiéter.'], ['Alors que plusieurs réacteurs sont encore à l’arrêt pour maintenance, la centrale de Bugey (Ain) a été victime d’une fuite radioactive.'], ['Du tritium a en effet été détecté dans les eaux souterraines de la structure, rapporte l’Autorité de sûreté nucléaire (Asn).L’élément a été retrouvé dans des proportions jusqu’à huit fois supérieures au seuil normal.'], ['L’incident est dû à un débordement de puisard, estime l’institution dans un communiqué.'], ['La fuite ne s’est cependant pas répandue hors du site et n’a contaminé aucune nappe phréatique.'], ['""EDF a renforcé le suivi des eaux souterraines et a mené des investigations afin d’identifier l’origine de l’événement.'], ['Celui-ci serait dû au débordement, le 10 novembre 2022, de l’un des puisards recueillant les eaux pluviales et des effluents collectés en rétention"", explique ainsi l’Asn.Parc nucléaire à la ramasseLe parc nucléaire français a été mis à rude épreuve ces derniers mois.'], ['En novembre, seuls 27 des 56 réacteurs étaient en état de marche, tous les autres étant en maintenance.'], ['Des fermetures qui ont eu un impact direct sur la production d’électricité.'], ['En octobre 2022, 20,2 térawattheures étaient ainsi sortis des centrales françaises, contre plus de 30 un an plus tôt.'], [""Au total, 29 réacteurs nucléaires sur 56 sont à l'arrêt en France, d'après les données de production de la journée d'hier.""], ['pic.twitter.com/uqJNYg0QMd— EnergieBot (@energiebot) October 30, 2022 Un sacré handicap au beau milieu de la crise énergétique qui a frappé l’Europe, sevrée de gaz russe.'], ['Pour la première fois depuis des décennies, la France a même dû se résoudre à importer de l’électricité.'], ['Sur les onze premiers mois de 2022, le pays avait ainsi un solde déficitaire de 14,5 térawattheures avec ses voisins.'], ['Une première depuis l’an 2000.Ce fiasco a entraîné la création d’une commission d’enquête sur ""la perte de souveraineté énergétique"" française.'], [""Ministres, ingénieurs, représentants syndicaux se sont succédés devant l'Assemblée nationale, pour tenter d’expliquer les dérives de la politique énergétique ces dernières années.Le gouvernement tente depuis lors de redresser la barre.""], ['Alors qu’il souhaitait arrêter 14 réacteurs nucléaires en 2018, Emmanuel Macron a désormais retourné sa veste.'], [""Le Président français souhaite maintenant construire six nouveaux réacteurs de type EPR2 d’ici 2035, à en croire la feuille de route pour la relance de l'énergie nucléaire dévoilée début février.""], [""#CoupuresElectricite c'est lui.Pourquoi ?""], [""La réponse est là 👇#Fessenheim c'est lui.#Astrid c'est lui.#Alstom c'est lui.Les 14 réacteurs #nucléaire à fermer c'est lui, la loi est d'ailleurs toujours en vigueur.""], ['#Macron pic.twitter.com/8WOMHoZuMW— Dubief Marc (@DubiefMarc) December 3, 2022']]]","[[['secteur', 'nucléaire', 'français'], ['réacteurs', 'arrêt', 'maintenance', 'centrale', 'bugey', 'ain', 'fuite', 'radioactive'], ['tritium', 'eaux', 'souterraines', 'structure', 'autorité', 'sûreté', 'nucléaire', 'élément', 'proportions', 'fois', 'supérieures', 'seuil', 'normal'], ['incident', 'débordement', 'puisard', 'institution', 'communiqué'], ['fuite', 'site', 'nappe', 'phréatique'], ['edf', 'suivi', 'eaux', 'souterraines', 'investigations', 'origine', 'événement'], ['dû', 'débordement', 'novembre', 'puisards', 'eaux', 'pluviales', 'effluents', 'rétention', 'nucléaire', 'ramassele', 'parc', 'nucléaire', 'français', 'rude', 'épreuve', 'derniers', 'mois'], ['novembre', 'réacteurs', 'état', 'marche', 'maintenance'], ['fermetures', 'impact', 'direct', 'production', 'électricité'], ['octobre', 'térawattheures', 'centrales', 'françaises', 'an'], ['total', 'réacteurs', 'nucléaires', 'arrêt', 'france', 'données', 'production', 'journée'], ['energiebot', 'october', 'sacré', 'handicap', 'beau', 'milieu', 'crise', 'énergétique', 'europe', 'gaz', 'russe'], ['fois', 'décennies', 'france', 'électricité'], ['premiers', 'mois', 'pays', 'solde', 'déficitaire', 'térawattheures', 'voisins'], ['an', 'fiasco', 'création', 'commission', 'enquête', 'perte', 'souveraineté', 'énergétique', 'française'], ['ministres', 'ingénieurs', 'représentants', 'syndicaux', 'assemblée', 'nationale', 'dérives', 'politique', 'énergétique', 'dernières', 'gouvernement', 'barre'], ['réacteurs', 'nucléaires', 'emmanuel', 'veste'], ['président', 'français', 'nouveaux', 'réacteurs', 'type', 'feuille', 'route', 'relance', 'énergie', 'nucléaire', 'début', 'février'], ['coupureselectricite'], ['réponse', 'fessenheim', 'réacteurs', 'nucléaire', 'loi', 'vigueur'], ['marc', 'december']]]","[[[], ['Bugey', 'Ain'], ['Asn).L’'], [], [], [], ['Asn', 'Parc nucléaire', 'parc nucléaire français'], [], [], [], ['France'], ['Europe'], ['France'], [], [], [], [], [], [], ['Fessenheim'], []]]","[[[], [], ['Autorité de sûreté nucléaire'], [], [], ['EDF'], [], [], [], [], [], [], [], [], [], ['Assemblée nationale'], [], [], [], [], []]]","[[[], [], [], [], [], [], [], [], [], [], [], [], [], [], [], [], ['Emmanuel Macron'], [], [], [], []]]","{'secteur': 1, 'nucléaire': 6, 'français': 3, 'réacteurs': 6, 'arrêt': 2, 'maintenance': 2, 'centrale': 1, 'bugey': 1, 'ain': 1, 'fuite': 2, 'radioactive': 1, 'tritium': 1, 'eaux': 3, 'souterraines': 2, 'structure': 1, 'autorité': 1, 'sûreté': 1, 'élément': 1, 'proportions': 1, 'fois': 2, 'supérieures': 1, 'seuil': 1, 'normal': 1, 'incident': 1, 'débordement': 2, 'puisard': 1, 'institution': 1, 'communiqué': 1, 'site': 1, 'nappe': 1, 'phréatique': 1, 'edf': 1, 'suivi': 1, 'investigations': 1, 'origine': 1, 'événement': 1, 'dû': 1, 'novembre': 2, 'puisards': 1, 'pluviales': 1, 'effluents': 1, 'rétention': 1, 'ramassele': 1, 'parc': 1, 'rude': 1, 'épreuve': 1, 'derniers': 1, 'mois': 2, 'état': 1, 'marche': 1, 'fermetures': 1, 'impact': 1, 'direct': 1, 'production': 2, 'électricité': 2, 'octobre': 1, 'térawattheures': 2, 'centrales': 1, 'françaises': 1, 'an': 2, 'total': 1, 'nucléaires': 2, 'france': 2, 'données': 1, 'journée': 1, 'energiebot': 1, 'october': 1, 'sacré': 1, 'handicap': 1, 'beau': 1, 'milieu': 1, 'crise': 1, 'énergétique': 3, 'europe': 1, 'gaz': 1, 'russe': 1, 'décennies': 1, 'premiers': 1, 'pays': 1, 'solde': 1, 'déficitaire': 1, 'voisins': 1, 'fiasco': 1, 'création': 1, 'commission': 1, 'enquête': 1, 'perte': 1, 'souveraineté': 1, 'française': 1, 'ministres': 1, 'ingénieurs': 1, 'représentants': 1, 'syndicaux': 1, 'assemblée': 1, 'nationale': 1, 'dérives': 1, 'politique': 1, 'dernières': 1, 'gouvernement': 1, 'barre': 1, 'emmanuel': 1, 'veste': 1, 'président': 1, 'nouveaux': 1, 'type': 1, 'feuille': 1, 'route': 1, 'relance': 1, 'énergie': 1, 'début': 1, 'février': 1, 'coupureselectricite': 1, 'réponse': 1, 'fessenheim': 1, 'loi': 1, 'vigueur': 1, 'marc': 1, 'december': 1}","{'Bugey': 1, 'Ain': 1, 'Asn).L’': 1, 'Asn': 1, 'Parc nucléaire': 1, 'parc nucléaire français': 1, 'France': 2, 'Europe': 1, 'Fessenheim': 1}","{'Autorité de sûreté nucléaire': 1, 'EDF': 1, 'Assemblée nationale': 1}",{'Emmanuel Macron': 1},2023,2,12
