timestamp,url,title,description,content,content-segmented,kws-l,loc-l,org-l,per-l,kws,loc,org,per,year,month,day
1682028000,https://fr.sputniknews.africa/20230421/une-voiture-pilonnee-par-des-debris-de-starship-pendant-son-lancement--video--1058756284.html,Une voiture pilonnée par des débris de Starship pendant son lancement – vidéo,"Garée non loin de la plateforme du lancement de Starship de SpaceX, cette voiture a essuyé des dégâts. Sur la séquence montrant le départ de la fusée, on voit le véhicule inondé par une fumée noire, sous une pluie de débris.","Des débris provenant du lancement de SpaceX Starship dans le sud du Texas ont endommagé une voiture, comme le montre une vidéo largement relayée sur les réseaux sociaux.Une caméra de surveillance a filmé le départ de la fusée d’un angle tout différent de celui officiellement diffusé. VR Cam caught some spectacular footage as #SuperHeavy rocked #SpaceX #Starbase this morning. I am floored at the amount of debris that was ejected. Waiting on Rover 2 damage assessment. Congratulations @elonmusk on pulling this historical launch! pic.twitter.com/6WKEXFqCGN— LabPadre (@LabPadre) April 20, 2023 Le vaisseau spatial décolle dans une gigantesque boule de feu et le panache noir commence à engloutir les alentours. Des éclats s’éparpillent, touchant le véhicule garé non loin de la caméra qui tremble, apparemment sous l’onde de choc. Car getting pelted by debris from Starship pic.twitter.com/yI61CQ3NFz— Latest in space (@latestinspace) April 20, 2023 ""En attente de l’évaluation des dommages du Rover"", a lancé en légende l’auteur de la publication.La voiture était située à une distance d’environ 335 mètres, a-t-il mentionné dans un commentaire.Test échouéDestinée aux vols vers la Lune et Mars, la fusée Starship de SpaceX a explosé peu après son décollage lors de son premier vol d’essai, le 20 avril. La fusée a commencé à pivoter de manière incontrôlée et a fini par se désintégrer.Plus tard, la société a fourni sa version des faits, précisant que l’explosion avait été sciemment actée. D’après SpaceX, plusieurs moteurs se sont arrêtés, l’engin a perdu de l’altitude et s’est mis à pivoter. Le système de fin de vol a été commandé à la fois sur le booster et sur le vaisseau.De son côté, Elon Musk, patron de la société, assure vouloir réaliser de prochains tests dans quelques mois.","[[['Des débris provenant du lancement de SpaceX Starship dans le sud du Texas ont endommagé une voiture, comme le montre une vidéo largement relayée sur les réseaux sociaux.Une caméra de surveillance a filmé le départ de la fusée d’un angle tout différent de celui officiellement diffusé.'], ['VR Cam caught some spectacular footage as #SuperHeavy rocked #SpaceX #Starbase this morning.'], ['I am floored at the amount of debris that was ejected.'], ['Waiting on Rover 2 damage assessment.'], ['Congratulations @elonmusk on pulling this historical launch!'], ['pic.twitter.com/6WKEXFqCGN— LabPadre (@LabPadre) April 20, 2023 Le vaisseau spatial décolle dans une gigantesque boule de feu et le panache noir commence à engloutir les alentours.'], ['Des éclats s’éparpillent, touchant le véhicule garé non loin de la caméra qui tremble, apparemment sous l’onde de choc.'], ['Car getting pelted by debris from Starship pic.twitter.com/yI61CQ3NFz— Latest in space (@latestinspace) April 20, 2023 ""En attente de l’évaluation des dommages du Rover"", a lancé en légende l’auteur de la publication.La voiture était située à une distance d’environ 335 mètres, a-t-il mentionné dans un commentaire.Test échouéDestinée aux vols vers la Lune et Mars, la fusée Starship de SpaceX a explosé peu après son décollage lors de son premier vol d’essai, le 20 avril.'], ['La fusée a commencé à pivoter de manière incontrôlée et a fini par se désintégrer.Plus tard, la société a fourni sa version des faits, précisant que l’explosion avait été sciemment actée.'], ['D’après SpaceX, plusieurs moteurs se sont arrêtés, l’engin a perdu de l’altitude et s’est mis à pivoter.'], ['Le système de fin de vol a été commandé à la fois sur le booster et sur le vaisseau.De son côté, Elon Musk, patron de la société, assure vouloir réaliser de prochains tests dans quelques mois.']]]","[[['débris', 'lancement', 'spacex', 'starship', 'sud', 'texas', 'voiture', 'vidéo', 'réseaux', 'caméra', 'surveillance', 'départ', 'fusée', 'angle'], ['footage', 'superheavy', 'rocked', 'spacex', 'starbase'], ['debris', 'ejected'], ['damage'], ['congratulations'], ['labpadre', 'april', 'vaisseau', 'spatial', 'gigantesque', 'boule', 'feu', 'panache', 'noir', 'alentours'], ['éclats', 'véhicule', 'caméra', 'onde', 'choc'], ['space', 'april', 'attente', 'évaluation', 'dommages', 'rover', 'légende', 'auteur', 'voiture', 'distance', 'mètres', 'vols', 'lune', 'mars', 'fusée', 'spacex', 'décollage', 'vol', 'essai', 'avril'], ['fusée', 'manière', 'incontrôlée', 'société', 'version', 'faits', 'explosion'], ['spacex', 'moteurs', 'engin', 'altitude'], ['système', 'fin', 'vol', 'fois', 'côté', 'elon', 'patron', 'société', 'prochains', 'tests', 'mois']]]","[[['Texas'], [], ['I'], [], [], ['@LabPadre'], [], ['Lune', 'Mars'], [], [], []]]","[[[], [], [], [], [], ['April'], [], ['April', 'Rover', 'SpaceX'], [], ['SpaceX'], []]]","[[[], [], [], [], [], ['LabPadre'], [], [], [], [], ['Elon Musk']]]","{'débris': 1, 'lancement': 1, 'spacex': 4, 'starship': 1, 'sud': 1, 'texas': 1, 'voiture': 2, 'vidéo': 1, 'réseaux': 1, 'caméra': 2, 'surveillance': 1, 'départ': 1, 'fusée': 3, 'angle': 1, 'footage': 1, 'superheavy': 1, 'rocked': 1, 'starbase': 1, 'debris': 1, 'ejected': 1, 'damage': 1, 'congratulations': 1, 'labpadre': 1, 'april': 2, 'vaisseau': 1, 'spatial': 1, 'gigantesque': 1, 'boule': 1, 'feu': 1, 'panache': 1, 'noir': 1, 'alentours': 1, 'éclats': 1, 'véhicule': 1, 'onde': 1, 'choc': 1, 'space': 1, 'attente': 1, 'évaluation': 1, 'dommages': 1, 'rover': 1, 'légende': 1, 'auteur': 1, 'distance': 1, 'mètres': 1, 'vols': 1, 'lune': 1, 'mars': 1, 'décollage': 1, 'vol': 2, 'essai': 1, 'avril': 1, 'manière': 1, 'incontrôlée': 1, 'société': 2, 'version': 1, 'faits': 1, 'explosion': 1, 'moteurs': 1, 'engin': 1, 'altitude': 1, 'système': 1, 'fin': 1, 'fois': 1, 'côté': 1, 'elon': 1, 'patron': 1, 'prochains': 1, 'tests': 1, 'mois': 1}","{'Texas': 1, 'I': 1, '@LabPadre': 1, 'Lune': 1, 'Mars': 1}","{'April': 2, 'Rover': 1, 'SpaceX': 2}","{'LabPadre': 1, 'Elon Musk': 1}",2023,4,20
1682028000,https://fr.sputniknews.africa/20230421/un-nouveau-fusil-antidrones-invente-en-russie---photo-1058756109.html,Un nouveau fusil antidrones inventé en Russie - photo,"Des spécialistes russes ont élaboré un nouveau fusil qui pourrait lutter contre les quadcoptères. Baptisé Stepachka, il est déjà testé dans la zone de l’opération spéciale en Ukraine.","Le nouveau fusil portant le nom de PARS-S Stepachka est capable de brouiller les fréquences des drones de type Mavic les plus utilisés dans l’opération spéciale. C’est ce qu’a déclaré ce 21 avril à Sputnik un représentant de l’entreprise conceptrice de ce fusil antidrones, Lokatsionnaya masterskaya (Lokmas).L’invention est présentée à l'exposition Équipement, qui se déroule à Moscou les 21 et 22 avril.Notre innovation la plus moderne [parmi celles présentées à l'exposition, ndlr] a été lancée en production de masse il y a deux mois. Il s'agit du fusil antidrones PARS-S, qui neutralise tous les drones [à double usage, ndlr] opérant dans l’opération spéciale: Mavic, FPV, Autel et d'autres engins répandus, a précisé le représentant de la société.Déjà employé en UkraineEn outre, selon l'interlocuteur de l'agence, le Stepachka est testé à la fois sur les champs de tir et dans la zone de l’opération spéciale. Depuis le début de celle-ci, la production d’armes antidrones chez Lokmas a été multipliée par plusieurs fois et se compte désormais par centaines chaque mois, a-t-il noté.D’après les données présentées à l'exposition, ce nouveau dispositif a une portée de suppression allant jusqu'à 1,5 kilomètre, pèse 9,6 kilogrammes et a une autonomie de deux heures. De plus, l’arme peut être utilisée en version stationnaire (sur un trépied), ou mobile.","[[['Le nouveau fusil portant le nom de PARS-S Stepachka est capable de brouiller les fréquences des drones de type Mavic les plus utilisés dans l’opération spéciale.'], [""C’est ce qu’a déclaré ce 21 avril à Sputnik un représentant de l’entreprise conceptrice de ce fusil antidrones, Lokatsionnaya masterskaya (Lokmas).L’invention est présentée à l'exposition Équipement, qui se déroule à Moscou les 21 et 22 avril.Notre innovation la plus moderne [parmi celles présentées à l'exposition, ndlr] a été lancée en production de masse il y a deux mois.""], [""Il s'agit du fusil antidrones PARS-S, qui neutralise tous les drones [à double usage, ndlr] opérant dans l’opération spéciale: Mavic, FPV, Autel et d'autres engins répandus, a précisé le représentant de la société.Déjà employé en UkraineEn outre, selon l'interlocuteur de l'agence, le Stepachka est testé à la fois sur les champs de tir et dans la zone de l’opération spéciale.""], [""Depuis le début de celle-ci, la production d’armes antidrones chez Lokmas a été multipliée par plusieurs fois et se compte désormais par centaines chaque mois, a-t-il noté.D’après les données présentées à l'exposition, ce nouveau dispositif a une portée de suppression allant jusqu'à 1,5 kilomètre, pèse 9,6 kilogrammes et a une autonomie de deux heures.""], ['De plus, l’arme peut être utilisée en version stationnaire (sur un trépied), ou mobile.']]]","[[['fusil', 'nom', 'pars', 'stepachka', 'capable', 'fréquences', 'drones', 'type', 'mavic', 'opération', 'spéciale'], ['avril', 'sputnik', 'représentant', 'entreprise', 'conceptrice', 'fusil', 'antidrones', 'lokatsionnaya', 'masterskaya', 'invention', 'exposition', 'équipement', 'moscou', 'innovation', 'moderne', 'exposition', 'ndlr', 'production', 'masse', 'mois'], ['fusil', 'antidrones', 'drones', 'double', 'usage', 'ndlr', 'opération', 'spéciale', 'mavic', 'fpv', 'autel', 'engins', 'représentant', 'ukraineen', 'interlocuteur', 'agence', 'stepachka', 'fois', 'champs', 'tir', 'zone', 'opération', 'spéciale'], ['début', 'production', 'armes', 'antidrones', 'lokmas', 'fois', 'centaines', 'mois', 'données', 'exposition', 'dispositif', 'portée', 'suppression', 'kilomètre', 'kilogrammes', 'autonomie', 'heures'], ['arme', 'version', 'stationnaire', 'trépied', 'mobile']]]","[[[], ['Moscou'], ['Autel', 'Stepachka'], [], []]]","[[[], ['Sputnik'], ['UkraineEn'], [], []]]","[[[], ['Lokatsionnaya masterskaya'], [], ['Lokmas'], []]]","{'fusil': 3, 'nom': 1, 'pars': 1, 'stepachka': 2, 'capable': 1, 'fréquences': 1, 'drones': 2, 'type': 1, 'mavic': 2, 'opération': 3, 'spéciale': 3, 'avril': 1, 'sputnik': 1, 'représentant': 2, 'entreprise': 1, 'conceptrice': 1, 'antidrones': 3, 'lokatsionnaya': 1, 'masterskaya': 1, 'invention': 1, 'exposition': 3, 'équipement': 1, 'moscou': 1, 'innovation': 1, 'moderne': 1, 'ndlr': 2, 'production': 2, 'masse': 1, 'mois': 2, 'double': 1, 'usage': 1, 'fpv': 1, 'autel': 1, 'engins': 1, 'ukraineen': 1, 'interlocuteur': 1, 'agence': 1, 'fois': 2, 'champs': 1, 'tir': 1, 'zone': 1, 'début': 1, 'armes': 1, 'lokmas': 1, 'centaines': 1, 'données': 1, 'dispositif': 1, 'portée': 1, 'suppression': 1, 'kilomètre': 1, 'kilogrammes': 1, 'autonomie': 1, 'heures': 1, 'arme': 1, 'version': 1, 'stationnaire': 1, 'trépied': 1, 'mobile': 1}","{'Moscou': 1, 'Autel': 1, 'Stepachka': 1}","{'Sputnik': 1, 'UkraineEn': 1}","{'Lokatsionnaya masterskaya': 1, 'Lokmas': 1}",2023,4,20
1682028000,https://fr.sputniknews.africa/20230421/le-burkina-faso-precise-les-modalites-de-la-mobilisation-generale-1058748570.html,Le Burkina Faso précise les modalités de la mobilisation générale,"Face à la menace terroriste, le Burkina Faso décrète une mobilisation générale de 12 mois. Les hommes de plus de 18 ans, ""physiquement aptes"", y seront soumis. Le commandement militaire sera désormais ""responsable de l’ordre public"" aux...","Le Président burkinabé de la transition Ibrahim Traoré a signé le 19 avril un décret sur la ""mobilisation générale et la mise en garde"".D’après le document, la mobilisation est censée durer 12 mois. À part les membres des forces de défense et de sécurité, sont mobilisables ""les jeunes gens de 18 ans ou plus, non-membres des forces armées nationales"". Ils doivent être ""physiquement aptes"" et seront enrôlés ""selon les besoins exprimés par les autorités compétentes"".Parallèlement, les populations civiles ""peuvent également s’organiser"" sous l’encadrement des militaires ""pour défendre leur localité"". Toutefois, le texte n’explique pas la forme de cet encadrement, ni la nature des moyens mis à leur disposition.Le décret porte également sur l’instauration du commandement militaire ""dans les zones où se déroulent des opérations militaires"". La gestion de ces zones sera exercée ""au côté des autorités civiles sur place"".Mesures exceptionnelles""Les droits et libertés individuels peuvent être restreints"", à l’exception des droits fondamentaux comme celui à la vie ou celui à ne pas être soumis à la torture ou à des traitements inhumains.Selon le décret, ces dispositions sont adoptées ""en vue de défendre l’intégrité du territoire national, de restaurer la sécurité sur l’ensemble du territoire et d’assurer la protection des populations et de leurs biens, contre la menace et les actions terroristes"".Le pays, en particulier sa partie nord, est pris depuis 2015 dans une spirale de violences attribuées à des groupes terroristes liés à Al-Qaïda* et à Daech*.* organisation terroriste interdite en Russie.","[[['Le Président burkinabé de la transition Ibrahim Traoré a signé le 19 avril un décret sur la ""mobilisation générale et la mise en garde"".D’après le document, la mobilisation est censée durer 12 mois.'], ['À part les membres des forces de défense et de sécurité, sont mobilisables ""les jeunes gens de 18 ans ou plus, non-membres des forces armées nationales"".'], ['Ils doivent être ""physiquement aptes"" et seront enrôlés ""selon les besoins exprimés par les autorités compétentes"".Parallèlement, les populations civiles ""peuvent également s’organiser"" sous l’encadrement des militaires ""pour défendre leur localité"".'], ['Toutefois, le texte n’explique pas la forme de cet encadrement, ni la nature des moyens mis à leur disposition.Le décret porte également sur l’instauration du commandement militaire ""dans les zones où se déroulent des opérations militaires"".'], ['La gestion de ces zones sera exercée ""au côté des autorités civiles sur place"".Mesures exceptionnelles""Les droits et libertés individuels peuvent être restreints"", à l’exception des droits fondamentaux comme celui à la vie ou celui à ne pas être soumis à la torture ou à des traitements inhumains.Selon le décret, ces dispositions sont adoptées ""en vue de défendre l’intégrité du territoire national, de restaurer la sécurité sur l’ensemble du territoire et d’assurer la protection des populations et de leurs biens, contre la menace et les actions terroristes"".Le pays, en particulier sa partie nord, est pris depuis 2015 dans une spirale de violences attribuées à des groupes terroristes liés à Al-Qaïda* et à Daech*.'], ['* organisation terroriste interdite en Russie.']]]","[[['président', 'burkinabé', 'transition', 'ibrahim', 'traoré', 'avril', 'décret', 'mobilisation', 'générale', 'mise', 'document', 'mobilisation', 'mois'], ['part', 'membres', 'forces', 'défense', 'sécurité', 'mobilisables', 'jeunes', 'ans', 'forces', 'armées', 'nationales'], ['aptes', 'besoins', 'autorités', 'populations', 'civiles', 'encadrement', 'militaires', 'localité'], ['texte', 'forme', 'encadrement', 'nature', 'moyens', 'décret', 'instauration', 'commandement', 'militaire', 'zones', 'opérations', 'militaires'], ['gestion', 'zones', 'côté', 'autorités', 'civiles', 'droits', 'libertés', 'individuels', 'exception', 'droits', 'fondamentaux', 'vie', 'torture', 'traitements', 'décret', 'dispositions', 'vue', 'intégrité', 'territoire', 'national', 'sécurité', 'ensemble', 'territoire', 'protection', 'populations', 'biens', 'menace', 'actions', 'pays', 'particulier', 'partie', 'spirale', 'violences', 'groupes', 'terroristes', 'al', 'qaïda'], ['organisation', 'terroriste', 'russie']]]","[[[], [], [], [], ['Daech*.'], ['Russie']]]","[[[], [], [], [], ['Al-Qaïda'], []]]","[[['Ibrahim Traoré'], [], [], [], [], []]]","{'président': 1, 'burkinabé': 1, 'transition': 1, 'ibrahim': 1, 'traoré': 1, 'avril': 1, 'décret': 3, 'mobilisation': 2, 'générale': 1, 'mise': 1, 'document': 1, 'mois': 1, 'part': 1, 'membres': 1, 'forces': 2, 'défense': 1, 'sécurité': 2, 'mobilisables': 1, 'jeunes': 1, 'ans': 1, 'armées': 1, 'nationales': 1, 'aptes': 1, 'besoins': 1, 'autorités': 2, 'populations': 2, 'civiles': 2, 'encadrement': 2, 'militaires': 2, 'localité': 1, 'texte': 1, 'forme': 1, 'nature': 1, 'moyens': 1, 'instauration': 1, 'commandement': 1, 'militaire': 1, 'zones': 2, 'opérations': 1, 'gestion': 1, 'côté': 1, 'droits': 2, 'libertés': 1, 'individuels': 1, 'exception': 1, 'fondamentaux': 1, 'vie': 1, 'torture': 1, 'traitements': 1, 'dispositions': 1, 'vue': 1, 'intégrité': 1, 'territoire': 2, 'national': 1, 'ensemble': 1, 'protection': 1, 'biens': 1, 'menace': 1, 'actions': 1, 'pays': 1, 'particulier': 1, 'partie': 1, 'spirale': 1, 'violences': 1, 'groupes': 1, 'terroristes': 1, 'al': 1, 'qaïda': 1, 'organisation': 1, 'terroriste': 1, 'russie': 1}","{'Daech*.': 1, 'Russie': 1}",{'Al-Qaïda': 1},{'Ibrahim Traoré': 1},2023,4,20
1682028000,https://fr.sputniknews.africa/20230421/explosion-dans-une-ville-russe-la-defense-rapporte-la-chute-imprevue-de-munition-dun-su-34--video-1058747316.html,Explosion dans une ville russe: la Défense rapporte la chute imprévue de munition d'un Su-34 - vidéo,"La chute imprévue d’une munition d’aviation a provoqué le 20 avril une déflagration dans la ville de Belgorod, selon la Défense russe. Le gouverneur de la région fait état de trois blessés et de dégâts causés aux immeubles et aux...","Une explosion s’est produite dans la soirée du 20 avril dans la ville de Belgorod. En résultat, un immeuble d’habitation et plusieurs voitures en stationnement ont été endommagés, des lignes électriques sont tombées. La déflagration a créé un cratère d'un rayon de 20 mètres.Le 20 avril 2023, pendant le vol d'un Su-34 des Forces aérospatiales russes au-dessus de la ville de Belgorod, il y a eu une chute anormale d'une munition d'aviation. En conséquence, des bâtiments résidentiels ont été endommagés, mais aucune victime n'est à déplorer, a déclaré le ministère russe de la Défense.L’institution a ajouté qu'une enquête est en cours.Trois blessésDe son côté, le gouverneur de la région Viatcheslav Gladkov a précisé sur Telegram ce 21 avril que trois personnes avaient été blessées. Deux ont été hospitalisées, l’une pour un traumatisme crânien, l'autre souffrant d’une tension artérielle très élevée. La troisième personne, avec des écorchures, a refusé d’aller à l’hôpital.M. Gladkov a indiqué que quatre appartements de l'immeuble et quatre voitures avaient été endommagés.Un centre d'information a été mis en place pour recueillir des données sur les dommages urbains.","[[['Une explosion s’est produite dans la soirée du 20 avril dans la ville de Belgorod.'], ['En résultat, un immeuble d’habitation et plusieurs voitures en stationnement ont été endommagés, des lignes électriques sont tombées.'], [""La déflagration a créé un cratère d'un rayon de 20 mètres.Le 20 avril 2023, pendant le vol d'un Su-34 des Forces aérospatiales russes au-dessus de la ville de Belgorod, il y a eu une chute anormale d'une munition d'aviation.""], [""En conséquence, des bâtiments résidentiels ont été endommagés, mais aucune victime n'est à déplorer, a déclaré le ministère russe de la Défense.L’institution a ajouté qu'une enquête est en cours.Trois blessésDe son côté, le gouverneur de la région Viatcheslav Gladkov a précisé sur Telegram ce 21 avril que trois personnes avaient été blessées.""], [""Deux ont été hospitalisées, l’une pour un traumatisme crânien, l'autre souffrant d’une tension artérielle très élevée.""], ['La troisième personne, avec des écorchures, a refusé d’aller à l’hôpital.M.'], [""Gladkov a indiqué que quatre appartements de l'immeuble et quatre voitures avaient été endommagés.Un centre d'information a été mis en place pour recueillir des données sur les dommages urbains.""]]]","[[['explosion', 'soirée', 'avril', 'ville', 'belgorod'], ['résultat', 'immeuble', 'habitation', 'voitures', 'stationnement', 'lignes', 'électriques'], ['déflagration', 'cratère', 'rayon', 'avril', 'vol', 'forces', 'aérospatiales', 'russes', 'ville', 'belgorod', 'chute', 'anormale', 'munition', 'aviation'], ['conséquence', 'bâtiments', 'résidentiels', 'victime', 'ministère', 'russe', 'institution', 'enquête', 'côté', 'gouverneur', 'région', 'viatcheslav', 'telegram', 'avril', 'personnes'], ['traumatisme', 'crânien', 'tension', 'artérielle', 'élevée'], ['écorchures'], ['appartements', 'immeuble', 'voitures', 'centre', 'information', 'place', 'données', 'dommages', 'urbains']]]","[[['Belgorod'], [], ['Belgorod'], [], [], [], ['Gladkov']]]","[[[], [], ['Su-34', 'Forces aérospatiales russes'], [], [], [], []]]","[[[], [], [], ['Viatcheslav Gladkov'], [], [], []]]","{'explosion': 1, 'soirée': 1, 'avril': 3, 'ville': 2, 'belgorod': 2, 'résultat': 1, 'immeuble': 2, 'habitation': 1, 'voitures': 2, 'stationnement': 1, 'lignes': 1, 'électriques': 1, 'déflagration': 1, 'cratère': 1, 'rayon': 1, 'vol': 1, 'forces': 1, 'aérospatiales': 1, 'russes': 1, 'chute': 1, 'anormale': 1, 'munition': 1, 'aviation': 1, 'conséquence': 1, 'bâtiments': 1, 'résidentiels': 1, 'victime': 1, 'ministère': 1, 'russe': 1, 'institution': 1, 'enquête': 1, 'côté': 1, 'gouverneur': 1, 'région': 1, 'viatcheslav': 1, 'telegram': 1, 'personnes': 1, 'traumatisme': 1, 'crânien': 1, 'tension': 1, 'artérielle': 1, 'élevée': 1, 'écorchures': 1, 'appartements': 1, 'centre': 1, 'information': 1, 'place': 1, 'données': 1, 'dommages': 1, 'urbains': 1}","{'Belgorod': 2, 'Gladkov': 1}","{'Su-34': 1, 'Forces aérospatiales russes': 1}",{'Viatcheslav Gladkov': 1},2023,4,20
