timestamp,url,title,description,content,content-segmented,kws-l,loc-l,org-l,per-l,kws,loc,org,per,year,month,day
1680904800,https://fr.sputniknews.africa/20230408/ces-avions-militaires-russes-seront-adaptes-pour-porter-des-armes-antisatellites-1058438904.html,Ces avions militaires russes seront adaptés pour porter des armes antisatellites,"La Russie continue la mise au point de systèmes de lutte antisatellites à base de chasseurs MiG-31D et d’avions de transport militaire Il-76, selon la revue Voïennaïa mysl. Le chasseur doit être doté d’un missile antisatellite et l’avion...","La Russie poursuit les travaux visant à équiper l’intercepteur MiG-31D d’un missile antisatellites et l’avion de transport militaire Il-76 d’un laser de combat, selon la revue Voïennaïa mysl publiée par le ministère de la Défense.""La Russie envisage plusieurs systèmes de lutte antisatellites déployés sur des vecteurs mobiles: un système de défense spatiale Kontakt équipant l’intercepteur MiG-31, un système de combat laser A60 Sokol-Echelon basé sur l’avion de transport Il-76, un laser militaire Peresvet"", détaille la revue.Des sources ouvertes avaient mentionné pour la dernière fois les travaux sur des systèmes antisatellites aéroportés en 2009. Le commandant en chef de l’armée de l’air avait alors déclaré que la ""réanimation du système était en cours"" dans l’intérêt de la défense spatiale.En 2018, un spotter avait mis en ligne des images prises dans la région de Moscou montrant un MiG-31 avec un missile noir inconnu sous son fuselage. Des sources spécialisées avaient estimé qu’il s’agissait d’un prototype d’une munition antisatellite.Historique du projetSelon des sources ouvertes, le développement d’un système aéroporté destiné à cibler des engins spatiaux circulant sur une orbite basse est mené sur la base des recherches précédentes et de nouvelles technologies. Les travaux sur le missile 79M6 Kontakt équipant un MiG-31D avaient commencé à l’époque soviétique, depuis 1984.Le développement de laser A-60 porté par un Il-76MD date lui aussi de l’époque de l’URSS, son premier vol remontant à 1981.En 2016, Iouri Borissov, alors vice-ministre russe de la Défense et actuellement directeur général de l’agence Roscosmos, avait annoncé des progrès dans le développement du système A-60. Pour la dernière fois, le projet a été officiellement évoqué en 2020: le bureau d’études Beriev a acquis un brevet d’avion porteur d’un système laser.","[[['La Russie poursuit les travaux visant à équiper l’intercepteur MiG-31D d’un missile antisatellites et l’avion de transport militaire Il-76 d’un laser de combat, selon la revue Voïennaïa mysl publiée par le ministère de la Défense.'], ['""La Russie envisage plusieurs systèmes de lutte antisatellites déployés sur des vecteurs mobiles: un système de défense spatiale Kontakt équipant l’intercepteur MiG-31, un système de combat laser A60 Sokol-Echelon basé sur l’avion de transport Il-76, un laser militaire Peresvet"", détaille la revue.Des sources ouvertes avaient mentionné pour la dernière fois les travaux sur des systèmes antisatellites aéroportés en 2009.'], ['Le commandant en chef de l’armée de l’air avait alors déclaré que la ""réanimation du système était en cours"" dans l’intérêt de la défense spatiale.En 2018, un spotter avait mis en ligne des images prises dans la région de Moscou montrant un MiG-31 avec un missile noir inconnu sous son fuselage.'], ['Des sources spécialisées avaient estimé qu’il s’agissait d’un prototype d’une munition antisatellite.Historique du projetSelon des sources ouvertes, le développement d’un système aéroporté destiné à cibler des engins spatiaux circulant sur une orbite basse est mené sur la base des recherches précédentes et de nouvelles technologies.'], ['Les travaux sur le missile 79M6 Kontakt équipant un MiG-31D avaient commencé à l’époque soviétique, depuis 1984.Le développement de laser A-60 porté par un Il-76MD date lui aussi de l’époque de l’URSS, son premier vol remontant à 1981.En 2016, Iouri Borissov, alors vice-ministre russe de la Défense et actuellement directeur général de l’agence Roscosmos, avait annoncé des progrès dans le développement du système A-60.'], ['Pour la dernière fois, le projet a été officiellement évoqué en 2020: le bureau d’études Beriev a acquis un brevet d’avion porteur d’un système laser.']]]","[[['russie', 'travaux', 'intercepteur', 'missile', 'antisatellites', 'avion', 'transport', 'militaire', 'laser', 'combat', 'revue', 'voïennaïa', 'mysl', 'ministère', 'défense'], ['russie', 'systèmes', 'lutte', 'vecteurs', 'mobiles', 'système', 'défense', 'spatiale', 'intercepteur', 'système', 'combat', 'laser', 'sokol', 'echelon', 'avion', 'transport', 'laser', 'militaire', 'peresvet', 'sources', 'ouvertes', 'dernière', 'fois', 'travaux', 'systèmes'], ['commandant', 'chef', 'armée', 'air', 'réanimation', 'système', 'cours', 'intérêt', 'défense', 'ligne', 'images', 'région', 'moscou', 'missile', 'noir', 'inconnu', 'fuselage'], ['sources', 'prototype', 'munition', 'projetselon', 'sources', 'ouvertes', 'développement', 'système', 'aéroporté', 'engins', 'spatiaux', 'orbite', 'basse', 'base', 'recherches', 'précédentes', 'nouvelles', 'technologies'], ['travaux', 'missile', 'époque', 'soviétique', 'développement', 'laser', 'époque', 'urss', 'vol', 'borissov', 'russe', 'défense', 'directeur', 'général', 'agence', 'roscosmos', 'progrès', 'développement', 'système'], ['dernière', 'fois', 'projet', 'bureau', 'études', 'brevet', 'avion', 'porteur', 'système', 'laser']]]","[[['Russie'], ['Russie', 'Peresvet'], ['Moscou'], [], ['1984.Le', 'A-60', 'Il-76MD', 'A-60'], []]]","[[['Voïennaïa', 'ministère de la Défense'], [], [], [], ['URSS', '1981.En 2016', 'Roscosmos'], []]]","[[['Il-76'], ['Il-76'], [], [], ['Iouri Borissov'], ['Beriev']]]","{'russie': 2, 'travaux': 3, 'intercepteur': 2, 'missile': 3, 'antisatellites': 1, 'avion': 3, 'transport': 2, 'militaire': 2, 'laser': 5, 'combat': 2, 'revue': 1, 'voïennaïa': 1, 'mysl': 1, 'ministère': 1, 'défense': 4, 'systèmes': 2, 'lutte': 1, 'vecteurs': 1, 'mobiles': 1, 'système': 6, 'spatiale': 1, 'sokol': 1, 'echelon': 1, 'peresvet': 1, 'sources': 3, 'ouvertes': 2, 'dernière': 2, 'fois': 2, 'commandant': 1, 'chef': 1, 'armée': 1, 'air': 1, 'réanimation': 1, 'cours': 1, 'intérêt': 1, 'ligne': 1, 'images': 1, 'région': 1, 'moscou': 1, 'noir': 1, 'inconnu': 1, 'fuselage': 1, 'prototype': 1, 'munition': 1, 'projetselon': 1, 'développement': 3, 'aéroporté': 1, 'engins': 1, 'spatiaux': 1, 'orbite': 1, 'basse': 1, 'base': 1, 'recherches': 1, 'précédentes': 1, 'nouvelles': 1, 'technologies': 1, 'époque': 2, 'soviétique': 1, 'urss': 1, 'vol': 1, 'borissov': 1, 'russe': 1, 'directeur': 1, 'général': 1, 'agence': 1, 'roscosmos': 1, 'progrès': 1, 'projet': 1, 'bureau': 1, 'études': 1, 'brevet': 1, 'porteur': 1}","{'Russie': 2, 'Peresvet': 1, 'Moscou': 1, '1984.Le': 1, 'A-60': 2, 'Il-76MD': 1}","{'Voïennaïa': 1, 'ministère de la Défense': 1, 'URSS': 1, '1981.En 2016': 1, 'Roscosmos': 1}","{'Il-76': 2, 'Iouri Borissov': 1, 'Beriev': 1}",2023,4,7
1680904800,https://fr.sputniknews.africa/20230408/la-defense-antiaerienne-russe-abat-un-missile-au-dessus-de-la-crimee-1058438576.html,La défense antiaérienne russe abat un missile au-dessus de la Crimée,L'Ukraine a de nouveau essayé d'attaquer la Crimée ce samedi. La défense antiaérienne russe a intercepté un missile au-dessus de la péninsule. Personne n'a été blessé.,"""Un missile tiré du côté de l'Ukraine a été abattu au-dessus de Feodossia"", a annoncé ce samedi sur Telegram le chef de la république de Crimée Sergueï Aksionov. Il a ainsi expliqué les explosions entendues ce matin par des habitants de cette ville portuaire de la côte méridionale de la péninsule. Feodossia occupe une position stratégique à proximité du détroit de Kertch, qui relie la mer Noire à la mer d'Azov.Un missile balistique à courte portéeSelon les premières informations, il s'agit d'un missile balistique à courte portée ukrainien Hrim-2 tiré depuis un polygone de la région d'Odessa.Des débris du missile sont tombés sur une localité criméenne sans faire de blessés.Depuis août dernier, la défense antiaérienne russe se voit régulièrement obligée de réagir à des attaques contre les infrastructures de la Crimée. Le plus souvent, il s'agit de drones. Le 22 et le 29 mars, ces engins ont également tenté de s'introduire dans la baie de Sébastopol et à proximité de Simféropol, mais ont été repoussés.","[[['""Un missile tiré du côté de l\'Ukraine a été abattu au-dessus de Feodossia"", a annoncé ce samedi sur Telegram le chef de la république de Crimée Sergueï Aksionov.'], ['Il a ainsi expliqué les explosions entendues ce matin par des habitants de cette ville portuaire de la côte méridionale de la péninsule.'], [""Feodossia occupe une position stratégique à proximité du détroit de Kertch, qui relie la mer Noire à la mer d'Azov.Un missile balistique à courte portéeSelon les premières informations, il s'agit d'un missile balistique à courte portée ukrainien Hrim-2 tiré depuis un polygone de la région d'Odessa.Des débris du missile sont tombés sur une localité criméenne sans faire de blessés.Depuis août dernier, la défense antiaérienne russe se voit régulièrement obligée de réagir à des attaques contre les infrastructures de la Crimée.""], [""Le plus souvent, il s'agit de drones.""], [""Le 22 et le 29 mars, ces engins ont également tenté de s'introduire dans la baie de Sébastopol et à proximité de Simféropol, mais ont été repoussés.""]]]","[[['missile', 'côté', 'ukraine', 'feodossia', 'samedi', 'telegram', 'chef', 'république', 'sergueï', 'aksionov'], ['explosions', 'matin', 'habitants', 'ville', 'portuaire', 'côte', 'méridionale', 'péninsule'], ['feodossia', 'position', 'stratégique', 'proximité', 'détroit', 'kertch', 'mer', 'noire', 'mer', 'missile', 'balistique', 'courte', 'premières', 'informations', 'missile', 'balistique', 'courte', 'portée', 'ukrainien', 'polygone', 'région', 'débris', 'missile', 'localité', 'criméenne', 'août', 'dernier', 'défense', 'antiaérienne', 'russe', 'attaques', 'infrastructures', 'crimée'], ['drones'], ['mars', 'engins', 'baie', 'sébastopol', 'proximité', 'simféropol']]]","[[['Ukraine', 'république de', 'Crimée'], [], ['détroit de Kertch', 'mer Noire', ""mer d'Azov"", 'Hrim-2', 'Odessa', 'Crimée'], [], ['baie de Sébastopol', 'Simféropol']]]","[[[], [], [], [], []]]","[[['Feodossia', 'Sergueï Aksionov'], [], ['Feodossia'], [], []]]","{'missile': 4, 'côté': 1, 'ukraine': 1, 'feodossia': 2, 'samedi': 1, 'telegram': 1, 'chef': 1, 'république': 1, 'sergueï': 1, 'aksionov': 1, 'explosions': 1, 'matin': 1, 'habitants': 1, 'ville': 1, 'portuaire': 1, 'côte': 1, 'méridionale': 1, 'péninsule': 1, 'position': 1, 'stratégique': 1, 'proximité': 2, 'détroit': 1, 'kertch': 1, 'mer': 2, 'noire': 1, 'balistique': 2, 'courte': 2, 'premières': 1, 'informations': 1, 'portée': 1, 'ukrainien': 1, 'polygone': 1, 'région': 1, 'débris': 1, 'localité': 1, 'criméenne': 1, 'août': 1, 'dernier': 1, 'défense': 1, 'antiaérienne': 1, 'russe': 1, 'attaques': 1, 'infrastructures': 1, 'crimée': 1, 'drones': 1, 'mars': 1, 'engins': 1, 'baie': 1, 'sébastopol': 1, 'simféropol': 1}","{'Ukraine': 1, 'république de': 1, 'Crimée': 2, 'détroit de Kertch': 1, 'mer Noire': 1, ""mer d'Azov"": 1, 'Hrim-2': 1, 'Odessa': 1, 'baie de Sébastopol': 1, 'Simféropol': 1}",{},"{'Feodossia': 2, 'Sergueï Aksionov': 1}",2023,4,7
1680904800,https://fr.sputniknews.africa/20230408/le-tchad-expulse-lambassadeur-dallemagne-declare-persona-non-grata-1058438418.html,"Le Tchad expulse l'ambassadeur d'Allemagne, déclaré persona non grata","Le Tchad a déclaré l’ambassadeur allemand à N’Djamena persona non grata et lui a donné 48 heures pour quitter le pays. Les autorités l’accusent d’avoir enfreint les usages diplomatiques. Selon une source gouvernementale citée par l’AFP, il...","L'ambassadeur d'Allemagne au Tchad va être expulsé dans un délai de 48 heures pour ""attitude discourtoise"" et ""non-respect des usages diplomatiques"", a annoncé le gouvernement tchadien vendredi. Le gouvernement ""prie SEM (Son Excellence Monsieur, ndlr) Jan Christian Gordon Kricke, ambassadeur extraordinaire et plénipotentiaire de la République fédérale d'Allemagne, de quitter le territoire tchadien dans un délai de 48h"", a indiqué le porte-parole du gouvernement Aziz Mahamat Saleh, dans un communiqué. Les autorités n'ont pas donné de détails sur les faits qu'elles lui reprochent. ""Les raisons pour lesquelles le gouvernement du Tchad a déclaré notre Ambassadeur à N'Djamena persona non grata ne sont absolument pas compréhensibles. Nous sommes en contact à ce sujet avec le gouvernement du Tchad"", a indiqué à l'AFP une source au ministère allemand des Affaires étrangères. M.Kricke est ambassadeur au Tchad depuis juillet 2021, après avoir occupé des fonctions similaires au Niger, en Angola et aux Philippines. Il a également été représentant spécial de l'Allemagne pour le Sahel. Une source gouvernementale a affirmé à l'AFP sous couvert d'anonymat que les autorités reprochaient notamment au diplomate de ""trop s'immiscer"" dans la ""gouvernance du pays"", ainsi que ""des propos tendant à diviser les tchadiens"". M.Kricke avait reçu plusieurs ""rappels à l'ordre"", a assuré la même source.","[[['L\'ambassadeur d\'Allemagne au Tchad va être expulsé dans un délai de 48 heures pour ""attitude discourtoise"" et ""non-respect des usages diplomatiques"", a annoncé le gouvernement tchadien vendredi.'], ['Le gouvernement ""prie SEM (Son Excellence Monsieur, ndlr) Jan Christian Gordon Kricke, ambassadeur extraordinaire et plénipotentiaire de la République fédérale d\'Allemagne, de quitter le territoire tchadien dans un délai de 48h"", a indiqué le porte-parole du gouvernement Aziz Mahamat Saleh, dans un communiqué.'], [""Les autorités n'ont pas donné de détails sur les faits qu'elles lui reprochent.""], ['""Les raisons pour lesquelles le gouvernement du Tchad a déclaré notre Ambassadeur à N\'Djamena persona non grata ne sont absolument pas compréhensibles.'], ['Nous sommes en contact à ce sujet avec le gouvernement du Tchad"", a indiqué à l\'AFP une source au ministère allemand des Affaires étrangères.'], ['M.Kricke est ambassadeur au Tchad depuis juillet 2021, après avoir occupé des fonctions similaires au Niger, en Angola et aux Philippines.'], [""Il a également été représentant spécial de l'Allemagne pour le Sahel.""], ['Une source gouvernementale a affirmé à l\'AFP sous couvert d\'anonymat que les autorités reprochaient notamment au diplomate de ""trop s\'immiscer"" dans la ""gouvernance du pays"", ainsi que ""des propos tendant à diviser les tchadiens"".'], ['M.Kricke avait reçu plusieurs ""rappels à l\'ordre"", a assuré la même source.']]]","[[['ambassadeur', 'allemagne', 'tchad', 'délai', 'heures', 'attitude', 'usages', 'diplomatiques', 'gouvernement', 'tchadien', 'vendredi'], ['gouvernement', 'excellence', 'monsieur', 'ndlr', 'jan', 'christian', 'kricke', 'ambassadeur', 'extraordinaire', 'plénipotentiaire', 'république', 'fédérale', 'allemagne', 'territoire', 'tchadien', 'délai', 'gouvernement', 'communiqué'], ['autorités', 'détails', 'faits'], ['raisons', 'gouvernement', 'tchad', 'ambassadeur', 'compréhensibles'], ['contact', 'sujet', 'gouvernement', 'tchad', 'afp', 'source', 'ministère', 'allemand', 'affaires', 'étrangères'], ['ambassadeur', 'tchad', 'juillet', 'fonctions', 'similaires', 'angola', 'philippines'], ['représentant', 'spécial', 'allemagne', 'sahel'], ['source', 'gouvernementale', 'afp', 'couvert', 'anonymat', 'autorités', 'diplomate', 'gouvernance', 'pays', 'propos', 'tchadiens'], ['rappels', 'ordre', 'source']]]","[[['Allemagne', 'Tchad'], [""République fédérale d'Allemagne""], [], ['Tchad', 'Ambassadeur', ""N'Djamena""], ['Tchad'], ['Tchad', 'Niger', 'Angola', 'Philippines'], ['Allemagne', 'Sahel'], ['tchadiens'], []]]","[[[], ['SEM'], [], [], ['AFP', 'ministère allemand des Affaires étrangères'], [], [], ['AFP'], ['M.Kricke']]]","[[[], ['Excellence Monsieur', 'Jan Christian Gordon Kricke', 'Aziz Mahamat Saleh'], [], [], [], [], [], [], []]]","{'ambassadeur': 4, 'allemagne': 3, 'tchad': 4, 'délai': 2, 'heures': 1, 'attitude': 1, 'usages': 1, 'diplomatiques': 1, 'gouvernement': 5, 'tchadien': 2, 'vendredi': 1, 'excellence': 1, 'monsieur': 1, 'ndlr': 1, 'jan': 1, 'christian': 1, 'kricke': 1, 'extraordinaire': 1, 'plénipotentiaire': 1, 'république': 1, 'fédérale': 1, 'territoire': 1, 'communiqué': 1, 'autorités': 2, 'détails': 1, 'faits': 1, 'raisons': 1, 'compréhensibles': 1, 'contact': 1, 'sujet': 1, 'afp': 2, 'source': 3, 'ministère': 1, 'allemand': 1, 'affaires': 1, 'étrangères': 1, 'juillet': 1, 'fonctions': 1, 'similaires': 1, 'angola': 1, 'philippines': 1, 'représentant': 1, 'spécial': 1, 'sahel': 1, 'gouvernementale': 1, 'couvert': 1, 'anonymat': 1, 'diplomate': 1, 'gouvernance': 1, 'pays': 1, 'propos': 1, 'tchadiens': 1, 'rappels': 1, 'ordre': 1}","{'Allemagne': 2, 'Tchad': 4, ""République fédérale d'Allemagne"": 1, 'Ambassadeur': 1, ""N'Djamena"": 1, 'Niger': 1, 'Angola': 1, 'Philippines': 1, 'Sahel': 1, 'tchadiens': 1}","{'SEM': 1, 'AFP': 2, 'ministère allemand des Affaires étrangères': 1, 'M.Kricke': 1}","{'Excellence Monsieur': 1, 'Jan Christian Gordon Kricke': 1, 'Aziz Mahamat Saleh': 1}",2023,4,7
1680904800,https://fr.sputniknews.africa/20230408/elon-musk-ironise-sur-le-pentagone-qui-narrive-pas-a-supprimer-des-infos-secretes-sur-lukraine-1058438249.html,Elon Musk ironise sur le Pentagone qui n’arrive pas à supprimer des infos secrètes sur l’Ukraine,"Face à la fuite de documents secrets détaillant les plans des États-Unis concernant l'aide à Kiev dans son conflit avec Moscou, le Pentagone a dit essayer en vain de les supprimer du Web. Elon Musk s’est montré sarcastique à l’égard de...","Le milliardaire américain Elon Musk a tourné en dérision, sur Twitter, réseau qui lui appartient, les tentatives du Pentagone de supprimer des réseaux sociaux les publications contenant des documents classifiés ayant fuité et concernant le conflit en Ukraine. La veille, le journal New York Times avait en effet indiqué que les responsables de la Maison-Blanche n'avaient pas encore réussi, jeudi au soir, à faire supprimer ces publications du Web. Une enquête sur cette fuite serait en cours. Yeah, you can totally delete things from the Internet – that works perfectly and doesn’t draw attention to whatever you were trying to hide at all— Elon Musk (@elonmusk) April 7, 2023 ""Oui, vous pouvez totalement supprimer des choses d'Internet, cela fonctionne parfaitement et n'attire pas du tout l'attention sur ce que vous essayez de cacher"", a ironisé Musk.Pas de surpriseUn des documents en question parle notamment de 12 brigades en train d'être formées pour l'Ukraine, dont neuf apparemment par les États-Unis et d'autres alliés de l'Otan.De son côté, le Kremlin a dit ne pas avoir de doutes sur la participation des États-Unis ou de l'Otan, directe ou indirecte, au conflit en Ukraine.Elon Musk a lui aussi été récemment confronté à une fuite de données. Des fractions du code source de Twitter ont été partagées gratuitement il y a plusieurs mois sur GitHub, une plateforme en ligne pour les développeurs de logiciels. Elles n’ont été retirées que le 24 mars 2023 après un recours juridique.","[[['Le milliardaire américain Elon Musk a tourné en dérision, sur Twitter, réseau qui lui appartient, les tentatives du Pentagone de supprimer des réseaux sociaux les publications contenant des documents classifiés ayant fuité et concernant le conflit en Ukraine.'], [""La veille, le journal New York Times avait en effet indiqué que les responsables de la Maison-Blanche n'avaient pas encore réussi, jeudi au soir, à faire supprimer ces publications du Web.""], ['Une enquête sur cette fuite serait en cours.'], ['Yeah, you can totally delete things from the Internet – that works perfectly and doesn’t draw attention to whatever you were trying to hide at all— Elon Musk (@elonmusk) April 7, 2023 ""Oui, vous pouvez totalement supprimer des choses d\'Internet, cela fonctionne parfaitement et n\'attire pas du tout l\'attention sur ce que vous essayez de cacher"", a ironisé Musk.Pas de surpriseUn des documents en question parle notamment de 12 brigades en train d\'être formées pour l\'Ukraine, dont neuf apparemment par les États-Unis et d\'autres alliés de l\'Otan.De son côté, le Kremlin a dit ne pas avoir de doutes sur la participation des États-Unis ou de l\'Otan, directe ou indirecte, au conflit en Ukraine.Elon Musk a lui aussi été récemment confronté à une fuite de données.'], ['Des fractions du code source de Twitter ont été partagées gratuitement il y a plusieurs mois sur GitHub, une plateforme en ligne pour les développeurs de logiciels.'], ['Elles n’ont été retirées que le 24 mars 2023 après un recours juridique.']]]","[[['milliardaire', 'américain', 'elon', 'musk', 'dérision', 'twitter', 'réseau', 'tentatives', 'pentagone', 'réseaux', 'sociaux', 'publications', 'documents', 'fuité', 'conflit', 'ukraine'], ['veille', 'journal', 'new', 'responsables', 'maison', 'blanche', 'jeudi', 'soir', 'publications', 'web'], ['enquête', 'fuite', 'cours'], ['yeah', 'you', 'internet', 'you', 'musk', 'april', 'oui', 'choses', 'internet', 'attention', 'documents', 'question', 'brigades', 'train', 'ukraine', 'alliés', 'côté', 'kremlin', 'doutes', 'participation', 'otan', 'indirecte', 'conflit', 'musk', 'fuite', 'données'], ['fractions', 'code', 'source', 'twitter', 'gratuitement', 'mois', 'github', 'plateforme', 'ligne', 'développeurs', 'logiciels'], ['mars', 'recours', 'juridique']]]","[[['Pentagone', 'Ukraine'], ['Maison-Blanche'], [], ['surpriseUn', 'Ukraine', 'États-Unis', 'Kremlin', 'États-Unis', 'Ukraine'], [], []]]","[[[], ['New York Times'], [], ['April', 'Musk', 'Otan', 'Otan'], [], []]]","[[['Elon Musk'], [], [], ['Elon Musk', 'Elon Musk'], [], []]]","{'milliardaire': 1, 'américain': 1, 'elon': 1, 'musk': 3, 'dérision': 1, 'twitter': 2, 'réseau': 1, 'tentatives': 1, 'pentagone': 1, 'réseaux': 1, 'sociaux': 1, 'publications': 2, 'documents': 2, 'fuité': 1, 'conflit': 2, 'ukraine': 2, 'veille': 1, 'journal': 1, 'new': 1, 'responsables': 1, 'maison': 1, 'blanche': 1, 'jeudi': 1, 'soir': 1, 'web': 1, 'enquête': 1, 'fuite': 2, 'cours': 1, 'yeah': 1, 'you': 2, 'internet': 2, 'april': 1, 'oui': 1, 'choses': 1, 'attention': 1, 'question': 1, 'brigades': 1, 'train': 1, 'alliés': 1, 'côté': 1, 'kremlin': 1, 'doutes': 1, 'participation': 1, 'otan': 1, 'indirecte': 1, 'données': 1, 'fractions': 1, 'code': 1, 'source': 1, 'gratuitement': 1, 'mois': 1, 'github': 1, 'plateforme': 1, 'ligne': 1, 'développeurs': 1, 'logiciels': 1, 'mars': 1, 'recours': 1, 'juridique': 1}","{'Pentagone': 1, 'Ukraine': 3, 'Maison-Blanche': 1, 'surpriseUn': 1, 'États-Unis': 2, 'Kremlin': 1}","{'New York Times': 1, 'April': 1, 'Musk': 1, 'Otan': 2}",{'Elon Musk': 3},2023,4,7
