timestamp,url,title,description,content,content-segmented,kws-l,loc-l,org-l,per-l,kws,loc,org,per,year,month,day
1668380400,https://fr.sputniknews.africa/20221114/espagne-des-militants-eclaboussent-lexposition-dune-momie-egyptienne---video-1056817819.html,Espagne: des militants éclaboussent l'exposition d'une momie égyptienne - vidéo,Des militants écologistes ont éclaboussé dimanche la cage en verre d'une réplique de momie au Musée Egyptien de Barcelone (est) afin de dénoncer l'inaction des gouvernements réunis pour la COP27 en Egypte face au changement climatique.,"Deux jeunes activistes, un homme et une femme appartenant au collectif ""Futuro Vegetal"", ont aspergé à l'aide de bouteilles en plastique de Coca-Cola la cage en verre de faux pétrole, puis les murs de faux sang. Ils ont ensuite dévoilé une grande banderole appelant à la ""Justice Climatique"", dénonçant une ""COPCA COLA"" en référence au sommet de la COP27 sur le climat réunie à Charm el-Cheik, en Egypte, et à Coca-Cola, l'un des sponsors officiels de la conférence. ▶️Dos militantes de @FuturoVegetal ""bañan"" con un líquido que simulaba ""petróleo"" la vitrina de una réplica de una momia faraónica en el Museo Egipcio de #Barcelona.Han rociado la pared con ""sangre falsa"" y han desplegado una pancarta con el mensaje: ""COPCA COLA +2.5º"" pic.twitter.com/O26eews4TG— Noticias CMM (@CMM_noticias) November 13, 2022 Le géant des boissons gazeuses est dénoncé par de nombreuses ONG de défense de l'environnement pour des activités qu'elles estiment polluantes à travers le monde, notamment en raison de la production massive de bouteilles en plastique.Une fois la police arrivée, les jeunes militants se sont montrés coopératifs et n'ont pas été arrêtés. Le Musée Egyptien a toutefois fait savoir qu'il comptait porter plainte en raison des dommages occasionnés.Des militants du même collectif, affilié au collectif Extinction rebellion, avaient collé leur main le 5 novembre sur les cadres de tableaux de Francisco Goya au Musée du Prado à Madrid pour attirer l'attention sur le réchauffement climatique, une action jugée ""injustifiable"" par le ministre espagnol de la Culture.Près d'une centaine de musées internationaux se sont déclarés ""profondément choqués"" jeudi par les actions visant des oeuvres d'art organisées par des militants de la cause environnementale, et ont rappelé leur rôle de conservation.Actions en abondance Plusieurs autres actions de ce type ont été menées ces dernières semaines par des militants du climat, qui ont pris pour cible des bâtiments emblématiques, mais aussi des célèbres oeuvres d'art dans plusieurs villes d'Europe. Des militants écologistes ont tenté sans succès vendredi à Oslo de se coller les mains sur ""Le Cri"", le chef d'oeuvre emblématique du peintre norvégien Edvard Munch, pour dénoncer l'industrie pétrolière en Norvège.Au début du mois, deux militantes de ""Last Generation"" avaient répandu de la purée de pommes de terre sur la vitre protégeant la toile de Claude Monet ""Les Meules"", au musée Barberini de Potsdam, en Allemagne.Des militants se sont également collés sur la vitre protégeant la ""Fille à la perle"" de Johannes Vermeer dans un musée aux Pays-Bas. D'autres ont jeté de la soupe sur celle qui protégeait les ""Tournesols"" de Vincent van Gogh à la National Gallery de Londres.","[[['Deux jeunes activistes, un homme et une femme appartenant au collectif ""Futuro Vegetal"", ont aspergé à l\'aide de bouteilles en plastique de Coca-Cola la cage en verre de faux pétrole, puis les murs de faux sang.', 'Ils ont ensuite dévoilé une grande banderole appelant à la ""Justice Climatique"", dénonçant une ""COPCA COLA"" en référence au sommet de la COP27 sur le climat réunie à Charm el-Cheik, en Egypte, et à Coca-Cola, l\'un des sponsors officiels de la conférence.', '▶️Dos militantes de @FuturoVegetal ""bañan"" con un líquido que simulaba ""petróleo"" la vitrina de una réplica de una momia faraónica en el Museo Egipcio de #Barcelona.Han rociado la pared con ""sangre falsa"" y han desplegado una pancarta con el mensaje: ""COPCA COLA +2.5º"" pic.twitter.com/O26eews4TG— Noticias CMM (@CMM_noticias) November 13, 2022 Le géant des boissons gazeuses est dénoncé par de nombreuses ONG de défense de l\'environnement pour des activités qu\'elles estiment polluantes à travers le monde, notamment en raison de la production massive de bouteilles en plastique.Une fois la police arrivée, les jeunes militants se sont montrés coopératifs et n\'ont pas été arrêtés.', 'Le Musée Egyptien a toutefois fait savoir qu\'il comptait porter plainte en raison des dommages occasionnés.Des militants du même collectif, affilié au collectif Extinction rebellion, avaient collé leur main le 5 novembre sur les cadres de tableaux de Francisco Goya au Musée du Prado à Madrid pour attirer l\'attention sur le réchauffement climatique, une action jugée ""injustifiable"" par le ministre espagnol de la Culture.Près d\'une centaine de musées internationaux se sont déclarés ""profondément choqués"" jeudi par les actions visant des oeuvres d\'art organisées par des militants de la cause environnementale, et ont rappelé leur rôle de conservation.Actions en abondance Plusieurs autres actions de ce type ont été menées ces dernières semaines par des militants du climat, qui ont pris pour cible des bâtiments emblématiques, mais aussi des célèbres oeuvres d\'art dans plusieurs villes d\'Europe.', 'Des militants écologistes ont tenté sans succès vendredi à Oslo de se coller les mains sur ""Le Cri"", le chef d\'oeuvre emblématique du peintre norvégien Edvard Munch, pour dénoncer l\'industrie pétrolière en Norvège.Au début du mois, deux militantes de ""Last Generation"" avaient répandu de la purée de pommes de terre sur la vitre protégeant la toile de Claude Monet ""Les Meules"", au musée Barberini de Potsdam, en Allemagne.Des militants se sont également collés sur la vitre protégeant la ""Fille à la perle"" de Johannes Vermeer dans un musée aux Pays-Bas.', 'D\'autres ont jeté de la soupe sur celle qui protégeait les ""Tournesols"" de Vincent van Gogh à la National Gallery de Londres.']]]","[[['jeune', 'activiste', 'homme', 'femme', 'collectif', 'futuro', 'vegetal', 'aide', 'bouteille', 'plastique', 'cage', 'verre', 'faux', 'pétrole', 'mur', 'faux', 'sang'], ['grand', 'banderole', 'justice', 'climatique', 'copca', 'cola', 'référence', 'sommet', 'climat', 'charm', 'cheik', 'egypte', 'sponsor', 'officiel', 'conférence'], ['militant', 'bañan', 'con', 'líquido', 'simulaba', 'petróleo', 'vitrina', 'una', 'réplica', 'una', 'momia', 'faraónica', 'museo', 'egipcio', 'rociado', 'pared', 'con', 'falsa', 'han', 'desplegado', 'con', 'mensaje', 'copca', 'cola', 'cmm', 'november', 'géant', 'boisson', 'gazeux', 'ong', 'défense', 'environnement', 'activité', 'polluant', 'travers', 'monde', 'raison', 'production', 'massif', 'bouteille', 'fois', 'police', 'jeune', 'militant', 'coopératif'], ['musée', 'egyptien', 'plainte', 'raison', 'dommage', 'militant', 'collectif', 'collectif', 'extinction', 'rebellion', 'main', 'novembre', 'cadre', 'tableau', 'francisco', 'goya', 'musée', 'prado', 'madrid', 'attention', 'réchauffement', 'climatique', 'action', 'injustifiable', 'ministre', 'espagnol', 'centaine', 'musée', 'international', 'jeudi', 'action', 'oeuvre', 'art', 'militant', 'cause', 'environnemental', 'rôle', 'abondance', 'action', 'type', 'dernier', 'semaine', 'militant', 'climat', 'cible', 'bâtiment', 'emblématique', 'célèbre', 'oeuvre', 'art', 'ville', 'europe'], ['militant', 'écologiste', 'succès', 'vendredi', 'oslo', 'main', 'cri', 'chef', 'oeuvre', 'emblématique', 'peintre', 'norvégien', 'edvard', 'munch', 'industrie', 'pétrolier', 'début', 'mois', 'militant', 'generation', 'purée', 'pomme', 'terre', 'vitre', 'toile', 'claude', 'monet', 'meule', 'musée', 'barberini', 'potsdam', 'militant', 'vitre', 'fille', 'perle', 'johannes', 'vermeer', 'musée', 'pays'], ['soupe', 'tournesol', 'vincent', 'national', 'gallery', 'londre']]]","[[[], ['Charm el-Cheik', 'Egypte'], ['el Museo Egipcio'], ['Musée Egyptien', 'Musée du Prado', 'Madrid', 'Europe'], ['Oslo', 'Norvège', 'musée Barberini', 'Potsdam', 'Allemagne', 'Pays-Bas'], ['National Gallery', 'Londres']]]","[[['Futuro Vegetal', 'Coca-Cola'], ['COLA', 'Coca-Cola'], ['Noticias CMM'], ['ministre espagnol de la Culture'], [], []]]","[[[], [], ['@FuturoVegetal', 'Han rociado', 'han desplegado una pancarta con el mensaje'], [], ['Edvard Munch', 'Claude Monet', 'Johannes Vermeer'], ['Vincent van Gogh']]]","{'jeune': 2, 'activiste': 1, 'homme': 1, 'femme': 1, 'collectif': 3, 'futuro': 1, 'vegetal': 1, 'aide': 1, 'bouteille': 2, 'plastique': 1, 'cage': 1, 'verre': 1, 'faux': 2, 'pétrole': 1, 'mur': 1, 'sang': 1, 'grand': 1, 'banderole': 1, 'justice': 1, 'climatique': 2, 'copca': 2, 'cola': 2, 'référence': 1, 'sommet': 1, 'climat': 2, 'charm': 1, 'cheik': 1, 'egypte': 1, 'sponsor': 1, 'officiel': 1, 'conférence': 1, 'militant': 8, 'bañan': 1, 'con': 3, 'líquido': 1, 'simulaba': 1, 'petróleo': 1, 'vitrina': 1, 'una': 2, 'réplica': 1, 'momia': 1, 'faraónica': 1, 'museo': 1, 'egipcio': 1, 'rociado': 1, 'pared': 1, 'falsa': 1, 'han': 1, 'desplegado': 1, 'mensaje': 1, 'cmm': 1, 'november': 1, 'géant': 1, 'boisson': 1, 'gazeux': 1, 'ong': 1, 'défense': 1, 'environnement': 1, 'activité': 1, 'polluant': 1, 'travers': 1, 'monde': 1, 'raison': 2, 'production': 1, 'massif': 1, 'fois': 1, 'police': 1, 'coopératif': 1, 'musée': 5, 'egyptien': 1, 'plainte': 1, 'dommage': 1, 'extinction': 1, 'rebellion': 1, 'main': 2, 'novembre': 1, 'cadre': 1, 'tableau': 1, 'francisco': 1, 'goya': 1, 'prado': 1, 'madrid': 1, 'attention': 1, 'réchauffement': 1, 'action': 3, 'injustifiable': 1, 'ministre': 1, 'espagnol': 1, 'centaine': 1, 'international': 1, 'jeudi': 1, 'oeuvre': 3, 'art': 2, 'cause': 1, 'environnemental': 1, 'rôle': 1, 'abondance': 1, 'type': 1, 'dernier': 1, 'semaine': 1, 'cible': 1, 'bâtiment': 1, 'emblématique': 2, 'célèbre': 1, 'ville': 1, 'europe': 1, 'écologiste': 1, 'succès': 1, 'vendredi': 1, 'oslo': 1, 'cri': 1, 'chef': 1, 'peintre': 1, 'norvégien': 1, 'edvard': 1, 'munch': 1, 'industrie': 1, 'pétrolier': 1, 'début': 1, 'mois': 1, 'generation': 1, 'purée': 1, 'pomme': 1, 'terre': 1, 'vitre': 2, 'toile': 1, 'claude': 1, 'monet': 1, 'meule': 1, 'barberini': 1, 'potsdam': 1, 'fille': 1, 'perle': 1, 'johannes': 1, 'vermeer': 1, 'pays': 1, 'soupe': 1, 'tournesol': 1, 'vincent': 1, 'national': 1, 'gallery': 1, 'londre': 1}","{'Charm el-Cheik': 1, 'Egypte': 1, 'el Museo Egipcio': 1, 'Musée Egyptien': 1, 'Musée du Prado': 1, 'Madrid': 1, 'Europe': 1, 'Oslo': 1, 'Norvège': 1, 'musée Barberini': 1, 'Potsdam': 1, 'Allemagne': 1, 'Pays-Bas': 1, 'National Gallery': 1, 'Londres': 1}","{'Futuro Vegetal': 1, 'Coca-Cola': 2, 'COLA': 1, 'Noticias CMM': 1, 'ministre espagnol de la Culture': 1}","{'@FuturoVegetal': 1, 'Han rociado': 1, 'han desplegado una pancarta con el mensaje': 1, 'Edvard Munch': 1, 'Claude Monet': 1, 'Johannes Vermeer': 1, 'Vincent van Gogh': 1}",2022,11,13
1668380400,https://fr.sputniknews.africa/20221114/serguei-lavrov-serait-hospitalise-a-son-arrive-au-sommet-du-g20-1056817321.html,"""Une haute voltige de fake news"": Moscou dément l'hospitalisation de Lavrov à Bali","Commentant les rapports faits сe 14 novembre par nombre de médias occidentaux sur sa soi-disant hospitalisation à Bali, Sergueï Lavrov a expliqué que c'était ""un jeu qui n'est pas nouveau dans la politique"". Il a souhaité aux journalistes...","La diplomatie russe a démenti les rapports sur l'hospitalisation de Sergueï Lavrov aussitôt que ces informations ont été relayées par nombre de médias occidentaux.[Je souhaite] ""aux journalistes occidentaux d'être plus honnêtes qu'ils ne le sont et d'écrire plus souvent la vérité"", a fait remarquer le ministre dans une vidéo publiée par la porte-parole de la diplomatie russe Maria Zakharova.La séquence montre le ministre russe en tenue d'été en train de consulter des papiers sur un balcon non loin de la forêt. M.Lavrov a également expliqué que c'était ""un jeu qui n'est pas nouveau dans la politique"".Auparavant, citant les responsables indonésiens, l'agence Associated Presse a fait part de l'hospitalisation du ministre russe des Affaires étrangères. Avant de publier cette vidéo, Maria Zakharova a publié un démenti des informations sur la soi-disant hospitalisation du chef de la diplomatie russe.""Avec Sergueï Victorovitch [Lavrov, ndlr], nous sommes en train de lire le fil d'actualités et n’en croyons pas nos yeux: il se trouve qu'il est hospitalisé. C'est certainement une haute voltige de fake news"", a-t-elle écrit sur sa chaîne Telegram.","[[[""La diplomatie russe a démenti les rapports sur l'hospitalisation de Sergueï Lavrov aussitôt que ces informations ont été relayées par nombre de médias occidentaux."", '[Je souhaite] ""aux journalistes occidentaux d\'être plus honnêtes qu\'ils ne le sont et d\'écrire plus souvent la vérité"", a fait remarquer le ministre dans une vidéo publiée par la porte-parole de la diplomatie russe Maria Zakharova.La séquence montre le ministre russe en tenue d\'été en train de consulter des papiers sur un balcon non loin de la forêt.', 'M.Lavrov a également expliqué que c\'était ""un jeu qui n\'est pas nouveau dans la politique"".Auparavant, citant les responsables indonésiens, l\'agence Associated Presse a fait part de l\'hospitalisation du ministre russe des Affaires étrangères.', 'Avant de publier cette vidéo, Maria Zakharova a publié un démenti des informations sur la soi-disant hospitalisation du chef de la diplomatie russe.', '""Avec Sergueï Victorovitch [Lavrov, ndlr], nous sommes en train de lire le fil d\'actualités et n’en croyons pas nos yeux: il se trouve qu\'il est hospitalisé.', 'C\'est certainement une haute voltige de fake news"", a-t-elle écrit sur sa chaîne Telegram.']]]","[[['diplomatie', 'russe', 'rapport', 'hospitalisation', 'sergueï', 'lavrov', 'information', 'nombre', 'média', 'occidental'], ['journaliste', 'occidental', 'honnête', 'vérité', 'ministre', 'vidéo', 'diplomatie', 'russe', 'séquence', 'ministre', 'russe', 'tenue', 'train', 'papier', 'balcon', 'forêt'], ['jeu', 'responsable', 'indonésien', 'agence', 'presse', 'part', 'hospitalisation', 'ministre', 'russe', 'affaire', 'étranger'], ['vidéo', 'zakharova', 'démenti', 'information', 'hospitalisation', 'chef', 'diplomatie', 'russe'], ['sergueï', 'victorovitch', 'lavrov', 'ndlr', 'train', 'fil', 'actualité', 'oeil'], ['haut', 'voltige', 'news', 'chaîne', 'telegram']]]","[[[], [], [], [], [], []]]","[[[], [], ['Associated Presse', 'ministre russe des Affaires étrangères'], [], [], ['Telegram']]]","[[['Sergueï Lavrov'], ['Maria Zakharova'], ['M.Lavrov'], ['Maria Zakharova'], ['Sergueï Victorovitch', 'Lavrov'], []]]","{'diplomatie': 3, 'russe': 5, 'rapport': 1, 'hospitalisation': 3, 'sergueï': 2, 'lavrov': 2, 'information': 2, 'nombre': 1, 'média': 1, 'occidental': 2, 'journaliste': 1, 'honnête': 1, 'vérité': 1, 'ministre': 3, 'vidéo': 2, 'séquence': 1, 'tenue': 1, 'train': 2, 'papier': 1, 'balcon': 1, 'forêt': 1, 'jeu': 1, 'responsable': 1, 'indonésien': 1, 'agence': 1, 'presse': 1, 'part': 1, 'affaire': 1, 'étranger': 1, 'zakharova': 1, 'démenti': 1, 'chef': 1, 'victorovitch': 1, 'ndlr': 1, 'fil': 1, 'actualité': 1, 'oeil': 1, 'haut': 1, 'voltige': 1, 'news': 1, 'chaîne': 1, 'telegram': 1}",{},"{'Associated Presse': 1, 'ministre russe des Affaires étrangères': 1, 'Telegram': 1}","{'Sergueï Lavrov': 1, 'Maria Zakharova': 2, 'M.Lavrov': 1, 'Sergueï Victorovitch': 1, 'Lavrov': 1}",2022,11,13
1668380400,https://fr.sputniknews.africa/20221114/lotan-ne-peut-pas-vivre-sans-un-ennemi-assure-un-vice-ministre-russe-1056815124.html,"""L'Otan ne peut pas vivre sans un ennemi"", assure un vice-ministre russe","Pour l'Alliance de l'Atlantique Nord, il est impossible de continuer d'exister si elle n'a pas d'ennemi, avance un diplomate russe de haut rang. Aujourd’hui, en quête de nouvelles zones d'influence, elle progresse en Asie en s'approchant...","""L'Otan est une organisation qui ne peut pas vivre sans un ennemi. Elle mourra sans un ennemi. L'essentiel est de créer une image de l'ennemi en progressant vers les frontières de cet adversaire potentiel.""C'est ce qu'a déclaré à Sputnik le vice-ministre russe des Affaires étrangères Alexandre Grouchko. Et d'ajouter que l'Asie a été proclamée nouvelle zone d'intérêt de l'Alliance, la zone de défense de l'Otan se rapprochant des frontières chinoises.Les intentions expansionnistes de l'OtanLe chef de la diplomatie russe Sergueï Lavrov avait déclaré que Moscou et Pékin étaient unis en défendant le rôle de l’Association des nations de l'Asie du Sud-Est (ASEAN) mais que l'Occident avait ses plans quant à la coopération entre ses États membres. Les États-Unis et leurs alliés de l'Otan tentent actuellement de ""prendre en main"" l'espace de l'ASEAN, qui possède une structure de sécurité et de coopération inclusive, ouverte et juste, a-t-il noté à l'issue du sommet de l'Asie du Sud-Est à Phnom Penh, au Cambodge.Selon le ministre, ces tentatives se font notamment à l'aide de la militarisation de la région en vue de contenir la Chine et de limiter les intérêts russes en Asie-Pacifique.Un comportement ""irrationnel""Dans le même entretien, Alexandre Grouchko a aussi qualifié d'""irrationnel"" le comportement de l'Occident. Cela concerne notamment les discussions sur une éventuelle adhésion de l'Ukraine à l'Otan.""L'élargissement de l'Otan est un processus qui n'a rien à voir avec les intérêts de la sécurité de l'Alliance"", alors que les critères formulés pour sa politique de portes ouvertes disent que tout élargissement doit renforcer sa sécurité. Or, en réalité, tout élargissement l'affaiblit, selon le diplomate. Quant à une éventuelle adhésion de la Suède et de la Finlande, elle créera une ligne de contact entre l'Alliance et la Russie longue de 1.200 km. Ceci alors que Moscou a été désigné comme principal adversaire et menace pour l'Alliance.","[[['""L\'Otan est une organisation qui ne peut pas vivre sans un ennemi.', 'Elle mourra sans un ennemi.', ""L'essentiel est de créer une image de l'ennemi en progressant vers les frontières de cet adversaire potentiel."", '""C\'est ce qu\'a déclaré à Sputnik le vice-ministre russe des Affaires étrangères Alexandre Grouchko.', ""Et d'ajouter que l'Asie a été proclamée nouvelle zone d'intérêt de l'Alliance, la zone de défense de l'Otan se rapprochant des frontières chinoises.Les intentions expansionnistes de l'OtanLe chef de la diplomatie russe Sergueï Lavrov avait déclaré que Moscou et Pékin étaient unis en défendant le rôle de l’Association des nations de l'Asie du Sud-Est (ASEAN) mais que l'Occident avait ses plans quant à la coopération entre ses États membres."", 'Les États-Unis et leurs alliés de l\'Otan tentent actuellement de ""prendre en main"" l\'espace de l\'ASEAN, qui possède une structure de sécurité et de coopération inclusive, ouverte et juste, a-t-il noté à l\'issue du sommet de l\'Asie du Sud-Est à Phnom Penh, au Cambodge.Selon le ministre, ces tentatives se font notamment à l\'aide de la militarisation de la région en vue de contenir la Chine et de limiter les intérêts russes en Asie-Pacifique.Un comportement ""irrationnel""Dans le même entretien, Alexandre Grouchko a aussi qualifié d\'""irrationnel"" le comportement de l\'Occident.', ""Cela concerne notamment les discussions sur une éventuelle adhésion de l'Ukraine à l'Otan."", '""L\'élargissement de l\'Otan est un processus qui n\'a rien à voir avec les intérêts de la sécurité de l\'Alliance"", alors que les critères formulés pour sa politique de portes ouvertes disent que tout élargissement doit renforcer sa sécurité.', ""Or, en réalité, tout élargissement l'affaiblit, selon le diplomate."", ""Quant à une éventuelle adhésion de la Suède et de la Finlande, elle créera une ligne de contact entre l'Alliance et la Russie longue de 1.200 km."", ""Ceci alors que Moscou a été désigné comme principal adversaire et menace pour l'Alliance.""]]]","[[['otan', 'organisation', 'ennemi'], ['ennemi'], ['essentiel', 'image', 'ennemi', 'frontière', 'adversaire', 'potentiel'], ['sputnik', 'russe', 'affaire', 'étranger', 'alexandre', 'grouchko'], ['asie', 'nouveau', 'zone', 'intérêt', 'alliance', 'zone', 'défense', 'otan', 'frontière', 'intention', 'expansionniste', 'otanle', 'chef', 'diplomatie', 'russe', 'sergueï', 'lavrov', 'moscou', 'pékin', 'rôle', 'association', 'nation', 'asie', 'asean', 'occident', 'plan', 'coopération', 'état', 'membre'], ['allié', 'otan', 'main', 'espace', 'asean', 'structure', 'sécurité', 'coopération', 'inclusif', 'issue', 'sommet', 'asie', 'penh', 'ministre', 'tentative', 'aide', 'militarisation', 'région', 'vue', 'chine', 'intérêt', 'russe', 'comportement', 'entretien', 'alexandre', 'grouchko', 'comportement', 'occident'], ['discussion', 'éventuel', 'adhésion', 'ukraine', 'otan'], ['élargissement', 'otan', 'processus', 'intérêt', 'sécurité', 'alliance', 'critère', 'politique', 'porte', 'ouvert', 'élargissement', 'sécurité'], ['réalité', 'élargissement', 'diplomate'], ['éventuel', 'adhésion', 'suède', 'finlande', 'ligne', 'contact', 'alliance', 'russie', 'long', 'kilomètre'], ['moscou', 'principal', 'adversaire', 'alliance']]]","[[[], [], [], [], ['Asie', 'Moscou', 'Pékin', 'Occident', 'États'], ['États-Unis', 'Asie du Sud-Est', 'Phnom Penh', 'Cambodge', 'Chine', 'Asie-Pacifique', 'Occident'], ['Ukraine'], ['Alliance'], [], ['Suède', 'Finlande'], ['Moscou']]]","[[['Otan'], [], [], ['Sputnik'], ['Alliance', 'Otan', ""Association des nations de l'Asie du Sud-Est"", 'ASEAN'], ['Otan', 'ASEAN'], ['Otan'], ['Otan'], [], ['Alliance et la Russie longue'], ['Alliance']]]","[[[], [], [], ['Alexandre Grouchko'], ['Sergueï Lavrov'], ['Alexandre Grouchko'], [], [], [], [], []]]","{'otan': 5, 'organisation': 1, 'ennemi': 3, 'essentiel': 1, 'image': 1, 'frontière': 2, 'adversaire': 2, 'potentiel': 1, 'sputnik': 1, 'russe': 3, 'affaire': 1, 'étranger': 1, 'alexandre': 2, 'grouchko': 2, 'asie': 3, 'nouveau': 1, 'zone': 2, 'intérêt': 3, 'alliance': 4, 'défense': 1, 'intention': 1, 'expansionniste': 1, 'otanle': 1, 'chef': 1, 'diplomatie': 1, 'sergueï': 1, 'lavrov': 1, 'moscou': 2, 'pékin': 1, 'rôle': 1, 'association': 1, 'nation': 1, 'asean': 2, 'occident': 2, 'plan': 1, 'coopération': 2, 'état': 1, 'membre': 1, 'allié': 1, 'main': 1, 'espace': 1, 'structure': 1, 'sécurité': 3, 'inclusif': 1, 'issue': 1, 'sommet': 1, 'penh': 1, 'ministre': 1, 'tentative': 1, 'aide': 1, 'militarisation': 1, 'région': 1, 'vue': 1, 'chine': 1, 'comportement': 2, 'entretien': 1, 'discussion': 1, 'éventuel': 2, 'adhésion': 2, 'ukraine': 1, 'élargissement': 3, 'processus': 1, 'critère': 1, 'politique': 1, 'porte': 1, 'ouvert': 1, 'réalité': 1, 'diplomate': 1, 'suède': 1, 'finlande': 1, 'ligne': 1, 'contact': 1, 'russie': 1, 'long': 1, 'kilomètre': 1, 'principal': 1}","{'Asie': 1, 'Moscou': 2, 'Pékin': 1, 'Occident': 2, 'États': 1, 'États-Unis': 1, 'Asie du Sud-Est': 1, 'Phnom Penh': 1, 'Cambodge': 1, 'Chine': 1, 'Asie-Pacifique': 1, 'Ukraine': 1, 'Alliance': 1, 'Suède': 1, 'Finlande': 1}","{'Otan': 5, 'Sputnik': 1, 'Alliance': 2, ""Association des nations de l'Asie du Sud-Est"": 1, 'ASEAN': 2, 'Alliance et la Russie longue': 1}","{'Alexandre Grouchko': 2, 'Sergueï Lavrov': 1}",2022,11,13
