timestamp,url,title,description,content,content-segmented,kws-l,loc-l,org-l,per-l,kws,loc,org,per,year,month,day
1667862000,https://fr.sputniknews.africa/20221108/macron-annoncera-mercredi-la-fin-officielle-de-loperation-barkhane-au-sahel-1056756009.html,Macron annoncera mercredi la fin officielle de l'opération Barkhane au Sahel,"Emmanuel Macron annoncera mercredi officiellement la fin de l'opération antijihadiste Barkhane au Sahel, un peu moins de trois mois après le retrait des soldats français du Mali, a indiqué mardi l'Elysée.","Le chef de l'Etat, en visite à Toulon, prononcera un discours qui sera notamment ""l'occasion de marquer officiellement la fin de l'opération Barkhane et d'annoncer une adaptation significative de nos bases en Afrique"", a-t-on précisé de même source.Cette annonce sera sans conséquence sur le dispositif militaire français dans la région. Quelque 3.000 militaires français sont encore déployés au Niger, au Tchad et au Burkina Faso. Du contingent français reste en Afrique La force a compté jusqu'à 5.500 militaires au plus fort de son déploiement dans le Sahel. Poussée hors du Mali par la junte au pouvoir depuis 2020, l'armée française a définitivement quitté le pays mi-août, après neuf ans de lutte antidjihadiste.Elle reste pour autant dans la région et continue à lutter contre les groupes jihadistes liés à Al-Qaïda* ou au groupe Daech*, qui étendent progressivement leurs activités vers les pays du Golfe de Guinée. Selon l'Élysée, le principe est ""de réduire l'exposition et la visibilité de nos forces militaires en Afrique, de se concentrer sur la coopération et l'appui (...), principalement en termes d'équipement, de formation, de renseignement et de partenariat opérationnel lorsque les pays le souhaitent"". Départ du MaliDès l'annonce en février du départ du Mali, la France avait annoncé sa volonté de lancer des discussions avec les Etats africains sur ce dossier.Un récent rapport de l'Institut de Recherche stratégique de l'Ecole militaire (Irsem), dépendant du ministère français de la Défense, décrivait ainsi au Mali la ""prolifération de contenus de désinformation en ligne, le plus souvent destinés à dénigrer la présence française et justifier celle de la Russie"". Il constatait aussi la contagion au Burkina voisin. L'idée désormais est de continuer à agir, mais en discrétion. Aucun nouveau nom n'a été semble-t-il donné aux troupes désormais déployées. ""Nos soldats restent couverts, protégés, soutenus, administrés dans des conditions qui sont satisfaisantes"" mais l'annonce officielle est ""nécessaire localement"", a-t-on ajouté à l'Elysée. ""Dans le champ des perceptions, Barkhane continue d'occuper une présence très importante sur les réseaux sociaux. Il faut y mettre clairement un terme pour pouvoir basculer sur une autre logique"", a-t-on conclu. *Organisations terroristes interdites en Russie","[[['Le chef de l\'Etat, en visite à Toulon, prononcera un discours qui sera notamment ""l\'occasion de marquer officiellement la fin de l\'opération Barkhane et d\'annoncer une adaptation significative de nos bases en Afrique"", a-t-on précisé de même source.Cette annonce sera sans conséquence sur le dispositif militaire français dans la région.', 'Quelque 3.000 militaires français sont encore déployés au Niger, au Tchad et au Burkina Faso.', ""Du contingent français reste en Afrique La force a compté jusqu'à 5.500 militaires au plus fort de son déploiement dans le Sahel."", ""Poussée hors du Mali par la junte au pouvoir depuis 2020, l'armée française a définitivement quitté le pays mi-août, après neuf ans de lutte antidjihadiste.Elle reste pour autant dans la région et continue à lutter contre les groupes jihadistes liés à Al-Qaïda* ou au groupe Daech*, qui étendent progressivement leurs activités vers les pays du Golfe de Guinée."", 'Selon l\'Élysée, le principe est ""de réduire l\'exposition et la visibilité de nos forces militaires en Afrique, de se concentrer sur la coopération et l\'appui (...), principalement en termes d\'équipement, de formation, de renseignement et de partenariat opérationnel lorsque les pays le souhaitent"".', 'Départ du MaliDès l\'annonce en février du départ du Mali, la France avait annoncé sa volonté de lancer des discussions avec les Etats africains sur ce dossier.Un récent rapport de l\'Institut de Recherche stratégique de l\'Ecole militaire (Irsem), dépendant du ministère français de la Défense, décrivait ainsi au Mali la ""prolifération de contenus de désinformation en ligne, le plus souvent destinés à dénigrer la présence française et justifier celle de la Russie"".', 'Il constatait aussi la contagion au Burkina voisin.', ""L'idée désormais est de continuer à agir, mais en discrétion."", ""Aucun nouveau nom n'a été semble-t-il donné aux troupes désormais déployées."", '""Nos soldats restent couverts, protégés, soutenus, administrés dans des conditions qui sont satisfaisantes"" mais l\'annonce officielle est ""nécessaire localement"", a-t-on ajouté à l\'Elysée.', '""Dans le champ des perceptions, Barkhane continue d\'occuper une présence très importante sur les réseaux sociaux.', 'Il faut y mettre clairement un terme pour pouvoir basculer sur une autre logique"", a-t-on conclu.', '*Organisations terroristes interdites en Russie']]]","[[['chef', 'etat', 'visite', 'toulon', 'discours', 'occasion', 'fin', 'opération', 'barkhan', 'adaptation', 'significatif', 'base', 'afrique', 'conséquence', 'dispositif', 'militaire', 'français', 'région'], ['militaire', 'français', 'tchad', 'burkina', 'faso'], ['contingent', 'français', 'afrique', 'force', 'militaire', 'déploiement', 'sahel'], ['mali', 'junte', 'pouvoir', 'armée', 'français', 'pays', 'an', 'lutte', 'région', 'groupe', 'jihadiste', 'al', 'qaïda', 'groupe', 'daech', 'activité', 'pays', 'golfe', 'guinée'], ['élysée', 'principe', 'exposition', 'visibilité', 'force', 'militaire', 'afrique', 'coopération', 'appui', 'terme', 'équipement', 'formation', 'renseignement', 'partenariat', 'opérationnel', 'pays'], ['départ', 'malidè', 'annonce', 'février', 'départ', 'mali', 'france', 'volonté', 'discussion', 'etat', 'africain', 'récent', 'rapport', 'institut', 'recherche', 'stratégique', 'ecole', 'militaire', 'irsem', 'ministère', 'français', 'défense', 'mali', 'prolifération', 'contenu', 'désinformation', 'ligne', 'présence', 'français', 'russie'], ['contagion', 'burkina', 'voisin'], ['idée', 'discrétion'], ['nom', 'troupe'], ['soldat', 'couvert', 'condition', 'satisfaisant', 'officiel', 'nécessaire', 'elysée'], ['champ', 'perception', 'barkhane', 'présence', 'important', 'réseau', 'social'], ['terme', 'logique'], ['organisation', 'terroriste', 'russie']]]","[[['Etat', 'Toulon', 'Afrique'], ['Niger', 'Tchad', 'Burkina Faso'], ['Afrique', 'Sahel'], ['Mali', 'Golfe de Guinée'], ['Élysée', 'Afrique'], ['Mali', 'France', 'Irsem', 'Mali', 'Russie'], ['Burkina'], [], [], ['Elysée'], [], [], ['Russie']]]","[[[], [], [], ['Al-Qaïda', 'Daech'], [], [""Institut de Recherche stratégique de l'Ecole militaire""], [], [], [], [], [], [], []]]","[[[], [], [], [], [], [], [], [], [], [], ['Barkhane'], [], []]]","{'chef': 1, 'etat': 2, 'visite': 1, 'toulon': 1, 'discours': 1, 'occasion': 1, 'fin': 1, 'opération': 1, 'barkhan': 1, 'adaptation': 1, 'significatif': 1, 'base': 1, 'afrique': 3, 'conséquence': 1, 'dispositif': 1, 'militaire': 5, 'français': 6, 'région': 2, 'tchad': 1, 'burkina': 2, 'faso': 1, 'contingent': 1, 'force': 2, 'déploiement': 1, 'sahel': 1, 'mali': 3, 'junte': 1, 'pouvoir': 1, 'armée': 1, 'pays': 3, 'an': 1, 'lutte': 1, 'groupe': 2, 'jihadiste': 1, 'al': 1, 'qaïda': 1, 'daech': 1, 'activité': 1, 'golfe': 1, 'guinée': 1, 'élysée': 1, 'principe': 1, 'exposition': 1, 'visibilité': 1, 'coopération': 1, 'appui': 1, 'terme': 2, 'équipement': 1, 'formation': 1, 'renseignement': 1, 'partenariat': 1, 'opérationnel': 1, 'départ': 2, 'malidè': 1, 'annonce': 1, 'février': 1, 'france': 1, 'volonté': 1, 'discussion': 1, 'africain': 1, 'récent': 1, 'rapport': 1, 'institut': 1, 'recherche': 1, 'stratégique': 1, 'ecole': 1, 'irsem': 1, 'ministère': 1, 'défense': 1, 'prolifération': 1, 'contenu': 1, 'désinformation': 1, 'ligne': 1, 'présence': 2, 'russie': 2, 'contagion': 1, 'voisin': 1, 'idée': 1, 'discrétion': 1, 'nom': 1, 'troupe': 1, 'soldat': 1, 'couvert': 1, 'condition': 1, 'satisfaisant': 1, 'officiel': 1, 'nécessaire': 1, 'elysée': 1, 'champ': 1, 'perception': 1, 'barkhane': 1, 'important': 1, 'réseau': 1, 'social': 1, 'logique': 1, 'organisation': 1, 'terroriste': 1}","{'Etat': 1, 'Toulon': 1, 'Afrique': 3, 'Niger': 1, 'Tchad': 1, 'Burkina Faso': 1, 'Sahel': 1, 'Mali': 3, 'Golfe de Guinée': 1, 'Élysée': 1, 'France': 1, 'Irsem': 1, 'Russie': 2, 'Burkina': 1, 'Elysée': 1}","{'Al-Qaïda': 1, 'Daech': 1, ""Institut de Recherche stratégique de l'Ecole militaire"": 1}",{'Barkhane': 1},2022,11,7
1667862000,https://fr.sputniknews.africa/20221108/kinshasa-augmente-son-budget-defense-de-300-pour-2023-1056754207.html,Kinshasa augmente son budget défense de 300% pour 2023,L’engagement du gouvernement congolais à mettre à la disposition de ses forces de défense et de sécurité toutes les ressources nécessaires s’est traduit par l’augmentation de son budget militaire de 300% pour l’année prochaine.,"Intervenant vendredi 4 novembre lors d’une réunion du conseil des ministres, le Premier ministre de la République démocratique du Congo Sama Lukonde a réitéré le soutien du gouvernement au Président Félix Tshisekedi au lendemain de son message à la Nation appelant les Congolais à se mobiliser contre ""l’agression rwandaise via le M23"".Pour soutenir les efforts du Président afin de rétablir la paix, le Premier ministre a annoncé une hausse du budget défense pour 2023.Selon le compte-rendu du conseil des ministres présenté par le porte-parole du gouvernement Patrick Muyaya, M.Lukonde ""a renouvelé l’engagement du gouvernement de mettre à la disposition des forces de défense et de sécurité toutes les ressources nécessaires en vue de l’accomplissement de leur noble mission"".""Il (Sama Lukonde) a aussi souligné le fait que dans le projet de loi de finances pour l'exercice 2023 présenté et défendu devant la représentation nationale, le gouvernement a alloué 10,4% du budget global au secteur de la défense et de la sécurité, ce qui représente un accroissement de plus de 300% comparé au budget précédent"", a rapporté le porte-parole.En présentant le projet de budget pour l’année 2023 devant l’Assemblée nationale la semaine dernière, Sama Kukonde avait annoncé une hausse de près de 32% par rapport à l’année en cours, jusqu’à 14,6 milliards de dollars.Renforcement de l’armée et de l’industrie militaireIl a indiqué que l’allocation de fonds dans le secteur de la défense et de la sécurité à hauteur de 10,4% avait pour but une montée en puissance des forces armées et la redynamisation de l’industrie militaire.Le budget prévoit l’acquisition d’armes et de munitions de guerre, de moyens logistiques, une réhabilitation des infrastructures militaires, la formation et un recrutement.Un poste budgétaire prévoit le renforcement de l’armée de l’air. Pour son armement, la RDC s’approvisionne notamment en Russie.Accusations réciproquesLes relations sont très tendues entre le Rwanda et la RDC depuis la résurgence du M23 (Mouvement du 23 mars), une ancienne rébellion tutsie vaincue en 2013 qui a repris les armes fin 2021. Kinshasa, qui accuse Kigali de soutenir activement cette rébellion, a expulsé l'ambassadeur du Rwanda.Le Rwanda dément et accuse en retour la RDC - qui nie elle aussi - de collusion avec les FDLR (Forces démocratiques de libération du Rwanda), un mouvement de rebelles hutus rwandais, dont certains sont impliqués dans le génocide des Tutsis en 1994 au Rwanda.","[[['Intervenant vendredi 4 novembre lors d’une réunion du conseil des ministres, le Premier ministre de la République démocratique du Congo Sama Lukonde a réitéré le soutien du gouvernement au Président Félix Tshisekedi au lendemain de son message à la Nation appelant les Congolais à se mobiliser contre ""l’agression rwandaise via le M23"".Pour soutenir les efforts du Président afin de rétablir la paix, le Premier ministre a annoncé une hausse du budget défense pour 2023.Selon le compte-rendu du conseil des ministres présenté par le porte-parole du gouvernement Patrick Muyaya, M.Lukonde ""a renouvelé l’engagement du gouvernement de mettre à la disposition des forces de défense et de sécurité toutes les ressources nécessaires en vue de l’accomplissement de leur noble mission"".', '""Il (Sama Lukonde) a aussi souligné le fait que dans le projet de loi de finances pour l\'exercice 2023 présenté et défendu devant la représentation nationale, le gouvernement a alloué 10,4% du budget global au secteur de la défense et de la sécurité, ce qui représente un accroissement de plus de 300% comparé au budget précédent"", a rapporté le porte-parole.En présentant le projet de budget pour l’année 2023 devant l’Assemblée nationale la semaine dernière, Sama Kukonde avait annoncé une hausse de près de 32% par rapport à l’année en cours, jusqu’à 14,6 milliards de dollars.Renforcement de l’armée et de l’industrie militaireIl a indiqué que l’allocation de fonds dans le secteur de la défense et de la sécurité à hauteur de 10,4% avait pour but une montée en puissance des forces armées et la redynamisation de l’industrie militaire.Le budget prévoit l’acquisition d’armes et de munitions de guerre, de moyens logistiques, une réhabilitation des infrastructures militaires, la formation et un recrutement.Un poste budgétaire prévoit le renforcement de l’armée de l’air.', 'Pour son armement, la RDC s’approvisionne notamment en Russie.Accusations réciproquesLes relations sont très tendues entre le Rwanda et la RDC depuis la résurgence du M23 (Mouvement du 23 mars), une ancienne rébellion tutsie vaincue en 2013 qui a repris les armes fin 2021.', ""Kinshasa, qui accuse Kigali de soutenir activement cette rébellion, a expulsé l'ambassadeur du Rwanda.Le Rwanda dément et accuse en retour la RDC - qui nie elle aussi - de collusion avec les FDLR (Forces démocratiques de libération du Rwanda), un mouvement de rebelles hutus rwandais, dont certains sont impliqués dans le génocide des Tutsis en 1994 au Rwanda.""]]]","[[['vendredi', 'novembre', 'réunion', 'conseil', 'ministre', 'ministre', 'république', 'démocratique', 'congo', 'lukond', 'soutien', 'gouvernement', 'président', 'félix', 'tshisekedi', 'lendemain', 'message', 'nation', 'congolais', 'agression', 'rwandais', 'effort', 'président', 'paix', 'ministre', 'hausse', 'budget', 'défense', 'conseil', 'ministre', 'gouvernement', 'patrick', 'engagement', 'gouvernement', 'disposition', 'force', 'défense', 'sécurité', 'ressource', 'nécessaire', 'vue', 'accomplissement', 'noble', 'mission'], ['sama', 'lukond', 'projet', 'loi', 'finance', 'exercice', 'représentation', 'national', 'gouvernement', 'budget', 'global', 'secteur', 'défense', 'sécurité', 'accroissement', 'budget', 'précédent', 'projet', 'budget', 'année', 'assemblée', 'national', 'semaine', 'dernier', 'sama', 'hausse', 'rapport', 'année', 'cours', 'milliard', 'armée', 'industrie', 'militaireil', 'allocation', 'fonds', 'secteur', 'défense', 'sécurité', 'hauteur', 'but', 'montée', 'puissance', 'force', 'armée', 'redynamisation', 'industrie', 'budget', 'acquisition', 'arme', 'munition', 'guerre', 'moyen', 'logistique', 'réhabilitation', 'infrastructure', 'militaire', 'formation', 'poste', 'budgétaire', 'renforcement', 'armée', 'air'], ['armement', 'rdc', 'réciproquesle', 'relation', 'tendre', 'rwanda', 'rdc', 'résurgence', 'mouvement', 'mars', 'ancien', 'rébellion', 'tutsi', 'arme'], ['kinshasa', 'rébellion', 'ambassadeur', 'rwanda', 'rdc', 'collusion', 'fdlr', 'force', 'démocratique', 'libération', 'rwanda', 'mouvement', 'rebelle', 'hutu', 'rwandais', 'génocide', 'tutsi', 'rwanda']]]","[[['Nation', 'République démocratique du Congo'], [], ['RDC', 'Russie', 'réciproquesLes', 'Rwanda', 'RDC'], ['Kinshasa', 'Kigali', 'Rwanda', 'Rwanda', 'RDC -', 'Rwanda']]]","[[['Premier ministre de la République démocratique du Congo Sama Lukonde'], ['Assemblée nationale'], ['M23', 'Mouvement du 23 mars'], ['FDLR', 'Forces démocratiques de libération du Rwanda']]]","[[['Président Félix Tshisekedi', 'Président', 'Patrick Muyaya', 'M.Lukonde'], ['Sama Lukonde', 'Sama Kukonde'], [], []]]","{'vendredi': 1, 'novembre': 1, 'réunion': 1, 'conseil': 2, 'ministre': 4, 'république': 1, 'démocratique': 2, 'congo': 1, 'lukond': 2, 'soutien': 1, 'gouvernement': 4, 'président': 2, 'félix': 1, 'tshisekedi': 1, 'lendemain': 1, 'message': 1, 'nation': 1, 'congolais': 1, 'agression': 1, 'rwandais': 2, 'effort': 1, 'paix': 1, 'hausse': 2, 'budget': 5, 'défense': 4, 'patrick': 1, 'engagement': 1, 'disposition': 1, 'force': 3, 'sécurité': 3, 'ressource': 1, 'nécessaire': 1, 'vue': 1, 'accomplissement': 1, 'noble': 1, 'mission': 1, 'sama': 2, 'projet': 2, 'loi': 1, 'finance': 1, 'exercice': 1, 'représentation': 1, 'national': 2, 'global': 1, 'secteur': 2, 'accroissement': 1, 'précédent': 1, 'année': 2, 'assemblée': 1, 'semaine': 1, 'dernier': 1, 'rapport': 1, 'cours': 1, 'milliard': 1, 'armée': 3, 'industrie': 2, 'militaireil': 1, 'allocation': 1, 'fonds': 1, 'hauteur': 1, 'but': 1, 'montée': 1, 'puissance': 1, 'redynamisation': 1, 'acquisition': 1, 'arme': 2, 'munition': 1, 'guerre': 1, 'moyen': 1, 'logistique': 1, 'réhabilitation': 1, 'infrastructure': 1, 'militaire': 1, 'formation': 1, 'poste': 1, 'budgétaire': 1, 'renforcement': 1, 'air': 1, 'armement': 1, 'rdc': 3, 'réciproquesle': 1, 'relation': 1, 'tendre': 1, 'rwanda': 4, 'résurgence': 1, 'mouvement': 2, 'mars': 1, 'ancien': 1, 'rébellion': 2, 'tutsi': 2, 'kinshasa': 1, 'ambassadeur': 1, 'collusion': 1, 'fdlr': 1, 'libération': 1, 'rebelle': 1, 'hutu': 1, 'génocide': 1}","{'Nation': 1, 'République démocratique du Congo': 1, 'RDC': 2, 'Russie': 1, 'réciproquesLes': 1, 'Rwanda': 4, 'Kinshasa': 1, 'Kigali': 1, 'RDC -': 1}","{'Premier ministre de la République démocratique du Congo Sama Lukonde': 1, 'Assemblée nationale': 1, 'M23': 1, 'Mouvement du 23 mars': 1, 'FDLR': 1, 'Forces démocratiques de libération du Rwanda': 1}","{'Président Félix Tshisekedi': 1, 'Président': 1, 'Patrick Muyaya': 1, 'M.Lukonde': 1, 'Sama Lukonde': 1, 'Sama Kukonde': 1}",2022,11,7
1667862000,https://fr.sputniknews.africa/20221108/moscou-salue-la-volonte-dalger-dadherer-aux-brics-1056754022.html,Moscou salue la volonté d'Alger d'adhérer aux BRICS,"Moscou salue l'intention de l'Algérie d'adhérer au groupe des BRICS, a déclaré ce mardi un vice-ministre russe des Affaires étrangères. Un diplomate algérien vient de confirmer à Sputnik que la demande d'adhésion a bien été envoyée aux...","Moscou salue la volonté de l'Algérie d'adhérer au groupe des BRICS, a déclaré ce mardi le vice-ministre russe des Affaires étrangères Mikhaïl Bogdanov.""Nous entretenons un dialogue confidentiel avec l'Algérie. Mais cette question [de l'adhésion de nouveaux membres] est examinée dans le cadre d'un travail collectif"", a précisé M.Bogdanov, envoyé spécial du Président pour le Proche-Orient et les pays d'Afrique.Le groupe en question réunit pour l'instant cinq pays: le Brésil, la Russie, l'Inde, la Chine et l'Afrique du Sud. Le 7 novembre 2022, l’Algérie a fait une demande officielle pour rejoindre les BRICS.Confirmation officielleLe conseiller au ministère algérien des Affaires étrangères Salah Boucha a confirmé à Sputnik que le pays avait officiellement demandé l'adhésion au groupe des BRICS.""Oui, nous avons envoyé hier soir une communication officielle aux États membres des BRICS concernant notre désir de rejoindre le groupe. Nous espérons que notre demande sera examinée rapidement"", a-t-il déclaré.Plusieurs autres pays, dont l'Arabie saoudite, la Turquie, l'Égypte et le Nigeria, ont exprimé leur souhait de rejoindre les BRICS. L'Iran et l'Argentine sont candidats officiels à l'adhésion.À l'heure actuelle, la superficie cumulée des membres du groupe couvre 30% de la terre ferme. Leur population représente 42% de la population mondiale.","[[[""Moscou salue la volonté de l'Algérie d'adhérer au groupe des BRICS, a déclaré ce mardi le vice-ministre russe des Affaires étrangères Mikhaïl Bogdanov."", '""Nous entretenons un dialogue confidentiel avec l\'Algérie.', 'Mais cette question [de l\'adhésion de nouveaux membres] est examinée dans le cadre d\'un travail collectif"", a précisé M.Bogdanov, envoyé spécial du Président pour le Proche-Orient et les pays d\'Afrique.Le groupe en question réunit pour l\'instant cinq pays: le Brésil, la Russie, l\'Inde, la Chine et l\'Afrique du Sud.', ""Le 7 novembre 2022, l’Algérie a fait une demande officielle pour rejoindre les BRICS.Confirmation officielleLe conseiller au ministère algérien des Affaires étrangères Salah Boucha a confirmé à Sputnik que le pays avait officiellement demandé l'adhésion au groupe des BRICS."", '""Oui, nous avons envoyé hier soir une communication officielle aux États membres des BRICS concernant notre désir de rejoindre le groupe.', 'Nous espérons que notre demande sera examinée rapidement"", a-t-il déclaré.Plusieurs autres pays, dont l\'Arabie saoudite, la Turquie, l\'Égypte et le Nigeria, ont exprimé leur souhait de rejoindre les BRICS.', ""L'Iran et l'Argentine sont candidats officiels à l'adhésion.À l'heure actuelle, la superficie cumulée des membres du groupe couvre 30% de la terre ferme."", 'Leur population représente 42% de la population mondiale.']]]","[[['moscou', 'volonté', 'algérie', 'groupe', 'bric', 'mardi', 'russe', 'affaire', 'étranger', 'mikhaïl', 'bogdanov'], ['dialogue', 'confidentiel', 'algérie'], ['question', 'adhésion', 'nouveau', 'membre', 'cadre', 'travail', 'collectif', 'spécial', 'président', 'orient', 'pays', 'groupe', 'question', 'instant', 'pays', 'brésil', 'russie', 'inde', 'chine', 'afrique', 'sud'], ['novembre', 'algérie', 'demande', 'officiel', 'officiellele', 'conseiller', 'ministère', 'algérien', 'affaire', 'étranger', 'salah', 'sputnik', 'pays', 'adhésion', 'groupe', 'bric'], ['oui', 'soir', 'communication', 'officiel', 'état', 'membre', 'bric', 'désir', 'groupe'], ['demande', 'pays', 'arabie', 'saoudite', 'turquie', 'égypte', 'nigeria', 'souhait', 'bric'], ['iran', 'argentine', 'candidat', 'officiel', 'heure', 'actuel', 'superficie', 'membre', 'groupe', 'terre', 'ferme'], ['population', 'population', 'mondial']]]","[[['Moscou', 'Algérie'], ['Algérie'], ['Afrique', 'Brésil', 'Russie', 'Inde', 'Chine', 'Afrique du Sud'], ['l’Algérie'], ['États'], ['Arabie saoudite', 'Turquie', 'Égypte', 'Nigeria'], ['Iran', 'Argentine'], []]]","[[['BRICS', 'vice-ministre russe des Affaires'], [], [], ['ministère algérien des Affaires étrangères', 'Sputnik', 'BRICS'], ['BRICS'], ['BRICS'], [], []]]","[[['Mikhaïl Bogdanov'], [], ['M.Bogdanov'], ['Salah Boucha'], [], [], [], []]]","{'moscou': 1, 'volonté': 1, 'algérie': 3, 'groupe': 5, 'bric': 4, 'mardi': 1, 'russe': 1, 'affaire': 2, 'étranger': 2, 'mikhaïl': 1, 'bogdanov': 1, 'dialogue': 1, 'confidentiel': 1, 'question': 2, 'adhésion': 2, 'nouveau': 1, 'membre': 3, 'cadre': 1, 'travail': 1, 'collectif': 1, 'spécial': 1, 'président': 1, 'orient': 1, 'pays': 4, 'instant': 1, 'brésil': 1, 'russie': 1, 'inde': 1, 'chine': 1, 'afrique': 1, 'sud': 1, 'novembre': 1, 'demande': 2, 'officiel': 3, 'officiellele': 1, 'conseiller': 1, 'ministère': 1, 'algérien': 1, 'salah': 1, 'sputnik': 1, 'oui': 1, 'soir': 1, 'communication': 1, 'état': 1, 'désir': 1, 'arabie': 1, 'saoudite': 1, 'turquie': 1, 'égypte': 1, 'nigeria': 1, 'souhait': 1, 'iran': 1, 'argentine': 1, 'candidat': 1, 'heure': 1, 'actuel': 1, 'superficie': 1, 'terre': 1, 'ferme': 1, 'population': 2, 'mondial': 1}","{'Moscou': 1, 'Algérie': 2, 'Afrique': 1, 'Brésil': 1, 'Russie': 1, 'Inde': 1, 'Chine': 1, 'Afrique du Sud': 1, 'l’Algérie': 1, 'États': 1, 'Arabie saoudite': 1, 'Turquie': 1, 'Égypte': 1, 'Nigeria': 1, 'Iran': 1, 'Argentine': 1}","{'BRICS': 4, 'vice-ministre russe des Affaires': 1, 'ministère algérien des Affaires étrangères': 1, 'Sputnik': 1}","{'Mikhaïl Bogdanov': 1, 'M.Bogdanov': 1, 'Salah Boucha': 1}",2022,11,7
