timestamp,url,title,description,content,content-segmented,kws-l,loc-l,org-l,per-l,kws,loc,org,per,year,month,day
1676156400,https://fr.sputniknews.africa/20230212/un-gardien-de-but-belge-meurt-juste-apres-avoir-arrete-un-penalty-1057901635.html,Un gardien de but belge meurt juste après avoir arrêté un penalty,"Une équipe de foot belge a été endeuillée par la mort de son gardien, qui a fait un malaise sur le terrain. Ce type de décès est plus courant qu’on ne le croit.","""L'Angoisse du gardien de but au moment du penalty"", le fameux roman du prix Nobel de littérature Peter Handke a trouvé un écho macabre en Belgique, ce 11 février. Arne Espeel, gardien de l’équipe de Winkel Sport B évoluant en deuxième division provinciale, a en effet trouvé la mort après avoir arrêté un tir au but, rapporte le quotidien Nieuwsblad.Le jeune homme de 25 ans a été pris d’un malaise et s’est effondré juste après son arrêt décisif. Il a été pris de convulsions, sous les yeux de ses coéquipiers. Les secours n’ont pas tardé à arriver sur place et ont essayé de le sauver à l’aide d’un défibrillateur. Mais le jeune portier est finalement décédé lors de son transfert à l’hôpital.""C'est une catastrophe et un choc pour tout le monde. Arne a joué avec le club toute sa vie et était très aimé. C'était un garçon merveilleusement sympathique, toujours de bonne humeur et prêt à aider. C'est vraiment un coup dur. D'abord pour sa famille et aussi pour tout notre club"", a déclaré Patrick Rotsaert, directeur sportif de Winkel.Le jeune frère d’Arne, qui évolue dans la même équipe, était sur le banc lorsque la scène s’est déroulée.Une autopsie doit désormais être réalisée pour établir la cause du décès.Morts en plein effortLes décès de sportif en pleine action ne sont pas chose rare. Le football en a déjà fourni des exemples, y compris au très haut niveau. Le Camerounais Marc-Vivien Foé avait notamment était victime d’un malaise cardiaque en 2003 avec sa sélection nationale, lors d’un match contre la Colombie, en Coupe des confédérations. Des images morbides qui avaient fait le tour du monde.Plus récemment, un autre Camerounais, Patrick Ekeng avait aussi trouvé la mort sur le terrain, lors d’un match avec le Dinamo Bucarest. Là encore à cause d’une crise cardiaque.Même sort pour Antonio Puerta, jeune joueur de Séville, qui avait fait un malaise pendant une rencontre contre Getafe, en 2007. Victime de quatre nouvelles attaques cardiaques dans les vestiaires, il avait succombé quelques jours plus tard. Les portes du stade Sanchez Pizjuan avaient été renommées en son honneur.Le football n’est cependant pas le sport le plus dangereux, particulièrement au rayon blessure. Cette palme revient à l’équitation, qui est l’activité physique la plus risquée, à en croire une étude américaine publiée en 2021. Même le football américain et la course automobile ne s’en approche pas. À cheval, les blessures à la tête et au cou sont particulièrement meurtrières, entraînant la mort dans près de 75% des cas.","[[['""L\'Angoisse du gardien de but au moment du penalty"", le fameux roman du prix Nobel de littérature Peter Handke a trouvé un écho macabre en Belgique, ce 11 février.'], ['Arne Espeel, gardien de l’équipe de Winkel Sport B évoluant en deuxième division provinciale, a en effet trouvé la mort après avoir arrêté un tir au but, rapporte le quotidien Nieuwsblad.Le jeune homme de 25 ans a été pris d’un malaise et s’est effondré juste après son arrêt décisif.'], ['Il a été pris de convulsions, sous les yeux de ses coéquipiers.'], ['Les secours n’ont pas tardé à arriver sur place et ont essayé de le sauver à l’aide d’un défibrillateur.'], ['Mais le jeune portier est finalement décédé lors de son transfert à l’hôpital.'], ['""C\'est une catastrophe et un choc pour tout le monde.'], ['Arne a joué avec le club toute sa vie et était très aimé.'], [""C'était un garçon merveilleusement sympathique, toujours de bonne humeur et prêt à aider.""], [""C'est vraiment un coup dur.""], ['D\'abord pour sa famille et aussi pour tout notre club"", a déclaré Patrick Rotsaert, directeur sportif de Winkel.Le jeune frère d’Arne, qui évolue dans la même équipe, était sur le banc lorsque la scène s’est déroulée.Une autopsie doit désormais être réalisée pour établir la cause du décès.Morts en plein effortLes décès de sportif en pleine action ne sont pas chose rare.'], ['Le football en a déjà fourni des exemples, y compris au très haut niveau.'], ['Le Camerounais Marc-Vivien Foé avait notamment était victime d’un malaise cardiaque en 2003 avec sa sélection nationale, lors d’un match contre la Colombie, en Coupe des confédérations.'], ['Des images morbides qui avaient fait le tour du monde.Plus récemment, un autre Camerounais, Patrick Ekeng avait aussi trouvé la mort sur le terrain, lors d’un match avec le Dinamo Bucarest.'], ['Là encore à cause d’une crise cardiaque.Même sort pour Antonio Puerta, jeune joueur de Séville, qui avait fait un malaise pendant une rencontre contre Getafe, en 2007.'], ['Victime de quatre nouvelles attaques cardiaques dans les vestiaires, il avait succombé quelques jours plus tard.'], ['Les portes du stade Sanchez Pizjuan avaient été renommées en son honneur.Le football n’est cependant pas le sport le plus dangereux, particulièrement au rayon blessure.'], ['Cette palme revient à l’équitation, qui est l’activité physique la plus risquée, à en croire une étude américaine publiée en 2021.'], ['Même le football américain et la course automobile ne s’en approche pas.'], ['À cheval, les blessures à la tête et au cou sont particulièrement meurtrières, entraînant la mort dans près de 75% des cas.']]]","[[['angoisse', 'gardien', 'but', 'moment', 'penalty', 'fameux', 'roman', 'prix', 'nobel', 'littérature', 'écho', 'macabre', 'belgique', 'février'], ['gardien', 'équipe', 'winkel', 'sport', 'b', 'division', 'provinciale', 'mort', 'tir', 'but', 'quotidien', 'jeune', 'homme', 'ans', 'malaise', 'arrêt', 'décisif'], ['convulsions', 'yeux', 'coéquipiers'], ['secours', 'place', 'aide', 'défibrillateur'], ['jeune', 'portier', 'transfert', 'hôpital'], ['catastrophe', 'choc', 'monde'], ['arne', 'club', 'vie'], ['garçon', 'sympathique', 'bonne', 'humeur', 'prêt'], ['coup', 'dur'], ['famille', 'club', 'patrick', 'directeur', 'sportif', 'jeune', 'frère', 'arne', 'équipe', 'banc', 'scène', 'autopsie', 'cause', 'plein', 'décès', 'sportif', 'pleine', 'action', 'chose', 'rare'], ['football', 'exemples', 'haut', 'niveau'], ['camerounais', 'marc', 'vivien', 'foé', 'malaise', 'cardiaque', 'sélection', 'nationale', 'match', 'colombie', 'coupe', 'confédérations'], ['images', 'morbides', 'tour', 'camerounais', 'patrick', 'ekeng', 'mort', 'terrain', 'match', 'dinamo', 'bucarest'], ['cause', 'crise', 'antonio', 'puerta', 'jeune', 'joueur', 'séville', 'malaise', 'rencontre', 'getafe'], ['victime', 'nouvelles', 'attaques', 'cardiaques', 'vestiaires', 'jours'], ['portes', 'stade', 'pizjuan', 'football', 'sport', 'dangereux', 'rayon', 'blessure'], ['palme', 'équitation', 'activité', 'physique', 'étude', 'américaine'], ['football', 'américain', 'course', 'automobile', 'approche'], ['cheval', 'blessures', 'tête', 'cou', 'meurtrières', 'mort', 'cas']]]","[[['Belgique'], [], [], [], [], [], [], [], [], ['Winkel', 'effortLes'], [], ['Cameroun Cameroun', 'Colombie'], ['Cameroun Cameroun'], ['Séville', 'Getafe'], [], [], [], [], []]]","[[[], ['Winkel Sport B', 'Nieuwsblad'], [], [], [], [], [], [], [], [], [], [], ['Dinamo Bucarest'], [], [], [], [], [], []]]","[[['Peter Handke'], ['Arne Espeel'], [], [], [], [], ['Arne'], [], [], ['Patrick Rotsaert', 'Arne'], [], ['Marc-Vivien Foé'], ['Patrick Ekeng'], ['Antonio Puerta'], [], ['Sanchez Pizjuan'], [], [], []]]","{'angoisse': 1, 'gardien': 2, 'but': 2, 'moment': 1, 'penalty': 1, 'fameux': 1, 'roman': 1, 'prix': 1, 'nobel': 1, 'littérature': 1, 'écho': 1, 'macabre': 1, 'belgique': 1, 'février': 1, 'équipe': 2, 'winkel': 1, 'sport': 2, 'b': 1, 'division': 1, 'provinciale': 1, 'mort': 3, 'tir': 1, 'quotidien': 1, 'jeune': 4, 'homme': 1, 'ans': 1, 'malaise': 3, 'arrêt': 1, 'décisif': 1, 'convulsions': 1, 'yeux': 1, 'coéquipiers': 1, 'secours': 1, 'place': 1, 'aide': 1, 'défibrillateur': 1, 'portier': 1, 'transfert': 1, 'hôpital': 1, 'catastrophe': 1, 'choc': 1, 'monde': 1, 'arne': 2, 'club': 2, 'vie': 1, 'garçon': 1, 'sympathique': 1, 'bonne': 1, 'humeur': 1, 'prêt': 1, 'coup': 1, 'dur': 1, 'famille': 1, 'patrick': 2, 'directeur': 1, 'sportif': 2, 'frère': 1, 'banc': 1, 'scène': 1, 'autopsie': 1, 'cause': 2, 'plein': 1, 'décès': 1, 'pleine': 1, 'action': 1, 'chose': 1, 'rare': 1, 'football': 3, 'exemples': 1, 'haut': 1, 'niveau': 1, 'camerounais': 2, 'marc': 1, 'vivien': 1, 'foé': 1, 'cardiaque': 1, 'sélection': 1, 'nationale': 1, 'match': 2, 'colombie': 1, 'coupe': 1, 'confédérations': 1, 'images': 1, 'morbides': 1, 'tour': 1, 'ekeng': 1, 'terrain': 1, 'dinamo': 1, 'bucarest': 1, 'crise': 1, 'antonio': 1, 'puerta': 1, 'joueur': 1, 'séville': 1, 'rencontre': 1, 'getafe': 1, 'victime': 1, 'nouvelles': 1, 'attaques': 1, 'cardiaques': 1, 'vestiaires': 1, 'jours': 1, 'portes': 1, 'stade': 1, 'pizjuan': 1, 'dangereux': 1, 'rayon': 1, 'blessure': 1, 'palme': 1, 'équitation': 1, 'activité': 1, 'physique': 1, 'étude': 1, 'américaine': 1, 'américain': 1, 'course': 1, 'automobile': 1, 'approche': 1, 'cheval': 1, 'blessures': 1, 'tête': 1, 'cou': 1, 'meurtrières': 1, 'cas': 1}","{'Belgique': 1, 'Winkel': 1, 'effortLes': 1, 'Cameroun Cameroun': 2, 'Colombie': 1, 'Séville': 1, 'Getafe': 1}","{'Winkel Sport B': 1, 'Nieuwsblad': 1, 'Dinamo Bucarest': 1}","{'Peter Handke': 1, 'Arne Espeel': 1, 'Arne': 2, 'Patrick Rotsaert': 1, 'Marc-Vivien Foé': 1, 'Patrick Ekeng': 1, 'Antonio Puerta': 1, 'Sanchez Pizjuan': 1}",2023,2,11
1676156400,https://fr.sputniknews.africa/20230212/roscosmos-devoile-la-photo-de-la-faille-tectonique-suite-au-seisme-en-turquie-1057901368.html,Roscosmos dévoile la photo de la faille tectonique suite au séisme en Turquie,La faille tectonique apparue suite au tremblement de terre meurtrier qui a touché la Turquie et la Syrie a été prise en photo par le satellite d’observation russe Canopus-V.,"Roscosmos poursuit sa surveillance spatiale des conséquences du tremblement de terre dans le sud-est de la Turquie. Presqu’une semaine après le séisme ayant emporté la vie de près de 30.000 personnes seulement dans ce pays, l’agence a publié une image de la faille tectonique créée par la catastrophe.La photo a été faite par le satellite d’observation russe Canopus-V. Auparavant, tous les satellites de télédétection de la Terre russes ont été réorientés pour observer la zone sinistrée dans la partie orientale de la péninsule anatolienne.Le lendemain de la tragédie, l’agence spatiale a publié une image satellite de la région. Les secousses des tremblements de terre de magnitude 7,7 et 7,6 ayant frappé le 6 février le sud-est de la Turquie, ont été ressenties dans 10 provinces du pays et des États voisins, dont la Syrie a le plus souffert.","[[['Roscosmos poursuit sa surveillance spatiale des conséquences du tremblement de terre dans le sud-est de la Turquie.'], ['Presqu’une semaine après le séisme ayant emporté la vie de près de 30.000 personnes seulement dans ce pays, l’agence a publié une image de la faille tectonique créée par la catastrophe.La photo a été faite par le satellite d’observation russe Canopus-V. Auparavant, tous les satellites de télédétection de la Terre russes ont été réorientés pour observer la zone sinistrée dans la partie orientale de la péninsule anatolienne.Le lendemain de la tragédie, l’agence spatiale a publié une image satellite de la région.'], ['Les secousses des tremblements de terre de magnitude 7,7 et 7,6 ayant frappé le 6 février le sud-est de la Turquie, ont été ressenties dans 10 provinces du pays et des États voisins, dont la Syrie a le plus souffert.']]]","[[['roscosmos', 'surveillance', 'spatiale', 'conséquences', 'tremblement', 'terre', 'turquie'], ['semaine', 'séisme', 'vie', 'personnes', 'pays', 'agence', 'image', 'faille', 'tectonique', 'photo', 'satellite', 'observation', 'russe', 'canopus', 'satellites', 'télédétection', 'terre', 'russes', 'zone', 'partie', 'orientale', 'péninsule', 'tragédie', 'agence', 'spatiale', 'image', 'satellite', 'région'], ['secousses', 'tremblements', 'terre', 'magnitude', 'février', 'turquie', 'provinces', 'pays', 'états', 'voisins', 'syrie']]]","[[['Roscosmos', 'Turquie'], ['Terre'], ['Turquie', 'États', 'Syrie']]]","[[[], [], []]]","[[[], [], []]]","{'roscosmos': 1, 'surveillance': 1, 'spatiale': 2, 'conséquences': 1, 'tremblement': 1, 'terre': 3, 'turquie': 2, 'semaine': 1, 'séisme': 1, 'vie': 1, 'personnes': 1, 'pays': 2, 'agence': 2, 'image': 2, 'faille': 1, 'tectonique': 1, 'photo': 1, 'satellite': 2, 'observation': 1, 'russe': 1, 'canopus': 1, 'satellites': 1, 'télédétection': 1, 'russes': 1, 'zone': 1, 'partie': 1, 'orientale': 1, 'péninsule': 1, 'tragédie': 1, 'région': 1, 'secousses': 1, 'tremblements': 1, 'magnitude': 1, 'février': 1, 'provinces': 1, 'états': 1, 'voisins': 1, 'syrie': 1}","{'Roscosmos': 1, 'Turquie': 2, 'Terre': 1, 'États': 1, 'Syrie': 1}",{},{},2023,2,11
1676156400,https://fr.sputniknews.africa/20230212/guide-de-lapocalypse-nucleaire-laustralie-et-la-nouvelle-zelande-les-mieux-places-pour-survivre-1057901106.html,Guide de l’apocalypse nucléaire: quels pays sont les mieux placés pour survivre?,Des scientifiques affirment que l’Australie et la Nouvelle-Zélande sont les pays les mieux pourvus pour assurer la survie d’une civilisation après une apocalypse nucléaire.,"Alors que certains s’interrogent sur les scénarios du pire, dans le sillage du conflit en Ukraine, une étude a classé les pays les mieux armés pour résister à une catastrophe réduisant soudainement la lumière du soleil, comme une guerre nucléaire ou un impact d’astéroïde.Cette enquête insolite, publiée dans la revue Risk Analysis, révèle que l’Australie et la Nouvelle-Zélande ont le plus de chance de s’en sortir. L’île-continent, gros producteur agricole, pourrait facilement assurer sa sécurité alimentaire.""Le tampon d'approvisionnement alimentaire de l'Australie est gigantesque. Avec le potentiel pour nourrir plusieurs dizaines de millions de personnes supplémentaires"", explique ainsi l’étude.Le pays des kangourous possède aussi un vaste excédent énergétique et se trouve à l’écart des sites probables de retombées nucléaires dans l'hémisphère nord. Seul bémol: l’Australie entretient des liens étroits avec les États-Unis et le Royaume-Uni, ce qui pourrait en faire une cible dans une guerre nucléaire.La Nouvelle-Zélande bénéficie elle aussi d’un réservoir agricole important, qui l’aiderait en cas d’apocalypse. Le pays serait en outre moins touché par une chute brutale de la température mondiale, l’influence de l’océan se faisant sentir partout sur son territoire, même à l’intérieur des terres. Sa cohésion sociale jouerait aussi un rôle important si le pire venait à se produire.Derrière ces deux pays, d’autres États insulaires tirent leur épingle du jeu, comme l'Islande, les Îles Salomon et le Vanuatu.Angoisse nucléaireLe conflit en Ukraine a réveillé le spectre d’une possible escalade nucléaire. L’""horloge de l’apocalypse"", programme qui reflète les menaces pesant sur l’humanité, a d’ailleurs été avancé à minuit moins 90 secondes, fin janvier. Soit le plus proche niveau du minuit nucléaire.La Russie a plusieurs fois réaffirmé sa position en matière d’armes nucléaires ces derniers mois, expliquant que celles-ci étaient un ultime recours défensif. Début décembre, Vladimir Poutine avait ainsi déclaré que Moscou ne brandirait pas son armement atomique ""comme un rasoir"".Le Président russe avait plus tôt fustigé le ""chantage nucléaire"" mené par l’Occident, déplorant notamment l’accroissement des risques autour de la centrale de Zaporojié.","[[['Alors que certains s’interrogent sur les scénarios du pire, dans le sillage du conflit en Ukraine, une étude a classé les pays les mieux armés pour résister à une catastrophe réduisant soudainement la lumière du soleil, comme une guerre nucléaire ou un impact d’astéroïde.Cette enquête insolite, publiée dans la revue Risk Analysis, révèle que l’Australie et la Nouvelle-Zélande ont le plus de chance de s’en sortir.'], ['L’île-continent, gros producteur agricole, pourrait facilement assurer sa sécurité alimentaire.'], ['""Le tampon d\'approvisionnement alimentaire de l\'Australie est gigantesque.'], ['Avec le potentiel pour nourrir plusieurs dizaines de millions de personnes supplémentaires"", explique ainsi l’étude.Le pays des kangourous possède aussi un vaste excédent énergétique et se trouve à l’écart des sites probables de retombées nucléaires dans l\'hémisphère nord.'], ['Seul bémol: l’Australie entretient des liens étroits avec les États-Unis et le Royaume-Uni, ce qui pourrait en faire une cible dans une guerre nucléaire.La Nouvelle-Zélande bénéficie elle aussi d’un réservoir agricole important, qui l’aiderait en cas d’apocalypse.'], ['Le pays serait en outre moins touché par une chute brutale de la température mondiale, l’influence de l’océan se faisant sentir partout sur son territoire, même à l’intérieur des terres.'], [""Sa cohésion sociale jouerait aussi un rôle important si le pire venait à se produire.Derrière ces deux pays, d’autres États insulaires tirent leur épingle du jeu, comme l'Islande, les Îles Salomon et le Vanuatu.Angoisse nucléaireLe conflit en Ukraine a réveillé le spectre d’une possible escalade nucléaire.""], ['L’""horloge de l’apocalypse"", programme qui reflète les menaces pesant sur l’humanité, a d’ailleurs été avancé à minuit moins 90 secondes, fin janvier.'], ['Soit le plus proche niveau du minuit nucléaire.La Russie a plusieurs fois réaffirmé sa position en matière d’armes nucléaires ces derniers mois, expliquant que celles-ci étaient un ultime recours défensif.'], ['Début décembre, Vladimir Poutine avait ainsi déclaré que Moscou ne brandirait pas son armement atomique ""comme un rasoir"".Le Président russe avait plus tôt fustigé le ""chantage nucléaire"" mené par l’Occident, déplorant notamment l’accroissement des risques autour de la centrale de Zaporojié.']]]","[[['scénarios', 'pire', 'sillage', 'conflit', 'ukraine', 'étude', 'pays', 'armés', 'catastrophe', 'lumière', 'soleil', 'guerre', 'nucléaire', 'impact', 'enquête', 'insolite', 'revue', 'australie', 'nouvelle', 'zélande', 'chance'], ['île', 'continent', 'gros', 'producteur', 'agricole', 'sécurité', 'alimentaire'], ['tampon', 'approvisionnement', 'alimentaire', 'australie', 'gigantesque'], ['potentiel', 'dizaines', 'millions', 'personnes', 'supplémentaires', 'pays', 'kangourous', 'vaste', 'excédent', 'énergétique', 'écart', 'sites', 'probables', 'retombées', 'nucléaires', 'hémisphère', 'nord'], ['bémol', 'australie', 'liens', 'étroits', 'royaume', 'uni', 'cible', 'guerre', 'nouvelle', 'zélande', 'réservoir', 'agricole', 'important', 'cas', 'apocalypse'], ['pays', 'chute', 'brutale', 'température', 'mondiale', 'influence', 'océan', 'territoire', 'intérieur', 'terres'], ['cohésion', 'sociale', 'rôle', 'important', 'pire', 'pays', 'états', 'insulaires', 'épingle', 'jeu', 'islande', 'îles', 'conflit', 'ukraine', 'spectre', 'escalade', 'nucléaire'], ['apocalypse', 'programme', 'menaces', 'pesant', 'humanité', 'avancé', 'minuit', 'secondes', 'fin', 'janvier'], ['niveau', 'minuit', 'russie', 'fois', 'position', 'matière', 'armes', 'nucléaires', 'derniers', 'mois', 'ultime', 'recours', 'défensif'], ['début', 'décembre', 'vladimir', 'poutine', 'moscou', 'armement', 'atomique', 'président', 'russe', 'chantage', 'nucléaire', 'occident', 'accroissement', 'risques', 'centrale', 'zaporojié']]]","[[['Ukraine', 'Australie', 'Nouvelle-Zélande'], [], ['Australie'], [], ['Australie', 'États-Unis', 'Royaume-Uni'], [], ['Islande', 'Îles Salomon', 'Vanuatu', 'Ukraine'], ['L’""horloge'], ['Russie'], ['Moscou', 'Occident', 'Zaporojié']]]","[[[], [], [], [], [], [], [], [], [], []]]","[[[], [], [], [], [], [], [], [], [], ['Vladimir Poutine', 'Président russe']]]","{'scénarios': 1, 'pire': 2, 'sillage': 1, 'conflit': 2, 'ukraine': 2, 'étude': 1, 'pays': 4, 'armés': 1, 'catastrophe': 1, 'lumière': 1, 'soleil': 1, 'guerre': 2, 'nucléaire': 3, 'impact': 1, 'enquête': 1, 'insolite': 1, 'revue': 1, 'australie': 3, 'nouvelle': 2, 'zélande': 2, 'chance': 1, 'île': 1, 'continent': 1, 'gros': 1, 'producteur': 1, 'agricole': 2, 'sécurité': 1, 'alimentaire': 2, 'tampon': 1, 'approvisionnement': 1, 'gigantesque': 1, 'potentiel': 1, 'dizaines': 1, 'millions': 1, 'personnes': 1, 'supplémentaires': 1, 'kangourous': 1, 'vaste': 1, 'excédent': 1, 'énergétique': 1, 'écart': 1, 'sites': 1, 'probables': 1, 'retombées': 1, 'nucléaires': 2, 'hémisphère': 1, 'nord': 1, 'bémol': 1, 'liens': 1, 'étroits': 1, 'royaume': 1, 'uni': 1, 'cible': 1, 'réservoir': 1, 'important': 2, 'cas': 1, 'apocalypse': 2, 'chute': 1, 'brutale': 1, 'température': 1, 'mondiale': 1, 'influence': 1, 'océan': 1, 'territoire': 1, 'intérieur': 1, 'terres': 1, 'cohésion': 1, 'sociale': 1, 'rôle': 1, 'états': 1, 'insulaires': 1, 'épingle': 1, 'jeu': 1, 'islande': 1, 'îles': 1, 'spectre': 1, 'escalade': 1, 'programme': 1, 'menaces': 1, 'pesant': 1, 'humanité': 1, 'avancé': 1, 'minuit': 2, 'secondes': 1, 'fin': 1, 'janvier': 1, 'niveau': 1, 'russie': 1, 'fois': 1, 'position': 1, 'matière': 1, 'armes': 1, 'derniers': 1, 'mois': 1, 'ultime': 1, 'recours': 1, 'défensif': 1, 'début': 1, 'décembre': 1, 'vladimir': 1, 'poutine': 1, 'moscou': 1, 'armement': 1, 'atomique': 1, 'président': 1, 'russe': 1, 'chantage': 1, 'occident': 1, 'accroissement': 1, 'risques': 1, 'centrale': 1, 'zaporojié': 1}","{'Ukraine': 2, 'Australie': 3, 'Nouvelle-Zélande': 1, 'États-Unis': 1, 'Royaume-Uni': 1, 'Islande': 1, 'Îles Salomon': 1, 'Vanuatu': 1, 'L’""horloge': 1, 'Russie': 1, 'Moscou': 1, 'Occident': 1, 'Zaporojié': 1}",{},"{'Vladimir Poutine': 1, 'Président russe': 1}",2023,2,11
