timestamp,url,title,description,content,content-segmented,kws-l,loc-l,org-l,per-l,kws,loc,org,per,year,month,day
1680904800,https://fr.sputniknews.africa/20230408/les-etats-unis-sont-entre-le-marteau-russe-et-lenclume-chinoise-en-afrique-estime-un-politologue-1058443086.html,"""Les États-Unis sont entre le marteau russe et l’enclume chinoise en Afrique""","Washington a de plus en plus de mal à trouver sa place en Afrique, alors que les pays du continent nouent des partenariats avec Moscou et Pékin, explique à Sputnik le politologue Abdou Karim Diakhaté.","Alors que les visites d’officiels américains se succèdent en Afrique, les États-Unis sont pris entre deux feux sur le continent. Washington, qui croyait pouvoir profiter de la perte d’influence française dans certaines régions, se voit en effet confronté à l’apparition des nouveaux partenaires chinois et russes, explique à Sputnik Abdou Karim Diakhaté, politologue et directeur de publication du magazine Le Panafricain.""Les États-Unis sont entre le marteau russe et l’enclume chinoise en Afrique. La Chine est le principal partenaire commercial de beaucoup de pays du continent, mais la coopération entre les pays africains et la Russie connaît une nouvelle dynamique et suscite de grands espoirs. C’est cette tendance qui dérange les États-Unis"", déclare-t-il ainsi.Washington a également dû revoir ses financements à la baisse, coupant dans ses aides à l’Afrique. Lors du G7 2022, Joe Biden avait ainsi promis un plan Marshall de 600 milliards de dollars à destination du continent, avant de finalement évoquer un financement de 50 milliards sur trois ans lors du dernier sommet Afrique - États-Unis, rappelle Abdou Karim Diakhaté.Des pressions inefficacesCette perte d’influence américaine a même poussé Washington à faire la morale à certains pays africains sur leur collaboration avec Moscou ou Pékin. Début janvier, la ministre de la Défense sud-africaine Thandi Modise avait encore dénoncé les ""pression injustifiées"" de Washington pour obliger son pays à couper les ponts avec la Russie, dans le sillage de l’incident du navire Lady R.Des pressions américaines qui n’aboutiront sans doute pas, affirment cependant Abdou Karim Diakhaté, qui applaudit la ""prise de conscience"" des pays africains sur le sujet. La résilience de l’Afrique après la pandémie de Covid-19 a notamment montré que le continent pouvait se prendre en charge lui-même.""Je ne pense pas que les pressions exercées par les pays occidentaux sur certains pays africains quant au choix de leurs partenaires puissent aboutir. Il y a une prise de conscience qui va au-delà du simple constat, une réelle démarche de rupture dont on voit les effets se produire ici et là, à travers des prises de position de plus en plus audacieuses, des réflexions et des actes forts posés par des élites politiques et une société civile très dynamique"", déclare-t-il ainsi.La Russie n’est pas isoléeLes liens que cultivent aujourd’hui les pays africains avec Moscou prouvent en outre que la Russie n’est pas isolée sur la scène internationale, souligne encore Abdou Karim Diakhaté. Les pays arabes s’abstiennent également de prendre des sanctions, tandis que la position de la Russie au sein des BRICS lui assure certains soutiens, explique l’expert.""Dans le monde multipolaire, un isolement de la Russie ne me semble pas possible compte tenu des enjeux géostratégiques et des intérêts divergents des pays Seuls 28 pays sur les 54 que compte l’Union africaine ont voté en faveur de la résolution condamnant l’invasion russe de l’Ukraine D’autres pays, comme l’Inde et l’Iran, tentent de préserver leurs liens économiques avec l’Occident, mais aussi leur coopération énergétique et sécuritaire avec la Russie"", argumente-t-il.Un constat partagé par le géopolitologue français Aymeric Chauprade, qui expliquait récemment à Sputnik que la stratégie occidentale d’isolement de la Russie avait ses limites.","[[['Alors que les visites d’officiels américains se succèdent en Afrique, les États-Unis sont pris entre deux feux sur le continent.'], ['Washington, qui croyait pouvoir profiter de la perte d’influence française dans certaines régions, se voit en effet confronté à l’apparition des nouveaux partenaires chinois et russes, explique à Sputnik Abdou Karim Diakhaté, politologue et directeur de publication du magazine Le Panafricain.'], ['""Les États-Unis sont entre le marteau russe et l’enclume chinoise en Afrique.'], ['La Chine est le principal partenaire commercial de beaucoup de pays du continent, mais la coopération entre les pays africains et la Russie connaît une nouvelle dynamique et suscite de grands espoirs.'], ['C’est cette tendance qui dérange les États-Unis"", déclare-t-il ainsi.Washington a également dû revoir ses financements à la baisse, coupant dans ses aides à l’Afrique.'], ['Lors du G7 2022, Joe Biden avait ainsi promis un plan Marshall de 600 milliards de dollars à destination du continent, avant de finalement évoquer un financement de 50 milliards sur trois ans lors du dernier sommet Afrique - États-Unis, rappelle Abdou Karim Diakhaté.Des pressions inefficacesCette perte d’influence américaine a même poussé Washington à faire la morale à certains pays africains sur leur collaboration avec Moscou ou Pékin.'], ['Début janvier, la ministre de la Défense sud-africaine Thandi Modise avait encore dénoncé les ""pression injustifiées"" de Washington pour obliger son pays à couper les ponts avec la Russie, dans le sillage de l’incident du navire Lady R.Des pressions américaines qui n’aboutiront sans doute pas, affirment cependant Abdou Karim Diakhaté, qui applaudit la ""prise de conscience"" des pays africains sur le sujet.'], ['La résilience de l’Afrique après la pandémie de Covid-19 a notamment montré que le continent pouvait se prendre en charge lui-même.'], ['""Je ne pense pas que les pressions exercées par les pays occidentaux sur certains pays africains quant au choix de leurs partenaires puissent aboutir.'], ['Il y a une prise de conscience qui va au-delà du simple constat, une réelle démarche de rupture dont on voit les effets se produire ici et là, à travers des prises de position de plus en plus audacieuses, des réflexions et des actes forts posés par des élites politiques et une société civile très dynamique"", déclare-t-il ainsi.La Russie n’est pas isoléeLes liens que cultivent aujourd’hui les pays africains avec Moscou prouvent en outre que la Russie n’est pas isolée sur la scène internationale, souligne encore Abdou Karim Diakhaté.'], ['Les pays arabes s’abstiennent également de prendre des sanctions, tandis que la position de la Russie au sein des BRICS lui assure certains soutiens, explique l’expert.'], ['""Dans le monde multipolaire, un isolement de la Russie ne me semble pas possible compte tenu des enjeux géostratégiques et des intérêts divergents des pays Seuls 28 pays sur les 54 que compte l’Union africaine ont voté en faveur de la résolution condamnant l’invasion russe de l’Ukraine D’autres pays, comme l’Inde et l’Iran, tentent de préserver leurs liens économiques avec l’Occident, mais aussi leur coopération énergétique et sécuritaire avec la Russie"", argumente-t-il.Un constat partagé par le géopolitologue français Aymeric Chauprade, qui expliquait récemment à Sputnik que la stratégie occidentale d’isolement de la Russie avait ses limites.']]]","[[['visites', 'officiels', 'américains', 'afrique', 'feux', 'continent'], ['washington', 'perte', 'influence', 'française', 'régions', 'apparition', 'nouveaux', 'partenaires', 'chinois', 'russes', 'sputnik', 'abdou', 'karim', 'diakhaté', 'politologue', 'directeur', 'publication', 'magazine', 'panafricain'], ['marteau', 'russe', 'enclume', 'chinoise', 'afrique'], ['chine', 'principal', 'partenaire', 'commercial', 'pays', 'continent', 'coopération', 'pays', 'africains', 'russie', 'nouvelle', 'dynamique', 'grands', 'espoirs'], ['tendance', 'financements', 'baisse', 'aides', 'afrique'], ['joe', 'biden', 'plan', 'marshall', 'milliards', 'dollars', 'destination', 'continent', 'financement', 'milliards', 'ans', 'dernier', 'sommet', 'afrique', 'abdou', 'karim', 'pressions', 'inefficacescette', 'perte', 'influence', 'américaine', 'washington', 'morale', 'pays', 'africains', 'collaboration', 'moscou', 'pékin'], ['début', 'janvier', 'ministre', 'défense', 'thandi', 'modise', 'pression', 'injustifiées', 'washington', 'pays', 'ponts', 'russie', 'sillage', 'incident', 'navire', 'lady', 'pressions', 'américaines', 'doute', 'abdou', 'karim', 'diakhaté', 'prise', 'conscience', 'pays', 'africains', 'sujet'], ['résilience', 'afrique', 'pandémie', 'continent', 'charge'], ['pressions', 'pays', 'occidentaux', 'pays', 'africains', 'choix', 'partenaires'], ['prise', 'conscience', 'simple', 'constat', 'réelle', 'démarche', 'rupture', 'effets', 'travers', 'prises', 'position', 'audacieuses', 'réflexions', 'actes', 'forts', 'élites', 'politiques', 'société', 'civile', 'dynamique', 'russie', 'isoléeles', 'liens', 'pays', 'africains', 'moscou', 'russie', 'scène', 'internationale', 'abdou', 'karim', 'diakhaté'], ['pays', 'arabes', 'sanctions', 'position', 'russie', 'sein', 'brics', 'soutiens', 'expert'], ['monde', 'multipolaire', 'isolement', 'russie', 'compte', 'enjeux', 'géostratégiques', 'intérêts', 'divergents', 'pays', 'pays', 'compte', 'union', 'africaine', 'faveur', 'résolution', 'invasion', 'russe', 'ukraine', 'pays', 'inde', 'iran', 'liens', 'économiques', 'occident', 'coopération', 'énergétique', 'sécuritaire', 'russie', 'constat', 'géopolitologue', 'français', 'aymeric', 'chauprade', 'sputnik', 'stratégie', 'occidentale', 'isolement', 'russie', 'limites']]]","[[['Afrique', 'États-Unis'], [], ['États-Unis', 'Afrique'], ['Chine', 'Russie'], ['États-Unis', 'l’Afrique'], ['Afrique - États-Unis', 'Moscou', 'Pékin'], ['Washington', 'Russie'], ['l’Afrique'], [], ['Russie', 'Moscou', 'Russie'], ['Russie'], ['Russie', 'Ukraine', 'Inde', 'Iran', 'Occident', 'Russie', 'Russie']]]","[[[], ['Panafricain'], [], [], [], ['G7'], ['ministre de la Défense sud-africaine'], [], [], [], ['BRICS'], ['Union africaine', 'Sputnik']]]","[[[], ['Washington', 'Sputnik Abdou Karim Diakhaté'], [], [], ['Washington'], ['Joe Biden', 'Abdou Karim Diakhaté', 'Washington'], ['Abdou Karim Diakhaté'], [], [], ['Abdou Karim Diakhaté'], [], ['Aymeric Chauprade']]]","{'visites': 1, 'officiels': 1, 'américains': 1, 'afrique': 5, 'feux': 1, 'continent': 4, 'washington': 3, 'perte': 2, 'influence': 2, 'française': 1, 'régions': 1, 'apparition': 1, 'nouveaux': 1, 'partenaires': 2, 'chinois': 1, 'russes': 1, 'sputnik': 2, 'abdou': 4, 'karim': 4, 'diakhaté': 3, 'politologue': 1, 'directeur': 1, 'publication': 1, 'magazine': 1, 'panafricain': 1, 'marteau': 1, 'russe': 2, 'enclume': 1, 'chinoise': 1, 'chine': 1, 'principal': 1, 'partenaire': 1, 'commercial': 1, 'pays': 12, 'coopération': 2, 'africains': 5, 'russie': 8, 'nouvelle': 1, 'dynamique': 2, 'grands': 1, 'espoirs': 1, 'tendance': 1, 'financements': 1, 'baisse': 1, 'aides': 1, 'joe': 1, 'biden': 1, 'plan': 1, 'marshall': 1, 'milliards': 2, 'dollars': 1, 'destination': 1, 'financement': 1, 'ans': 1, 'dernier': 1, 'sommet': 1, 'pressions': 3, 'inefficacescette': 1, 'américaine': 1, 'morale': 1, 'collaboration': 1, 'moscou': 2, 'pékin': 1, 'début': 1, 'janvier': 1, 'ministre': 1, 'défense': 1, 'thandi': 1, 'modise': 1, 'pression': 1, 'injustifiées': 1, 'ponts': 1, 'sillage': 1, 'incident': 1, 'navire': 1, 'lady': 1, 'américaines': 1, 'doute': 1, 'prise': 2, 'conscience': 2, 'sujet': 1, 'résilience': 1, 'pandémie': 1, 'charge': 1, 'occidentaux': 1, 'choix': 1, 'simple': 1, 'constat': 2, 'réelle': 1, 'démarche': 1, 'rupture': 1, 'effets': 1, 'travers': 1, 'prises': 1, 'position': 2, 'audacieuses': 1, 'réflexions': 1, 'actes': 1, 'forts': 1, 'élites': 1, 'politiques': 1, 'société': 1, 'civile': 1, 'isoléeles': 1, 'liens': 2, 'scène': 1, 'internationale': 1, 'arabes': 1, 'sanctions': 1, 'sein': 1, 'brics': 1, 'soutiens': 1, 'expert': 1, 'monde': 1, 'multipolaire': 1, 'isolement': 2, 'compte': 2, 'enjeux': 1, 'géostratégiques': 1, 'intérêts': 1, 'divergents': 1, 'union': 1, 'africaine': 1, 'faveur': 1, 'résolution': 1, 'invasion': 1, 'ukraine': 1, 'inde': 1, 'iran': 1, 'économiques': 1, 'occident': 1, 'énergétique': 1, 'sécuritaire': 1, 'géopolitologue': 1, 'français': 1, 'aymeric': 1, 'chauprade': 1, 'stratégie': 1, 'occidentale': 1, 'limites': 1}","{'Afrique': 2, 'États-Unis': 3, 'Chine': 1, 'Russie': 8, 'l’Afrique': 2, 'Afrique - États-Unis': 1, 'Moscou': 2, 'Pékin': 1, 'Washington': 1, 'Ukraine': 1, 'Inde': 1, 'Iran': 1, 'Occident': 1}","{'Panafricain': 1, 'G7': 1, 'ministre de la Défense sud-africaine': 1, 'BRICS': 1, 'Union africaine': 1, 'Sputnik': 1}","{'Washington': 3, 'Sputnik Abdou Karim Diakhaté': 1, 'Joe Biden': 1, 'Abdou Karim Diakhaté': 3, 'Aymeric Chauprade': 1}",2023,4,7
1680904800,https://fr.sputniknews.africa/20230408/du-jamais-vu-uranus-photographie-dans-les-moindres-details-par-le-telescope-james-webb-1058442901.html,Du jamais vu: Uranus photographié dans les moindres détails par le télescope James-Webb,Uranus a montré un nouveau visage grâce au télescope spatial James-Webb. Celui-ci est parvenu à immortaliser la planète en révélant ses anneaux lumineux et quelques détails inédits.,"Le télescope spatial James-Webb (JWST) de la NASA a diffusé son premier cliché d’Uranus qui dévoile ce qui restait jusque-là invisible. Ainsi, l’appareil a photographié non seulement la géante glaciale mais aussi quelques-unes de ses 27 lunes et 11 de ses 13 anneaux connus. Sur cette image exceptionnelle, ils brillent de mille feux. 🔭 EN IMAGE | Le télescope spatial James Webb de la #Nasa a partagé sa première image d’#Uranus. Elle révèle onze des treize anneaux de la planète. pic.twitter.com/L5XXHlChNt— Cerfia (@CerfiaFR) April 7, 2023 L’appareil a démontré une puissance et sensibilité colossales en enregistrant ""les deux anneaux poussiéreux les plus ténus de la planète, qui n’avaient pas été découverts avant le survol de Voyager 2 en 1986"", explique la NASA.Si l’on compare les anneaux d’Uranus à ceux de Saturne, les premiers sont plus minces, étroits et sombres que les seconds.""Grâce aux longueurs d’onde infrarouges et à la sensibilité accrue de Webb, nous voyons plus de détails, ce qui montre à quel point l’atmosphère d’Uranus est dynamique"", explique l’Agence spatiale européenne (ESA) dans un communiqué.Ce n’est que le débutLa NASA a détaillé que ces découvertes avaient été rendues possibles grâce à ""une courte exposition de 12 minutes avec seulement deux filtres"".Ainsi, il ne s’agit que de ""la partie émergée de l’iceberg de ce que James Webb peut faire pour observer cette planète mystérieuse"".D’autres études sont déjà en cours, et d’autres encore sont prévues…","[[['Le télescope spatial James-Webb (JWST) de la NASA a diffusé son premier cliché d’Uranus qui dévoile ce qui restait jusque-là invisible.'], ['Ainsi, l’appareil a photographié non seulement la géante glaciale mais aussi quelques-unes de ses 27 lunes et 11 de ses 13 anneaux connus.'], ['Sur cette image exceptionnelle, ils brillent de mille feux.'], ['🔭 EN IMAGE | Le télescope spatial James Webb de la #Nasa a partagé sa première image d’#Uranus.'], ['Elle révèle onze des treize anneaux de la planète.'], ['pic.twitter.com/L5XXHlChNt— Cerfia (@CerfiaFR) April 7, 2023 L’appareil a démontré une puissance et sensibilité colossales en enregistrant ""les deux anneaux poussiéreux les plus ténus de la planète, qui n’avaient pas été découverts avant le survol de Voyager 2 en 1986"", explique la NASA.Si l’on compare les anneaux d’Uranus à ceux de Saturne, les premiers sont plus minces, étroits et sombres que les seconds.'], ['""Grâce aux longueurs d’onde infrarouges et à la sensibilité accrue de Webb, nous voyons plus de détails, ce qui montre à quel point l’atmosphère d’Uranus est dynamique"", explique l’Agence spatiale européenne (ESA) dans un communiqué.Ce n’est que le débutLa NASA a détaillé que ces découvertes avaient été rendues possibles grâce à ""une courte exposition de 12 minutes avec seulement deux filtres"".Ainsi, il ne s’agit que de ""la partie émergée de l’iceberg de ce que James Webb peut faire pour observer cette planète mystérieuse"".D’autres études sont déjà en cours, et d’autres encore sont prévues…']]]","[[['télescope', 'spatial', 'james', 'webb', 'jwst', 'nasa', 'cliché', 'uranus', 'invisible'], ['appareil', 'géante', 'glaciale', 'lunes', 'anneaux'], ['image', 'exceptionnelle', 'feux'], ['image', 'télescope', 'spatial', 'james', 'webb', 'nasa', 'image'], ['anneaux', 'planète'], ['cerfia', 'april', 'appareil', 'puissance', 'sensibilité', 'colossales', 'anneaux', 'poussiéreux', 'ténus', 'planète', 'survol', 'anneaux', 'uranus', 'saturne', 'premiers', 'minces', 'étroits', 'sombres', 'seconds'], ['grâce', 'longueurs', 'onde', 'infrarouges', 'sensibilité', 'accrue', 'webb', 'détails', 'point', 'atmosphère', 'uranus', 'dynamique', 'agence', 'spatiale', 'européenne', 'esa', 'débutla', 'nasa', 'découvertes', 'grâce', 'courte', 'exposition', 'minutes', 'partie', 'émergée', 'iceberg', 'james', 'planète', 'études', 'cours']]]","[[['télescope spatial James-Webb', 'Uranus'], [], [], [], [], ['Uranus', 'Saturne'], ['Uranus']]]","[[['NASA'], [], [], ['Nasa'], [], ['April'], ['Agence spatiale européenne', 'ESA', 'NASA']]]","[[[], [], [], [], [], [], ['Webb', 'James Webb']]]","{'télescope': 2, 'spatial': 2, 'james': 3, 'webb': 3, 'jwst': 1, 'nasa': 3, 'cliché': 1, 'uranus': 3, 'invisible': 1, 'appareil': 2, 'géante': 1, 'glaciale': 1, 'lunes': 1, 'anneaux': 4, 'image': 3, 'exceptionnelle': 1, 'feux': 1, 'planète': 3, 'cerfia': 1, 'april': 1, 'puissance': 1, 'sensibilité': 2, 'colossales': 1, 'poussiéreux': 1, 'ténus': 1, 'survol': 1, 'saturne': 1, 'premiers': 1, 'minces': 1, 'étroits': 1, 'sombres': 1, 'seconds': 1, 'grâce': 2, 'longueurs': 1, 'onde': 1, 'infrarouges': 1, 'accrue': 1, 'détails': 1, 'point': 1, 'atmosphère': 1, 'dynamique': 1, 'agence': 1, 'spatiale': 1, 'européenne': 1, 'esa': 1, 'débutla': 1, 'découvertes': 1, 'courte': 1, 'exposition': 1, 'minutes': 1, 'partie': 1, 'émergée': 1, 'iceberg': 1, 'études': 1, 'cours': 1}","{'télescope spatial James-Webb': 1, 'Uranus': 3, 'Saturne': 1}","{'NASA': 2, 'Nasa': 1, 'April': 1, 'Agence spatiale européenne': 1, 'ESA': 1}","{'Webb': 1, 'James Webb': 1}",2023,4,7
1680904800,https://fr.sputniknews.africa/20230408/la-coree-du-nord-effectue-un-test-de-drone-dattaque-sous-marin-a-capacite-nucleaire-1058442761.html,La Corée du Nord effectue un test de drone d'attaque sous-marin à capacité nucléaire,"La Corée du Nord a annoncé ce samedi 8 avril avoir procédé avec succès à un test de drone d'attaque sous-marin à capacité nucléaire. L'engin a ""explosé avec précision sous l’eau”, affirme Pyongyang.","Le test de ce ""système d'arme stratégique sous-marine"" s’est tenu du 4 au 7 avril, a précisé l’agence de presse sud-coréenne Yonhap, citant le média officiel nord-coréen. L’arme a “explosé avec précision sous l’eau”, a affirmé Pyongyang, estimant que cet essai “prouve la fiabilité du système d’armement stratégique sous-marin et sa faculté d’attaque létale”. Le drone d'essai a été déployé à partir d'un port de la province du Hamgyong du Sud et a navigué le long d'un parcours simulant une distance de 1.000 kilomètres pendant 71 heures et six minutes. Cet essai intervient alors que la Corée du Sud et les Etats-Unis ont effectué récemment des exercices aériens conjoints avec un bombardier stratégique B-52H. Il s’agit du troisième test de ce dispositif revendiqué par la Corée du Nord, qui a récemment dévoilé l'ogive nucléaire tactique Hwasan-31.","[[['Le test de ce ""système d\'arme stratégique sous-marine"" s’est tenu du 4 au 7 avril, a précisé l’agence de presse sud-coréenne Yonhap, citant le média officiel nord-coréen.'], ['L’arme a “explosé avec précision sous l’eau”, a affirmé Pyongyang, estimant que cet essai “prouve la fiabilité du système d’armement stratégique sous-marin et sa faculté d’attaque létale”.'], [""Le drone d'essai a été déployé à partir d'un port de la province du Hamgyong du Sud et a navigué le long d'un parcours simulant une distance de 1.000 kilomètres pendant 71 heures et six minutes.""], ['Cet essai intervient alors que la Corée du Sud et les Etats-Unis ont effectué récemment des exercices aériens conjoints avec un bombardier stratégique B-52H.'], [""Il s’agit du troisième test de ce dispositif revendiqué par la Corée du Nord, qui a récemment dévoilé l'ogive nucléaire tactique Hwasan-31.""]]]","[[['test', 'système', 'arme', 'stratégique', 'avril', 'agence', 'presse', 'média', 'officiel'], ['arme', 'précision', 'eau', 'pyongyang', 'essai', 'fiabilité', 'système', 'armement', 'stratégique', 'faculté', 'attaque', 'létale'], ['drone', 'essai', 'port', 'province', 'hamgyong', 'sud', 'long', 'parcours', 'distance', 'kilomètres', 'heures', 'minutes'], ['essai', 'corée', 'sud', 'exercices', 'aériens', 'conjoints', 'bombardier', 'stratégique'], ['test', 'dispositif', 'corée', 'nord', 'ogive', 'nucléaire', 'tactique']]]","[[[], ['Pyongyang'], ['Hamgyong du Sud'], ['Corée du Sud', 'Etats-Unis'], ['Corée du Nord', 'Hwasan-31']]]","[[[], [], [], [], []]]","[[['Yonhap'], [], [], [], []]]","{'test': 2, 'système': 2, 'arme': 2, 'stratégique': 3, 'avril': 1, 'agence': 1, 'presse': 1, 'média': 1, 'officiel': 1, 'précision': 1, 'eau': 1, 'pyongyang': 1, 'essai': 3, 'fiabilité': 1, 'armement': 1, 'faculté': 1, 'attaque': 1, 'létale': 1, 'drone': 1, 'port': 1, 'province': 1, 'hamgyong': 1, 'sud': 2, 'long': 1, 'parcours': 1, 'distance': 1, 'kilomètres': 1, 'heures': 1, 'minutes': 1, 'corée': 2, 'exercices': 1, 'aériens': 1, 'conjoints': 1, 'bombardier': 1, 'dispositif': 1, 'nord': 1, 'ogive': 1, 'nucléaire': 1, 'tactique': 1}","{'Pyongyang': 1, 'Hamgyong du Sud': 1, 'Corée du Sud': 1, 'Etats-Unis': 1, 'Corée du Nord': 1, 'Hwasan-31': 1}",{},{'Yonhap': 1},2023,4,7
