timestamp,url,title,description,content,content-segmented,kws-l,loc-l,org-l,per-l,kws,loc,org,per,year,month,day
1672354800,https://fr.sputniknews.africa/20221230/au-gabon-la-promotion-des-droits-des-femmes-reste-insuffisante-selon-un-sondage-1057465247.html,"Au Gabon, la promotion des droits des femmes reste insuffisante, selon un sondage","Les Gabonais louent les efforts mis en place par le gouvernement pour promouvoir les droits des femmes, selon une enquête spéciale d’Afrobarometer. Des efforts considérables, mais tout de même insuffisants.","Les droits des femmes commencent progressivement à être reconnus à leur juste valeur au Gabon. Les Gabonais en sont fiers et approuvent cette avancée, ressort-il d’une enquête spéciale du round 9 d’Afrobarometer.""D’après la plus récente enquête Afrobarometer au Gabon, 80% des Gabonais disent que les hommes et les femmes devraient avoir les mêmes droits de posséder et d'hériter des terres"", indique le rapport de l’enquête.Une refonte complète du Code civil a donné aux femmes les mêmes droits qu’aux hommes d’être chef de famille, d’obtenir un emploi sans l’autorisation de leur conjoint, de choisir où elles veulent vivre, d’ouvrir un compte bancaire et de contrôler et d’hériter des actifs, entre autres.Encore des efforts à faireLes mesures législatives montrent un effort pour surmonter les marques de l’ancien Code civil qui concédait le contrôle des femmes aux hommes. Le droit civil donnait la priorité aux hommes d’être les chefs de famille, pour diriger avec une autorité excessive et injustifiée la vie familiale ainsi que l’existence de la femme, dans les secteurs de l’emploi, l’obtention de documents et l’ouverture de compte bancaire.Il y a encore des défis à relever, comme la vulgarisation et l’application des nouvelles lois face aux stéréotypes sociaux et aux préjugés de sexe qui demeurent dans la société gabonaise.Par ailleurs, les femmes ne détiennent que 15,38% des sièges parlementaires au Gabon, selon un rapport de Inter-Parliamentary Union, édition 2022. La grossesse précoce, qui contraint plus de la moitié des élèves-mères à abandonner leur scolarité, restreint le niveau d’instruction et le statut socio-économique des femmes, d’après une rapport de l’UNICEF, paru en 2017. Un péril qui se lit également en considérant les avortements clandestins, qui constituent l’une des causes les plus importantes de décès de femmes enceintes dans le pays, a rapporté New Humanitarian en 2015.","[[['Les droits des femmes commencent progressivement à être reconnus à leur juste valeur au Gabon.', 'Les Gabonais en sont fiers et approuvent cette avancée, ressort-il d’une enquête spéciale du round 9 d’Afrobarometer.', '""D’après la plus récente enquête Afrobarometer au Gabon, 80% des Gabonais disent que les hommes et les femmes devraient avoir les mêmes droits de posséder et d\'hériter des terres"", indique le rapport de l’enquête.Une refonte complète du Code civil a donné aux femmes les mêmes droits qu’aux hommes d’être chef de famille, d’obtenir un emploi sans l’autorisation de leur conjoint, de choisir où elles veulent vivre, d’ouvrir un compte bancaire et de contrôler et d’hériter des actifs, entre autres.Encore des efforts à faireLes mesures législatives montrent un effort pour surmonter les marques de l’ancien Code civil qui concédait le contrôle des femmes aux hommes.', 'Le droit civil donnait la priorité aux hommes d’être les chefs de famille, pour diriger avec une autorité excessive et injustifiée la vie familiale ainsi que l’existence de la femme, dans les secteurs de l’emploi, l’obtention de documents et l’ouverture de compte bancaire.Il y a encore des défis à relever, comme la vulgarisation et l’application des nouvelles lois face aux stéréotypes sociaux et aux préjugés de sexe qui demeurent dans la société gabonaise.Par ailleurs, les femmes ne détiennent que 15,38% des sièges parlementaires au Gabon, selon un rapport de Inter-Parliamentary Union, édition 2022.', 'La grossesse précoce, qui contraint plus de la moitié des élèves-mères à abandonner leur scolarité, restreint le niveau d’instruction et le statut socio-économique des femmes, d’après une rapport de l’UNICEF, paru en 2017.', 'Un péril qui se lit également en considérant les avortements clandestins, qui constituent l’une des causes les plus importantes de décès de femmes enceintes dans le pays, a rapporté New Humanitarian en 2015.']]]","[[['droit', 'femme', 'valeur', 'gabon'], ['gabonais', 'fier', 'avancée', 'ressort', 'enquête', 'spécial', 'round'], ['récent', 'enquête', 'gabon', 'gabonais', 'homme', 'femme', 'droit', 'terre', 'rapport', 'refonte', 'complet', 'code', 'civil', 'femme', 'droit', 'homme', 'chef', 'famille', 'emploi', 'autorisation', 'conjoint', 'compte', 'bancaire', 'actif', 'effort', 'fairele', 'mesure', 'législatif', 'effort', 'marque', 'ancien', 'code', 'civil', 'contrôle', 'femme', 'homme'], ['droit', 'civil', 'priorité', 'homme', 'chef', 'famille', 'autorité', 'excessif', 'injustifié', 'vie', 'familial', 'existence', 'femme', 'secteur', 'emploi', 'obtention', 'document', 'ouverture', 'compte', 'défi', 'vulgarisation', 'application', 'nouveau', 'loi', 'face', 'stéréotype', 'social', 'préjugé', 'sexe', 'société', 'femme', 'siège', 'parlementaire', 'gabon', 'rapport', 'union', 'édition'], ['grossesse', 'précoce', 'moitié', 'élève', 'mère', 'scolarité', 'restreindre', 'niveau', 'instruction', 'statut', 'femme', 'rapport', 'unicef'], ['péril', 'avortement', 'clandestin', 'cause', 'important', 'décès', 'femme', 'pays', 'new']]]","[[['Gabon'], ['Gabon'], ['Gabon', 'Gabon', 'faireLes'], ['Gabon'], [], []]]","[[[], [], ['Afrobarometer'], ['Inter-Parliamentary Union'], ['UNICEF'], ['New Humanitarian']]]","[[[], ['Afrobarometer'], [], [], [], []]]","{'droit': 4, 'femme': 8, 'valeur': 1, 'gabon': 3, 'gabonais': 2, 'fier': 1, 'avancée': 1, 'ressort': 1, 'enquête': 2, 'spécial': 1, 'round': 1, 'récent': 1, 'homme': 4, 'terre': 1, 'rapport': 3, 'refonte': 1, 'complet': 1, 'code': 2, 'civil': 3, 'chef': 2, 'famille': 2, 'emploi': 2, 'autorisation': 1, 'conjoint': 1, 'compte': 2, 'bancaire': 1, 'actif': 1, 'effort': 2, 'fairele': 1, 'mesure': 1, 'législatif': 1, 'marque': 1, 'ancien': 1, 'contrôle': 1, 'priorité': 1, 'autorité': 1, 'excessif': 1, 'injustifié': 1, 'vie': 1, 'familial': 1, 'existence': 1, 'secteur': 1, 'obtention': 1, 'document': 1, 'ouverture': 1, 'défi': 1, 'vulgarisation': 1, 'application': 1, 'nouveau': 1, 'loi': 1, 'face': 1, 'stéréotype': 1, 'social': 1, 'préjugé': 1, 'sexe': 1, 'société': 1, 'siège': 1, 'parlementaire': 1, 'union': 1, 'édition': 1, 'grossesse': 1, 'précoce': 1, 'moitié': 1, 'élève': 1, 'mère': 1, 'scolarité': 1, 'restreindre': 1, 'niveau': 1, 'instruction': 1, 'statut': 1, 'unicef': 1, 'péril': 1, 'avortement': 1, 'clandestin': 1, 'cause': 1, 'important': 1, 'décès': 1, 'pays': 1, 'new': 1}","{'Gabon': 5, 'faireLes': 1}","{'Afrobarometer': 1, 'Inter-Parliamentary Union': 1, 'UNICEF': 1, 'New Humanitarian': 1}",{'Afrobarometer': 1},2022,12,29
1672354800,https://fr.sputniknews.africa/20221230/souhaiter-la-bonne-annee-a-biden-pour-poutine-cest-hors-de-question-1057464739.html,"Souhaiter la Bonne Année à Biden? Pour Poutine, c’est hors de question","Sans langue de bois, le porte-parole du Président russe a fait savoir que Vladimir Poutine n’enverrait pas ses meilleurs vœux pour 2023 aux dirigeants de certains pays. Parmi lesquels Joe Biden, Emmanuel Macron et les autres chefs d’États...","Le Président russe n’adressera pas ses vœux pour le Nouvel an aux Présidents des pays hostiles à la Russie. Une mesure en miroir, a déclaré ce vendredi 30 décembre Dmitri Peskov, porte-parole du Président russe, à la presse.""Non, ce ne sera pas le cas.Ces homologues qui sont les nôtres n'envoient pas de vœux eux-mêmes, nous n'avons en fait aucun contact avec eux maintenant, et compte tenu des actions hostiles qu'ils entreprennent en permanence, le Président ne leur en adressera pas"", a-t-il indiqué.Il a ainsi répondu à une question sur d’éventuels souhaits de bonne année 2023 de la part de Vladimir Poutine à Joe Biden, Emmanuel Macron et au chancelier allemand Olaf Scholz.Des vœux aux pays amisLe site Internet du Kremlin a publié, le 23 décembre, les vœux présentés par le dirigeant russe aux chefs d'État et de gouvernement étrangers à l'occasion de Noël et du Nouvel An à venir.Les seuls dirigeants européens à avoir reçu de tels télégrammes de Poutine étaient Viktor Orban, le Premier ministre hongrois (le seul dirigeant de l'UE sur cette liste), et Aleksandar Vucic, le Président serbe.Aucun État africain parmi les pays ""hostiles""Les pays considérés comme hostiles par Moscou sont actuellement au nombre de 49. Publiée en mai 2021, la liste ne comptait d’abord que les États-Unis et la République tchèque. Plus tard, les autorités russes l’ont rallongée, y portant également la France, le Royaume-Uni, le Japon, Taïwan, la Nouvelle-Zélande entre autres.Aucun pays africain ne figure sur la liste des pays hostiles à Moscou.","[[['Le Président russe n’adressera pas ses vœux pour le Nouvel an aux Présidents des pays hostiles à la Russie.', 'Une mesure en miroir, a déclaré ce vendredi 30 décembre Dmitri Peskov, porte-parole du Président russe, à la presse.', '""Non, ce ne sera pas le cas.Ces homologues qui sont les nôtres n\'envoient pas de vœux eux-mêmes, nous n\'avons en fait aucun contact avec eux maintenant, et compte tenu des actions hostiles qu\'ils entreprennent en permanence, le Président ne leur en adressera pas"", a-t-il indiqué.Il a ainsi répondu à une question sur d’éventuels souhaits de bonne année 2023 de la part de Vladimir Poutine à Joe Biden, Emmanuel Macron et au chancelier allemand Olaf Scholz.Des vœux aux pays amisLe site Internet du Kremlin a publié, le 23 décembre, les vœux présentés par le dirigeant russe aux chefs d\'État et de gouvernement étrangers à l\'occasion de Noël et du Nouvel An à venir.Les seuls dirigeants européens à avoir reçu de tels télégrammes de Poutine étaient Viktor Orban, le Premier ministre hongrois (le seul dirigeant de l\'UE sur cette liste), et Aleksandar Vucic, le Président serbe.Aucun État africain parmi les pays ""hostiles""Les pays considérés comme hostiles par Moscou sont actuellement au nombre de 49.', 'Publiée en mai 2021, la liste ne comptait d’abord que les États-Unis et la République tchèque.', 'Plus tard, les autorités russes l’ont rallongée, y portant également la France, le Royaume-Uni, le Japon, Taïwan, la Nouvelle-Zélande entre autres.Aucun pays africain ne figure sur la liste des pays hostiles à Moscou.']]]","[[['président', 'russe', 'vœu', 'nouveau', 'an', 'président', 'pays', 'hostile', 'russie'], ['mesure', 'miroir', 'vendredi', 'décembre', 'peskov', 'président', 'russe', 'presse'], ['homologue', 'vœu', 'contact', 'compte', 'action', 'hostile', 'permanence', 'président', 'question', 'éventuel', 'souhait', 'bon', 'année', 'part', 'vladimir', 'poutine', 'joe', 'biden', 'emmanuel', 'chancelier', 'allemand', 'olaf', 'vœu', 'pays', 'site', 'internet', 'kremlin', 'décembre', 'vœu', 'dirigeant', 'russe', 'chef', 'état', 'gouvernement', 'étranger', 'occasion', 'noël', 'nouveau', 'an', 'dirigeant', 'européen', 'télégramme', 'poutine', 'orban', 'ministre', 'hongrois', 'dirigeant', 'ue', 'liste', 'aleksandar', 'vucic', 'président', 'état', 'africain', 'pays', 'pays', 'hostile', 'moscou', 'nombre'], ['mai', 'liste', 'république', 'tchèque'], ['autorité', 'russe', 'france', 'royaume', 'uni', 'japon', 'taïwan', 'nouveau', 'zélande', 'pays', 'africain', 'liste', 'pays', 'hostile', 'moscou']]]","[[['Russie'], [], ['Kremlin', 'État', 'État africain', 'Moscou'], ['États-Unis', 'République tchèque'], ['France', 'Royaume-Uni', 'Japon', 'Taïwan', 'Nouvelle-Zélande', 'Moscou']]]","[[['Nouvel an'], [], ['UE'], [], []]]","[[['Président russe'], ['Dmitri Peskov', 'Président russe'], ['Président', 'Vladimir Poutine', 'Joe Biden', 'Emmanuel Macron', 'Olaf Scholz', 'Poutine', 'Viktor Orban', 'Aleksandar Vucic', 'Président serbe'], [], []]]","{'président': 5, 'russe': 4, 'vœu': 4, 'nouveau': 3, 'an': 2, 'pays': 6, 'hostile': 4, 'russie': 1, 'mesure': 1, 'miroir': 1, 'vendredi': 1, 'décembre': 2, 'peskov': 1, 'presse': 1, 'homologue': 1, 'contact': 1, 'compte': 1, 'action': 1, 'permanence': 1, 'question': 1, 'éventuel': 1, 'souhait': 1, 'bon': 1, 'année': 1, 'part': 1, 'vladimir': 1, 'poutine': 2, 'joe': 1, 'biden': 1, 'emmanuel': 1, 'chancelier': 1, 'allemand': 1, 'olaf': 1, 'site': 1, 'internet': 1, 'kremlin': 1, 'dirigeant': 3, 'chef': 1, 'état': 2, 'gouvernement': 1, 'étranger': 1, 'occasion': 1, 'noël': 1, 'européen': 1, 'télégramme': 1, 'orban': 1, 'ministre': 1, 'hongrois': 1, 'ue': 1, 'liste': 3, 'aleksandar': 1, 'vucic': 1, 'africain': 2, 'moscou': 2, 'nombre': 1, 'mai': 1, 'république': 1, 'tchèque': 1, 'autorité': 1, 'france': 1, 'royaume': 1, 'uni': 1, 'japon': 1, 'taïwan': 1, 'zélande': 1}","{'Russie': 1, 'Kremlin': 1, 'État': 1, 'État africain': 1, 'Moscou': 2, 'États-Unis': 1, 'République tchèque': 1, 'France': 1, 'Royaume-Uni': 1, 'Japon': 1, 'Taïwan': 1, 'Nouvelle-Zélande': 1}","{'Nouvel an': 1, 'UE': 1}","{'Président russe': 2, 'Dmitri Peskov': 1, 'Président': 1, 'Vladimir Poutine': 1, 'Joe Biden': 1, 'Emmanuel Macron': 1, 'Olaf Scholz': 1, 'Poutine': 1, 'Viktor Orban': 1, 'Aleksandar Vucic': 1, 'Président serbe': 1}",2022,12,29
1672354800,https://fr.sputniknews.africa/20221230/les-46-militaires-ivoiriens-detenus-au-mali-condamnes-a-20-ans-de-prison--1057464260.html,Les 46 militaires ivoiriens détenus au Mali condamnés à 20 ans de prison,"La Cour d'appel de Bamako a condamné à 20 ans de prison les 46 soldats ivoiriens détenus à Bamako depuis juillet. Ils ont été reconnus coupables, entre autres, d'atteinte à la sûreté extérieure de l'État et de complot contre le...","Les 46 soldats ivoiriens détenus à Bamako depuis juillet et que le Mali accuse d'être des mercenaires ont été condamnés ce vendredi 30 décembre à 20 ans de prison, a annoncé le procureur général près la Cour d'appel de Bamako.""La Cour d’assises est entrée en voie de condamnation contre les 46 accusés comparants, dont liste nominative figurant audit Arrêt, par le prononcé à leur encontre de la peine de 20 ans de réclusion criminelle et celle de deux (2) millions d’amende chacun"", lit-on dans le communiqué. #Mali-Affaire des 46 : Le Procureur Général communique sur le verdict. pic.twitter.com/X5psBTUpBk— Niang Abdoul (@NiangAbdoul15) December 30, 2022 Les soldats ont été reconnus coupables de ""crimes d’attentat et complot contre le Gouvernement, d’atteinte à la sûreté extérieure de l’État, de détention, port et transport d’armes et de munitions de guerre ou de défense intentionnellement en relation avec une entreprise individuelle et collective ayant pour but de troubler l’ordre public par l’intimidation ou la terreur"".La cour a en outre ordonné la confiscation des armes ayant servi à commettre les infractions retenues à la charge des accusés.Les trois femmes soldats ivoiriennes libérées en septembre ont été condamnées à la peine de mort par contumace et à 10 millions d'amende chacune.""La Cour est également entrée en voie de condamnation par contumace contre les trois accusées non comparantes dont liste nominative figurant également audit Arrêt par le prononcé à leur encontre de la peine de mort et celle de 10 millions d’amende chacune du chef des mêmes infractions retenues à la charge de leurs coaccusés comparants.""Le procès, lancé le 29 décembre à Bamako, s'est tenu à huis clos et sous haute surveillance des forces de sécurité, selon l'agence France-Presse. Il intervient deux jours avant l'ultimatum fixé par les chefs d'État ouest-africains au gouvernement de transition malien pour libérer les 46 militaires, et une semaine après que le ministre ivoirien de la Défense a assuré que l'affaire était ""en voie de résolution"" après une visite officielle à Bamako.Détenus depuis juilletLes autorités maliennes ont arrêté 49 soldats ivoiriens le 10 juillet sur le sol malien, les accusant d'être des ""mercenaires"". Les soldats ont été inculpés mi-août de ""tentative d'atteinte à la sûreté extérieure de l'État"" et formellement écroués. Trois femmes ont été libérées après une médiation togolaise.La Côte d'ivoire a assuré que ces combattants étaient en mission pour l'Onu, dans le cadre d'opérations de soutien logistique à la Mission des Nations unies au Mali (MINUSMA) et exige leur libération.","[[[""Les 46 soldats ivoiriens détenus à Bamako depuis juillet et que le Mali accuse d'être des mercenaires ont été condamnés ce vendredi 30 décembre à 20 ans de prison, a annoncé le procureur général près la Cour d'appel de Bamako."", '""La Cour d’assises est entrée en voie de condamnation contre les 46 accusés comparants, dont liste nominative figurant audit Arrêt, par le prononcé à leur encontre de la peine de 20 ans de réclusion criminelle et celle de deux (2) millions d’amende chacun"", lit-on dans le communiqué.', '#Mali-Affaire des 46 : Le Procureur Général communique sur le verdict.', 'pic.twitter.com/X5psBTUpBk— Niang Abdoul (@NiangAbdoul15) December 30, 2022 Les soldats ont été reconnus coupables de ""crimes d’attentat et complot contre le Gouvernement, d’atteinte à la sûreté extérieure de l’État, de détention, port et transport d’armes et de munitions de guerre ou de défense intentionnellement en relation avec une entreprise individuelle et collective ayant pour but de troubler l’ordre public par l’intimidation ou la terreur"".La cour a en outre ordonné la confiscation des armes ayant servi à commettre les infractions retenues à la charge des accusés.Les trois femmes soldats ivoiriennes libérées en septembre ont été condamnées à la peine de mort par contumace et à 10 millions d\'amende chacune.', '""La Cour est également entrée en voie de condamnation par contumace contre les trois accusées non comparantes dont liste nominative figurant également audit Arrêt par le prononcé à leur encontre de la peine de mort et celle de 10 millions d’amende chacune du chef des mêmes infractions retenues à la charge de leurs coaccusés comparants.', '""Le procès, lancé le 29 décembre à Bamako, s\'est tenu à huis clos et sous haute surveillance des forces de sécurité, selon l\'agence France-Presse.', 'Il intervient deux jours avant l\'ultimatum fixé par les chefs d\'État ouest-africains au gouvernement de transition malien pour libérer les 46 militaires, et une semaine après que le ministre ivoirien de la Défense a assuré que l\'affaire était ""en voie de résolution"" après une visite officielle à Bamako.Détenus depuis juilletLes autorités maliennes ont arrêté 49 soldats ivoiriens le 10 juillet sur le sol malien, les accusant d\'être des ""mercenaires"".', 'Les soldats ont été inculpés mi-août de ""tentative d\'atteinte à la sûreté extérieure de l\'État"" et formellement écroués.', ""Trois femmes ont été libérées après une médiation togolaise.La Côte d'ivoire a assuré que ces combattants étaient en mission pour l'Onu, dans le cadre d'opérations de soutien logistique à la Mission des Nations unies au Mali (MINUSMA) et exige leur libération.""]]]","[[['soldat', 'ivoirien', 'bamako', 'juillet', 'mali', 'mercenaire', 'vendredi', 'décembre', 'an', 'prison', 'procureur', 'général', 'cour', 'appel', 'bamako'], ['cour', 'assise', 'voie', 'condamnation', 'accusé', 'comparant', 'liste', 'nominatif', 'audit', 'arrêt', 'encontre', 'peine', 'an', 'réclusion', 'criminel', 'million', 'amende', 'lit', 'communiqué'], ['mali', 'affaire', 'procureur', 'général', 'verdict'], ['niang', 'abdoul', 'december', 'soldat', 'coupable', 'crime', 'attentat', 'complot', 'gouvernement', 'atteinte', 'sûreté', 'extérieur', 'état', 'détention', 'port', 'transport', 'arme', 'munition', 'guerre', 'défense', 'relation', 'entreprise', 'individuel', 'collective', 'but', 'ordre', 'public', 'intimidation', 'cour', 'confiscation', 'arme', 'infraction', 'charge', 'femme', 'soldat', 'ivoirien', 'septembre', 'peine', 'mort', 'contumace', 'million', 'amende'], ['cour', 'voie', 'condamnation', 'contumace', 'accusé', 'comparant', 'liste', 'nominatif', 'audit', 'arrêt', 'prononcé', 'encontre', 'peine', 'mort', 'million', 'amende', 'chef', 'infraction', 'charge', 'coaccusé', 'comparant'], ['procès', 'décembre', 'bamako', 'huis', 'haut', 'surveillance', 'force', 'sécurité', 'agence', 'franc', 'presse'], ['jour', 'ultimatum', 'chef', 'état', 'gouvernement', 'transition', 'malien', 'militaire', 'semaine', 'ministre', 'ivoirien', 'défense', 'affaire', 'voie', 'résolution', 'visite', 'officiel', 'juilletle', 'autorité', 'malien', 'soldat', 'ivoirien', 'juillet', 'sol', 'malien', 'mercenaire'], ['soldat', 'tentative', 'atteinte', 'sûreté', 'extérieur', 'état'], ['femme', 'médiation', 'côte', 'ivoire', 'combattant', 'mission', 'onu', 'cadre', 'opération', 'soutien', 'logistique', 'mission', 'nation', 'uni', 'mali', 'minusma', 'libération']]]","[[['Bamako', 'Mali', ""Cour d'appel de Bamako""], ['Cour d’assises'], ['Procureur Général'], ['État'], [], ['Bamako'], ['État', 'Bamako', 'juilletLes'], ['État'], [""Côte d'ivoire""]]]","[[[], [], [], ['Gouvernement'], ['Cour'], ['France-Presse'], [], [], ['Onu', 'Mission des Nations unies au Mali', 'MINUSMA']]]","[[[], [], [], [], [], [], [], [], []]]","{'soldat': 5, 'ivoirien': 4, 'bamako': 3, 'juillet': 2, 'mali': 3, 'mercenaire': 2, 'vendredi': 1, 'décembre': 2, 'an': 2, 'prison': 1, 'procureur': 2, 'général': 2, 'cour': 4, 'appel': 1, 'assise': 1, 'voie': 3, 'condamnation': 2, 'accusé': 2, 'comparant': 3, 'liste': 2, 'nominatif': 2, 'audit': 2, 'arrêt': 2, 'encontre': 2, 'peine': 3, 'réclusion': 1, 'criminel': 1, 'million': 3, 'amende': 3, 'lit': 1, 'communiqué': 1, 'affaire': 2, 'verdict': 1, 'niang': 1, 'abdoul': 1, 'december': 1, 'coupable': 1, 'crime': 1, 'attentat': 1, 'complot': 1, 'gouvernement': 2, 'atteinte': 2, 'sûreté': 2, 'extérieur': 2, 'état': 3, 'détention': 1, 'port': 1, 'transport': 1, 'arme': 2, 'munition': 1, 'guerre': 1, 'défense': 2, 'relation': 1, 'entreprise': 1, 'individuel': 1, 'collective': 1, 'but': 1, 'ordre': 1, 'public': 1, 'intimidation': 1, 'confiscation': 1, 'infraction': 2, 'charge': 2, 'femme': 2, 'septembre': 1, 'mort': 2, 'contumace': 2, 'prononcé': 1, 'chef': 2, 'coaccusé': 1, 'procès': 1, 'huis': 1, 'haut': 1, 'surveillance': 1, 'force': 1, 'sécurité': 1, 'agence': 1, 'franc': 1, 'presse': 1, 'jour': 1, 'ultimatum': 1, 'transition': 1, 'malien': 3, 'militaire': 1, 'semaine': 1, 'ministre': 1, 'résolution': 1, 'visite': 1, 'officiel': 1, 'juilletle': 1, 'autorité': 1, 'sol': 1, 'tentative': 1, 'médiation': 1, 'côte': 1, 'ivoire': 1, 'combattant': 1, 'mission': 2, 'onu': 1, 'cadre': 1, 'opération': 1, 'soutien': 1, 'logistique': 1, 'nation': 1, 'uni': 1, 'minusma': 1, 'libération': 1}","{'Bamako': 3, 'Mali': 1, ""Cour d'appel de Bamako"": 1, 'Cour d’assises': 1, 'Procureur Général': 1, 'État': 3, 'juilletLes': 1, ""Côte d'ivoire"": 1}","{'Gouvernement': 1, 'Cour': 1, 'France-Presse': 1, 'Onu': 1, 'Mission des Nations unies au Mali': 1, 'MINUSMA': 1}",{},2022,12,29
