timestamp,url,title,description,content,content-segmented,kws-l,loc-l,org-l,per-l,kws,loc,org,per,year,month,day
1677711600,https://fr.sputniknews.africa/20230302/le-flux-darmes-de-loccident-vers-lafrique-pourrait-provoquer-une-hausse-des-conflits-1058085828.html,"Le flux d'armes de l’Occident vers l'Afrique pourrait ""provoquer une hausse des conflits""","Dans un contexte d’intensification du commerce d’armes occidentales en provenance de l’Ukraine, un analyste politique et un expert en matière de sécurité tchadiens interrogés par Sputnik mettent en garde contre les activités des groupes...","Le trafic d’armes occidentales en provenance de l’Ukraine contribue à l’essor du terrorisme en Afrique, explique à Sputnik l’expert tchadien en matière de sécurité Ismail Mohamed Tahir qui pointe plusieurs facteurs y contribuant.""Outre les terroristes, il y a des groupes militaires plus petits qui s’affrontent régulièrement à cause, par exemple, des ressources naturelles, des mines et des fermes. Même des groupes armés comme cela reçoivent des armes en provenance de l’Europe. Par conséquent, cela pourrait concerner le nord du Tchad et le Niger où se déroulent des combats pour le contrôle des gisements d’or. Et l’Algérie s’avère soudainement être un hub de transport de ces armes"", a-t-il souligné.L’analyste politique tchadien Abou Bakr Abdel Salam a également confirmé à Sputnik que le flux principal concernait des mouvements rebelles et des cellules terroristes.""Par exemple, dans la région tchadienne de Tibesti, les armes tombent dans toutes les mains. Certains les portent sur eux sous prétexte d’autodéfense. Le trafic d’armes est aussi actif au Congo, au Nigeria. Les risques de nouveaux affrontements, de coups d’État, de hausse de la violence et d’instabilité sont grands. Des mafias et des gangs dans nombre de pays du Sahel ont déjà reçu des armes en provenance de l’Europe. Prochainement, cela pourrait provoquer une hausse des conflits"", a estimé l’analyste.Les avertissements russesEn octobre 2022, l’Onu s’est alarmée face au regain d’activités des terroristes et extrémistes en Afrique, qui ""exploitent l'instabilité et les conflits pour intensifier les attaques à travers le continent"". La Russie a à plusieurs reprises déclaré qu’une partie importante d’armes occidentales fournies à l’Ukraine tombait entre les mains de terroristes ou était volée.""Nous avons donné de nombreuses preuves sur la façon dont une partie importante des armes tombe entre les mains de terroristes et de criminels, alimentant des conflits dans le monde entier, et une énorme quantité de ressources est tout simplement volée"", a déclaré le 17 novembre le représentant russe au Conseil de sécurité de l'Onu, Vassili Nebenzia.Fin octobre, Vladimir Poutine a mis en garde contre les livraisons abondantes d’armes à l’Ukraine par les États-Unis. Il a appelé à prêter attention au ""marché noir"" et au risque que des armes puissantes tombent entre les mains de criminels.","[[['Le trafic d’armes occidentales en provenance de l’Ukraine contribue à l’essor du terrorisme en Afrique, explique à Sputnik l’expert tchadien en matière de sécurité Ismail Mohamed Tahir qui pointe plusieurs facteurs y contribuant.'], ['""Outre les terroristes, il y a des groupes militaires plus petits qui s’affrontent régulièrement à cause, par exemple, des ressources naturelles, des mines et des fermes.'], ['Même des groupes armés comme cela reçoivent des armes en provenance de l’Europe.'], ['Par conséquent, cela pourrait concerner le nord du Tchad et le Niger où se déroulent des combats pour le contrôle des gisements d’or.'], ['Et l’Algérie s’avère soudainement être un hub de transport de ces armes"", a-t-il souligné.L’analyste politique tchadien Abou Bakr Abdel Salam a également confirmé à Sputnik que le flux principal concernait des mouvements rebelles et des cellules terroristes.'], ['""Par exemple, dans la région tchadienne de Tibesti, les armes tombent dans toutes les mains.'], ['Certains les portent sur eux sous prétexte d’autodéfense.'], ['Le trafic d’armes est aussi actif au Congo, au Nigeria.'], ['Les risques de nouveaux affrontements, de coups d’État, de hausse de la violence et d’instabilité sont grands.'], ['Des mafias et des gangs dans nombre de pays du Sahel ont déjà reçu des armes en provenance de l’Europe.'], ['Prochainement, cela pourrait provoquer une hausse des conflits"", a estimé l’analyste.Les avertissements russesEn octobre 2022, l’Onu s’est alarmée face au regain d’activités des terroristes et extrémistes en Afrique, qui ""exploitent l\'instabilité et les conflits pour intensifier les attaques à travers le continent"".'], ['La Russie a à plusieurs reprises déclaré qu’une partie importante d’armes occidentales fournies à l’Ukraine tombait entre les mains de terroristes ou était volée.'], ['""Nous avons donné de nombreuses preuves sur la façon dont une partie importante des armes tombe entre les mains de terroristes et de criminels, alimentant des conflits dans le monde entier, et une énorme quantité de ressources est tout simplement volée"", a déclaré le 17 novembre le représentant russe au Conseil de sécurité de l\'Onu, Vassili Nebenzia.Fin octobre, Vladimir Poutine a mis en garde contre les livraisons abondantes d’armes à l’Ukraine par les États-Unis.'], ['Il a appelé à prêter attention au ""marché noir"" et au risque que des armes puissantes tombent entre les mains de criminels.']]]","[[['trafic', 'armes', 'occidentales', 'provenance', 'ukraine', 'essor', 'terrorisme', 'afrique', 'sputnik', 'expert', 'tchadien', 'matière', 'sécurité', 'mohamed', 'tahir', 'pointe', 'facteurs'], ['terroristes', 'groupes', 'militaires', 'petits', 'cause', 'exemple', 'ressources', 'naturelles', 'mines', 'fermes'], ['groupes', 'armés', 'armes', 'provenance', 'europe'], ['conséquent', 'nord', 'tchad', 'combats', 'contrôle', 'gisements'], ['algérie', 'hub', 'transport', 'armes', 'analyste', 'politique', 'tchadien', 'abou', 'bakr', 'abdel', 'salam', 'sputnik', 'flux', 'principal', 'mouvements', 'rebelles', 'cellules', 'terroristes'], ['exemple', 'région', 'tchadienne', 'tibesti', 'armes', 'mains'], ['prétexte', 'autodéfense'], ['trafic', 'armes', 'actif', 'congo', 'nigeria'], ['risques', 'nouveaux', 'affrontements', 'coups', 'état', 'hausse', 'violence', 'instabilité', 'grands'], ['mafias', 'gangs', 'nombre', 'pays', 'sahel', 'armes', 'provenance', 'europe'], ['hausse', 'conflits', 'avertissements', 'russesen', 'octobre', 'onu', 'face', 'regain', 'activités', 'terroristes', 'extrémistes', 'afrique', 'instabilité', 'conflits', 'attaques', 'travers', 'continent'], ['russie', 'reprises', 'partie', 'importante', 'armes', 'occidentales', 'ukraine', 'mains', 'terroristes'], ['preuves', 'partie', 'importante', 'armes', 'mains', 'terroristes', 'criminels', 'conflits', 'monde', 'entier', 'énorme', 'quantité', 'ressources', 'novembre', 'représentant', 'russe', 'conseil', 'sécurité', 'onu', 'vassili', 'octobre', 'vladimir', 'poutine', 'garde', 'livraisons', 'abondantes', 'armes', 'ukraine'], ['attention', 'marché', 'noir', 'risque', 'armes', 'puissantes', 'mains', 'criminels']]]","[[['Ukraine', 'Afrique'], [], ['l’Europe'], ['Tchad', 'Niger'], ['Algérie'], ['Tibesti'], [], ['Congo', 'Nigeria'], ['État'], ['Sahel', 'l’Europe'], ['Afrique'], ['Russie', 'Ukraine'], ['Ukraine', 'États-Unis'], []]]","[[['Sputnik'], [], [], [], ['Sputnik'], [], [], [], [], [], ['Onu'], [], [""Conseil de sécurité de l'Onu""], []]]","[[['Ismail Mohamed Tahir'], [], [], [], ['Abou Bakr Abdel Salam'], [], [], [], [], [], [], [], ['Vassili Nebenzia', 'Vladimir Poutine'], []]]","{'trafic': 2, 'armes': 10, 'occidentales': 2, 'provenance': 3, 'ukraine': 3, 'essor': 1, 'terrorisme': 1, 'afrique': 2, 'sputnik': 2, 'expert': 1, 'tchadien': 2, 'matière': 1, 'sécurité': 2, 'mohamed': 1, 'tahir': 1, 'pointe': 1, 'facteurs': 1, 'terroristes': 5, 'groupes': 2, 'militaires': 1, 'petits': 1, 'cause': 1, 'exemple': 2, 'ressources': 2, 'naturelles': 1, 'mines': 1, 'fermes': 1, 'armés': 1, 'europe': 2, 'conséquent': 1, 'nord': 1, 'tchad': 1, 'combats': 1, 'contrôle': 1, 'gisements': 1, 'algérie': 1, 'hub': 1, 'transport': 1, 'analyste': 1, 'politique': 1, 'abou': 1, 'bakr': 1, 'abdel': 1, 'salam': 1, 'flux': 1, 'principal': 1, 'mouvements': 1, 'rebelles': 1, 'cellules': 1, 'région': 1, 'tchadienne': 1, 'tibesti': 1, 'mains': 4, 'prétexte': 1, 'autodéfense': 1, 'actif': 1, 'congo': 1, 'nigeria': 1, 'risques': 1, 'nouveaux': 1, 'affrontements': 1, 'coups': 1, 'état': 1, 'hausse': 2, 'violence': 1, 'instabilité': 2, 'grands': 1, 'mafias': 1, 'gangs': 1, 'nombre': 1, 'pays': 1, 'sahel': 1, 'conflits': 3, 'avertissements': 1, 'russesen': 1, 'octobre': 2, 'onu': 2, 'face': 1, 'regain': 1, 'activités': 1, 'extrémistes': 1, 'attaques': 1, 'travers': 1, 'continent': 1, 'russie': 1, 'reprises': 1, 'partie': 2, 'importante': 2, 'preuves': 1, 'criminels': 2, 'monde': 1, 'entier': 1, 'énorme': 1, 'quantité': 1, 'novembre': 1, 'représentant': 1, 'russe': 1, 'conseil': 1, 'vassili': 1, 'vladimir': 1, 'poutine': 1, 'garde': 1, 'livraisons': 1, 'abondantes': 1, 'attention': 1, 'marché': 1, 'noir': 1, 'risque': 1, 'puissantes': 1}","{'Ukraine': 3, 'Afrique': 2, 'l’Europe': 2, 'Tchad': 1, 'Niger': 1, 'Algérie': 1, 'Tibesti': 1, 'Congo': 1, 'Nigeria': 1, 'État': 1, 'Sahel': 1, 'Russie': 1, 'États-Unis': 1}","{'Sputnik': 2, 'Onu': 1, ""Conseil de sécurité de l'Onu"": 1}","{'Ismail Mohamed Tahir': 1, 'Abou Bakr Abdel Salam': 1, 'Vassili Nebenzia': 1, 'Vladimir Poutine': 1}",2023,3,1
1677711600,https://fr.sputniknews.africa/20230302/pres-de-650-militaires-ukrainiens-un-su-24-14-drones-3-entrepots-ce-que-lukraine-a-perdu-en-24h-1058085556.html,"Près de 650 militaires ukrainiens, un Su-24, 14 drones, 3 entrepôts… ce que l’Ukraine a perdu en 24h","Durant ces dernières 24 heures, l’armée russe a abattu un bombardier, un hélicoptère et 14 drones, rapporte la Défense russe. Environ 640 soldats ukrainiens dont 270 sur l’axe de Donetsk ont été éliminés. Des obusiers Gvozdika, Msta-B et...","Les forces armées russes ont éliminé près de 640 militaires ukrainiens sur toute la ligne de front ces dernières 24 heures, a rapporté ce 2 mars le ministère russe de la Défense dans son bilan quotidien de l’opération spéciale.Environ 270 d’entre eux ont été tués sur l’axe de Donetsk, jusqu’à 160 dans la direction de Krasny Liman, et plus de 50 sur l’axe de Koupiansk.Les forces de Kiev ont également perdu jusqu’à 80 de leurs soldats sur les axes de Donetsk-Sud et de Zaporojié, et autant dans la région de Kherson.Par ailleurs, un poste de communication a été frappé près d’Avdeïevka, en république populaire de Donetsk (RPD).Dans cette zone, un dépôt de munitions a également été bombardé. Deux autres sites de ce type ont été démolis dans les régions de Kherson et de Kharkov.Armes détruitesDes chasseurs russes ont abattu un bombardier ukrainien Su-24 près de Mikhaïlovka et un hélicoptère Mi-8 près de la localité Kourakhovka, les deux en RPD.L’artillerie russe a en outre anéanti deux obusiers D-30, deux canons automoteurs Gvozdika, ainsi que quatre Msta-B. Un système de défense antiaérienne Bouk M-1 a été détruit près de la ville de Kramatorsk. Un radar du système sol-air S-300 a été détruit près de Nikopol, dans la région de Dniepropetrovsk, avec plusieurs chars et autres blindés.La défense aérienne russe a abattu 14 drones ainsi qu’un projectile de lance-roquettes multiples HIMARS.En 24 heures, 89 postes d'artillerie ainsi que du personnel et du matériel militaires ont été bombardés dans 195 zones.Depuis le début de l’opération militaire spéciale en Ukraine, l’armée russe a abattu 393 avions, 212 hélicoptères et 3.295 drones. Elle a détruit 407 systèmes de défense antiaérienne, 8.105 chars et autres blindés, 1.045 véhicules de lance-roquettes multiples, 4.247 pièces d’artillerie de terrain et de mortiers, et 8.665 autres équipements militaires.","[[['Les forces armées russes ont éliminé près de 640 militaires ukrainiens sur toute la ligne de front ces dernières 24 heures, a rapporté ce 2 mars le ministère russe de la Défense dans son bilan quotidien de l’opération spéciale.Environ 270 d’entre eux ont été tués sur l’axe de Donetsk, jusqu’à 160 dans la direction de Krasny Liman, et plus de 50 sur l’axe de Koupiansk.Les forces de Kiev ont également perdu jusqu’à 80 de leurs soldats sur les axes de Donetsk-Sud et de Zaporojié, et autant dans la région de Kherson.Par ailleurs, un poste de communication a été frappé près d’Avdeïevka, en république populaire de Donetsk (RPD).Dans cette zone, un dépôt de munitions a également été bombardé.'], ['Deux autres sites de ce type ont été démolis dans les régions de Kherson et de Kharkov.Armes détruitesDes chasseurs russes ont abattu un bombardier ukrainien Su-24 près de Mikhaïlovka et un hélicoptère Mi-8 près de la localité Kourakhovka, les deux en RPD.L’artillerie russe a en outre anéanti deux obusiers D-30, deux canons automoteurs Gvozdika, ainsi que quatre Msta-B.'], ['Un système de défense antiaérienne Bouk M-1 a été détruit près de la ville de Kramatorsk.'], [""Un radar du système sol-air S-300 a été détruit près de Nikopol, dans la région de Dniepropetrovsk, avec plusieurs chars et autres blindés.La défense aérienne russe a abattu 14 drones ainsi qu’un projectile de lance-roquettes multiples HIMARS.En 24 heures, 89 postes d'artillerie ainsi que du personnel et du matériel militaires ont été bombardés dans 195 zones.Depuis le début de l’opération militaire spéciale en Ukraine, l’armée russe a abattu 393 avions, 212 hélicoptères et 3.295 drones.""], ['Elle a détruit 407 systèmes de défense antiaérienne, 8.105 chars et autres blindés, 1.045 véhicules de lance-roquettes multiples, 4.247 pièces d’artillerie de terrain et de mortiers, et 8.665 autres équipements militaires.']]]","[[['forces', 'armées', 'russes', 'militaires', 'ukrainiens', 'ligne', 'front', 'dernières', 'heures', 'mars', 'ministère', 'russe', 'défense', 'bilan', 'quotidien', 'opération', 'axe', 'donetsk', 'direction', 'krasny', 'liman', 'axe', 'forces', 'kiev', 'soldats', 'axes', 'donetsk', 'sud', 'zaporojié', 'région', 'poste', 'communication', 'avdeïevka', 'république', 'populaire', 'donetsk', 'zone', 'dépôt', 'munitions'], ['sites', 'type', 'régions', 'kherson', 'chasseurs', 'russes', 'bombardier', 'ukrainien', 'mikhaïlovka', 'hélicoptère', 'localité', 'kourakhovka', 'artillerie', 'russe', 'obusiers', 'canons', 'automoteurs', 'gvozdika', 'msta'], ['système', 'défense', 'antiaérienne', 'bouk', 'ville', 'kramatorsk'], ['radar', 'système', 'sol', 'air', 'nikopol', 'région', 'dniepropetrovsk', 'chars', 'défense', 'aérienne', 'russe', 'drones', 'projectile', 'roquettes', 'multiples', 'heures', 'postes', 'artillerie', 'personnel', 'matériel', 'militaires', 'début', 'opération', 'militaire', 'spéciale', 'ukraine', 'armée', 'russe', 'avions', 'hélicoptères', 'drones'], ['systèmes', 'défense', 'antiaérienne', 'chars', 'blindés', 'véhicules', 'lance', 'roquettes', 'multiples', 'pièces', 'artillerie', 'terrain', 'mortiers', 'équipements', 'militaires']]]","[[['Donetsk', 'Koupiansk', 'Kiev', 'Donetsk-Sud', 'Zaporojié', 'Kherson', 'Avdeïevka', 'république populaire de Donetsk', 'RPD).Dans'], ['Kherson', 'Kharkov', 'Mikhaïlovka', 'RPD.L’'], ['ville de Kramatorsk'], ['Nikopol', 'Dniepropetrovsk', 'Ukraine'], []]]","[[['ministère russe de la Défense'], ['Gvozdika'], [], [], []]]","[[['Krasny Liman'], ['Kourakhovka', 'Msta-B.'], ['Bouk M-1'], [], []]]","{'forces': 2, 'armées': 1, 'russes': 2, 'militaires': 3, 'ukrainiens': 1, 'ligne': 1, 'front': 1, 'dernières': 1, 'heures': 2, 'mars': 1, 'ministère': 1, 'russe': 4, 'défense': 4, 'bilan': 1, 'quotidien': 1, 'opération': 2, 'axe': 2, 'donetsk': 3, 'direction': 1, 'krasny': 1, 'liman': 1, 'kiev': 1, 'soldats': 1, 'axes': 1, 'sud': 1, 'zaporojié': 1, 'région': 2, 'poste': 1, 'communication': 1, 'avdeïevka': 1, 'république': 1, 'populaire': 1, 'zone': 1, 'dépôt': 1, 'munitions': 1, 'sites': 1, 'type': 1, 'régions': 1, 'kherson': 1, 'chasseurs': 1, 'bombardier': 1, 'ukrainien': 1, 'mikhaïlovka': 1, 'hélicoptère': 1, 'localité': 1, 'kourakhovka': 1, 'artillerie': 3, 'obusiers': 1, 'canons': 1, 'automoteurs': 1, 'gvozdika': 1, 'msta': 1, 'système': 2, 'antiaérienne': 2, 'bouk': 1, 'ville': 1, 'kramatorsk': 1, 'radar': 1, 'sol': 1, 'air': 1, 'nikopol': 1, 'dniepropetrovsk': 1, 'chars': 2, 'aérienne': 1, 'drones': 2, 'projectile': 1, 'roquettes': 2, 'multiples': 2, 'postes': 1, 'personnel': 1, 'matériel': 1, 'début': 1, 'militaire': 1, 'spéciale': 1, 'ukraine': 1, 'armée': 1, 'avions': 1, 'hélicoptères': 1, 'systèmes': 1, 'blindés': 1, 'véhicules': 1, 'lance': 1, 'pièces': 1, 'terrain': 1, 'mortiers': 1, 'équipements': 1}","{'Donetsk': 1, 'Koupiansk': 1, 'Kiev': 1, 'Donetsk-Sud': 1, 'Zaporojié': 1, 'Kherson': 2, 'Avdeïevka': 1, 'république populaire de Donetsk': 1, 'RPD).Dans': 1, 'Kharkov': 1, 'Mikhaïlovka': 1, 'RPD.L’': 1, 'ville de Kramatorsk': 1, 'Nikopol': 1, 'Dniepropetrovsk': 1, 'Ukraine': 1}","{'ministère russe de la Défense': 1, 'Gvozdika': 1}","{'Krasny Liman': 1, 'Kourakhovka': 1, 'Msta-B.': 1, 'Bouk M-1': 1}",2023,3,1
1677711600,https://fr.sputniknews.africa/20230302/alger-aurait-decide-de-suspendre-les-laissez-passer-consulaires-en-france-1058085198.html,Alger aurait décidé de suspendre les laissez-passer consulaires en France,"Sur fond de tensions diplomatiques avec Paris, Alger aurait décidé de ne plus émettre de laissez-passer consulaires en France, qui facilitent l’expulsion de clandestins algériens. Une décision qui pourrait détériorer encore plus les...","Les autorités algériennes auraient pris la décision de suspendre l’émission de laissez-passer consulaires en France, nécessaires pour permettre le retour des Algériens arrivés illégalement sur le sol français, relate la radio Europe1.Pour l’instant, l’information n’a pas été confirmée officiellement, ni par Alger ni par Paris.Selon Europe1, cette décision fait suite au rappel le 8 février de l’ambassadeur algérien présent à Paris. Le gouvernement algérien dénonce le non-respect de sa souveraineté et accuse Paris d’avoir permis l’exfiltration clandestine vers la France via la Tunisie de la militante Amira Bouraoui. Journaliste mais aussi activiste algérienne, cette dernière était interdite de quitter le territoire algérien, mais est parvenue à se rendre à Lyon en février, rappelle Europe1.Relations russo-algériennesSur fond de tensions avec Paris, Alger ne cache pas sa proximité avec Moscou. Plus tôt, l’Algérie a fait une demande d’adhésion au groupe des BRICS. Pour la Russie, elle représente l’un des candidats majeurs à une éventuelle adhésion ce groupe.Le 27 février, le secrétaire du Conseil de sécurité russe s’est rendu à Alger pour une visite où il a rencontré le Président Tebboune. Nikolaï Patrouchev a rassuré le chef de l’État algérien en affirmant que la Russie considérait la République arabe comme l'un de ses principaux partenaires internationaux.","[[['Les autorités algériennes auraient pris la décision de suspendre l’émission de laissez-passer consulaires en France, nécessaires pour permettre le retour des Algériens arrivés illégalement sur le sol français, relate la radio Europe1.Pour l’instant, l’information n’a pas été confirmée officiellement, ni par Alger ni par Paris.Selon Europe1, cette décision fait suite au rappel le 8 février de l’ambassadeur algérien présent à Paris.'], ['Le gouvernement algérien dénonce le non-respect de sa souveraineté et accuse Paris d’avoir permis l’exfiltration clandestine vers la France via la Tunisie de la militante Amira Bouraoui.'], ['Journaliste mais aussi activiste algérienne, cette dernière était interdite de quitter le territoire algérien, mais est parvenue à se rendre à Lyon en février, rappelle Europe1.Relations russo-algériennesSur fond de tensions avec Paris, Alger ne cache pas sa proximité avec Moscou.'], ['Plus tôt, l’Algérie a fait une demande d’adhésion au groupe des BRICS.'], ['Pour la Russie, elle représente l’un des candidats majeurs à une éventuelle adhésion ce groupe.Le 27 février, le secrétaire du Conseil de sécurité russe s’est rendu à Alger pour une visite où il a rencontré le Président Tebboune.'], [""Nikolaï Patrouchev a rassuré le chef de l’État algérien en affirmant que la Russie considérait la République arabe comme l'un de ses principaux partenaires internationaux.""]]]","[[['autorités', 'algériennes', 'décision', 'émission', 'france', 'nécessaires', 'algériens', 'sol', 'français', 'radio', 'instant', 'information', 'alger', 'décision', 'suite', 'rappel', 'février', 'ambassadeur', 'algérien', 'présent', 'paris'], ['gouvernement', 'algérien', 'souveraineté', 'paris', 'exfiltration', 'clandestine', 'france', 'tunisie', 'militante', 'bouraoui'], ['journaliste', 'activiste', 'algérienne', 'dernière', 'territoire', 'algérien', 'lyon', 'février', 'russo', 'algériennessur', 'fond', 'tensions', 'paris', 'alger', 'proximité', 'moscou'], ['algérie', 'demande', 'adhésion', 'groupe', 'brics'], ['russie', 'candidats', 'majeurs', 'éventuelle', 'adhésion', 'février', 'secrétaire', 'conseil', 'sécurité', 'russe', 'visite', 'président', 'tebboune'], ['patrouchev', 'chef', 'état', 'algérien', 'russie', 'république', 'arabe', 'principaux', 'partenaires', 'internationaux']]]","[[['France', 'Algérie', 'Alger', 'Paris', 'Europe1', 'Paris'], ['Paris', 'France', 'Tunisie'], ['Lyon', 'Paris', 'Alger', 'Moscou'], [], ['Russie', 'Alger'], ['État algérien', 'Russie', 'République arabe']]]","[[['radio Europe1.Pour'], [], [], ['BRICS'], ['Conseil de sécurité russe'], []]]","[[[], ['Amira Bouraoui'], [], [], ['Président Tebboune'], []]]","{'autorités': 1, 'algériennes': 1, 'décision': 2, 'émission': 1, 'france': 2, 'nécessaires': 1, 'algériens': 1, 'sol': 1, 'français': 1, 'radio': 1, 'instant': 1, 'information': 1, 'alger': 2, 'suite': 1, 'rappel': 1, 'février': 3, 'ambassadeur': 1, 'algérien': 4, 'présent': 1, 'paris': 3, 'gouvernement': 1, 'souveraineté': 1, 'exfiltration': 1, 'clandestine': 1, 'tunisie': 1, 'militante': 1, 'bouraoui': 1, 'journaliste': 1, 'activiste': 1, 'algérienne': 1, 'dernière': 1, 'territoire': 1, 'lyon': 1, 'russo': 1, 'algériennessur': 1, 'fond': 1, 'tensions': 1, 'proximité': 1, 'moscou': 1, 'algérie': 1, 'demande': 1, 'adhésion': 2, 'groupe': 1, 'brics': 1, 'russie': 2, 'candidats': 1, 'majeurs': 1, 'éventuelle': 1, 'secrétaire': 1, 'conseil': 1, 'sécurité': 1, 'russe': 1, 'visite': 1, 'président': 1, 'tebboune': 1, 'patrouchev': 1, 'chef': 1, 'état': 1, 'république': 1, 'arabe': 1, 'principaux': 1, 'partenaires': 1, 'internationaux': 1}","{'France': 2, 'Algérie': 1, 'Alger': 3, 'Paris': 4, 'Europe1': 1, 'Tunisie': 1, 'Lyon': 1, 'Moscou': 1, 'Russie': 2, 'État algérien': 1, 'République arabe': 1}","{'radio Europe1.Pour': 1, 'BRICS': 1, 'Conseil de sécurité russe': 1}","{'Amira Bouraoui': 1, 'Président Tebboune': 1}",2023,3,1
